<?xml version="1.0"?>
<?xml-stylesheet type='text/xsl' href='MessageLog.xsl'?>
<Log FirstSessionID="1" LastSessionID="508"><Message Date="16/05/2007" Time="6:13:12 PM" DateTime="2007-05-16T08:13:12.224Z" SessionID="1"><From><User FriendlyName="- *one James (&amp;)  Charmed --- &quot;Yes.... Yes... Yeah, 22 Inches&quot;"/></From><To><User FriendlyName="-brenDAN-&quot;if the bear is hungry it will eat&quot; @ gymz"/></To><Text Style="font-family:Microsoft Sans Serif; color:#000000; ">http://www.newyorker.com/online/video/conference/2007/wright</Text></Message><Message Date="16/05/2007" Time="6:21:49 PM" DateTime="2007-05-16T08:21:49.828Z" SessionID="2"><From><User FriendlyName="-brenDAN-&quot;if the bear is hungry it will eat&quot;"/></From><To><User FriendlyName="- *one James (&amp;)  Charmed --- &quot;Yes.... Yes... Yeah, 22 Inches&quot;"/></To><Text Style="font-family:Microsoft Sans Serif; color:#0000ff; ">whats it about</Text></Message><Message Date="16/05/2007" Time="6:24:46 PM" DateTime="2007-05-16T08:24:46.163Z" SessionID="2"><From><User FriendlyName="-brenDAN-&quot;if the bear is hungry it will eat&quot;"/></From><To><User FriendlyName="- *one James (&amp;)  Charmed --- &quot;Yes.... Yes... Yeah, 22 Inches&quot;"/></To><Text Style="font-family:Microsoft Sans Serif; color:#0000ff; ">that was fiar boring</Text></Message><Message Date="16/05/2007" Time="9:28:10 PM" DateTime="2007-05-16T11:28:10.832Z" SessionID="3"><From><User FriendlyName="- *one James (&amp;)  Charmed --- &quot;Yes.... Yes... Yeah, 22 Inches&quot;"/></From><To><User FriendlyName="-brenDAN-&quot;if the bear is hungry it will eat&quot;_doing eco"/></To><Text Style="font-family:Microsoft Sans Serif; color:#000000; ">watch that thing?</Text></Message><Message Date="16/05/2007" Time="9:28:28 PM" DateTime="2007-05-16T11:28:28.050Z" SessionID="3"><From><User FriendlyName="- *one James (&amp;)  Charmed --- &quot;Yes.... Yes... Yeah, 22 Inches&quot;"/></From><To><User FriendlyName="-brenDAN-&quot;if the bear is hungry it will eat&quot;_doing eco"/></To><Text Style="font-family:Microsoft Sans Serif; color:#000000; ">It only rly starts at like 1/5 or a 1/4 of the way in...</Text></Message><Message Date="16/05/2007" Time="9:28:43 PM" DateTime="2007-05-16T11:28:43.316Z" SessionID="4"><From><User FriendlyName="-brenDAN-&quot;if the bear is hungry it will eat&quot;_doing eco"/></From><To><User FriendlyName="- *one James (&amp;)  Charmed --- &quot;Yes.... Yes... Yeah, 22 Inches&quot;"/></To><Text Style="font-family:Microsoft Sans Serif; color:#0000ff; ">boring as</Text></Message><Message Date="16/05/2007" Time="9:28:50 PM" DateTime="2007-05-16T11:28:50.795Z" SessionID="4"><From><User FriendlyName="- *one James (&amp;)  Charmed --- &quot;Yes.... Yes... Yeah, 22 Inches&quot;"/></From><To><User FriendlyName="-brenDAN-&quot;if the bear is hungry it will eat&quot;_doing eco"/></To><Text Style="font-family:Microsoft Sans Serif; color:#000000; ">did u see the fuckin game?</Text></Message><Message Date="16/05/2007" Time="9:28:58 PM" DateTime="2007-05-16T11:28:58.159Z" SessionID="4"><From><User FriendlyName="- *one James (&amp;)  Charmed --- &quot;Yes.... Yes... Yeah, 22 Inches&quot;"/></From><To><User FriendlyName="-brenDAN-&quot;if the bear is hungry it will eat&quot;_doing eco"/></To><Text Style="font-family:Microsoft Sans Serif; color:#000000; ">fool</Text></Message><Message Date="16/05/2007" Time="9:29:03 PM" DateTime="2007-05-16T11:29:03.190Z" SessionID="4"><From><User FriendlyName="- *one James (&amp;)  Charmed --- &quot;Yes.... Yes... Yeah, 22 Inches&quot;"/></From><To><User FriendlyName="-brenDAN-&quot;if the bear is hungry it will eat&quot;_doing eco"/></To><Text Style="font-family:Microsoft Sans Serif; color:#000000; ">Star at like 1/4 in</Text></Message><Message Date="16/05/2007" Time="9:29:05 PM" DateTime="2007-05-16T11:29:05.981Z" SessionID="4"><From><User FriendlyName="- *one James (&amp;)  Charmed --- &quot;Yes.... Yes... Yeah, 22 Inches&quot;"/></From><To><User FriendlyName="-brenDAN-&quot;if the bear is hungry it will eat&quot;_doing eco"/></To><Text Style="font-family:Microsoft Sans Serif; color:#000000; ">start*</Text></Message><Message Date="16/05/2007" Time="9:30:20 PM" DateTime="2007-05-16T11:30:20.575Z" SessionID="4"><From><User FriendlyName="- *one James (&amp;)  Charmed --- &quot;Yes.... Yes... Yeah, 22 Inches&quot;"/></From><To><User FriendlyName="-brenDAN-&quot;if the bear is hungry it will eat&quot;_doing eco"/></To><Text Style="font-family:Microsoft Sans Serif; color:#000000; ">http://www.newyorker.com/online/video/conference/2007/wright</Text></Message><Message Date="16/05/2007" Time="9:30:27 PM" DateTime="2007-05-16T11:30:27.699Z" SessionID="4"><From><User FriendlyName="- *one James (&amp;)  Charmed --- &quot;Yes.... Yes... Yeah, 22 Inches&quot;"/></From><To><User FriendlyName="-brenDAN-&quot;if the bear is hungry it will eat&quot;_doing eco"/></To><Text Style="font-family:Microsoft Sans Serif; color:#000000; ">its fucking awesome I tells ya</Text></Message><Message Date="16/05/2007" Time="9:31:33 PM" DateTime="2007-05-16T11:31:33.982Z" SessionID="4"><From><User FriendlyName="- *one James (&amp;)  Charmed --- &quot;Yes.... Yes... Yeah, 22 Inches&quot;"/></From><To><User FriendlyName="-brenDAN-&quot;if the bear is hungry it will eat&quot;_doing eco"/></To><Text Style="font-family:Microsoft Sans Serif; color:#000000; ">watching (ff)</Text></Message><Message Date="17/05/2007" Time="7:22:51 PM" DateTime="2007-05-17T09:22:51.271Z" SessionID="5"><From><User FriendlyName="- *one James (&amp;)  Charmed --- &quot;Yes.... Yes... Yeah, 22 Inches&quot;"/></From><To><User FriendlyName="-brenDAN-&quot;if the bear is hungry it will eat&quot;_doing eco whilst in the shower"/></To><Text Style="font-family:Microsoft Sans Serif; color:#000000; ">Yo Bring ur diary 2moz 2 take home gamez!</Text></Message><Message Date="17/05/2007" Time="7:23:35 PM" DateTime="2007-05-17T09:23:35.332Z" SessionID="6"><From><User FriendlyName="-brenDAN-&quot;if the bear is hungry it will eat&quot;_doing eco whilst in the shower"/></From><To><User FriendlyName="- *one James (&amp;)  Charmed --- &quot;Yes.... Yes... Yeah, 22 Inches&quot;"/></To><Text Style="font-family:Microsoft Sans Serif; color:#0000ff; ">w00t</Text></Message><Message Date="17/05/2007" Time="7:25:07 PM" DateTime="2007-05-17T09:25:07.097Z" SessionID="7"><From><User FriendlyName="-brenDAN-&quot;if the bear is hungry it will eat&quot;_doing eco"/></From><To><User FriendlyName="- *one James (&amp;)  Charmed --- &quot;Yes.... Yes... Yeah, 22 Inches&quot;"/></To><Text Style="font-family:Microsoft Sans Serif; color:#0000ff; ">gaming da froday nigt ups</Text></Message><Message Date="17/05/2007" Time="7:25:08 PM" DateTime="2007-05-17T09:25:08.427Z" SessionID="7"><From><User FriendlyName="-brenDAN-&quot;if the bear is hungry it will eat&quot;_doing eco"/></From><To><User FriendlyName="- *one James (&amp;)  Charmed --- &quot;Yes.... Yes... Yeah, 22 Inches&quot;"/></To><Text Style="font-family:Microsoft Sans Serif; color:#0000ff; ">u in</Text></Message><Message Date="17/05/2007" Time="7:25:14 PM" DateTime="2007-05-17T09:25:14.875Z" SessionID="7"><From><User FriendlyName="-brenDAN-&quot;if the bear is hungry it will eat&quot;_doing eco"/></From><To><User FriendlyName="- *one James (&amp;)  Charmed --- &quot;Yes.... Yes... Yeah, 22 Inches&quot;"/></To><Text Style="font-family:Microsoft Sans Serif; color:#0000ff; ">or until i feel tired</Text></Message><Message Date="17/05/2007" Time="7:29:27 PM" DateTime="2007-05-17T09:29:27.630Z" SessionID="7"><From><User FriendlyName="- *one James (&amp;)  Charmed --- &quot;Yes.... Yes... Yeah, 22 Inches&quot;"/></From><To><User FriendlyName="-brenDAN-&quot;if the bear is hungry it will eat&quot;_doing eco"/></To><Text Style="font-family:Microsoft Sans Serif; color:#000000; ">for sure</Text></Message><Message Date="17/05/2007" Time="7:29:32 PM" DateTime="2007-05-17T09:29:32.044Z" SessionID="7"><From><User FriendlyName="- *one James (&amp;)  Charmed --- &quot;Yes.... Yes... Yeah, 22 Inches&quot;"/></From><To><User FriendlyName="-brenDAN-&quot;if the bear is hungry it will eat&quot;_doing eco"/></To><Text Style="font-family:Microsoft Sans Serif; color:#000000; ">so many games 2 play :D</Text></Message><Message Date="17/05/2007" Time="7:29:33 PM" DateTime="2007-05-17T09:29:33.028Z" SessionID="7"><From><User FriendlyName="- *one James (&amp;)  Charmed --- &quot;Yes.... Yes... Yeah, 22 Inches&quot;"/></From><To><User FriendlyName="-brenDAN-&quot;if the bear is hungry it will eat&quot;_doing eco"/></To><Text Style="font-family:Microsoft Sans Serif; color:#000000; ">woot</Text></Message><Message Date="17/05/2007" Time="7:29:41 PM" DateTime="2007-05-17T09:29:41.543Z" SessionID="8"><From><User FriendlyName="-brenDAN-&quot;if the bear is hungry it will eat&quot;_doing eco"/></From><To><User FriendlyName="- *one James (&amp;)  Charmed --- &quot;Yes.... Yes... Yeah, 22 Inches&quot;"/></To><Text Style="font-family:Microsoft Sans Serif; color:#0000ff; ">how many?! lolz</Text></Message><Message Date="17/05/2007" Time="7:29:43 PM" DateTime="2007-05-17T09:29:43.604Z" SessionID="8"><From><User FriendlyName="-brenDAN-&quot;if the bear is hungry it will eat&quot;_doing eco"/></From><To><User FriendlyName="- *one James (&amp;)  Charmed --- &quot;Yes.... Yes... Yeah, 22 Inches&quot;"/></To><Text Style="font-family:Microsoft Sans Serif; color:#0000ff; ">scared to ask</Text></Message><Message Date="17/05/2007" Time="7:34:11 PM" DateTime="2007-05-17T09:34:11.733Z" SessionID="8"><From><User FriendlyName="- *one James (&amp;)  Charmed --- &quot;Yes.... Yes... Yeah, 22 Inches&quot;"/></From><To><User FriendlyName="-brenDAN-&quot;if the bear is hungry it will eat&quot;_doing eco"/></To><Text Style="font-family:Microsoft Sans Serif; color:#000000; ">Lets just say I called the disc life-1 for a reason?</Text></Message><Message Date="17/05/2007" Time="7:37:39 PM" DateTime="2007-05-17T09:37:39.566Z" SessionID="8"><From><User FriendlyName="-brenDAN-&quot;if the bear is hungry it will eat&quot;_doing eco"/></From><To><User FriendlyName="- *one James (&amp;)  Charmed --- &quot;Yes.... Yes... Yeah, 22 Inches&quot;"/></To><Text Style="font-family:Microsoft Sans Serif; color:#0000ff; ">hahah kool</Text></Message><Message Date="17/05/2007" Time="7:37:53 PM" DateTime="2007-05-17T09:37:53.753Z" SessionID="8"><From><User FriendlyName="-brenDAN-&quot;if the bear is hungry it will eat&quot;_doing eco"/></From><To><User FriendlyName="- *one James (&amp;)  Charmed --- &quot;Yes.... Yes... Yeah, 22 Inches&quot;"/></To><Text Style="font-family:Microsoft Sans Serif; color:#0000ff; ">swear to fucken god their was a scream outside that sounded like a banshee</Text></Message><Message Date="17/05/2007" Time="8:00:42 PM" DateTime="2007-05-17T10:00:42.087Z" SessionID="8"><From><User FriendlyName="- *one James (&amp;)  Charmed --- &quot;Yes.... Yes... Yeah, 22 Inches&quot;"/></From><To><User FriendlyName="-brenDAN-&quot;if the bear is hungry it will eat&quot;_doing eco"/></To><Text Style="font-family:Microsoft Sans Serif; color:#000000; ">lol scary</Text></Message><Message Date="17/05/2007" Time="8:02:47 PM" DateTime="2007-05-17T10:02:47.863Z" SessionID="9"><From><User FriendlyName="-brenDAN-&quot;if the bear is hungry it will eat&quot;_doing eco"/></From><To><User FriendlyName="- *one James (&amp;)  Charmed --- &quot;Yes.... Yes... Yeah, 22 Inches&quot;"/></To><Text Style="font-family:Microsoft Sans Serif; color:#0000ff; ">fkn oath shat my pants imo</Text></Message><Message Date="17/05/2007" Time="8:02:54 PM" DateTime="2007-05-17T10:02:54.207Z" SessionID="9"><From><User FriendlyName="- *one James (&amp;)  Charmed --- &quot;Yes.... Yes... Yeah, 22 Inches&quot;"/></From><To><User FriendlyName="-brenDAN-&quot;if the bear is hungry it will eat&quot;_doing eco"/></To><Text Style="font-family:Microsoft Sans Serif; color:#000000; ">crazy ay</Text></Message><Message Date="17/05/2007" Time="8:03:14 PM" DateTime="2007-05-17T10:03:14.661Z" SessionID="10"><From><User FriendlyName="-brenDAN-&quot;if the bear is hungry it will eat&quot;_doing eco"/></From><To><User FriendlyName="- *one James (&amp;)  Charmed --- &quot;Yes.... Yes... Yeah, 22 Inches&quot;"/></To><Text Style="font-family:Microsoft Sans Serif; color:#0000ff; ">whilst ive been staring at this same page for almost and hr and a half</Text></Message><Message Date="17/05/2007" Time="8:03:21 PM" DateTime="2007-05-17T10:03:21.906Z" SessionID="10"><From><User FriendlyName="-brenDAN-&quot;if the bear is hungry it will eat&quot;_doing eco"/></From><To><User FriendlyName="- *one James (&amp;)  Charmed --- &quot;Yes.... Yes... Yeah, 22 Inches&quot;"/></To><Text Style="font-family:Microsoft Sans Serif; color:#0000ff; ">FUCKEN ESSAY GAY SHIT</Text></Message><Message Date="17/05/2007" Time="8:04:02 PM" DateTime="2007-05-17T10:04:02.200Z" SessionID="10"><From><User FriendlyName="- *one James (&amp;)  Charmed --- &quot;Yes.... Yes... Yeah, 22 Inches&quot;"/></From><To><User FriendlyName="-brenDAN-&quot;if the bear is hungry it will eat&quot;_doing eco"/></To><Text Style="font-family:Microsoft Sans Serif; color:#000000; ">Essay :|</Text></Message><Message Date="17/05/2007" Time="8:04:27 PM" DateTime="2007-05-17T10:04:27.485Z" SessionID="11"><From><User FriendlyName="-brenDAN-&quot;if the bear is hungry it will eat&quot;_doing eco"/></From><To><User FriendlyName="- *one James (&amp;)  Charmed --- &quot;Yes.... Yes... Yeah, 22 Inches&quot;"/></To><Text Style="font-family:Microsoft Sans Serif; color:#0000ff; ">jah the whole idea of putting concepts together to support or make true something</Text></Message><Message Date="17/05/2007" Time="8:04:29 PM" DateTime="2007-05-17T10:04:29.489Z" SessionID="11"><From><User FriendlyName="-brenDAN-&quot;if the bear is hungry it will eat&quot;_doing eco"/></From><To><User FriendlyName="- *one James (&amp;)  Charmed --- &quot;Yes.... Yes... Yeah, 22 Inches&quot;"/></To><Text Style="font-family:Microsoft Sans Serif; color:#0000ff; ">or a rather</Text></Message><Message Date="17/05/2007" Time="8:04:32 PM" DateTime="2007-05-17T10:04:32.723Z" SessionID="11"><From><User FriendlyName="-brenDAN-&quot;if the bear is hungry it will eat&quot;_doing eco"/></From><To><User FriendlyName="- *one James (&amp;)  Charmed --- &quot;Yes.... Yes... Yeah, 22 Inches&quot;"/></To><Text Style="font-family:Microsoft Sans Serif; color:#0000ff; ">gay economics</Text></Message><Message Date="17/05/2007" Time="8:04:54 PM" DateTime="2007-05-17T10:04:54.093Z" SessionID="11"><From><User FriendlyName="-brenDAN-&quot;if the bear is hungry it will eat&quot;_doing eco"/></From><To><User FriendlyName="- *one James (&amp;)  Charmed --- &quot;Yes.... Yes... Yeah, 22 Inches&quot;"/></To><Text Style="font-family:Microsoft Sans Serif; color:#0000ff; ">High inflation may cause the currency to depreciate over time. Thus depreciating the Australian dollar which will make the Balance of goods and services improve yet  make foreign liabilities harder to pay off, as well as foreign investors loosing confidence in the Australian economy which may see investors remove their money from the Australian economy.</Text></Message><Message Date="17/05/2007" Time="8:04:59 PM" DateTime="2007-05-17T10:04:59.352Z" SessionID="11"><From><User FriendlyName="-brenDAN-&quot;if the bear is hungry it will eat&quot;_doing eco"/></From><To><User FriendlyName="- *one James (&amp;)  Charmed --- &quot;Yes.... Yes... Yeah, 22 Inches&quot;"/></To><Text Style="font-family:Microsoft Sans Serif; color:#0000ff; ">just a little taste</Text></Message><Message Date="17/05/2007" Time="8:05:18 PM" DateTime="2007-05-17T10:05:18.711Z" SessionID="11"><From><User FriendlyName="- *one James (&amp;)  Charmed --- &quot;Yes.... Yes... Yeah, 22 Inches&quot;"/></From><To><User FriendlyName="-brenDAN-&quot;if the bear is hungry it will eat&quot;_doing eco"/></To><Text Style="font-family:Microsoft Sans Serif; color:#000000; ">oh sweet....</Text></Message><Message Date="17/05/2007" Time="8:05:38 PM" DateTime="2007-05-17T10:05:38.694Z" SessionID="11"><From><User FriendlyName="-brenDAN-&quot;if the bear is hungry it will eat&quot;_doing eco"/></From><To><User FriendlyName="- *one James (&amp;)  Charmed --- &quot;Yes.... Yes... Yeah, 22 Inches&quot;"/></To><Text Style="font-family:Microsoft Sans Serif; color:#0000ff; ">yea i was on a roll last night 600 quality words with ease</Text></Message><Message Date="17/05/2007" Time="8:05:46 PM" DateTime="2007-05-17T10:05:46.735Z" SessionID="11"><From><User FriendlyName="-brenDAN-&quot;if the bear is hungry it will eat&quot;_doing eco"/></From><To><User FriendlyName="- *one James (&amp;)  Charmed --- &quot;Yes.... Yes... Yeah, 22 Inches&quot;"/></To><Text Style="font-family:Microsoft Sans Serif; color:#0000ff; ">now its like WTF was i on about</Text></Message><Message Date="17/05/2007" Time="8:06:44 PM" DateTime="2007-05-17T10:06:44.245Z" SessionID="11"><From><User FriendlyName="- *one James (&amp;)  Charmed --- &quot;Yes.... Yes... Yeah, 22 Inches&quot;"/></From><To><User FriendlyName="-brenDAN-&quot;if the bear is hungry it will eat&quot;_doing eco"/></To><Text Style="font-family:Microsoft Sans Serif; color:#000000; ">I just battled a PCP mate</Text></Message><Message Date="17/05/2007" Time="8:06:46 PM" DateTime="2007-05-17T10:06:46.147Z" SessionID="11"><From><User FriendlyName="- *one James (&amp;)  Charmed --- &quot;Yes.... Yes... Yeah, 22 Inches&quot;"/></From><To><User FriendlyName="-brenDAN-&quot;if the bear is hungry it will eat&quot;_doing eco"/></To><Text Style="font-family:Microsoft Sans Serif; color:#000000; ">on pokemon</Text></Message><Message Date="17/05/2007" Time="8:06:48 PM" DateTime="2007-05-17T10:06:48.084Z" SessionID="11"><From><User FriendlyName="- *one James (&amp;)  Charmed --- &quot;Yes.... Yes... Yeah, 22 Inches&quot;"/></From><To><User FriendlyName="-brenDAN-&quot;if the bear is hungry it will eat&quot;_doing eco"/></To><Text Style="font-family:Microsoft Sans Serif; color:#000000; ">man so sweet</Text></Message><Message Date="17/05/2007" Time="8:07:01 PM" DateTime="2007-05-17T10:07:01.785Z" SessionID="11"><From><User FriendlyName="-brenDAN-&quot;if the bear is hungry it will eat&quot;_doing eco"/></From><To><User FriendlyName="- *one James (&amp;)  Charmed --- &quot;Yes.... Yes... Yeah, 22 Inches&quot;"/></To><Text Style="font-family:Microsoft Sans Serif; color:#0000ff; ">smash him?</Text></Message><Message Date="17/05/2007" Time="8:07:07 PM" DateTime="2007-05-17T10:07:07.186Z" SessionID="11"><From><User FriendlyName="- *one James (&amp;)  Charmed --- &quot;Yes.... Yes... Yeah, 22 Inches&quot;"/></From><To><User FriendlyName="-brenDAN-&quot;if the bear is hungry it will eat&quot;_doing eco"/></To><Text Style="font-family:Microsoft Sans Serif; color:#000000; ">1-1</Text></Message><Message Date="17/05/2007" Time="8:07:10 PM" DateTime="2007-05-17T10:07:10.521Z" SessionID="11"><From><User FriendlyName="- *one James (&amp;)  Charmed --- &quot;Yes.... Yes... Yeah, 22 Inches&quot;"/></From><To><User FriendlyName="-brenDAN-&quot;if the bear is hungry it will eat&quot;_doing eco"/></To><Text Style="font-family:Microsoft Sans Serif; color:#000000; ">he got me first round</Text></Message><Message Date="17/05/2007" Time="8:07:15 PM" DateTime="2007-05-17T10:07:15.128Z" SessionID="11"><From><User FriendlyName="- *one James (&amp;)  Charmed --- &quot;Yes.... Yes... Yeah, 22 Inches&quot;"/></From><To><User FriendlyName="-brenDAN-&quot;if the bear is hungry it will eat&quot;_doing eco"/></To><Text Style="font-family:Microsoft Sans Serif; color:#000000; ">And I smashed him second</Text></Message><Message Date="17/05/2007" Time="8:07:23 PM" DateTime="2007-05-17T10:07:23.080Z" SessionID="11"><From><User FriendlyName="- *one James (&amp;)  Charmed --- &quot;Yes.... Yes... Yeah, 22 Inches&quot;"/></From><To><User FriendlyName="-brenDAN-&quot;if the bear is hungry it will eat&quot;_doing eco"/></To><Text Style="font-family:Microsoft Sans Serif; color:#000000; ">He got 1 of my pkmn</Text></Message><Message Date="17/05/2007" Time="8:07:43 PM" DateTime="2007-05-17T10:07:43.864Z" SessionID="11"><From><User FriendlyName="-brenDAN-&quot;if the bear is hungry it will eat&quot;_doing eco"/></From><To><User FriendlyName="- *one James (&amp;)  Charmed --- &quot;Yes.... Yes... Yeah, 22 Inches&quot;"/></To><Text Style="font-family:Microsoft Sans Serif; color:#0000ff; ">oh noes</Text></Message><Message Date="17/05/2007" Time="8:09:56 PM" DateTime="2007-05-17T10:09:56.510Z" SessionID="12"><From><User FriendlyName="-brenDAN-&quot;if the bear is hungry it will eat&quot;_doing eco"/></From><To><User FriendlyName="- *one James (&amp;)  Charmed --- &quot;Yes.... Yes... Yeah, 22 Inches&quot;"/></To><Text Style="font-family:Microsoft Sans Serif; color:#0000ff; ">man lindsy lohan is hawt</Text></Message><Message Date="17/05/2007" Time="8:21:15 PM" DateTime="2007-05-17T10:21:15.018Z" SessionID="12"><From><User FriendlyName="- *one James (&amp;)  Charmed --- &quot;Yes.... Yes... Yeah, 22 Inches&quot;"/></From><To><User FriendlyName="-brenDAN-&quot;if the bear is hungry it will eat&quot;_doing eco"/></To><Text Style="font-family:Microsoft Sans Serif; color:#000000; ">eh</Text></Message><Message Date="17/05/2007" Time="8:21:17 PM" DateTime="2007-05-17T10:21:17.216Z" SessionID="12"><From><User FriendlyName="- *one James (&amp;)  Charmed --- &quot;Yes.... Yes... Yeah, 22 Inches&quot;"/></From><To><User FriendlyName="-brenDAN-&quot;if the bear is hungry it will eat&quot;_doing eco"/></To><Text Style="font-family:Microsoft Sans Serif; color:#000000; ">not really</Text></Message><Message Date="17/05/2007" Time="8:21:29 PM" DateTime="2007-05-17T10:21:29.622Z" SessionID="12"><From><User FriendlyName="- *one James (&amp;)  Charmed --- &quot;Yes.... Yes... Yeah, 22 Inches&quot;"/></From><To><User FriendlyName="-brenDAN-&quot;if the bear is hungry it will eat&quot;_doing eco"/></To><Text Style="font-family:Microsoft Sans Serif; color:#000000; ">Im mean not saying shes not</Text></Message><Message Date="17/05/2007" Time="8:21:48 PM" DateTime="2007-05-17T10:21:48.356Z" SessionID="12"><From><User FriendlyName="- *one James (&amp;)  Charmed --- &quot;Yes.... Yes... Yeah, 22 Inches&quot;"/></From><To><User FriendlyName="-brenDAN-&quot;if the bear is hungry it will eat&quot;_doing eco"/></To><Text Style="font-family:Microsoft Sans Serif; color:#000000; ">but shes a cocain sniffing bumb sucking white trash junke whore</Text></Message><Message Date="17/05/2007" Time="8:21:54 PM" DateTime="2007-05-17T10:21:54.828Z" SessionID="12"><From><User FriendlyName="- *one James (&amp;)  Charmed --- &quot;Yes.... Yes... Yeah, 22 Inches&quot;"/></From><To><User FriendlyName="-brenDAN-&quot;if the bear is hungry it will eat&quot;_doing eco"/></To><Text Style="font-family:Microsoft Sans Serif; color:#000000; ">which is a bit of a turn off</Text></Message><Message Date="17/05/2007" Time="8:21:57 PM" DateTime="2007-05-17T10:21:57.099Z" SessionID="12"><From><User FriendlyName="- *one James (&amp;)  Charmed --- &quot;Yes.... Yes... Yeah, 22 Inches&quot;"/></From><To><User FriendlyName="-brenDAN-&quot;if the bear is hungry it will eat&quot;_doing eco"/></To><Text Style="font-family:Microsoft Sans Serif; color:#000000; ">personally</Text></Message><Message Date="17/05/2007" Time="8:22:22 PM" DateTime="2007-05-17T10:22:22.367Z" SessionID="13"><From><User FriendlyName="-brenDAN-&quot;if the bear is hungry it will eat&quot;_doing eco"/></From><To><User FriendlyName="- *one James (&amp;)  Charmed --- &quot;Yes.... Yes... Yeah, 22 Inches&quot;"/></To><Text Style="font-family:Microsoft Sans Serif; color:#0000ff; ">lollies</Text></Message><Message Date="17/05/2007" Time="8:24:17 PM" DateTime="2007-05-17T10:24:17.599Z" SessionID="13"><From><User FriendlyName="- *one James (&amp;)  Charmed --- &quot;Yes.... Yes... Yeah, 22 Inches&quot;"/></From><To><User FriendlyName="-brenDAN-&quot;if the bear is hungry it will eat&quot;_doing eco"/></To><Text Style="font-family:Microsoft Sans Serif; color:#000000; ">seriously</Text></Message><Message Date="17/05/2007" Time="8:24:22 PM" DateTime="2007-05-17T10:24:22.003Z" SessionID="13"><From><User FriendlyName="- *one James (&amp;)  Charmed --- &quot;Yes.... Yes... Yeah, 22 Inches&quot;"/></From><To><User FriendlyName="-brenDAN-&quot;if the bear is hungry it will eat&quot;_doing eco"/></To><Text Style="font-family:Microsoft Sans Serif; color:#000000; ">shes baaaad</Text></Message><Message Date="17/05/2007" Time="8:25:20 PM" DateTime="2007-05-17T10:25:20.393Z" SessionID="14"><From><User FriendlyName="-brenDAN-&quot;if the bear is hungry it will eat&quot;_doing eco"/></From><To><User FriendlyName="- *one James (&amp;)  Charmed --- &quot;Yes.... Yes... Yeah, 22 Inches&quot;"/></To><Text Style="font-family:Microsoft Sans Serif; color:#0000ff; ">sure</Text></Message><Message Date="17/05/2007" Time="8:25:23 PM" DateTime="2007-05-17T10:25:23.627Z" SessionID="14"><From><User FriendlyName="-brenDAN-&quot;if the bear is hungry it will eat&quot;_doing eco"/></From><To><User FriendlyName="- *one James (&amp;)  Charmed --- &quot;Yes.... Yes... Yeah, 22 Inches&quot;"/></To><Text Style="font-family:Microsoft Sans Serif; color:#0000ff; ">all girls are tho</Text></Message><Message Date="17/05/2007" Time="8:25:38 PM" DateTime="2007-05-17T10:25:38.787Z" SessionID="14"><From><User FriendlyName="- *one James (&amp;)  Charmed --- &quot;Yes.... Yes... Yeah, 22 Inches&quot;"/></From><To><User FriendlyName="-brenDAN-&quot;if the bear is hungry it will eat&quot;_doing eco"/></To><Text Style="font-family:Microsoft Sans Serif; color:#000000; ">nah </Text></Message><Message Date="17/05/2007" Time="8:26:04 PM" DateTime="2007-05-17T10:26:04.903Z" SessionID="14"><From><User FriendlyName="- *one James (&amp;)  Charmed --- &quot;Yes.... Yes... Yeah, 22 Inches&quot;"/></From><To><User FriendlyName="-brenDAN-&quot;if the bear is hungry it will eat&quot;_doing eco"/></To><Text Style="font-family:Microsoft Sans Serif; color:#000000; ">They had to digitally take out the bloodshottness and dark patches around her eyes in the movie "Herbie" becuz she was such a fucking hang over skank women</Text></Message><Message Date="17/05/2007" Time="8:26:46 PM" DateTime="2007-05-17T10:26:46.260Z" SessionID="15"><From><User FriendlyName="-brenDAN-&quot;if the bear is hungry it will eat&quot;_doing eco"/></From><To><User FriendlyName="- *one James (&amp;)  Charmed --- &quot;Yes.... Yes... Yeah, 22 Inches&quot;"/></To><Text Style="font-family:Microsoft Sans Serif; color:#0000ff; ">lololol</Text></Message><Message Date="17/05/2007" Time="8:26:49 PM" DateTime="2007-05-17T10:26:49.108Z" SessionID="15"><From><User FriendlyName="-brenDAN-&quot;if the bear is hungry it will eat&quot;_doing eco"/></From><To><User FriendlyName="- *one James (&amp;)  Charmed --- &quot;Yes.... Yes... Yeah, 22 Inches&quot;"/></To><Text Style="font-family:Microsoft Sans Serif; color:#0000ff; ">didnt know that</Text></Message><Message Date="18/05/2007" Time="11:21:48 PM" DateTime="2007-05-18T13:21:48.781Z" SessionID="16"><From><User FriendlyName="- *one James (&amp;)  Charmed --- &quot;Yes.... Yes... Yeah, 22 Inches&quot;"/></From><To><User FriendlyName="-brenDAN-&quot;if the bear is hungry it will eat&quot;"/></To><Text Style="font-family:Microsoft Sans Serif; color:#000000; ">RVS-Y796-MRAR-W8BF-BL3N</Text></Message><Message Date="18/05/2007" Time="11:22:41 PM" DateTime="2007-05-18T13:22:41.912Z" SessionID="16"><From><User FriendlyName="- *one James (&amp;)  Charmed --- &quot;Yes.... Yes... Yeah, 22 Inches&quot;"/></From><To><User FriendlyName="-brenDAN-&quot;if the bear is hungry it will eat&quot;"/></To><Text Style="font-family:Microsoft Sans Serif; color:#000000; ">RVS-Y783-CRXR-O1NJ-TF4L</Text></Message><Message Date="18/05/2007" Time="11:24:51 PM" DateTime="2007-05-18T13:24:51.634Z" SessionID="16"><From><User FriendlyName="- *one James (&amp;)  Charmed --- &quot;Yes.... Yes... Yeah, 22 Inches&quot;"/></From><To><User FriendlyName="-brenDAN-&quot;if the bear is hungry it will eat&quot;"/></To><Text Style="font-family:Microsoft Sans Serif; color:#000000; ">RVS-Y796-MRAR-W8BF-BL3N
[18:01:09] &lt;&lt;	RVS-Y783-CRXR-O1NJ-TF4L
[18:01:39] &lt;&lt;	RVS-Y796-MRAR-W8BF-BL3N</Text></Message><Invitation Date="19/05/2007" Time="12:42:38 PM" DateTime="2007-05-19T02:42:38.741Z" SessionID="17"><From><User FriendlyName="- *one James (&amp;)  Charmed --- &quot;Yes.... Yes... Yeah, 22 Inches&quot;"/></From><File>C:\Users\Test\Downloads\eMule\Incoming\[SERIAL-KEYGEN-CRACK] Rainbow Six 3 - Raven Shield.zip</File><Text Style="color:#545454; ">- *one James (&amp;)  Charmed --- "Yes.... Yes... Yeah, 22 Inches" sends C:\Users\Test\Downloads\eMule\Incoming\[SERIAL-KEYGEN-CRACK] Rainbow Six 3 - Raven Shield.zip</Text></Invitation><InvitationResponse Date="19/05/2007" Time="12:43:17 PM" DateTime="2007-05-19T02:43:17.512Z" SessionID="17"><From><User FriendlyName="-brenDAN-&quot;if the bear is hungry it will eat&quot;"/></From><File>C:\Users\Test\Downloads\eMule\Incoming\[SERIAL-KEYGEN-CRACK] Rainbow Six 3 - Raven Shield.zip</File><Text Style="color:#545454; ">Transfer of "[SERIAL-KEYGEN-CRACK] Rainbow Six 3 - Raven Shield.zip" is complete.</Text></InvitationResponse><Invitation Date="19/05/2007" Time="1:13:21 PM" DateTime="2007-05-19T03:13:21.304Z" SessionID="17"><From><User FriendlyName="- *one James (&amp;)  Charmed --- &quot;Yes.... Yes... Yeah, 22 Inches&quot;"/></From><File>C:\Users\Test\Downloads\eMule\Incoming\Raven Shield CD KEY.txt</File><Text Style="color:#545454; ">- *one James (&amp;)  Charmed --- "Yes.... Yes... Yeah, 22 Inches" sends C:\Users\Test\Downloads\eMule\Incoming\Raven Shield CD KEY.txt</Text></Invitation><InvitationResponse Date="19/05/2007" Time="1:13:28 PM" DateTime="2007-05-19T03:13:28.523Z" SessionID="17"><From><User FriendlyName="-brenDAN-&quot;if the bear is hungry it will eat&quot;"/></From><File>C:\Users\Test\Downloads\eMule\Incoming\Raven Shield CD KEY.txt</File><Text Style="color:#545454; ">Transfer of "Raven Shield CD KEY.txt" is complete.</Text></InvitationResponse><Message Date="24/05/2007" Time="5:57:32 PM" DateTime="2007-05-24T07:57:32.694Z" SessionID="18"><From><User FriendlyName="-brenDAN"/></From><To><User FriendlyName="- *one James (&amp;)  Charmed ---  Its the Great God Bird"/></To><Text Style="font-family:Microsoft Sans Serif; color:#0000ff; ">hey man whats jared msn?</Text></Message><Message Date="24/05/2007" Time="5:57:49 PM" DateTime="2007-05-24T07:57:49.584Z" SessionID="18"><From><User FriendlyName="- *one James (&amp;)  Charmed ---  Its the Great God Bird"/></From><To><User FriendlyName="-brenDAN"/></To><Text Style="font-family:Microsoft Sans Serif; color:#000000; ">im-mr-brightside@hotmail.com</Text></Message><Message Date="24/05/2007" Time="5:58:27 PM" DateTime="2007-05-24T07:58:27.134Z" SessionID="19"><From><User FriendlyName="-brenDAN"/></From><To><User FriendlyName="- *one James (&amp;)  Charmed ---  Its the Great God Bird"/></To><Text Style="font-family:Microsoft Sans Serif; color:#0000ff; ">oo thats were i went wrong lolz</Text></Message><Message Date="24/05/2007" Time="5:58:35 PM" DateTime="2007-05-24T07:58:35.012Z" SessionID="19"><From><User FriendlyName="-brenDAN"/></From><To><User FriendlyName="- *one James (&amp;)  Charmed ---  Its the Great God Bird"/></To><Text Style="font-family:Microsoft Sans Serif; color:#0000ff; ">bright-side i had it as</Text></Message><Message Date="25/05/2007" Time="3:10:55 PM" DateTime="2007-05-25T05:10:55.109Z" SessionID="20"><From><User FriendlyName="-brenDAN"/></From><To><User FriendlyName="- *one James (&amp;)  Charmed ---  Its the Great God Bird"/></To><Text Style="font-family:Microsoft Sans Serif; color:#0000ff; ">http://www.nissansilvia.com/forums/index.php?s=fd46600c1c6b1ccecaf0d36a428d6b8b&amp;showtopic=232477</Text></Message><Message Date="25/05/2007" Time="3:27:53 PM" DateTime="2007-05-25T05:27:53.040Z" SessionID="20"><From><User FriendlyName="- *one James (&amp;)  Charmed ---  Its the Great God Bird"/></From><To><User FriendlyName="-brenDAN"/></To><Text Style="font-family:Microsoft Sans Serif; color:#000000; ">ROFLlol</Text></Message><Message Date="25/05/2007" Time="3:27:54 PM" DateTime="2007-05-25T05:27:54.205Z" SessionID="20"><From><User FriendlyName="- *one James (&amp;)  Charmed ---  Its the Great God Bird"/></From><To><User FriendlyName="-brenDAN"/></To><Text Style="font-family:Microsoft Sans Serif; color:#000000; ">nice</Text></Message><Message Date="25/05/2007" Time="3:28:18 PM" DateTime="2007-05-25T05:28:18.987Z" SessionID="21"><From><User FriendlyName="-brenDAN"/></From><To><User FriendlyName="- *one James (&amp;)  Charmed ---  Its the Great God Bird"/></To><Text Style="font-family:Microsoft Sans Serif; color:#0000ff; ">rkn</Text></Message><Message Date="25/05/2007" Time="3:28:47 PM" DateTime="2007-05-25T05:28:47.854Z" SessionID="21"><From><User FriendlyName="-brenDAN"/></From><To><User FriendlyName="- *one James (&amp;)  Charmed ---  Its the Great God Bird"/></To><Text Style="font-family:Microsoft Sans Serif; color:#0000ff; ">im in da venti</Text></Message><Message Date="26/05/2007" Time="1:10:15 PM" DateTime="2007-05-26T03:10:15.749Z" SessionID="22"><From><User FriendlyName="- *one James (&amp;)  Charmed ---  Its the Great God Bird"/></From><To><User FriendlyName="-brenDAN"/></To><Text Style="font-family:Microsoft Sans Serif; color:#000000; ">wat 6 mins?</Text></Message><Message Date="26/05/2007" Time="1:10:26 PM" DateTime="2007-05-26T03:10:26.468Z" SessionID="23"><From><User FriendlyName="-brenDAN"/></From><To><User FriendlyName="- *one James (&amp;)  Charmed ---  Its the Great God Bird"/></To><Text Style="font-family:Microsoft Sans Serif; color:#0000ff; ">english speeeccch</Text></Message><Message Date="26/05/2007" Time="1:10:33 PM" DateTime="2007-05-26T03:10:33.434Z" SessionID="23"><From><User FriendlyName="- *one James (&amp;)  Charmed ---  Its the Great God Bird"/></From><To><User FriendlyName="-brenDAN"/></To><Text Style="font-family:Microsoft Sans Serif; color:#000000; ">how much u dun?</Text></Message><Message Date="26/05/2007" Time="1:10:42 PM" DateTime="2007-05-26T03:10:42.076Z" SessionID="24"><From><User FriendlyName="-brenDAN"/></From><To><User FriendlyName="- *one James (&amp;)  Charmed ---  Its the Great God Bird"/></To><Text Style="font-family:Microsoft Sans Serif; color:#0000ff; ">250 words</Text></Message><Message Date="26/05/2007" Time="1:10:48 PM" DateTime="2007-05-26T03:10:48.592Z" SessionID="24"><From><User FriendlyName="- *one James (&amp;)  Charmed ---  Its the Great God Bird"/></From><To><User FriendlyName="-brenDAN"/></To><Text Style="font-family:Microsoft Sans Serif; color:#000000; ">sameo</Text></Message><Message Date="26/05/2007" Time="1:10:49 PM" DateTime="2007-05-26T03:10:49.563Z" SessionID="25"><From><User FriendlyName="-brenDAN"/></From><To><User FriendlyName="- *one James (&amp;)  Charmed ---  Its the Great God Bird"/></To><Text Style="font-family:Microsoft Sans Serif; color:#0000ff; ">and 100 words is approx 30 sexc</Text></Message><Message Date="26/05/2007" Time="6:13:19 PM" DateTime="2007-05-26T08:13:19.982Z" SessionID="26"><From><User FriendlyName="-brenDAN| Jordan fails at spam k thanks"/></From><To><User FriendlyName="- *one James (&amp;) So how does it end?"/></To><Text Style="font-family:Microsoft Sans Serif; color:#0000ff; ">starcraft later tonight?</Text></Message><Message Date="26/05/2007" Time="6:13:32 PM" DateTime="2007-05-26T08:13:32.700Z" SessionID="26"><From><User FriendlyName="- *one James (&amp;) So how does it end?"/></From><To><User FriendlyName="-brenDAN| Jordan fails at spam k thanks"/></To><Text Style="font-family:Microsoft Sans Serif; color:#000000; ">l8r </Text></Message><Message Date="26/05/2007" Time="6:13:41 PM" DateTime="2007-05-26T08:13:41.458Z" SessionID="27"><From><User FriendlyName="-brenDAN| Jordan fails at spam k thanks"/></From><To><User FriendlyName="- *one James (&amp;) So how does it end?"/></To><Text Style="font-family:Microsoft Sans Serif; color:#0000ff; ">thats why i said later</Text></Message><Message Date="26/05/2007" Time="6:13:52 PM" DateTime="2007-05-26T08:13:52.539Z" SessionID="27"><From><User FriendlyName="- *one James (&amp;) So how does it end?"/></From><To><User FriendlyName="-brenDAN| Jordan fails at spam k thanks"/></To><Text Style="font-family:Microsoft Sans Serif; color:#000000; ">thats why I agreed with ur later statement...</Text></Message><Message Date="26/05/2007" Time="6:14:14 PM" DateTime="2007-05-26T08:14:14.413Z" SessionID="28"><From><User FriendlyName="-brenDAN| Jordan fails at spam k thanks"/></From><To><User FriendlyName="- *one James (&amp;) So how does it end?"/></To><Text Style="font-family:Microsoft Sans Serif; color:#0000ff; ">but thats why i said later..... so you could  just say yes.</Text></Message><Message Date="26/05/2007" Time="6:14:23 PM" DateTime="2007-05-26T08:14:23.927Z" SessionID="28"><From><User FriendlyName="- *one James (&amp;) So how does it end?"/></From><To><User FriendlyName="-brenDAN| Jordan fails at spam k thanks"/></To><Text Style="font-family:Microsoft Sans Serif; color:#000000; ">zomg</Text></Message><Message Date="26/05/2007" Time="6:14:29 PM" DateTime="2007-05-26T08:14:29.341Z" SessionID="28"><From><User FriendlyName="- *one James (&amp;) So how does it end?"/></From><To><User FriendlyName="-brenDAN| Jordan fails at spam k thanks"/></To><Text Style="font-family:Microsoft Sans Serif; color:#000000; ">Google fucking concur</Text></Message><Message Date="26/05/2007" Time="6:15:05 PM" DateTime="2007-05-26T08:15:05.973Z" SessionID="29"><From><User FriendlyName="-brenDAN| Jordan fails at spam k thanks"/></From><To><User FriendlyName="- *one James (&amp;) So how does it end?"/></To><Text Style="font-family:Microsoft Sans Serif; color:#0000ff; ">lolllies</Text></Message><Message Date="26/05/2007" Time="10:56:44 PM" DateTime="2007-05-26T12:56:44.234Z" SessionID="30"><From><User FriendlyName="-brenDAN"/></From><To><User FriendlyName="- *one James (&amp;) So how does it end?"/></To><Text Style="font-family:Microsoft Sans Serif; color:#0000ff; ">STARCRAFTTT</Text></Message><Message Date="26/05/2007" Time="10:56:55 PM" DateTime="2007-05-26T12:56:55.568Z" SessionID="30"><From><User FriendlyName="-brenDAN"/></From><To><User FriendlyName="- *one James (&amp;) So how does it end?"/></To><Text Style="font-family:Microsoft Sans Serif; color:#0000ff; ">vent too</Text></Message><Message Date="3/06/2007" Time="7:02:28 PM" DateTime="2007-06-03T09:02:28.929Z" SessionID="31"><From><User FriendlyName="-brenDNA"/></From><To><User FriendlyName="- *one James (&amp;) Anxiety is my caffeine!"/></To><Text Style="font-family:Microsoft Sans Serif; color:#0000ff; ">jimmeh</Text></Message><Message Date="3/06/2007" Time="7:02:34 PM" DateTime="2007-06-03T09:02:34.902Z" SessionID="31"><From><User FriendlyName="-brenDNA"/></From><To><User FriendlyName="- *one James (&amp;) Anxiety is my caffeine!"/></To><Text Style="font-family:Microsoft Sans Serif; color:#0000ff; ">come to memeee</Text></Message><Message Date="7/06/2007" Time="3:36:07 PM" DateTime="2007-06-07T05:36:07.832Z" SessionID="32"><From><User FriendlyName="-brenDAN"/></From><To><User FriendlyName="- *one James (&amp;) Kingdom Hearts 3 will finally be announced at this year's Tokyo Game Show!!!"/></To><Text Style="font-family:Microsoft Sans Serif; color:#0000ff; ">http://www.youtube.com/watch?v=AWy8vjlGCJU&amp;mode=related&amp;search=</Text></Message><Message Date="7/06/2007" Time="3:40:11 PM" DateTime="2007-06-07T05:40:11.636Z" SessionID="32"><From><User FriendlyName="- *one James (&amp;) Kingdom Hearts 3 will finally be announced at this year's Tokyo Game Show!!!"/></From><To><User FriendlyName="-brenDAN"/></To><Text Style="font-family:Microsoft Sans Serif; color:#000000; ">http://www.vintagecomputing.com/index.php/archives/103</Text></Message><Message Date="7/06/2007" Time="3:40:42 PM" DateTime="2007-06-07T05:40:42.441Z" SessionID="32"><From><User FriendlyName="-brenDAN"/></From><To><User FriendlyName="- *one James (&amp;) Kingdom Hearts 3 will finally be announced at this year's Tokyo Game Show!!!"/></To><Text Style="font-family:Microsoft Sans Serif; color:#0000ff; ">etf</Text></Message><Message Date="7/06/2007" Time="3:40:51 PM" DateTime="2007-06-07T05:40:51.134Z" SessionID="32"><From><User FriendlyName="-brenDAN"/></From><To><User FriendlyName="- *one James (&amp;) Kingdom Hearts 3 will finally be announced at this year's Tokyo Game Show!!!"/></To><Text Style="font-family:Microsoft Sans Serif; color:#0000ff; ">what in da world is that</Text></Message><Message Date="7/06/2007" Time="3:44:17 PM" DateTime="2007-06-07T05:44:17.921Z" SessionID="32"><From><User FriendlyName="- *one James (&amp;) Kingdom Hearts 3 will finally be announced at this year's Tokyo Game Show!!!"/></From><To><User FriendlyName="-brenDAN"/></To><Text Style="font-family:Microsoft Sans Serif; color:#000000; ">its the biggest games colection evar</Text></Message><Message Date="10/06/2007" Time="7:52:10 PM" DateTime="2007-06-10T09:52:10.110Z" SessionID="33"><From><User FriendlyName="-brenDAN"/></From><To><User FriendlyName="- *one James (&amp;) Kingdom Hearts 3 will finally be announced at this year's Tokyo Game Show!!!"/></To><Text Style="font-family:Microsoft Sans Serif; color:#0000ff; ">JAMES

</Text></Message><Message Date="10/06/2007" Time="7:52:10 PM" DateTime="2007-06-10T09:52:10.273Z" SessionID="33"><From><User FriendlyName="-brenDAN"/></From><To><User FriendlyName="- *one James (&amp;) Kingdom Hearts 3 will finally be announced at this year's Tokyo Game Show!!!"/></To><Text Style="font-family:Microsoft Sans Serif; color:#0000ff; ">swa</Text></Message><Message Date="10/06/2007" Time="7:52:10 PM" DateTime="2007-06-10T09:52:10.428Z" SessionID="33"><From><User FriendlyName="-brenDAN"/></From><To><User FriendlyName="- *one James (&amp;) Kingdom Hearts 3 will finally be announced at this year's Tokyo Game Show!!!"/></To><Text Style="font-family:Microsoft Sans Serif; color:#0000ff; ">s</Text></Message><Message Date="10/06/2007" Time="7:52:10 PM" DateTime="2007-06-10T09:52:10.593Z" SessionID="33"><From><User FriendlyName="-brenDAN"/></From><To><User FriendlyName="- *one James (&amp;) Kingdom Hearts 3 will finally be announced at this year's Tokyo Game Show!!!"/></To><Text Style="font-family:Microsoft Sans Serif; color:#0000ff; ">s</Text></Message><Message Date="10/06/2007" Time="7:52:10 PM" DateTime="2007-06-10T09:52:10.742Z" SessionID="33"><From><User FriendlyName="-brenDAN"/></From><To><User FriendlyName="- *one James (&amp;) Kingdom Hearts 3 will finally be announced at this year's Tokyo Game Show!!!"/></To><Text Style="font-family:Microsoft Sans Serif; color:#0000ff; ">s</Text></Message><Message Date="10/06/2007" Time="7:52:10 PM" DateTime="2007-06-10T09:52:10.889Z" SessionID="33"><From><User FriendlyName="-brenDAN"/></From><To><User FriendlyName="- *one James (&amp;) Kingdom Hearts 3 will finally be announced at this year's Tokyo Game Show!!!"/></To><Text Style="font-family:Microsoft Sans Serif; color:#0000ff; ">s</Text></Message><Message Date="11/06/2007" Time="1:50:48 PM" DateTime="2007-06-11T03:50:48.392Z" SessionID="34"><From><User FriendlyName="- *one James (&amp;) Kingdom Hearts 3 will finally be announced at this year's Tokyo Game Show!!!"/></From><To><User FriendlyName="-brenDAN"/></To><Text Style="font-family:Microsoft Sans Serif; color:#000000; ">why u shood get a PS3</Text></Message><Message Date="11/06/2007" Time="1:50:48 PM" DateTime="2007-06-11T03:50:48.862Z" SessionID="34"><From><User FriendlyName="- *one James (&amp;) Kingdom Hearts 3 will finally be announced at this year's Tokyo Game Show!!!"/></From><To><User FriendlyName="-brenDAN"/></To><Text Style="font-family:Microsoft Sans Serif; color:#000000; ">http://www.youtube.com/watch?v=r_CIsfIVMU0</Text></Message><Message Date="11/06/2007" Time="4:09:41 PM" DateTime="2007-06-11T06:09:41.419Z" SessionID="35"><From><User FriendlyName="-brenDAN"/></From><To><User FriendlyName="- *one James (&amp;) Kingdom Hearts 3 will finally be announced at this year's Tokyo Game Show!!!"/></To><Text Style="font-family:Microsoft Sans Serif; color:#0000ff; ">cbf dont have an account</Text></Message><Message Date="12/06/2007" Time="8:56:57 PM" DateTime="2007-06-12T10:56:57.326Z" SessionID="36"><From><User FriendlyName="SMB"/></From><To><User FriendlyName="Jordy"/><User FriendlyName="Jonathan..."/><User FriendlyName="(F)Heath is the fucking best | a mans home is his castle"/><User FriendlyName="-brenDAN"/><User FriendlyName="- *one James (&amp;) Kingdom Hearts 3 will finally be announced at this year's Tokyo Game Show!!!"/></To><Text Style="font-family:MS Sans Serif; font-weight:bold; color:#0000ff; ">the clan is up</Text></Message><Message Date="12/06/2007" Time="8:57:04 PM" DateTime="2007-06-12T10:57:04.263Z" SessionID="36"><From><User FriendlyName="Jordy"/></From><To><User FriendlyName="Jonathan..."/><User FriendlyName="SMB"/><User FriendlyName="(F)Heath is the fucking best | a mans home is his castle"/><User FriendlyName="-brenDAN"/><User FriendlyName="- *one James (&amp;) Kingdom Hearts 3 will finally be announced at this year's Tokyo Game Show!!!"/></To><Text Style="font-family:MS Shell Dlg; color:#000000; ">woo</Text></Message><Message Date="12/06/2007" Time="8:57:05 PM" DateTime="2007-06-12T10:57:05.522Z" SessionID="36"><From><User FriendlyName="SMB"/></From><To><User FriendlyName="Jordy"/><User FriendlyName="Jonathan..."/><User FriendlyName="(F)Heath is the fucking best | a mans home is his castle"/><User FriendlyName="-brenDAN"/><User FriendlyName="- *one James (&amp;) Kingdom Hearts 3 will finally be announced at this year's Tokyo Game Show!!!"/></To><Text Style="font-family:MS Sans Serif; font-weight:bold; color:#0000ff; ">jordy and i are the only member atm</Text></Message><Message Date="12/06/2007" Time="8:57:17 PM" DateTime="2007-06-12T10:57:17.793Z" SessionID="36"><From><User FriendlyName="SMB"/></From><To><User FriendlyName="Jordy"/><User FriendlyName="Jonathan..."/><User FriendlyName="(F)Heath is the fucking best | a mans home is his castle"/><User FriendlyName="-brenDAN"/><User FriendlyName="- *one James (&amp;) Kingdom Hearts 3 will finally be announced at this year's Tokyo Game Show!!!"/></To><Text Style="font-family:MS Sans Serif; font-weight:bold; color:#0000ff; ">waitin on all u hoes</Text></Message><Message Date="12/06/2007" Time="8:57:18 PM" DateTime="2007-06-12T10:57:18.563Z" SessionID="36"><From><User FriendlyName="Jonathan..."/></From><To><User FriendlyName="Jordy"/><User FriendlyName="SMB"/><User FriendlyName="(F)Heath is the fucking best | a mans home is his castle"/><User FriendlyName="-brenDAN"/><User FriendlyName="- *one James (&amp;) Kingdom Hearts 3 will finally be announced at this year's Tokyo Game Show!!!"/></To><Text Style="font-family:Comic Sans MS; color:#008000; ">kk</Text></Message><Message Date="12/06/2007" Time="8:59:13 PM" DateTime="2007-06-12T10:59:13.977Z" SessionID="36"><From><User FriendlyName="- *one James (&amp;) Kingdom Hearts 3 will finally be announced at this year's Tokyo Game Show!!!"/></From><To><User FriendlyName="Jordy"/><User FriendlyName="Jonathan..."/><User FriendlyName="SMB"/><User FriendlyName="(F)Heath is the fucking best | a mans home is his castle"/><User FriendlyName="-brenDAN"/></To><Text Style="font-family:Microsoft Sans Serif; color:#000000; ">here we go again</Text></Message><Message Date="12/06/2007" Time="8:59:20 PM" DateTime="2007-06-12T10:59:20.479Z" SessionID="36"><From><User FriendlyName="SMB"/></From><To><User FriendlyName="Jordy"/><User FriendlyName="Jonathan..."/><User FriendlyName="(F)Heath is the fucking best | a mans home is his castle"/><User FriendlyName="-brenDAN"/><User FriendlyName="- *one James (&amp;) Kingdom Hearts 3 will finally be announced at this year's Tokyo Game Show!!!"/></To><Text Style="font-family:MS Sans Serif; font-weight:bold; color:#0000ff; ">:P</Text></Message><Message Date="12/06/2007" Time="8:59:22 PM" DateTime="2007-06-12T10:59:22.278Z" SessionID="36"><From><User FriendlyName="Jordy"/></From><To><User FriendlyName="Jonathan..."/><User FriendlyName="SMB"/><User FriendlyName="(F)Heath is the fucking best | a mans home is his castle"/><User FriendlyName="-brenDAN"/><User FriendlyName="- *one James (&amp;) Kingdom Hearts 3 will finally be announced at this year's Tokyo Game Show!!!"/></To><Text Style="font-family:MS Shell Dlg; color:#000000; ">McJAM is the coolest gamming name ive ever had</Text></Message><Message Date="12/06/2007" Time="8:59:30 PM" DateTime="2007-06-12T10:59:30.587Z" SessionID="36"><From><User FriendlyName="Jordy"/></From><To><User FriendlyName="Jonathan..."/><User FriendlyName="SMB"/><User FriendlyName="(F)Heath is the fucking best | a mans home is his castle"/><User FriendlyName="-brenDAN"/><User FriendlyName="- *one James (&amp;) Kingdom Hearts 3 will finally be announced at this year's Tokyo Game Show!!!"/></To><Text Style="font-family:MS Shell Dlg; color:#000000; ">lets see how long it lasts this time</Text></Message><Message Date="12/06/2007" Time="8:59:31 PM" DateTime="2007-06-12T10:59:31.899Z" SessionID="36"><From><User FriendlyName="SMB"/></From><To><User FriendlyName="Jordy"/><User FriendlyName="Jonathan..."/><User FriendlyName="(F)Heath is the fucking best | a mans home is his castle"/><User FriendlyName="-brenDAN"/><User FriendlyName="- *one James (&amp;) Kingdom Hearts 3 will finally be announced at this year's Tokyo Game Show!!!"/></To><Text Style="font-family:MS Sans Serif; font-weight:bold; color:#0000ff; ">and its still ga</Text></Message><Message Date="12/06/2007" Time="8:59:32 PM" DateTime="2007-06-12T10:59:32.731Z" SessionID="36"><From><User FriendlyName="SMB"/></From><To><User FriendlyName="Jordy"/><User FriendlyName="Jonathan..."/><User FriendlyName="(F)Heath is the fucking best | a mans home is his castle"/><User FriendlyName="-brenDAN"/><User FriendlyName="- *one James (&amp;) Kingdom Hearts 3 will finally be announced at this year's Tokyo Game Show!!!"/></To><Text Style="font-family:MS Sans Serif; font-weight:bold; color:#0000ff; ">y</Text></Message><Message Date="12/06/2007" Time="8:59:43 PM" DateTime="2007-06-12T10:59:43.288Z" SessionID="36"><From><User FriendlyName="Jordy"/></From><To><User FriendlyName="Jonathan..."/><User FriendlyName="SMB"/><User FriendlyName="(F)Heath is the fucking best | a mans home is his castle"/><User FriendlyName="-brenDAN"/><User FriendlyName="- *one James (&amp;) Kingdom Hearts 3 will finally be announced at this year's Tokyo Game Show!!!"/></To><Text Style="font-family:MS Shell Dlg; color:#000000; ">wtf is ur name</Text></Message><Message Date="12/06/2007" Time="8:59:45 PM" DateTime="2007-06-12T10:59:45.596Z" SessionID="36"><From><User FriendlyName="Jordy"/></From><To><User FriendlyName="Jonathan..."/><User FriendlyName="SMB"/><User FriendlyName="(F)Heath is the fucking best | a mans home is his castle"/><User FriendlyName="-brenDAN"/><User FriendlyName="- *one James (&amp;) Kingdom Hearts 3 will finally be announced at this year's Tokyo Game Show!!!"/></To><Text Style="font-family:MS Shell Dlg; color:#000000; ">smb</Text></Message><Message Date="12/06/2007" Time="8:59:45 PM" DateTime="2007-06-12T10:59:45.794Z" SessionID="36"><From><User FriendlyName="Jonathan..."/></From><To><User FriendlyName="Jordy"/><User FriendlyName="SMB"/><User FriendlyName="(F)Heath is the fucking best | a mans home is his castle"/><User FriendlyName="-brenDAN"/><User FriendlyName="- *one James (&amp;) Kingdom Hearts 3 will finally be announced at this year's Tokyo Game Show!!!"/></To><Text Style="font-family:Comic Sans MS; color:#008000; ">jimmeh u gonna join?</Text></Message><Message Date="12/06/2007" Time="8:59:52 PM" DateTime="2007-06-12T10:59:52.429Z" SessionID="36"><From><User FriendlyName="Jordy"/></From><To><User FriendlyName="Jonathan..."/><User FriendlyName="SMB"/><User FriendlyName="(F)Heath is the fucking best | a mans home is his castle"/><User FriendlyName="-brenDAN"/><User FriendlyName="- *one James (&amp;) Kingdom Hearts 3 will finally be announced at this year's Tokyo Game Show!!!"/></To><Text Style="font-family:MS Shell Dlg; color:#000000; ">doesnt sound gay to me</Text></Message><Message Date="12/06/2007" Time="9:00:03 PM" DateTime="2007-06-12T11:00:03.589Z" SessionID="36"><From><User FriendlyName="Jordy"/></From><To><User FriendlyName="Jonathan..."/><User FriendlyName="SMB"/><User FriendlyName="(F)Heath is the fucking best | a mans home is his castle"/><User FriendlyName="-brenDAN"/><User FriendlyName="- *one James (&amp;) Kingdom Hearts 3 will finally be announced at this year's Tokyo Game Show!!!"/></To><Text Style="font-family:MS Shell Dlg; color:#000000; ">nothing gay in BALL SUCKING!</Text></Message><Message Date="12/06/2007" Time="9:00:13 PM" DateTime="2007-06-12T11:00:13.707Z" SessionID="36"><From><User FriendlyName="- *one James (&amp;) Kingdom Hearts 3 will finally be announced at this year's Tokyo Game Show!!!"/></From><To><User FriendlyName="Jordy"/><User FriendlyName="Jonathan..."/><User FriendlyName="SMB"/><User FriendlyName="(F)Heath is the fucking best | a mans home is his castle"/><User FriendlyName="-brenDAN"/></To><Text Style="font-family:Microsoft Sans Serif; color:#000000; ">I s'pose</Text></Message><Message Date="12/06/2007" Time="9:00:16 PM" DateTime="2007-06-12T11:00:16.911Z" SessionID="36"><From><User FriendlyName="SMB"/></From><To><User FriendlyName="Jordy"/><User FriendlyName="Jonathan..."/><User FriendlyName="(F)Heath is the fucking best | a mans home is his castle"/><User FriendlyName="-brenDAN"/><User FriendlyName="- *one James (&amp;) Kingdom Hearts 3 will finally be announced at this year's Tokyo Game Show!!!"/></To><Text Style="font-family:MS Sans Serif; font-weight:bold; color:#0000ff; ">thats why im telling u to suck MINE</Text></Message><Message Date="12/06/2007" Time="9:00:22 PM" DateTime="2007-06-12T11:00:22.410Z" SessionID="36"><From><User FriendlyName="- *one James (&amp;) Kingdom Hearts 3 will finally be announced at this year's Tokyo Game Show!!!"/></From><To><User FriendlyName="Jordy"/><User FriendlyName="Jonathan..."/><User FriendlyName="SMB"/><User FriendlyName="(F)Heath is the fucking best | a mans home is his castle"/><User FriendlyName="-brenDAN"/></To><Text Style="font-family:Microsoft Sans Serif; color:#000000; ">if u wanna go give up on Hybrid</Text></Message><Message Date="12/06/2007" Time="9:00:25 PM" DateTime="2007-06-12T11:00:25.504Z" SessionID="36"><From><User FriendlyName="- *one James (&amp;) Kingdom Hearts 3 will finally be announced at this year's Tokyo Game Show!!!"/></From><To><User FriendlyName="Jordy"/><User FriendlyName="Jonathan..."/><User FriendlyName="SMB"/><User FriendlyName="(F)Heath is the fucking best | a mans home is his castle"/><User FriendlyName="-brenDAN"/></To><Text Style="font-family:Microsoft Sans Serif; color:#000000; ">wat about eater n shit?</Text></Message><Message Date="12/06/2007" Time="9:00:27 PM" DateTime="2007-06-12T11:00:27.885Z" SessionID="36"><From><User FriendlyName="Jordy"/></From><To><User FriendlyName="Jonathan..."/><User FriendlyName="SMB"/><User FriendlyName="(F)Heath is the fucking best | a mans home is his castle"/><User FriendlyName="-brenDAN"/><User FriendlyName="- *one James (&amp;) Kingdom Hearts 3 will finally be announced at this year's Tokyo Game Show!!!"/></To><Text Style="font-family:MS Shell Dlg; color:#000000; ">coz ur a fag?</Text></Message><Message Date="12/06/2007" Time="9:00:34 PM" DateTime="2007-06-12T11:00:34.528Z" SessionID="36"><From><User FriendlyName="Jonathan..."/></From><To><User FriendlyName="Jordy"/><User FriendlyName="SMB"/><User FriendlyName="(F)Heath is the fucking best | a mans home is his castle"/><User FriendlyName="-brenDAN"/><User FriendlyName="- *one James (&amp;) Kingdom Hearts 3 will finally be announced at this year's Tokyo Game Show!!!"/></To><Text Style="font-family:Comic Sans MS; color:#008000; ">haha ye im thinking that</Text></Message><Message Date="12/06/2007" Time="9:00:44 PM" DateTime="2007-06-12T11:00:44.442Z" SessionID="36"><From><User FriendlyName="SMB"/></From><To><User FriendlyName="Jordy"/><User FriendlyName="Jonathan..."/><User FriendlyName="(F)Heath is the fucking best | a mans home is his castle"/><User FriendlyName="-brenDAN"/><User FriendlyName="- *one James (&amp;) Kingdom Hearts 3 will finally be announced at this year's Tokyo Game Show!!!"/></To><Text Style="font-family:MS Sans Serif; font-weight:bold; color:#0000ff; ">eater is cool</Text></Message><Message Date="12/06/2007" Time="9:00:45 PM" DateTime="2007-06-12T11:00:45.452Z" SessionID="36"><From><User FriendlyName="Jonathan..."/></From><To><User FriendlyName="Jordy"/><User FriendlyName="SMB"/><User FriendlyName="(F)Heath is the fucking best | a mans home is his castle"/><User FriendlyName="-brenDAN"/><User FriendlyName="- *one James (&amp;) Kingdom Hearts 3 will finally be announced at this year's Tokyo Game Show!!!"/></To><Text Style="font-family:Comic Sans MS; color:#008000; ">ahh</Text></Message><Message Date="12/06/2007" Time="9:00:48 PM" DateTime="2007-06-12T11:00:48.325Z" SessionID="36"><From><User FriendlyName="SMB"/></From><To><User FriendlyName="Jordy"/><User FriendlyName="Jonathan..."/><User FriendlyName="(F)Heath is the fucking best | a mans home is his castle"/><User FriendlyName="-brenDAN"/><User FriendlyName="- *one James (&amp;) Kingdom Hearts 3 will finally be announced at this year's Tokyo Game Show!!!"/></To><Text Style="font-family:MS Sans Serif; font-weight:bold; color:#0000ff; ">as is koopeh</Text></Message><Message Date="12/06/2007" Time="9:00:53 PM" DateTime="2007-06-12T11:00:53.160Z" SessionID="36"><From><User FriendlyName="SMB"/></From><To><User FriendlyName="Jordy"/><User FriendlyName="Jonathan..."/><User FriendlyName="(F)Heath is the fucking best | a mans home is his castle"/><User FriendlyName="-brenDAN"/><User FriendlyName="- *one James (&amp;) Kingdom Hearts 3 will finally be announced at this year's Tokyo Game Show!!!"/></To><Text Style="font-family:MS Sans Serif; font-weight:bold; color:#0000ff; ">but he sucks like me</Text></Message><Message Date="12/06/2007" Time="9:00:58 PM" DateTime="2007-06-12T11:00:58.219Z" SessionID="36"><From><User FriendlyName="Jordy"/></From><To><User FriendlyName="Jonathan..."/><User FriendlyName="SMB"/><User FriendlyName="(F)Heath is the fucking best | a mans home is his castle"/><User FriendlyName="-brenDAN"/><User FriendlyName="- *one James (&amp;) Kingdom Hearts 3 will finally be announced at this year's Tokyo Game Show!!!"/></To><Text Style="font-family:MS Shell Dlg; color:#000000; ">make a new GA acount and be in 2 clans simple</Text></Message><Message Date="12/06/2007" Time="9:01:00 PM" DateTime="2007-06-12T11:01:00.210Z" SessionID="36"><From><User FriendlyName="SMB"/></From><To><User FriendlyName="Jordy"/><User FriendlyName="Jonathan..."/><User FriendlyName="(F)Heath is the fucking best | a mans home is his castle"/><User FriendlyName="-brenDAN"/><User FriendlyName="- *one James (&amp;) Kingdom Hearts 3 will finally be announced at this year's Tokyo Game Show!!!"/></To><Text Style="font-family:MS Sans Serif; font-weight:bold; color:#0000ff; ">brenDAN is shit</Text></Message><Message Date="12/06/2007" Time="9:01:05 PM" DateTime="2007-06-12T11:01:05.237Z" SessionID="36"><From><User FriendlyName="Jonathan..."/></From><To><User FriendlyName="Jordy"/><User FriendlyName="SMB"/><User FriendlyName="(F)Heath is the fucking best | a mans home is his castle"/><User FriendlyName="-brenDAN"/><User FriendlyName="- *one James (&amp;) Kingdom Hearts 3 will finally be announced at this year's Tokyo Game Show!!!"/></To><Text Style="font-family:Comic Sans MS; color:#008000; ">yea</Text></Message><Message Date="12/06/2007" Time="9:01:05 PM" DateTime="2007-06-12T11:01:05.827Z" SessionID="36"><From><User FriendlyName="SMB"/></From><To><User FriendlyName="Jordy"/><User FriendlyName="Jonathan..."/><User FriendlyName="(F)Heath is the fucking best | a mans home is his castle"/><User FriendlyName="-brenDAN"/><User FriendlyName="- *one James (&amp;) Kingdom Hearts 3 will finally be announced at this year's Tokyo Game Show!!!"/></To><Text Style="font-family:MS Sans Serif; font-weight:bold; color:#0000ff; ">do u rekon we should get him?</Text></Message><Message Date="12/06/2007" Time="9:01:09 PM" DateTime="2007-06-12T11:01:09.036Z" SessionID="36"><From><User FriendlyName="Jonathan..."/></From><To><User FriendlyName="Jordy"/><User FriendlyName="SMB"/><User FriendlyName="(F)Heath is the fucking best | a mans home is his castle"/><User FriendlyName="-brenDAN"/><User FriendlyName="- *one James (&amp;) Kingdom Hearts 3 will finally be announced at this year's Tokyo Game Show!!!"/></To><Text Style="font-family:Comic Sans MS; color:#008000; ">might do that</Text></Message><Message Date="12/06/2007" Time="9:01:17 PM" DateTime="2007-06-12T11:01:17.982Z" SessionID="36"><From><User FriendlyName="Jonathan..."/></From><To><User FriendlyName="Jordy"/><User FriendlyName="SMB"/><User FriendlyName="(F)Heath is the fucking best | a mans home is his castle"/><User FriendlyName="-brenDAN"/><User FriendlyName="- *one James (&amp;) Kingdom Hearts 3 will finally be announced at this year's Tokyo Game Show!!!"/></To><Text Style="font-family:Comic Sans MS; color:#008000; ">jimmeh do they take gmail accounts?</Text></Message><Message Date="12/06/2007" Time="9:01:33 PM" DateTime="2007-06-12T11:01:33.144Z" SessionID="36"><From><User FriendlyName="SMB"/></From><To><User FriendlyName="Jordy"/><User FriendlyName="Jonathan..."/><User FriendlyName="(F)Heath is the fucking best | a mans home is his castle"/><User FriendlyName="-brenDAN"/><User FriendlyName="- *one James (&amp;) Kingdom Hearts 3 will finally be announced at this year's Tokyo Game Show!!!"/></To><Text Style="font-family:MS Sans Serif; font-weight:bold; color:#0000ff; ">nah</Text></Message><Message Date="12/06/2007" Time="9:01:34 PM" DateTime="2007-06-12T11:01:34.643Z" SessionID="36"><From><User FriendlyName="SMB"/></From><To><User FriendlyName="Jordy"/><User FriendlyName="Jonathan..."/><User FriendlyName="(F)Heath is the fucking best | a mans home is his castle"/><User FriendlyName="-brenDAN"/><User FriendlyName="- *one James (&amp;) Kingdom Hearts 3 will finally be announced at this year's Tokyo Game Show!!!"/></To><Text Style="font-family:MS Sans Serif; font-weight:bold; color:#0000ff; ">just isp</Text></Message><Message Date="12/06/2007" Time="9:01:45 PM" DateTime="2007-06-12T11:01:45.809Z" SessionID="36"><From><User FriendlyName="Jonathan..."/></From><To><User FriendlyName="Jordy"/><User FriendlyName="SMB"/><User FriendlyName="(F)Heath is the fucking best | a mans home is his castle"/><User FriendlyName="-brenDAN"/><User FriendlyName="- *one James (&amp;) Kingdom Hearts 3 will finally be announced at this year's Tokyo Game Show!!!"/></To><Text Style="font-family:Comic Sans MS; color:#008000; ">well where the fk am i gonna get another one of those</Text></Message><Message Date="12/06/2007" Time="9:01:52 PM" DateTime="2007-06-12T11:01:52.007Z" SessionID="36"><From><User FriendlyName="Jonathan..."/></From><To><User FriendlyName="Jordy"/><User FriendlyName="SMB"/><User FriendlyName="(F)Heath is the fucking best | a mans home is his castle"/><User FriendlyName="-brenDAN"/><User FriendlyName="- *one James (&amp;) Kingdom Hearts 3 will finally be announced at this year's Tokyo Game Show!!!"/></To><Text Style="font-family:Comic Sans MS; color:#008000; ">i dun even know where i got my first one</Text></Message><Message Date="12/06/2007" Time="9:01:58 PM" DateTime="2007-06-12T11:01:58.528Z" SessionID="36"><From><User FriendlyName="Jordy"/></From><To><User FriendlyName="Jonathan..."/><User FriendlyName="SMB"/><User FriendlyName="(F)Heath is the fucking best | a mans home is his castle"/><User FriendlyName="-brenDAN"/><User FriendlyName="- *one James (&amp;) Kingdom Hearts 3 will finally be announced at this year's Tokyo Game Show!!!"/></To><Text Style="font-family:MS Shell Dlg; color:#000000; ">umm could u change ur current 1?</Text></Message><Message Date="12/06/2007" Time="9:02:12 PM" DateTime="2007-06-12T11:02:12.913Z" SessionID="36"><From><User FriendlyName="Jordy"/></From><To><User FriendlyName="Jonathan..."/><User FriendlyName="SMB"/><User FriendlyName="(F)Heath is the fucking best | a mans home is his castle"/><User FriendlyName="-brenDAN"/><User FriendlyName="- *one James (&amp;) Kingdom Hearts 3 will finally be announced at this year's Tokyo Game Show!!!"/></To><Text Style="font-family:MS Shell Dlg; color:#000000; ">so it has a diff name then u could have 2</Text></Message><Message Date="12/06/2007" Time="9:02:21 PM" DateTime="2007-06-12T11:02:21.884Z" SessionID="36"><From><User FriendlyName="Jonathan..."/></From><To><User FriendlyName="Jordy"/><User FriendlyName="SMB"/><User FriendlyName="(F)Heath is the fucking best | a mans home is his castle"/><User FriendlyName="-brenDAN"/><User FriendlyName="- *one James (&amp;) Kingdom Hearts 3 will finally be announced at this year's Tokyo Game Show!!!"/></To><Text Style="font-family:Comic Sans MS; color:#008000; ">huh?</Text></Message><Message Date="12/06/2007" Time="9:02:27 PM" DateTime="2007-06-12T11:02:27.905Z" SessionID="36"><From><User FriendlyName="Jonathan..."/></From><To><User FriendlyName="Jordy"/><User FriendlyName="SMB"/><User FriendlyName="(F)Heath is the fucking best | a mans home is his castle"/><User FriendlyName="-brenDAN"/><User FriendlyName="- *one James (&amp;) Kingdom Hearts 3 will finally be announced at this year's Tokyo Game Show!!!"/></To><Text Style="font-family:Comic Sans MS; color:#008000; ">if ur saying wat i think ur saying</Text></Message><Message Date="12/06/2007" Time="9:02:31 PM" DateTime="2007-06-12T11:02:31.951Z" SessionID="36"><From><User FriendlyName="Jonathan..."/></From><To><User FriendlyName="Jordy"/><User FriendlyName="SMB"/><User FriendlyName="(F)Heath is the fucking best | a mans home is his castle"/><User FriendlyName="-brenDAN"/><User FriendlyName="- *one James (&amp;) Kingdom Hearts 3 will finally be announced at this year's Tokyo Game Show!!!"/></To><Text Style="font-family:Comic Sans MS; color:#008000; ">U R A FKIN RTARD</Text></Message><Message Date="12/06/2007" Time="9:02:43 PM" DateTime="2007-06-12T11:02:43.626Z" SessionID="36"><From><User FriendlyName="- *one James (&amp;) Kingdom Hearts 3 will finally be announced at this year's Tokyo Game Show!!!"/></From><To><User FriendlyName="Jordy"/><User FriendlyName="Jonathan..."/><User FriendlyName="SMB"/><User FriendlyName="(F)Heath is the fucking best | a mans home is his castle"/><User FriendlyName="-brenDAN"/></To><Text Style="font-family:Microsoft Sans Serif; color:#000000; ">just stick with hybrid</Text></Message><Message Date="12/06/2007" Time="9:02:46 PM" DateTime="2007-06-12T11:02:46.681Z" SessionID="36"><From><User FriendlyName="- *one James (&amp;) Kingdom Hearts 3 will finally be announced at this year's Tokyo Game Show!!!"/></From><To><User FriendlyName="Jordy"/><User FriendlyName="Jonathan..."/><User FriendlyName="SMB"/><User FriendlyName="(F)Heath is the fucking best | a mans home is his castle"/><User FriendlyName="-brenDAN"/></To><Text Style="font-family:Microsoft Sans Serif; color:#000000; ">and change the n ame</Text></Message><Message Date="12/06/2007" Time="9:02:54 PM" DateTime="2007-06-12T11:02:54.535Z" SessionID="36"><From><User FriendlyName="(F)Heath is the fucking best | a mans home is his castle"/></From><To><User FriendlyName="Jordy"/><User FriendlyName="Jonathan..."/><User FriendlyName="SMB"/><User FriendlyName="-brenDAN"/><User FriendlyName="- *one James (&amp;) Kingdom Hearts 3 will finally be announced at this year's Tokyo Game Show!!!"/></To><Text Style="font-family:Microsoft Sans Serif; color:#008080; ">fuck that</Text></Message><Message Date="12/06/2007" Time="9:02:58 PM" DateTime="2007-06-12T11:02:58.516Z" SessionID="36"><From><User FriendlyName="Jonathan..."/></From><To><User FriendlyName="Jordy"/><User FriendlyName="SMB"/><User FriendlyName="(F)Heath is the fucking best | a mans home is his castle"/><User FriendlyName="-brenDAN"/><User FriendlyName="- *one James (&amp;) Kingdom Hearts 3 will finally be announced at this year's Tokyo Game Show!!!"/></To><Text Style="font-family:Comic Sans MS; color:#008000; ">yea</Text></Message><Message Date="12/06/2007" Time="9:03:00 PM" DateTime="2007-06-12T11:03:00.009Z" SessionID="36"><From><User FriendlyName="Jordy"/></From><To><User FriendlyName="Jonathan..."/><User FriendlyName="SMB"/><User FriendlyName="(F)Heath is the fucking best | a mans home is his castle"/><User FriendlyName="-brenDAN"/><User FriendlyName="- *one James (&amp;) Kingdom Hearts 3 will finally be announced at this year's Tokyo Game Show!!!"/></To><Text Style="font-family:MS Shell Dlg; color:#000000; ">change ur isp email which is an option you can do then make a new ga account</Text></Message><Message Date="12/06/2007" Time="9:03:03 PM" DateTime="2007-06-12T11:03:03.009Z" SessionID="36"><From><User FriendlyName="Jonathan..."/></From><To><User FriendlyName="Jordy"/><User FriendlyName="SMB"/><User FriendlyName="(F)Heath is the fucking best | a mans home is his castle"/><User FriendlyName="-brenDAN"/><User FriendlyName="- *one James (&amp;) Kingdom Hearts 3 will finally be announced at this year's Tokyo Game Show!!!"/></To><Text Style="font-family:Comic Sans MS; color:#008000; ">just make 2 accounts</Text></Message><Message Date="12/06/2007" Time="9:03:05 PM" DateTime="2007-06-12T11:03:05.008Z" SessionID="36"><From><User FriendlyName="(F)Heath is the fucking best | a mans home is his castle"/></From><To><User FriendlyName="Jordy"/><User FriendlyName="Jonathan..."/><User FriendlyName="SMB"/><User FriendlyName="-brenDAN"/><User FriendlyName="- *one James (&amp;) Kingdom Hearts 3 will finally be announced at this year's Tokyo Game Show!!!"/></To><Text Style="font-family:Microsoft Sans Serif; color:#008080; ">if you dont want to join the clan jimmeh then dont</Text></Message><Message Date="12/06/2007" Time="9:03:11 PM" DateTime="2007-06-12T11:03:11.065Z" SessionID="36"><From><User FriendlyName="Jordy"/></From><To><User FriendlyName="Jonathan..."/><User FriendlyName="SMB"/><User FriendlyName="(F)Heath is the fucking best | a mans home is his castle"/><User FriendlyName="-brenDAN"/><User FriendlyName="- *one James (&amp;) Kingdom Hearts 3 will finally be announced at this year's Tokyo Game Show!!!"/></To><Text Style="font-family:MS Shell Dlg; color:#000000; ">join u fgag</Text></Message><Message Date="12/06/2007" Time="9:03:13 PM" DateTime="2007-06-12T11:03:13.451Z" SessionID="36"><From><User FriendlyName="(F)Heath is the fucking best | a mans home is his castle"/></From><To><User FriendlyName="Jordy"/><User FriendlyName="Jonathan..."/><User FriendlyName="SMB"/><User FriendlyName="-brenDAN"/><User FriendlyName="- *one James (&amp;) Kingdom Hearts 3 will finally be announced at this year's Tokyo Game Show!!!"/></To><Text Style="font-family:Microsoft Sans Serif; color:#008080; ">simple</Text></Message><Message Date="12/06/2007" Time="9:03:14 PM" DateTime="2007-06-12T11:03:14.319Z" SessionID="36"><From><User FriendlyName="Jordy"/></From><To><User FriendlyName="Jonathan..."/><User FriendlyName="SMB"/><User FriendlyName="(F)Heath is the fucking best | a mans home is his castle"/><User FriendlyName="-brenDAN"/><User FriendlyName="- *one James (&amp;) Kingdom Hearts 3 will finally be announced at this year's Tokyo Game Show!!!"/></To><Text Style="font-family:MS Shell Dlg; color:#000000; ">fag*</Text></Message><Message Date="12/06/2007" Time="9:03:21 PM" DateTime="2007-06-12T11:03:21.716Z" SessionID="36"><From><User FriendlyName="Jordy"/></From><To><User FriendlyName="Jonathan..."/><User FriendlyName="SMB"/><User FriendlyName="(F)Heath is the fucking best | a mans home is his castle"/><User FriendlyName="-brenDAN"/><User FriendlyName="- *one James (&amp;) Kingdom Hearts 3 will finally be announced at this year's Tokyo Game Show!!!"/></To><Text Style="font-family:MS Shell Dlg; color:#000000; ">u joining hef?</Text></Message><Message Date="12/06/2007" Time="9:03:31 PM" DateTime="2007-06-12T11:03:31.249Z" SessionID="36"><From><User FriendlyName="SMB"/></From><To><User FriendlyName="Jordy"/><User FriendlyName="Jonathan..."/><User FriendlyName="(F)Heath is the fucking best | a mans home is his castle"/><User FriendlyName="-brenDAN"/><User FriendlyName="- *one James (&amp;) Kingdom Hearts 3 will finally be announced at this year's Tokyo Game Show!!!"/></To><Text Style="font-family:MS Sans Serif; font-weight:bold; color:#0000ff; ">hef is</Text></Message><Message Date="12/06/2007" Time="9:03:32 PM" DateTime="2007-06-12T11:03:32.977Z" SessionID="36"><From><User FriendlyName="(F)Heath is the fucking best | a mans home is his castle"/></From><To><User FriendlyName="Jordy"/><User FriendlyName="Jonathan..."/><User FriendlyName="SMB"/><User FriendlyName="-brenDAN"/><User FriendlyName="- *one James (&amp;) Kingdom Hearts 3 will finally be announced at this year's Tokyo Game Show!!!"/></To><Text Style="font-family:Microsoft Sans Serif; color:#008080; ">yea</Text></Message><Message Date="12/06/2007" Time="9:03:33 PM" DateTime="2007-06-12T11:03:33.447Z" SessionID="36"><From><User FriendlyName="SMB"/></From><To><User FriendlyName="Jordy"/><User FriendlyName="Jonathan..."/><User FriendlyName="(F)Heath is the fucking best | a mans home is his castle"/><User FriendlyName="-brenDAN"/><User FriendlyName="- *one James (&amp;) Kingdom Hearts 3 will finally be announced at this year's Tokyo Game Show!!!"/></To><Text Style="font-family:MS Sans Serif; font-weight:bold; color:#0000ff; ">coz he loves me</Text></Message><Message Date="12/06/2007" Time="9:03:36 PM" DateTime="2007-06-12T11:03:36.182Z" SessionID="36"><From><User FriendlyName="SMB"/></From><To><User FriendlyName="Jordy"/><User FriendlyName="Jonathan..."/><User FriendlyName="(F)Heath is the fucking best | a mans home is his castle"/><User FriendlyName="-brenDAN"/><User FriendlyName="- *one James (&amp;) Kingdom Hearts 3 will finally be announced at this year's Tokyo Game Show!!!"/></To><Text Style="font-family:MS Sans Serif; font-weight:bold; color:#0000ff; ">and i love him</Text></Message><Message Date="12/06/2007" Time="9:03:37 PM" DateTime="2007-06-12T11:03:37.330Z" SessionID="36"><From><User FriendlyName="(F)Heath is the fucking best | a mans home is his castle"/></From><To><User FriendlyName="Jordy"/><User FriendlyName="Jonathan..."/><User FriendlyName="SMB"/><User FriendlyName="-brenDAN"/><User FriendlyName="- *one James (&amp;) Kingdom Hearts 3 will finally be announced at this year's Tokyo Game Show!!!"/></To><Text Style="font-family:Microsoft Sans Serif; color:#008080; ">got nothing better to do</Text></Message><Message Date="12/06/2007" Time="9:03:39 PM" DateTime="2007-06-12T11:03:39.180Z" SessionID="36"><From><User FriendlyName="Jordy"/></From><To><User FriendlyName="Jonathan..."/><User FriendlyName="SMB"/><User FriendlyName="(F)Heath is the fucking best | a mans home is his castle"/><User FriendlyName="-brenDAN"/><User FriendlyName="- *one James (&amp;) Kingdom Hearts 3 will finally be announced at this year's Tokyo Game Show!!!"/></To><Text Style="font-family:MS Shell Dlg; color:#000000; ">well thats nice</Text></Message><Message Date="12/06/2007" Time="9:03:41 PM" DateTime="2007-06-12T11:03:41.302Z" SessionID="36"><From><User FriendlyName="SMB"/></From><To><User FriendlyName="Jordy"/><User FriendlyName="Jonathan..."/><User FriendlyName="(F)Heath is the fucking best | a mans home is his castle"/><User FriendlyName="-brenDAN"/><User FriendlyName="- *one James (&amp;) Kingdom Hearts 3 will finally be announced at this year's Tokyo Game Show!!!"/></To><Text Style="font-family:MS Sans Serif; font-weight:bold; color:#0000ff; ">and we're gonna get married!</Text></Message><Message Date="12/06/2007" Time="9:03:41 PM" DateTime="2007-06-12T11:03:41.827Z" SessionID="36"><From><User FriendlyName="- *one James (&amp;) Kingdom Hearts 3 will finally be announced at this year's Tokyo Game Show!!!"/></From><To><User FriendlyName="Jordy"/><User FriendlyName="Jonathan..."/><User FriendlyName="SMB"/><User FriendlyName="(F)Heath is the fucking best | a mans home is his castle"/><User FriendlyName="-brenDAN"/></To><Text Style="font-family:Microsoft Sans Serif; color:#000000; ">heath u stupid dum fuck, It seams stupid to make a new clan wen half the mebers are alreayd in one, and we'd be loosing some good players...</Text></Message><Message Date="12/06/2007" Time="9:03:54 PM" DateTime="2007-06-12T11:03:54.828Z" SessionID="36"><From><User FriendlyName="Jonathan..."/></From><To><User FriendlyName="Jordy"/><User FriendlyName="SMB"/><User FriendlyName="(F)Heath is the fucking best | a mans home is his castle"/><User FriendlyName="-brenDAN"/><User FriendlyName="- *one James (&amp;) Kingdom Hearts 3 will finally be announced at this year's Tokyo Game Show!!!"/></To><Text Style="font-family:Comic Sans MS; color:#008000; ">na im with hefa</Text></Message><Message Date="12/06/2007" Time="9:03:56 PM" DateTime="2007-06-12T11:03:56.196Z" SessionID="36"><From><User FriendlyName="SMB"/></From><To><User FriendlyName="Jordy"/><User FriendlyName="Jonathan..."/><User FriendlyName="(F)Heath is the fucking best | a mans home is his castle"/><User FriendlyName="-brenDAN"/><User FriendlyName="- *one James (&amp;) Kingdom Hearts 3 will finally be announced at this year's Tokyo Game Show!!!"/></To><Text Style="font-family:MS Sans Serif; font-weight:bold; color:#0000ff; ">its not about bieng good</Text></Message><Message Date="12/06/2007" Time="9:04:01 PM" DateTime="2007-06-12T11:04:01.341Z" SessionID="36"><From><User FriendlyName="(F)Heath is the fucking best | a mans home is his castle"/></From><To><User FriendlyName="Jordy"/><User FriendlyName="Jonathan..."/><User FriendlyName="SMB"/><User FriendlyName="-brenDAN"/><User FriendlyName="- *one James (&amp;) Kingdom Hearts 3 will finally be announced at this year's Tokyo Game Show!!!"/></To><Text Style="font-family:Microsoft Sans Serif; color:#008080; ">we dont want your shit players</Text></Message><Message Date="12/06/2007" Time="9:04:01 PM" DateTime="2007-06-12T11:04:01.898Z" SessionID="36"><From><User FriendlyName="SMB"/></From><To><User FriendlyName="Jordy"/><User FriendlyName="Jonathan..."/><User FriendlyName="(F)Heath is the fucking best | a mans home is his castle"/><User FriendlyName="-brenDAN"/><User FriendlyName="- *one James (&amp;) Kingdom Hearts 3 will finally be announced at this year's Tokyo Game Show!!!"/></To><Text Style="font-family:MS Sans Serif; font-weight:bold; color:#0000ff; ">its about being pwned by the good</Text></Message><Message Date="12/06/2007" Time="9:04:03 PM" DateTime="2007-06-12T11:04:03.993Z" SessionID="36"><From><User FriendlyName="- *one James (&amp;) Kingdom Hearts 3 will finally be announced at this year's Tokyo Game Show!!!"/></From><To><User FriendlyName="Jordy"/><User FriendlyName="Jonathan..."/><User FriendlyName="SMB"/><User FriendlyName="(F)Heath is the fucking best | a mans home is his castle"/><User FriendlyName="-brenDAN"/></To><Text Style="font-family:Microsoft Sans Serif; color:#000000; ">They dont have to be good</Text></Message><Message Date="12/06/2007" Time="9:04:05 PM" DateTime="2007-06-12T11:04:05.865Z" SessionID="36"><From><User FriendlyName="(F)Heath is the fucking best | a mans home is his castle"/></From><To><User FriendlyName="Jordy"/><User FriendlyName="Jonathan..."/><User FriendlyName="SMB"/><User FriendlyName="-brenDAN"/><User FriendlyName="- *one James (&amp;) Kingdom Hearts 3 will finally be announced at this year's Tokyo Game Show!!!"/></To><Text Style="font-family:Microsoft Sans Serif; color:#008080; ">hybrid are fucking useless</Text></Message><Message Date="12/06/2007" Time="9:04:06 PM" DateTime="2007-06-12T11:04:06.458Z" SessionID="36"><From><User FriendlyName="SMB"/></From><To><User FriendlyName="Jordy"/><User FriendlyName="Jonathan..."/><User FriendlyName="(F)Heath is the fucking best | a mans home is his castle"/><User FriendlyName="-brenDAN"/><User FriendlyName="- *one James (&amp;) Kingdom Hearts 3 will finally be announced at this year's Tokyo Game Show!!!"/></To><Text Style="font-family:MS Sans Serif; font-weight:bold; color:#0000ff; ">dont u see?!</Text></Message><Message Date="12/06/2007" Time="9:04:06 PM" DateTime="2007-06-12T11:04:06.487Z" SessionID="36"><From><User FriendlyName="Jonathan..."/></From><To><User FriendlyName="Jordy"/><User FriendlyName="SMB"/><User FriendlyName="(F)Heath is the fucking best | a mans home is his castle"/><User FriendlyName="-brenDAN"/><User FriendlyName="- *one James (&amp;) Kingdom Hearts 3 will finally be announced at this year's Tokyo Game Show!!!"/></To><Text Style="font-family:Comic Sans MS; color:#008000; ">no point fkin up hyrbid</Text></Message><Message Date="12/06/2007" Time="9:04:17 PM" DateTime="2007-06-12T11:04:17.407Z" SessionID="36"><From><User FriendlyName="- *one James (&amp;) Kingdom Hearts 3 will finally be announced at this year's Tokyo Game Show!!!"/></From><To><User FriendlyName="Jordy"/><User FriendlyName="Jonathan..."/><User FriendlyName="SMB"/><User FriendlyName="(F)Heath is the fucking best | a mans home is his castle"/><User FriendlyName="-brenDAN"/></To><Text Style="font-family:Microsoft Sans Serif; color:#000000; ">Ea+er is a champ tho</Text></Message><Message Date="12/06/2007" Time="9:04:22 PM" DateTime="2007-06-12T11:04:22.897Z" SessionID="36"><From><User FriendlyName="(F)Heath is the fucking best | a mans home is his castle"/></From><To><User FriendlyName="Jordy"/><User FriendlyName="Jonathan..."/><User FriendlyName="SMB"/><User FriendlyName="-brenDAN"/><User FriendlyName="- *one James (&amp;) Kingdom Hearts 3 will finally be announced at this year's Tokyo Game Show!!!"/></To><Text Style="font-family:Microsoft Sans Serif; color:#008080; ">and we are making this caln so our who team is just us</Text></Message><Message Date="12/06/2007" Time="9:04:30 PM" DateTime="2007-06-12T11:04:30.757Z" SessionID="36"><From><User FriendlyName="(F)Heath is the fucking best | a mans home is his castle"/></From><To><User FriendlyName="Jordy"/><User FriendlyName="Jonathan..."/><User FriendlyName="SMB"/><User FriendlyName="-brenDAN"/><User FriendlyName="- *one James (&amp;) Kingdom Hearts 3 will finally be announced at this year's Tokyo Game Show!!!"/></To><Text Style="font-family:Microsoft Sans Serif; color:#008080; ">whole*</Text></Message><Message Date="12/06/2007" Time="9:04:36 PM" DateTime="2007-06-12T11:04:36.150Z" SessionID="36"><From><User FriendlyName="- *one James (&amp;) Kingdom Hearts 3 will finally be announced at this year's Tokyo Game Show!!!"/></From><To><User FriendlyName="Jordy"/><User FriendlyName="Jonathan..."/><User FriendlyName="SMB"/><User FriendlyName="(F)Heath is the fucking best | a mans home is his castle"/><User FriendlyName="-brenDAN"/></To><Text Style="font-family:Microsoft Sans Serif; color:#000000; ">yes cuz that worked out the last 3 times din it</Text></Message><Message Date="12/06/2007" Time="9:04:39 PM" DateTime="2007-06-12T11:04:39.692Z" SessionID="36"><From><User FriendlyName="- *one James (&amp;) Kingdom Hearts 3 will finally be announced at this year's Tokyo Game Show!!!"/></From><To><User FriendlyName="Jordy"/><User FriendlyName="Jonathan..."/><User FriendlyName="SMB"/><User FriendlyName="(F)Heath is the fucking best | a mans home is his castle"/><User FriendlyName="-brenDAN"/></To><Text Style="font-family:Microsoft Sans Serif; color:#000000; ">or is it 4?</Text></Message><Message Date="12/06/2007" Time="9:04:42 PM" DateTime="2007-06-12T11:04:42.606Z" SessionID="36"><From><User FriendlyName="Jonathan..."/></From><To><User FriendlyName="Jordy"/><User FriendlyName="SMB"/><User FriendlyName="(F)Heath is the fucking best | a mans home is his castle"/><User FriendlyName="-brenDAN"/><User FriendlyName="- *one James (&amp;) Kingdom Hearts 3 will finally be announced at this year's Tokyo Game Show!!!"/></To><Text Style="font-family:Comic Sans MS; color:#008000; ">hefa who put u inchatge at all</Text></Message><Message Date="12/06/2007" Time="9:04:49 PM" DateTime="2007-06-12T11:04:49.719Z" SessionID="36"><From><User FriendlyName="SMB"/></From><To><User FriendlyName="Jordy"/><User FriendlyName="Jonathan..."/><User FriendlyName="(F)Heath is the fucking best | a mans home is his castle"/><User FriendlyName="-brenDAN"/><User FriendlyName="- *one James (&amp;) Kingdom Hearts 3 will finally be announced at this year's Tokyo Game Show!!!"/></To><Text Style="font-family:MS Sans Serif; font-weight:bold; color:#0000ff; ">OI!</Text></Message><Message Date="12/06/2007" Time="9:04:50 PM" DateTime="2007-06-12T11:04:50.452Z" SessionID="36"><From><User FriendlyName="(F)Heath is the fucking best | a mans home is his castle"/></From><To><User FriendlyName="Jordy"/><User FriendlyName="Jonathan..."/><User FriendlyName="SMB"/><User FriendlyName="-brenDAN"/><User FriendlyName="- *one James (&amp;) Kingdom Hearts 3 will finally be announced at this year's Tokyo Game Show!!!"/></To><Text Style="font-family:Microsoft Sans Serif; color:#008080; ">im just saying</Text></Message><Message Date="12/06/2007" Time="9:04:54 PM" DateTime="2007-06-12T11:04:54.528Z" SessionID="36"><From><User FriendlyName="SMB"/></From><To><User FriendlyName="Jordy"/><User FriendlyName="Jonathan..."/><User FriendlyName="(F)Heath is the fucking best | a mans home is his castle"/><User FriendlyName="-brenDAN"/><User FriendlyName="- *one James (&amp;) Kingdom Hearts 3 will finally be announced at this year's Tokyo Game Show!!!"/></To><Text Style="font-family:MS Sans Serif; font-weight:bold; color:#0000ff; ">lets not attack each other</Text></Message><Message Date="12/06/2007" Time="9:04:55 PM" DateTime="2007-06-12T11:04:55.165Z" SessionID="36"><From><User FriendlyName="(F)Heath is the fucking best | a mans home is his castle"/></From><To><User FriendlyName="Jordy"/><User FriendlyName="Jonathan..."/><User FriendlyName="SMB"/><User FriendlyName="-brenDAN"/><User FriendlyName="- *one James (&amp;) Kingdom Hearts 3 will finally be announced at this year's Tokyo Game Show!!!"/></To><Text Style="font-family:Microsoft Sans Serif; color:#008080; ">im not joining hybrid</Text></Message><Message Date="12/06/2007" Time="9:05:01 PM" DateTime="2007-06-12T11:05:01.696Z" SessionID="36"><From><User FriendlyName="Jordy"/></From><To><User FriendlyName="Jonathan..."/><User FriendlyName="SMB"/><User FriendlyName="(F)Heath is the fucking best | a mans home is his castle"/><User FriendlyName="-brenDAN"/><User FriendlyName="- *one James (&amp;) Kingdom Hearts 3 will finally be announced at this year's Tokyo Game Show!!!"/></To><Text Style="font-family:MS Shell Dlg; color:#000000; ">fuck u boys get cut much?</Text></Message><Message Date="12/06/2007" Time="9:05:05 PM" DateTime="2007-06-12T11:05:05.044Z" SessionID="36"><From><User FriendlyName="SMB"/></From><To><User FriendlyName="Jordy"/><User FriendlyName="Jonathan..."/><User FriendlyName="(F)Heath is the fucking best | a mans home is his castle"/><User FriendlyName="-brenDAN"/><User FriendlyName="- *one James (&amp;) Kingdom Hearts 3 will finally be announced at this year's Tokyo Game Show!!!"/></To><Text Style="font-family:MS Sans Serif; font-weight:bold; color:#0000ff; ">haha</Text></Message><Message Date="12/06/2007" Time="9:05:05 PM" DateTime="2007-06-12T11:05:05.447Z" SessionID="36"><From><User FriendlyName="Jonathan..."/></From><To><User FriendlyName="Jordy"/><User FriendlyName="SMB"/><User FriendlyName="(F)Heath is the fucking best | a mans home is his castle"/><User FriendlyName="-brenDAN"/><User FriendlyName="- *one James (&amp;) Kingdom Hearts 3 will finally be announced at this year's Tokyo Game Show!!!"/></To><Text Style="font-family:Comic Sans MS; color:#008000; ">no1 aksed u to</Text></Message><Message Date="12/06/2007" Time="9:05:07 PM" DateTime="2007-06-12T11:05:07.468Z" SessionID="36"><From><User FriendlyName="SMB"/></From><To><User FriendlyName="Jordy"/><User FriendlyName="Jonathan..."/><User FriendlyName="(F)Heath is the fucking best | a mans home is his castle"/><User FriendlyName="-brenDAN"/><User FriendlyName="- *one James (&amp;) Kingdom Hearts 3 will finally be announced at this year's Tokyo Game Show!!!"/></To><Text Style="font-family:MS Sans Serif; font-weight:bold; color:#0000ff; ">agreed jordy</Text></Message><Message Date="12/06/2007" Time="9:05:09 PM" DateTime="2007-06-12T11:05:09.564Z" SessionID="36"><From><User FriendlyName="(F)Heath is the fucking best | a mans home is his castle"/></From><To><User FriendlyName="Jordy"/><User FriendlyName="Jonathan..."/><User FriendlyName="SMB"/><User FriendlyName="-brenDAN"/><User FriendlyName="- *one James (&amp;) Kingdom Hearts 3 will finally be announced at this year's Tokyo Game Show!!!"/></To><Text Style="font-family:Microsoft Sans Serif; color:#008080; ">ok good</Text></Message><Leave Date="12/06/2007" Time="9:05:10 PM" DateTime="2007-06-12T11:05:10.539Z" SessionID="36"><User FriendlyName="(F)Heath is the fucking best | a mans home is his castle"/><Text Style="color:#800000; ">(F)Heath is the fucking best | a mans home is his castle has left the conversation.</Text></Leave><Message Date="12/06/2007" Time="9:05:14 PM" DateTime="2007-06-12T11:05:14.556Z" SessionID="36"><From><User FriendlyName="Jonathan..."/></From><To><User FriendlyName="Jordy"/><User FriendlyName="SMB"/><User FriendlyName="-brenDAN"/><User FriendlyName="- *one James (&amp;) Kingdom Hearts 3 will finally be announced at this year's Tokyo Game Show!!!"/></To><Text Style="font-family:Comic Sans MS; color:#008000; ">stfu calm fks!</Text></Message><Message Date="12/06/2007" Time="9:05:19 PM" DateTime="2007-06-12T11:05:19.829Z" SessionID="36"><From><User FriendlyName="SMB"/></From><To><User FriendlyName="Jordy"/><User FriendlyName="Jonathan..."/><User FriendlyName="-brenDAN"/><User FriendlyName="- *one James (&amp;) Kingdom Hearts 3 will finally be announced at this year's Tokyo Game Show!!!"/></To><Text Style="font-family:MS Sans Serif; font-weight:bold; color:#0000ff; ">jimmeh and jp are on the period bleeds</Text></Message><Message Date="12/06/2007" Time="9:05:26 PM" DateTime="2007-06-12T11:05:26.138Z" SessionID="36"><From><User FriendlyName="Jonathan..."/></From><To><User FriendlyName="Jordy"/><User FriendlyName="SMB"/><User FriendlyName="-brenDAN"/><User FriendlyName="- *one James (&amp;) Kingdom Hearts 3 will finally be announced at this year's Tokyo Game Show!!!"/></To><Text Style="font-family:Comic Sans MS; color:#008000; ">nod</Text></Message><Message Date="12/06/2007" Time="9:05:30 PM" DateTime="2007-06-12T11:05:30.823Z" SessionID="36"><From><User FriendlyName="- *one James (&amp;) Kingdom Hearts 3 will finally be announced at this year's Tokyo Game Show!!!"/></From><To><User FriendlyName="Jordy"/><User FriendlyName="Jonathan..."/><User FriendlyName="SMB"/><User FriendlyName="-brenDAN"/></To><Text Style="font-family:Microsoft Sans Serif; color:#000000; ">Im jsut being realistic</Text></Message><Message Date="12/06/2007" Time="9:05:34 PM" DateTime="2007-06-12T11:05:34.134Z" SessionID="36"><From><User FriendlyName="- *one James (&amp;) Kingdom Hearts 3 will finally be announced at this year's Tokyo Game Show!!!"/></From><To><User FriendlyName="Jordy"/><User FriendlyName="Jonathan..."/><User FriendlyName="SMB"/><User FriendlyName="-brenDAN"/></To><Text Style="font-family:Microsoft Sans Serif; color:#000000; ">wat happend with ctp</Text></Message><Message Date="12/06/2007" Time="9:05:36 PM" DateTime="2007-06-12T11:05:36.686Z" SessionID="36"><From><User FriendlyName="- *one James (&amp;) Kingdom Hearts 3 will finally be announced at this year's Tokyo Game Show!!!"/></From><To><User FriendlyName="Jordy"/><User FriendlyName="Jonathan..."/><User FriendlyName="SMB"/><User FriendlyName="-brenDAN"/></To><Text Style="font-family:Microsoft Sans Serif; color:#000000; ">pete made a clan</Text></Message><Message Date="12/06/2007" Time="9:05:48 PM" DateTime="2007-06-12T11:05:48.892Z" SessionID="36"><From><User FriendlyName="- *one James (&amp;) Kingdom Hearts 3 will finally be announced at this year's Tokyo Game Show!!!"/></From><To><User FriendlyName="Jordy"/><User FriendlyName="Jonathan..."/><User FriendlyName="SMB"/><User FriendlyName="-brenDAN"/></To><Text Style="font-family:Microsoft Sans Serif; color:#000000; ">no one showed up sept me breno jp and the whores we recruited</Text></Message><Message Date="12/06/2007" Time="9:05:49 PM" DateTime="2007-06-12T11:05:49.781Z" SessionID="36"><From><User FriendlyName="SMB"/></From><To><User FriendlyName="Jordy"/><User FriendlyName="Jonathan..."/><User FriendlyName="-brenDAN"/><User FriendlyName="- *one James (&amp;) Kingdom Hearts 3 will finally be announced at this year's Tokyo Game Show!!!"/></To><Text Style="font-family:MS Sans Serif; font-weight:bold; color:#0000ff; ">yeh but its just about getting the fun back into it</Text></Message><Message Date="12/06/2007" Time="9:05:51 PM" DateTime="2007-06-12T11:05:51.957Z" SessionID="36"><From><User FriendlyName="- *one James (&amp;) Kingdom Hearts 3 will finally be announced at this year's Tokyo Game Show!!!"/></From><To><User FriendlyName="Jordy"/><User FriendlyName="Jonathan..."/><User FriendlyName="SMB"/><User FriendlyName="-brenDAN"/></To><Text Style="font-family:Microsoft Sans Serif; color:#000000; ">clan fell apart</Text></Message><Message Date="12/06/2007" Time="9:05:53 PM" DateTime="2007-06-12T11:05:53.359Z" SessionID="36"><From><User FriendlyName="SMB"/></From><To><User FriendlyName="Jordy"/><User FriendlyName="Jonathan..."/><User FriendlyName="-brenDAN"/><User FriendlyName="- *one James (&amp;) Kingdom Hearts 3 will finally be announced at this year's Tokyo Game Show!!!"/></To><Text Style="font-family:MS Sans Serif; font-weight:bold; color:#0000ff; ">no competition</Text></Message><Message Date="12/06/2007" Time="9:06:00 PM" DateTime="2007-06-12T11:06:00.957Z" SessionID="36"><From><User FriendlyName="- *one James (&amp;) Kingdom Hearts 3 will finally be announced at this year's Tokyo Game Show!!!"/></From><To><User FriendlyName="Jordy"/><User FriendlyName="Jonathan..."/><User FriendlyName="SMB"/><User FriendlyName="-brenDAN"/></To><Text Style="font-family:Microsoft Sans Serif; color:#000000; ">I enjoyed Hybrid</Text></Message><Message Date="12/06/2007" Time="9:06:09 PM" DateTime="2007-06-12T11:06:09.662Z" SessionID="36"><From><User FriendlyName="SMB"/></From><To><User FriendlyName="Jordy"/><User FriendlyName="Jonathan..."/><User FriendlyName="-brenDAN"/><User FriendlyName="- *one James (&amp;) Kingdom Hearts 3 will finally be announced at this year's Tokyo Game Show!!!"/></To><Text Style="font-family:MS Sans Serif; font-weight:bold; color:#0000ff; ">ther is commitment this time</Text></Message><Message Date="12/06/2007" Time="9:06:16 PM" DateTime="2007-06-12T11:06:16.654Z" SessionID="36"><From><User FriendlyName="SMB"/></From><To><User FriendlyName="Jordy"/><User FriendlyName="Jonathan..."/><User FriendlyName="-brenDAN"/><User FriendlyName="- *one James (&amp;) Kingdom Hearts 3 will finally be announced at this year's Tokyo Game Show!!!"/></To><Text Style="font-family:MS Sans Serif; font-weight:bold; color:#0000ff; ">noone said they were gonna join last time</Text></Message><Message Date="12/06/2007" Time="9:06:22 PM" DateTime="2007-06-12T11:06:22.729Z" SessionID="36"><From><User FriendlyName="- *one James (&amp;) Kingdom Hearts 3 will finally be announced at this year's Tokyo Game Show!!!"/></From><To><User FriendlyName="Jordy"/><User FriendlyName="Jonathan..."/><User FriendlyName="SMB"/><User FriendlyName="-brenDAN"/></To><Text Style="font-family:Microsoft Sans Serif; color:#000000; ">like the past 3 times</Text></Message><Message Date="12/06/2007" Time="9:06:23 PM" DateTime="2007-06-12T11:06:23.414Z" SessionID="36"><From><User FriendlyName="Jonathan..."/></From><To><User FriendlyName="Jordy"/><User FriendlyName="SMB"/><User FriendlyName="-brenDAN"/><User FriendlyName="- *one James (&amp;) Kingdom Hearts 3 will finally be announced at this year's Tokyo Game Show!!!"/></To><Text Style="font-family:Comic Sans MS; color:#008000; ">yes they did</Text></Message><Message Date="12/06/2007" Time="9:06:24 PM" DateTime="2007-06-12T11:06:24.611Z" SessionID="36"><From><User FriendlyName="Jordy"/></From><To><User FriendlyName="Jonathan..."/><User FriendlyName="SMB"/><User FriendlyName="-brenDAN"/><User FriendlyName="- *one James (&amp;) Kingdom Hearts 3 will finally be announced at this year's Tokyo Game Show!!!"/></To><Text Style="font-family:MS Shell Dlg; color:#000000; ">im keen</Text></Message><Message Date="12/06/2007" Time="9:06:24 PM" DateTime="2007-06-12T11:06:24.665Z" SessionID="36"><From><User FriendlyName="- *one James (&amp;) Kingdom Hearts 3 will finally be announced at this year's Tokyo Game Show!!!"/></From><To><User FriendlyName="Jordy"/><User FriendlyName="Jonathan..."/><User FriendlyName="SMB"/><User FriendlyName="-brenDAN"/></To><Text Style="font-family:Microsoft Sans Serif; color:#000000; ">everyone did</Text></Message><Message Date="12/06/2007" Time="9:06:28 PM" DateTime="2007-06-12T11:06:28.942Z" SessionID="36"><From><User FriendlyName="Jordy"/></From><To><User FriendlyName="Jonathan..."/><User FriendlyName="SMB"/><User FriendlyName="-brenDAN"/><User FriendlyName="- *one James (&amp;) Kingdom Hearts 3 will finally be announced at this year's Tokyo Game Show!!!"/></To><Text Style="font-family:MS Shell Dlg; color:#000000; ">ill even practive</Text></Message><Message Date="12/06/2007" Time="9:06:30 PM" DateTime="2007-06-12T11:06:30.070Z" SessionID="36"><From><User FriendlyName="SMB"/></From><To><User FriendlyName="Jordy"/><User FriendlyName="Jonathan..."/><User FriendlyName="-brenDAN"/><User FriendlyName="- *one James (&amp;) Kingdom Hearts 3 will finally be announced at this year's Tokyo Game Show!!!"/></To><Text Style="font-family:MS Sans Serif; font-weight:bold; color:#0000ff; ">heath said fuck no</Text></Message><Message Date="12/06/2007" Time="9:06:33 PM" DateTime="2007-06-12T11:06:33.179Z" SessionID="36"><From><User FriendlyName="SMB"/></From><To><User FriendlyName="Jordy"/><User FriendlyName="Jonathan..."/><User FriendlyName="-brenDAN"/><User FriendlyName="- *one James (&amp;) Kingdom Hearts 3 will finally be announced at this year's Tokyo Game Show!!!"/></To><Text Style="font-family:MS Sans Serif; font-weight:bold; color:#0000ff; ">saccy said no</Text></Message><Message Date="12/06/2007" Time="9:06:33 PM" DateTime="2007-06-12T11:06:33.810Z" SessionID="36"><From><User FriendlyName="Jonathan..."/></From><To><User FriendlyName="Jordy"/><User FriendlyName="SMB"/><User FriendlyName="-brenDAN"/><User FriendlyName="- *one James (&amp;) Kingdom Hearts 3 will finally be announced at this year's Tokyo Game Show!!!"/></To><Text Style="font-family:Comic Sans MS; color:#008000; ">me and brendan spent the better part of a firday making clan shit</Text></Message><Message Date="12/06/2007" Time="9:06:36 PM" DateTime="2007-06-12T11:06:36.829Z" SessionID="36"><From><User FriendlyName="Jordy"/></From><To><User FriendlyName="Jonathan..."/><User FriendlyName="SMB"/><User FriendlyName="-brenDAN"/><User FriendlyName="- *one James (&amp;) Kingdom Hearts 3 will finally be announced at this year's Tokyo Game Show!!!"/></To><Text Style="font-family:MS Shell Dlg; color:#000000; ">practice</Text></Message><Message Date="12/06/2007" Time="9:06:47 PM" DateTime="2007-06-12T11:06:47.461Z" SessionID="36"><From><User FriendlyName="SMB"/></From><To><User FriendlyName="Jordy"/><User FriendlyName="Jonathan..."/><User FriendlyName="-brenDAN"/><User FriendlyName="- *one James (&amp;) Kingdom Hearts 3 will finally be announced at this year's Tokyo Game Show!!!"/></To><Text Style="font-family:MS Sans Serif; font-weight:bold; color:#0000ff; ">u and brenDAN do not equal everyone</Text></Message><Message Date="12/06/2007" Time="9:06:52 PM" 