<?xml version="1.0"?>
<?xml-stylesheet type='text/xsl' href='MessageLog.xsl'?>
<Log FirstSessionID="1" LastSessionID="117"><Message Date="24/08/2004" Time="7:18:13 PM" DateTime="2004-08-24T09:18:13.812Z" SessionID="1"><From><User FriendlyName="James:^)"/></From><To><User FriendlyName="emcee_draco@hotmail.com"/></To><Text Style="font-family:Comic Sans MS; font-weight:bold; color:#000080; ">oi dan</Text></Message><Message Date="24/08/2004" Time="7:18:20 PM" DateTime="2004-08-24T09:18:20.161Z" SessionID="1"><From><User FriendlyName="emcee_draco@hotmail.com"/></From><To><User FriendlyName="James:^)"/></To><Text Style="font-family:Times New Roman; color:#000000; ">haha</Text></Message><Message Date="24/08/2004" Time="7:18:20 PM" DateTime="2004-08-24T09:18:20.422Z" SessionID="1"><From><User FriendlyName="James:^)"/></From><To><User FriendlyName="emcee_draco@hotmail.com"/></To><Text Style="font-family:Comic Sans MS; font-weight:bold; color:#000080; ">ive dun it</Text></Message><Message Date="24/08/2004" Time="7:18:23 PM" DateTime="2004-08-24T09:18:23.176Z" SessionID="1"><From><User FriendlyName="emcee_draco@hotmail.com"/></From><To><User FriendlyName="James:^)"/></To><Text Style="font-family:Times New Roman; color:#000000; ">ur lazy</Text></Message><Message Date="24/08/2004" Time="7:18:24 PM" DateTime="2004-08-24T09:18:24.838Z" SessionID="1"><From><User FriendlyName="James:^)"/></From><To><User FriendlyName="emcee_draco@hotmail.com"/></To><Text Style="font-family:Comic Sans MS; font-weight:bold; color:#000080; ">lol</Text></Message><Message Date="24/08/2004" Time="7:18:31 PM" DateTime="2004-08-24T09:18:31.067Z" SessionID="1"><From><User FriendlyName="James:^)"/></From><To><User FriendlyName="emcee_draco@hotmail.com"/></To><Text Style="font-family:Comic Sans MS; font-weight:bold; color:#000080; ">i cant be butherd getting up agn</Text></Message><Message Date="24/08/2004" Time="7:18:45 PM" DateTime="2004-08-24T09:18:45.908Z" SessionID="1"><From><User FriendlyName="emcee_draco@hotmail.com"/></From><To><User FriendlyName="James:^)"/></To><Text Style="font-family:Times New Roman; color:#000000; ">but this is an easier way of communicating</Text></Message><Message Date="24/08/2004" Time="7:18:47 PM" DateTime="2004-08-24T09:18:47.090Z" SessionID="1"><From><User FriendlyName="James:^)"/></From><To><User FriendlyName="emcee_draco@hotmail.com"/></To><Text Style="font-family:Comic Sans MS; font-weight:bold; color:#000080; ">i just cam in a second ago</Text></Message><Message Date="24/08/2004" Time="7:18:49 PM" DateTime="2004-08-24T09:18:49.944Z" SessionID="1"><From><User FriendlyName="James:^)"/></From><To><User FriendlyName="emcee_draco@hotmail.com"/></To><Text Style="font-family:Comic Sans MS; font-weight:bold; color:#000080; ">yeah</Text></Message><Message Date="24/08/2004" Time="7:18:55 PM" DateTime="2004-08-24T09:18:55.542Z" SessionID="1"><From><User FriendlyName="emcee_draco@hotmail.com"/></From><To><User FriendlyName="James:^)"/></To><Text Style="font-family:Times New Roman; color:#000000; ">lol</Text></Message><Message Date="24/08/2004" Time="7:19:04 PM" DateTime="2004-08-24T09:19:04.004Z" SessionID="1"><From><User FriendlyName="emcee_draco@hotmail.com"/></From><To><User FriendlyName="James:^)"/></To><Text Style="font-family:Times New Roman; color:#000000; ">so u have dun it now?</Text></Message><Message Date="24/08/2004" Time="7:19:07 PM" DateTime="2004-08-24T09:19:07.339Z" SessionID="1"><From><User FriendlyName="James:^)"/></From><To><User FriendlyName="emcee_draco@hotmail.com"/></To><Text Style="font-family:Comic Sans MS; font-weight:bold; color:#000080; ">yeah</Text></Message><Message Date="24/08/2004" Time="7:19:10 PM" DateTime="2004-08-24T09:19:10.954Z" SessionID="1"><From><User FriendlyName="emcee_draco@hotmail.com"/></From><To><User FriendlyName="James:^)"/></To><Text Style="font-family:Times New Roman; color:#000000; ">is it hard..?</Text></Message><Message Date="24/08/2004" Time="7:19:17 PM" DateTime="2004-08-24T09:19:17.544Z" SessionID="1"><From><User FriendlyName="James:^)"/></From><To><User FriendlyName="emcee_draco@hotmail.com"/></To><Text Style="font-family:Comic Sans MS; font-weight:bold; color:#000080; ">not really</Text></Message><Message Date="24/08/2004" Time="7:21:02 PM" DateTime="2004-08-24T09:21:02.074Z" SessionID="2"><From><User FriendlyName="emcee_draco@hotmail.com"/></From><To><User FriendlyName="James:^)"/></To><Text Style="font-family:Times New Roman; color:#000000; ">can i make it so u roll over an image, and it crackles like bacon</Text></Message><Message Date="24/08/2004" Time="7:21:18 PM" DateTime="2004-08-24T09:21:18.147Z" SessionID="2"><From><User FriendlyName="James:^)"/></From><To><User FriendlyName="emcee_draco@hotmail.com"/></To><Text Style="font-family:Comic Sans MS; font-weight:bold; color:#000080; ">lol</Text></Message><Message Date="24/08/2004" Time="7:21:21 PM" DateTime="2004-08-24T09:21:21.252Z" SessionID="2"><From><User FriendlyName="James:^)"/></From><To><User FriendlyName="emcee_draco@hotmail.com"/></To><Text Style="font-family:Comic Sans MS; font-weight:bold; color:#000080; ">yeah if u want</Text></Message><Message Date="24/08/2004" Time="7:21:22 PM" DateTime="2004-08-24T09:21:22.784Z" SessionID="2"><From><User FriendlyName="emcee_draco@hotmail.com"/></From><To><User FriendlyName="James:^)"/></To><Text Style="font-family:Times New Roman; color:#000000; ">giddyup!</Text></Message><Message Date="24/08/2004" Time="7:28:05 PM" DateTime="2004-08-24T09:28:05.213Z" SessionID="2"><From><User FriendlyName="James:^)"/></From><To><User FriendlyName="emcee_draco@hotmail.com"/></To><Text Style="font-family:Comic Sans MS; font-weight:bold; color:#000080; ">Britney Spears - From her first song, "One more time" - Ah, see me. I'm not too young - some people hear this reversal as "Sleep with me, I'm not too young" - Download mp3 file (A recent analysis of this song by the 2004 Adelaide RS training class concluded that the phrase actually says "Slee me" with no "p" and as such should not be documented, only "I'm not too young")</Text></Message><Message Date="24/08/2004" Time="7:28:11 PM" DateTime="2004-08-24T09:28:11.031Z" SessionID="2"><From><User FriendlyName="James:^)"/></From><To><User FriendlyName="emcee_draco@hotmail.com"/></To><Text Style="font-family:Comic Sans MS; font-weight:bold; color:#000080; ">http://www.reversespeech.com/rev/tooyoung.Mp3</Text></Message><Message Date="24/08/2004" Time="7:29:14 PM" DateTime="2004-08-24T09:29:14.272Z" SessionID="3"><From><User FriendlyName="James:^)"/></From><To><User FriendlyName="emcee_draco@hotmail.com"/></To><Text Style="font-family:Comic Sans MS; font-weight:bold; color:#000080; ">the first 30 seconds is real song</Text></Message><Message Date="24/08/2004" Time="7:29:20 PM" DateTime="2004-08-24T09:29:20.831Z" SessionID="3"><From><User FriendlyName="James:^)"/></From><To><User FriendlyName="emcee_draco@hotmail.com"/></To><Text Style="font-family:Comic Sans MS; font-weight:bold; color:#000080; ">after that they play it backwards</Text></Message><Message Date="24/08/2004" Time="7:29:21 PM" DateTime="2004-08-24T09:29:21.042Z" SessionID="3"><From><User FriendlyName="emcee_draco@hotmail.com"/></From><To><User FriendlyName="James:^)"/></To><Text Style="font-family:Times New Roman; color:#000000; ">hahah yeah thast pretty funny</Text></Message><Message Date="24/08/2004" Time="7:29:28 PM" DateTime="2004-08-24T09:29:28.572Z" SessionID="3"><From><User FriendlyName="emcee_draco@hotmail.com"/></From><To><User FriendlyName="James:^)"/></To><Text Style="font-family:Times New Roman; color:#000000; ">yeah i heard it</Text></Message><Message Date="24/08/2004" Time="9:00:57 PM" DateTime="2004-08-24T11:00:57.085Z" SessionID="4"><From><User FriendlyName="emcee_draco@hotmail.com"/></From><To><User FriendlyName="James:^)"/></To><Text Style="font-family:Times New Roman; color:#000000; ">whats the name of the file</Text></Message><Message Date="24/08/2004" Time="9:00:59 PM" DateTime="2004-08-24T11:00:59.017Z" SessionID="4"><From><User FriendlyName="emcee_draco@hotmail.com"/></From><To><User FriendlyName="James:^)"/></To><Text Style="font-family:Times New Roman; color:#000000; ">????????????????????????????????????????/</Text></Message><Message Date="24/08/2004" Time="9:01:05 PM" DateTime="2004-08-24T11:01:05.897Z" SessionID="4"><From><User FriendlyName="emcee_draco@hotmail.com"/></From><To><User FriendlyName="James:^)"/></To><Text Style="font-family:Times New Roman; color:#000000; ">ya cunt</Text></Message><Message Date="24/08/2004" Time="9:01:10 PM" DateTime="2004-08-24T11:01:10.213Z" SessionID="4"><From><User FriendlyName="emcee_draco@hotmail.com"/></From><To><User FriendlyName="James:^)"/></To><Text Style="font-family:Times New Roman; color:#000000; ">lol</Text></Message><Message Date="24/08/2004" Time="9:01:13 PM" DateTime="2004-08-24T11:01:13.017Z" SessionID="4"><From><User FriendlyName="James:^)"/></From><To><User FriendlyName="emcee_draco@hotmail.com"/></To><Text Style="font-family:Comic Sans MS; font-weight:bold; color:#000080; ">same name</Text></Message><Message Date="24/08/2004" Time="9:01:16 PM" DateTime="2004-08-24T11:01:16.292Z" SessionID="4"><From><User FriendlyName="emcee_draco@hotmail.com"/></From><To><User FriendlyName="James:^)"/></To><Text Style="font-family:Times New Roman; color:#000000; ">haha</Text></Message><Message Date="24/08/2004" Time="9:01:22 PM" DateTime="2004-08-24T11:01:22.081Z" SessionID="4"><From><User FriendlyName="emcee_draco@hotmail.com"/></From><To><User FriendlyName="James:^)"/></To><Text Style="font-family:Times New Roman; color:#000000; ">nah seriously</Text></Message><Message Date="24/08/2004" Time="9:01:25 PM" DateTime="2004-08-24T11:01:25.495Z" SessionID="4"><From><User FriendlyName="James:^)"/></From><To><User FriendlyName="emcee_draco@hotmail.com"/></To><Text Style="font-family:Comic Sans MS; font-weight:bold; color:#000080; ">crate over text</Text></Message><Message Date="24/08/2004" Time="9:01:26 PM" DateTime="2004-08-24T11:01:26.727Z" SessionID="4"><From><User FriendlyName="James:^)"/></From><To><User FriendlyName="emcee_draco@hotmail.com"/></To><Text Style="font-family:Comic Sans MS; font-weight:bold; color:#000080; ">same name</Text></Message><Message Date="24/08/2004" Time="9:01:30 PM" DateTime="2004-08-24T11:01:30.613Z" SessionID="4"><From><User FriendlyName="emcee_draco@hotmail.com"/></From><To><User FriendlyName="James:^)"/></To><Text Style="font-family:Times New Roman; color:#000000; ">ok sweet</Text></Message><Message Date="24/08/2004" Time="9:01:31 PM" DateTime="2004-08-24T11:01:31.093Z" SessionID="4"><From><User FriendlyName="James:^)"/></From><To><User FriendlyName="emcee_draco@hotmail.com"/></To><Text Style="font-family:Comic Sans MS; font-weight:bold; color:#000080; ">just overwriten</Text></Message><Message Date="24/08/2004" Time="9:01:36 PM" DateTime="2004-08-24T11:01:36.852Z" SessionID="5"><From><User FriendlyName="emcee_draco@hotmail.com"/></From><To><User FriendlyName="James:^)"/></To><Text Style="font-family:Times New Roman; color:#000000; ">yup</Text></Message><Message Date="24/08/2004" Time="9:01:39 PM" DateTime="2004-08-24T11:01:39.245Z" SessionID="5"><From><User FriendlyName="emcee_draco@hotmail.com"/></From><To><User FriendlyName="James:^)"/></To><Text Style="font-family:Times New Roman; color:#000000; ">gotsch</Text></Message><Message Date="24/08/2004" Time="9:01:44 PM" DateTime="2004-08-24T11:01:44.633Z" SessionID="5"><From><User FriendlyName="emcee_draco@hotmail.com"/></From><To><User FriendlyName="James:^)"/></To><Text Style="font-family:Times New Roman; color:#000000; ">*gotchya</Text></Message><Message Date="24/08/2004" Time="9:01:50 PM" DateTime="2004-08-24T11:01:50.201Z" SessionID="5"><From><User FriendlyName="James:^)"/></From><To><User FriendlyName="emcee_draco@hotmail.com"/></To><Text Style="font-family:Comic Sans MS; font-weight:bold; color:#000080; ">hehe</Text></Message><Message Date="24/08/2004" Time="9:03:53 PM" DateTime="2004-08-24T11:03:53.779Z" SessionID="6"><From><User FriendlyName="emcee_draco@hotmail.com"/></From><To><User FriendlyName="James:^)"/></To><Text Style="font-family:Times New Roman; color:#000000; ">james i cant do it</Text></Message><Message Date="24/08/2004" Time="9:03:59 PM" DateTime="2004-08-24T11:03:59.106Z" SessionID="6"><From><User FriendlyName="emcee_draco@hotmail.com"/></From><To><User FriendlyName="James:^)"/></To><Text Style="font-family:Times New Roman; color:#000000; ">can u come anad help me</Text></Message><Message Date="24/08/2004" Time="9:04:02 PM" DateTime="2004-08-24T11:04:02.671Z" SessionID="6"><From><User FriendlyName="emcee_draco@hotmail.com"/></From><To><User FriendlyName="James:^)"/></To><Text Style="font-family:Times New Roman; color:#000000; ">lol</Text></Message><Message Date="24/08/2004" Time="9:04:04 PM" DateTime="2004-08-24T11:04:04.284Z" SessionID="6"><From><User FriendlyName="James:^)"/></From><To><User FriendlyName="emcee_draco@hotmail.com"/></To><Text Style="font-family:Comic Sans MS; font-weight:bold; color:#000080; ">lol</Text></Message><Message Date="24/08/2004" Time="9:04:07 PM" DateTime="2004-08-24T11:04:07.639Z" SessionID="6"><From><User FriendlyName="emcee_draco@hotmail.com"/></From><To><User FriendlyName="James:^)"/></To><Text Style="font-family:Times New Roman; color:#000000; ">pleeze</Text></Message><Message Date="24/08/2004" Time="9:04:07 PM" DateTime="2004-08-24T11:04:07.659Z" SessionID="6"><From><User FriendlyName="James:^)"/></From><To><User FriendlyName="emcee_draco@hotmail.com"/></To><Text Style="font-family:Comic Sans MS; font-weight:bold; color:#000080; ">lazy bastard</Text></Message><Message Date="24/08/2004" Time="9:04:11 PM" DateTime="2004-08-24T11:04:11.294Z" SessionID="6"><From><User FriendlyName="emcee_draco@hotmail.com"/></From><To><User FriendlyName="James:^)"/></To><Text Style="font-family:Times New Roman; color:#000000; ">haha</Text></Message><Message Date="24/08/2004" Time="9:04:13 PM" DateTime="2004-08-24T11:04:13.167Z" SessionID="6"><From><User FriendlyName="emcee_draco@hotmail.com"/></From><To><User FriendlyName="James:^)"/></To><Text Style="font-family:Times New Roman; color:#000000; ">yep</Text></Message><Message Date="24/08/2004" Time="9:04:14 PM" DateTime="2004-08-24T11:04:14.338Z" SessionID="6"><From><User FriendlyName="James:^)"/></From><To><User FriendlyName="emcee_draco@hotmail.com"/></To><Text Style="font-family:Comic Sans MS; font-weight:bold; color:#000080; ">yeah im coming im coming</Text></Message><Message Date="24/08/2004" Time="9:04:33 PM" DateTime="2004-08-24T11:04:33.045Z" SessionID="7"><From><User FriendlyName="emcee_draco@hotmail.com"/></From><To><User FriendlyName="James:^)"/></To><Text Style="font-family:Times New Roman; color:#000000; ">come on</Text></Message><Message Date="24/08/2004" Time="9:04:36 PM" DateTime="2004-08-24T11:04:36.700Z" SessionID="7"><From><User FriendlyName="emcee_draco@hotmail.com"/></From><To><User FriendlyName="James:^)"/></To><Text Style="font-family:Times New Roman; color:#000000; ">hurry up</Text></Message><Message Date="24/08/2004" Time="9:04:38 PM" DateTime="2004-08-24T11:04:38.062Z" SessionID="7"><From><User FriendlyName="James:^)"/></From><To><User FriendlyName="emcee_draco@hotmail.com"/></To><Text Style="font-family:Comic Sans MS; font-weight:bold; color:#000080; ">....</Text></Message><Message Date="24/08/2004" Time="9:04:40 PM" DateTime="2004-08-24T11:04:40.396Z" SessionID="7"><From><User FriendlyName="James:^)"/></From><To><User FriendlyName="emcee_draco@hotmail.com"/></To><Text Style="font-family:Comic Sans MS; font-weight:bold; color:#000080; ">lol</Text></Message><Message Date="24/08/2004" Time="9:04:50 PM" DateTime="2004-08-24T11:04:50.861Z" SessionID="7"><From><User FriendlyName="emcee_draco@hotmail.com"/></From><To><User FriendlyName="James:^)"/></To><Text Style="font-family:Times New Roman; color:#000000; ">stop typing and come in</Text></Message><Message Date="24/08/2004" Time="9:04:51 PM" DateTime="2004-08-24T11:04:51.462Z" SessionID="7"><From><User FriendlyName="James:^)"/></From><To><User FriendlyName="emcee_draco@hotmail.com"/></To><Text Style="font-family:Comic Sans MS; font-weight:bold; color:#000080; ">im giving her all shes got captain!</Text></Message><Message Date="24/08/2004" Time="9:04:58 PM" DateTime="2004-08-24T11:04:58.331Z" SessionID="8"><From><User FriendlyName="emcee_draco@hotmail.com"/></From><To><User FriendlyName="James:^)"/></To><Text Style="font-family:Times New Roman; color:#000000; ">lol</Text></Message><Message Date="24/08/2004" Time="9:06:40 PM" DateTime="2004-08-24T11:06:40.578Z" SessionID="9"><From><User FriendlyName="emcee_draco@hotmail.com"/></From><To><User FriendlyName="James:^)"/></To><Text Style="font-family:Times New Roman; color:#000000; ">well.....</Text></Message><Message Date="24/08/2004" Time="9:06:45 PM" DateTime="2004-08-24T11:06:45.085Z" SessionID="9"><From><User FriendlyName="James:^)"/></From><To><User FriendlyName="emcee_draco@hotmail.com"/></To><Text Style="font-family:Comic Sans MS; font-weight:bold; color:#000080; ">just a sec</Text></Message><Message Date="24/08/2004" Time="9:06:47 PM" DateTime="2004-08-24T11:06:47.368Z" SessionID="9"><From><User FriendlyName="emcee_draco@hotmail.com"/></From><To><User FriendlyName="James:^)"/></To><Text Style="font-family:Times New Roman; color:#000000; ">what seems to be the problem</Text></Message><Message Date="24/08/2004" Time="9:06:49 PM" DateTime="2004-08-24T11:06:49.301Z" SessionID="9"><From><User FriendlyName="James:^)"/></From><To><User FriendlyName="emcee_draco@hotmail.com"/></To><Text Style="font-family:Comic Sans MS; font-weight:bold; color:#000080; ">hold ur horseeyss</Text></Message><Message Date="24/08/2004" Time="9:07:00 PM" DateTime="2004-08-24T11:07:00.918Z" SessionID="9"><From><User FriendlyName="James:^)"/></From><To><User FriendlyName="emcee_draco@hotmail.com"/></To><Text Style="font-family:Comic Sans MS; font-weight:bold; color:#000080; ">ahh</Text></Message><Message Date="24/08/2004" Time="9:07:02 PM" DateTime="2004-08-24T11:07:02.029Z" SessionID="9"><From><User FriendlyName="James:^)"/></From><To><User FriendlyName="emcee_draco@hotmail.com"/></To><Text Style="font-family:Comic Sans MS; font-weight:bold; color:#000080; ">got it</Text></Message><Message Date="24/08/2004" Time="9:07:04 PM" DateTime="2004-08-24T11:07:04.062Z" SessionID="9"><From><User FriendlyName="James:^)"/></From><To><User FriendlyName="emcee_draco@hotmail.com"/></To><Text Style="font-family:Comic Sans MS; font-weight:bold; color:#000080; ">comin</Text></Message><Message Date="24/08/2004" Time="9:07:07 PM" DateTime="2004-08-24T11:07:07.347Z" SessionID="9"><From><User FriendlyName="emcee_draco@hotmail.com"/></From><To><User FriendlyName="James:^)"/></To><Text Style="font-family:Times New Roman; color:#000000; ">ok </Text></Message><Message Date="24/08/2004" Time="9:07:15 PM" DateTime="2004-08-24T11:07:15.288Z" SessionID="9"><From><User FriendlyName="emcee_draco@hotmail.com"/></From><To><User FriendlyName="James:^)"/></To><Text Style="font-family:Times New Roman; color:#000000; ">ya gona copy it again</Text></Message><Message Date="27/08/2004" Time="8:37:40 PM" DateTime="2004-08-27T10:37:40.708Z" SessionID="10"><From><User FriendlyName="&quot;im sick of music thats so homogenous, yeah i've read the dictionary, sorry did that state the obvious?&quot;"/></From><To><User FriendlyName="James:^) Sweet Caroline.... BARM BARM BARMM!!!!!!!!!!!!"/></To><Text Style="font-family:Times New Roman; color:#000000; ">whats with ur new nickname bro</Text></Message><Message Date="27/08/2004" Time="8:37:41 PM" DateTime="2004-08-27T10:37:41.810Z" SessionID="10"><From><User FriendlyName="&quot;im sick of music thats so homogenous, yeah i've read the dictionary, sorry did that state the obvious?&quot;"/></From><To><User FriendlyName="James:^) Sweet Caroline.... BARM BARM BARMM!!!!!!!!!!!!"/></To><Text Style="font-family:Times New Roman; color:#000000; ">?</Text></Message><Message Date="27/08/2004" Time="8:37:49 PM" DateTime="2004-08-27T10:37:49.731Z" SessionID="10"><From><User FriendlyName="&quot;im sick of music thats so homogenous, yeah i've read the dictionary, sorry did that state the obvious?&quot;"/></From><To><User FriendlyName="James:^) Sweet Caroline.... BARM BARM BARMM!!!!!!!!!!!!"/></To><Text Style="font-family:Times New Roman; color:#000000; ">who is caroline</Text></Message><Message Date="27/08/2004" Time="8:37:52 PM" DateTime="2004-08-27T10:37:52.094Z" SessionID="10"><From><User FriendlyName="&quot;im sick of music thats so homogenous, yeah i've read the dictionary, sorry did that state the obvious?&quot;"/></From><To><User FriendlyName="James:^) Sweet Caroline.... BARM BARM BARMM!!!!!!!!!!!!"/></To><Text Style="font-family:Times New Roman; color:#000000; ">?</Text></Message><Message Date="27/08/2004" Time="8:38:26 PM" DateTime="2004-08-27T10:38:26.634Z" SessionID="10"><From><User FriendlyName="James:^) Sweet Caroline.... BARM BARM BARMM!!!!!!!!!!!!"/></From><To><User FriendlyName="&quot;im sick of music thats so homogenous, yeah i've read the dictionary, sorry did that state the obvious?&quot;"/></To><Text Style="font-family:Comic Sans MS; font-weight:bold; color:#000080; ">song</Text></Message><Message Date="27/08/2004" Time="8:38:44 PM" DateTime="2004-08-27T10:38:44.530Z" SessionID="10"><From><User FriendlyName="&quot;im sick of music thats so homogenous, yeah i've read the dictionary, sorry did that state the obvious?&quot;"/></From><To><User FriendlyName="James:^) Sweet Caroline.... BARM BARM BARMM!!!!!!!!!!!!"/></To><Text Style="font-family:Times New Roman; color:#000000; ">ok  </Text></Message><Message Date="27/08/2004" Time="8:38:45 PM" DateTime="2004-08-27T10:38:45.191Z" SessionID="10"><From><User FriendlyName="&quot;im sick of music thats so homogenous, yeah i've read the dictionary, sorry did that state the obvious?&quot;"/></From><To><User FriendlyName="James:^) Sweet Caroline.... BARM BARM BARMM!!!!!!!!!!!!"/></To><Text Style="font-family:Times New Roman; color:#000000; ">i see</Text></Message><Message Date="27/08/2004" Time="8:38:51 PM" DateTime="2004-08-27T10:38:51.530Z" SessionID="10"><From><User FriendlyName="James:^) Sweet Caroline.... BARM BARM BARMM!!!!!!!!!!!!"/></From><To><User FriendlyName="&quot;im sick of music thats so homogenous, yeah i've read the dictionary, sorry did that state the obvious?&quot;"/></To><Text Style="font-family:Comic Sans MS; font-weight:bold; color:#000080; ">oi</Text></Message><Message Date="27/08/2004" Time="8:38:58 PM" DateTime="2004-08-27T10:38:58.049Z" SessionID="10"><From><User FriendlyName="&quot;im sick of music thats so homogenous, yeah i've read the dictionary, sorry did that state the obvious?&quot;"/></From><To><User FriendlyName="James:^) Sweet Caroline.... BARM BARM BARMM!!!!!!!!!!!!"/></To><Text Style="font-family:Times New Roman; color:#000000; ">oi</Text></Message><Message Date="27/08/2004" Time="8:39:29 PM" DateTime="2004-08-27T10:39:29.955Z" SessionID="10"><From><User FriendlyName="James:^) Sweet Caroline.... BARM BARM BARMM!!!!!!!!!!!!"/></From><To><User FriendlyName="&quot;im sick of music thats so homogenous, yeah i've read the dictionary, sorry did that state the obvious?&quot;"/></To><Text Style="font-family:Comic Sans MS; font-weight:bold; color:#000080; ">check ur shared docs</Text></Message><Message Date="27/08/2004" Time="8:39:35 PM" DateTime="2004-08-27T10:39:35.573Z" SessionID="10"><From><User FriendlyName="&quot;im sick of music thats so homogenous, yeah i've read the dictionary, sorry did that state the obvious?&quot;"/></From><To><User FriendlyName="James:^) Sweet Caroline.... BARM BARM BARMM!!!!!!!!!!!!"/></To><Text Style="font-family:Times New Roman; color:#000000; ">why</Text></Message><Message Date="27/08/2004" Time="8:39:37 PM" DateTime="2004-08-27T10:39:37.987Z" SessionID="10"><From><User FriendlyName="James:^) Sweet Caroline.... BARM BARM BARMM!!!!!!!!!!!!"/></From><To><User FriendlyName="&quot;im sick of music thats so homogenous, yeah i've read the dictionary, sorry did that state the obvious?&quot;"/></To><Text Style="font-family:Comic Sans MS; font-weight:bold; color:#000080; ">its called tripod- Sweet caroline</Text></Message><Message Date="27/08/2004" Time="8:39:39 PM" DateTime="2004-08-27T10:39:39.769Z" SessionID="10"><From><User FriendlyName="&quot;im sick of music thats so homogenous, yeah i've read the dictionary, sorry did that state the obvious?&quot;"/></From><To><User FriendlyName="James:^) Sweet Caroline.... BARM BARM BARMM!!!!!!!!!!!!"/></To><Text Style="font-family:Times New Roman; color:#000000; ">????????????????????????????????????????????????????
</Text></Message><Message Date="27/08/2004" Time="8:39:46 PM" DateTime="2004-08-27T10:39:46.609Z" SessionID="10"><From><User FriendlyName="James:^) Sweet Caroline.... BARM BARM BARMM!!!!!!!!!!!!"/></From><To><User FriendlyName="&quot;im sick of music thats so homogenous, yeah i've read the dictionary, sorry did that state the obvious?&quot;"/></To><Text Style="font-family:Comic Sans MS; font-weight:bold; color:#000080; ">its the best song in the fargen world!</Text></Message><Message Date="27/08/2004" Time="8:39:57 PM" DateTime="2004-08-27T10:39:57.134Z" SessionID="11"><From><User FriendlyName="&quot;im sick of music thats so homogenous, yeah i've read the dictionary, sorry did that state the obvious?&quot;"/></From><To><User FriendlyName="James:^) Sweet Caroline.... BARM BARM BARMM!!!!!!!!!!!!"/></To><Text Style="font-family:Times New Roman; color:#000000; ">ok ill ave a look</Text></Message><Message Date="3/09/2004" Time="7:37:32 PM" DateTime="2004-09-03T09:37:32.933Z" SessionID="12"><From><User FriendlyName="&quot;im sick of music thats so homogenous, yeah i've read the dictionary, sorry did that state the obvious?&quot;"/></From><To><User FriendlyName="James 8-| Playing ET"/></To><Text Style="font-family:Times New Roman; color:#000000; ">hey blud can u get me a cuppa tea and  two choc mint bikkys pleeeeze!!!</Text></Message><Message Date="3/09/2004" Time="7:37:35 PM" DateTime="2004-09-03T09:37:35.016Z" SessionID="12"><From><User FriendlyName="&quot;im sick of music thats so homogenous, yeah i've read the dictionary, sorry did that state the obvious?&quot;"/></From><To><User FriendlyName="James 8-| Playing ET"/></To><Text Style="font-family:Times New Roman; color:#000000; ">lol</Text></Message><Message Date="3/09/2004" Time="7:37:40 PM" DateTime="2004-09-03T09:37:40.694Z" SessionID="12"><From><User FriendlyName="James 8-| Playing ET"/></From><To><User FriendlyName="&quot;im sick of music thats so homogenous, yeah i've read the dictionary, sorry did that state the obvious?&quot;"/></To><Text Style="font-family:Comic Sans MS; font-weight:bold; color:#000080; ">:P</Text></Message><Message Date="3/09/2004" Time="7:37:48 PM" DateTime="2004-09-03T09:37:48.836Z" SessionID="12"><From><User FriendlyName="James 8-| Playing ET"/></From><To><User FriendlyName="&quot;im sick of music thats so homogenous, yeah i've read the dictionary, sorry did that state the obvious?&quot;"/></To><Text Style="font-family:Comic Sans MS; font-weight:bold; color:#000080; ">gooooooood luck!</Text></Message><Message Date="3/09/2004" Time="7:37:56 PM" DateTime="2004-09-03T09:37:56.297Z" SessionID="13"><From><User FriendlyName="&quot;im sick of music thats so homogenous, yeah i've read the dictionary, sorry did that state the obvious?&quot;"/></From><To><User FriendlyName="James 8-| Playing ET"/></To><Text Style="font-family:Times New Roman; color:#000000; ">ohh come on</Text></Message><Message Date="3/09/2004" Time="7:38:00 PM" DateTime="2004-09-03T09:38:00.062Z" SessionID="13"><From><User FriendlyName="&quot;im sick of music thats so homogenous, yeah i've read the dictionary, sorry did that state the obvious?&quot;"/></From><To><User FriendlyName="James 8-| Playing ET"/></To><Text Style="font-family:Times New Roman; color:#000000; ">i do it fro u</Text></Message><Message Date="3/09/2004" Time="7:38:04 PM" DateTime="2004-09-03T09:38:04.779Z" SessionID="13"><From><User FriendlyName="&quot;im sick of music thats so homogenous, yeah i've read the dictionary, sorry did that state the obvious?&quot;"/></From><To><User FriendlyName="James 8-| Playing ET"/></To><Text Style="font-family:Times New Roman; color:#000000; ">*for</Text></Message><Message Date="3/09/2004" Time="7:40:22 PM" DateTime="2004-09-03T09:40:22.497Z" SessionID="14"><From><User FriendlyName="&quot;im sick of music thats so homogenous, yeah i've read the dictionary, sorry did that state the obvious?&quot;"/></From><To><User FriendlyName="James 8-|"/></To><Text Style="font-family:Times New Roman; color:#000000; ">pleeze bro</Text></Message><Message Date="3/09/2004" Time="7:40:29 PM" DateTime="2004-09-03T09:40:29.577Z" SessionID="14"><From><User FriendlyName="James 8-|"/></From><To><User FriendlyName="&quot;im sick of music thats so homogenous, yeah i've read the dictionary, sorry did that state the obvious?&quot;"/></To><Text Style="font-family:Comic Sans MS; font-weight:bold; color:#000080; ">in a few</Text></Message><Message Date="3/09/2004" Time="7:40:36 PM" DateTime="2004-09-03T09:40:36.317Z" SessionID="14"><From><User FriendlyName="&quot;im sick of music thats so homogenous, yeah i've read the dictionary, sorry did that state the obvious?&quot;"/></From><To><User FriendlyName="James 8-|"/></To><Text Style="font-family:Times New Roman; color:#000000; ">ok sweet</Text></Message><Message Date="3/09/2004" Time="7:40:38 PM" DateTime="2004-09-03T09:40:38.940Z" SessionID="14"><From><User FriendlyName="&quot;im sick of music thats so homogenous, yeah i've read the dictionary, sorry did that state the obvious?&quot;"/></From><To><User FriendlyName="James 8-|"/></To><Text Style="font-family:Times New Roman; color:#000000; ">no wukkas</Text></Message><Message Date="3/09/2004" Time="7:45:04 PM" DateTime="2004-09-03T09:45:04.793Z" SessionID="15"><From><User FriendlyName="James 8-|"/></From><To><User FriendlyName="&quot;im sick of music thats so homogenous, yeah i've read the dictionary, sorry did that state the obvious?&quot;"/></To><Text Style="font-family:Comic Sans MS; font-weight:bold; color:#000080; ">shoon u be at a partae</Text></Message><Message Date="3/09/2004" Time="7:45:15 PM" DateTime="2004-09-03T09:45:15.718Z" SessionID="15"><From><User FriendlyName="James 8-|"/></From><To><User FriendlyName="&quot;im sick of music thats so homogenous, yeah i've read the dictionary, sorry did that state the obvious?&quot;"/></To><Text Style="font-family:Comic Sans MS; font-weight:bold; color:#000080; ">because you have a speech inpediment</Text></Message><Message Date="3/09/2004" Time="7:45:22 PM" DateTime="2004-09-03T09:45:22.839Z" SessionID="15"><From><User FriendlyName="James 8-|"/></From><To><User FriendlyName="&quot;im sick of music thats so homogenous, yeah i've read the dictionary, sorry did that state the obvious?&quot;"/></To><Text Style="font-family:Comic Sans MS; font-weight:bold; color:#000080; ">lol</Text></Message><Message Date="3/09/2004" Time="7:45:33 PM" DateTime="2004-09-03T09:45:33.003Z" SessionID="15"><From><User FriendlyName="&quot;im sick of music thats so homogenous, yeah i've read the dictionary, sorry did that state the obvious?&quot;"/></From><To><User FriendlyName="James 8-|"/></To><Text Style="font-family:Times New Roman; color:#000000; ">im gonna go out at 8 30</Text></Message><Message Date="3/09/2004" Time="7:45:47 PM" DateTime="2004-09-03T09:45:47.114Z" SessionID="15"><From><User FriendlyName="&quot;im sick of music thats so homogenous, yeah i've read the dictionary, sorry did that state the obvious?&quot;"/></From><To><User FriendlyName="James 8-|"/></To><Text Style="font-family:Times New Roman; color:#000000; ">what?</Text></Message><Message Date="3/09/2004" Time="7:45:57 PM" DateTime="2004-09-03T09:45:57.108Z" SessionID="15"><From><User FriendlyName="James 8-|"/></From><To><User FriendlyName="&quot;im sick of music thats so homogenous, yeah i've read the dictionary, sorry did that state the obvious?&quot;"/></To><Text Style="font-family:Comic Sans MS; font-weight:bold; color:#000080; ">nvm</Text></Message><Message Date="3/09/2004" Time="7:46:12 PM" DateTime="2004-09-03T09:46:12.450Z" SessionID="16"><From><User FriendlyName="&quot;im sick of music thats so homogenous, yeah i've read the dictionary, sorry did that state the obvious?&quot;"/></From><To><User FriendlyName="James 8-|"/></To><Text Style="font-family:Times New Roman; color:#000000; ">because u fucked up ur typing u mean</Text></Message><Message Date="3/09/2004" Time="7:46:18 PM" DateTime="2004-09-03T09:46:18.008Z" SessionID="16"><From><User FriendlyName="James 8-|"/></From><To><User FriendlyName="&quot;im sick of music thats so homogenous, yeah i've read the dictionary, sorry did that state the obvious?&quot;"/></To><Text Style="font-family:Comic Sans MS; font-weight:bold; color:#000080; ">noo</Text></Message><Message Date="3/09/2004" Time="7:46:23 PM" DateTime="2004-09-03T09:46:23.075Z" SessionID="16"><From><User FriendlyName="&quot;im sick of music thats so homogenous, yeah i've read the dictionary, sorry did that state the obvious?&quot;"/></From><To><User FriendlyName="James 8-|"/></To><Text Style="font-family:Times New Roman; color:#000000; ">what do u meaan&gt;?</Text></Message><Message Date="3/09/2004" Time="7:46:23 PM" DateTime="2004-09-03T09:46:23.536Z" SessionID="16"><From><User FriendlyName="James 8-|"/></From><To><User FriendlyName="&quot;im sick of music thats so homogenous, yeah i've read the dictionary, sorry did that state the obvious?&quot;"/></To><Text Style="font-family:Comic Sans MS; font-weight:bold; color:#000080; ">u no how ppl try n be cool</Text></Message><Message Date="3/09/2004" Time="7:46:24 PM" DateTime="2004-09-03T09:46:24.878Z" SessionID="16"><From><User FriendlyName="James 8-|"/></From><To><User FriendlyName="&quot;im sick of music thats so homogenous, yeah i've read the dictionary, sorry did that state the obvious?&quot;"/></To><Text Style="font-family:Comic Sans MS; font-weight:bold; color:#000080; ">and say</Text></Message><Message Date="3/09/2004" Time="7:46:29 PM" DateTime="2004-09-03T09:46:29.244Z" SessionID="16"><From><User FriendlyName="James 8-|"/></From><To><User FriendlyName="&quot;im sick of music thats so homogenous, yeah i've read the dictionary, sorry did that state the obvious?&quot;"/></To><Text Style="font-family:Comic Sans MS; font-weight:bold; color:#000080; ">Im gooin 2 a partae</Text></Message><Message Date="3/09/2004" Time="7:46:37 PM" DateTime="2004-09-03T09:46:37.466Z" SessionID="16"><From><User FriendlyName="&quot;im sick of music thats so homogenous, yeah i've read the dictionary, sorry did that state the obvious?&quot;"/></From><To><User FriendlyName="James 8-|"/></To><Text Style="font-family:Times New Roman; color:#000000; ">ohh hahah</Text></Message><Message Date="3/09/2004" Time="7:46:40 PM" DateTime="2004-09-03T09:46:40.510Z" SessionID="16"><From><User FriendlyName="&quot;im sick of music thats so homogenous, yeah i've read the dictionary, sorry did that state the obvious?&quot;"/></From><To><User FriendlyName="James 8-|"/></To><Text Style="font-family:Times New Roman; color:#000000; ">yeah i got ya</Text></Message><Message Date="3/09/2004" Time="7:46:43 PM" DateTime="2004-09-03T09:46:43.114Z" SessionID="16"><From><User FriendlyName="James 8-|"/></From><To><User FriendlyName="&quot;im sick of music thats so homogenous, yeah i've read the dictionary, sorry did that state the obvious?&quot;"/></To><Text Style="font-family:Comic Sans MS; font-weight:bold; color:#000080; ">;)</Text></Message><Message Date="3/09/2004" Time="7:46:43 PM" DateTime="2004-09-03T09:46:43.855Z" SessionID="16"><From><User FriendlyName="James 8-|"/></From><To><User FriendlyName="&quot;im sick of music thats so homogenous, yeah i've read the dictionary, sorry did that state the obvious?&quot;"/></To><Text Style="font-family:Comic Sans MS; font-weight:bold; color:#000080; ">ok</Text></Message><Message Date="3/09/2004" Time="7:46:45 PM" DateTime="2004-09-03T09:46:45.147Z" SessionID="16"><From><User FriendlyName="James 8-|"/></From><To><User FriendlyName="&quot;im sick of music thats so homogenous, yeah i've read the dictionary, sorry did that state the obvious?&quot;"/></To><Text Style="font-family:Comic Sans MS; font-weight:bold; color:#000080; ">good</Text></Message><Message Date="6/09/2004" Time="8:22:36 PM" DateTime="2004-09-06T10:22:36.754Z" SessionID="17"><From><User FriendlyName="&quot;im sick of music thats so homogenous, yeah i've read the dictionary, sorry did that state the obvious?&quot;"/></From><To><User FriendlyName="(g)James 8-|"/></To><Text Style="font-family:Terminal; color:#000000; ">hows that tea commin?</Text></Message><Message Date="6/09/2004" Time="8:26:43 PM" DateTime="2004-09-06T10:26:43.859Z" SessionID="18"><From><User FriendlyName="&quot;im sick of music thats so homogenous, yeah i've read the dictionary, sorry did that state the obvious?&quot;"/></From><To><User FriendlyName="(g)James 8-|"/></To><Text Style="font-family:Terminal; color:#000000; ">ay bro.... tea time</Text></Message><Message Date="12/09/2004" Time="2:38:37 PM" DateTime="2004-09-12T04:38:37.727Z" SessionID="19"><From><User FriendlyName="&quot;im sick of music thats so homogenous, yeah i've read the dictionary, sorry did that state the obvious?&quot;"/></From><To><User FriendlyName="(f)James 8-| Bubble-Beard, The mighty Pirate"/></To><Text Style="font-family:Terminal; color:#000000; ">hey james</Text></Message><Message Date="12/09/2004" Time="2:38:50 PM" DateTime="2004-09-12T04:38:50.155Z" SessionID="19"><From><User FriendlyName="(f)James 8-| Bubble-Beard, The mighty Pirate"/></From><To><User FriendlyName="&quot;im sick of music thats so homogenous, yeah i've read the dictionary, sorry did that state the obvious?&quot;"/></To><Text Style="font-family:Comic Sans MS; font-weight:bold; color:#000080; ">aye</Text></Message><Message Date="12/09/2004" Time="2:39:04 PM" DateTime="2004-09-12T04:39:04.416Z" SessionID="19"><From><User FriendlyName="&quot;im sick of music thats so homogenous, yeah i've read the dictionary, sorry did that state the obvious?&quot;"/></From><To><User FriendlyName="(f)James 8-| Bubble-Beard, The mighty Pirate"/></To><Text Style="font-family:Terminal; color:#000000; ">if i put a track in shared docs...can u convert it to mp3 and send it back</Text></Message><Message Date="12/09/2004" Time="2:39:53 PM" DateTime="2004-09-12T04:39:53.596Z" SessionID="19"><From><User FriendlyName="(f)James 8-| Bubble-Beard, The mighty Pirate"/></From><To><User FriendlyName="&quot;im sick of music thats so homogenous, yeah i've read the dictionary, sorry did that state the obvious?&quot;"/></To><Text Style="font-family:Comic Sans MS; font-weight:bold; color:#000080; ">8-)</Text></Message><Message Date="12/09/2004" Time="2:39:54 PM" DateTime="2004-09-12T04:39:54.388Z" SessionID="19"><From><User FriendlyName="(f)James 8-| Bubble-Beard, The mighty Pirate"/></From><To><User FriendlyName="&quot;im sick of music thats so homogenous, yeah i've read the dictionary, sorry did that state the obvious?&quot;"/></To><Text Style="font-family:Comic Sans MS; font-weight:bold; color:#000080; ">yeah</Text></Message><Message Date="12/09/2004" Time="2:39:57 PM" DateTime="2004-09-12T04:39:57.091Z" SessionID="19"><From><User FriendlyName="(f)James 8-| Bubble-Beard, The mighty Pirate"/></From><To><User FriendlyName="&quot;im sick of music thats so homogenous, yeah i've read the dictionary, sorry did that state the obvious?&quot;"/></To><Text Style="font-family:Comic Sans MS; font-weight:bold; color:#000080; ">hurry up</Text></Message><Message Date="12/09/2004" Time="2:40:02 PM" DateTime="2004-09-12T04:40:02.489Z" SessionID="19"><From><User FriendlyName="&quot;im sick of music thats so homogenous, yeah i've read the dictionary, sorry did that state the obvious?&quot;"/></From><To><User FriendlyName="(f)James 8-| Bubble-Beard, The mighty Pirate"/></To><Text Style="font-family:Terminal; color:#000000; ">its called as</Text></Message><Message Date="12/09/2004" Time="2:40:07 PM" DateTime="2004-09-12T04:40:07.997Z" SessionID="19"><From><User FriendlyName="&quot;im sick of music thats so homogenous, yeah i've read the dictionary, sorry did that state the obvious?&quot;"/></From><To><User FriendlyName="(f)James 8-| Bubble-Beard, The mighty Pirate"/></To><Text Style="font-family:Terminal; color:#000000; ">*sad paino</Text></Message><Message Date="12/09/2004" Time="2:40:26 PM" DateTime="2004-09-12T04:40:26.233Z" SessionID="19"><From><User FriendlyName="(f)James 8-| Bubble-Beard, The mighty Pirate"/></From><To><User FriendlyName="&quot;im sick of music thats so homogenous, yeah i've read the dictionary, sorry did that state the obvious?&quot;"/></To><Text Style="font-family:Comic Sans MS; font-weight:bold; color:#000080; ">wma or mp3?</Text></Message><Message Date="12/09/2004" Time="2:40:33 PM" DateTime="2004-09-12T04:40:33.584Z" SessionID="19"><From><User FriendlyName="&quot;im sick of music thats so homogenous, yeah i've read the dictionary, sorry did that state the obvious?&quot;"/></From><To><User FriendlyName="(f)James 8-| Bubble-Beard, The mighty Pirate"/></To><Text Style="font-family:Terminal; color:#000000; ">mp3</Text></Message><Message Date="12/09/2004" Time="2:40:43 PM" DateTime="2004-09-12T04:40:43.168Z" SessionID="19"><From><User FriendlyName="(f)James 8-| Bubble-Beard, The mighty Pirate"/></From><To><User FriendlyName="&quot;im sick of music thats so homogenous, yeah i've read the dictionary, sorry did that state the obvious?&quot;"/></To><Text Style="font-family:Comic Sans MS; font-weight:bold; color:#000080; ">wma r smaller</Text></Message><Message Date="12/09/2004" Time="2:40:45 PM" DateTime="2004-09-12T04:40:45.181Z" SessionID="19"><From><User FriendlyName="&quot;im sick of music thats so homogenous, yeah i've read the dictionary, sorry did that state the obvious?&quot;"/></From><To><User FriendlyName="(f)James 8-| Bubble-Beard, The mighty Pirate"/></To><Text Style="font-family:Terminal; color:#000000; ">its there now</Text></Message><Message Date="12/09/2004" Time="2:41:00 PM" DateTime="2004-09-12T04:41:00.903Z" SessionID="19"><From><User FriendlyName="&quot;im sick of music thats so homogenous, yeah i've read the dictionary, sorry did that state the obvious?&quot;"/></From><To><User FriendlyName="(f)James 8-| Bubble-Beard, The mighty Pirate"/></To><Text Style="font-family:Terminal; color:#000000; ">well can most people dl wma</Text></Message><Message Date="12/09/2004" Time="2:41:02 PM" DateTime="2004-09-12T04:41:02.045Z" SessionID="19"><From><User FriendlyName="&quot;im sick of music thats so homogenous, yeah i've read the dictionary, sorry did that state the obvious?&quot;"/></From><To><User FriendlyName="(f)James 8-| Bubble-Beard, The mighty Pirate"/></To><Text Style="font-family:Terminal; color:#000000; ">?</Text></Message><Message Date="12/09/2004" Time="2:41:08 PM" DateTime="2004-09-12T04:41:08.394Z" SessionID="19"><From><User FriendlyName="(f)James 8-| Bubble-Beard, The mighty Pirate"/></From><To><User FriendlyName="&quot;im sick of music thats so homogenous, yeah i've read the dictionary, sorry did that state the obvious?&quot;"/></To><Text Style="font-family:Comic Sans MS; font-weight:bold; color:#000080; ">ah</Text></Message><Message Date="12/09/2004" Time="2:41:11 PM" DateTime="2004-09-12T04:41:11.979Z" SessionID="19"><From><User FriendlyName="(f)James 8-| Bubble-Beard, The mighty Pirate"/></From><To><User FriendlyName="&quot;im sick of music thats so homogenous, yeah i've read the dictionary, sorry did that state the obvious?&quot;"/></To><Text Style="font-family:Comic Sans MS; font-weight:bold; color:#000080; ">il just do mp3</Text></Message><Message Date="12/09/2004" Time="2:41:14 PM" DateTime="2004-09-12T04:41:14.423Z" SessionID="19"><From><User FriendlyName="(f)James 8-| Bubble-Beard, The mighty Pirate"/></From><To><User FriendlyName="&quot;im sick of music thats so homogenous, yeah i've read the dictionary, sorry did that state the obvious?&quot;"/></To><Text Style="font-family:Comic Sans MS; font-weight:bold; color:#000080; ">more common</Text></Message><Message Date="12/09/2004" Time="2:41:15 PM" DateTime="2004-09-12T04:41:15.574Z" SessionID="19"><From><User FriendlyName="&quot;im sick of music thats so homogenous, yeah i've read the dictionary, sorry did that state the obvious?&quot;"/></From><To><User FriendlyName="(f)James 8-| Bubble-Beard, The mighty Pirate"/></To><Text Style="font-family:Terminal; color:#000000; ">u have to have windows media</Text></Message><Message Date="12/09/2004" Time="2:41:20 PM" DateTime="2004-09-12T04:41:20.481Z" SessionID="19"><From><User FriendlyName="&quot;im sick of music thats so homogenous, yeah i've read the dictionary, sorry did that state the obvious?&quot;"/></From><To><User FriendlyName="(f)James 8-| Bubble-Beard, The mighty Pirate"/></To><Text Style="font-family:Terminal; color:#000000; ">dont ya</Text></Message><Message Date="12/09/2004" Time="2:41:29 PM" DateTime="2004-09-12T04:41:29.274Z" SessionID="19"><From><User FriendlyName="&quot;im sick of music thats so homogenous, yeah i've read the dictionary, sorry did that state the obvious?&quot;"/></From><To><User FriendlyName="(f)James 8-| Bubble-Beard, The mighty Pirate"/></To><Text Style="font-family:Terminal; color:#000000; ">ok thanks bro</Text></Message><Message Date="12/09/2004" Time="2:43:41 PM" DateTime="2004-09-12T04:43:41.795Z" SessionID="19"><From><User FriendlyName="(f)James 8-| Bubble-Beard, The mighty Pirate"/></From><To><User FriendlyName="&quot;im sick of music thats so homogenous, yeah i've read the dictionary, sorry did that state the obvious?&quot;"/></To><Text Style="font-family:Comic Sans MS; font-weight:bold; color:#000080; ">the filesize is 7.05 meg</Text></Message><Message Date="12/09/2004" Time="2:43:52 PM" DateTime="2004-09-12T04:43:52.129Z" SessionID="19"><From><User FriendlyName="&quot;im sick of music thats so homogenous, yeah i've read the dictionary, sorry did that state the obvious?&quot;"/></From><To><User FriendlyName="(f)James 8-| Bubble-Beard, The mighty Pirate"/></To><Text Style="font-family:Terminal; color:#000000; ">ko goodoh</Text></Message><Message Date="12/09/2004" Time="2:43:56 PM" DateTime="2004-09-12T04:43:56.896Z" SessionID="19"><From><User FriendlyName="(f)James 8-| Bubble-Beard, The mighty Pirate"/></From><To><User FriendlyName="&quot;im sick of music thats so homogenous, yeah i've read the dictionary, sorry did that state the obvious?&quot;"/></To><Text Style="font-family:Comic Sans MS; font-weight:bold; color:#000080; ">wats the minimin bitrate u can handle?</Text></Message><Message Date="12/09/2004" Time="2:44:07 PM" DateTime="2004-09-12T04:44:07.241Z" SessionID="19"><From><User FriendlyName="&quot;im sick of music thats so homogenous, yeah i've read the dictionary, sorry did that state the obvious?&quot;"/></From><To><User FriendlyName="(f)James 8-| Bubble-Beard, The mighty Pirate"/></To><Text Style="font-family:Terminal; color:#000000; ">did u resave it as a diff name</Text></Message><Message Date="12/09/2004" Time="2:44:17 PM" DateTime="2004-09-12T04:44:17.185Z" SessionID="19"><From><User FriendlyName="&quot;im sick of music thats so homogenous, yeah i've read the dictionary, sorry did that state the obvious?&quot;"/></From><To><User FriendlyName="(f)James 8-| Bubble-Beard, The mighty Pirate"/></To><Text Style="font-family:Terminal; color:#000000; ">dunno..</Text></Message><Message Date="12/09/2004" Time="2:44:25 PM" DateTime="2004-09-12T04:44:25.527Z" SessionID="19"><From><User FriendlyName="&quot;im sick of music thats so homogenous, yeah i've read the dictionary, sorry did that state the obvious?&quot;"/></From><To><User FriendlyName="(f)James 8-| Bubble-Beard, The mighty Pirate"/></To><Text Style="font-family:Terminal; color:#000000; ">it should be at leats 16 bit</Text></Message><Message Date="12/09/2004" Time="2:44:27 PM" DateTime="2004-09-12T04:44:27.640Z" SessionID="19"><From><User FriendlyName="(f)James 8-| Bubble-Beard, The mighty Pirate"/></From><To><User FriendlyName="&quot;im sick of music thats so homogenous, yeah i've read the dictionary, sorry did that state the obvious?&quot;"/></To><Text Style="font-family:Comic Sans MS; font-weight:bold; color:#000080; ">ill make it lower and see if ti sounds shit</Text></Message><Message Date="12/09/2004" Time="2:44:29 PM" DateTime="2004-09-12T04:44:29.323Z" SessionID="19"><From><User FriendlyName="&quot;im sick of music thats so homogenous, yeah i've read the dictionary, sorry did that state the obvious?&quot;"/></From><To><User FriendlyName="(f)James 8-| Bubble-Beard, The mighty Pirate"/></To><Text Style="font-family:Terminal; color:#000000; ">rsoe</Text></Message><Message Date="12/09/2004" Time="2:44:32 PM" DateTime="2004-09-12T04:44:32.257Z" SessionID="19"><From><User FriendlyName="&quot;im sick of music thats so homogenous, yeah i've read the dictionary, sorry did that state the obvious?&quot;"/></From><To><User FriendlyName="(f)James 8-| Bubble-Beard, The mighty Pirate"/></To><Text Style="font-family:Terminal; color:#000000; ">*reso</Text></Message><Message Date="12/09/2004" Time="2:48:14 PM" DateTime="2004-09-12T04:48:14.076Z" SessionID="20"><From><User FriendlyName="&quot;im sick of music thats so homogenous, yeah i've read the dictionary, sorry did that state the obvious?&quot;"/></From><To><User FriendlyName="(f)James 8-| Bubble-Beard, The mighty Pirate"/></To><Text Style="font-family:Terminal; color:#000000; ">u did it as wma</Text></Message><Message Date="12/09/2004" Time="2:48:32 PM" DateTime="2004-09-12T04:48:32.693Z" SessionID="21"><From><User FriendlyName="&quot;im sick of music thats so homogenous, yeah i've read the dictionary, sorry did that state the obvious?&quot;"/></From><To><User FriendlyName="(f)James 8-| Bubble-Beard, The mighty Pirate"/></To><Text Style="font-family:Terminal; color:#000000; ">i thort u was gonna do mp3</Text></Message><Message Date="12/09/2004" Time="2:49:10 PM" DateTime="2004-09-12T04:49:10.257Z" SessionID="21"><From><User FriendlyName="&quot;im sick of music thats so homogenous, yeah i've read the dictionary, sorry did that state the obvious?&quot;"/></From><To><User FriendlyName="(f)James 8-| Bubble-Beard, The mighty Pirate"/></To><Text Style="font-family:Terminal; color:#000000; ">oh well it shouldnt matter</Text></Message><Message Date="25/09/2004" Time="7:26:34 PM" DateTime="2004-09-25T09:26:34.000Z" SessionID="22"><From><User FriendlyName="&quot;The domesticated ape, celebrates pain in a vegetated state!&quot;"/></From><To><User FriendlyName="James*-)"/></To><Text Style="font-family:Terminal; color:#000000; ">can u make me a cuppa tea bommer....?</Text></Message><Message Date="25/09/2004" Time="7:26:39 PM" DateTime="2004-09-25T09:26:39.418Z" SessionID="22"><From><User FriendlyName="&quot;The domesticated ape, celebrates pain in a vegetated state!&quot;"/></From><To><User FriendlyName="James*-)"/></To><Text Style="font-family:Terminal; color:#000000; ">pleeze,</Text></Message><Message Date="25/09/2004" Time="7:26:43 PM" DateTime="2004-09-25T09:26:43.274Z" SessionID="22"><From><User FriendlyName="James*-)"/></From><To><User FriendlyName="&quot;The domesticated ape, celebrates pain in a vegetated state!&quot;"/></To><Text Style="font-family:Comic Sans MS; font-weight:bold; color:#000080; ">:)yell no :)</Text></Message><Message Date="25/09/2004" Time="7:26:53 PM" DateTime="2004-09-25T09:26:53.559Z" SessionID="23"><From><User FriendlyName="&quot;The domesticated ape, celebrates pain in a vegetated state!&quot;"/></From><To><User FriendlyName="James*-)"/></To><Text Style="font-family:Terminal; color:#000000; ">come on</Text></Message><Message Date="25/09/2004" Time="7:26:55 PM" DateTime="2004-09-25T09:26:55.782Z" SessionID="23"><From><User FriendlyName="&quot;The domesticated ape, celebrates pain in a vegetated state!&quot;"/></From><To><User FriendlyName="James*-)"/></To><Text Style="font-family:Terminal; color:#000000; ">do it</Text></Message><Message Date="25/09/2004" Time="7:27:03 PM" DateTime="2004-09-25T09:27:03.202Z" SessionID="23"><From><User FriendlyName="James*-)"/></From><To><User FriendlyName="&quot;The domesticated ape, celebrates pain in a vegetated state!&quot;"/></To><Text Style="font-family:Comic Sans MS; font-weight:bold; color:#000080; ">soon</Text></Message><Message Date="25/09/2004" Time="7:27:11 PM" DateTime="2004-09-25T09:27:11.905Z" SessionID="24"><From><User FriendlyName="&quot;The domesticated ape, celebrates pain in a vegetated state!&quot;"/></From><To><User FriendlyName="James*-)"/></To><Text Style="font-family:Terminal; color:#000000; ">ok sweet</Text></Message><Message Date="25/09/2004" Time="7:27:22 PM" DateTime="2004-09-25T09:27:22.730Z" SessionID="24"><From><User FriendlyName="&quot;The domesticated ape, celebrates pain in a vegetated state!&quot;"/></From><To><User FriendlyName="James*-)"/></To><Text Style="font-family:Terminal; color:#000000; ">can i have it in a little tea cup too</Text></Message><Message Date="25/09/2004" Time="7:27:25 PM" DateTime="2004-09-25T09:27:25.855Z" SessionID="24"><From><User FriendlyName="&quot;The domesticated ape, celebrates pain in a vegetated state!&quot;"/></From><To><User FriendlyName="James*-)"/></To><Text Style="font-family:Terminal; color:#000000; ">not a mug</Text></Message><Message Date="25/09/2004" Time="7:27:30 PM" DateTime="2004-09-25T09:27:30.482Z" SessionID="24"><From><User FriendlyName="James*-)"/></From><To><User FriendlyName="&quot;The domesticated ape, celebrates pain in a vegetated state!&quot;"/></To><Text Style="font-family:Comic Sans MS; font-weight:bold; color:#000080; ">8-)</Text></Message><Message Date="25/09/2004" Time="7:59:57 PM" DateTime="2004-09-25T09:59:57.321Z" SessionID="25"><From><User FriendlyName="&quot;The domesticated ape, celebrates pain in a vegetated state!&quot;"/></From><To><User FriendlyName="James*-)"/></To><Text Style="font-family:Terminal; color:#000000; ">Tea time</Text></Message><Message Date="25/09/2004" Time="8:00:05 PM" DateTime="2004-09-25T10:00:05.453Z" SessionID="25"><From><User FriendlyName="James*-)"/></From><To><User FriendlyName="&quot;The domesticated ape, celebrates pain in a vegetated state!&quot;"/></To><Text Style="font-family:Comic Sans MS; font-weight:bold; color:#000080; ">really</Text></Message><Message Date="25/09/2004" Time="8:00:08 PM" DateTime="2004-09-25T10:00:08.457Z" SessionID="25"><From><User FriendlyName="James*-)"/></From><To><User FriendlyName="&quot;The domesticated ape, celebrates pain in a vegetated state!&quot;"/></To><Text Style="font-family:Comic Sans MS; font-weight:bold; color:#000080; ">thanks dan</Text></Message><Message Date="25/09/2004" Time="8:00:17 PM" DateTime="2004-09-25T10:00:17.350Z" SessionID="25"><From><User FriendlyName="James*-)"/></From><To><User FriendlyName="&quot;The domesticated ape, celebrates pain in a vegetated state!&quot;"/></To><Text Style="font-family:Comic Sans MS; font-weight:bold; color:#000080; ">and can u grab us a bikky while ur up?</Text></Message><Message Date="25/09/2004" Time="8:00:20 PM" DateTime="2004-09-25T10:00:20.835Z" SessionID="25"><From><User FriendlyName="James*-)"/></From><To><User FriendlyName="&quot;The domesticated ape, celebrates pain in a vegetated state!&quot;"/></To><Text Style="font-family:Comic Sans MS; font-weight:bold; color:#000080; ">cmon ur closer</Text></Message><Message Date="25/09/2004" Time="8:00:21 PM" DateTime="2004-09-25T10:00:21.486Z" SessionID="26"><From><User FriendlyName="&quot;The domesticated ape, celebrates pain in a vegetated state!&quot;"/></From><To><User FriendlyName="James*-)"/></To><Text Style="font-family:Terminal; color:#000000; ">lol</Text></Message><Message Date="25/09/2004" Time="8:00:28 PM" DateTime="2004-09-25T10:00:28.806Z" SessionID="27"><From><User FriendlyName="&quot;The domesticated ape, celebrates pain in a vegetated state!&quot;"/></From><To><User FriendlyName="James*-)"/></To><Text Style="font-family:Terminal; color:#000000; ">nah ur closer</Text></Message><Message Date="25/09/2004" Time="8:00:36 PM" DateTime="2004-09-25T10:00:36.197Z" SessionID="27"><From><User FriendlyName="&quot;The domesticated ape, celebrates pain in a vegetated state!&quot;"/></From><To><User FriendlyName="James*-)"/></To><Text Style="font-family:Terminal; color:#000000; ">u can get there on weels</Text></Message><Message Date="25/09/2004" Time="8:00:57 PM" DateTime="2004-09-25T10:00:57.988Z" SessionID="27"><From><User FriendlyName="&quot;The domesticated ape, celebrates pain in a vegetated state!&quot;"/></From><To><User FriendlyName="James*-)"/></To><Text Style="font-family:Terminal; color:#000000; ">and bring it in to the tv room</Text></Message><Message Date="25/09/2004" Time="8:01:05 PM" DateTime="2004-09-25T10:01:05.639Z" SessionID="27"><From><User FriendlyName="&quot;The domesticated ape, celebrates pain in a vegetated state!&quot;"/></From><To><User FriendlyName="James*-)"/></To><Text Style="font-family:Terminal; color:#000000; ">im gonna resume starwars</Text></Message><Message Date="25/09/2004" Time="8:01:22 PM" DateTime="2004-09-25T10:01:22.363Z" SessionID="27"><From><User FriendlyName="James*-)"/></From><To><User FriendlyName="&quot;The domesticated ape, celebrates pain in a vegetated state!&quot;"/></To><Text Style="font-family:Comic Sans MS; font-weight:bold; color:#000080; ">lol</Text></Message><Message Date="25/09/2004" Time="8:01:45 PM" DateTime="2004-09-25T10:01:45.807Z" SessionID="28"><From><User FriendlyName="&quot;The domesticated ape, celebrates pain in a vegetated state!&quot;"/></From><To><User FriendlyName="James*-)"/></To><Text Style="font-family:Terminal; color:#000000; ">(b) cheers</Text></Message><Message Date="25/09/2004" Time="8:02:39 PM" DateTime="2004-09-25T10:02:39.504Z" SessionID="28"><From><User FriendlyName="James*-)"/></From><To><User FriendlyName="&quot;The domesticated ape, celebrates pain in a vegetated state!&quot;"/></To><Text Style="font-family:Comic Sans MS; font-weight:bold; color:#000080; ">uh</Text></Message><Message Date="25/09/2004" Time="8:02:40 PM" DateTime="2004-09-25T10:02:40.065Z" SessionID="28"><From><User FriendlyName="James*-)"/></From><To><User FriendlyName="&quot;The domesticated ape, celebrates pain in a vegetated state!&quot;"/></To><Text Style="font-family:Comic Sans MS; font-weight:bold; color:#000080; ">wat</Text></Message><Message Date="25/09/2004" Time="8:02:40 PM" DateTime="2004-09-25T10:02:40.706Z" SessionID="28"><From><User FriendlyName="James*-)"/></From><To><User FriendlyName="&quot;The domesticated ape, celebrates pain in a vegetated state!&quot;"/></To><Text Style="font-family:Comic Sans MS; font-weight:bold; color:#000080; ">no</Text></Message><Message Date="25/09/2004" Time="8:02:43 PM" DateTime="2004-09-25T10:02:43.009Z" SessionID="28"><From><User FriendlyName="James*-)"/></From><To><User FriendlyName="&quot;The domesticated ape, celebrates pain in a vegetated state!&quot;"/></To><Text Style="font-family:Comic Sans MS; font-weight:bold; color:#000080; ">u make me 1</Text></Message><Message Date="25/09/2004" Time="8:02:45 PM" DateTime="2004-09-25T10:02:45.583Z" SessionID="28"><From><User FriendlyName="James*-)"/></From><To><User FriendlyName="&quot;The domesticated ape, celebrates pain in a vegetated state!&quot;"/></To><Text Style="font-family:Comic Sans MS; font-weight:bold; color:#000080; ">ur due for it</Text></Message><Message Date="25/09/2004" Time="8:02:48 PM" DateTime="2004-09-25T10:02:48.127Z" SessionID="28"><From><User FriendlyName="&quot;The domesticated ape, celebrates pain in a vegetated state!&quot;"/></From><To><User FriendlyName="James*-)"/></To><Text Style="font-family:Terminal; color:#000000; ">nope</Text></Message><Message Date="25/09/2004" Time="8:02:48 PM" DateTime="2004-09-25T10:02:48.948Z" SessionID="28"><From><User FriendlyName="James*-)"/></From><To><User FriendlyName="&quot;The domesticated ape, celebrates pain in a vegetated state!&quot;"/></To><Text Style="font-family:Comic Sans MS; font-weight:bold; color:#000080; ">its ur turn</Text></Message><Message Date="25/09/2004" Time="8:02:51 PM" DateTime="2004-09-25T10:02:51.562Z" SessionID="28"><From><User FriendlyName="&quot;The domesticated ape, celebrates pain in a vegetated state!&quot;"/></From><To><User FriendlyName="James*-)"/></To><Text Style="font-family:Terminal; color:#000000; ">u said u wood</Text></Message><Message Date="25/09/2004" Time="8:02:54 PM" DateTime="2004-09-25T10:02:54.436Z" SessionID="28"><From><User FriendlyName="James*-)"/></From><To><User FriendlyName="&quot;The domesticated ape, celebrates pain in a vegetated state!&quot;"/></To><Text Style="font-family:Comic Sans MS; font-weight:bold; color:#000080; ">U gotta make me wun</Text></Message><Message Date="25/09/2004" Time="8:03:02 PM" DateTime="2004-09-25T10:03:02.477Z" SessionID="29"><From><User FriendlyName="&quot;The domesticated ape, celebrates pain in a vegetated state!&quot;"/></From><To><User FriendlyName="James*-)"/></To><Text Style="font-family:Terminal; color:#000000; ">nup</Text></Message><Message Date="25/09/2004" Time="8:03:11 PM" DateTime="2004-09-25T10:03:11.791Z" SessionID="29"><From><User FriendlyName="&quot;The domesticated ape, celebrates pain in a vegetated state!&quot;"/></From><To><User FriendlyName="James*-)"/></To><Text Style="font-family:Terminal; color:#000000; ">common, ur better at it</Text></Message><Message Date="25/09/2004" Time="8:03:21 PM" DateTime="2004-09-25T10:03:21.164Z" SessionID="29"><From><User FriendlyName="James*-)"/></From><To><User FriendlyName="&quot;The domesticated ape, celebrates pain in a vegetated state!&quot;"/></To><Text Style="font-family:Comic Sans MS; font-weight:bold; color:#000080; ">i sure am</Text></Message><Message Date="25/09/2004" Time="8:03:23 PM" DateTime="2004-09-25T10:03:23.768Z" SessionID="29"><From><User FriendlyName="James*-)"/></From><To><User FriendlyName="&quot;The domesticated ape, celebrates pain in a vegetated state!&quot;"/></To><Text Style="font-family:Comic Sans MS; font-weight:bold; color:#000080; ">but no</Text></Message><Message Date="25/09/2004" Time="8:03:31 PM" DateTime="2004-09-25T10:03:31.589Z" SessionID="30"><From><User FriendlyName="&quot;The domesticated ape, celebrates pain in a vegetated state!&quot;"/></From><To><User FriendlyName="James*-)"/></To><Text Style="font-family:Terminal; color:#000000; ">lol</Text></Message><Message Date="10/10/2004" Time="11:55:32 AM" DateTime="2004-10-10T01:55:32.249Z" SessionID="31"><From><User FriendlyName="James*-) The fewer things you try, the more things your good at :)"/></From><To><User FriendlyName="&quot;The domesticated ape, celebrates pain in a vegetated state!&quot;"/></To><Text Style="font-family:Comic Sans MS; font-weight:bold; color:#000080; ">wats the file called?</Text></Message><Message Date="10/10/2004" Time="11:55:53 AM" DateTime="2004-10-10T01:55:53.700Z" SessionID="32"><From><User FriendlyName="&quot;The domesticated ape, celebrates pain in a vegetated state!&quot;"/></From><To><User FriendlyName="James*-) The fewer things you try, the more things your good at :)"/></To><Text Style="font-family:Terminal; color:#000000; ">dreamtime orchestral.wav</Text></Message><Message Date="10/10/2004" Time="11:55:59 AM" DateTime="2004-10-10T01:55:59.618Z" SessionID="32"><From><User FriendlyName="&quot;The domesticated ape, celebrates pain in a vegetated state!&quot;"/></From><To><User FriendlyName="James*-) The fewer things you try, the more things your good at :)"/></To><Text Style="font-family:Terminal; color:#000000; ">it should be there now</Text></Message><Message Date="10/10/2004" Time="11:57:04 AM" DateTime="2004-10-10T01:57:04.722Z" SessionID="33"><From><User FriendlyName="&quot;The domesticated ape, celebrates pain in a vegetated state!&quot;"/></From><To><User FriendlyName="James*-) The fewer things you try, the more things your good at :)"/></To><Text Style="font-family:Terminal; color:#000000; ">u doin it yet</Text></Message><Message Date="10/10/2004" Time="11:57:04 AM" DateTime="2004-10-10T01:57:04.732Z" SessionID="33"><From><User FriendlyName="&quot;The domesticated ape, celebrates pain in a vegetated state!&quot;"/></From><To><User FriendlyName="James*-) The fewer things you try, the more things your good at :)"/></To><Text Style="font-family:Terminal; color:#000000; ">?</Text></Message><Message Date="10/10/2004" Time="11:57:10 AM" DateTime="2004-10-10T01:57:10.540Z" SessionID="33"><From><User FriendlyName="James*-) The fewer things you try, the more things your good at :)"/></From><To><User FriendlyName="&quot;The domesticated ape, celebrates pain in a vegetated state!&quot;"/></To><Text Style="font-family:Comic Sans MS; font-weight:bold; color:#000080; ">i cant see it</Text></Message><Message Date="10/10/2004" Time="11:57:15 AM" DateTime="2004-10-10T01:57:15.838Z" SessionID="33"><From><User FriendlyName="James*-) The fewer things you try, the more things your good at :)"/></From><To><User FriendlyName="&quot;The domesticated ape, celebrates pain in a vegetated state!&quot;"/></To><Text Style="font-family:Comic Sans MS; font-weight:bold; color:#000080; ">out it in ur shared documents</Text></Message><Message Date="10/10/2004" Time="11:57:19 AM" DateTime="2004-10-10T01:57:19.994Z" SessionID="33"><From><User FriendlyName="James*-) The fewer things you try, the more things your good at :)"/></From><To><User FriendlyName="&quot;The domesticated ape, celebrates pain in a vegetated state!&quot;"/></To><Text Style="font-family:Comic Sans MS; font-weight:bold; color:#000080; ">and in shared music</Text></Message><Message Date="10/10/2004" Time="11:58:20 AM" DateTime="2004-10-10T01:58:20.851Z" SessionID="34"><From><User FriendlyName="&quot;The domesticated ape, celebrates pain in a vegetated state!&quot;"/></From><To><User FriendlyName="James*-) The fewer things you try, the more things your good at :)"/></To><Text Style="font-family:Terminal; color:#000000; ">its there now</Text></Message><Message Date="10/10/2004" Time="11:58:21 AM" DateTime="2004-10-10T01:58:21.903Z" SessionID="34"><From><User FriendlyName="&quot;The domesticated ape, celebrates pain in a vegetated state!&quot;"/></From><To><User FriendlyName="James*-) The fewer things you try, the more things your good at :)"/></To><Text Style="font-family:Terminal; color:#000000; ">check it</Text></Message><Message Date="12/10/2004" Time="8:46:28 PM" DateTime="2004-10-12T10:46:28.082Z" SessionID="35"><From><User FriendlyName="James*-)I started a joke, which started the whole crying ... But I didnt see; That the joke was on me..."/></From><To><User FriendlyName="Unfold the fabric of the secret tribe, make music as i creep through the deep of night...."/></To><Text Style="font-family:Comic Sans MS; font-weight:bold; color:#000080; ">we are very sorry for the problems that MSN are having but they will be fixed. MSN will shut down at 12:00 tonight for a week or so until we can figure out what has been going on. please send this once again to at least 25 people it doesn't matter if they are the same people just do it so that we will not shut your account down thank you</Text></Message><Message Date="17/10/2004" Time="4:04:52 PM" DateTime="2004-10-17T06:04:52.432Z" SessionID="36"><From><User FriendlyName="Unfold the fabric of the secret tribe, make music as i creep through the deep of night...."/></From><To><User FriendlyName="James*-)Regardless of warnings the future doesn't scare me at all; NOTHINGS LIKE BEFORE"/></To><Text Style="font-family:Terminal; color:#000000; ">hey james</Text></Message><Message Date="17/10/2004" Time="4:04:58 PM" DateTime="2004-10-17T06:04:58.140Z" SessionID="36"><From><User FriendlyName="James*-)Regardless of warnings the future doesn't scare me at all; NOTHINGS LIKE BEFORE"/></From><To><User FriendlyName="Unfold the fabric of the secret tribe, make music as i creep through the deep of night...."/></To><Text Style="font-family:Comic Sans MS; font-weight:bold; color:#000080; ">???</Text></Message><Message Date="17/10/2004" Time="4:05:03 PM" DateTime="2004-10-17T06:05:03.247Z" SessionID="36"><From><User FriendlyName="Unfold the fabric of the secret tribe, make music as i creep through the deep of night...."/></From><To><User FriendlyName="James*-)Regardless of warnings the future doesn't scare me at all; NOTHINGS LIKE BEFORE"/></To><Text Style="font-family:Terminal; color:#000000; ">im just gonna out a song in shared docs</Text></Message><Message Date="17/10/2004" Time="4:05:10 PM" DateTime="2004-10-17T06:05:10.668Z" SessionID="36"><From><User FriendlyName="Unfold the fabric of the secret tribe, make music as i creep through the deep of night...."/></From><To><User FriendlyName="James*-)Regardless of warnings the future doesn't scare me at all; NOTHINGS LIKE BEFORE"/></To><Text Style="font-family:Terminal; color:#000000; ">can u make it an mp3</Text></Message><Message Date="17/10/2004" Time="4:05:13 PM" DateTime="2004-10-17T06:05:13.512Z" SessionID="36"><From><User FriendlyName="James*-)Regardless of warnings the future doesn't scare me at all; NOTHINGS LIKE BEFORE"/></From><To><User FriendlyName="Unfold the fabric of the secret tribe, make music as i creep through the deep of night...."/></To><Text Style="font-family:Comic Sans MS; font-weight:bold; color:#000080; ">8-)</Text></Message><Message Date="17/10/2004" Time="4:05:27 PM" DateTime="2004-10-17T06:05:27.081Z" SessionID="36"><From><User FriendlyName="James*-)Regardless of warnings the future doesn't scare me at all; NOTHINGS LIKE BEFORE"/></From><To><User FriendlyName="Unfold the fabric of the secret tribe, make music as i creep through the deep of night...."/></To><Text Style="font-family:Comic Sans MS; font-weight:bold; color:#000080; ">aye aye</Text></Message><Message Date="17/10/2004" Time="4:05:46 PM" DateTime="2004-10-17T06:05:46.610Z" SessionID="36"><From><User FriendlyName="James*-)Regardless of warnings the future doesn't scare me at all; NOTHINGS LIKE BEFORE"/></From><To><User FriendlyName="Unfold the fabric of the secret tribe, make music as i creep through the deep of night...."/></To><Text Style="font-family:Comic Sans MS; font-weight:bold; color:#000080; ">ready</Text></Message><Message Date="17/10/2004" Time="4:06:04 PM" DateTime="2004-10-17T06:06:04.816Z" SessionID="36"><From><User FriendlyName="James*-)Regardless of warnings the future doesn't scare me at all; NOTHINGS LIKE BEFORE"/></From><To><User FriendlyName="Unfold the fabric of the secret tribe, make music as i creep through the deep of night...."/></To><Text Style="font-family:Comic Sans MS; font-weight:bold; color:#000080; ">Wats it called?</Text></Message><Message Date="17/10/2004" Time="4:06:29 PM" DateTime="2004-10-17T06:06:29.251Z" SessionID="36"><From><User FriendlyName="Unfold the fabric of the secret tribe, make music as i creep through the deep of night...."/></From><To><User FriendlyName="James*-)Regardless of warnings the future doesn't scare me at all; NOTHINGS LIKE BEFORE"/></To><Text Style="font-family:Terminal; color:#000000; ">scotty's bassline track2</Text></Message><Message Date="17/10/2004" Time="4:07:05 PM" DateTime="2004-10-17T06:07:05.493Z" SessionID="36"><From><User FriendlyName="James*-)Regardless of warnings the future doesn't scare me at all; NOTHINGS LIKE BEFORE"/></From><To><User FriendlyName="Unfold the fabric of the secret tribe, make music as i creep through the deep of night...."/></To><Text Style="font-family:Comic Sans MS; font-weight:bold; color:#000080; ">ok its done</Text></Message><Message Date="17/10/2004" Time="4:07:17 PM" DateTime="2004-10-17T06:07:17.861Z" SessionID="37"><From><User FriendlyName="Unfold the fabric of the secret tribe, make music as i creep through the deep of night...."/></From><To><User FriendlyName="James*-)Regardless of warnings the future doesn't scare me at all; NOTHINGS LIKE BEFORE"/></To><Text Style="font-family:Terminal; color:#000000; ">kk thanks bro</Text></Message><Message Date="7/11/2004" Time="3:05:24 PM" DateTime="2004-11-07T04:05:24.008Z" SessionID="38"><From><User FriendlyName="Unfold the fabric of the secret tribe, make music as i creep through the deep of night...."/></From><To><User FriendlyName="James*-) I think therefore I am... I think."/></To><Text Style="font-family:Terminal; color:#000000; ">busted</Text></Message><Message Date="8/11/2004" Time="5:56:17 PM" DateTime="2004-11-08T06:56:17.591Z" SessionID="39"><From><User FriendlyName="Unfold the fabric of the secret tribe, make music as i creep through the deep of night...."/></From><To><User FriendlyName="James*-) I think therefore I am... I think."/></To><Text Style="font-family:Terminal; color:#000000; ">a big happy circle of friends is commin ur way!</Text></Message><Message Date="8/11/2004" Time="5:56:20 PM" DateTime="2004-11-08T06:56:20.235Z" SessionID="39"><From><User FriendlyName="Unfold the fabric of the secret tribe, make music as i creep through the deep of night...."/></From><To><User FriendlyName="James*-) I think therefore I am... I think."/></To><Text Style="font-family:Terminal; color:#000000; ">hahaha</Text></Message><Message Date="21/11/2004" Time="8:25:57 AM" DateTime="2004-11-20T21:25:57.162Z" SessionID="40"><From><User FriendlyName="leaps and bounds..."/></From><To><User FriendlyName="James*-)HALF LIFE 2 IS OUT!!!!!!!!!!!! :D"/></To><Text Style="font-family:Microsoft Sans Serif; color:#0000ff; ">haha now ya cant type</Text></Message><Message Date="21/11/2004" Time="8:26:02 AM" DateTime="2004-11-20T21:26:02.539Z" SessionID="40"><From><User FriendlyName="leaps and bounds..."/></From><To><User FriendlyName="James*-)HALF LIFE 2 IS OUT!!!!!!!!!!!! :D"/></To><Text Style="font-family:Microsoft Sans Serif; color:#0000ff; ">biatch</Text></Message><Message Date="21/11/2004" Time="8:26:15 AM" DateTime="2004-11-20T21:26:15.197Z" SessionID="40"><From><User FriendlyName="James*-)HALF LIFE 2 IS OUT!!!!!!!!!!!! :D"/></From><To><User FriendlyName="leaps and bounds..."/></To><Text Style="font-family:Comic Sans MS; font-weight:bold; color:#000080; ">^o)</Text></Message><Message Date="21/11/2004" Time="8:26:26 AM" DateTime="2004-11-20T21:26:26.684Z" SessionID="40"><From><User FriendlyName="leaps and bounds..."/></From><To><User FriendlyName="James*-)HALF LIFE 2 IS OUT!!!!!!!!!!!! :D"/></To><Text Style="font-family:Microsoft Sans Serif; color:#0000ff; ">8o|</Text></Message><Message Date="21/11/2004" Time="8:26:55 AM" DateTime="2004-11-20T21:26:55.866Z" SessionID="40"><From><User FriendlyName="James*-)HALF LIFE 2 IS OUT!!!!!!!!!!!! :D"/></From><To><User FriendlyName="leaps and bounds..."/></To><Text Style="font-family:Comic Sans MS; font-weight:bold; color:#000080; ">f1f2f3</Text></Message><Message Date="21/11/2004" Time="8:29:05 AM" DateTime="2004-11-20T21:29:05.382Z" SessionID="41"><From><User FriendlyName="leaps and bounds..."/></From><To><User FriendlyName="James*-)HALF LIFE 2 IS OUT!!!!!!!!!!!! :D"/></To><Text Style="font-family:Microsoft Sans Serif; color:#0000ff; ">:'(</Text></Message><Message Date="21/11/2004" Time="8:29:10 AM" DateTime="2004-11-20T21:29:10.169Z" SessionID="41"><From><User FriendlyName="leaps and bounds..."/></From><To><User FriendlyName="James*-)HALF LIFE 2 IS OUT!!!!!!!!!!!! :D"/></To><Text Style="font-family:Microsoft Sans Serif; color:#0000ff; ">:D</Text></Message><Message Date="21/11/2004" Time="8:29:21 AM" DateTime="2004-11-20T21:29:21.385Z" SessionID="41"><From><User FriendlyName="James*-)HALF LIFE 2 IS OUT!!!!!!!!!!!! :D"/></From><To><User FriendlyName="leaps and bounds..."/></To><Text Style="font-family:Comic Sans MS; font-weight:bold; color:#000080; ">disgust</Text></Message><InvitationResponse Date="21/11/2004" Time="8:29:32 AM" DateTime="2004-11-20T21:29:32.141Z" SessionID="41"><From><User FriendlyName="James*-)HALF LIFE 2 IS OUT!!!!!!!!!!!! :D"/></From><Application></Application><Text>James*-)HALF LIFE 2 IS OUT!!!!!!!!!!!! :D sent the wink "Kiss"</Text></InvitationResponse><Message Date="21/11/2004" Time="8:29:39 AM" DateTime="2004-11-20T21:29:39.321Z" SessionID="41"><From><User FriendlyName="leaps and bounds..."/></From><To><User FriendlyName="James*-)HALF LIFE 2 IS OUT!!!!!!!!!!!! :D"/></To><Text Style="font-family:Microsoft Sans Serif; color:#0000ff; ">maybe u shouldnt have stolen my keyboard then!! haha</Text></Message><Message Date="21/11/2004" Time="8:29:46 AM" DateTime="2004-11-20T21:29:46.962Z" SessionID="41"><From><User FriendlyName="leaps and bounds..."/></From><To><User FriendlyName="James*-)HALF LIFE 2 IS OUT!!!!!!!!!!!! :D"/></To><Text Style="font-family:Microsoft Sans Serif; color:#0000ff; ">now ur stuffed</Text></Message><Message Date="21/11/2004" Time="8:29:52 AM" DateTime="2004-11-20T21:29:52.670Z" SessionID="41"><From><User FriendlyName="James*-)HALF LIFE 2 IS OUT!!!!!!!!!!!! :D"/></From><To><User FriendlyName="leaps and bounds..."/></To><Text Style="font-family:Comic Sans MS; font-weight:bold; color:#000080; ">???</Text></Message><Message Date="21/11/2004" Time="8:30:12 AM" DateTime="2004-11-20T21:30:12.318Z" SessionID="41"><From><User FriendlyName="James*-)HALF LIFE 2 IS OUT!!!!!!!!!!!! :D"/></From><To><User FriendlyName="leaps and bounds..."/></To><Text Style="font-family:Comic Sans MS; font-weight:bold; color:#000080; ">what r u on about?</Text></Message><Message Date="21/11/2004" Time="8:30:34 AM" DateTime="2004-11-20T21:30:34.400Z" SessionID="41"><From><User FriendlyName="leaps and bounds..."/></From><To><User FriendlyName="James*-)HALF LIFE 2 IS OUT!!!!!!!!!!!! :D"/></To><Text Style="font-family:Microsoft Sans Serif; color:#0000ff; ">hey i hought u couldnt type</Text></Message><Message Date="21/11/2004" Time="8:30:52 AM" DateTime="2004-11-20T21:30:52.516Z" SessionID="41"><From><User FriendlyName="James*-)HALF LIFE 2 IS OUT!!!!!!!!!!!! :D"/></From><To><User FriendlyName="leaps and bounds..."/></To><Text Style="font-family:Comic Sans MS; font-weight:bold; color:#000080; ">hu sed i can</Text></Message><Message Date="21/11/2004" Time="8:30:57 AM" DateTime="2004-11-20T21:30:57.744Z" SessionID="41"><From><User FriendlyName="James*-)HALF LIFE 2 IS OUT!!!!!!!!!!!! :D"/></From><To><User FriendlyName="leaps and bounds..."/></To><Text Style="font-family:Comic Sans MS; font-weight:bold; color:#000080; ">fun1</Text></Message><Message Date="21/11/2004" Time="8:31:12 AM" DateTime="2004-11-20T21:31:12.004Z" SessionID="41"><From><User FriendlyName="leaps and bounds..."/></From><To><User FriendlyName="James*-)HALF LIFE 2 IS OUT!!!!!!!!!!!! :D"/></To><Text Style="font-family:Microsoft Sans Serif; color:#0000ff; ">this is u 8-|</Text></Message><Message Date="21/11/2004" Time="8:31:24 AM" DateTime="2004-11-20T21:31:24.282Z" SessionID="41"><From><User FriendlyName="leaps and bounds..."/></From><To><User FriendlyName="James*-)HALF LIFE 2 IS OUT!!!!!!!!!!!! :D"/></To><Text Style="font-family:Microsoft Sans Serif; color:#0000ff; ">NERD</Text></Message><Message Date="21/11/2004" Time="8:31:27 AM" DateTime="2004-11-20T21:31:27.006Z" SessionID="41"><From><User FriendlyName="leaps and bounds..."/></From><To><User FriendlyName="James*-)HALF LIFE 2 IS OUT!!!!!!!!!!!! :D"/></To><Text Style="font-family:Microsoft Sans Serif; color:#0000ff; ">lol</Text></Message><Message Date="21/11/2004" Time="8:31:33 AM" DateTime="2004-11-20T21:31:33.836Z" SessionID="41"><From><User FriendlyName="James*-)HALF LIFE 2 IS OUT!!!!!!!!!!!! :D"/></From><To><User FriendlyName="leaps and bounds..."/></To><Text Style="font-family:Comic Sans MS; font-weight:bold; color:#000080; ">8-)</Text></Message><Message Date="21/11/2004" Time="8:31:43 AM" DateTime="2004-11-20T21:31:43.740Z" SessionID="41"><From><User FriendlyName="James*-)HALF LIFE 2 IS OUT!!!!!!!!!!!! :D"/></From><To><User FriendlyName="leaps and bounds..."/></To><Text Style="font-family:Comic Sans MS; font-weight:bold; color:#000080; ">wow nice 1</Text></Message><Message Date="21/11/2004" Time="8:31:49 AM" DateTime="2004-11-20T21:31:49.508Z" SessionID="41"><From><User FriendlyName="James*-)HALF LIFE 2 IS OUT!!!!!!!!!!!! :D"/></From><To><User FriendlyName="leaps and bounds..."/></To><Text Style="font-family:Comic Sans MS; font-weight:bold; color:#000080; ">lol</Text></Message><Message Date="21/11/2004" Time="8:31:57 AM" DateTime="2004-11-20T21:31:57.920Z" SessionID="41"><From><User FriendlyName="James*-)HALF LIFE 2 IS OUT!!!!!!!!!!!! :D"/></From><To><User FriendlyName="leaps and bounds..."/></To><Text Style="font-family:Comic Sans MS; font-weight:bold; color:#000080; ">dumbass</Text></Message><Message Date="21/11/2004" Time="8:32:21 AM" DateTime="2004-11-20T21:32:21.164Z" SessionID="41"><From><User FriendlyName="James*-)HALF LIFE 2 IS OUT!!!!!!!!!!!! :D"/></From><To><User FriendlyName="leaps and bounds..."/></To><Text Style="font-family:Comic Sans MS; font-weight:bold; color:#000080; ">hitler</Text></Message><Message Date="24/12/2004" Time="10:44:37 AM" DateTime="2004-12-23T23:44:37.846Z" SessionID="42"><From><User FriendlyName="GEMS TONE PRODUCTIONS"/></From><To><User FriendlyName="James *-)"/></To><Text Style="font-family:Microsoft Sans Serif; color:#0000ff; ">yummy yellow ones!</Text></Message><Message Date="24/12/2004" Time="10:44:47 AM" DateTime="2004-12-23T23:44:47.199Z" SessionID="42"><From><User FriendlyName="GEMS TONE PRODUCTIONS"/></From><To><User FriendlyName="James *-)"/></To><Text Style="font-family:Microsoft Sans Serif; color:#0000ff; ">:D</Text></Message><Message Date="24/12/2004" Time="10:45:13 AM" DateTime="2004-12-23T23:45:13.157Z" SessionID="42"><From><User FriendlyName="James *-)"/></From><To><User FriendlyName="GEMS TONE PRODUCTIONS"/></To><Text Style="font-family:Comic Sans MS; font-weight:bold; color:#000080; ">Jila mints are better:P</Text></Message><Message Date="24/12/2004" Time="10:46:33 AM" DateTime="2004-12-23T23:46:33.562Z" SessionID="43"><From><User FriendlyName="GEMS TONE PRODUCTIONS"/></From><To><User FriendlyName="James *-)"/></To><Text Style="font-family:Microsoft Sans Serif; color:#0000ff; ">mums birfday chocolates are better</Text></Message><Message Date="24/12/2004" Time="10:46:35 AM" DateTime="2004-12-23T23:46:35.195Z" SessionID="43"><From><User FriendlyName="GEMS TONE PRODUCTIONS"/></From><To><User FriendlyName="James *-)"/></To><Text Style="font-family:Microsoft Sans Serif; color:#0000ff; ">lol</Text></Message><Message Date="27/12/2004" Time="7:02:46 PM" DateTime="2004-12-27T08:02:46.001Z" SessionID="44"><From><User FriendlyName="James *-)"/></From><To><User FriendlyName="GEMS TONE PRODUCTIONS"/></To><Text Style="font-family:Comic Sans MS; font-weight:bold; color:#000080; ">http://www.musicaviva.com/fsmd/list.tpl?category=irish</Text></Message><Message Date="30/12/2004" Time="12:39:03 PM" DateTime="2004-12-30T01:39:03.533Z" SessionID="45"><From><User FriendlyName="GEMS TONE PRODUCTIONS"/></From><To><User FriendlyName="(f)James *-) Why does singing someone elses music make you an idol?"/></To><Text Style="font-family:Microsoft Sans Serif; color:#0000ff; ">did u gobble up the pancake?</Text></Message><Message Date="3/01/2005" Time="11:12:58 AM" DateTime="2005-01-03T00:12:58.999Z" SessionID="46"><From><User FriendlyName="GEMS TONE PRODUCTIONS"/></From><To><User FriendlyName="(f)James *-) If there's anything more important than my ego around, I want it caught and shot now."/></To><Text Style="font-family:MS Sans Serif; color:#000000; ">hey</Text></Message><Message Date="3/01/2005" Time="11:13:14 AM" DateTime="2005-01-03T00:13:14.241Z" SessionID="46"><From><User FriendlyName="(f)James *-) If there's anything more important than my ego around, I want it caught and shot now."/></From><To><User FriendlyName="GEMS TONE PRODUCTIONS"/></To><Text Style="font-family:Comic Sans MS; font-weight:bold; color:#000080; ">Hay dan, Hows the "Burne"</Text></Message><Message Date="3/01/2005" Time="11:13:22 AM" DateTime="2005-01-03T00:13:22.843Z" SessionID="46"><From><User FriendlyName="GEMS TONE PRODUCTIONS"/></From><To><User FriendlyName="(f)James *-) If there's anything more important than my ego around, I want it caught and shot now."/></To><Text Style="font-family:MS Sans Serif; color:#000000; ">the burn!</Text></Message><Message Date="3/01/2005" Time="11:13:26 AM" DateTime="2005-01-03T00:13:26.418Z" SessionID="46"><From><User FriendlyName="GEMS TONE PRODUCTIONS"/></From><To><User FriendlyName="(f)James *-) If there's anything more important than my ego around, I want it caught and shot now."/></To><Text Style="font-family:MS Sans Serif; color:#000000; ">yeh mad</Text></Message><Message Date="3/01/2005" Time="11:13:50 AM" DateTime="2005-01-03T00:13:50.643Z" SessionID="46"><From><User FriendlyName="GEMS TONE PRODUCTIONS"/></From><To><User FriendlyName="(f)James *-) If there's anything more important than my ego around, I want it caught and shot now."/></To><Text Style="font-family:MS Sans Serif; color:#000000; ">just chillin out back at roseys place</Text></Message><Message Date="3/01/2005" Time="11:14:17 AM" DateTime="2005-01-03T00:14:17.141Z" SessionID="46"><From><User FriendlyName="GEMS TONE PRODUCTIONS"/></From><To><User FriendlyName="(f)James *-) If there's anything more important than my ego around, I want it caught and shot now."/></To><Text Style="font-family:MS Sans Serif; color:#000000; ">goin to have dinner at cathy and bills tonight im sure that will be lots of fun....NOT</Text></Message><Message Date="3/01/2005" Time="11:14:22 AM" DateTime="2005-01-03T00:14:22.929Z" SessionID="46"><From><User FriendlyName="(f)James *-) If there's anything more important than my ego around, I want it caught and shot now."/></From><To><User FriendlyName="GEMS TONE PRODUCTIONS"/></To><Text Style="font-family:Comic Sans MS; font-weight:bold; color:#000080; ">:)</Text></Message><Message Date="3/01/2005" Time="11:14:23 AM" DateTime="2005-01-03T00:14:23.891Z" SessionID="46"><From><User FriendlyName="GEMS TONE PRODUCTIONS"/></From><To><User FriendlyName="(f)James *-) If there's anything more important than my ego around, I want it caught and shot now."/></To><Text Style="font-family:MS Sans Serif; color:#000000; ">nah should be ok</Text></Message><Message Date="3/01/2005" Time="11:14:24 AM" DateTime="2005-01-03T00:14:24.201Z" SessionID="46"><From><User FriendlyName="(f)James *-) If there's anything more important than my ego around, I want it caught and shot now."/></From><To><User FriendlyName="GEMS TONE PRODUCTIONS"/></To><Text Style="font-family:Comic Sans MS; font-weight:bold; color:#000080; ">yippe</Text></Message><Message Date="3/01/2005" Time="11:14:29 AM" DateTime="2005-01-03T00:14:29.819Z" SessionID="46"><From><User FriendlyName="(f)James *-) If there's anything more important than my ego around, I want it caught and shot now."/></From><To><User FriendlyName="GEMS TONE PRODUCTIONS"/></To><Text Style="font-family:Comic Sans MS; font-weight:bold; color:#000080; ">hehe</Text></Message><Message Date="3/01/2005" Time="11:14:55 AM" DateTime="2005-01-03T00:14:55.416Z" SessionID="46"><From><User FriendlyName="GEMS TONE PRODUCTIONS"/></From><To><User FriendlyName="(f)James *-) If there's anything more important than my ego around, I want it caught and shot now."/></To><Text Style="font-family:MS Sans Serif; color:#000000; ">how are u guys goin without me</Text></Message><Message Date="3/01/2005" Time="11:15:08 AM" DateTime="2005-01-03T00:15:08.355Z" SessionID="46"><From><User FriendlyName="GEMS TONE PRODUCTIONS"/></From><To><User FriendlyName="(f)James *-) If there's anything more important than my ego around, I want it caught and shot now."/></To><Text Style="font-family:MS Sans Serif; color:#000000; ">missing me i spose</Text></Message><Message Date="3/01/2005" Time="11:16:04 AM" DateTime="2005-01-03T00:16:04.666Z" SessionID="46"><From><User FriendlyName="GEMS TONE PRODUCTIONS"/></From><To><User FriendlyName="(f)James *-) If there's anything more important than my ego around, I want it caught and shot now."/></To><Text Style="font-family:MS Sans Serif; color:#000000; ">ne way gotta jet</Text></Message><Message Date="3/01/2005" Time="11:16:08 AM" DateTime="2005-01-03T00:16:08.391Z" SessionID="46"><From><User FriendlyName="GEMS TONE PRODUCTIONS"/></From><To><User FriendlyName="(f)James *-) If there's anything more important than my ego around, I want it caught and shot now."/></To><Text Style="font-family:MS Sans Serif; color:#000000; ">cya bro</Text></Message><Message Date="3/03/2005" Time="4:27:35 PM" DateTime="2005-03-03T05:27:35.013Z" SessionID="47"><From><User FriendlyName="Danrock"/></From><To><User FriendlyName="James *-)"/></To><Text Style="font-family:Microsoft Sans Serif; color:#0000ff; ">james can u come and help me for just a tick... before i break my computer</Text></Message><Message Date="3/03/2005" Time="4:27:51 PM" DateTime="2005-03-03T05:27:51.227Z" SessionID="47"><From><User FriendlyName="James *-)"/></From><To><User FriendlyName="Danrock"/></To><Text Style="font-family:Comic Sans MS; font-weight:bold; color:#000080; ">...</Text></Message><Message Date="3/03/2005" Time="4:27:52 PM" DateTime="2005-03-03T05:27:52.859Z" SessionID="47"><From><User FriendlyName="Danrock"/></From><To><User FriendlyName="James *-)"/></To><Text Style="font-family:Microsoft Sans Serif; color:#0000ff; ">just wanna make a new fuckin hotmail account</Text></Message><Message Date="3/03/2005" Time="4:27:53 PM" DateTime="2005-03-03T05:27:53.069Z" SessionID="47"><From><User FriendlyName="James *-)"/></From><To><User FriendlyName="Danrock"/></To><Text Style="font-family:Comic Sans MS; font-weight:bold; color:#000080; ">wat</Text></Message><Message Date="3/03/2005" Time="4:27:59 PM" DateTime="2005-03-03T05:27:59.038Z" SessionID="47"><From><User FriendlyName="Danrock"/></From><To><User FriendlyName="James *-)"/></To><Text Style="font-family:Microsoft Sans Serif; color:#0000ff; ">and it wont let me</Text></Message><Message Date="3/03/2005" Time="4:28:05 PM" DateTime="2005-03-03T05:28:05.888Z" SessionID="47"><From><User FriendlyName="James *-)"/></From><To><User FriendlyName="Danrock"/></To><Text Style="font-family:Comic Sans MS; font-weight:bold; color:#000080; ">Do u have a GMAIL account?</Text></Message><Message Date="3/03/2005" Time="4:28:09 PM" DateTime="2005-03-03T05:28:09.773Z" SessionID="47"><From><User FriendlyName="Danrock"/></From><To><User FriendlyName="James *-)"/></To><Text Style="font-family:Microsoft Sans Serif; color:#0000ff; ">i dunno how to get to the fuckin page</Text></Message><Message Date="3/03/2005" Time="4:28:14 PM" DateTime="2005-03-03T05:28:14.290Z" SessionID="47"><From><User FriendlyName="Danrock"/></From><To><User FriendlyName="James *-)"/></To><Text Style="font-family:Microsoft Sans Serif; color:#0000ff; ">i dont want gmail</Text></Message><Message Date="3/03/2005" Time="4:28:18 PM" DateTime="2005-03-03T05:28:18.706Z" SessionID="47"><From><User FriendlyName="Danrock"/></From><To><User FriendlyName="James *-)"/></To><Text Style="font-family:Microsoft Sans Serif; color:#0000ff; ">yes i do tho</Text></Message><Message Date="3/03/2005" Time="4:28:22 PM" DateTime="2005-03-03T05:28:22.652Z" SessionID="47"><From><User FriendlyName="Danrock"/></From><To><User FriendlyName="James *-)"/></To><Text Style="font-family:Microsoft Sans Serif; color:#0000ff; ">its gay</Text></Message><Message Date="3/03/2005" Time="4:28:36 PM" DateTime="2005-03-03T05:28:36.922Z" SessionID="47"><From><User FriendlyName="Danrock"/></From><To><User FriendlyName="James *-)"/></To><Text Style="font-family:Microsoft Sans Serif; color:#0000ff; ">common.... pleeze</Text></Message><Message Date="3/03/2005" Time="4:28:37 PM" DateTime="2005-03-03T05:28:37.773Z" SessionID="47"><From><User FriendlyName="James *-)"/></From><To><User FriendlyName="Danrock"/></To><Text Style="font-family:Comic Sans MS; font-weight:bold; color:#000080; ">kk</Text></Message><Message Date="16/03/2005" Time="9:13:13 PM" DateTime="2005-03-16T10:13:13.882Z" SessionID="48"><From><User FriendlyName="James*-)Everyone is entlitled to James' Opinion"/></From><To><User FriendlyName="Danrock"/></To><Text Style="font-family:Comic Sans MS; font-weight:bold; color:#000080; ">How much did u print!</Text></Message><Message Date="16/03/2005" Time="9:13:25 PM" DateTime="2005-03-16T10:13:25.819Z" SessionID="48"><From><User FriendlyName="Danrock"/></From><To><User FriendlyName="James*-)Everyone is entlitled to James' Opinion"/></To><Text Style="font-family:Microsoft Sans Serif; color:#0000ff; ">um...</Text></Message><Message Date="16/03/2005" Time="9:13:28 PM" DateTime="2005-03-16T10:13:28.122Z" SessionID="48"><From><User FriendlyName="Danrock"/></From><To><User FriendlyName="James*-)Everyone is entlitled to James' Opinion"/></To><Text Style="font-family:Microsoft Sans Serif; color:#0000ff; ">few pages</Text></Message><Message Date="16/03/2005" Time="9:13:35 PM" DateTime="2005-03-16T10:13:35.843Z" SessionID="48"><From><User FriendlyName="James*-)Everyone is entlitled to James' Opinion"/></From><To><User FriendlyName="Danrock"/></To><Text Style="font-family:Comic Sans MS; font-weight:bold; color:#000080; ">ffs</Text></Message><Message Date="16/03/2005" Time="9:13:41 PM" DateTime="2005-03-16T10:13:41.061Z" SessionID="48"><From><User FriendlyName="James*-)Everyone is entlitled to James' Opinion"/></From><To><User FriendlyName="Danrock"/></To><Text Style="font-family:Comic Sans MS; font-weight:bold; color:#000080; ">dont print in paint!</Text></Message><Message Date="16/03/2005" Time="9:14:04 PM" DateTime="2005-03-16T10:14:04.014Z" SessionID="48"><From><User FriendlyName="James*-)Everyone is entlitled to James' Opinion"/></From><To><User FriendlyName="Danrock"/></To><Text Style="font-family:Comic Sans MS; font-weight:bold; color:#000080; ">hmm surely 8's enoguh</Text></Message><Message Date="16/03/2005" Time="9:14:09 PM" DateTime="2005-03-16T10:14:09.962Z" SessionID="48"><From><User FriendlyName="Danrock"/></From><To><User FriendlyName="James*-)Everyone is entlitled to James' Opinion"/></To><Text Style="font-family:Microsoft Sans Serif; color:#0000ff; ">haha</Text></Message><Message Date="16/03/2005" Time="9:14:14 PM" DateTime="2005-03-16T10:14:14.319Z" SessionID="48"><From><User FriendlyName="James*-)Everyone is entlitled to James' Opinion"/></From><To><User FriendlyName="Danrock"/></To><Text Style="font-family:Comic Sans MS; font-weight:bold; color:#000080; ">ohh on2 9!</Text></Message><Message Date="16/03/2005" Time="9:14:15 PM" DateTime="2005-03-16T10:14:15.410Z" SessionID="48"><From><User FriendlyName="Danrock"/></From><To><User FriendlyName="James*-)Everyone is entlitled to James' Opinion"/></To><Text Style="font-family:Microsoft Sans Serif; color:#0000ff; ">yeh paints good</Text></Message><Message Date="16/03/2005" Time="9:14:16 PM" DateTime="2005-03-16T10:14:16.402Z" SessionID="48"><From><User FriendlyName="Danrock"/></From><To><User FriendlyName="James*-)Everyone is entlitled to James' Opinion"/></To><Text Style="font-family:Microsoft Sans Serif; color:#0000ff; ">why not</Text></Message><Message Date="16/03/2005" Time="9:14:26 PM" DateTime="2005-03-16T10:14:26.226Z" SessionID="48"><From><User FriendlyName="James*-)Everyone is entlitled to James' Opinion"/></From><To><User FriendlyName="Danrock"/></To><Text Style="font-family:Comic Sans MS; font-weight:bold; color:#000080; ">BECAUSE ITS PRINTS IT ON 2 PAGES!</Text></Message><Message Date="21/03/2005" Time="8:49:51 PM" DateTime="2005-03-21T09:49:51.947Z" SessionID="49"><From><User FriendlyName="Danrock"/></From><To><User FriendlyName="James*-)"/></To><Text Style="font-family:Microsoft Sans Serif; color:#0000ff; ">james did my thing print??</Text></Message><Message Date="21/03/2005" Time="8:50:33 PM" DateTime="2005-03-21T09:50:33.417Z" SessionID="49"><From><User FriendlyName="James*-)"/></From><To><User FriendlyName="Danrock"/></To><Text Style="font-family:Comic Sans MS; font-weight:bold; color:#000080; ">nuh</Text></Message><Message Date="21/03/2005" Time="8:50:49 PM" DateTime="2005-03-21T09:50:49.650Z" SessionID="50"><From><User FriendlyName="Danrock"/></From><To><User FriendlyName="James*-)"/></To><Text Style="font-family:Microsoft Sans Serif; color:#0000ff; ">hmm</Text></Message><Message Date="21/03/2005" Time="8:53:40 PM" DateTime="2005-03-21T09:53:40.205Z" SessionID="51"><From><User FriendlyName="Danrock"/></From><To><User FriendlyName="James*-)"/></To><Text Style="font-family:Microsoft Sans Serif; color:#0000ff; ">is there paper?</Text></Message><Message Date="21/03/2005" Time="8:53:45 PM" DateTime="2005-03-21T09:53:45.333Z" SessionID="51"><From><User FriendlyName="Danrock"/></From><To><User FriendlyName="James*-)"/></To><Text Style="font-family:Microsoft Sans Serif; color:#0000ff; ">can u do it</Text></Message><Message Date="21/03/2005" Time="8:54:06 PM" DateTime="2005-03-21T09:54:06.063Z" SessionID="51"><From><User FriendlyName="James*-)"/></From><To><User FriendlyName="Danrock"/></To><Text Style="font-family:Comic Sans MS; font-weight:bold; color:#000080; ">theres paper</Text></Message><Message Date="7/04/2005" Time="6:40:51 PM" DateTime="2005-04-07T08:40:51.601Z" SessionID="52"><From><User FriendlyName="Danrock"/></From><To><User FriendlyName="James*-)&quot;When you have that many monkeys, anything is possible.&quot;"/></To><Text Style="font-family:MS Shell Dlg; color:#000000; ">hey james</Text></Message><Message Date="7/04/2005" Time="6:40:53 PM" DateTime="2005-04-07T08:40:53.113Z" SessionID="52"><From><User FriendlyName="Danrock"/></From><To><User FriendlyName="James*-)&quot;When you have that many monkeys, anything is possible.&quot;"/></To><Text Style="font-family:MS Shell Dlg; color:#000000; ">hah</Text></Message><Message Date="7/04/2005" Time="6:40:58 PM" DateTime="2005-04-07T08:40:58.501Z" SessionID="52"><From><User FriendlyName="James*-)&quot;When you have that many monkeys, anything is possible.&quot;"/></From><To><User FriendlyName="Danrock"/></To><Text Style="font-family:Comic Sans MS; font-weight:bold; color:#000080; ">???</Text></Message><Message Date="7/04/2005" Time="6:41:00 PM" DateTime="2005-04-07T08:41:00.714Z" SessionID="52"><From><User FriendlyName="Danrock"/></From><To><User FriendlyName="James*-)&quot;When you have that many monkeys, anything is possible.&quot;"/></To><Text Style="font-family:MS Shell Dlg; color:#000000; ">im in an internet cafe..</Text></Message><Message Date="7/04/2005" Time="6:41:01 PM" DateTime="2005-04-07T08:41:01.605Z" SessionID="52"><From><User FriendlyName="Danrock"/></From><To><User FriendlyName="James*-)&quot;When you have that many monkeys, anything is possible.&quot;"/></To><Text Style="font-family:MS Shell Dlg; color:#000000; ">lol</Text></Message><Message Date="7/04/2005" Time="6:41:07 PM" DateTime="2005-04-07T08:41:07.915Z" SessionID="52"><From><User FriendlyName="James*-)&quot;When you have that many monkeys, anything is possible.&quot;"/></From><To><User FriendlyName="Danrock"/></To><Text Style="font-family:Comic Sans MS; font-weight:bold; color:#000080; ">8-|</Text></Message><Message Date="7/04/2005" Time="6:41:14 PM" DateTime="2005-04-07T08:41:14.444Z" SessionID="52"><From><User FriendlyName="Danrock"/></From><To><User FriendlyName="James*-)&quot;When you have that many monkeys, anything is possible.&quot;"/></To><Text Style="font-family:MS Shell Dlg; color:#000000; ">yup</Text></Message><Message Date="7/04/2005" Time="6:41:17 PM" DateTime="2005-04-07T08:41:17.719Z" SessionID="52"><From><User FriendlyName="Danrock"/></From><To><User FriendlyName="James*-)&quot;When you have that many monkeys, anything is possible.&quot;"/></To><Text Style="font-family:MS Shell Dlg; color:#000000; ">nerding it up</Text></Message><Message Date="7/04/2005" Time="6:41:25 PM" DateTime="2005-04-07T08:41:25.610Z" SessionID="52"><From><User FriendlyName="James*-)&quot;When you have that many monkeys, anything is possible.&quot;"/></From><To><User FriendlyName="Danrock"/></To><Text Style="font-family:Comic Sans MS; font-weight:bold; color:#000080; ">Wat u doing?</Text></Message><Message Dat