<?xml version="1.0"?>
<?xml-stylesheet type='text/xsl' href='MessageLog.xsl'?>
<Log FirstSessionID="1" LastSessionID="681"><Invitation Date="31/10/2004" Time="12:45:52 PM" DateTime="2004-10-31T01:45:52.766Z" SessionID="1"><From><User FriendlyName="*HeAtH* Dont be a fool, Rap your tool"/></From><Application>an audio conversation</Application><Text Style="color:#545454; ">*HeAtH* Dont be a fool, Rap your tool is inviting you to start an audio conversation. Do you want to Accept (Alt+C) or Decline (Alt+D) the invitation?</Text></Invitation><Message Date="31/10/2004" Time="12:45:52 PM" DateTime="2004-10-31T01:45:52.836Z" SessionID="1"><From><User FriendlyName="*HeAtH* Dont be a fool, Rap your tool"/></From><To><User FriendlyName="James*-) 17 Days To Half Life 2 :D"/></To><Text Style="font-family:Arial; font-weight:bold; color:#000000; ">wana go on vent?</Text></Message><Message Date="31/10/2004" Time="12:46:44 PM" DateTime="2004-10-31T01:46:44.621Z" SessionID="1"><From><User FriendlyName="*HeAtH* Dont be a fool, Rap your tool"/></From><To><User FriendlyName="James*-) 17 Days To Half Life 2 :D"/></To><Text Style="font-family:Arial; font-weight:bold; color:#000000; ">james ffs</Text></Message><Message Date="31/10/2004" Time="12:47:05 PM" DateTime="2004-10-31T01:47:05.781Z" SessionID="1"><From><User FriendlyName="*HeAtH* Dont be a fool, Rap your tool"/></From><To><User FriendlyName="James*-) 17 Days To Half Life 2 :D"/></To><Text Style="font-family:Arial; font-weight:bold; color:#000000; ">fuck u then</Text></Message><InvitationResponse Date="31/10/2004" Time="12:47:06 PM" DateTime="2004-10-31T01:47:06.482Z" SessionID="1"><From><User FriendlyName="*HeAtH* Dont be a fool, Rap your tool"/></From><Application>an audio conversation</Application><Text Style="color:#800000; ">*HeAtH* Dont be a fool, Rap your tool has canceled the invitation to start an audio conversation.</Text></InvitationResponse><Message Date="31/10/2004" Time="12:51:54 PM" DateTime="2004-10-31T01:51:54.196Z" SessionID="1"><From><User FriendlyName="*HeAtH* Dont be a fool, Rap your tool"/></From><To><User FriendlyName="James*-) 17 Days To Half Life 2 :D"/></To><Text Style="font-family:Arial; font-weight:bold; color:#000000; ">omg james</Text></Message><Message Date="31/10/2004" Time="12:54:17 PM" DateTime="2004-10-31T01:54:17.762Z" SessionID="1"><From><User FriendlyName="James*-) 17 Days To Half Life 2 :D"/></From><To><User FriendlyName="*HeAtH* Dont be a fool, Rap your tool"/></To><Text Style="font-family:Comic Sans MS; font-weight:bold; color:#000080; ">wat</Text></Message><Message Date="31/10/2004" Time="12:54:30 PM" DateTime="2004-10-31T01:54:30.120Z" SessionID="1"><From><User FriendlyName="James*-) 17 Days To Half Life 2 :D"/></From><To><User FriendlyName="*HeAtH* Dont be a fool, Rap your tool"/></To><Text Style="font-family:Comic Sans MS; font-weight:bold; color:#000080; ">:P</Text></Message><Message Date="31/10/2004" Time="12:54:37 PM" DateTime="2004-10-31T01:54:37.260Z" SessionID="1"><From><User FriendlyName="James*-) 17 Days To Half Life 2 :D"/></From><To><User FriendlyName="*HeAtH* Dont be a fool, Rap your tool"/></To><Text Style="font-family:Comic Sans MS; font-weight:bold; color:#000080; ">When ur not away</Text></Message><Message Date="31/10/2004" Time="12:54:50 PM" DateTime="2004-10-31T01:54:50.019Z" SessionID="1"><From><User FriendlyName="James*-) 17 Days To Half Life 2 :D"/></From><To><User FriendlyName="*HeAtH* Dont be a fool, Rap your tool"/></To><Text Style="font-family:Comic Sans MS; font-weight:bold; color:#000080; ">Can u tel us if ur pool is still diseased?</Text></Message><Message Date="31/10/2004" Time="12:59:21 PM" DateTime="2004-10-31T01:59:21.629Z" SessionID="2"><From><User FriendlyName="*HeAtH* Dont be a fool, Rap your tool"/></From><To><User FriendlyName="James*-) 17 Days To Half Life 2 :D"/></To><Text Style="font-family:Arial; font-weight:bold; color:#000000; ">back</Text></Message><Message Date="31/10/2004" Time="12:59:29 PM" DateTime="2004-10-31T01:59:29.621Z" SessionID="2"><From><User FriendlyName="*HeAtH* Dont be a fool, Rap your tool"/></From><To><User FriendlyName="James*-) 17 Days To Half Life 2 :D"/></To><Text Style="font-family:Arial; font-weight:bold; color:#000000; ">ill go look my dads been fixin it \</Text></Message><Message Date="31/10/2004" Time="12:59:31 PM" DateTime="2004-10-31T01:59:31.613Z" SessionID="2"><From><User FriendlyName="James*-) 17 Days To Half Life 2 :D"/></From><To><User FriendlyName="*HeAtH* Dont be a fool, Rap your tool"/></To><Text Style="font-family:Comic Sans MS; font-weight:bold; color:#000080; ">Is ur pool still infested</Text></Message><Invitation Date="31/10/2004" Time="12:59:56 PM" DateTime="2004-10-31T01:59:56.900Z" SessionID="2"><From><User FriendlyName="*HeAtH* Dont be a fool, Rap your tool"/></From><Application>an audio conversation</Application><Text Style="color:#545454; ">*HeAtH* Dont be a fool, Rap your tool is inviting you to start an audio conversation. Do you want to Accept (Alt+C) or Decline (Alt+D) the invitation?</Text></Invitation><InvitationResponse Date="31/10/2004" Time="12:59:59 PM" DateTime="2004-10-31T01:59:59.844Z" SessionID="2"><From><User FriendlyName="*HeAtH* Dont be a fool, Rap your tool"/></From><Application>an audio conversation</Application><Text Style="color:#545454; ">You have accepted the invitation to start an audio conversation.</Text></InvitationResponse><Message Date="31/10/2004" Time="1:00:29 PM" DateTime="2004-10-31T02:00:29.266Z" SessionID="2"><From><User FriendlyName="James*-) 17 Days To Half Life 2 :D"/></From><To><User FriendlyName="*HeAtH* Dont be a fool, Rap your tool"/></To><Text Style="font-family:Comic Sans MS; font-weight:bold; color:#000080; ">ffffs</Text></Message><Message Date="31/10/2004" Time="1:00:33 PM" DateTime="2004-10-31T02:00:33.012Z" SessionID="2"><From><User FriendlyName="James*-) 17 Days To Half Life 2 :D"/></From><To><User FriendlyName="*HeAtH* Dont be a fool, Rap your tool"/></To><Text Style="font-family:Comic Sans MS; font-weight:bold; color:#000080; ">CA</Text></Message><Message Date="31/10/2004" Time="9:46:08 PM" DateTime="2004-10-31T10:46:08.448Z" SessionID="3"><From><User FriendlyName="James*-) 16 Days To Half Life 2 :D"/></From><To><User FriendlyName="*HeAtH* Dont be a fool, Rap your tool"/></To><Text Style="font-family:Comic Sans MS; font-weight:bold; color:#000080; ">Hey u there?</Text></Message><Message Date="31/10/2004" Time="9:46:22 PM" DateTime="2004-10-31T10:46:22.598Z" SessionID="3"><From><User FriendlyName="James*-) 16 Days To Half Life 2 :D"/></From><To><User FriendlyName="*HeAtH* Dont be a fool, Rap your tool"/></To><Text Style="font-family:Comic Sans MS; font-weight:bold; color:#000080; ">Or r u in game</Text></Message><Message Date="31/10/2004" Time="9:46:31 PM" DateTime="2004-10-31T10:46:31.280Z" SessionID="3"><From><User FriendlyName="*HeAtH* Dont be a fool, Rap your tool"/></From><To><User FriendlyName="James*-) 16 Days To Half Life 2 :D"/></To><Text Style="font-family:Arial; font-weight:bold; color:#000000; ">im on ihug</Text></Message><Message Date="31/10/2004" Time="9:46:35 PM" DateTime="2004-10-31T10:46:35.326Z" SessionID="3"><From><User FriendlyName="James*-) 16 Days To Half Life 2 :D"/></From><To><User FriendlyName="*HeAtH* Dont be a fool, Rap your tool"/></To><Text Style="font-family:Comic Sans MS; font-weight:bold; color:#000080; ">ohh</Text></Message><Message Date="31/10/2004" Time="9:46:37 PM" DateTime="2004-10-31T10:46:37.029Z" SessionID="3"><From><User FriendlyName="James*-) 16 Days To Half Life 2 :D"/></From><To><User FriendlyName="*HeAtH* Dont be a fool, Rap your tool"/></To><Text Style="font-family:Comic Sans MS; font-weight:bold; color:#000080; ">shit</Text></Message><Message Date="31/10/2004" Time="9:46:42 PM" DateTime="2004-10-31T10:46:42.667Z" SessionID="3"><From><User FriendlyName="James*-) 16 Days To Half Life 2 :D"/></From><To><User FriendlyName="*HeAtH* Dont be a fool, Rap your tool"/></To><Text Style="font-family:Comic Sans MS; font-weight:bold; color:#000080; ">Nvm then</Text></Message><Message Date="31/10/2004" Time="9:46:43 PM" DateTime="2004-10-31T10:46:43.798Z" SessionID="3"><From><User FriendlyName="James*-) 16 Days To Half Life 2 :D"/></From><To><User FriendlyName="*HeAtH* Dont be a fool, Rap your tool"/></To><Text Style="font-family:Comic Sans MS; font-weight:bold; color:#000080; ">Cya 2moz</Text></Message><Message Date="31/10/2004" Time="9:48:46 PM" DateTime="2004-10-31T10:48:46.665Z" SessionID="4"><From><User FriendlyName="*HeAtH* Dont be a fool, Rap your tool"/></From><To><User FriendlyName="James*-) 16 Days To Half Life 2 :D"/></To><Text Style="font-family:Arial; font-weight:bold; color:#000000; ">ok im here</Text></Message><Message Date="31/10/2004" Time="9:48:57 PM" DateTime="2004-10-31T10:48:57.601Z" SessionID="4"><From><User FriendlyName="*HeAtH* Dont be a fool, Rap your tool"/></From><To><User FriendlyName="James*-) 16 Days To Half Life 2 :D"/></To><Text Style="font-family:Arial; font-weight:bold; color:#000000; ">wat u want</Text></Message><Message Date="31/10/2004" Time="9:49:12 PM" DateTime="2004-10-31T10:49:12.793Z" SessionID="4"><From><User FriendlyName="*HeAtH* Dont be a fool, Rap your tool"/></From><To><User FriendlyName="James*-) 16 Days To Half Life 2 :D"/></To><Text Style="font-family:Arial; font-weight:bold; color:#000000; ">???</Text></Message><Message Date="31/10/2004" Time="9:49:57 PM" DateTime="2004-10-31T10:49:57.767Z" SessionID="4"><From><User FriendlyName="*HeAtH* Dont be a fool, Rap your tool"/></From><To><User FriendlyName="James*-) 16 Days To Half Life 2 :D"/></To><Text Style="font-family:Arial; font-weight:bold; color:#000000; ">james</Text></Message><Message Date="31/10/2004" Time="9:50:52 PM" DateTime="2004-10-31T10:50:52.486Z" SessionID="4"><From><User FriendlyName="James*-) 16 Days To Half Life 2 :D"/></From><To><User FriendlyName="*HeAtH* Dont be a fool, Rap your tool"/></To><Text Style="font-family:Comic Sans MS; font-weight:bold; color:#000080; ">aye</Text></Message><Message Date="31/10/2004" Time="9:51:03 PM" DateTime="2004-10-31T10:51:03.812Z" SessionID="4"><From><User FriendlyName="James*-) 16 Days To Half Life 2 :D"/></From><To><User FriendlyName="*HeAtH* Dont be a fool, Rap your tool"/></To><Text Style="font-family:Comic Sans MS; font-weight:bold; color:#000080; ">soz was getting sum food</Text></Message><Message Date="31/10/2004" Time="9:51:08 PM" DateTime="2004-10-31T10:51:08.088Z" SessionID="4"><From><User FriendlyName="*HeAtH* Dont be a fool, Rap your tool"/></From><To><User FriendlyName="James*-) 16 Days To Half Life 2 :D"/></To><Text Style="font-family:Arial; font-weight:bold; color:#000000; ">ok</Text></Message><Message Date="31/10/2004" Time="9:51:18 PM" DateTime="2004-10-31T10:51:18.964Z" SessionID="4"><From><User FriendlyName="James*-) 16 Days To Half Life 2 :D"/></From><To><User FriendlyName="*HeAtH* Dont be a fool, Rap your tool"/></To><Text Style="font-family:Comic Sans MS; font-weight:bold; color:#000080; ">vent</Text></Message><Message Date="31/10/2004" Time="9:51:23 PM" DateTime="2004-10-31T10:51:23.521Z" SessionID="4"><From><User FriendlyName="James*-) 16 Days To Half Life 2 :D"/></From><To><User FriendlyName="*HeAtH* Dont be a fool, Rap your tool"/></To><Text Style="font-family:Comic Sans MS; font-weight:bold; color:#000080; ">gamestar</Text></Message><Message Date="31/10/2004" Time="9:51:33 PM" DateTime="2004-10-31T10:51:33.946Z" SessionID="4"><From><User FriendlyName="James*-) 16 Days To Half Life 2 :D"/></From><To><User FriendlyName="*HeAtH* Dont be a fool, Rap your tool"/></To><Text Style="font-family:Comic Sans MS; font-weight:bold; color:#000080; ">or r u with alias?</Text></Message><Message Date="31/10/2004" Time="9:51:39 PM" DateTime="2004-10-31T10:51:39.594Z" SessionID="4"><From><User FriendlyName="*HeAtH* Dont be a fool, Rap your tool"/></From><To><User FriendlyName="James*-) 16 Days To Half Life 2 :D"/></To><Text Style="font-family:Arial; font-weight:bold; color:#000000; ">na im in</Text></Message><Message Date="1/11/2004" Time="3:59:28 PM" DateTime="2004-11-01T04:59:28.437Z" SessionID="5"><From><User FriendlyName="*HeAtH* Dont be a fool, Rap your tool"/></From><To><User FriendlyName="James*-) 16 Days To Half Life 2 :D"/></To><Text Style="font-family:Arial; font-weight:bold; color:#000000; ">hey</Text></Message><Message Date="2/11/2004" Time="4:37:36 PM" DateTime="2004-11-02T05:37:36.192Z" SessionID="6"><From><User FriendlyName="James*-) Pics or It didn't Happen..."/></From><To><User FriendlyName="*HeAtH* Dont be a fool, Rap your tool"/></To><Text Style="font-family:Comic Sans MS; font-weight:bold; color:#000080; ">Hay</Text></Message><Message Date="2/11/2004" Time="4:37:42 PM" DateTime="2004-11-02T05:37:42.551Z" SessionID="6"><From><User FriendlyName="*HeAtH* Dont be a fool, Rap your tool"/></From><To><User FriendlyName="James*-) Pics or It didn't Happen..."/></To><Text Style="font-family:Arial; font-weight:bold; color:#000000; ">where were u</Text></Message><Message Date="2/11/2004" Time="4:37:45 PM" DateTime="2004-11-02T05:37:45.856Z" SessionID="6"><From><User FriendlyName="James*-) Pics or It didn't Happen..."/></From><To><User FriendlyName="*HeAtH* Dont be a fool, Rap your tool"/></To><Text Style="font-family:Comic Sans MS; font-weight:bold; color:#000080; ">Wanna play ET</Text></Message><Message Date="2/11/2004" Time="4:37:53 PM" DateTime="2004-11-02T05:37:53.587Z" SessionID="6"><From><User FriendlyName="James*-) Pics or It didn't Happen..."/></From><To><User FriendlyName="*HeAtH* Dont be a fool, Rap your tool"/></To><Text Style="font-family:Comic Sans MS; font-weight:bold; color:#000080; ">OMFG ur like the 5th person 2 ask me that</Text></Message><Message Date="2/11/2004" Time="4:38:00 PM" DateTime="2004-11-02T05:38:00.707Z" SessionID="6"><From><User FriendlyName="*HeAtH* Dont be a fool, Rap your tool"/></From><To><User FriendlyName="James*-) Pics or It didn't Happen..."/></To><Text Style="font-family:Arial; font-weight:bold; color:#000000; ">i wonder why</Text></Message><Message Date="2/11/2004" Time="4:38:06 PM" DateTime="2004-11-02T05:38:06.916Z" SessionID="6"><From><User FriendlyName="James*-) Pics or It didn't Happen..."/></From><To><User FriendlyName="*HeAtH* Dont be a fool, Rap your tool"/></To><Text Style="font-family:Comic Sans MS; font-weight:bold; color:#000080; ">I was in a brothel in Switzerland</Text></Message><Message Date="2/11/2004" Time="4:38:08 PM" DateTime="2004-11-02T05:38:08.599Z" SessionID="6"><From><User FriendlyName="James*-) Pics or It didn't Happen..."/></From><To><User FriendlyName="*HeAtH* Dont be a fool, Rap your tool"/></To><Text Style="font-family:Comic Sans MS; font-weight:bold; color:#000080; ">Go on VENT</Text></Message><Message Date="2/11/2004" Time="5:39:00 PM" DateTime="2004-11-02T06:39:00.220Z" SessionID="7"><From><User FriendlyName="James*-) Pics or It didn't Happen..."/></From><To><User FriendlyName="*HeAtH* Dont be a fool, Rap your tool"/></To><Text Style="font-family:Comic Sans MS; font-weight:bold; color:#000080; ">Wats tha server details for alias?</Text></Message><Message Date="2/11/2004" Time="5:39:06 PM" DateTime="2004-11-02T06:39:06.979Z" SessionID="8"><From><User FriendlyName="*HeAtH* Dont be a fool, Rap your tool"/></From><To><User FriendlyName="James*-) Pics or It didn't Happen..."/></To><Text Style="font-family:Arial; font-weight:bold; color:#000000; ">nvm</Text></Message><Message Date="2/11/2004" Time="5:39:12 PM" DateTime="2004-11-02T06:39:12.297Z" SessionID="8"><From><User FriendlyName="*HeAtH* Dont be a fool, Rap your tool"/></From><To><User FriendlyName="James*-) Pics or It didn't Happen..."/></To><Text Style="font-family:Arial; font-weight:bold; color:#000000; ">whole teams in it</Text></Message><Message Date="2/11/2004" Time="5:39:30 PM" DateTime="2004-11-02T06:39:30.874Z" SessionID="8"><From><User FriendlyName="*HeAtH* Dont be a fool, Rap your tool"/></From><To><User FriendlyName="James*-) Pics or It didn't Happen..."/></To><Text Style="font-family:Arial; font-weight:bold; color:#000000; ">dres having a prac i think</Text></Message><Message Date="2/11/2004" Time="5:40:02 PM" DateTime="2004-11-02T06:40:02.509Z" SessionID="8"><From><User FriendlyName="James*-) Pics or It didn't Happen..."/></From><To><User FriendlyName="*HeAtH* Dont be a fool, Rap your tool"/></To><Text Style="font-family:Comic Sans MS; font-weight:bold; color:#000080; ">nope</Text></Message><Message Date="2/11/2004" Time="5:40:11 PM" DateTime="2004-11-02T06:40:11.212Z" SessionID="8"><From><User FriendlyName="*HeAtH* Dont be a fool, Rap your tool"/></From><To><User FriendlyName="James*-) Pics or It didn't Happen..."/></To><Text Style="font-family:Arial; font-weight:bold; color:#000000; ">well there all in a server</Text></Message><Message Date="2/11/2004" Time="5:53:47 PM" DateTime="2004-11-02T06:53:47.305Z" SessionID="9"><From><User FriendlyName="*HeAtH* Dont be a fool, Rap your tool"/></From><To><User FriendlyName="James*-) Pics or It didn't Happen..."/></To><Text Style="font-family:Arial; font-weight:bold; color:#000000; ">lol im capt of ix</Text></Message><Message Date="5/11/2004" Time="4:23:47 PM" DateTime="2004-11-05T05:23:47.705Z" SessionID="10"><From><User FriendlyName="*HeAtH*"/></From><To><User FriendlyName="James*-) I think therefore I am... I think."/></To><Text Style="font-family:Arial; font-weight:bold; color:#000000; ">hey</Text></Message><Invitation Date="5/11/2004" Time="7:38:42 PM" DateTime="2004-11-05T08:38:42.703Z" SessionID="11"><From><User FriendlyName="*HeAtH*"/></From><Application>an audio conversation</Application><Text Style="color:#545454; ">*HeAtH* is inviting you to start an audio conversation. Do you want to Accept (Alt+C) or Decline (Alt+D) the invitation?</Text></Invitation><Message Date="5/11/2004" Time="7:39:15 PM" DateTime="2004-11-05T08:39:15.520Z" SessionID="12"><From><User FriendlyName="*HeAtH*"/></From><To><User FriendlyName="James*-) I think therefore I am... I think."/></To><Text Style="font-family:Arial; font-weight:bold; color:#000000; ">helo</Text></Message><Message Date="5/11/2004" Time="9:21:36 PM" DateTime="2004-11-05T10:21:36.961Z" SessionID="13"><From><User FriendlyName="James*-) I think therefore I am... I think."/></From><To><User FriendlyName="*HeAtH*"/></To><Text Style="font-family:Comic Sans MS; font-weight:bold; color:#000080; ">Hay</Text></Message><Message Date="9/11/2004" Time="4:51:00 PM" DateTime="2004-11-09T05:51:00.052Z" SessionID="14"><From><User FriendlyName="James*-) I think therefore I am... I think."/></From><To><User FriendlyName="*HeAtH*"/></To><Text Style="font-family:Comic Sans MS; font-weight:bold; color:#000080; ">Oi heath cna u send us that .cfg?</Text></Message><Message Date="9/11/2004" Time="4:51:15 PM" DateTime="2004-11-09T05:51:15.044Z" SessionID="15"><From><User FriendlyName="*HeAtH*"/></From><To><User FriendlyName="James*-) I think therefore I am... I think."/></To><Text Style="font-family:Arial; font-weight:bold; color:#000000; ">???</Text></Message><Message Date="9/11/2004" Time="4:51:20 PM" DateTime="2004-11-09T05:51:20.091Z" SessionID="15"><From><User FriendlyName="James*-) I think therefore I am... I think."/></From><To><User FriendlyName="*HeAtH*"/></To><Text Style="font-family:Comic Sans MS; font-weight:bold; color:#000080; ">For ET</Text></Message><Message Date="9/11/2004" Time="4:51:26 PM" DateTime="2004-11-09T05:51:26.360Z" SessionID="16"><From><User FriendlyName="*HeAtH*"/></From><To><User FriendlyName="James*-) I think therefore I am... I think."/></To><Text Style="font-family:Arial; font-weight:bold; color:#000000; ">ok</Text></Message><Invitation Date="9/11/2004" Time="4:51:53 PM" DateTime="2004-11-09T05:51:53.449Z" SessionID="16"><From><User FriendlyName="*HeAtH*"/></From><File>etconfiggolf.cfg</File><Text Style="color:#545454; ">*HeAtH* sends etconfiggolf.cfg</Text></Invitation><Message Date="9/11/2004" Time="4:51:56 PM" DateTime="2004-11-09T05:51:56.423Z" SessionID="16"><From><User FriendlyName="*HeAtH*"/></From><To><User FriendlyName="James*-) I think therefore I am... I think."/></To><Text Style="font-family:Arial; font-weight:bold; color:#000000; ">ill send u golfs 1</Text></Message><Message Date="9/11/2004" Time="4:51:58 PM" DateTime="2004-11-09T05:51:58.977Z" SessionID="16"><From><User FriendlyName="*HeAtH*"/></From><To><User FriendlyName="James*-) I think therefore I am... I think."/></To><Text Style="font-family:Arial; font-weight:bold; color:#000000; ">its kick ass</Text></Message><Message Date="9/11/2004" Time="4:51:59 PM" DateTime="2004-11-09T05:51:59.638Z" SessionID="16"><From><User FriendlyName="James*-) I think therefore I am... I think."/></From><To><User FriendlyName="*HeAtH*"/></To><Text Style="font-family:Comic Sans MS; font-weight:bold; color:#000080; ">ok</Text></Message><InvitationResponse Date="9/11/2004" Time="4:52:03 PM" DateTime="2004-11-09T05:52:03.033Z" SessionID="16"><From><User FriendlyName="*HeAtH*"/></From><File>C:\Documents and Settings\James O'Toole\My Documents\My Received Files\etconfiggolf.cfg</File><Text Style="color:#545454; ">You have successfully received C:\Documents and Settings\James O'Toole\My Documents\My Received Files\etconfiggolf.cfg from *HeAtH*.</Text></InvitationResponse><Message Date="9/11/2004" Time="4:52:09 PM" DateTime="2004-11-09T05:52:09.192Z" SessionID="16"><From><User FriendlyName="James*-) I think therefore I am... I think."/></From><To><User FriendlyName="*HeAtH*"/></To><Text Style="font-family:Comic Sans MS; font-weight:bold; color:#000080; ">Do i haev 2 /exec it</Text></Message><Message Date="9/11/2004" Time="4:52:12 PM" DateTime="2004-11-09T05:52:12.066Z" SessionID="16"><From><User FriendlyName="James*-) I think therefore I am... I think."/></From><To><User FriendlyName="*HeAtH*"/></To><Text Style="font-family:Comic Sans MS; font-weight:bold; color:#000080; ">or do i replace it</Text></Message><Message Date="9/11/2004" Time="4:52:15 PM" DateTime="2004-11-09T05:52:15.341Z" SessionID="16"><From><User FriendlyName="*HeAtH*"/></From><To><User FriendlyName="James*-) I think therefore I am... I think."/></To><Text Style="font-family:Arial; font-weight:bold; color:#000000; ">replace</Text></Message><Message Date="9/11/2004" Time="4:52:19 PM" DateTime="2004-11-09T05:52:19.497Z" SessionID="16"><From><User FriendlyName="James*-) I think therefore I am... I think."/></From><To><User FriendlyName="*HeAtH*"/></To><Text Style="font-family:Comic Sans MS; font-weight:bold; color:#000080; ">ok</Text></Message><Message Date="9/11/2004" Time="4:52:21 PM" DateTime="2004-11-09T05:52:21.810Z" SessionID="16"><From><User FriendlyName="James*-) I think therefore I am... I think."/></From><To><User FriendlyName="*HeAtH*"/></To><Text Style="font-family:Comic Sans MS; font-weight:bold; color:#000080; ">in ETMAIN</Text></Message><Message Date="9/11/2004" Time="4:52:23 PM" DateTime="2004-11-09T05:52:23.282Z" SessionID="16"><From><User FriendlyName="*HeAtH*"/></From><To><User FriendlyName="James*-) I think therefore I am... I think."/></To><Text Style="font-family:Arial; font-weight:bold; color:#000000; ">just rename it as config.efg</Text></Message><Message Date="9/11/2004" Time="4:52:25 PM" DateTime="2004-11-09T05:52:25.715Z" SessionID="16"><From><User FriendlyName="*HeAtH*"/></From><To><User FriendlyName="James*-) I think therefore I am... I think."/></To><Text Style="font-family:Arial; font-weight:bold; color:#000000; ">cfg*</Text></Message><Message Date="9/11/2004" Time="4:52:28 PM" DateTime="2004-11-09T05:52:28.990Z" SessionID="16"><From><User FriendlyName="James*-) I think therefore I am... I think."/></From><To><User FriendlyName="*HeAtH*"/></To><Text Style="font-family:Comic Sans MS; font-weight:bold; color:#000080; ">?</Text></Message><Message Date="9/11/2004" Time="4:52:32 PM" DateTime="2004-11-09T05:52:32.605Z" SessionID="16"><From><User FriendlyName="James*-) I think therefore I am... I think."/></From><To><User FriendlyName="*HeAtH*"/></To><Text Style="font-family:Comic Sans MS; font-weight:bold; color:#000080; ">or etpro</Text></Message><Message Date="9/11/2004" Time="4:52:37 PM" DateTime="2004-11-09T05:52:37.392Z" SessionID="16"><From><User FriendlyName="*HeAtH*"/></From><To><User FriendlyName="James*-) I think therefore I am... I think."/></To><Text Style="font-family:Arial; font-weight:bold; color:#000000; ">do it in etmain etpro and shrub</Text></Message><Message Date="9/11/2004" Time="4:52:40 PM" DateTime="2004-11-09T05:52:40.286Z" SessionID="16"><From><User FriendlyName="James*-) I think therefore I am... I think."/></From><To><User FriendlyName="*HeAtH*"/></To><Text Style="font-family:Comic Sans MS; font-weight:bold; color:#000080; ">or shrub or watvever</Text></Message><Message Date="9/11/2004" Time="4:52:42 PM" DateTime="2004-11-09T05:52:42.460Z" SessionID="16"><From><User FriendlyName="James*-) I think therefore I am... I think."/></From><To><User FriendlyName="*HeAtH*"/></To><Text Style="font-family:Comic Sans MS; font-weight:bold; color:#000080; ">ok</Text></Message><Message Date="9/11/2004" Time="4:52:42 PM" DateTime="2004-11-09T05:52:42.920Z" SessionID="16"><From><User FriendlyName="James*-) I think therefore I am... I think."/></From><To><User FriendlyName="*HeAtH*"/></To><Text Style="font-family:Comic Sans MS; font-weight:bold; color:#000080; ">CA</Text></Message><Message Date="9/11/2004" Time="4:53:00 PM" DateTime="2004-11-09T05:53:00.576Z" SessionID="17"><From><User FriendlyName="*HeAtH*"/></From><To><User FriendlyName="James*-) I think therefore I am... I think."/></To><Text Style="font-family:Arial; font-weight:bold; color:#000000; ">im goin on et</Text></Message><Message Date="9/11/2004" Time="4:53:00 PM" DateTime="2004-11-09T05:53:00.596Z" SessionID="17"><From><User FriendlyName="*HeAtH*"/></From><To><User FriendlyName="James*-) I think therefore I am... I think."/></To><Text Style="font-family:Arial; font-weight:bold; color:#000000; ">latas</Text></Message><Message Date="9/11/2004" Time="4:53:16 PM" DateTime="2004-11-09T05:53:16.989Z" SessionID="17"><From><User FriendlyName="James*-) I think therefore I am... I think."/></From><To><User FriendlyName="*HeAtH*"/></To><Text Style="font-family:Comic Sans MS; font-weight:bold; color:#000080; ">okydoky</Text></Message><Message Date="9/11/2004" Time="5:02:01 PM" DateTime="2004-11-09T06:02:01.714Z" SessionID="18"><From><User FriendlyName="*HeAtH*"/></From><To><User FriendlyName="James*-) I think therefore I am... I think."/></To><Text Style="font-family:Arial; font-weight:bold; color:#000000; ">wat u doin</Text></Message><Message Date="9/11/2004" Time="5:05:14 PM" DateTime="2004-11-09T06:05:14.291Z" SessionID="18"><From><User FriendlyName="James*-) I think therefore I am... I think."/></From><To><User FriendlyName="*HeAtH*"/></To><Text Style="font-family:Comic Sans MS; font-weight:bold; color:#000080; ">Fiddling with ur CFG</Text></Message><Message Date="9/11/2004" Time="5:05:37 PM" DateTime="2004-11-09T06:05:37.514Z" SessionID="19"><From><User FriendlyName="*HeAtH*"/></From><To><User FriendlyName="James*-) I think therefore I am... I think."/></To><Text Style="font-family:Arial; font-weight:bold; color:#000000; ">i duno how 2 fidle wif it</Text></Message><Message Date="9/11/2004" Time="5:05:37 PM" DateTime="2004-11-09T06:05:37.524Z" SessionID="19"><From><User FriendlyName="*HeAtH*"/></From><To><User FriendlyName="James*-) I think therefore I am... I think."/></To><Text Style="font-family:Arial; font-weight:bold; color:#000000; ">ill prob brake it</Text></Message><Message Date="9/11/2004" Time="5:06:05 PM" DateTime="2004-11-09T06:06:05.284Z" SessionID="19"><From><User FriendlyName="James*-) I think therefore I am... I think."/></From><To><User FriendlyName="*HeAtH*"/></To><Text Style="font-family:Comic Sans MS; font-weight:bold; color:#000080; ">1.make backup
2.fiddle</Text></Message><Message Date="9/11/2004" Time="5:06:15 PM" DateTime="2004-11-09T06:06:15.048Z" SessionID="19"><From><User FriendlyName="*HeAtH*"/></From><To><User FriendlyName="James*-) I think therefore I am... I think."/></To><Text Style="font-family:Arial; font-weight:bold; color:#000000; ">i still duno how 2 do it</Text></Message><Message Date="9/11/2004" Time="5:06:32 PM" DateTime="2004-11-09T06:06:32.523Z" SessionID="19"><From><User FriendlyName="*HeAtH*"/></From><To><User FriendlyName="James*-) I think therefore I am... I think."/></To><Text Style="font-family:Arial; font-weight:bold; color:#000000; ">once uve fidled can i hav a look</Text></Message><Message Date="9/11/2004" Time="5:08:01 PM" DateTime="2004-11-09T06:08:01.141Z" SessionID="20"><From><User FriendlyName="*HeAtH*"/></From><To><User FriendlyName="James*-) I think therefore I am... I think."/></To><Text Style="font-family:Arial; font-weight:bold; color:#000000; ">???</Text></Message><Invitation Date="9/11/2004" Time="5:08:31 PM" DateTime="2004-11-09T06:08:31.224Z" SessionID="20"><From><User FriendlyName="*HeAtH*"/></From><Application>an audio conversation</Application><Text Style="color:#545454; ">*HeAtH* is inviting you to start an audio conversation. Do you want to Accept (Alt+C) or Decline (Alt+D) the invitation?</Text></Invitation><InvitationResponse Date="9/11/2004" Time="5:08:38 PM" DateTime="2004-11-09T06:08:38.735Z" SessionID="20"><From><User FriendlyName="*HeAtH*"/></From><Application>an audio conversation</Application><Text Style="color:#545454; ">You have accepted the invitation to start an audio conversation.</Text></InvitationResponse><Message Date="9/11/2004" Time="5:09:18 PM" DateTime="2004-11-09T06:09:18.051Z" SessionID="20"><From><User FriendlyName="*HeAtH*"/></From><To><User FriendlyName="James*-) I think therefore I am... I think."/></To><Text Style="font-family:Arial; font-weight:bold; color:#000000; ">hm...</Text></Message><Message Date="9/11/2004" Time="5:09:23 PM" DateTime="2004-11-09T06:09:23.249Z" SessionID="20"><From><User FriendlyName="James*-) I think therefore I am... I think."/></From><To><User FriendlyName="*HeAtH*"/></To><Text Style="font-family:Comic Sans MS; font-weight:bold; color:#000080; ">my mikes on</Text></Message><Message Date="9/11/2004" Time="5:09:28 PM" DateTime="2004-11-09T06:09:28.616Z" SessionID="20"><From><User FriendlyName="James*-) I think therefore I am... I think."/></From><To><User FriendlyName="*HeAtH*"/></To><Text Style="font-family:Comic Sans MS; font-weight:bold; color:#000080; ">and the lights going up n down</Text></Message><Message Date="9/11/2004" Time="5:09:31 PM" DateTime="2004-11-09T06:09:31.941Z" SessionID="20"><From><User FriendlyName="James*-) I think therefore I am... I think."/></From><To><User FriendlyName="*HeAtH*"/></To><Text Style="font-family:Comic Sans MS; font-weight:bold; color:#000080; ">and im talking and talking</Text></Message><Message Date="9/11/2004" Time="5:09:40 PM" DateTime="2004-11-09T06:09:40.203Z" SessionID="21"><From><User FriendlyName="*HeAtH*"/></From><To><User FriendlyName="James*-) I think therefore I am... I think."/></To><Text Style="font-family:Arial; font-weight:bold; color:#000000; ">lol</Text></Message><Message Date="9/11/2004" Time="5:09:43 PM" DateTime="2004-11-09T06:09:43.037Z" SessionID="21"><From><User FriendlyName="*HeAtH*"/></From><To><User FriendlyName="James*-) I think therefore I am... I think."/></To><Text Style="font-family:Arial; font-weight:bold; color:#000000; ">hm...</Text></Message><Invitation Date="9/11/2004" Time="5:10:10 PM" DateTime="2004-11-09T06:10:10.787Z" SessionID="21"><From><User FriendlyName="*HeAtH*"/></From><Application>an audio conversation</Application><Text Style="color:#545454; ">*HeAtH* is inviting you to start an audio conversation. Do you want to Accept (Alt+C) or Decline (Alt+D) the invitation?</Text></Invitation><InvitationResponse Date="9/11/2004" Time="5:10:12 PM" DateTime="2004-11-09T06:10:12.660Z" SessionID="21"><From><User FriendlyName="*HeAtH*"/></From><Application>an audio conversation</Application><Text Style="color:#545454; ">You have accepted the invitation to start an audio conversation.</Text></InvitationResponse><Invitation Date="9/11/2004" Time="5:10:22 PM" DateTime="2004-11-09T06:10:22.514Z" SessionID="21"><From><User FriendlyName="James*-) I think therefore I am... I think."/></From><Application>an audio conversation</Application><Text Style="color:#545454; ">You have invited *HeAtH* to start an audio conversation. Please wait for a response, or Cancel (Alt+Q) the pending invitation.</Text></Invitation><InvitationResponse Date="9/11/2004" Time="5:10:25 PM" DateTime="2004-11-09T06:10:25.799Z" SessionID="21"><From><User FriendlyName="*HeAtH*"/></From><Application>an audio conversation</Application><Text Style="color:#545454; ">*HeAtH* has accepted your invitation to start an audio conversation.</Text></InvitationResponse><Message Date="9/11/2004" Time="5:10:49 PM" DateTime="2004-11-09T06:10:49.382Z" SessionID="21"><From><User FriendlyName="James*-) I think therefore I am... I think."/></From><To><User FriendlyName="*HeAtH*"/></To><Text Style="font-family:Comic Sans MS; font-weight:bold; color:#000080; ">fangleberries</Text></Message><Message Date="9/11/2004" Time="5:10:51 PM" DateTime="2004-11-09T06:10:51.896Z" SessionID="21"><From><User FriendlyName="James*-) I think therefore I am... I think."/></From><To><User FriendlyName="*HeAtH*"/></To><Text Style="font-family:Comic Sans MS; font-weight:bold; color:#000080; ">hay u on vnet?</Text></Message><Message Date="9/11/2004" Time="5:10:54 PM" DateTime="2004-11-09T06:10:54.830Z" SessionID="21"><From><User FriendlyName="James*-) I think therefore I am... I think."/></From><To><User FriendlyName="*HeAtH*"/></To><Text Style="font-family:Comic Sans MS; font-weight:bold; color:#000080; ">vent*?</Text></Message><Message Date="9/11/2004" Time="5:10:56 PM" DateTime="2004-11-09T06:10:56.102Z" SessionID="21"><From><User FriendlyName="*HeAtH*"/></From><To><User FriendlyName="James*-) I think therefore I am... I think."/></To><Text Style="font-family:Arial; font-weight:bold; color:#000000; ">ill go on</Text></Message><Message Date="9/11/2004" Time="5:11:01 PM" DateTime="2004-11-09T06:11:01.109Z" SessionID="21"><From><User FriendlyName="James*-) I think therefore I am... I think."/></From><To><User FriendlyName="*HeAtH*"/></To><Text Style="font-family:Comic Sans MS; font-weight:bold; color:#000080; ">GIve us the ip</Text></Message><Message Date="9/11/2004" Time="5:11:06 PM" DateTime="2004-11-09T06:11:06.006Z" SessionID="21"><From><User FriendlyName="*HeAtH*"/></From><To><User FriendlyName="James*-) I think therefore I am... I think."/></To><Text Style="font-family:Arial; font-weight:bold; color:#000000; ">for?</Text></Message><Message Date="9/11/2004" Time="5:11:15 PM" DateTime="2004-11-09T06:11:15.149Z" SessionID="21"><From><User FriendlyName="James*-) I think therefore I am... I think."/></From><To><User FriendlyName="*HeAtH*"/></To><Text Style="font-family:Comic Sans MS; font-weight:bold; color:#000080; ">for the server</Text></Message><Message Date="9/11/2004" Time="5:11:22 PM" DateTime="2004-11-09T06:11:22.510Z" SessionID="21"><From><User FriendlyName="*HeAtH*"/></From><To><User FriendlyName="James*-) I think therefore I am... I think."/></To><Text Style="font-family:Arial; font-weight:bold; color:#000000; ">im in the dre one in gamestah</Text></Message><Message Date="9/11/2004" Time="5:11:42 PM" DateTime="2004-11-09T06:11:42.248Z" SessionID="21"><From><User FriendlyName="James*-) I think therefore I am... I think."/></From><To><User FriendlyName="*HeAtH*"/></To><Text Style="font-family:Comic Sans MS; font-weight:bold; color:#000080; ">ok brb</Text></Message><Message Date="9/11/2004" Time="5:12:26 PM" DateTime="2004-11-09T06:12:26.712Z" SessionID="22"><From><User FriendlyName="James*-) I think therefore I am... I think."/></From><To><User FriendlyName="*HeAtH*"/></To><Text Style="font-family:Comic Sans MS; font-weight:bold; color:#000080; ">oi</Text></Message><Message Date="9/11/2004" Time="5:12:28 PM" DateTime="2004-11-09T06:12:28.385Z" SessionID="22"><From><User FriendlyName="James*-) I think therefore I am... I think."/></From><To><User FriendlyName="*HeAtH*"/></To><Text Style="font-family:Comic Sans MS; font-weight:bold; color:#000080; ">im in</Text></Message><Message Date="9/11/2004" Time="5:12:29 PM" DateTime="2004-11-09T06:12:29.837Z" SessionID="22"><From><User FriendlyName="James*-) I think therefore I am... I think."/></From><To><User FriendlyName="*HeAtH*"/></To><Text Style="font-family:Comic Sans MS; font-weight:bold; color:#000080; ">talk bitch</Text></Message><Message Date="9/11/2004" Time="5:12:40 PM" DateTime="2004-11-09T06:12:40.652Z" SessionID="23"><From><User FriendlyName="*HeAtH*"/></From><To><User FriendlyName="James*-) I think therefore I am... I think."/></To><Text Style="font-family:Arial; font-weight:bold; color:#000000; ">can u hear me</Text></Message><Message Date="9/11/2004" Time="5:12:44 PM" DateTime="2004-11-09T06:12:44.188Z" SessionID="23"><From><User FriendlyName="James*-) I think therefore I am... I think."/></From><To><User FriendlyName="*HeAtH*"/></To><Text Style="font-family:Comic Sans MS; font-weight:bold; color:#000080; ">neg</Text></Message><Message Date="9/11/2004" Time="5:12:56 PM" DateTime="2004-11-09T06:12:56.866Z" SessionID="23"><From><User FriendlyName="*HeAtH*"/></From><To><User FriendlyName="James*-) I think therefore I am... I think."/></To><Text Style="font-family:Arial; font-weight:bold; color:#000000; ">i cant hear u</Text></Message><Message Date="9/11/2004" Time="5:13:00 PM" DateTime="2004-11-09T06:13:00.671Z" SessionID="23"><From><User FriendlyName="James*-) I think therefore I am... I think."/></From><To><User FriendlyName="*HeAtH*"/></To><Text Style="font-family:Comic Sans MS; font-weight:bold; color:#000080; ">shazbot</Text></Message><Message Date="9/11/2004" Time="5:13:04 PM" DateTime="2004-11-09T06:13:04.106Z" SessionID="23"><From><User FriendlyName="James*-) I think therefore I am... I think."/></From><To><User FriendlyName="*HeAtH*"/></To><Text Style="font-family:Comic Sans MS; font-weight:bold; color:#000080; ">i cant hear u either</Text></Message><Message Date="9/11/2004" Time="5:13:19 PM" DateTime="2004-11-09T06:13:19.108Z" SessionID="24"><From><User FriendlyName="*HeAtH*"/></From><To><User FriendlyName="James*-) I think therefore I am... I think."/></To><Text Style="font-family:Arial; font-weight:bold; color:#000000; ">gay</Text></Message><Message Date="9/11/2004" Time="5:13:28 PM" DateTime="2004-11-09T06:13:28.421Z" SessionID="24"><From><User FriendlyName="James*-) I think therefore I am... I think."/></From><To><User FriendlyName="*HeAtH*"/></To><Text Style="font-family:Comic Sans MS; font-weight:bold; color:#000080; ">oi might me tha server</Text></Message><Message Date="9/11/2004" Time="5:13:38 PM" DateTime="2004-11-09T06:13:38.185Z" SessionID="24"><From><User FriendlyName="James*-) I think therefore I am... I think."/></From><To><User FriendlyName="*HeAtH*"/></To><Text Style="font-family:Comic Sans MS; font-weight:bold; color:#000080; ">ventrilo.3fl.net go there</Text></Message><Message Date="9/11/2004" Time="5:13:43 PM" DateTime="2004-11-09T06:13:43.863Z" SessionID="24"><From><User FriendlyName="James*-) I think therefore I am... I think."/></From><To><User FriendlyName="*HeAtH*"/></To><Text Style="font-family:Comic Sans MS; font-weight:bold; color:#000080; ">there server for vent</Text></Message><Message Date="9/11/2004" Time="5:13:44 PM" DateTime="2004-11-09T06:13:44.244Z" SessionID="24"><From><User FriendlyName="James*-) I think therefore I am... I think."/></From><To><User FriendlyName="*HeAtH*"/></To><Text Style="font-family:Comic Sans MS; font-weight:bold; color:#000080; ">ventrilo.3fl.net</Text></Message><Message Date="9/11/2004" Time="5:13:49 PM" DateTime="2004-11-09T06:13:49.832Z" SessionID="24"><From><User FriendlyName="James*-) I think therefore I am... I think."/></From><To><User FriendlyName="*HeAtH*"/></To><Text Style="font-family:Comic Sans MS; font-weight:bold; color:#000080; ">default port</Text></Message><Message Date="9/11/2004" Time="5:14:19 PM" DateTime="2004-11-09T06:14:19.324Z" SessionID="24"><From><User FriendlyName="James*-) I think therefore I am... I think."/></From><To><User FriendlyName="*HeAtH*"/></To><Text Style="font-family:Comic Sans MS; font-weight:bold; color:#000080; ">hurrup</Text></Message><Message Date="9/11/2004" Time="5:15:35 PM" DateTime="2004-11-09T06:15:35.814Z" SessionID="24"><From><User FriendlyName="*HeAtH*"/></From><To><User FriendlyName="James*-) I think therefore I am... I think."/></To><Text Style="font-family:Arial; font-weight:bold; color:#000000; ">wana go 2 anotha server</Text></Message><Message Date="9/11/2004" Time="5:15:44 PM" DateTime="2004-11-09T06:15:44.457Z" SessionID="24"><From><User FriendlyName="James*-) I think therefore I am... I think."/></From><To><User FriendlyName="*HeAtH*"/></To><Text Style="font-family:Comic Sans MS; font-weight:bold; color:#000080; ">Give me and IP</Text></Message><Message Date="9/11/2004" Time="5:15:54 PM" DateTime="2004-11-09T06:15:54.341Z" SessionID="24"><From><User FriendlyName="James*-) I think therefore I am... I think."/></From><To><User FriendlyName="*HeAtH*"/></To><Text Style="font-family:Comic Sans MS; font-weight:bold; color:#000080; ">203.97.94.163</Text></Message><Message Date="9/11/2004" Time="5:15:58 PM" DateTime="2004-11-09T06:15:58.337Z" SessionID="24"><From><User FriendlyName="James*-) I think therefore I am... I think."/></From><To><User FriendlyName="*HeAtH*"/></To><Text Style="font-family:Comic Sans MS; font-weight:bold; color:#000080; ">port 27960</Text></Message><Message Date="9/11/2004" Time="5:16:08 PM" DateTime="2004-11-09T06:16:08.922Z" SessionID="24"><From><User FriendlyName="James*-) I think therefore I am... I think."/></From><To><User FriendlyName="*HeAtH*"/></To><Text Style="font-family:Comic Sans MS; font-weight:bold; color:#000080; ">wait that dusnt work</Text></Message><Message Date="9/11/2004" Time="5:16:21 PM" DateTime="2004-11-09T06:16:21.640Z" SessionID="24"><From><User FriendlyName="*HeAtH*"/></From><To><User FriendlyName="James*-) I think therefore I am... I think."/></To><Text Style="font-family:Arial; font-weight:bold; color:#000000; ">comon i need one</Text></Message><Message Date="9/11/2004" Time="5:16:30 PM" DateTime="2004-11-09T06:16:30.613Z" SessionID="24"><From><User FriendlyName="James*-) I think therefore I am... I think."/></From><To><User FriendlyName="*HeAtH*"/></To><Text Style="font-family:Comic Sans MS; font-weight:bold; color:#000080; ">Go on ur server</Text></Message><Message Date="9/11/2004" Time="5:16:35 PM" DateTime="2004-11-09T06:16:35.340Z" SessionID="24"><From><User FriendlyName="*HeAtH*"/></From><To><User FriendlyName="James*-) I think therefore I am... I think."/></To><Text Style="font-family:Arial; font-weight:bold; color:#000000; ">ok</Text></Message><Message Date="9/11/2004" Time="5:16:42 PM" DateTime="2004-11-09T06:16:42.100Z" SessionID="24"><From><User FriendlyName="James*-) I think therefore I am... I think."/></From><To><User FriendlyName="*HeAtH*"/></To><Text Style="font-family:Comic Sans MS; font-weight:bold; color:#000080; ">give us the IP</Text></Message><Message Date="9/11/2004" Time="5:16:57 PM" DateTime="2004-11-09T06:16:57.412Z" SessionID="24"><From><User FriendlyName="*HeAtH*"/></From><To><User FriendlyName="James*-) I think therefore I am... I think."/></To><Text Style="font-family:Arial; font-weight:bold; color:#000000; ">210.55.13.243</Text></Message><Message Date="9/11/2004" Time="5:17:02 PM" DateTime="2004-11-09T06:17:02.088Z" SessionID="24"><From><User FriendlyName="*HeAtH*"/></From><To><User FriendlyName="James*-) I think therefore I am... I think."/></To><Text Style="font-family:Arial; font-weight:bold; color:#000000; ">3784</Text></Message><Message Date="9/11/2004" Time="5:17:11 PM" DateTime="2004-11-09T06:17:11.642Z" SessionID="24"><From><User FriendlyName="James*-) I think therefore I am... I think."/></From><To><User FriendlyName="*HeAtH*"/></To><Text Style="font-family:Comic Sans MS; font-weight:bold; color:#000080; ">im in</Text></Message><Message Date="9/11/2004" Time="5:17:45 PM" DateTime="2004-11-09T06:17:45.991Z" SessionID="25"><From><User FriendlyName="James*-) I think therefore I am... I think."/></From><To><User FriendlyName="*HeAtH*"/></To><Text Style="font-family:Comic Sans MS; font-weight:bold; color:#000080; ">Can u hear me sluthole?</Text></Message><Message Date="9/11/2004" Time="5:17:51 PM" DateTime="2004-11-09T06:17:51.299Z" SessionID="25"><From><User FriendlyName="*HeAtH*"/></From><To><User FriendlyName="James*-) I think therefore I am... I think."/></To><Text Style="font-family:Arial; font-weight:bold; color:#000000; ">no</Text></Message><Message Date="9/11/2004" Time="5:17:57 PM" DateTime="2004-11-09T06:17:57.849Z" SessionID="25"><From><User FriendlyName="*HeAtH*"/></From><To><User FriendlyName="James*-) I think therefore I am... I think."/></To><Text Style="font-family:Arial; font-weight:bold; color:#000000; ">go battlefield 1942</Text></Message><Message Date="9/11/2004" Time="5:18:01 PM" DateTime="2004-11-09T06:18:01.774Z" SessionID="25"><From><User FriendlyName="James*-) I think therefore I am... I think."/></From><To><User FriendlyName="*HeAtH*"/></To><Text Style="font-family:Comic Sans MS; font-weight:bold; color:#000080; ">ca</Text></Message><Message Date="13/11/2004" Time="10:29:35 AM" DateTime="2004-11-12T23:29:35.528Z" SessionID="26"><From><User FriendlyName="*HeAtH*"/></From><To><User FriendlyName="James*-) I think therefore I am... I think."/></To><Text Style="font-family:Arial; font-weight:bold; color:#000000; ">hey</Text></Message><Message Date="13/11/2004" Time="10:30:25 AM" DateTime="2004-11-12T23:30:25.751Z" SessionID="26"><From><User FriendlyName="*HeAtH*"/></From><To><User FriendlyName="James*-) I think therefore I am... I think."/></To><Text Style="font-family:Arial; font-weight:bold; color:#000000; ">james</Text></Message><Message Date="14/11/2004" Time="11:25:41 AM" DateTime="2004-11-14T00:25:41.526Z" SessionID="27"><From><User FriendlyName="*HeAtH*"/></From><To><User FriendlyName="James*-) I think therefore I am... I think."/></To><Text Style="font-family:Arial; font-weight:bold; color:#000000; ">wat vent u wana go on</Text></Message><Invitation Date="14/11/2004" Time="11:25:50 AM" DateTime="2004-11-14T00:25:50.619Z" SessionID="27"><From><User FriendlyName="*HeAtH*"/></From><Application>an audio conversation</Application><Text Style="color:#545454; ">*HeAtH* is inviting you to start an audio conversation. Do you want to Accept (Alt+C) or Decline (Alt+D) the invitation?</Text></Invitation><InvitationResponse Date="14/11/2004" Time="11:25:53 AM" DateTime="2004-11-14T00:25:53.333Z" SessionID="27"><From><User FriendlyName="*HeAtH*"/></From><Application>an audio conversation</Application><Text Style="color:#545454; ">You have accepted the invitation to start an audio conversation.</Text></InvitationResponse><Message Date="14/11/2004" Time="11:26:22 AM" DateTime="2004-11-14T00:26:22.826Z" SessionID="27"><From><User FriendlyName="James*-) I think therefore I am... I think."/></From><To><User FriendlyName="*HeAtH*"/></To><Text Style="font-family:Comic Sans MS; font-weight:bold; color:#000080; ">jsut a sec</Text></Message><Message Date="14/11/2004" Time="11:26:45 AM" DateTime="2004-11-14T00:26:45.508Z" SessionID="27"><From><User FriendlyName="James*-) I think therefore I am... I think."/></From><To><User FriendlyName="*HeAtH*"/></To><Text Style="font-family:Comic Sans MS; font-weight:bold; color:#000080; ">Can u hear usssss</Text></Message><Message Date="14/11/2004" Time="11:26:48 AM" DateTime="2004-11-14T00:26:48.693Z" SessionID="27"><From><User FriendlyName="*HeAtH*"/></From><To><User FriendlyName="James*-) I think therefore I am... I think."/></To><Text Style="font-family:Arial; font-weight:bold; color:#000000; ">nop</Text></Message><Message Date="14/11/2004" Time="11:26:56 AM" DateTime="2004-11-14T00:26:56.224Z" SessionID="27"><From><User FriendlyName="James*-) I think therefore I am... I think."/></From><To><User FriendlyName="*HeAtH*"/></To><Text Style="font-family:Comic Sans MS; font-weight:bold; color:#000080; ">man ur MSNs gey</Text></Message><Message Date="14/11/2004" Time="11:27:01 AM" DateTime="2004-11-14T00:27:01.301Z" SessionID="28"><From><User FriendlyName="*HeAtH*"/></From><To><User FriendlyName="James*-) I think therefore I am... I think."/></To><Text Style="font-family:Arial; font-weight:bold; color:#000000; ">i no</Text></Message><Message Date="14/11/2004" Time="11:27:03 AM" DateTime="2004-11-14T00:27:03.835Z" SessionID="28"><From><User FriendlyName="*HeAtH*"/></From><To><User FriendlyName="James*-) I think therefore I am... I think."/></To><Text Style="font-family:Arial; font-weight:bold; color:#000000; ">lets go on alias vent</Text></Message><Message Date="14/11/2004" Time="11:27:12 AM" DateTime="2004-11-14T00:27:12.327Z" SessionID="28"><From><User FriendlyName="James*-) I think therefore I am... I think."/></From><To><User FriendlyName="*HeAtH*"/></To><Text Style="font-family:Comic Sans MS; font-weight:bold; color:#000080; ">No can do</Text></Message><Message Date="14/11/2004" Time="11:27:19 AM" DateTime="2004-11-14T00:27:19.788Z" SessionID="28"><From><User FriendlyName="*HeAtH*"/></From><To><User FriendlyName="James*-) I think therefore I am... I think."/></To><Text Style="font-family:Arial; font-weight:bold; color:#000000; ">why?</Text></Message><Message Date="14/11/2004" Time="11:27:40 AM" DateTime="2004-11-14T00:27:40.287Z" SessionID="28"><From><User FriendlyName="James*-) I think therefore I am... I think."/></From><To><User FriendlyName="*HeAtH*"/></To><Text Style="font-family:Comic Sans MS; font-weight:bold; color:#000080; ">wrong version</Text></Message><Message Date="14/11/2004" Time="11:27:46 AM" DateTime="2004-11-14T00:27:46.045Z" SessionID="29"><From><User FriendlyName="*HeAtH*"/></From><To><User FriendlyName="James*-) I think therefore I am... I think."/></To><Text Style="font-family:Arial; font-weight:bold; color:#000000; ">shit</Text></Message><Message Date="14/11/2004" Time="11:27:58 AM" DateTime="2004-11-14T00:27:58.503Z" SessionID="29"><From><User FriendlyName="*HeAtH*"/></From><To><User FriendlyName="James*-) I think therefore I am... I think."/></To><Text Style="font-family:Arial; font-weight:bold; color:#000000; ">send me link ill download 2.2</Text></Message><Message Date="14/11/2004" Time="11:28:09 AM" DateTime="2004-11-14T00:28:09.539Z" SessionID="29"><From><User FriendlyName="James*-) I think therefore I am... I think."/></From><To><User FriendlyName="*HeAtH*"/></To><Text Style="font-family:Comic Sans MS; font-weight:bold; color:#000080; ">www.ventrilo.com</Text></Message><Message Date="14/11/2004" Time="11:28:15 AM" DateTime="2004-11-14T00:28:15.728Z" SessionID="29"><From><User FriendlyName="*HeAtH*"/></From><To><User FriendlyName="James*-) I think therefore I am... I think."/></To><Text Style="font-family:Arial; font-weight:bold; color:#000000; ">lol</Text></Message><Message Date="14/11/2004" Time="11:30:19 AM" DateTime="2004-11-14T00:30:19.787Z" SessionID="29"><From><User FriendlyName="*HeAtH*"/></From><To><User FriendlyName="James*-) I think therefore I am... I think."/></To><Text Style="font-family:Arial; font-weight:bold; color:#000000; ">do i hav 2 get rid of 2.1</Text></Message><Message Date="14/11/2004" Time="11:30:25 AM" DateTime="2004-11-14T00:30:25.234Z" SessionID="29"><From><User FriendlyName="James*-) I think therefore I am... I think."/></From><To><User FriendlyName="*HeAtH*"/></To><Text Style="font-family:Comic Sans MS; font-weight:bold; color:#000080; ">v41</Text></Message><Message Date="14/11/2004" Time="11:30:28 AM" DateTime="2004-11-14T00:30:28.709Z" SessionID="29"><From><User FriendlyName="James*-) I think therefore I am... I think."/></From><To><User FriendlyName="*HeAtH*"/></To><Text Style="font-family:Comic Sans MS; font-weight:bold; color:#000080; ">yyuuuuuuuuuuuup</Text></Message><Message Date="14/11/2004" Time="11:30:33 AM" DateTime="2004-11-14T00:30:33.937Z" SessionID="29"><From><User FriendlyName="*HeAtH*"/></From><To><User FriendlyName="James*-) I think therefore I am... I think."/></To><Text Style="font-family:Arial; font-weight:bold; color:#000000; ">fuck it then</Text></Message><Message Date="14/11/2004" Time="11:30:41 AM" DateTime="2004-11-14T00:30:41.468Z" SessionID="29"><From><User FriendlyName="James*-) I think therefore I am... I think."/></From><To><User FriendlyName="*HeAtH*"/></To><Text Style="font-family:Comic Sans MS; font-weight:bold; color:#000080; ">u can reinstall the old version l8r</Text></Message><Message Date="14/11/2004" Time="11:30:46 AM" DateTime="2004-11-14T00:30:46.335Z" SessionID="30"><From><User FriendlyName="*HeAtH*"/></From><To><User FriendlyName="James*-) I think therefore I am... I think."/></To><Text Style="font-family:Arial; font-weight:bold; color:#000000; ">na im fine</Text></Message><Message Date="14/11/2004" Time="11:30:53 AM" DateTime="2004-11-14T00:30:53.345Z" SessionID="30"><From><User FriendlyName="*HeAtH*"/></From><To><User FriendlyName="James*-) I think therefore I am... I think."/></To><Text Style="font-family:Arial; font-weight:bold; color:#000000; ">i got like 15 channels</Text></Message><Message Date="14/11/2004" Time="11:30:56 AM" DateTime="2004-11-14T00:30:56.750Z" SessionID="30"><From><User FriendlyName="James*-) I think therefore I am... I think."/></From><To><User FriendlyName="*HeAtH*"/></To><Text Style="font-family:Comic Sans MS; font-weight:bold; color:#000080; ">oi do the wizard thingo</Text></Message><Message Date="14/11/2004" Time="11:31:12 AM" DateTime="2004-11-14T00:31:12.272Z" SessionID="31"><From><User FriendlyName="James*-) I think therefore I am... I think."/></From><To><User FriendlyName="*HeAtH*"/></To><Text Style="font-family:Comic Sans MS; font-weight:bold; color:#000080; ">msn</Text></Message><Message Date="14/11/2004" Time="11:31:15 AM" DateTime="2004-11-14T00:31:15.777Z" SessionID="31"><From><User FriendlyName="*HeAtH*"/></From><To><User FriendlyName="James*-) I think therefore I am... I think."/></To><Text Style="font-family:Arial; font-weight:bold; color:#000000; ">done</Text></Message><Invitation Date="14/11/2004" Time="11:31:17 AM" DateTime="2004-11-14T00:31:17.349Z" SessionID="31"><From><User FriendlyName="*HeAtH*"/></From><Application>an audio conversation</Application><Text Style="color:#545454; ">*HeAtH* is inviting you to start an audio conversation. Do you want to Accept (Alt+C) or Decline (Alt+D) the invitation?</Text></Invitation><InvitationResponse Date="14/11/2004" Time="11:31:19 AM" DateTime="2004-11-14T00:31:19.532Z" SessionID="31"><From><User FriendlyName="*HeAtH*"/></From><Application>an audio conversation</Application><Text Style="color:#545454; ">You have accepted the invitation to start an audio conversation.</Text></InvitationResponse><Message Date="14/11/2004" Time="11:31:27 AM" DateTime="2004-11-14T00:31:27.394Z" SessionID="31"><From><User FriendlyName="James*-) I think therefore I am... I think."/></From><To><User FriendlyName="*HeAtH*"/></To><Text Style="font-family:Comic Sans MS; font-weight:bold; color:#000080; ">i got u</Text></Message><Message Date="14/11/2004" Time="11:31:37 AM" DateTime="2004-11-14T00:31:37.999Z" SessionID="31"><From><User FriendlyName="James*-) I think therefore I am... I think."/></From><To><User FriendlyName="*HeAtH*"/></To><Text Style="font-family:Comic Sans MS; font-weight:bold; color:#000080; ">no i normaly cant</Text></Message><Message Date="14/11/2004" Time="11:31:42 AM" DateTime="2004-11-14T00:31:42.255Z" SessionID="31"><From><User FriendlyName="James*-) I think therefore I am... I think."/></From><To><User FriendlyName="*HeAtH*"/></To><Text Style="font-family:Comic Sans MS; font-weight:bold; color:#000080; ">oi</Text></Message><Message Date="14/11/2004" Time="11:31:46 AM" DateTime="2004-11-14T00:31:46.872Z" SessionID="31"><From><User FriendlyName="James*-) I think therefore I am... I think."/></From><To><User FriendlyName="*HeAtH*"/></To><Text Style="font-family:Comic Sans MS; font-weight:bold; color:#000080; ">r ur hedfones on?</Text></Message><Message Date="14/11/2004" Time="11:31:59 AM" DateTime="2004-11-14T00:31:59.159Z" SessionID="31"><From><User FriendlyName="James*-) I think therefore I am... I think."/></From><To><User FriendlyName="*HeAtH*"/></To><Text Style="font-family:Comic Sans MS; font-weight:bold; color:#000080; ">ohhh good 4 u</Text></Message><Invitation Date="14/11/2004" Time="11:32:01 AM" DateTime="2004-11-14T00:32:01.252Z" SessionID="31"><From><User FriendlyName="James*-) I think therefore I am... I think."/></From><Application>an audio conversation</Application><Text Style="color:#545454; ">You have invited *HeAtH* to start an audio conversation. Please wait for a response, or Cancel (Alt+Q) the pending invitation.</Text></Invitation><InvitationResponse Date="14/11/2004" Time="11:32:04 AM" DateTime="2004-11-14T00:32:04.778Z" SessionID="31"><From><User FriendlyName="*HeAtH*"/></From><Application>an audio conversation</Application><Text Style="color:#545454; ">*HeAtH* has accepted your invitation to start an audio conversation.</Text></InvitationResponse><Message Date="14/11/2004" Time="11:32:12 AM" DateTime="2004-11-14T00:32:12.509Z" SessionID="31"><From><User FriendlyName="James*-) I think therefore I am... I think."/></From><To><User FriendlyName="*HeAtH*"/></To><Text Style="font-family:Comic Sans MS; font-weight:bold; color:#000080; ">sumtimes this happens when me n marc do it</Text></Message><Invitation Date="14/11/2004" Time="11:32:16 AM" DateTime="2004-11-14T00:32:16.945Z" SessionID="31"><From><User FriendlyName="James*-) I think therefore I am... I think."/></From><Application>an audio conversation</Application><Text Style="color:#545454; ">You have invited *HeAtH* to start an audio conversation. Please wait for a response, or Cancel (Alt+Q) the pending invitation.</Text></Invitation><InvitationResponse Date="14/11/2004" Time="11:32:21 AM" DateTime="2004-11-14T00:32:21.191Z" SessionID="31"><From><User FriendlyName="*HeAtH*"/></From><Application>an audio conversation</Application><Text Style="color:#545454; ">*HeAtH* has accepted your invitation to start an audio conversation.</Text></InvitationResponse><Invitation Date="14/11/2004" Time="11:32:26 AM" DateTime="2004-11-14T00:32:26.499Z" SessionID="31"><From><User FriendlyName="*HeAtH*"/></From><Application>an audio conversation</Application><Text Style="color:#545454; ">*HeAtH* is inviting you to start an audio conversation. Do you want to Accept (Alt+C) or Decline (Alt+D) the invitation?</Text></Invitation><Message Date="14/11/2004" Time="11:32:28 AM" DateTime="2004-11-14T00:32:28.422Z" SessionID="31"><From><User FriendlyName="James*-) I think therefore I am... I think."/></From><To><User FriendlyName="*HeAtH*"/></To><Text Style="font-family:Comic Sans MS; font-weight:bold; color:#000080; ">it sumtimes take a few times</Text></Message><InvitationResponse Date="14/11/2004" Time="11:32:30 AM" DateTime="2004-11-14T00:32:30.124Z" SessionID="31"><From><User FriendlyName="*HeAtH*"/></From><Application>an audio conversation</Application><Text Style="color:#545454; ">You have accepted the invitation to start an audio conversation.</Text></InvitationResponse><Message Date="14/11/2004" Time="11:32:47 AM" DateTime="2004-11-14T00:32:47.739Z" SessionID="31"><From><User FriendlyName="*HeAtH*"/></From><To><User FriendlyName="James*-) I think therefore I am... I think."/></To><Text Style="font-family:Arial; font-weight:bold; color:#000000; ">taking longer thats good</Text></Message><Invitation Date="14/11/2004" Time="11:32:52 AM" DateTime="2004-11-14T00:32:52.646Z" SessionID="31"><From><User FriendlyName="James*-) I think therefore I am... I think."/></From><Application>an audio conversation</Application><Text Style="color:#545454; ">You have invited *HeAtH* to start an audio conversation. Please wait for a response, or Cancel (Alt+Q) the pending invitation.</Text></Invitation><InvitationResponse Date="14/11/2004" Time="11:32:55 AM" DateTime="2004-11-14T00:32:55.651Z" SessionID="31"><From><User FriendlyName="*HeAtH*"/></From><Application>an audio conversation</Application><Text Style="color:#545454; ">*HeAtH* has accepted your invitation to start an audio conversation.</Text></InvitationResponse><Invitation Date="14/11/2004" Time="11:33:03 AM" DateTime="2004-11-14T00:33:03.382Z" SessionID="31"><From><User FriendlyName="*HeAtH*"/></From><Application>an audio conversation</Application><Text Style="color:#545454; ">*HeAtH* is inviting you to start an audio conversation. Do you want to Accept (Alt+C) or Decline (Alt+D) the invitation?</Text></Invitation><InvitationResponse Date="14/11/2004" Time="11:33:04 AM" DateTime="2004-11-14T00:33:04.944Z" SessionID="31"><From><User FriendlyName="*HeAtH*"/></From><Application>an audio conversation</Application><Text Style="color:#545454; ">You have accepted the invitation to start an audio conversation.</Text></InvitationResponse><Message Date="14/11/2004" Time="11:33:20 AM" DateTime="2004-11-14T00:33:20.006Z" SessionID="31"><From><User FriendlyName="James*-) I think therefore I am... I think."/></From><To><User FriendlyName="*HeAtH*"/></To><Text Style="font-family:Comic Sans MS; font-weight:bold; color:#000080; ">oi</Text></Message><Message Date="14/11/2004" Time="11:33:23 AM" DateTime="2004-11-14T00:33:23.050Z" SessionID="31"><From><User FriendlyName="James*-) I think therefore I am... I think."/></From><To><User FriendlyName="*HeAtH*"/></To><Text Style="font-family:Comic Sans MS; font-weight:bold; color:#000080; ">download that</Text></Message><Message Date="14/11/2004" Time="11:33:23 AM" DateTime="2004-11-14T00:33:23.651Z" SessionID="31"><From><User FriendlyName="James*-) I think therefore I am... I think."/></From><To><User FriendlyName="*HeAtH*"/></To><Text Style="font-family:Comic Sans MS; font-weight:bold; color:#000080; ">http://www.softpedia.com/public/cat/10/4/1/10-4-1-128.shtml</Text></Message><Message Date="14/11/2004" Time="11:33:32 AM" DateTime="2004-11-14T00:33:32.624Z" SessionID="31"><From><User FriendlyName="*HeAtH*"/></From><To><User FriendlyName="James*-) I think therefore I am... I think."/></To><Text Style="font-family:Arial; font-weight:bold; color:#000000; ">v51</Text></Message><Message Date="14/11/2004" Time="11:33:38 AM" DateTime="2004-11-14T00:33:38.703Z" SessionID="31"><From><User FriendlyName="James*-) I think therefore I am... I think."/></From><To><User FriendlyName="*HeAtH*"/></To><Text Style="font-family:Comic Sans MS; font-weight:bold; color:#000080; ">its MSN 7</Text></Message><Message Date="14/11/2004" Time="11:33:47 AM" DateTime="2004-11-14T00:33:47.285Z" SessionID="31"><From><User FriendlyName="James*-) I think therefore I am... I think."/></From><To><User FriendlyName="*HeAtH*"/></To><Text Style="font-family:Comic Sans MS; font-weight:bold; color:#000080; ">it'll probly fix it</Text></Message><Message Date="14/11/2004" Time="11:33:56 AM" DateTime="2004-11-14T00:33:56.909Z" SessionID="31"><From><User FriendlyName="*HeAtH*"/></From><To><User FriendlyName="James*-) I think therefore I am... I think."/></To><Text Style="font-family:Arial; font-weight:bold; color:#000000; ">oh yea i got plua</Text></Message><Message Date="14/11/2004" Time="11:33:58 AM" DateTime="2004-11-14T00:33:58.491Z" SessionID="31"><From><User FriendlyName="*HeAtH*"/></From><To><User FriendlyName="James*-) I think therefore I am... I think."/></To><Text Style="font-family:Arial; font-weight:bold; color:#000000; ">plus</Text></Message><Message Date="14/11/2004" Time="11:34:02 AM" DateTime="2004-11-14T00:34:02.236Z" SessionID="31"><From><User FriendlyName="James*-) I think therefore I am... I think."/></From><To><User FriendlyName="*HeAtH*"/></To><Text Style="font-family:Comic Sans MS; font-weight:bold; color:#000080; ">yeah</Text></Message><Message Date="14/11/2004" Time="11:34:04 AM" DateTime="2004-11-14T00:34:04.640Z" SessionID="31"><From><User FriendlyName="James*-) I think therefore I am... I think."/></From><To><User FriendlyName="*HeAtH*"/></To><Text Style="font-family:Comic Sans MS; font-weight:bold; color:#000080; ">this is MSN 7</Text></Message><Message Date="14/11/2004" Time="11:34:06 AM" DateTime="2004-11-14T00:34:06.673Z" SessionID="31"><From><User FriendlyName="James*-) I think therefore I am... I think."/></From><To><User FriendlyName="*HeAtH*"/></To><Text Style="font-family:Comic Sans MS; font-weight:bold; color:#000080; ">a new version</Text></Message><Message Date="14/11/2004" Time="11:34:14 AM" DateTime="2004-11-14T00:34:14.324Z" SessionID="32"><From><User FriendlyName="*HeAtH*"/></From><To><User FriendlyName="James*-) I think therefore I am... I think."/></To><Text Style="font-family:Arial; font-weight:bold; color:#000000; ">dude where is the download button</Text></Message><Message Date="14/11/2004" Time="11:34:20 AM" DateTime="2004-11-14T00:34:20.192Z" SessionID="32"><From><User FriendlyName="James*-) I think therefore I am... I think."/></From><To><User FriendlyName="*HeAtH*"/></To><Text Style="font-family:Comic Sans MS; font-weight:bold; color:#000080; ">the big red wun</Text></Message><Message Date="14/11/2004" Time="11:34:27 AM" DateTime="2004-11-14T00:34:27.723Z" SessionID="32"><From><User FriendlyName="*HeAtH*"/></From><To><User FriendlyName="James*-) I think therefore I am... I think."/></To><Text Style="font-family:Arial; font-weight:bold; color:#000000; ">oh there it is</Text></Message><Message Date="14/11/2004" Time="11:34:33 AM" DateTime="2004-11-14T00:34:33.902Z" SessionID="32"><From><User FriendlyName="James*-) I think therefore I am... I think."/></From><To><User FriendlyName="*HeAtH*"/></To><Text Style="font-family:Comic Sans MS; font-weight:bold; color:#000080; ">lo.</Text></Message><Message Date="14/11/2004" Time="11:34:44 AM" DateTime="2004-11-14T00:34:44.016Z" SessionID="32"><From><User FriendlyName="*HeAtH*"/></From><To><User FriendlyName="James*-) I think therefore I am... I think."/></To><Text Style="font-family:Arial; font-weight:bold; color:#000000; ">i was looking at right hand side</Text></Message><Message Date="14/11/2004" Time="11:35:09 AM" DateTime="2004-11-14T00:35:09.163Z" SessionID="32"><From><User FriendlyName="*HeAtH*"/></From><To><User FriendlyName="James*-) I think therefore I am... I think."/></To><Text Style="font-family:Arial; font-weight:bold; color:#000000; ">1 min 40 secs grrr</Text></Message><Message Date="14/11/2004" Time="11:35:23 AM" DateTime="2004-11-14T00:35:23.964Z" SessionID="32"><From><User FriendlyName="*HeAtH*"/></From><To><User FriendlyName="James*-) I think therefore I am... I think."/></To><Text Style="font-family:Arial; font-weight:bold; color:#000000; ">wait its goin up</Text></Message><Message Date="14/11/2004" Time="11:35:39 AM" DateTime="2004-11-14T00:35:39.897Z" SessionID="32"><From><User FriendlyName="*HeAtH*"/></From><To><User FriendlyName="James*-) I think therefore I am... I think."/></To><Text Style="font-family:Arial; font-weight:bold; color:#000000; ">hey i think my cables gone gay</Text></Message><Message Date="14/11/2004" Time="11:35:48 AM" DateTime="2004-11-14T00:35:48.369Z" SessionID="32"><From><User FriendlyName="James*-) I think therefore I am... I think."/></From><To><User FriendlyName="*HeAtH*"/></To><Text Style="font-family:Comic Sans MS; font-weight:bold; color:#000080; ">how long left</Text></Message><Message Date="14/11/2004" Time="11:35:54 AM" DateTime="2004-11-14T00:35:54.047Z" SessionID="32"><From><User FriendlyName="*HeAtH*"/></From><To><User FriendlyName="James*-) I think therefore I am... I think."/></To><Text Style="font-family:Arial; font-weight:bold; color:#000000; ">2 34</Text></Message><Message Date="14/11/2004" Time="11:36:02 AM" DateTime="2004-11-14T00:36:02.660Z" SessionID="32"><From><User FriendlyName="*HeAtH*"/></From><To><User FriendlyName="James*-) I think therefore I am... I think."/></To><Text Style="font-family:Arial; font-weight:bold; color:#000000; ">im downloading at 40k</Text></Message><Message Date="14/11/2004" Time="11:36:08 AM" DateTime="2004-11-14T00:36:08.167Z" SessionID="32"><From><User FriendlyName="*HeAtH*"/></From><To><User FriendlyName="James*-) I think therefore I am... I think."/></To><Text Style="font-family:Arial; font-weight:bold; color:#000000; ">and goin lower</Text></Message><Message Date="14/11/2004" Time="11:36:38 AM" DateTime="2004-11-14T00:36:38.271Z" SessionID="32"><From><User FriendlyName="James*-) I think therefore I am... I think."/></From><To><User FriendlyName="*HeAtH*"/></To><Text Style="font-family:Comic Sans MS; font-weight:bold; color:#000080; ">http://www.mess.be/pafiledb/pafiledb.php?action=file&amp;id=518&amp;PHPSESSID=a65b8a2c5f93e8e16967736e948f4adf</Text></Message><Message Date="14/11/2004" Time="11:36:46 AM" DateTime="2004-11-14T00:36:46.503Z" SessionID="32"><From><User FriendlyName="*HeAtH*"/></From><To><User FriendlyName="James*-) I think therefore I am... I think."/></To><Text Style="font-family:Arial; font-weight:bold; color:#000000; ">wats that</Text></Message><Message Date="14/11/2004" Time="11:37:03 AM" DateTime="2004-11-14T00:37:03.928Z" SessionID="32"><From><User FriendlyName="James*-) I think therefore I am... I think."/></From><To><User FriendlyName="*HeAtH*"/></To><Text Style="font-family:Comic Sans MS; font-weight:bold; color:#000080; ">anuther link</Text></Message><Message Date="14/11/2004" Time="11:37:17 AM" DateTime="2004-11-14T00:37:17.908Z" SessionID="32"><From><User FriendlyName="*HeAtH*"/></From><To><User FriendlyName="James*-) I think therefore I am... I think."/></To><Text Style="font-family:Arial; font-weight:bold; color:#000000; ">its downloading i got 50 secs 2 go</Text></Message><Message Date="14/11/2004" Time="11:37:21 AM" DateTime="2004-11-14T00:37:21.924Z" SessionID="32"><From><User FriendlyName="James*-) I think therefore I am... I think."/></From><To><User FriendlyName="*HeAtH*"/></To><Text Style="font-family:Comic Sans MS; font-weight:bold; color:#000080; ">ok</Text></Message><Message Date="14/11/2004" Time="11:37:29 AM" DateTime="2004-11-14T00:37:29.084Z" SessionID="32"><From><User FriendlyName="*HeAtH*"/></From><To><User FriendlyName="James*-) I think therefore I am... I think."/></To><Text Style="font-family:Arial; font-weight:bold; color:#000000; ">but the gay thing is its at 45k</Text></Message><Message Date="14/11/2004" Time="11:37:31 AM" DateTime="2004-11-14T00:37:31.107Z" SessionID="32"><From><User FriendlyName="James*-) I think therefore I am... I think."/></From><To><User FriendlyName="*HeAtH*"/></To><Text Style="font-family:Comic Sans MS; font-weight:bold; color:#000080; ">it took me lik 14 seconds off that site</Text></Message><Message Date="14/11/2004" Time="11:37:38 AM" DateTime="2004-11-14T00:37:38.858Z" SessionID="32"><From><User FriendlyName="*HeAtH*"/></From><To><User FriendlyName="James*-) I think therefore I am... I think."/></To><Text Style="font-family:Arial; font-weight:bold; color:#000000; ">i no my cables gay</Text></Message><Message Date="14/11/2004" Time="11:37:43 AM" DateTime="2004-11-14T00:37:43.194Z" SessionID="32"><From><User FriendlyName="James*-) I think therefore I am... I think."/></From><To><User FriendlyName="*HeAtH*"/></To><Text Style="font-family:Comic Sans MS; font-weight:bold; color:#000080; ">v51</Text></Message><Message Date="14/11/2004" Time="11:37:48 AM" DateTime="2004-11-14T00:37:48.592Z" SessionID="32"><From><User FriendlyName="*HeAtH*"/></From><To><User FriendlyName="James*-) I think therefore I am... I think."/></To><Text Style="font-family:Arial; font-weight:bold; color:#000000; ">i cant play on most et servers atm</Text></Message><Message Date="14/11/2004" Time="11:38:34 AM" DateTime="2004-11-14T00:38:34.187Z" SessionID="32"><From><User FriendlyName="James*-) I think therefore I am... I think."/></From><To><User FriendlyName="*HeAtH*"/></To><Text Style="font-family:Comic Sans MS; font-weight:bold; color:#000080; "> 	 	


_      |    /\    |\  |\    |_  (   _
  ._/  /---\  |  \|  \  |__  ._)  </Text></Message><Message Date="14/11/2004" Time="11:39:41 AM" DateTime="2004-11-14T00:39:41.154Z" SessionID="33"><From><User FriendlyName="James*-) I think therefore I am... I think."/></From><To><User FriendlyName="*HeAtH*"/></To><Text Style="font-family:Comic Sans MS; font-weight:bold; color:#000080; ">got it now?</Text></Message><Invitation Date="14/11/2004" Time="11:39:46 AM" DateTime="2004-11-14T00:39:46.361Z" SessionID="33"><From><User FriendlyName="James*-) I think therefore I am... I think."/></From><Application>an audio conversation</Application><Text Style="color:#545454; ">You have invited *HeAtH* to start an audio conversation. Please wait for a response, or Cancel (Alt+Q) the pending invitation.</Text></Invitation><Invitation Date="14/11/2004" Time="11:39:48 AM" DateTime="2004-11-14T00:39:48.024Z" SessionID="33"><From><User FriendlyName="*HeAtH*"/></From><Application>an audio conversation</Application><Text Style="color:#545454; ">*HeAtH* is inviting you to start an audio conversation. Do you want to Accept (Alt+C) or Decline (Alt+D) the invitation?</Text></Invitation><Message Date="14/11/2004" Time="11:39:48 AM" DateTime="2004-11-14T00:39:48.875Z" SessionID="33"><From><User FriendlyName="*HeAtH*"/></From><To><User FriendlyName="James*-) I think therefore I am... I think."/></To><Text Style="font-family:Arial; font-weight:bold; color:#000000; ">yea</Text></Message><InvitationResponse Date="14/11/2004" Time="11:39:51 AM" DateTime="2004-11-14T00:39:51.499Z" SessionID="33"><From><User FriendlyName="*HeAtH*"/></From><Application>an audio conversation</Application><Text Style="color:#800000; ">You have declined the invitation to start an audio conversation.</Text></InvitationResponse><InvitationResponse Date="14/11/2004" Time="11:39:54 AM" DateTime="2004-11-14T00:39:54.343Z" SessionID="33"><From><User FriendlyName="*HeAtH*"/></From><Application>an audio conversation</Application><Text Style="color:#800000; ">You have canceled your invitation to start an audio conversation.</Text></InvitationResponse><Invitation Date="14/11/2004" Time="11:39:54 AM" DateTime="2004-11-14T00:39:54.883Z" SessionID="33"><From><User FriendlyName="James*-) I think therefore I am... I think."/></From><Application>an audio conversation</Application><Text Style="color:#545454; ">You have invited *HeAtH* to start an audio conversation. Please wait for a response, or Cancel (Alt+Q) the pending invitation.</Text></Invitation><InvitationResponse Date="14/11/2004" Time="11:40:01 AM" DateTime="2004-11-14T00:40:01.463Z" SessionID="33"><From><User FriendlyName="*HeAtH*"/></From><Application>an audio conversation</Application><Text Style="color:#545454; ">*HeAtH* has accepted your invitation to start an audio conversation.</Text></InvitationResponse><Message Date="14/11/2004" Time="11:40:14 AM" DateTime="2004-11-14T00:40:14.392Z" SessionID="33"><From><User FriendlyName="James*-) I think therefore I am... I think."/></From><To><User FriendlyName="*HeAtH*"/></To><Text Style="font-family:Comic Sans MS; font-weight:bold; color:#000080; ">dont nudhe me</Text></Message><Message Date="14/11/2004" Time="11:40:15 AM" DateTime="2004-11-14T00:40:15.603Z" SessionID="33"><From><User FriendlyName="*HeAtH*"/></From><To><User FriendlyName="James*-) I think therefore I am... I think."/></To><Text Style="font-family:Arial; font-weight:bold; color:#000000; ">wtf</Text></Message><Message Date="14/11/2004" Time="11:40:16 AM" DateTime="2004-11-14T00:40:16.404Z" SessionID="33"><From><User FriendlyName="James*-) I think therefore I am... I think."/></From><To><User FriendlyName="*HeAtH*"/></To><Text Style="font-family:Comic Sans MS; font-weight:bold; color:#000080; ">I can hear u</Text></Message><Invitation Date="14/11/2004" Time="11:40:33 AM" DateTime="2004-11-14T00:40:33.128Z" SessionID="33"><From><User FriendlyName="*HeAtH*"/></From><Application>an audio conversation</Application><Text Style="color:#545454; ">*HeAtH* is inviting you to start an audio conversation. Do you want to Accept (Alt+C) or Decline (Alt+D) the invitation?</Text></Invitation><InvitationResponse Date="14/11/2004" Time="11:40:35 AM" DateTime="2004-11-14T00:40:35.842Z" SessionID="33"><From><User FriendlyName="*HeAtH*"/></From><Application>an audio conversation</Application><Text Style="color:#545454; ">You have accepted the invitation to start an audio conversation.</Text></InvitationResponse><Message Date="14/11/2004" Time="11:40:45 AM" DateTime="2004-11-14T00:40:45.646Z" SessionID="33"><From><User FriendlyName="James*-) I think therefore I am... I think."/></From><To><User FriendlyName="*HeAtH*"/></To><Text Style="font-family:Comic Sans MS; font-weight:bold; color:#000080; ">helo</Text></Message><Invitation Date="14/11/2004" Time="11:40:49 AM" DateTime="2004-11-14T00:40:49.272Z" SessionID="33"><From><User FriendlyName="James*-) I think therefore I am... I think."/></From><Application>an audio conversation</Application><Text Style="color:#545454; ">You have invited *HeAtH* to start an audio conversation. Please wait for a response, or Cancel (Alt+Q) the pending invitation.</Text></Invitation><InvitationResponse Date="14/11/2004" Time="11:40:52 AM" DateTime="2004-11-14T00:40:52.416Z" SessionID="33"><From><User FriendlyName="*HeAtH*"/></From><Application>an audio conversation</Application><Text Style="color:#545454; ">*HeAtH* has accepted your invitation to start an audio conversation.</Text></InvitationResponse><Message Date="14/11/2004" Time="11:41:02 AM" DateTime="2004-11-14T00:41:02.180Z" SessionID="33"><From><User FriendlyName="James*-) I think therefore I am... I think."/></From><To><User FriendlyName="*HeAtH*"/></To><Text Style="font-family:Comic Sans MS; font-weight:bold; color:#000080; ">ohhh</Text></Message><Message Date="14/11/2004" Time="11:41:15 AM" DateTime="2004-11-14T00:41:15.580Z" SessionID="33"><From><User FriendlyName="James*-) I think therefore I am... I think."/></From><To><User FriendlyName="*HeAtH*"/></To><Text Style="font-family:Comic Sans MS; font-weight:bold; color:#000080; ">do u still have teamspeak?</Text></Message><Message Date="14/11/2004" Time="11:41:19 AM" DateTime="2004-11-14T00:41:19.896Z" SessionID="33"><From><User FriendlyName="*HeAtH*"/></From><To><User FriendlyName="James*-) I think therefore I am... I think."/></To><Text Style="font-family:Arial; font-weight:bold; color:#000000; ">yea</Text></Message><Message Date="14/11/2004" Time="11:41:27 AM" DateTime="2004-11-14T00:41:27.437Z" SessionID="33"><From><User FriendlyName="James*-) I think therefore I am... I think."/></From><To><User FriendlyName="*HeAtH*"/></To><Text Style="font-family:Comic Sans MS; font-weight:bold; color:#000080; ">ok</Text></Message><Message Date="14/11/2004" Time="11:41:30 AM" DateTime="2004-11-14T00:41:30.861Z" SessionID="33"><From><User FriendlyName="James*-) I think therefore I am... I think."/></From><To><User FriendlyName="*HeAtH*"/></To><Text Style="font-family:Comic Sans MS; font-weight:bold; color:#000080; ">give us ur server info</Text></Message><Message Date="14/11/2004" Time="11:41:33 AM" DateTime="2004-11-14T00:41:33.726Z" SessionID="33"><From><User FriendlyName="*HeAtH*"/></From><To><User FriendlyName="James*-) I think therefore I am... I think."/></To><Text Style="font-family:Arial; font-weight:bold; color:#000000; ">ok</Text></Message><Message Date="14/11/2004" Time="11:41:57 AM" DateTime="2004-11-14T00:41:57.320Z" SessionID="33"><From><User FriendlyName="James*-) I think therefore I am... I think."/></From><To><User FriendlyName="*HeAtH*"/></To><Text Style="font-family:Comic Sans MS; font-weight:bold; color:#000080; ">Go full screan and do it</Text></Message><Message Date="14/11/2004" Time="11:42:06 AM" DateTime="2004-11-14T00:42:06.042Z" SessionID="33"><From><User FriendlyName="James*-) I think therefore I am... I think."/></From><To><User FriendlyName="*HeAtH*"/></To><Text Style="font-family:Comic Sans MS; font-weight:bold; color:#000080; ">how dodgy is it</Text></Message><Message Date="14/11/2004" Time="11:42:11 AM" DateTime="2004-11-14T00:42:11.470Z" SessionID="33"><From><User FriendlyName="*HeAtH*"/></From><To><User FriendlyName="James*-) I think therefore I am... I think."/></To><Text Style="font-family:Arial; font-weight:bold; color:#000000; ">203.24.101.86:8767</Text></Message><Message Date="14/11/2004" Time="11:42:19 AM" DateTime="2004-11-14T00:42:19.441Z" SessionID="33"><From><User FriendlyName="*HeAtH*"/></From><To><User FriendlyName="James*-) I think therefore I am... I think."/></To><Text Style="font-family:Arial; font-weight:bold; color:#000000; ">ip and just put bomer in name</Text></Message><Message Date="14/11/2004" Time="11:42:32 AM" DateTime="2004-11-14T00:42:32.470Z" SessionID="33"><From><User FriendlyName="James*-) I think therefore I am... I think."/></From><To><User FriendlyName="*HeAtH*"/></To><Text Style="font-family:Comic Sans MS; font-weight:bold; color:#000080; ">ok</Text></Message><Message Date="14/11/2004" Time="11:42:36 AM" DateTime="2004-11-14T00:42:36.055Z" SessionID="33"><From><User FriendlyName="James*-) I think therefore I am... I think."/></From><To><User FriendlyName="*HeAtH*"/></To><Text Style="font-family:Comic Sans MS; font-weight:bold; color:#000080; ">5 seconds left</Text></Message><Message Date="14/11/2004" Time="11:42:55 AM" DateTime="2004-11-14T00:42:55.964Z" SessionID="33"><From><User FriendlyName="James*-) I think therefore I am... I think."/></From><To><User FriendlyName="*HeAtH*"/></To><Text Style="font-family:Comic Sans MS; font-weight:bold; color:#000080; ">ok</Text></Message><Message Date="14/11/2004" Time="11:42:57 AM" DateTime="2004-11-14T00:42:57.486Z" SessionID="33"><From><User FriendlyName="James*-) I think therefore I am... I think."/></From><To><User FriendlyName="*HeAtH*"/></To><Text Style="font-family:Comic Sans MS; font-weight:bold; color:#000080; ">i got it</Text></Message><Message Date="14/11/2004" Time="11:43:12 AM" DateTime="2004-11-14T00:43:12.217Z" SessionID="33"><From><User FriendlyName="*HeAtH*"/></From><To><User FriendlyName="James*-) I think therefore I am... I think."/></To><Text Style="font-family:Arial; font-weight:bold; color:#000000; ">comon</Text></Message><Message Date="14/11/2004" Time="11:43:20 AM" DateTime="2004-11-14T00:43:20.259Z" SessionID="33"><From><User FriendlyName="*HeAtH*"/></From><To><User FriendlyName="James*-) I think therefore I am... I think."/></To><Text Style="font-family:Arial; font-weight:bold; color:#000000; ">iron cross</Text></Message><Message Date="14/11/2004" Time="11:43:22 AM" DateTime="2004-11-14T00:43:22.822Z" SessionID="33"><From><User FriendlyName="James*-) I think therefore I am... I think."/></From><To><User FriendlyName="*HeAtH*"/></To><Text Style="font-family:Comic Sans MS; font-weight:bold; color:#000080; ">wat chanl</Text></Message><Message Date="14/11/2004" Time="11:43:25 AM" DateTime="2004-11-14T00:43:25.436Z" SessionID="33"><From><User FriendlyName="*HeAtH*"/></From><To><User FriendlyName="James*-) I think therefore I am... I think."/></To><Text Style="font-family:Arial; font-weight:bold; color:#000000; ">pw is ironx</Text></Message><Message Date="14/11/2004" Time="8:55:22 PM" DateTime="2004-11-14T09:55:22.606Z" SessionID="34"><From><User FriendlyName="James*-)"/></From><To><User FriendlyName="*HeAtH*"/></To><Text Style="font-family:Comic Sans MS; font-weight:bold; color:#000080; ">heath do u no the password 2 the AS clan server</Text></Message><Message Date="14/11/2004" Time="8:55:34 PM" DateTime="2004-11-14T09:55:34.884Z" SessionID="34"><From><User FriendlyName="*HeAtH*"/></From><To><User FriendlyName="James*-)"/></To><Text Style="font-family:Arial; font-weight:bold; color:#000000; ">no why?</Text></Message><Message Date="14/11/2004" Time="8:55:54 PM" DateTime="2004-11-14T09:55:54.162Z" SessionID="34"><From><User FriendlyName="James*-)"/></From><To><User FriendlyName="*HeAtH*"/></To><Text Style="font-family:Comic Sans MS; font-weight:bold; color:#000080; ">i wanna play heahshot</Text></Message><Message Date="14/11/2004" Time="8:56:04 PM" DateTime="2004-11-14T09:56:04.146Z" SessionID="34"><From><User FriendlyName="James*-)"/></From><To><User FriendlyName="*HeAtH*"/></To><Text Style="font-family:Comic Sans MS; font-weight:bold; color:#000080; ">do u no a server that has headshot on it</Text></Message><Message Date="14/11/2004" Time="8:56:04 PM" DateTime="2004-11-14T09:56:04.557Z" SessionID="34"><From><User FriendlyName="*HeAtH*"/></From><To><User FriendlyName="James*-)"/></To><Text Style="font-family:Arial; font-weight:bold; color:#000000; ">hold on brb</Text></Message><Message Date="14/11/2004" Time="8:56:10 PM" DateTime="2004-11-14T09:56:10.655Z" SessionID="34"><From><User FriendlyName="James*-)"/></From><To><User FriendlyName="*HeAtH*"/></To><Text Style="font-family:Comic Sans MS; font-weight:bold; color:#000080; ">besides Quiet Bridge</Text></Message><Message Date="14/11/2004" Time="8:56:13 PM" DateTime="2004-11-14T09:56:13.570Z" SessionID="34"><From><User FriendlyName="*HeAtH*"/></From><To><User FriendlyName="James*-)"/></To><Text Style="font-family:Arial; font-weight:bold; color:#000000; ">ubik or klank k</Text></Message><Message Date="14/11/2004" Time="8:56:14 PM" DateTime="2004-11-14T09:56:14.922Z" SessionID="34"><From><User FriendlyName="*HeAtH*"/></From><To><User FriendlyName="James*-)"/></To><Text Style="font-family:Arial; font-weight:bold; color:#000000; ">brb</Text></Message><Message Date="14/11/2004" Time="9:01:30 PM" DateTime="2004-11-14T10:01:30.606Z" SessionID="34"><From><User FriendlyName="James*-)"/></From><To><User FriendlyName="*HeAtH*"/></To><Text Style="font-family:Comic Sans MS; font-weight:bold; color:#000080; ">oi</Text></Message><Message Date="14/11/2004" Time="9:01:57 PM" DateTime="2004-11-14T10:01:57.735Z" SessionID="34"><From><User FriendlyName="James*-)"/></From><To><User FriendlyName="*HeAtH*"/></To><Text Style="font-family:Comic Sans MS; font-weight:bold; color:#000080; ">Oi fucker</Text></Message><Message Date="14/11/2004" Time="9:02:07 PM" DateTime="2004-11-14T10:02:07.388Z" SessionID="34"><From><User FriendlyName="James*-)"/></From><To><User FriendlyName="*HeAtH*"/></To><Text Style="font-family:Comic Sans MS; font-weight:bold; color:#000080; ">Wat server has Headshot on it?</Text></Message><Message Date="14/11/2004" Time="9:02:17 PM" DateTime="2004-11-14T10:02:17.583Z" SessionID="34"><From><User FriendlyName="*HeAtH*"/></From><To><User FriendlyName="James*-)"/></To><Text Style="font-family:Arial; font-weight:bold; color:#000000; ">its brenton</Text></Message><Message Date="14/11/2004" Time="9:02:19 PM" DateTime="2004-11-14T10:02:19.666Z" SessionID="34"><From><User FriendlyName="*HeAtH*"/></From><To><User FriendlyName="James*-)"/></To><Text Style="font-family:Arial; font-weight:bold; color:#000000; ">-___"</Text></Message><Message Date="14/11/2004" Time="9:02:22 PM" DateTime="2004-11-14T10:02:22.761Z" SessionID="34"><From><User FriendlyName="*HeAtH*"/></From><To><User FriendlyName="James*-)"/></To><Text Style="font-family:Arial; font-weight:bold; color:#000000; ">-____-"</Text></Message><Message Date="14/11/2004" Time="9:02:25 PM" DateTime="2004-11-14T10:02:25.484Z" SessionID="34"><From><User FriendlyName="James*-)"/></From><To><User FriendlyName="*HeAtH*"/></To><Text Style="font-family:Comic Sans MS; font-weight:bold; color:#000080; ">well find dom muther fucker!</Text></Message><Message Date="14/11/2004" Time="9:02:28 PM" DateTime="2004-11-14T10:02:28.959Z" SessionID="34"><From><User FriendlyName="James*-)"/></From><To><User FriendlyName="*HeAtH*"/></To><Text Style="font-family:Comic Sans MS; font-weight:bold; color:#000080; ">doom 3 </Text></Message><Message Date="14/11/2004" Time="9:02:31 PM" DateTime="2004-11-14T10:02:31.123Z" SessionID="34"><From><User FriendlyName="*HeAtH*"/></From><To><User FriendlyName="James*-)"/></To><Text Style="font-family:Arial; font-weight:bold; color:#000000; ">heath now</Text></Message><Message Date="14/11/2004" Time="9:02:34 PM" DateTime="2004-11-14T10:02:34.057Z" SessionID="34"><From><User FriendlyName="*HeAtH*"/></From><To><User FriendlyName="James*-)"/></To><Text Style="font-family:Arial; font-weight:bold; color:#000000; ">brenton left</Text></Message><Message Date="14/11/2004" Time="9:02:35 PM" DateTime="2004-11-14T10:02:35.719Z" SessionID="34"><From><User FriendlyName="James*-)"/></From><To><User FriendlyName="*HeAtH*"/></To><Text Style="font-family:Comic Sans MS; font-weight:bold; color:#000080; ">heath</Text></Message><Message Date="14/11/2004" Time="9:02:39 PM" DateTime="2004-11-14T10:02:39.955Z" SessionID="34"><From><User FriendlyName="James*-)"/></From><To><User FriendlyName="*HeAtH*"/></To><Text Style="font-family:Comic Sans MS; font-weight:bold; color:#000080; ">Wat server has headshot</Text></Message><Message Date="14/11/2004" Time="9:02:40 PM" DateTime="2004-11-14T10:02:40.977Z" SessionID="34"><From><User FriendlyName="*HeAtH*"/></From><To><User FriendlyName="James*-)"/></To><Text Style="font-family:Arial; font-weight:bold; color:#000000; ">yes</Text></Message><Message Date="14/11/2004" Time="9:02:47 PM" DateTime="2004-11-14T10:02:47.206Z" SessionID="34"><From><User FriendlyName="*HeAtH*"/></From><To><User FriendlyName="James*-)"/></To><Text Style="font-family:Arial; font-weight:bold; color:#000000; ">ubik or klan k</Text></Message><Message Date="14/11/2004" Time="9:02:53 PM" DateTime="2004-11-14T10:02:53.024Z" SessionID="34"><From><User FriendlyName="James*-)"/></From><To><User FriendlyName="*HeAtH*"/></To><Text Style="font-family:Comic Sans MS; font-weight:bold; color:#000080; ">ubik dunt work</Text></Message><Message Date="14/11/2004" Time="9:02:54 PM" DateTime="2004-11-14T10:02:54.757Z" SessionID="34"><From><User FriendlyName="*HeAtH*"/></From><To><User FriendlyName="James*-)"/></To><Text Style="font-family:Arial; font-weight:bold; color:#000000; ">u hav 2 set it 2 objective</Text></Message><Message Date="14/11/2004" Time="9:03:01 PM" DateTime="2004-11-14T10:03:01.096Z" SessionID="34"><From><User FriendlyName="*HeAtH*"/></From><To><User FriendlyName="James*-)"/></To><Text Style="font-family:Arial; font-weight:bold; color:#000000; ">ill do it</Text></Message><Invitation Date="14/11/2004" Time="9:03:05 PM" DateTime="2004-11-14T10:03:05.983Z" SessionID="34"><From><User FriendlyName="*HeAtH*"/></From><Application>an audio conversation</Application><Text Style="color:#545454; ">*HeAtH* is inviting you to start an audio conversation. Do you want to Accept (Alt+C) or Decline (Alt+D) the invitation?</Text></Invitation><InvitationResponse Date="14/11/2004" Time="9:03:20 PM" DateTime="2004-11-14T10:03:20.043Z" SessionID="34"><From><User FriendlyName="*HeAtH*"/></From><Application>an audio conversation</Application><Text Style="color:#800000; ">*HeAtH* has canceled the invitation to start an audio conversation.</Text></InvitationResponse><Invitation Date="14/11/2004" Time="9:03:24 PM" DateTime="2004-11-14T10:03:24.529Z" SessionID="34"><From><User FriendlyName="James*-)"/></From><Application>an audio conversation</Application><Text Style="color:#545454; ">You have invited *HeAtH* to start an audio conversation. Please wait for a response, or Cancel (Alt+Q) the pending invitation.</Text></Invitation><Message Date="14/11/2004" Time="9:03:25 PM" DateTime="2004-11-14T10:03:25.711Z" SessionID="34"><From><User FriendlyName="*HeAtH*"/></From><To><User FriendlyName="James*-)"/></To><Text Style="font-family:Arial; font-weight:bold; color:#000000; ">ask 4 audio</Text></Message><InvitationResponse Date="14/11/2004" Time="9:03:31 PM" DateTime="2004-11-14T10:03:31.409Z" SessionID="34"><From><User FriendlyName="*HeAtH*"/></From><Application>an audio conversation</Application><Text Style="color:#545454; ">*HeAtH* has accepted your invitation to start an audio conversation.</Text></InvitationResponse><Message Date="14/11/2004" Time="9:03:46 PM" DateTime="2004-11-14T10:03:46.191Z" SessionID="34"><From><User FriendlyName="*HeAtH*"/></From><To><User FriendlyName="James*-)"/></To><Text Style="font-family:Arial; font-weight:bold; color:#000000; ">i can hear u</Text></Message><Invitation Date="14/11/2004" Time="9:03:54 PM" DateTime="2004-11-14T10:03:54.002Z" SessionID="34"><From><User FriendlyName="James*-)"/></From><Application>an audio conversation</Application><Text Style="color:#545454; ">You have invited *HeAtH* to start an audio conversation. Please wait for a response, or Cancel (Alt+Q) the pending invitation.</Text></Invitation><Message Date="14/11/2004" Time="9:03:56 PM" DateTime="2004-11-14T10:03:56.996Z" SessionID="34"><From><User FriendlyName="*HeAtH*"/></From><To><User FriendlyName="James*-)"/></To><Text Style="font-family:Arial; font-weight:bold; color:#000000; ">i could hear u</Text></Message><InvitationResponse Date="14/11/2004" Time="9:03:58 PM" DateTime="2004-11-14T10:03:58.759Z" SessionID="34"><From><User FriendlyName="*HeAtH*"/></From><Application>an audio conversation</Application><Text Style="color:#545454; ">*HeAtH* has accepted your invitation to start an audio conversation.</Text></InvitationResponse><Message Date="16/11/2004" Time="6:56:23 PM" DateTime="2004-11-16T07:56:23.210Z" SessionID="35"><From><User FriendlyName="James*-) Im not as think as you drunk I am..."/></From><To><User FriendlyName="*HeAtH* 8===D (|)"/></To><Text Style="font-family:Comic Sans MS; font-weight:bold; color:#000080; ">3:50 seconds</Text></Message><Message Date="1/12/2004" Time="8:15:04 PM" DateTime="2004-12-01T09:15:04.840Z" SessionID="36"><From><User FriendlyName="James:)Listen, in order to maintain air speed velocity a swallow eneds to beat it wings 43 times every second, Am i right....."/></From><To><User FriendlyName="*HeAtH*"/></To><Text Style="font-family:Comic Sans MS; font-weight:bold; color:#000080; ">Hay</Text></Message><Message Date="3/12/2004" Time="7:42:07 PM" DateTime="2004-12-03T08:42:07.289Z" SessionID="37"><From><User FriendlyName="*HeAtH*"/></From><To><User FriendlyName="James:)BeeeeeeeeeeeeW!"/></To><Text Style="font-family:Arial; font-weight:bold; color:#000000; ">u no bout baseball</Text></Message><Message Date="3/12/2004" Time="7:42:19 PM" DateTime="2004-12-03T08:42:19.306Z" SessionID="37"><From><User FriendlyName="James:)BeeeeeeeeeeeeW!"/></From><To><User FriendlyName="*HeAtH*"/></To><Text Style="font-family:Comic Sans MS; font-weight:bold; color:#000080; ">noooop</Text></Message><Message Date="3/12/2004" Time="7:42:19 PM" DateTime="2004-12-03T08:42:19.937Z" SessionID="37"><From><User FriendlyName="James:)BeeeeeeeeeeeeW!"/></From><To><User FriendlyName="*HeAtH*"/></To><Text Style="font-family:Comic Sans MS; font-weight:bold; color:#000080; ">eu</Text></Message><Message Date="3/12/2004" Time="7:42:55 PM" DateTime="2004-12-03T08:42:55.278Z" SessionID="37"><From><User FriendlyName="*HeAtH*"/></From><To><User FriendlyName="James:)BeeeeeeeeeeeeW!"/></To><Text Style="font-family:Arial; font-weight:bold; color:#000000; ">um...matt said its 10:30 game b there at 9:30</Text></Message><Message Date="3/12/2004" Time="7:43:43 PM" DateTime="2004-12-03T08:43:43.728Z" SessionID="37"><From><User FriendlyName="*HeAtH*"/></From><To><User FriendlyName="James:)BeeeeeeeeeeeeW!"/></To><Text Style="font-family:Arial; font-weight:bold; color:#000000; ">i think its a home game</Text></Message><Message Date="3/12/2004" Time="7:43:51 PM" DateTime="2004-12-03T08:43:51.449Z" SessionID="37"><From><User FriendlyName="James:)BeeeeeeeeeeeeW!"/></From><To><User FriendlyName="*HeAtH*"/></To><Text Style="font-family:Comic Sans MS; font-weight:bold; color:#000080; ">ok sweet</Text></Message><Message Date="3/12/2004" Time="7:43:59 PM" DateTime="2004-12-03T08:43:59.030Z" SessionID="37"><From><User FriendlyName="*HeAtH*"/></From><To><User FriendlyName="James:)BeeeeeeeeeeeeW!"/></To><Text Style="font-family:Arial; font-weight:bold; color:#000000; ">tell radus</Text></Message><Message Date="4/12/2004" Time="8:22:01 AM" DateTime="2004-12-03T21:22:01.150Z" SessionID="38"><From><User FriendlyName="*HeAtH*"/></From><To><User FriendlyName="James:)I have Lots of Ram, BOOOYAH!!!!!"/></To><Text Style="font-family:Arial; font-weight:bold; color:#000000; ">hey</Text></Message><Message Date="4/12/2004" Time="2:15:13 PM" DateTime="2004-12-04T03:15:13.811Z" SessionID="39"><From><User FriendlyName="*HeAtH*"/></From><To><User FriendlyName="James:)I have Lots of Ram, BOOOYAH!!!!!"/></To><Text Style="font-family:Arial; font-weight:bold; color:#000000; ">HEY</Text></Message><Message Date="9/12/2004" Time="7:38:34 PM" DateTime="2004-12-09T08:38:34.680Z" SessionID="40"><From><User FriendlyName="James *-)Fly me to the moon, and let me play among the star.Let me see what spring is like on Jupitar and Mars,,,,"/></From><To><User FriendlyName="*HeAtH*"/></To><Text Style="font-family:Comic Sans MS; font-weight:bold; color:#000080; ">Hay heath U where kicking crap all over nikki Hay...</Text></Message><Message Date="9/12/2004" Time="7:38:51 PM" DateTime="2004-12-09T08:38:51.564Z" SessionID="41"><From><User FriendlyName="*HeAtH*"/></From><To><User FriendlyName="James *-)Fly me to the moon, and let me play among the star.Let me see what spring is like on Jupitar and Mars,,,,"/></To><Text Style="font-family:Arial; font-weight:bold; color:#000000; ">bit why</Text></Message><Message Date="9/12/2004" Time="7:39:07 PM" DateTime="2004-12-09T08:39:07.517Z" SessionID="41"><From><User FriendlyName="James *-)Fly me to the moon, and let me play among the star.Let me see what spring is like on Jupitar and Mars,,,,"/></From><To><User FriendlyName="*HeAtH*"/></To><Text Style="font-family:Comic Sans MS; font-weight:bold; color:#000080; ">k</Text></Message><Message Date="9/12/2004" Time="7:39:19 PM" DateTime="2004-12-09T08:39:19.334Z" SessionID="41"><From><User FriendlyName="James *-)Fly me to the moon, and let me play among the star.Let me see what spring is like on Jupitar and Mars,,,,"/></From><To><User FriendlyName="*HeAtH*"/></To><Text Style="font-family:Comic Sans MS; font-weight:bold; color:#000080; ">cuz she sed thats why she threw crap all over daniel</Text></Message><Message Date="10/12/2004" Time="8:47:24 PM" DateTime="2004-12-10T09:47:24.013Z" SessionID="42"><From><User FriendlyName="*HeAtH*"/></From><To><User FriendlyName="James *-)Fly me to the moon, and let me play among the star.Let me see what spring is like on Jupitar and Mars..."/></To><Text Style="font-family:Arial; font-weight:bold; color:#000000; ">come back in</Text></Message><Invitation Date="10/12/2004" Time="8:47:33 PM" DateTime="2004-12-10T09:47:33.827Z" SessionID="42"><From><User FriendlyName="*HeAtH*"/></From><Application>an audio conversation</Application><Text Style="color:#545454; ">*HeAtH* is inviting you to start an audio conversation. Do you want to Accept (Alt+C) or Decline (Alt+D) the invitation?</Text></Invitation><InvitationResponse Date="10/12/2004" Time="8:48:26 PM" DateTime="2004-12-10T09:48:26.072Z" SessionID="42"><From><User FriendlyName="*HeAtH*"/></From><Application>an audio conversation</Application><Text Style="color:#800000; ">*HeAtH* has canceled the invitation to start an audio conversation.</Text></InvitationResponse><Invitation Date="10/12/2004" Time="8:48:52 PM" DateTime="2004-12-10T09:48:52.561Z" SessionID="42"><From><User FriendlyName="*HeAtH*"/></From><Application>an audio conversation</Application><Text Style="color:#545454; ">*HeAtH* is inviting you to start an audio conversation. Do you want to Accept (Alt+C) or Decline (Alt+D) the invitation?</Text></Invitation><InvitationResponse Date="10/12/2004" Time="8:49:28 PM" DateTime="2004-12-10T09:49:28.422Z" SessionID="42"><From><User FriendlyName="*HeAtH*"/></From><Application>an audio conversation</Application><Text Style="color:#800000; ">You have declined the invitation to start an audio conversation.</Text></InvitationResponse><Message Date="10/12/2004" Time="8:49:33 PM" DateTime="2004-12-10T09:49:33.049Z" SessionID="42"><From><User FriendlyName="*