<?xml version="1.0"?>
<?xml-stylesheet type='text/xsl' href='MessageLog.xsl'?>
<Log FirstSessionID="639" LastSessionID="1317"><Message Date="21/10/2006" Time="5:52:27 PM" DateTime="2006-10-21T07:52:27.234Z" SessionID="639"><From><User FriendlyName="Jono..."/></From><To><User FriendlyName="- James :)-If you're still in doubt, go knock yourself out..."/></To><Text Style="font-family:Century Gothic; color:#008000; ">soz man</Text></Message><Message Date="21/10/2006" Time="5:52:27 PM" DateTime="2006-10-21T07:52:27.984Z" SessionID="639"><From><User FriendlyName="Jono..."/></From><To><User FriendlyName="- James :)-If you're still in doubt, go knock yourself out..."/></To><Text Style="font-family:Century Gothic; color:#008000; ">im back</Text></Message><Message Date="21/10/2006" Time="5:52:29 PM" DateTime="2006-10-21T07:52:29.250Z" SessionID="639"><From><User FriendlyName="Jono..."/></From><To><User FriendlyName="- James :)-If you're still in doubt, go knock yourself out..."/></To><Text Style="font-family:Century Gothic; color:#008000; ">:P</Text></Message><Message Date="21/10/2006" Time="5:52:36 PM" DateTime="2006-10-21T07:52:36.703Z" SessionID="639"><From><User FriendlyName="Jono..."/></From><To><User FriendlyName="- James :)-If you're still in doubt, go knock yourself out..."/></To><Text Style="font-family:Century Gothic; color:#008000; ">ready for more ra2 makin?</Text></Message><Message Date="21/10/2006" Time="6:14:56 PM" DateTime="2006-10-21T08:14:56.156Z" SessionID="639"><From><User FriendlyName="- James :)-If you're still in doubt, go knock yourself out..."/></From><To><User FriendlyName="I am Thor!"/></To><Text Style="font-family:Microsoft Sans Serif; color:#000000; ">ay</Text></Message><Message Date="21/10/2006" Time="6:29:11 PM" DateTime="2006-10-21T08:29:11.671Z" SessionID="640"><From><User FriendlyName="I am Thor!"/></From><To><User FriendlyName="- James :)-If you're still in doubt, go knock yourself out..."/></To><Text Style="font-family:Century Gothic; color:#008000; ">ha ha</Text></Message><Message Date="21/10/2006" Time="6:29:14 PM" DateTime="2006-10-21T08:29:14.156Z" SessionID="640"><From><User FriendlyName="I am Thor!"/></From><To><User FriendlyName="- James :)-If you're still in doubt, go knock yourself out..."/></To><Text Style="font-family:Century Gothic; color:#008000; ">computer prob again?</Text></Message><Message Date="21/10/2006" Time="6:29:27 PM" DateTime="2006-10-21T08:29:27.593Z" SessionID="640"><From><User FriendlyName="- James :)-If you're still in doubt, go knock yourself out..."/></From><To><User FriendlyName="I am Thor!"/></To><Text Style="font-family:Microsoft Sans Serif; color:#000000; ">I tried 2 alt tab as it was loading, and I couldnt get out of ra 2... </Text></Message><Message Date="21/10/2006" Time="6:29:29 PM" DateTime="2006-10-21T08:29:29.625Z" SessionID="640"><From><User FriendlyName="- James :)-If you're still in doubt, go knock yourself out..."/></From><To><User FriendlyName="I am Thor!"/></To><Text Style="font-family:Microsoft Sans Serif; color:#000000; ">hmm</Text></Message><Message Date="21/10/2006" Time="6:29:44 PM" DateTime="2006-10-21T08:29:44.125Z" SessionID="640"><From><User FriendlyName="- James :)-If you're still in doubt, go knock yourself out..."/></From><To><User FriendlyName="I am Thor!"/></To><Text Style="font-family:Microsoft Sans Serif; color:#000000; ">Wanna try Wacca again? cuz b4 i couldnt ping u</Text></Message><Message Date="21/10/2006" Time="6:29:45 PM" DateTime="2006-10-21T08:29:45.171Z" SessionID="640"><From><User FriendlyName="- James :)-If you're still in doubt, go knock yourself out..."/></From><To><User FriendlyName="I am Thor!"/></To><Text Style="font-family:Microsoft Sans Serif; color:#000000; ">now I can</Text></Message><Message Date="21/10/2006" Time="6:29:50 PM" DateTime="2006-10-21T08:29:50.390Z" SessionID="640"><From><User FriendlyName="I am Thor!"/></From><To><User FriendlyName="- James :)-If you're still in doubt, go knock yourself out..."/></To><Text Style="font-family:Century Gothic; color:#008000; ">kk</Text></Message><Message Date="21/10/2006" Time="6:30:30 PM" DateTime="2006-10-21T08:30:30.875Z" SessionID="640"><From><User FriendlyName="- James :)-If you're still in doubt, go knock yourself out..."/></From><To><User FriendlyName="I am Thor!"/></To><Text Style="font-family:Microsoft Sans Serif; color:#000000; ">I mades a game</Text></Message><Message Date="21/10/2006" Time="6:56:52 PM" DateTime="2006-10-21T08:56:52.125Z" SessionID="640"><From><User FriendlyName="- James :)-If you're still in doubt, go knock yourself out..."/></From><To><User FriendlyName="I am Thor!"/></To><Text Style="font-family:Microsoft Sans Serif; color:#000000; ">Hay JP</Text></Message><Message Date="21/10/2006" Time="6:56:59 PM" DateTime="2006-10-21T08:56:59.500Z" SessionID="640"><From><User FriendlyName="I am Thor!"/></From><To><User FriendlyName="- James :)-If you're still in doubt, go knock yourself out..."/></To><Text Style="font-family:Century Gothic; color:#008000; ">yea?</Text></Message><Message Date="21/10/2006" Time="6:57:01 PM" DateTime="2006-10-21T08:57:01.015Z" SessionID="640"><From><User FriendlyName="- James :)-If you're still in doubt, go knock yourself out..."/></From><To><User FriendlyName="I am Thor!"/></To><Text Style="font-family:Microsoft Sans Serif; color:#000000; ">I gotta go get some indian food ay</Text></Message><Message Date="21/10/2006" Time="6:57:05 PM" DateTime="2006-10-21T08:57:05.156Z" SessionID="640"><From><User FriendlyName="- James :)-If you're still in doubt, go knock yourself out..."/></From><To><User FriendlyName="I am Thor!"/></To><Text Style="font-family:Microsoft Sans Serif; color:#000000; ">Down the 'Nali</Text></Message><Message Date="21/10/2006" Time="6:57:05 PM" DateTime="2006-10-21T08:57:05.515Z" SessionID="640"><From><User FriendlyName="I am Thor!"/></From><To><User FriendlyName="- James :)-If you're still in doubt, go knock yourself out..."/></To><Text Style="font-family:Century Gothic; color:#008000; ">ha ha</Text></Message><Message Date="21/10/2006" Time="6:57:09 PM" DateTime="2006-10-21T08:57:09.671Z" SessionID="640"><From><User FriendlyName="I am Thor!"/></From><To><User FriendlyName="- James :)-If you're still in doubt, go knock yourself out..."/></To><Text Style="font-family:Century Gothic; color:#008000; ">alrighty man</Text></Message><Message Date="21/10/2006" Time="6:57:12 PM" DateTime="2006-10-21T08:57:12.421Z" SessionID="640"><From><User FriendlyName="I am Thor!"/></From><To><User FriendlyName="- James :)-If you're still in doubt, go knock yourself out..."/></To><Text Style="font-family:Century Gothic; color:#008000; ">i pwned u!</Text></Message><Message Date="21/10/2006" Time="6:57:17 PM" DateTime="2006-10-21T08:57:17.531Z" SessionID="640"><From><User FriendlyName="I am Thor!"/></From><To><User FriendlyName="- James :)-If you're still in doubt, go knock yourself out..."/></To><Text Style="font-family:Century Gothic; color:#008000; ">wait</Text></Message><Message Date="21/10/2006" Time="6:57:17 PM" DateTime="2006-10-21T08:57:17.906Z" SessionID="640"><From><User FriendlyName="- James :)-If you're still in doubt, go knock yourself out..."/></From><To><User FriendlyName="I am Thor!"/></To><Text Style="font-family:Microsoft Sans Serif; color:#000000; ">lol I dont know that game</Text></Message><Message Date="21/10/2006" Time="6:57:21 PM" DateTime="2006-10-21T08:57:21.375Z" SessionID="640"><From><User FriendlyName="I am Thor!"/></From><To><User FriendlyName="- James :)-If you're still in doubt, go knock yourself out..."/></To><Text Style="font-family:Century Gothic; color:#008000; ">i wanna finish u off</Text></Message><Message Date="21/10/2006" Time="6:57:25 PM" DateTime="2006-10-21T08:57:25.187Z" SessionID="640"><From><User FriendlyName="- James :)-If you're still in doubt, go knock yourself out..."/></From><To><User FriendlyName="I am Thor!"/></To><Text Style="font-family:Microsoft Sans Serif; color:#000000; ">good for u:P</Text></Message><Message Date="21/10/2006" Time="6:57:32 PM" DateTime="2006-10-21T08:57:32.062Z" SessionID="640"><From><User FriendlyName="- James :)-If you're still in doubt, go knock yourself out..."/></From><To><User FriendlyName="I am Thor!"/></To><Text Style="font-family:Microsoft Sans Serif; color:#000000; ">Im gonner go grab some food and watch the last 3 eps of house</Text></Message><Message Date="21/10/2006" Time="6:57:40 PM" DateTime="2006-10-21T08:57:40.015Z" SessionID="640"><From><User FriendlyName="- James :)-If you're still in doubt, go knock yourself out..."/></From><To><User FriendlyName="I am Thor!"/></To><Text Style="font-family:Microsoft Sans Serif; color:#000000; ">I might be back in like 2 hours or so..</Text></Message><Message Date="21/10/2006" Time="6:57:42 PM" DateTime="2006-10-21T08:57:42.265Z" SessionID="640"><From><User FriendlyName="- James :)-If you're still in doubt, go knock yourself out..."/></From><To><User FriendlyName="I am Thor!"/></To><Text Style="font-family:Microsoft Sans Serif; color:#000000; ">maybe 3:P</Text></Message><Message Date="21/10/2006" Time="6:57:47 PM" DateTime="2006-10-21T08:57:47.656Z" SessionID="640"><From><User FriendlyName="- James :)-If you're still in doubt, go knock yourself out..."/></From><To><User FriendlyName="I am Thor!"/></To><Text Style="font-family:Microsoft Sans Serif; color:#000000; ">If ur still up for some wacca or somefin</Text></Message><Message Date="21/10/2006" Time="6:58:32 PM" DateTime="2006-10-21T08:58:32.484Z" SessionID="641"><From><User FriendlyName="I am Thor!"/></From><To><User FriendlyName="- James :)-If you're still in doubt, go knock yourself out..."/></To><Text Style="font-family:Century Gothic; color:#008000; ">im goin to nikkis soon:D</Text></Message><Message Date="21/10/2006" Time="6:58:38 PM" DateTime="2006-10-21T08:58:38.593Z" SessionID="641"><From><User FriendlyName="I am Thor!"/></From><To><User FriendlyName="- James :)-If you're still in doubt, go knock yourself out..."/></To><Text Style="font-family:Century Gothic; color:#008000; ">so mayb if i get home earlier</Text></Message><Message Date="21/10/2006" Time="6:58:48 PM" DateTime="2006-10-21T08:58:48.171Z" SessionID="641"><From><User FriendlyName="I am Thor!"/></From><To><User FriendlyName="- James :)-If you're still in doubt, go knock yourself out..."/></To><Text Style="font-family:Century Gothic; color:#008000; ">if we play that game again ill let u in on a secret</Text></Message><Message Date="21/10/2006" Time="6:58:49 PM" DateTime="2006-10-21T08:58:49.421Z" SessionID="641"><From><User FriendlyName="I am Thor!"/></From><To><User FriendlyName="- James :)-If you're still in doubt, go knock yourself out..."/></To><Text Style="font-family:Century Gothic; color:#008000; ">:P</Text></Message><Message Date="21/10/2006" Time="6:59:43 PM" DateTime="2006-10-21T08:59:43.437Z" SessionID="641"><From><User FriendlyName="- James :)-If you're still in doubt, go knock yourself out..."/></From><To><User FriendlyName="I am Thor!"/></To><Text Style="font-family:Microsoft Sans Serif; color:#000000; ">lol, secret</Text></Message><Message Date="21/10/2006" Time="6:59:46 PM" DateTime="2006-10-21T08:59:46.921Z" SessionID="641"><From><User FriendlyName="- James :)-If you're still in doubt, go knock yourself out..."/></From><To><User FriendlyName="I am Thor!"/></To><Text Style="font-family:Microsoft Sans Serif; color:#000000; ">MORE LIKE CHEATCRET</Text></Message><Message Date="23/10/2006" Time="9:02:01 PM" DateTime="2006-10-23T11:02:01.468Z" SessionID="642"><From><User FriendlyName="I am Jonathan..."/></From><To><User FriendlyName="- James :)-Holding my thoughts in my Heart..."/></To><Text Style="font-family:Comic Sans MS; color:#008000; ">jimmeh a questionio</Text></Message><Message Date="23/10/2006" Time="9:02:08 PM" DateTime="2006-10-23T11:02:08.140Z" SessionID="642"><From><User FriendlyName="- James :)-Holding my thoughts in my Heart..."/></From><To><User FriendlyName="I am Jonathan..."/></To><Text Style="font-family:Microsoft Sans Serif; color:#000000; ">Sure thing</Text></Message><Message Date="23/10/2006" Time="9:02:17 PM" DateTime="2006-10-23T11:02:17.828Z" SessionID="642"><From><User FriendlyName="I am Jonathan..."/></From><To><User FriendlyName="- James :)-Holding my thoughts in my Heart..."/></To><Text Style="font-family:Comic Sans MS; color:#008000; ">how did u split the string in tha romannumeral thing</Text></Message><Message Date="23/10/2006" Time="9:02:36 PM" DateTime="2006-10-23T11:02:36.734Z" SessionID="642"><From><User FriendlyName="- James :)-Holding my thoughts in my Heart..."/></From><To><User FriendlyName="I am Jonathan..."/></To><Text Style="font-family:Microsoft Sans Serif; color:#000000; ">well it tok my quite a few periods of work</Text></Message><Message Date="23/10/2006" Time="9:02:48 PM" DateTime="2006-10-23T11:02:48.250Z" SessionID="643"><From><User FriendlyName="I am Jonathan..."/></From><To><User FriendlyName="- James :)-Holding my thoughts in my Heart..."/></To><Text Style="font-family:Comic Sans MS; color:#008000; ">was it brute force?</Text></Message><Message Date="23/10/2006" Time="9:02:53 PM" DateTime="2006-10-23T11:02:53.046Z" SessionID="643"><From><User FriendlyName="- James :)-Holding my thoughts in my Heart..."/></From><To><User FriendlyName="I am Jonathan..."/></To><Text Style="font-family:Microsoft Sans Serif; color:#000000; ">nope</Text></Message><Message Date="23/10/2006" Time="9:02:54 PM" DateTime="2006-10-23T11:02:54.781Z" SessionID="643"><From><User FriendlyName="I am Jonathan..."/></From><To><User FriendlyName="- James :)-Holding my thoughts in my Heart..."/></To><Text Style="font-family:Comic Sans MS; color:#008000; ">or logic?</Text></Message><Message Date="23/10/2006" Time="9:03:00 PM" DateTime="2006-10-23T11:03:00.781Z" SessionID="643"><From><User FriendlyName="- James :)-Holding my thoughts in my Heart..."/></From><To><User FriendlyName="I am Jonathan..."/></To><Text Style="font-family:Microsoft Sans Serif; color:#000000; ">the latter</Text></Message><Message Date="23/10/2006" Time="9:03:15 PM" DateTime="2006-10-23T11:03:15.859Z" SessionID="644"><From><User FriendlyName="I am Jonathan..."/></From><To><User FriendlyName="- James :)-Holding my thoughts in my Heart..."/></To><Text Style="font-family:Comic Sans MS; color:#008000; ">how did u do it</Text></Message><Message Date="23/10/2006" Time="9:03:20 PM" DateTime="2006-10-23T11:03:20.078Z" SessionID="644"><From><User FriendlyName="I am Jonathan..."/></From><To><User FriendlyName="- James :)-Holding my thoughts in my Heart..."/></To><Text Style="font-family:Comic Sans MS; color:#008000; ">i have been trying all arvo</Text></Message><Message Date="23/10/2006" Time="9:03:34 PM" DateTime="2006-10-23T11:03:34.265Z" SessionID="644"><From><User FriendlyName="- James :)-Holding my thoughts in my Heart..."/></From><To><User FriendlyName="I am Jonathan..."/></To><Text Style="font-family:Microsoft Sans Serif; color:#000000; ">haha yeh its tricky</Text></Message><Message Date="23/10/2006" Time="9:03:38 PM" DateTime="2006-10-23T11:03:38.062Z" SessionID="644"><From><User FriendlyName="- James :)-Holding my thoughts in my Heart..."/></From><To><User FriendlyName="I am Jonathan..."/></To><Text Style="font-family:Microsoft Sans Serif; color:#000000; ">sorry I dont have my code on me</Text></Message><Message Date="23/10/2006" Time="9:03:53 PM" DateTime="2006-10-23T11:03:53.359Z" SessionID="644"><From><User FriendlyName="I am Jonathan..."/></From><To><User FriendlyName="- James :)-Holding my thoughts in my Heart..."/></To><Text Style="font-family:Comic Sans MS; color:#008000; ">okay</Text></Message><Message Date="23/10/2006" Time="9:36:27 PM" DateTime="2006-10-23T11:36:27.656Z" SessionID="644"><From><User FriendlyName="- James :)-Holding my thoughts in my Heart..."/></From><To><User FriendlyName="I am Jonathan..."/></To><Text Style="font-family:Microsoft Sans Serif; color:#000000; ">any luck</Text></Message><Message Date="23/10/2006" Time="9:36:44 PM" DateTime="2006-10-23T11:36:44.500Z" SessionID="644"><From><User FriendlyName="I am Jonathan..."/></From><To><User FriendlyName="- James :)-Holding my thoughts in my Heart..."/></To><Text Style="font-family:Comic Sans MS; color:#008000; ">haha not at all</Text></Message><Message Date="23/10/2006" Time="9:36:53 PM" DateTime="2006-10-23T11:36:53.828Z" SessionID="644"><From><User FriendlyName="I am Jonathan..."/></From><To><User FriendlyName="- James :)-Holding my thoughts in my Heart..."/></To><Text Style="font-family:Comic Sans MS; color:#008000; ">i aint got the slightest clue wat to do</Text></Message><Message Date="23/10/2006" Time="9:38:14 PM" DateTime="2006-10-23T11:38:14.640Z" SessionID="644"><From><User FriendlyName="- James :)-Holding my thoughts in my Heart..."/></From><To><User FriendlyName="I am Jonathan..."/></To><Text Style="font-family:Microsoft Sans Serif; color:#000000; ">still working on it?</Text></Message><Message Date="23/10/2006" Time="9:38:25 PM" DateTime="2006-10-23T11:38:25.031Z" SessionID="644"><From><User FriendlyName="I am Jonathan..."/></From><To><User FriendlyName="- James :)-Holding my thoughts in my Heart..."/></To><Text Style="font-family:Comic Sans MS; color:#008000; ">watd u do</Text></Message><Message Date="23/10/2006" Time="9:38:25 PM" DateTime="2006-10-23T11:38:25.062Z" SessionID="644"><From><User FriendlyName="I am Jonathan..."/></From><To><User FriendlyName="- James :)-Holding my thoughts in my Heart..."/></To><Text Style="font-family:Comic Sans MS; color:#008000; ">i tried everything i could think off</Text></Message><Message Date="23/10/2006" Time="9:38:26 PM" DateTime="2006-10-23T11:38:26.031Z" SessionID="644"><From><User FriendlyName="I am Jonathan..."/></From><To><User FriendlyName="- James :)-Holding my thoughts in my Heart..."/></To><Text Style="font-family:Comic Sans MS; color:#008000; ">i even tried the net</Text></Message><Message Date="23/10/2006" Time="9:38:28 PM" DateTime="2006-10-23T11:38:28.812Z" SessionID="644"><From><User FriendlyName="I am Jonathan..."/></From><To><User FriendlyName="- James :)-Holding my thoughts in my Heart..."/></To><Text Style="font-family:Comic Sans MS; color:#008000; ">yea</Text></Message><Message Date="23/10/2006" Time="9:39:19 PM" DateTime="2006-10-23T11:39:19.203Z" SessionID="644"><From><User FriendlyName="- James :)-Holding my thoughts in my Heart..."/></From><To><User FriendlyName="I am Jonathan..."/></To><Text Style="font-family:Microsoft Sans Serif; color:#000000; ">had a raw input before the Function</Text></Message><Message Date="23/10/2006" Time="9:39:28 PM" DateTime="2006-10-23T11:39:28.750Z" SessionID="644"><From><User FriendlyName="- James :)-Holding my thoughts in my Heart..."/></From><To><User FriendlyName="I am Jonathan..."/></To><Text Style="font-family:Microsoft Sans Serif; color:#000000; ">I'll show u 2moz</Text></Message><Message Date="23/10/2006" Time="9:39:38 PM" DateTime="2006-10-23T11:39:38.421Z" SessionID="645"><From><User FriendlyName="I am Jonathan..."/></From><To><User FriendlyName="- James :)-Holding my thoughts in my Heart..."/></To><Text Style="font-family:Comic Sans MS; color:#008000; ">kk</Text></Message><Message Date="23/10/2006" Time="9:41:25 PM" DateTime="2006-10-23T11:41:25.468Z" SessionID="645"><From><User FriendlyName="- James :)-Holding my thoughts in my Heart..."/></From><To><User FriendlyName="I am Jonathan..."/></To><Text Style="font-family:Microsoft Sans Serif; color:#000000; ">haha Speaking of pythong.. Im downloading a program atm that lets u rip all legally bought music from itunes</Text></Message><Message Date="23/10/2006" Time="9:41:39 PM" DateTime="2006-10-23T11:41:39.156Z" SessionID="645"><From><User FriendlyName="I am Jonathan..."/></From><To><User FriendlyName="- James :)-Holding my thoughts in my Heart..."/></To><Text Style="font-family:Comic Sans MS; color:#008000; ">ha ha awsome</Text></Message><Message Date="24/10/2006" Time="4:12:45 PM" DateTime="2006-10-24T06:12:45.062Z" SessionID="646"><From><User FriendlyName="I am Jonathan..."/></From><To><User FriendlyName="- James :)-Holding my thoughts in my Heart..."/></To><Text Style="font-family:Comic Sans MS; color:#008000; ">jimmeh do u have that roman numerals code?</Text></Message><Message Date="24/10/2006" Time="4:12:52 PM" DateTime="2006-10-24T06:12:52.859Z" SessionID="646"><From><User FriendlyName="- James :)-Holding my thoughts in my Heart..."/></From><To><User FriendlyName="I am Jonathan..."/></To><Text Style="font-family:Microsoft Sans Serif; color:#000000; ">Nyah</Text></Message><Message Date="24/10/2006" Time="4:13:02 PM" DateTime="2006-10-24T06:13:02.296Z" SessionID="647"><From><User FriendlyName="I am Jonathan..."/></From><To><User FriendlyName="- James :)-Holding my thoughts in my Heart..."/></To><Text Style="font-family:Comic Sans MS; color:#008000; ">wat is it??</Text></Message><Message Date="24/10/2006" Time="4:13:04 PM" DateTime="2006-10-24T06:13:04.531Z" SessionID="647"><From><User FriendlyName="I am Jonathan..."/></From><To><User FriendlyName="- James :)-Holding my thoughts in my Heart..."/></To><Text Style="font-family:Comic Sans MS; color:#008000; ">nah or yah?</Text></Message><Message Date="24/10/2006" Time="4:13:39 PM" DateTime="2006-10-24T06:13:39.375Z" SessionID="647"><From><User FriendlyName="- James :)-Holding my thoughts in my Heart..."/></From><To><User FriendlyName="I am Jonathan..."/></To><Text Style="font-family:Microsoft Sans Serif; color:#000000; ">na</Text></Message><Message Date="24/10/2006" Time="4:13:44 PM" DateTime="2006-10-24T06:13:44.156Z" SessionID="648"><From><User FriendlyName="I am Jonathan..."/></From><To><User FriendlyName="- James :)-Holding my thoughts in my Heart..."/></To><Text Style="font-family:Comic Sans MS; color:#008000; ">kk</Text></Message><Message Date="26/10/2006" Time="4:55:36 PM" DateTime="2006-10-26T06:55:36.671Z" SessionID="649"><From><User FriendlyName="I am Jonathan..."/></From><To><User FriendlyName="- James :)-Holding my thoughts in my Heart..."/></To><Text Style="font-family:Comic Sans MS; color:#008000; ">jimmeh?</Text></Message><Message Date="26/10/2006" Time="4:56:32 PM" DateTime="2006-10-26T06:56:32.234Z" SessionID="649"><From><User FriendlyName="- James :)-Holding my thoughts in my Heart..."/></From><To><User FriendlyName="I am Jonathan..."/></To><Text Style="font-family:Microsoft Sans Serif; color:#000000; ">yah</Text></Message><Message Date="26/10/2006" Time="4:57:03 PM" DateTime="2006-10-26T06:57:03.812Z" SessionID="649"><From><User FriendlyName="- James :)-Holding my thoughts in my Heart..."/></From><To><User FriendlyName="I am Jonathan..."/></To><Text Style="font-family:Microsoft Sans Serif; color:#000000; ">send us wen ur ready</Text></Message><Invitation Date="26/10/2006" Time="4:57:31 PM" DateTime="2006-10-26T06:57:31.515Z" SessionID="650"><From><User FriendlyName="I am Jonathan..."/></From><File>hangman.py.py</File><Text Style="color:#545454; ">I am Jonathan... sends hangman.py.py</Text></Invitation><InvitationResponse Date="26/10/2006" Time="4:57:41 PM" DateTime="2006-10-26T06:57:41.250Z" SessionID="650"><From><User FriendlyName="I am Jonathan..."/></From><File>C:\Documents and Settings\James\My Documents\My Received Files\hangman.py.py</File><Text Style="color:#545454; ">You have successfully received C:\Documents and Settings\James\My Documents\My Received Files\hangman.py.py from I am Jonathan....</Text></InvitationResponse><Message Date="26/10/2006" Time="4:59:02 PM" DateTime="2006-10-26T06:59:02.671Z" SessionID="650"><From><User FriendlyName="- James :)-Holding my thoughts in my Heart..."/></From><To><User FriendlyName="I am Jonathan..."/></To><Text Style="font-family:Microsoft Sans Serif; color:#000000; ">so wat do u want it 2 do</Text></Message><Message Date="26/10/2006" Time="4:59:23 PM" DateTime="2006-10-26T06:59:23.484Z" SessionID="650"><From><User FriendlyName="I am Jonathan..."/></From><To><User FriendlyName="- James :)-Holding my thoughts in my Heart..."/></To><Text Style="font-family:Comic Sans MS; color:#008000; ">to validate the fricken thing</Text></Message><Message Date="26/10/2006" Time="4:59:36 PM" DateTime="2006-10-26T06:59:36.015Z" SessionID="650"><From><User FriendlyName="I am Jonathan..."/></From><To><User FriendlyName="- James :)-Holding my thoughts in my Heart..."/></To><Text Style="font-family:Comic Sans MS; color:#008000; ">and when u start losing the pic screws up:S</Text></Message><Message Date="27/10/2006" Time="3:16:39 PM" DateTime="2006-10-27T05:16:39.086Z" SessionID="651"><From><User FriendlyName="- James :)-Holding my thoughts in my Heart..."/></From><To><User FriendlyName="I am Jonathan..."/></To><Text Style="font-family:Microsoft Sans Serif; color:#000000; ">Hay jp</Text></Message><Message Date="27/10/2006" Time="3:19:20 PM" DateTime="2006-10-27T05:19:20.570Z" SessionID="652"><From><User FriendlyName="I am Jonathan..."/></From><To><User FriendlyName="- James :)-Holding my thoughts in my Heart..."/></To><Text Style="font-family:Comic Sans MS; color:#008000; ">hey man</Text></Message><Message Date="27/10/2006" Time="3:19:49 PM" DateTime="2006-10-27T05:19:49.664Z" SessionID="652"><From><User FriendlyName="- James :)-Holding my thoughts in my Heart..."/></From><To><User FriendlyName="I am Jonathan..."/></To><Text Style="font-family:Microsoft Sans Serif; color:#000000; ">get ur ET working</Text></Message><Message Date="27/10/2006" Time="3:19:53 PM" DateTime="2006-10-27T05:19:53.008Z" SessionID="652"><From><User FriendlyName="- James :)-Holding my thoughts in my Heart..."/></From><To><User FriendlyName="I am Jonathan..."/></To><Text Style="font-family:Microsoft Sans Serif; color:#000000; ">i think I no wats wrong</Text></Message><Message Date="27/10/2006" Time="3:20:01 PM" DateTime="2006-10-27T05:20:01.180Z" SessionID="652"><From><User FriendlyName="I am Jonathan..."/></From><To><User FriendlyName="- James :)-Holding my thoughts in my Heart..."/></To><Text Style="font-family:Comic Sans MS; color:#008000; ">na still broken</Text></Message><Message Date="27/10/2006" Time="3:20:06 PM" DateTime="2006-10-27T05:20:06.977Z" SessionID="652"><From><User FriendlyName="- James :)-Holding my thoughts in my Heart..."/></From><To><User FriendlyName="I am Jonathan..."/></To><Text Style="font-family:Microsoft Sans Serif; color:#000000; ">Try hosting ur own LAN server...</Text></Message><Message Date="27/10/2006" Time="3:20:12 PM" DateTime="2006-10-27T05:20:12.258Z" SessionID="652"><From><User FriendlyName="I am Jonathan..."/></From><To><User FriendlyName="- James :)-Holding my thoughts in my Heart..."/></To><Text Style="font-family:Comic Sans MS; color:#008000; ">give me 5</Text></Message><Message Date="27/10/2006" Time="3:20:14 PM" DateTime="2006-10-27T05:20:14.383Z" SessionID="652"><From><User FriendlyName="- James :)-Holding my thoughts in my Heart..."/></From><To><User FriendlyName="I am Jonathan..."/></To><Text Style="font-family:Microsoft Sans Serif; color:#000000; ">tell me wat happens</Text></Message><Message Date="27/10/2006" Time="3:20:17 PM" DateTime="2006-10-27T05:20:17.258Z" SessionID="652"><From><User FriendlyName="- James :)-Holding my thoughts in my Heart..."/></From><To><User FriendlyName="I am Jonathan..."/></To><Text Style="font-family:Microsoft Sans Serif; color:#000000; ">sure wen ur rdy</Text></Message><Message Date="27/10/2006" Time="3:20:19 PM" DateTime="2006-10-27T05:20:19.008Z" SessionID="653"><From><User FriendlyName="I am Jonathan..."/></From><To><User FriendlyName="- James :)-Holding my thoughts in my Heart..."/></To><Text Style="font-family:Comic Sans MS; color:#008000; ">in mid of wacca</Text></Message><Message Date="27/10/2006" Time="3:20:22 PM" DateTime="2006-10-27T05:20:22.711Z" SessionID="653"><From><User FriendlyName="- James :)-Holding my thoughts in my Heart..."/></From><To><User FriendlyName="I am Jonathan..."/></To><Text Style="font-family:Microsoft Sans Serif; color:#000000; ">hah</Text></Message><Message Date="27/10/2006" Time="3:20:24 PM" DateTime="2006-10-27T05:20:24.492Z" SessionID="653"><From><User FriendlyName="- James :)-Holding my thoughts in my Heart..."/></From><To><User FriendlyName="I am Jonathan..."/></To><Text Style="font-family:Microsoft Sans Serif; color:#000000; ">wat map</Text></Message><Message Date="27/10/2006" Time="3:21:02 PM" DateTime="2006-10-27T05:21:02.258Z" SessionID="653"><From><User FriendlyName="I am Jonathan..."/></From><To><User FriendlyName="- James :)-Holding my thoughts in my Heart..."/></To><Text Style="font-family:Comic Sans MS; color:#008000; ">footy</Text></Message><Message Date="27/10/2006" Time="3:21:03 PM" DateTime="2006-10-27T05:21:03.398Z" SessionID="653"><From><User FriendlyName="I am Jonathan..."/></From><To><User FriendlyName="- James :)-Holding my thoughts in my Heart..."/></To><Text Style="font-family:Comic Sans MS; color:#008000; ">:S</Text></Message><Message Date="27/10/2006" Time="3:21:05 PM" DateTime="2006-10-27T05:21:05.320Z" SessionID="653"><From><User FriendlyName="I am Jonathan..."/></From><To><User FriendlyName="- James :)-Holding my thoughts in my Heart..."/></To><Text Style="font-family:Comic Sans MS; color:#008000; ">only one up</Text></Message><Message Date="27/10/2006" Time="3:21:58 PM" DateTime="2006-10-27T05:21:58.977Z" SessionID="653"><From><User FriendlyName="I am Jonathan..."/></From><To><User FriendlyName="- James :)-Holding my thoughts in my Heart..."/></To><Text Style="font-family:Comic Sans MS; color:#008000; ">okay so wat i do</Text></Message><Message Date="27/10/2006" Time="3:22:01 PM" DateTime="2006-10-27T05:22:01.008Z" SessionID="653"><From><User FriendlyName="I am Jonathan..."/></From><To><User FriendlyName="- James :)-Holding my thoughts in my Heart..."/></To><Text Style="font-family:Comic Sans MS; color:#008000; ">howst lan</Text></Message><Message Date="27/10/2006" Time="3:23:29 PM" DateTime="2006-10-27T05:23:29.555Z" SessionID="653"><From><User FriendlyName="I am Jonathan..."/></From><To><User FriendlyName="- James :)-Holding my thoughts in my Heart..."/></To><Text Style="font-family:Comic Sans MS; color:#008000; ">its working</Text></Message><Message Date="27/10/2006" Time="3:23:59 PM" DateTime="2006-10-27T05:23:59.914Z" SessionID="653"><From><User FriendlyName="- James :)-Holding my thoughts in my Heart..."/></From><To><User FriendlyName="I am Jonathan..."/></To><Text Style="font-family:Microsoft Sans Serif; color:#000000; ">Cuz AI cant host a lan game...</Text></Message><Message Date="27/10/2006" Time="3:24:03 PM" DateTime="2006-10-27T05:24:03.695Z" SessionID="653"><From><User FriendlyName="- James :)-Holding my thoughts in my Heart..."/></From><To><User FriendlyName="I am Jonathan..."/></To><Text Style="font-family:Microsoft Sans Serif; color:#000000; ">i</Text></Message><Message Date="27/10/2006" Time="3:24:15 PM" DateTime="2006-10-27T05:24:15.148Z" SessionID="653"><From><User FriendlyName="I am Jonathan..."/></From><To><User FriendlyName="- James :)-Holding my thoughts in my Heart..."/></To><Text Style="font-family:Comic Sans MS; color:#008000; ">hmmm.</Text></Message><Message Date="27/10/2006" Time="3:24:16 PM" DateTime="2006-10-27T05:24:16.367Z" SessionID="653"><From><User FriendlyName="- James :)-Holding my thoughts in my Heart..."/></From><To><User FriendlyName="I am Jonathan..."/></To><Text Style="font-family:Microsoft Sans Serif; color:#000000; ">it comes up with missing solder axis file or something</Text></Message><Message Date="27/10/2006" Time="3:24:45 PM" DateTime="2006-10-27T05:24:45.273Z" SessionID="653"><From><User FriendlyName="I am Jonathan..."/></From><To><User FriendlyName="- James :)-Holding my thoughts in my Heart..."/></To><Text Style="font-family:Comic Sans MS; color:#008000; ">well mine works</Text></Message><Message Date="27/10/2006" Time="3:24:49 PM" DateTime="2006-10-27T05:24:49.664Z" SessionID="653"><From><User FriendlyName="- James :)-Holding my thoughts in my Heart..."/></From><To><User FriendlyName="I am Jonathan..."/></To><Text Style="font-family:Microsoft Sans Serif; color:#000000; ">hmm</Text></Message><Message Date="27/10/2006" Time="3:25:34 PM" DateTime="2006-10-27T05:25:34.367Z" SessionID="653"><From><User FriendlyName="I am Jonathan..."/></From><To><User FriendlyName="- James :)-Holding my thoughts in my Heart..."/></To><Text Style="font-family:Comic Sans MS; color:#008000; ">but i still cant get into normal games</Text></Message><Message Date="27/10/2006" Time="3:25:51 PM" DateTime="2006-10-27T05:25:51.695Z" SessionID="653"><From><User FriendlyName="- James :)-Holding my thoughts in my Heart..."/></From><To><User FriendlyName="I am Jonathan..."/></To><Text Style="font-family:Microsoft Sans Serif; color:#000000; ">hay</Text></Message><Message Date="27/10/2006" Time="3:25:54 PM" DateTime="2006-10-27T05:25:54.055Z" SessionID="653"><From><User FriendlyName="- James :)-Holding my thoughts in my Heart..."/></From><To><User FriendlyName="I am Jonathan..."/></To><Text Style="font-family:Microsoft Sans Serif; color:#000000; ">mine works now too:S</Text></Message><Message Date="27/10/2006" Time="3:26:00 PM" DateTime="2006-10-27T05:26:00.992Z" SessionID="653"><From><User FriendlyName="I am Jonathan..."/></From><To><User FriendlyName="- James :)-Holding my thoughts in my Heart..."/></To><Text Style="font-family:Comic Sans MS; color:#008000; ">lan?</Text></Message><Message Date="27/10/2006" Time="3:26:02 PM" DateTime="2006-10-27T05:26:02.430Z" SessionID="653"><From><User FriendlyName="- James :)-Holding my thoughts in my Heart..."/></From><To><User FriendlyName="I am Jonathan..."/></To><Text Style="font-family:Microsoft Sans Serif; color:#000000; ">Did ur skins have the christmas ones on them</Text></Message><Message Date="27/10/2006" Time="3:26:03 PM" DateTime="2006-10-27T05:26:03.367Z" SessionID="653"><From><User FriendlyName="- James :)-Holding my thoughts in my Heart..."/></From><To><User FriendlyName="I am Jonathan..."/></To><Text Style="font-family:Microsoft Sans Serif; color:#000000; ">ya</Text></Message><Message Date="27/10/2006" Time="3:26:08 PM" DateTime="2006-10-27T05:26:08.320Z" SessionID="653"><From><User FriendlyName="I am Jonathan..."/></From><To><User FriendlyName="- James :)-Holding my thoughts in my Heart..."/></To><Text Style="font-family:Comic Sans MS; color:#008000; ">ha ha yea</Text></Message><Message Date="27/10/2006" Time="3:26:21 PM" DateTime="2006-10-27T05:26:21.320Z" SessionID="653"><From><User FriendlyName="- James :)-Holding my thoughts in my Heart..."/></From><To><User FriendlyName="I am Jonathan..."/></To><Text Style="font-family:Microsoft Sans Serif; color:#000000; ">maybe we played on a server with those skins</Text></Message><Message Date="27/10/2006" Time="3:26:25 PM" DateTime="2006-10-27T05:26:25.633Z" SessionID="653"><From><User FriendlyName="- James :)-Holding my thoughts in my Heart..."/></From><To><User FriendlyName="I am Jonathan..."/></To><Text Style="font-family:Microsoft Sans Serif; color:#000000; ">that dont work online or something?</Text></Message><Message Date="27/10/2006" Time="3:26:44 PM" DateTime="2006-10-27T05:26:44.039Z" SessionID="653"><From><User FriendlyName="I am Jonathan..."/></From><To><User FriendlyName="- James :)-Holding my thoughts in my Heart..."/></To><Text Style="font-family:Comic Sans MS; color:#008000; ">hmm that would explani it</Text></Message><Message Date="27/10/2006" Time="3:27:25 PM" DateTime="2006-10-27T05:27:25.852Z" SessionID="653"><From><User FriendlyName="- James :)-Holding my thoughts in my Heart..."/></From><To><User FriendlyName="I am Jonathan..."/></To><Text Style="font-family:Microsoft Sans Serif; color:#000000; ">just wat is it called...</Text></Message><Message Date="27/10/2006" Time="3:27:35 PM" DateTime="2006-10-27T05:27:35.211Z" SessionID="653"><From><User FriendlyName="I am Jonathan..."/></From><To><User FriendlyName="- James :)-Holding my thoughts in my Heart..."/></To><Text Style="font-family:Comic Sans MS; color:#008000; ">Dunno</Text></Message><Message Date="27/10/2006" Time="3:27:43 PM" DateTime="2006-10-27T05:27:43.461Z" SessionID="653"><From><User FriendlyName="I am Jonathan..."/></From><To><User FriendlyName="- James :)-Holding my thoughts in my Heart..."/></To><Text Style="font-family:Comic Sans MS; color:#008000; ">it happens wen watching replays aswell</Text></Message><Message Date="27/10/2006" Time="3:28:13 PM" DateTime="2006-10-27T05:28:13.852Z" SessionID="653"><From><User FriendlyName="- James :)-Holding my thoughts in my Heart..."/></From><To><User FriendlyName="I am Jonathan..."/></To><Text Style="font-family:Microsoft Sans Serif; color:#000000; ">z_xmas_grinch</Text></Message><Message Date="27/10/2006" Time="3:28:19 PM" DateTime="2006-10-27T05:28:19.477Z" SessionID="653"><From><User FriendlyName="- James :)-Holding my thoughts in my Heart..."/></From><To><User FriendlyName="I am Jonathan..."/></To><Text Style="font-family:Microsoft Sans Serif; color:#000000; ">delete that file</Text></Message><Message Date="27/10/2006" Time="3:28:27 PM" DateTime="2006-10-27T05:28:27.695Z" SessionID="653"><From><User FriendlyName="I am Jonathan..."/></From><To><User FriendlyName="- James :)-Holding my thoughts in my Heart..."/></To><Text Style="font-family:Comic Sans MS; color:#008000; ">u do it and tell me if it works</Text></Message><Message Date="27/10/2006" Time="3:29:06 PM" DateTime="2006-10-27T05:29:06.305Z" SessionID="653"><From><User FriendlyName="- James :)-Holding my thoughts in my Heart..."/></From><To><User FriendlyName="I am Jonathan..."/></To><Text Style="font-family:Microsoft Sans Serif; color:#000000; ">nyah</Text></Message><Message Date="27/10/2006" Time="3:29:19 PM" DateTime="2006-10-27T05:29:19.305Z" SessionID="654"><From><User FriendlyName="I am Jonathan..."/></From><To><User FriendlyName="- James :)-Holding my thoughts in my Heart..."/></To><Text Style="font-family:Comic Sans MS; color:#008000; ">i will omst likely delete sumthin else</Text></Message><Message Date="27/10/2006" Time="3:32:39 PM" DateTime="2006-10-27T05:32:39.617Z" SessionID="655"><From><User FriendlyName="I am Jonathan..."/></From><To><User FriendlyName="- James :)-Holding my thoughts in my Heart..."/></To><Text Style="font-family:Comic Sans MS; color:#008000; ">brb</Text></Message><Message Date="9/11/2006" Time="5:43:52 PM" DateTime="2006-11-09T06:43:52.093Z" SessionID="656"><From><User FriendlyName="I am Jonathan..."/></From><To><User FriendlyName="- James :)-Charmed"/></To><Text Style="font-family:Comic Sans MS; color:#008000; ">jimmeh wats a pdf?</Text></Message><Message Date="9/11/2006" Time="5:47:07 PM" DateTime="2006-11-09T06:47:07.546Z" SessionID="656"><From><User FriendlyName="- James :)-Charmed"/></From><To><User FriendlyName="I am Jonathan..."/></To><Text Style="font-family:Microsoft Sans Serif; color:#000000; ">Like a document but all pretty</Text></Message><Message Date="12/11/2006" Time="12:03:09 PM" DateTime="2006-11-12T01:03:09.414Z" SessionID="657"><From><User FriendlyName="I am Jonathan..."/></From><To><User FriendlyName="- James :)-Charmed"/></To><Text Style="font-family:Comic Sans MS; color:#008000; ">jimmeh can i talk to you wen u get a spare 5 min</Text></Message><Message Date="12/11/2006" Time="12:03:18 PM" DateTime="2006-11-12T01:03:18.898Z" SessionID="657"><From><User FriendlyName="- James :)-Charmed"/></From><To><User FriendlyName="I am Jonathan..."/></To><Text Style="font-family:Microsoft Sans Serif; color:#000000; ">yeh Im free now</Text></Message><Message Date="12/11/2006" Time="12:03:44 PM" DateTime="2006-11-12T01:03:44.383Z" SessionID="657"><From><User FriendlyName="I am Jonathan..."/></From><To><User FriendlyName="- James :)-Charmed"/></To><Text Style="font-family:Comic Sans MS; color:#008000; ">okay with this software thing how do i do it so it is on like A3??</Text></Message><Message Date="12/11/2006" Time="12:03:55 PM" DateTime="2006-11-12T01:03:55.023Z" SessionID="657"><From><User FriendlyName="I am Jonathan..."/></From><To><User FriendlyName="- James :)-Charmed"/></To><Text Style="font-family:Comic Sans MS; color:#008000; ">and how do i take and save screen shots?</Text></Message><Message Date="12/11/2006" Time="12:04:14 PM" DateTime="2006-11-12T01:04:14.586Z" SessionID="657"><From><User FriendlyName="- James :)-Charmed"/></From><To><User FriendlyName="I am Jonathan..."/></To><Text Style="font-family:Microsoft Sans Serif; color:#000000; ">in word, goto file, page setup</Text></Message><Message Date="12/11/2006" Time="12:04:26 PM" DateTime="2006-11-12T01:04:26.242Z" SessionID="657"><From><User FriendlyName="- James :)-Charmed"/></From><To><User FriendlyName="I am Jonathan..."/></To><Text Style="font-family:Microsoft Sans Serif; color:#000000; ">Paper size up the top, choose a3 under paper size..</Text></Message><Message Date="12/11/2006" Time="12:04:50 PM" DateTime="2006-11-12T01:04:50.992Z" SessionID="658"><From><User FriendlyName="I am Jonathan..."/></From><To><User FriendlyName="- James :)-Charmed"/></To><Text Style="font-family:Comic Sans MS; color:#008000; ">i got no a3</Text></Message><Message Date="12/11/2006" Time="12:10:03 PM" DateTime="2006-11-12T01:10:03.398Z" SessionID="658"><From><User FriendlyName="- James :)-Charmed"/></From><To><User FriendlyName="I am Jonathan..."/></To><Text Style="font-family:Microsoft Sans Serif; color:#000000; ">Just set it out on 2 pages...</Text></Message><Message Date="12/11/2006" Time="12:10:40 PM" DateTime="2006-11-12T01:10:40.617Z" SessionID="658"><From><User FriendlyName="I am Jonathan..."/></From><To><User FriendlyName="- James :)-Charmed"/></To><Text Style="font-family:Comic Sans MS; color:#008000; ">okay</Text></Message><Message Date="12/11/2006" Time="12:10:46 PM" DateTime="2006-11-12T01:10:46.367Z" SessionID="658"><From><User FriendlyName="- James :)-Charmed"/></From><To><User FriendlyName="I am Jonathan..."/></To><Text Style="font-family:Microsoft Sans Serif; color:#000000; ">thats wat Im gonner do i think</Text></Message><Message Date="12/11/2006" Time="12:10:52 PM" DateTime="2006-11-12T01:10:52.836Z" SessionID="659"><From><User FriendlyName="I am Jonathan..."/></From><To><User FriendlyName="- James :)-Charmed"/></To><Text Style="font-family:Comic Sans MS; color:#008000; ">and how do i do screen shots and save em?</Text></Message><Message Date="12/11/2006" Time="12:10:59 PM" DateTime="2006-11-12T01:10:59.539Z" SessionID="659"><From><User FriendlyName="- James :)-Charmed"/></From><To><User FriendlyName="I am Jonathan..."/></To><Text Style="font-family:Microsoft Sans Serif; color:#000000; ">Print screen </Text></Message><Message Date="12/11/2006" Time="12:11:01 PM" DateTime="2006-11-12T01:11:01.586Z" SessionID="659"><From><User FriendlyName="- James :)-Charmed"/></From><To><User FriendlyName="I am Jonathan..."/></To><Text Style="font-family:Microsoft Sans Serif; color:#000000; ">on the keyboard..</Text></Message><Message Date="12/11/2006" Time="12:11:08 PM" DateTime="2006-11-12T01:11:08.586Z" SessionID="659"><From><User FriendlyName="I am Jonathan..."/></From><To><User FriendlyName="- James :)-Charmed"/></To><Text Style="font-family:Comic Sans MS; color:#008000; ">okay</Text></Message><Message Date="12/11/2006" Time="12:11:42 PM" DateTime="2006-11-12T01:11:42.726Z" SessionID="659"><From><User FriendlyName="I am Jonathan..."/></From><To><User FriendlyName="- James :)-Charmed"/></To><Text Style="font-family:Comic Sans MS; color:#008000; ">and how do i put it somewhere?</Text></Message><Message Date="12/11/2006" Time="12:12:08 PM" DateTime="2006-11-12T01:12:08.539Z" SessionID="659"><From><User FriendlyName="- James :)-Charmed"/></From><To><User FriendlyName="I am Jonathan..."/></To><Text Style="font-family:Microsoft Sans Serif; color:#000000; ">Paste</Text></Message><Message Date="12/11/2006" Time="12:12:14 PM" DateTime="2006-11-12T01:12:14.070Z" SessionID="659"><From><User FriendlyName="- James :)-Charmed"/></From><To><User FriendlyName="I am Jonathan..."/></To><Text Style="font-family:Microsoft Sans Serif; color:#000000; ">I'd put it in paint first</Text></Message><Message Date="12/11/2006" Time="12:12:16 PM" DateTime="2006-11-12T01:12:16.617Z" SessionID="659"><From><User FriendlyName="- James :)-Charmed"/></From><To><User FriendlyName="I am Jonathan..."/></To><Text Style="font-family:Microsoft Sans Serif; color:#000000; ">then cute the bits u need</Text></Message><Message Date="12/11/2006" Time="12:13:10 PM" DateTime="2006-11-12T01:13:10.695Z" SessionID="660"><From><User FriendlyName="I am Jonathan..."/></From><To><User FriendlyName="- James :)-Charmed"/></To><Text Style="font-family:Comic Sans MS; color:#008000; ">k thanks man</Text></Message><Message Date="12/11/2006" Time="12:24:17 PM" DateTime="2006-11-12T01:24:17.601Z" SessionID="660"><From><User FriendlyName="- James :)-Charmed"/></From><To><User FriendlyName="I am Jonathan..."/></To><Text Style="font-family:Microsoft Sans Serif; color:#000000; ">np</Text></Message><Message Date="16/11/2006" Time="4:42:26 PM" DateTime="2006-11-16T05:42:26.558Z" SessionID="661"><From><User FriendlyName="The Lantern... Death to port-a-loo's"/></From><To><User FriendlyName="- James :)-Charmed"/></To><Text Style="font-family:Comic Sans MS; color:#008000; ">jimmeh wat is pdf again?</Text></Message><Message Date="16/11/2006" Time="4:43:00 PM" DateTime="2006-11-16T05:43:00.324Z" SessionID="661"><From><User FriendlyName="- James :)-Charmed"/></From><To><User FriendlyName="The Lantern... Death to port-a-loo's"/></To><Text Style="font-family:Microsoft Sans Serif; color:#000000; ">Its a compiled document, used for making softcopies of manuals and such</Text></Message><Message Date="16/11/2006" Time="4:43:15 PM" DateTime="2006-11-16T05:43:15.714Z" SessionID="662"><From><User FriendlyName="The Lantern... Death to port-a-loo's"/></From><To><User FriendlyName="- James :)-Charmed"/></To><Text Style="font-family:Comic Sans MS; color:#008000; ">okay and does microsoft office have it?</Text></Message><Message Date="16/11/2006" Time="4:44:12 PM" DateTime="2006-11-16T05:44:12.527Z" SessionID="662"><From><User FriendlyName="- James :)-Charmed"/></From><To><User FriendlyName="The Lantern... Death to port-a-loo's"/></To><Text Style="font-family:Microsoft Sans Serif; color:#000000; ">Only 2007...</Text></Message><Message Date="16/11/2006" Time="4:44:15 PM" DateTime="2006-11-16T05:44:15.167Z" SessionID="662"><From><User FriendlyName="- James :)-Charmed"/></From><To><User FriendlyName="The Lantern... Death to port-a-loo's"/></To><Text Style="font-family:Microsoft Sans Serif; color:#000000; ">Ur not using it</Text></Message><Message Date="16/11/2006" Time="4:44:18 PM" DateTime="2006-11-16T05:44:18.933Z" SessionID="662"><From><User FriendlyName="The Lantern... Death to port-a-loo's"/></From><To><User FriendlyName="- James :)-Charmed"/></To><Text Style="font-family:Comic Sans MS; color:#008000; ">okay thanks man</Text></Message><Message Date="16/11/2006" Time="5:52:51 PM" DateTime="2006-11-16T06:52:51.261Z" SessionID="663"><From><User FriendlyName="The Lantern... Death to port-a-loo's"/></From><To><User FriendlyName="- James :)-Charmed"/></To><Text Style="font-family:Comic Sans MS; color:#008000; ">hey wat u using to set it out in for software?</Text></Message><Message Date="16/11/2006" Time="5:53:03 PM" DateTime="2006-11-16T06:53:03.042Z" SessionID="663"><From><User FriendlyName="- James :)-Charmed"/></From><To><User FriendlyName="The Lantern... Death to port-a-loo's"/></To><Text Style="font-family:Microsoft Sans Serif; color:#000000; ">Microsoft word </Text></Message><Message Date="16/11/2006" Time="5:59:28 PM" DateTime="2006-11-16T06:59:28.886Z" SessionID="663"><From><User FriendlyName="- James :)-Charmed"/></From><To><User FriendlyName="The Lantern... Death to port-a-loo's"/></To><Text Style="font-family:Microsoft Sans Serif; color:#000000; ">I typed about 3 pages in size 11 font</Text></Message><Message Date="16/11/2006" Time="5:59:34 PM" DateTime="2006-11-16T06:59:34.605Z" SessionID="663"><From><User FriendlyName="- James :)-Charmed"/></From><To><User FriendlyName="The Lantern... Death to port-a-loo's"/></To><Text Style="font-family:Microsoft Sans Serif; color:#000000; ">set the font size to 8</Text></Message><Message Date="16/11/2006" Time="5:59:40 PM" DateTime="2006-11-16T06:59:40.511Z" SessionID="663"><From><User FriendlyName="- James :)-Charmed"/></From><To><User FriendlyName="The Lantern... Death to port-a-loo's"/></To><Text Style="font-family:Microsoft Sans Serif; color:#000000; ">set the columns to 2</Text></Message><Message Date="16/11/2006" Time="5:59:57 PM" DateTime="2006-11-16T06:59:57.371Z" SessionID="663"><From><User FriendlyName="- James :)-Charmed"/></From><To><User FriendlyName="The Lantern... Death to port-a-loo's"/></To><Text Style="font-family:Microsoft Sans Serif; color:#000000; ">Put my name in it and 2 small screenshots</Text></Message><Message Date="16/11/2006" Time="6:00:06 PM" DateTime="2006-11-16T07:00:06.449Z" SessionID="663"><From><User FriendlyName="- James :)-Charmed"/></From><To><User FriendlyName="The Lantern... Death to port-a-loo's"/></To><Text Style="font-family:Microsoft Sans Serif; color:#000000; ">aswell s a small title</Text></Message><Message Date="16/11/2006" Time="6:00:24 PM" DateTime="2006-11-16T07:00:24.417Z" SessionID="663"><From><User FriendlyName="- James :)-Charmed"/></From><To><User FriendlyName="The Lantern... Death to port-a-loo's"/></To><Text Style="font-family:Microsoft Sans Serif; color:#000000; ">Look at the example article for comparison</Text></Message><Message Date="16/11/2006" Time="6:04:45 PM" DateTime="2006-11-16T07:04:45.371Z" SessionID="664"><From><User FriendlyName="The Lantern... Death to port-a-loo's"/></From><To><User FriendlyName="- James :)-Charmed"/></To><Text Style="font-family:Comic Sans MS; color:#008000; ">yea im just having trouble doin it</Text></Message><Invitation Date="18/11/2006" Time="5:03:50 PM" DateTime="2006-11-18T06:03:50.968Z" SessionID="665"><From><User FriendlyName="Jonathan..."/></From><File>OrcsUnd v HumNElves 2.2~1.w3x</File><Text Style="color:#545454; ">Jonathan... sends OrcsUnd v HumNElves 2.2~1.w3x</Text></Invitation><Message Date="18/11/2006" Time="5:04:40 PM" DateTime="2006-11-18T06:04:40.234Z" SessionID="665"><From><User FriendlyName="Jonathan..."/></From><To><User FriendlyName="- James :)-Charmed"/></To><Text Style="font-family:Comic Sans MS; color:#008000; ">im goin to toilet brb</Text></Message><InvitationResponse Date="18/11/2006" Time="5:05:07 PM" DateTime="2006-11-18T06:05:07.046Z" SessionID="665"><From><User FriendlyName="Jonathan..."/></From><File>C:\Documents and Settings\James\My Documents\My Received Files\OrcsUnd v HumNElves 2.2~1.w3x</File><Text Style="color:#545454; ">You have successfully received C:\Documents and Settings\James\My Documents\My Received Files\OrcsUnd v HumNElves 2.2~1.w3x from Jonathan....</Text></InvitationResponse><Message Date="18/11/2006" Time="5:01:49 PM" DateTime="2006-11-18T06:01:49.061Z" SessionID="665"><From><User FriendlyName="Jonathan..."/></From><To><User FriendlyName="- James :)-Charmed"/></To><Text>comeon jimmeh</Text></Message><Message Date="18/11/2006" Time="5:05:24 PM" DateTime="2006-11-18T06:05:24.421Z" SessionID="665"><From><User FriendlyName="- James :)-Charmed"/></From><To><User FriendlyName="Jonathan..."/></To><Text Style="font-family:Microsoft Sans Serif; color:#000000; ">TA</Text></Message><Message Date="18/11/2006" Time="5:01:56 PM" DateTime="2006-11-18T06:01:56.172Z" SessionID="665"><From><User FriendlyName="Jonathan..."/></From><To><User FriendlyName="- James :)-Charmed"/></To><Text>i cant send it to u unless ur "online"</Text></Message><Message Date="18/11/2006" Time="5:06:04 PM" DateTime="2006-11-18T06:06:04.406Z" SessionID="665"><From><User FriendlyName="Jonathan..."/></From><To><User FriendlyName="- James :)-Charmed"/></To><Text Style="font-family:Comic Sans MS; color:#008000; ">bk</Text></Message><Message Date="18/11/2006" Time="5:06:13 PM" DateTime="2006-11-18T06:06:13.453Z" SessionID="665"><From><User FriendlyName="- James :)-Charmed"/></From><To><User FriendlyName="Jonathan..."/></To><Text Style="font-family:Microsoft Sans Serif; color:#000000; ">im just copying it 2 my wacca dir</Text></Message><Message Date="18/11/2006" Time="5:06:19 PM" DateTime="2006-11-18T06:06:19.390Z" SessionID="665"><From><User FriendlyName="Jonathan..."/></From><To><User FriendlyName="- James :)-Charmed"/></To><Text Style="font-family:Comic Sans MS; color:#008000; ">okidokie</Text></Message><Message Date="18/11/2006" Time="5:09:09 PM" DateTime="2006-11-18T06:09:09.390Z" SessionID="666"><From><User FriendlyName="Jonathan..."/></From><To><User FriendlyName="- James :)-Charmed"/></To><Text Style="font-family:Comic Sans MS; color:#008000; ">are we still playin?</Text></Message><Message Date="18/11/2006" Time="5:09:22 PM" DateTime="2006-11-18T06:09:22.578Z" SessionID="666"><From><User FriendlyName="- James :)-Charmed"/></From><To><User FriendlyName="Jonathan..."/></To><Text Style="font-family:Microsoft Sans Serif; color:#000000; ">yeh</Text></Message><Message Date="18/11/2006" Time="5:09:29 PM" DateTime="2006-11-18T06:09:29.437Z" SessionID="666"><From><User FriendlyName="- James :)-Charmed"/></From><To><User FriendlyName="Jonathan..."/></To><Text Style="font-family:Microsoft Sans Serif; color:#000000; ">soz mum wanted deatails for some places shes goine 2nite</Text></Message><Message Date="18/11/2006" Time="5:09:34 PM" DateTime="2006-11-18T06:09:34.750Z" SessionID="666"><From><User FriendlyName="Jonathan..."/></From><To><User FriendlyName="- James :)-Charmed"/></To><Text Style="font-family:Comic Sans MS; color:#008000; ">okidokie</Text></Message><Message Date="18/11/2006" Time="5:10:21 PM" DateTime="2006-11-18T06:10:21.671Z" SessionID="666"><From><User FriendlyName="- James :)-Charmed"/></From><To><User FriendlyName="Jonathan..."/></To><Text Style="font-family:Microsoft Sans Serif; color:#000000; ">kk its up</Text></Message><Message Date="18/11/2006" Time="5:10:23 PM" DateTime="2006-11-18T06:10:23.953Z" SessionID="666"><From><User FriendlyName="- James :)-Charmed"/></From><To><User FriendlyName="Jonathan..."/></To><Text Style="font-family:Microsoft Sans Serif; color:#000000; ">soz bout that</Text></Message><Message Date="28/11/2006" Time="5:26:55 PM" DateTime="2006-11-28T06:26:55.234Z" SessionID="667"><From><User FriendlyName="Jonathan..."/></From><To><User FriendlyName="- James ~ Charmed!"/></To><Text Style="font-family:Comic Sans MS; color:#008000; ">jimmeh can i ask of u a favour?</Text></Message><Message Date="28/11/2006" Time="5:26:59 PM" DateTime="2006-11-28T06:26:59.593Z" SessionID="667"><From><User FriendlyName="- James ~ Charmed!"/></From><To><User FriendlyName="Jonathan..."/></To><Text Style="font-family:Microsoft Sans Serif; color:#000000; ">woh?</Text></Message><Message Date="28/11/2006" Time="5:27:18 PM" DateTime="2006-11-28T06:27:18.390Z" SessionID="668"><From><User FriendlyName="Jonathan..."/></From><To><User FriendlyName="- James ~ Charmed!"/></To><Text Style="font-family:Comic Sans MS; color:#008000; ">have u done a paragrapgh about a text for the essay?</Text></Message><Message Date="28/11/2006" Time="5:27:36 PM" DateTime="2006-11-28T06:27:36.203Z" SessionID="668"><From><User FriendlyName="- James ~ Charmed!"/></From><To><User FriendlyName="Jonathan..."/></To><Text Style="font-family:Microsoft Sans Serif; color:#000000; ">Not yet</Text></Message><Message Date="28/11/2006" Time="5:27:38 PM" DateTime="2006-11-28T06:27:38.156Z" SessionID="668"><From><User FriendlyName="- James ~ Charmed!"/></From><To><User FriendlyName="Jonathan..."/></To><Text Style="font-family:Microsoft Sans Serif; color:#000000; ">Only intro..</Text></Message><Message Date="28/11/2006" Time="5:27:42 PM" DateTime="2006-11-28T06:27:42.062Z" SessionID="669"><From><User FriendlyName="Jonathan..."/></From><To><User FriendlyName="- James ~ Charmed!"/></To><Text Style="font-family:Comic Sans MS; color:#008000; ">dammit</Text></Message><Message Date="28/11/2006" Time="5:30:32 PM" DateTime="2006-11-28T06:30:32.093Z" SessionID="670"><From><User FriendlyName="- James ~ Charmed!"/></From><To><User FriendlyName="Jonathan..."/></To><Text Style="font-family:Microsoft Sans Serif; color:#000000; ">we gotta match on friday</Text></Message><Message Date="28/11/2006" Time="5:30:39 PM" DateTime="2006-11-28T06:30:39.390Z" SessionID="670"><From><User FriendlyName="- James ~ Charmed!"/></From><To><User FriendlyName="Jonathan..."/></To><Text Style="font-family:Microsoft Sans Serif; color:#000000; ">Nic Captaining..</Text></Message><Message Date="28/11/2006" Time="5:31:03 PM" DateTime="2006-11-28T06:31:03.406Z" SessionID="671"><From><User FriendlyName="Jonathan..."/></From><To><User FriendlyName="- James ~ Charmed!"/></To><Text Style="font-family:Comic Sans MS; color:#008000; ">danke</Text></Message><Message Date="28/11/2006" Time="5:31:13 PM" DateTime="2006-11-28T06:31:13.984Z" SessionID="671"><From><User FriendlyName="- James ~ Charmed!"/></From><To><User FriendlyName="Jonathan..."/></To><Text Style="font-family:Microsoft Sans Serif; color:#000000; ">YOU FUCKING DOUCHE BAG</Text></Message><Message Date="28/11/2006" Time="5:31:34 PM" DateTime="2006-11-28T06:31:34.203Z" SessionID="672"><From><User FriendlyName="Jonathan..."/></From><To><User FriendlyName="- James ~ Charmed!"/></To><Text Style="font-family:Comic Sans MS; color:#008000; ">y?</Text></Message><Message Date="28/11/2006" Time="5:31:42 PM" DateTime="2006-11-28T06:31:42.187Z" SessionID="672"><From><User FriendlyName="- James ~ Charmed!"/></From><To><User FriendlyName="Jonathan..."/></To><Text Style="font-family:Microsoft Sans Serif; color:#000000; ">Uncaptain me?</Text></Message><Message Date="28/11/2006" Time="5:31:48 PM" DateTime="2006-11-28T06:31:48.312Z" SessionID="672"><From><User FriendlyName="- James ~ Charmed!"/></From><To><User FriendlyName="Jonathan..."/></To><Text Style="font-family:Microsoft Sans Serif; color:#000000; ">Fuck you much!</Text></Message><Message Date="28/11/2006" Time="5:31:56 PM" DateTime="2006-11-28T06:31:56.062Z" SessionID="673"><From><User FriendlyName="Jonathan..."/></From><To><User FriendlyName="- James ~ Charmed!"/></To><Text Style="font-family:Comic Sans MS; color:#008000; ">i captained u</Text></Message><Message Date="28/11/2006" Time="5:31:56 PM" DateTime="2006-11-28T06:31:56.687Z" SessionID="673"><From><User FriendlyName="Jonathan..."/></From><To><User FriendlyName="- James ~ Charmed!"/></To><Text Style="font-family:Comic Sans MS; color:#008000; ">noob</Text></Message><Message Date="28/11/2006" Time="5:32:02 PM" DateTime="2006-11-28T06:32:02.843Z" SessionID="673"><From><User FriendlyName="Jonathan..."/></From><To><User FriendlyName="- James ~ Charmed!"/></To><Text Style="font-family:Comic Sans MS; color:#008000; ">hefa uncaptained u</Text></Message><Message Date="28/11/2006" Time="5:32:13 PM" DateTime="2006-11-28T06:32:13.187Z" SessionID="673"><From><User FriendlyName="Jonathan..."/></From><To><User FriendlyName="- James ~ Charmed!"/></To><Text Style="font-family:Comic Sans MS; color:#008000; ">i captained u not longer than an hour ago</Text></Message><Message Date="28/11/2006" Time="5:33:14 PM" DateTime="2006-11-28T06:33:14.406Z" SessionID="673"><From><User FriendlyName="- James ~ Charmed!"/></From><To><User FriendlyName="Jonathan..."/></To><Text Style="font-family:Microsoft Sans Serif; color:#000000; ">woh ever</Text></Message><Message Date="28/11/2006" Time="5:33:22 PM" DateTime="2006-11-28T06:33:22.109Z" SessionID="674"><From><User FriendlyName="Jonathan..."/></From><To><User FriendlyName="- James ~ Charmed!"/></To><Text Style="font-family:Comic Sans MS; color:#008000; ">okay then</Text></Message><Message Date="28/11/2006" Time="7:47:42 PM" DateTime="2006-11-28T08:47:42.421Z" SessionID="675"><From><User FriendlyName="Jonathan..."/></From><To><User FriendlyName="- James ~ Charmed!"/></To><Text Style="font-family:Comic Sans MS; color:#008000; ">jimeh how do u read from a file in python?</Text></Message><Message Date="28/11/2006" Time="8:00:41 PM" DateTime="2006-11-28T09:00:41.078Z" SessionID="675"><From><User FriendlyName="- James ~ Charmed!"/></From><To><User FriendlyName="Jonathan..."/></To><Text Style="font-family:Microsoft Sans Serif; color:#000000; ">First... You uncaptain it, screw with it a bit and then expect it to turn UP on friday night</Text></Message><Message Date="28/11/2006" Time="8:01:00 PM" DateTime="2006-11-28T09:01:00.562Z" SessionID="676"><From><User FriendlyName="Jonathan..."/></From><To><User FriendlyName="- James ~ Charmed!"/></To><Text Style="font-family:Comic Sans MS; color:#008000; ">jimmeh wtf are u on about</Text></Message><Message Date="28/11/2006" Time="8:01:01 PM" DateTime="2006-11-28T09:01:01.953Z" SessionID="676"><From><User FriendlyName="Jonathan..."/></From><To><User FriendlyName="- James ~ Charmed!"/></To><Text Style="font-family:Comic Sans MS; color:#008000; ">1stl</Text></Message><Message Date="28/11/2006" Time="8:01:02 PM" DateTime="2006-11-28T09:01:02.843Z" SessionID="676"><From><User FriendlyName="Jonathan..."/></From><To><User FriendlyName="- James ~ Charmed!"/></To><Text Style="font-family:Comic Sans MS; color:#008000; ">y</Text></Message><Message Date="28/11/2006" Time="8:01:05 PM" DateTime="2006-11-28T09:01:05.875Z" SessionID="676"><From><User FriendlyName="Jonathan..."/></From><To><User FriendlyName="- James ~ Charmed!"/></To><Text Style="font-family:Comic Sans MS; color:#008000; ">i didnt challenge any1</Text></Message><Message Date="28/11/2006" Time="8:01:14 PM" DateTime="2006-11-28T09:01:14.703Z" SessionID="676"><From><User FriendlyName="- James ~ Charmed!"/></From><To><User FriendlyName="Jonathan..."/></To><Text Style="font-family:Microsoft Sans Serif; color:#000000; ">lol shuttup ok</Text></Message><Message Date="28/11/2006" Time="8:01:15 PM" DateTime="2006-11-28T09:01:15.093Z" SessionID="676"><From><User FriendlyName="Jonathan..."/></From><To><User FriendlyName="- James ~ Charmed!"/></To><Text Style="font-family:Comic Sans MS; color:#008000; ">2ndly heffa uncaptained u</Text></Message><Message Date="28/11/2006" Time="8:01:39 PM" DateTime="2006-11-28T09:01:39.750Z" SessionID="676"><From><User FriendlyName="- James ~ Charmed!"/></From><To><User FriendlyName="Jonathan..."/></To><Text Style="font-family:Microsoft Sans Serif; color:#000000; ">I have no idea</Text></Message><Message Date="28/11/2006" Time="8:01:49 PM" DateTime="2006-11-28T09:01:49.640Z" SessionID="676"><From><User FriendlyName="- James ~ Charmed!"/></From><To><User FriendlyName="Jonathan..."/></To><Text Style="font-family:Microsoft Sans Serif; color:#000000; ">Im fare fortgettful</Text></Message><Message Date="28/11/2006" Time="8:02:01 PM" DateTime="2006-11-28T09:02:01.359Z" SessionID="677"><From><User FriendlyName="Jonathan..."/></From><To><User FriendlyName="- James ~ Charmed!"/></To><Text Style="font-family:Comic Sans MS; color:#008000; ">kk</Text></Message><Message Date="2/12/2006" Time="7:07:58 PM" DateTime="2006-12-02T08:07:58.046Z" SessionID="678"><From><User FriendlyName="Jonathan..."/></From><To><User FriendlyName="- James (&amp;) Charmed!"/></To><Text Style="font-family:Comic Sans MS; color:#008000; ">hey can u help me for a sec?</Text></Message><Message Date="2/12/2006" Time="7:12:42 PM" DateTime="2006-12-02T08:12:42.562Z" SessionID="678"><From><User FriendlyName="- James (&amp;) Charmed!"/></From><To><User FriendlyName="Jonathan..."/></To><Text Style="font-family:Microsoft Sans Serif; color:#000000; ">wah?</Text></Message><Message Date="2/12/2006" Time="7:13:06 PM" DateTime="2006-12-02T08:13:06.812Z" SessionID="678"><From><User FriendlyName="Jonathan..."/></From><To><User FriendlyName="- James (&amp;) Charmed!"/></To><Text Style="font-family:Comic Sans MS; color:#008000; ">u know how u did that line drawing thing in that grid thingy</Text></Message><Message Date="2/12/2006" Time="7:13:21 PM" DateTime="2006-12-02T08:13:21.359Z" SessionID="678"><From><User FriendlyName="- James (&amp;) Charmed!"/></From><To><User FriendlyName="Jonathan..."/></To><Text Style="font-family:Microsoft Sans Serif; color:#000000; ">I sure do</Text></Message><Message Date="2/12/2006" Time="7:13:30 PM" DateTime="2006-12-02T08:13:30.343Z" SessionID="678"><From><User FriendlyName="Jonathan..."/></From><To><User FriendlyName="- James (&amp;) Charmed!"/></To><Text Style="font-family:Comic Sans MS; color:#008000; ">well how did u get it to automatically auto set the width and colour?</Text></Message><Message Date="2/12/2006" Time="7:13:45 PM" DateTime="2006-12-02T08:13:45.171Z" SessionID="678"><From><User FriendlyName="- James (&amp;) Charmed!"/></From><To><User FriendlyName="Jonathan..."/></To><Text Style="font-family:Microsoft Sans Serif; color:#000000; ">Did u make a field for the width and the color?</Text></Message><Message Date="2/12/2006" Time="7:14:00 PM" DateTime="2006-12-02T08:14:00.640Z" SessionID="678"><From><User FriendlyName="Jonathan..."/></From><To><User FriendlyName="- James (&amp;) Charmed!"/></To><Text Style="font-family:Comic Sans MS; color:#008000; ">yea</Text></Message><Message Date="2/12/2006" Time="7:14:55 PM" DateTime="2006-12-02T08:14:55.359Z" SessionID="678"><From><User FriendlyName="- James (&amp;) Charmed!"/></From><To><User FriendlyName="Jonathan..."/></To><Text Style="font-family:Microsoft Sans Serif; color:#000000; ">Well U have to Fill those to spaces with what you want for the automatic settings</Text></Message><Message Date="2/12/2006" Time="7:15:16 PM" DateTime="2006-12-02T08:15:16.250Z" SessionID="678"><From><User FriendlyName="Jonathan..."/></From><To><User FriendlyName="- James (&amp;) Charmed!"/></To><Text Style="font-family:Comic Sans MS; color:#008000; ">i tried</Text></Message><Message Date="2/12/2006" Time="7:15:35 PM" DateTime="2006-12-02T08:15:35.796Z" SessionID="678"><From><User FriendlyName="- James (&amp;) Charmed!"/></From><To><User FriendlyName="Jonathan..."/></To><Text Style="font-family:Microsoft Sans Serif; color:#000000; ">I just made a variable called to trigger a function</Text></Message><Message Date="2/12/2006" Time="7:15:38 PM" DateTime="2006-12-02T08:15:38.875Z" SessionID="678"><From><User FriendlyName="- James (&amp;) Charmed!"/></From><To><User FriendlyName="Jonathan..."/></To><Text Style="font-family:Microsoft Sans Serif; color:#000000; ">so like</Text></Message><Message Date="2/12/2006" Time="7:15:43 PM" DateTime="2006-12-02T08:15:43.718Z" SessionID="678"><From><User FriendlyName="- James (&amp;) Charmed!"/></From><To><User FriendlyName="Jonathan..."/></To><Text Style="font-family:Microsoft Sans Serif; color:#000000; ">firstrun=1</Text></Message><Message Date="2/12/2006" Time="7:15:59 PM" DateTime="2006-12-02T08:15:59.640Z" SessionID="678"><From><User FriendlyName="- James (&amp;) Charmed!"/></From><To><User FriendlyName="Jonathan..."/></To><Text Style="font-family:Microsoft Sans Serif; color:#000000; ">if firstrun==1:
       Ini()</Text></Message><Message Date="2/12/2006" Time="7:16:09 PM" DateTime="2006-12-02T08:16:09.453Z" SessionID="678"><From><User FriendlyName="- James (&amp;) Charmed!"/></From><To><User FriendlyName="Jonathan..."/></To><Text Style="font-family:Microsoft Sans Serif; color:#000000; ">then in the ini function</Text></Message><Message Date="2/12/2006" Time="7:16:32 PM" DateTime="2006-12-02T08:16:32.250Z" SessionID="678"><From><User FriendlyName="Jonathan..."/></From><To><User FriendlyName="- James (&amp;) Charmed!"/></To><Text Style="font-family:Comic Sans MS; color:#008000; ">fill="blue"??</Text></Message><Message Date="2/12/2006" Time="7:16:32 PM" DateTime="2006-12-02T08:16:32.718Z" SessionID="678"><From><User FriendlyName="Jonathan..."/></From><To><User FriendlyName="- James (&amp;) Charmed!"/></To><Text Style="font-family:Comic Sans MS; color:#008000; ">etc</Text></Message><Message Date="2/12/2006" Time="7:17:02 PM" DateTime="2006-12-02T08:17:02.765Z" SessionID="678"><From><User FriendlyName="- James (&amp;) Charmed!"/></From><To><User FriendlyName="Jonathan..."/></To><Text Style="font-family:Microsoft Sans Serif; color:#000000; ">yup</Text></Message><Message Date="2/12/2006" Time="7:17:11 PM" DateTime="2006-12-02T08:17:11.390Z" SessionID="678"><From><User FriendlyName="Jonathan..."/></From><To><User FriendlyName="- James (&amp;) Charmed!"/></To><Text Style="font-family:Comic Sans MS; color:#008000; ">okay thanks</Text></Message><Message Date="2/12/2006" Time="7:19:48 PM" DateTime="2006-12-02T08:19:48.687Z" SessionID="678"><From><User FriendlyName="- James (&amp;) Charmed!"/></From><To><User FriendlyName="Jonathan..."/></To><Text Style="font-family:Microsoft Sans Serif; color:#000000; ">oh and at the end of the function, set firstrun=0</Text></Message><Message Date="2/12/2006" Time="7:20:04 PM" DateTime="2006-12-02T08:20:04.828Z" SessionID="679"><From><User FriendlyName="Jonathan..."/></From><To><User FriendlyName="- James (&amp;) Charmed!"/></To><Text Style="font-family:Comic Sans MS; color:#008000; ">okay</Text></Message><Message Date="2/12/2006" Time="7:25:07 PM" DateTime="2006-12-02T08:25:07.718Z" SessionID="680"><From><User FriendlyName="- James (&amp;) Charmed!"/></From><To><User FriendlyName="Jonathan..."/></To><Text Style="font-family:Microsoft Sans Serif; color:#000000; ">So did u uninstall ET?</Text></Message><Message Date="2/12/2006" Time="7:25:48 PM" DateTime="2006-12-02T08:25:48.093Z" SessionID="680"><From><User FriendlyName="Jonathan..."/></From><To><User FriendlyName="- James (&amp;) Charmed!"/></To><Text Style="font-family:Comic Sans MS; color:#008000; ">na</Text></Message><Message Date="2/12/2006" Time="7:25:54 PM" DateTime="2006-12-02T08:25:54.203Z" SessionID="680"><From><User FriendlyName="Jonathan..."/></From><To><User FriendlyName="- James (&amp;) Charmed!"/></To><Text Style="font-family:Comic Sans MS; color:#008000; ">i can be bothered</Text></Message><Message Date="2/12/2006" Time="7:26:02 PM" DateTime="2006-12-02T08:26:02.765Z" SessionID="680"><From><User FriendlyName="Jonathan..."/></From><To><User FriendlyName="- James (&amp;) Charmed!"/></To><Text Style="font-family:Comic Sans MS; color:#008000; ">holidays coming up</Text></Message><Message Date="2/12/2006" Time="7:26:04 PM" DateTime="2006-12-02T08:26:04.750Z" SessionID="680"><From><User FriendlyName="Jonathan..."/></From><To><User FriendlyName="- James (&amp;) Charmed!"/></To><Text Style="font-family:Comic Sans MS; color:#008000; ">and i am only goin to install it again:P</Text></Message><Message Date="2/12/2006" Time="7:26:07 PM" DateTime="2006-12-02T08:26:07.906Z" SessionID="680"><From><User FriendlyName="- James (&amp;) Charmed!"/></From><To><User FriendlyName="Jonathan..."/></To><Text Style="font-family:Microsoft Sans Serif; color:#000000; ">lol, click programs, Wolfet and uninstall is way 2 mcuh</Text></Message><Message Date="2/12/2006" Time="7:26:09 PM" DateTime="2006-12-02T08:26:09.703Z" SessionID="680"><From><User FriendlyName="- James (&amp;) Charmed!"/></From><To><User FriendlyName="Jonathan..."/></To><Text Style="font-family:Microsoft Sans Serif; color:#000000; ">haha</Text></Message><Message Date="2/12/2006" Time="7:26:12 PM" DateTime="2006-12-02T08:26:12.171Z" SessionID="680"><From><User FriendlyName="- James (&amp;) Charmed!"/></From><To><User FriendlyName="Jonathan..."/></To><Text Style="font-family:Microsoft Sans Serif; color:#000000; ">I new u wouldn't</Text></Message><Message Date="2/12/2006" Time="7:26:37 PM" DateTime="2006-12-02T08:26:37.546Z" SessionID="681"><From><User FriendlyName="Jonathan..."/></From><To><User FriendlyName="- James (&amp;) Charmed!"/></To><Text Style="font-family:Comic Sans MS; color:#008000; ">ha ha:P</Text></Message><Message Date="2/12/2006" Time="7:26:37 PM" DateTime="2006-12-02T08:26:37.546Z" SessionID="681"><From><User FriendlyName="Jonathan..."/></From><To><User FriendlyName="- James (&amp;) Charmed!"/></To><Text Style="font-family:Comic Sans MS; color:#008000; ">im all talk</Text></Message><Message Date="2/12/2006" Time="7:26:37 PM" DateTime="2006-12-02T08:26:37.562Z" SessionID="681"><From><User FriendlyName="Jonathan..."/></From><To><User FriendlyName="- James (&amp;) Charmed!"/></To><Text Style="font-family:Comic Sans MS; color:#008000; ">cept for wow</Text></Message><Message Date="2/12/2006" Time="7:26:40 PM" DateTime="2006-12-02T08:26:40.718Z" SessionID="681"><From><User FriendlyName="Jonathan..."/></From><To><User FriendlyName="- James (&amp;) Charmed!"/></To><Text Style="font-family:Comic Sans MS; color:#008000; ">i do wanna get wow off u</Text></Message><Message Date="2/12/2006" Time="7:26:54 PM" DateTime="2006-12-02T08:26:54.953Z" SessionID="681"><From><User FriendlyName="- James (&amp;) Charmed!"/></From><To><User FriendlyName="Jonathan..."/></To><Text Style="font-family:Microsoft Sans Serif; color:#000000; ">U WANT IT AGAIN!?</Text></Message><Message Date="2/12/2006" Time="7:27:10 PM" DateTime="2006-12-02T08:27:10.750Z" SessionID="682"><From><User FriendlyName="Jonathan..."/></From><To><User FriendlyName="- James (&amp;) Charmed!"/></To><Text Style="font-family:Comic Sans MS; color:#008000; ">nod</Text></Message><Message Date="2/12/2006" Time="7:27:10 PM" DateTime="2006-12-02T08:27:10.750Z" SessionID="682"><From><User FriendlyName="Jonathan..."/></From><To><User FriendlyName="- James (&amp;) Charmed!"/></To><Text Style="font-family:Comic Sans MS; color:#008000; ">for the hols</Text></Message><Message Date="2/12/2006" Time="7:27:18 PM" DateTime="2006-12-02T08:27:18.750Z" SessionID="682"><From><User FriendlyName="Jonathan..."/></From><To><User FriendlyName="- James (&amp;) Charmed!"/></To><Text Style="font-family:Comic Sans MS; color:#008000; ">8 weeks of nothin</Text></Message><Message Date="2/12/2006" Time="7:27:34 PM" DateTime="2006-12-02T08:27:34.093Z" SessionID="682"><From><User FriendlyName="Jonathan..."/></From><To><User FriendlyName="- James (&amp;) Charmed!"/></To><Text Style="font-family:Comic Sans MS; color:#008000; ">canvas.create_line(int(entx1.get()),int(enty1.get()),int(entx2.get()),int(entx2.get()),fill="Black",width=1)</Text></Message><Message Date="2/12/2006" Time="7:27:36 PM" DateTime="2006-12-02T08:27:36.187Z" SessionID="682"><From><User FriendlyName="Jonathan..."/></From><To><User FriendlyName="- James (&amp;) Charmed!"/></To><Text Style="font-family:Comic Sans MS; color:#008000; ">it isnt working</Text></Message><Message Date="2/12/2006" Time="7:27:42 PM" DateTime="2006-12-02T08:27:42.593Z" SessionID="682"><From><User FriendlyName="Jonathan..."/></From><To><User FriendlyName="- James (&amp;) Charmed!"/></To><Text Style="font-family:Comic Sans MS; color:#008000; ">okay wtf is that </Text></Message><Message Date="2/12/2006" Time="7:28:44 PM" DateTime="2006-12-02T08:28:44.843Z" SessionID="682"><From><User FriendlyName="- James (&amp;) Charmed!"/></From><To><User FriendlyName="Jonathan..."/></To><Text Style="font-family:Microsoft Sans Serif; color:#000000; ">if firsttime==1:
canvas.create_line(int(entx1.get( ,int(enty1.get( ,int(entx2.get( ,int(entx2.get( ,fill=fill,width=width)
else:
      canvas.create_line(int(entx1.get( ,int(enty1.get( ,int(entx2.get ( ,int(entx2.get( ,fill="Black",width=1)</Text></Message><Message Date="2/12/2006" Time="7:29:12 PM" DateTime="2006-12-02T08:29:12.218Z" SessionID="682"><From><User FriendlyName="Jonathan..."/></From><To><User FriendlyName="- James (&amp;) Charmed!"/></To><Text Style="font-family:Comic Sans MS; color:#008000; ">kk</Text></Message><Message Date="2/12/2006" Time="7:46:09 PM" DateTime="2006-12-02T08:46:09.125Z" SessionID="683"><From><User FriendlyName="Jonathan..."/></From><To><User FriendlyName="- James (&amp;) Charmed!"/></To><Text Style="font-family:Comic Sans MS; color:#008000; ">how do u get the word actually into the ent field with out actually having to type it in??</Text></Message><Message Date="2/12/2006" Time="7:46:49 PM" DateTime="2006-12-02T08:46:49.453Z" SessionID="683"><From><User FriendlyName="- James (&amp;) Charmed!"/></From><To><User FriendlyName="Jonathan..."/></To><Text Style="font-family:Microsoft Sans Serif; color:#000000; ">i think it sumfin line entwidth.write(0,1)</Text></Message><Message Date="2/12/2006" Time="7:46:55 PM" DateTime="2006-12-02T08:46:55.859Z" SessionID="683"><From><User FriendlyName="- James (&amp;) Charmed!"/></From><To><User FriendlyName="Jonathan..."/></To><Text Style="font-family:Microsoft Sans Serif; color:#000000; ">I think its write*-)</Text></Message><Message Date="2/12/2006" Time="7:47:00 PM" DateTime="2006-12-02T08:47:00.921Z" SessionID="683"><From><User FriendlyName="- James (&amp;) Charmed!"/></From><To><User FriendlyName="Jonathan..."/></To><Text Style="font-family:Microsoft Sans Serif; color:#000000; ">Its on that tkinter thing</Text></Message><Message Date="2/12/2006" Time="7:47:17 PM" DateTime="2006-12-02T08:47:17.640Z" SessionID="684"><From><User FriendlyName="Jonathan..."/></From><To><User FriendlyName="- James (&amp;) Charmed!"/></To><Text Style="font-family:Comic Sans MS; color:#008000; ">under wat?</Text></Message><Message Date="2/12/2006" Time="7:48:02 PM" DateTime="2006-12-02T08:48:02.031Z" SessionID="684"><From><User FriendlyName="- James (&amp;) Charmed!"/></From><To><User FriendlyName="Jonathan..."/></To><Text Style="font-family:Microsoft Sans Serif; color:#000000; ">umm, entry box widget</Text></Message><Message Date="2/12/2006" Time="7:48:47 PM" DateTime="2006-12-02T08:48:47.750Z" SessionID="684"><From><User FriendlyName="Jonathan..."/></From><To><User FriendlyName="- James (&amp;) Charmed!"/></To><Text Style="font-family:Comic Sans MS; color:#008000; ">k thanks man</Text></Message><Message Date="3/12/2006" Time="10:46:55 AM" DateTime="2006-12-02T23:46:55.421Z" SessionID="685"><From><User FriendlyName="- James (&amp;) Charmed!"/></From><To><User FriendlyName="Jonathan..."/></To><Text Style="font-family:Microsoft Sans Serif; color:#000000; ">english = lame as</Text></Message><Message Date="3/12/2006" Time="10:47:10 AM" DateTime="2006-12-02T23:47:10.218Z" SessionID="685"><From><User FriendlyName="- James (&amp;) Charmed!"/></From><To><User FriendlyName="Jonathan..."/></To><Text Style="font-family:Microsoft Sans Serif; color:#000000; ">Jordan made me play et at 2am last night, man its hard playing at that time in the morning,</Text></Message><Message Date="3/12/2006" Time="10:47:13 AM" DateTime="2006-12-02T23:47:13.906Z" SessionID="685"><From><User FriendlyName="Jonathan..."/></From><To><User FriendlyName="- James (&amp;) Charmed!"/></To><Text Style="font-family:Comic Sans MS; color:#008000; ">i know aye</Text></Message><Message Date="3/12/2006" Time="10:47:15 AM" DateTime="2006-12-02T23:47:15.593Z" SessionID="685"><From><User FriendlyName="Jonathan..."/></From><To><User FriendlyName="- James (&amp;) Charmed!"/></To><Text Style="font-family:Comic Sans MS; color:#008000; ">fk im doin my staory</Text></Message><Message Date="3/12/2006" Time="10:47:32 AM" DateTime="2006-12-02T23:47:32.312Z" SessionID="685"><From><User FriendlyName="- James (&amp;) Charmed!"/></From><To><User FriendlyName="Jonathan..."/></To><Text Style="font-family:Microsoft Sans Serif; color:#000000; ">47-6 me vs jordan + some noob joined at the last few mins</Text></Message><Message Date="3/12/2006" Time="10:47:36 AM" DateTime="2006-12-02T23:47:36.218Z" SessionID="685"><From><User FriendlyName="Jonathan..."/></From><To><User FriendlyName="- James (&amp;) Charmed!"/></To><Text Style="font-family:Comic Sans MS; color:#008000; ">ha ha</Text></Message><Message Date="3/12/2006" Time="10:47:36 AM" DateTime="2006-12-02T23:47:36.218Z" SessionID="685"><From><User FriendlyName="Jonathan..."/></From><To><User FriendlyName="- James (&amp;) Charmed!"/></To><Text Style="font-family:Comic Sans MS; color:#008000; ">my et aint wokring</Text></Message><Message Date="3/12/2006" Time="10:47:36 AM" DateTime="2006-12-02T23:47:36.718Z" SessionID="685"><From><User FriendlyName="Jonathan..."/></From><To><User FriendlyName="- James (&amp;) Charmed!"/></To><Text Style="font-family:Comic Sans MS; color:#008000; ">i keep laggin out</Text></Message><Message Date="3/12/2006" Time="10:47:36 AM" DateTime="2006-12-02T23:47:36.718Z" SessionID="685"><From><User FriendlyName="Jonathan..."/></From><To><User FriendlyName="- James (&amp;) Charmed!"/></To><Text Style="font-family:Comic Sans MS; color:#008000; ">big time</Text></Message><Message Date="3/12/2006" Time="10:47:40 AM" DateTime="2006-12-02T23:47:40.000Z" SessionID="685"><From><User FriendlyName="- James (&amp;) Charmed!"/></From><To><User FriendlyName="Jonathan..."/></To><Text Style="font-family:Microsoft Sans Serif; color:#000000; ">Im dong my essay</Text></Message><Message Date="3/12/2006" Time="10:47:46 AM" DateTime="2006-12-02T23:47:46.593Z" SessionID="685"><From><User FriendlyName="- James (&amp;) Charmed!"/></From><To><User FriendlyName="Jonathan..."/></To><Text Style="font-family:Microsoft Sans Serif; color:#000000; ">I've done like nearly 1 text</Text></Message><Message Date="3/12/2006" Time="10:47:47 AM" DateTime="2006-12-02T23:47:47.656Z" SessionID="685"><From><User FriendlyName="Jonathan..."/></From><To><User FriendlyName="- James (&amp;) Charmed!"/></To><Text Style="font-family:Comic Sans MS; color:#008000; ">ah ha ha</Text></Message><Message Date="3/12/2006" Time="10:47:52 AM" DateTime="2006-12-02T23:47:52.515Z" SessionID="685"><From><User FriendlyName="- James (&amp;) Charmed!"/></From><To><User FriendlyName="Jonathan..."/></To><Text Style="font-family:Microsoft Sans Serif; color:#000000; ">(of 6 :()</Text></Message><Message Date="3/12/2006" Time="10:48:04 AM" DateTime="2006-12-02T23:48:04.000Z" SessionID="686"><From><User FriendlyName="Jonathan..."/></From><To><User FriendlyName="- James (&amp;) Charmed!"/></To><Text Style="font-family:Comic Sans MS; color:#008000; ">im lucky that my et doesnt work</Text></Message><Message Date="3/12/2006" Time="10:48:09 AM" DateTime="2006-12-02T23:48:09.046Z" SessionID="686"><From><User FriendlyName="Jonathan..."/></From><To><User FriendlyName="- James (&amp;) Charmed!"/></To><Text Style="font-family:Comic Sans MS; color:#008000; ">cause now i will actually get some work done</Text></Message><Message Date="3/12/2006" Time="10:48:28 AM" DateTime="2006-12-02T23:48:28.359Z" SessionID="686"><From><User FriendlyName="Jonathan..."/></From><To><User FriendlyName="- James (&amp;) Charmed!"/></To><Text Style="font-family:Comic Sans MS; color:#008000; ">usually i would just be playin et</Text></Message><Message Date="3/12/2006" Time="10:48:31 AM" DateTime="2006-12-02T23:48:31.093Z" SessionID="686"><From><User FriendlyName="- James (&amp;) Charmed!"/></From><To><User FriendlyName="Jonathan..."/></To><Text Style="font-family:Microsoft Sans Serif; color:#000000; ">haha</Text></Message><Message Date="3/12/2006" Time="10:48:48 AM" DateTime="2006-12-02T23:48:48.312Z" SessionID="686"><From><User FriendlyName="- James (&amp;) Charmed!"/></From><To><User FriendlyName="Jonathan..."/></To><Text Style="font-family:Microsoft Sans Serif; color:#000000; ">yeh I no I played some CSS this morning and listened to 1 podcast, then im like NO more games untill this shit is done</Text></Message><Message Date="3/12/2006" Time="10:48:50 AM" DateTime="2006-12-02T23:48:50.265Z" SessionID="686"><From><User FriendlyName="- James (&amp;) Charmed!"/></From><To><User FriendlyName="Jonathan..."/></To><Text Style="font-family:Microsoft Sans Serif; color:#000000; ">atleast most of it</Text></Message><Message Date="3/12/2006" Time="10:49:07 AM" DateTime="2006-12-02T23:49:07.796Z" SessionID="687"><From><User FriendlyName="Jonathan..."/></From><To><User FriendlyName="- James (&amp;) Charmed!"/></To><Text Style="font-family:Comic Sans MS; color:#008000; ">ha ha yea</Text></Message><Message Date="3/12/2006" Time="10:49:16 AM" DateTime="2006-12-02T23:49:16.609Z" SessionID="687"><From><User FriendlyName="Jonathan..."/></From><To><User FriendlyName="- James (&amp;) Charmed!"/></To><Text Style="font-family:Comic Sans MS; color:#008000; ">there just so adictive!</Text></Message><Message Date="3/12/2006" Time="2:00:33 PM" DateTime="2006-12-03T03:00:33.687Z" SessionID="688"><From><User FriendlyName="Jonathan..."/></From><To><User FriendlyName="- James (&amp;) Charmed!"/></To><Text Style="font-family:Comic Sans MS; color:#008000; ">hey u there?</Text></Message><Message Date="3/12/2006" Time="2:15:30 PM" DateTime="2006-12-03T03:15:30.531Z" SessionID="688"><From><User FriendlyName="- James (&amp;) Charmed!"/></From><To><User FriendlyName="Jonathan..."/></To><Text Style="font-family:Microsoft Sans Serif; color:#000000; ">yup</Text></Message><Message Date="23/12/2006" Time="11:27:24 PM" DateTime="2006-12-23T12:27:24.283Z" SessionID="689"><From><User FriendlyName=""/></From><To><User FriendlyName="- James(&amp;) Charmed"/></To><Text Style="font-family:Comic Sans MS; color:#008000; ">hey is benny around??</Text></Message><Message Date="23/12/2006" Time="11:27:29 PM" DateTime="2006-12-23T12:27:29.361Z" SessionID="689"><From><User FriendlyName=""/></From><To><User FriendlyName="- James(&amp;) Charmed"/></To><Text Style="font-family:Comic Sans MS; color:#008000; ">or is he away somewherE?</Text></Message><Message Date="23/12/2006" Time="11:27:36 PM" DateTime="2006-12-23T12:27:36.143Z" SessionID="689"><From><User FriendlyName="- James(&amp;) Charmed"/></From><To><User FriendlyName=""/></To><Text Style="font-family:Microsoft Sans Serif; color:#000000; ">I think hes away</Text></Message><Message Date="23/12/2006" Time="11:27:46 PM" DateTime="2006-12-23T12:27:46.783Z" SessionID="690"><From><User FriendlyName=""/></From><To><User FriendlyName="- James(&amp;) Charmed"/></To><Text Style="font-family:Comic Sans MS; color:#008000; ">dammit his always afkin way</Text></Message><Message Date="10/01/2007" Time="10:12:10 AM" DateTime="2007-01-09T23:12:10.500Z" SessionID="691"><From><User FriendlyName="- James(&amp;) Charmed ||| Angel pumping gas, why wont this moment last, its fate my life has brought me here today..."/></From><To><User FriendlyName="nahtano"/></To><Text Style="font-family:Microsoft Sans Serif; color:#000000; ">Hay, Beach 2day at 11</Text></Message><Message Date="10/01/2007" Time="10:12:11 AM" DateTime="2007-01-09T23:12:11.515Z" SessionID="691"><From><User FriendlyName="- James(&amp;) Charmed ||| Angel pumping gas, why wont this moment last, its fate my life has brought me here today..."/></From><To><User FriendlyName="nahtano"/></To><Text Style="font-family:Microsoft Sans Serif; color:#000000; ">maccas</Text></Message><Message Date="10/01/2007" Time="10:12:18 AM" DateTime="2007-01-09T23:12:18.375Z" SessionID="691"><From><User FriendlyName="- James(&amp;) Charmed ||| Angel pumping gas, why wont this moment last, its fate my life has brought me here today..."/></From><To><User FriendlyName="nahtano"/></To><Text Style="font-family:Microsoft Sans Serif; color:#000000; ">holy crap I gotta leave in a sec &gt;_&lt;</Text></Message><Message Date="10/01/2007" Time="10:24:05 AM" DateTime="2007-01-09T23:24:05.671Z" SessionID="692"><From><User FriendlyName="nahtano"/></From><To><User FriendlyName="- James(&amp;) Charmed ||| Angel pumping gas, why wont this moment last, its fate my life has brought me here today..."/></To><Text Style="font-family:Comic Sans MS; color:#008000; ">kk</Text></Message><Message Date="18/01/2007" Time="7:41:53 PM" DateTime="2007-01-18T08:41:53.568Z" SessionID="693"><From><User FriendlyName="- James(&amp;) Charmed"/></From><To><User FriendlyName="Jono"/></To><Text Style="font-family:Microsoft Sans Serif; color:#000000; ">JP!</Text></Message><Message Date="18/01/2007" Time="7:42:09 PM" DateTime="2007-01-18T08:42:09.334Z" SessionID="693"><From><User FriendlyName="- James(&amp;) Charmed"/></From><To><User FriendlyName="Jono"/></To><Text Style="font-family:Microsoft Sans Serif; color:#000000; ">http://louhi.kempele.fi/~skyostil/uv/fretsonfire/</Text></Message><Message Date="18/01/2007" Time="7:42:21 PM" DateTime="2007-01-18T08:42:21.037Z" SessionID="693"><From><User FriendlyName="- James(&amp;) Charmed"/></From><To><User FriendlyName="Jono"/></To><Text Style="font-family:Microsoft Sans Serif; color:#000000; ">ITS Guitar hero but for the computer, u use ur keyboard to play it</Text></Message><Message Date="18/01/2007" Time="7:42:22 PM" DateTime="2007-01-18T08:42:22.897Z" SessionID="693"><From><User FriendlyName="- James(&amp;) Charmed"/></From><To><User FriendlyName="Jono"/></To><Text Style="font-family:Microsoft Sans Serif; color:#000000; ">ITS BRILLIANT!</Text></Message><Message Date="18/01/2007" Time="7:42:37 PM" DateTime="2007-01-18T08:42:37.740Z" SessionID="694"><From><User FriendlyName="Jono"/></From><To><User FriendlyName="- James(&amp;) Charmed"/></To><Text Style="font-family:Comic Sans MS; color:#008000; ">it better be [evil]</Text></Message><Message Date="18/01/2007" Time="7:43:18 PM" DateTime="2007-01-18T08:43:18.803Z" SessionID="694"><From><User FriendlyName="Jono"/></From><To><User FriendlyName="- James(&amp;) Charmed"/></To><Text Style="font-family:Comic Sans MS; color:#008000; ">jimmeh theres noithin there</Text></Message><Message Date="18/01/2007" Time="7:44:10 PM" DateTime="2007-01-18T08:44:10.147Z" SessionID="694"><From><User FriendlyName="Jono"/></From><To><User FriendlyName="- James(&amp;) Charmed"/></To><Text Style="font-family:Comic Sans MS; color:#008000; ">wat do i do?
</Text></Message><Message Date="18/01/2007" Time="7:45:27 PM" DateTime="2007-01-18T08:45:27.303Z" SessionID="694"><From><User FriendlyName="Jono"/></From><To><User FriendlyName="- James(&amp;) Charmed"/></To><Text Style="font-family:Comic Sans MS; color:#008000; ">goddammit</Text></Message><Message Date="18/01/2007" Time="7:45:30 PM" DateTime="2007-01-18T08:45:30.615Z" SessionID="694"><From><User FriendlyName="Jono"/></From><To><User FriendlyName="- James(&amp;) Charmed"/></To><Text Style="font-family:Comic Sans MS; color:#008000; ">which one do i dl??</Text></Message><Message Date="18/01/2007" Time="7:55:05 PM" DateTime="2007-01-18T08:55:05.365Z" SessionID="694"><From><User FriendlyName="- James(&amp;) Charmed"/></From><To><User FriendlyName="Jono"/></To><Text Style="font-family:Microsoft Sans Serif; color:#000000; ">the tope one</Text></Message><Message Date="18/01/2007" Time="7:55:14 PM" DateTime="2007-01-18T08:55:14.615Z" SessionID="694"><From><User FriendlyName="- James(&amp;) Charmed"/></From><To><User FriendlyName="Jono"/></To><Text Style="font-family:Microsoft Sans Serif; color:#000000; ">http://louhi.kempele.fi/~skyostil/uv/fretsonfire/dist/FretsOnFire-1.1.324-win32.zip</Text></Message><Message Date="18/01/2007" Time="8:31:40 PM" DateTime="2007-01-18T09:31:40.381Z" SessionID="695"><From><User FriendlyName="Jono"/></From><To><User FriendlyName="- James(&amp;) Charmed"/></To><Text Style="font-family:Comic Sans MS; color:#008000; ">how are u suposed to play that games?</Text></Message><Message Date="18/01/2007" Time="8:35:53 PM" DateTime="2007-01-18T09:35:53.506Z" SessionID="695"><From><User FriendlyName="- James(&amp;) Charmed"/></From><To><User FriendlyName="Jono"/></To><Text Style="font-family:Microsoft Sans Serif; color:#000000; ">haha</Text></Message><Message Date="18/01/2007" Time="8:35:56 PM" DateTime="2007-01-18T09:35:56.600Z" SessionID="695"><From><User FriendlyName="- James(&amp;) Charmed"/></From><To><User FriendlyName="Jono"/></To><Text Style="font-family:Microsoft Sans Serif; color:#000000; ">du the tutorial</Text></Message><Message Date="21/01/2007" Time="6:42:12 PM" DateTime="2007-01-21T07:42:12.750Z" SessionID="696"><From><User FriendlyName="Don't drink and drive. You might spill your beer..."/></From><To><User FriendlyName="- James(&amp;) Charmed! ARRIVE MEMORY CARD DAMNIT!"/></To><Text Style="font-family:Comic Sans MS; color:#008000; ">jimmeh u there?</Text></Message><Message Date="21/01/2007" Time="9:02:56 PM" DateTime="2007-01-21T10:02:56.859Z" SessionID="696"><From><User FriendlyName="- James(&amp;) Charmed! ARRIVE MEMORY CARD DAMNIT!"/></From><To><User FriendlyName="Don't drink and drive. You might spill your beer..."/></To><Text Style="font-family:Microsoft Sans Serif; color:#000000; ">hay</Text></Message><Message Date="21/01/2007" Time="10:26:29 PM" DateTime="2007-01-21T11:26:29.562Z" SessionID="697"><From><User FriendlyName="- James(&amp;) Charmed! ARRIVE MEMORY CARD DAMNIT!"/></From><To><User FriendlyName="Jono..."/></To><Text Style="font-family:Microsoft Sans Serif; color:#000000; ">Hay</Text></Message><Message Date="21/01/2007" Time="10:26:56 PM" DateTime="2007-01-21T11:26:56.500Z" SessionID="698"><From><User FriendlyName="Jono..."/></From><To><User FriendlyName="- James(&amp;) Charmed! ARRIVE MEMORY CARD DAMNIT!"/></To><Text Style="font-family:Comic Sans MS; color:#008000; ">howdy</Text></Message><Message Date="21/01/2007" Time="10:27:09 PM" DateTime="2007-01-21T11:27:09.046Z" SessionID="698"><From><User FriendlyName="- James(&amp;) Charmed! ARRIVE MEMORY CARD DAMNIT!"/></From><To><User FriendlyName="Jono..."/></To><Text Style="font-family:Microsoft Sans Serif; color:#000000; ">I earnt $150 fixing puters today!</Text></Message><Message Date="21/01/2007" Time="10:27:09 PM" DateTime="2007-01-21T11:27:09.937Z" SessionID="698"><From><User FriendlyName="- James(&amp;) Charmed! ARRIVE MEMORY CARD DAMNIT!"/></From><To><User FriendlyName="Jono..."/></To><Text Style="font-family:Microsoft Sans Serif; color:#000000; ">WOOT</Text></Message><Message Date="21/01/2007" Time="10:27:17 PM" DateTime="2007-01-21T11:27:17.671Z" SessionID="698"><From><User FriendlyName="Jono..."/></From><To><User FriendlyName="- James(&amp;) Charmed! ARRIVE MEMORY CARD DAMNIT!"/></To><Text Style="font-family:Comic Sans MS; color:#008000; ">serious</Text></Message><Message Date="21/01/2007" Time="10:27:20 PM" DateTime="2007-01-21T11:27:20.890Z" SessionID="698"><From><User FriendlyName="Jono..."/></From><To><User FriendlyName="- James(&amp;) Charmed! ARRIVE MEMORY CARD DAMNIT!"/></To><Text Style="font-family:Comic Sans MS; color:#008000; ">u lucky bastard</Text></Message><Message Date="21/01/2007" Time="10:27:28 PM" DateTime="2007-01-21T11:27:28.046Z" SessionID="698"><From><User FriendlyName="- James(&amp;) Charmed! ARRIVE MEMORY CARD DAMNIT!"/></From><To><User FriendlyName="Jono..."/></To><Text Style="font-family:Microsoft Sans Serif; color:#000000; ">haha</Text></Message><Message Date="21/01/2007" Time="10:27:31 PM" DateTime="2007-01-21T11:27:31.500Z" SessionID="698"><From><User FriendlyName="- James(&amp;) Charmed! ARRIVE MEMORY CARD DAMNIT!"/></From><To><User FriendlyName="Jono..."/></To><Text Style="font-family:Microsoft Sans Serif; color:#000000; ">well like 10 hours work</Text></Message><Message Date="21/01/2007" Time="10:27:36 PM" DateTime="2007-01-21T11:27:36.734Z" SessionID="698"><From><User FriendlyName="- James(&amp;) Charmed! ARRIVE MEMORY CARD DAMNIT!"/></From><To><User FriendlyName="Jono..."/></To><Text Style="font-family:Microsoft Sans Serif; color:#000000; ">with dinner and a bit of a break in the middle</Text></Message><Message Date="21/01/2007" Time="10:27:39 PM" DateTime="2007-01-21T11:27:39.484Z" SessionID="698"><From><User FriendlyName="- James(&amp;) Charmed! ARRIVE MEMORY CARD DAMNIT!"/></From><To><User FriendlyName="Jono..."/></To><Text Style="font-family:Microsoft Sans Serif; color:#000000; ">At carters</Text></Message><Message Date="21/01/2007" Time="10:27:44 PM" DateTime="2007-01-21T11:27:44.375Z" SessionID="698"><From><User FriendlyName="Jono..."/></From><To><User FriendlyName="- James(&amp;) Charmed! ARRIVE MEMORY CARD DAMNIT!"/></To><Text Style="font-family:Comic Sans MS; color:#008000; ">ha ha</Text></Message><Message Date="21/01/2007" Time="10:27:46 PM" DateTime="2007-01-21T11:27:46.125Z" SessionID="698"><From><User FriendlyName="Jono..."/></From><To><User FriendlyName="- James(&amp;) Charmed! ARRIVE MEMORY CARD DAMNIT!"/></To><Text Style="font-family:Comic Sans MS; color:#008000; ">nice</Text></Message><Message Date="21/01/2007" Time="10:27:47 PM" DateTime="2007-01-21T11:27:47.453Z" SessionID="698"><From><User FriendlyName="- James(&amp;) Charmed! ARRIVE MEMORY CARD DAMNIT!"/></From><To><User FriendlyName="Jono..."/></To><Text Style="font-family:Microsoft Sans Serif; color:#000000; ">reformatting+backuping and reinstalling 2 pc's</Text></Message><Message Date="21/01/2007" Time="10:28:04 PM" DateTime="2007-01-21T11:28:04.484Z" SessionID="698"><From><User FriendlyName="- James(&amp;) Charmed! ARRIVE MEMORY CARD DAMNIT!"/></From><To><User FriendlyName="Jono..."/></To><Text Style="font-family:Microsoft Sans Serif; color:#000000; ">Man im up for some gaming</Text></Message><Message Date="21/01/2007" Time="10:28:12 PM" DateTime="2007-01-21T11:28:12.828Z" SessionID="698"><From><User FriendlyName="Jono..."/></From><To><User FriendlyName="- James(&amp;) Charmed! ARRIVE MEMORY CARD DAMNIT!"/></To><Text Style="font-family:Comic Sans MS; color:#008000; ">sameo</Text></Message><Message Date="21/01/2007" Time="10:28:19 PM" DateTime="2007-01-21T11:28:19.109Z" SessionID="698"><From><User FriendlyName="Jono..."/></From><To><User FriendlyName="- James(&amp;) Charmed! ARRIVE MEMORY CARD DAMNIT!"/></To><Text Style="font-family:Comic Sans MS; color:#008000; ">but i have ot be off by 11:S</Text></Message><Message Date="21/01/2007" Time="10:28:23 PM" DateTime="2007-01-21T11:28:23.250Z" SessionID="698"><From><User FriendlyName="Jono..."/></From><To><User FriendlyName="- James(&amp;) Charmed! ARRIVE MEMORY CARD DAMNIT!"/></To><Text Style="font-family:Comic Sans MS; color:#008000; ">mums in a bitchy mood</Text></Message><Message Date="21/01/2007" Time="10:28:24 PM" DateTime="2007-01-21T11:28:24.390Z" SessionID="698"><From><User FriendlyName="- James(&amp;) Charmed! ARRIVE MEMORY CARD DAMNIT!"/></From><To><User FriendlyName="Jono..."/></To><Text Style="font-family:Microsoft Sans Serif; color:#000000; ">wacca or et</Text></Message><Message Date="21/01/2007" Time="10:28:26 PM" DateTime="2007-01-21T11:28:26.812Z" SessionID="698"><From><User FriendlyName="- James(&amp;) Charmed! ARRIVE MEMORY CARD DAMNIT!"/></From><To><User FriendlyName="Jono..."/></To><Text Style="font-family:Microsoft Sans Serif; color:#000000; ">ah k</Text></Message><Message Date="21/01/2007" Time="10:28:27 PM" DateTime="2007-01-21T11:28:27.437Z" SessionID="698"><From><User FriendlyName="Jono..."/></From><To><User FriendlyName="- James(&amp;) Charmed! ARRIVE MEMORY CARD DAMNIT!"/></To><Text Style="font-family:Comic Sans MS; color:#008000; ">et</Text></Message><Message Date="21/01/2007" Time="10:28:35 PM" DateTime="2007-01-21T11:28:35.062Z" SessionID="698"><From><User FriendlyName="- James(&amp;) Charmed! ARRIVE MEMORY CARD DAMNIT!"/></From><To><User FriendlyName="Jono..."/></To><Text Style="font-family:Microsoft Sans Serif; color:#000000; ">well hay I bought a PSP:D portable gaming much!</Text></Message><Message Date="21/01/2007" Time="10:28:40 PM" DateTime="2007-01-21T11:28:40.203Z" SessionID="698"><From><User FriendlyName="Jono..."/></From><To><User FriendlyName="- James(&amp;) Charmed! ARRIVE MEMORY CARD DAMNIT!"/></To><Text Style="font-family:Comic Sans MS; color:#008000; ">haha</Text></Message><Message Date="21/01/2007" Time="10:28:49 PM" DateTime="2007-01-21T11:28:49.421Z" SessionID="698"><From><User FriendlyName="Jono..."/></From><To><User FriendlyName="- James(&amp;) Charmed! ARRIVE MEMORY CARD DAMNIT!"/></To><Text Style="font-family:Comic Sans MS; color:#008000; ">where the frig do u get all ur damn moneyt</Text></Message><Message Date="21/01/2007" Time="10:28:59 PM" DateTime="2007-01-21T11:28:59.593Z" SessionID="698"><From><User FriendlyName="- James(&amp;) Charmed! ARRIVE MEMORY CARD DAMNIT!"/></From><To><User FriendlyName="Jono..."/></To><Text Style="font-family:Microsoft Sans Serif; color:#000000; ">$80 a month pocket money :D</Text></Message><Message Date="21/01/2007" Time="10:29:49 PM" DateTime="2007-01-21T11:29:49.906Z" SessionID="698"><From><User FriendlyName="- James(&amp;) Charmed! ARRIVE MEMORY CARD DAMNIT!"/></From><To><User FriendlyName="Jono..."/></To><Text Style="font-family:Microsoft Sans Serif; color:#000000; ">to get the psp it was $150 on ebayt, I got 80 pockect, $20