<?xml version="1.0"?>
<?xml-stylesheet type='text/xsl' href='MessageLog.xsl'?>
<Log FirstSessionID="1" LastSessionID="47"><Message Date="24/04/2004" Time="9:40:33 PM" DateTime="2004-04-24T11:40:33.492Z" SessionID="1"><From><User FriendlyName="James *-)"/></From><To><User FriendlyName=":PIv figured out my weakness...im totally addicted 2 babes(6)u came along just like a song nd britened my day i jst cnt:Dwitout u"/></To><Text Style="font-family:Trebuchet MS; font-weight:bold; color:#ff0000; ">hi</Text></Message><Message Date="24/04/2004" Time="9:41:39 PM" DateTime="2004-04-24T11:41:39.657Z" SessionID="1"><From><User FriendlyName="James *-)"/></From><To><User FriendlyName=":PIv figured out my weakness...im totally addicted 2 babes(6)u came along just like a song nd britened my day i jst cnt:Dwitout u"/></To><Text Style="font-family:Trebuchet MS; font-weight:bold; color:#ff0000; ">uh, Hi?</Text></Message><Message Date="24/04/2004" Time="9:41:41 PM" DateTime="2004-04-24T11:41:41.820Z" SessionID="1"><From><User FriendlyName="James *-)"/></From><To><User FriendlyName=":PIv figured out my weakness...im totally addicted 2 babes(6)u came along just like a song nd britened my day i jst cnt:Dwitout u"/></To><Text Style="font-family:Trebuchet MS; font-weight:bold; color:#ff0000; ">nope</Text></Message><Message Date="24/04/2004" Time="9:41:43 PM" DateTime="2004-04-24T11:41:43.072Z" SessionID="1"><From><User FriendlyName="James *-)"/></From><To><User FriendlyName=":PIv figured out my weakness...im totally addicted 2 babes(6)u came along just like a song nd britened my day i jst cnt:Dwitout u"/></To><Text Style="font-family:Trebuchet MS; font-weight:bold; color:#ff0000; ">hone</Text></Message><Message Date="24/04/2004" Time="9:41:45 PM" DateTime="2004-04-24T11:41:45.065Z" SessionID="1"><From><User FriendlyName="James *-)"/></From><To><User FriendlyName=":PIv figured out my weakness...im totally addicted 2 babes(6)u came along just like a song nd britened my day i jst cnt:Dwitout u"/></To><Text Style="font-family:Trebuchet MS; font-weight:bold; color:#ff0000; ">gone*</Text></Message><Message Date="24/04/2004" Time="9:41:51 PM" DateTime="2004-04-24T11:41:51.013Z" SessionID="1"><From><User FriendlyName="James *-)"/></From><To><User FriendlyName=":PIv figured out my weakness...im totally addicted 2 babes(6)u came along just like a song nd britened my day i jst cnt:Dwitout u"/></To><Text Style="font-family:Trebuchet MS; font-weight:bold; color:#ff0000; ">ignoring me AGAIN!</Text></Message><Message Date="24/04/2004" Time="9:41:56 PM" DateTime="2004-04-24T11:41:56.511Z" SessionID="2"><From><User FriendlyName=":PIv figured out my weakness...im totally addicted 2 babes(6)u came along just like a song nd britened my day i jst cnt:Dwitout u"/></From><To><User FriendlyName="James *-)"/></To><Text Style="font-family:Comic Sans MS; font-weight:bold; color:#ff00ff; ">soz</Text></Message><Message Date="24/04/2004" Time="9:41:56 PM" DateTime="2004-04-24T11:41:56.802Z" SessionID="2"><From><User FriendlyName=":PIv figured out my weakness...im totally addicted 2 babes(6)u came along just like a song nd britened my day i jst cnt:Dwitout u"/></From><To><User FriendlyName="James *-)"/></To><Text Style="font-family:Comic Sans MS; font-weight:bold; color:#ff00ff; ">here</Text></Message><Message Date="24/04/2004" Time="9:42:03 PM" DateTime="2004-04-24T11:42:03.862Z" SessionID="2"><From><User FriendlyName="James *-)"/></From><To><User FriendlyName=":PIv figured out my weakness...im totally addicted 2 babes(6)u came along just like a song nd britened my day i jst cnt:Dwitout u"/></To><Text Style="font-family:Trebuchet MS; font-weight:bold; color:#ff0000; ">ohh</Text></Message><Message Date="24/04/2004" Time="9:42:05 PM" DateTime="2004-04-24T11:42:05.244Z" SessionID="2"><From><User FriendlyName="James *-)"/></From><To><User FriendlyName=":PIv figured out my weakness...im totally addicted 2 babes(6)u came along just like a song nd britened my day i jst cnt:Dwitout u"/></To><Text Style="font-family:Trebuchet MS; font-weight:bold; color:#ff0000; ">hi</Text></Message><Message Date="24/04/2004" Time="9:42:46 PM" DateTime="2004-04-24T11:42:46.243Z" SessionID="2"><From><User FriendlyName=":PIv figured out my weakness...im totally addicted 2 babes(6)u came along just like a song nd britened my day i jst cnt:Dwitout u"/></From><To><User FriendlyName="James *-)"/></To><Text Style="font-family:Comic Sans MS; font-weight:bold; color:#ff00ff; ">hi</Text></Message><Message Date="24/04/2004" Time="9:56:22 PM" DateTime="2004-04-24T11:56:22.286Z" SessionID="3"><From><User FriendlyName=":PIv figured out my weakness...im totally addicted 2 babes(6)u came along just like a song nd britened my day i jst cnt:Dwitout u"/></From><To><User FriendlyName="James *-)"/></To><Text Style="font-family:Comic Sans MS; font-weight:bold; color:#ff00ff; ">so</Text></Message><Message Date="24/04/2004" Time="9:56:36 PM" DateTime="2004-04-24T11:56:36.687Z" SessionID="3"><From><User FriendlyName="James *-)"/></From><To><User FriendlyName=":PIv figured out my weakness...im totally addicted 2 babes(6)u came along just like a song nd britened my day i jst cnt:Dwitout u"/></To><Text Style="font-family:Trebuchet MS; font-weight:bold; color:#ff0000; ">so</Text></Message><Message Date="24/04/2004" Time="9:56:54 PM" DateTime="2004-04-24T11:56:54.402Z" SessionID="4"><From><User FriendlyName=":PIv figured out my weakness...im totally addicted 2 babes(6)u came along just like a song nd britened my day i jst cnt:Dwitout u"/></From><To><User FriendlyName="James *-)"/></To><Text Style="font-family:Comic Sans MS; font-weight:bold; color:#ff00ff; ">al that fus nd then u hardly talk</Text></Message><Message Date="24/04/2004" Time="9:57:17 PM" DateTime="2004-04-24T11:57:17.846Z" SessionID="4"><From><User FriendlyName="James *-)"/></From><To><User FriendlyName=":PIv figured out my weakness...im totally addicted 2 babes(6)u came along just like a song nd britened my day i jst cnt:Dwitout u"/></To><Text Style="font-family:Trebuchet MS; font-weight:bold; color:#ff0000; ">soz talking 2 my friend on the webcam</Text></Message><Message Date="24/04/2004" Time="9:57:23 PM" DateTime="2004-04-24T11:57:23.744Z" SessionID="4"><From><User FriendlyName="James *-)"/></From><To><User FriendlyName=":PIv figured out my weakness...im totally addicted 2 babes(6)u came along just like a song nd britened my day i jst cnt:Dwitout u"/></To><Text Style="font-family:Trebuchet MS; font-weight:bold; color:#ff0000; ">dont really have much time</Text></Message><Message Date="24/04/2004" Time="9:57:26 PM" DateTime="2004-04-24T11:57:26.228Z" SessionID="5"><From><User FriendlyName=":PIv figured out my weakness...im totally addicted 2 babes(6)u came along just like a song nd britened my day i jst cnt:Dwitout u"/></From><To><User FriendlyName="James *-)"/></To><Text Style="font-family:Comic Sans MS; font-weight:bold; color:#ff00ff; ">okays</Text></Message><Message Date="24/04/2004" Time="9:57:27 PM" DateTime="2004-04-24T11:57:27.850Z" SessionID="5"><From><User FriendlyName=":PIv figured out my weakness...im totally addicted 2 babes(6)u came along just like a song nd britened my day i jst cnt:Dwitout u"/></From><To><User FriendlyName="James *-)"/></To><Text Style="font-family:Comic Sans MS; font-weight:bold; color:#ff00ff; ">bye</Text></Message><Message Date="24/04/2004" Time="9:57:34 PM" DateTime="2004-04-24T11:57:34.530Z" SessionID="5"><From><User FriendlyName="James *-)"/></From><To><User FriendlyName=":PIv figured out my weakness...im totally addicted 2 babes(6)u came along just like a song nd britened my day i jst cnt:Dwitout u"/></To><Text Style="font-family:Trebuchet MS; font-weight:bold; color:#ff0000; ">bye i gtg 2</Text></Message><Message Date="24/04/2004" Time="9:57:46 PM" DateTime="2004-04-24T11:57:46.637Z" SessionID="6"><From><User FriendlyName=":PIv figured out my weakness...im totally addicted 2 babes(6)u came along just like a song nd britened my day i jst cnt:Dwitout u"/></From><To><User FriendlyName="James *-)"/></To><Text Style="font-family:Comic Sans MS; font-weight:bold; color:#ff00ff; ">by</Text></Message><Message Date="24/04/2004" Time="9:58:27 PM" DateTime="2004-04-24T11:58:27.176Z" SessionID="6"><From><User FriendlyName="James *-)"/></From><To><User FriendlyName=":PIv figured out my weakness...im totally addicted 2 babes(6)u came along just like a song nd britened my day i jst cnt:Dwitout u"/></To><Text Style="font-family:Trebuchet MS; font-weight:bold; color:#ff0000; ">Sleep Sweet</Text></Message><Message Date="24/04/2004" Time="9:58:53 PM" DateTime="2004-04-24T11:58:53.874Z" SessionID="7"><From><User FriendlyName=":PIv figured out my weakness...im totally addicted 2 babes(6)u came along just like a song nd britened my day i jst cnt:Dwitout u"/></From><To><User FriendlyName="James *-)"/></To><Text Style="font-family:Comic Sans MS; font-weight:bold; color:#ff00ff; ">yep</Text></Message><Message Date="24/04/2004" Time="9:58:56 PM" DateTime="2004-04-24T11:58:56.067Z" SessionID="7"><From><User FriendlyName=":PIv figured out my weakness...im totally addicted 2 babes(6)u came along just like a song nd britened my day i jst cnt:Dwitout u"/></From><To><User FriendlyName="James *-)"/></To><Text Style="font-family:Comic Sans MS; font-weight:bold; color:#ff00ff; ">sure 2</Text></Message><Message Date="25/04/2004" Time="9:35:20 PM" DateTime="2004-04-25T11:35:20.412Z" SessionID="8"><From><User FriendlyName="Jameš :) 9 Days to my Birthday &lt;:o)"/></From><To><User FriendlyName=":PI figured out my weakness, im totally addicted 2 babes:Pu came along just like a song nd britened my day(#) keesha's a champ(&amp;)"/></To><Text Style="font-family:Trebuchet MS; font-weight:bold; color:#ff0000; ">Hullo</Text></Message><Message Date="25/04/2004" Time="9:36:21 PM" DateTime="2004-04-25T11:36:21.530Z" SessionID="8"><From><User FriendlyName=":PI figured out my weakness, im totally addicted 2 babes:Pu came along just like a song nd britened my day(#) keesha's a champ(&amp;)"/></From><To><User FriendlyName="Jameš :) 9 Days to my Birthday &lt;:o)"/></To><Text Style="font-family:Comic Sans MS; font-weight:bold; color:#ff00ff; ">hi</Text></Message><Message Date="25/04/2004" Time="9:36:32 PM" DateTime="2004-04-25T11:36:32.335Z" SessionID="8"><From><User FriendlyName="Jameš :) 9 Days to my Birthday &lt;:o)"/></From><To><User FriendlyName=":PI figured out my weakness, im totally addicted 2 babes:Pu came along just like a song nd britened my day(#) keesha's a champ(&amp;)"/></To><Text Style="font-family:Trebuchet MS; font-weight:bold; color:#ff0000; ">Guess what!</Text></Message><Message Date="25/04/2004" Time="9:36:41 PM" DateTime="2004-04-25T11:36:41.248Z" SessionID="8"><From><User FriendlyName=":PI figured out my weakness, im totally addicted 2 babes:Pu came along just like a song nd britened my day(#) keesha's a champ(&amp;)"/></From><To><User FriendlyName="Jameš :) 9 Days to my Birthday &lt;:o)"/></To><Text Style="font-family:Comic Sans MS; font-weight:bold; color:#ff00ff; ">wat?</Text></Message><Message Date="25/04/2004" Time="9:36:44 PM" DateTime="2004-04-25T11:36:44.363Z" SessionID="8"><From><User FriendlyName="Jameš :) 9 Days to my Birthday &lt;:o)"/></From><To><User FriendlyName=":PI figured out my weakness, im totally addicted 2 babes:Pu came along just like a song nd britened my day(#) keesha's a champ(&amp;)"/></To><Text Style="font-family:Trebuchet MS; font-weight:bold; color:#ff0000; ">My dad just got called up to goto singapore :(</Text></Message><Message Date="25/04/2004" Time="9:36:56 PM" DateTime="2004-04-25T11:36:56.901Z" SessionID="8"><From><User FriendlyName=":PI figured out my weakness, im totally addicted 2 babes:Pu came along just like a song nd britened my day(#) keesha's a champ(&amp;)"/></From><To><User FriendlyName="Jameš :) 9 Days to my Birthday &lt;:o)"/></To><Text Style="font-family:Comic Sans MS; font-weight:bold; color:#ff00ff; ">oh</Text></Message><Message Date="25/04/2004" Time="9:37:01 PM" DateTime="2004-04-25T11:37:01.447Z" SessionID="8"><From><User FriendlyName="Jameš :) 9 Days to my Birthday &lt;:o)"/></From><To><User FriendlyName=":PI figured out my weakness, im totally addicted 2 babes:Pu came along just like a song nd britened my day(#) keesha's a champ(&amp;)"/></To><Text Style="font-family:Trebuchet MS; font-weight:bold; color:#ff0000; ">He had to leave in 10 minutes</Text></Message><Message Date="25/04/2004" Time="9:37:15 PM" DateTime="2004-04-25T11:37:15.097Z" SessionID="8"><From><User FriendlyName=":PI figured out my weakness, im totally addicted 2 babes:Pu came along just like a song nd britened my day(#) keesha's a champ(&amp;)"/></From><To><User FriendlyName="Jameš :) 9 Days to my Birthday &lt;:o)"/></To><Text Style="font-family:Comic Sans MS; font-weight:bold; color:#ff00ff; ">wow wat 4 like work?</Text></Message><Message Date="25/04/2004" Time="9:37:16 PM" DateTime="2004-04-25T11:37:16.839Z" SessionID="8"><From><User FriendlyName="Jameš :) 9 Days to my Birthday &lt;:o)"/></From><To><User FriendlyName=":PI figured out my weakness, im totally addicted 2 babes:Pu came along just like a song nd britened my day(#) keesha's a champ(&amp;)"/></To><Text Style="font-family:Trebuchet MS; font-weight:bold; color:#ff0000; ">hes gone now , but he gets back on munday</Text></Message><Message Date="25/04/2004" Time="9:37:22 PM" DateTime="2004-04-25T11:37:22.447Z" SessionID="8"><From><User FriendlyName="Jameš :) 9 Days to my Birthday &lt;:o)"/></From><To><User FriendlyName=":PI figured out my weakness, im totally addicted 2 babes:Pu came along just like a song nd britened my day(#) keesha's a champ(&amp;)"/></To><Text Style="font-family:Trebuchet MS; font-weight:bold; color:#ff0000; ">Hes a pilot</Text></Message><Message Date="25/04/2004" Time="9:37:25 PM" DateTime="2004-04-25T11:37:25.332Z" SessionID="8"><From><User FriendlyName="Jameš :) 9 Days to my Birthday &lt;:o)"/></From><To><User FriendlyName=":PI figured out my weakness, im totally addicted 2 babes:Pu came along just like a song nd britened my day(#) keesha's a champ(&amp;)"/></To><Text Style="font-family:Trebuchet MS; font-weight:bold; color:#ff0000; ">Captain</Text></Message><Message Date="25/04/2004" Time="9:37:42 PM" DateTime="2004-04-25T11:37:42.536Z" SessionID="8"><From><User FriendlyName=":PI figured out my weakness, im totally addicted 2 babes:Pu came along just like a song nd britened my day(#) keesha's a champ(&amp;)"/></From><To><User FriendlyName="Jameš :) 9 Days to my Birthday &lt;:o)"/></To><Text Style="font-family:Comic Sans MS; font-weight:bold; color:#ff00ff; ">wow</Text></Message><Message Date="25/04/2004" Time="9:38:39 PM" DateTime="2004-04-25T11:38:39.438Z" SessionID="8"><From><User FriendlyName="Jameš :) 9 Days to my Birthday &lt;:o)"/></From><To><User FriendlyName=":PI figured out my weakness, im totally addicted 2 babes:Pu came along just like a song nd britened my day(#) keesha's a champ(&amp;)"/></To><Text Style="font-family:Trebuchet MS; font-weight:bold; color:#ff0000; ">yeah</Text></Message><Message Date="25/04/2004" Time="9:38:51 PM" DateTime="2004-04-25T11:38:51.796Z" SessionID="8"><From><User FriendlyName="Jameš :) 9 Days to my Birthday &lt;:o)"/></From><To><User FriendlyName=":PI figured out my weakness, im totally addicted 2 babes:Pu came along just like a song nd britened my day(#) keesha's a champ(&amp;)"/></To><Text Style="font-family:Trebuchet MS; font-weight:bold; color:#ff0000; ">But hes getting a Video Card over there for my Birthday</Text></Message><Message Date="25/04/2004" Time="9:38:56 PM" DateTime="2004-04-25T11:38:56.092Z" SessionID="8"><From><User FriendlyName="Jameš :) 9 Days to my Birthday &lt;:o)"/></From><To><User FriendlyName=":PI figured out my weakness, im totally addicted 2 babes:Pu came along just like a song nd britened my day(#) keesha's a champ(&amp;)"/></To><Text Style="font-family:Trebuchet MS; font-weight:bold; color:#ff0000; ">so thats a +</Text></Message><Message Date="25/04/2004" Time="9:39:26 PM" DateTime="2004-04-25T11:39:26.416Z" SessionID="8"><From><User FriendlyName=":PI figured out my weakness, im totally addicted 2 babes:Pu came along just like a song nd britened my day(#) keesha's a champ(&amp;)"/></From><To><User FriendlyName="Jameš :) 9 Days to my Birthday &lt;:o)"/></To><Text Style="font-family:Comic Sans MS; font-weight:bold; color:#ff00ff; ">kool</Text></Message><Message Date="27/04/2004" Time="10:19:21 PM" DateTime="2004-04-27T12:19:21.227Z" SessionID="9"><From><User FriendlyName="Jameš &lt;:o)"/></From><To><User FriendlyName="y dnt u go  put a condom on ur hed cos if ur gonna act like a dik u mite aswell look like 1 2(#) keisha's a champ(&amp;)"/></To><Text Style="font-family:Trebuchet MS; font-weight:bold; color:#008000; ">hi</Text></Message><Join Date="27/04/2004" Time="10:19:32 PM" DateTime="2004-04-27T12:19:32.513Z" SessionID="9"><User FriendlyName="(b) St&lt;:o)@Do (b)"/><Text Style="color:#008000; ">(b) St&lt;:o)@Do (b) has been added to the conversation.</Text></Join><Message Date="27/04/2004" Time="10:19:44 PM" DateTime="2004-04-27T12:19:44.891Z" SessionID="9"><From><User FriendlyName="Jameš &lt;:o)"/></From><To><User FriendlyName="(b) St&lt;:o)@Do (b)"/><User FriendlyName="y dnt u go  put a condom on ur hed cos if ur gonna act like a dik u mite aswell look like 1 2(#) keisha's a champ(&amp;)"/></To><Text Style="font-family:Trebuchet MS; font-weight:bold; color:#008000; ">hi</Text></Message><Message Date="27/04/2004" Time="10:19:52 PM" DateTime="2004-04-27T12:19:52.001Z" SessionID="9"><From><User FriendlyName="y dnt u go  put a condom on ur hed cos if ur gonna act like a dik u mite aswell look like 1 2(#) keisha's a champ(&amp;)"/></From><To><User FriendlyName="Jameš &lt;:o)"/><User FriendlyName="(b) St&lt;:o)@Do (b)"/></To><Text Style="font-family:Comic Sans MS; font-weight:bold; color:#ff00ff; ">ah wat?????????</Text></Message><Message Date="27/04/2004" Time="10:19:55 PM" DateTime="2004-04-27T12:19:55.216Z" SessionID="9"><From><User FriendlyName="Jameš &lt;:o)"/></From><To><User FriendlyName="(b) St&lt;:o)@Do (b)"/><User FriendlyName="y dnt u go  put a condom on ur hed cos if ur gonna act like a dik u mite aswell look like 1 2(#) keisha's a champ(&amp;)"/></To><Text Style="font-family:Trebuchet MS; font-weight:bold; color:#008000; ">hi</Text></Message><Message Date="27/04/2004" Time="10:20:01 PM" DateTime="2004-04-27T12:20:01.995Z" SessionID="9"><From><User FriendlyName="Jameš &lt;:o)"/></From><To><User FriendlyName="(b) St&lt;:o)@Do (b)"/><User FriendlyName="y dnt u go  put a condom on ur hed cos if ur gonna act like a dik u mite aswell look like 1 2(#) keisha's a champ(&amp;)"/></To><Text Style="font-family:Trebuchet MS; font-weight:bold; color:#008000; ">This is my friend</Text></Message><Message Date="27/04/2004" Time="10:20:05 PM" DateTime="2004-04-27T12:20:05.560Z" SessionID="9"><From><User FriendlyName="Jameš &lt;:o)"/></From><To><User FriendlyName="(b) St&lt;:o)@Do (b)"/><User FriendlyName="y dnt u go  put a condom on ur hed cos if ur gonna act like a dik u mite aswell look like 1 2(#) keisha's a champ(&amp;)"/></To><Text Style="font-family:Trebuchet MS; font-weight:bold; color:#008000; ">say hi</Text></Message><Message Date="27/04/2004" Time="10:20:08 PM" DateTime="2004-04-27T12:20:08.565Z" SessionID="9"><From><User FriendlyName="(b) St&lt;:o)@Do (b)"/></From><To><User FriendlyName="Jameš &lt;:o)"/><User FriendlyName="y dnt u go  put a condom on ur hed cos if ur gonna act like a dik u mite aswell look like 1 2(#) keisha's a champ(&amp;)"/></To><Text Style="font-family:Franklin Gothic Book; font-weight:bold; color:#ff0000; ">hey</Text></Message><Message Date="27/04/2004" Time="10:20:13 PM" DateTime="2004-04-27T12:20:13.562Z" SessionID="9"><From><User FriendlyName="Jameš &lt;:o)"/></From><To><User FriendlyName="(b) St&lt;:o)@Do (b)"/><User FriendlyName="y dnt u go  put a condom on ur hed cos if ur gonna act like a dik u mite aswell look like 1 2(#) keisha's a champ(&amp;)"/></To><Text Style="font-family:Trebuchet MS; font-weight:bold; color:#008000; ">I SAID HI!</Text></Message><Message Date="27/04/2004" Time="10:20:16 PM" DateTime="2004-04-27T12:20:16.296Z" SessionID="9"><From><User FriendlyName="y dnt u go  put a condom on ur hed cos if ur gonna act like a dik u mite aswell look like 1 2(#) keisha's a champ(&amp;)"/></From><To><User FriendlyName="Jameš &lt;:o)"/><User FriendlyName="(b) St&lt;:o)@Do (b)"/></To><Text Style="font-family:Comic Sans MS; font-weight:bold; color:#ff00ff; ">hi</Text></Message><Message Date="27/04/2004" Time="10:20:18 PM" DateTime="2004-04-27T12:20:18.429Z" SessionID="9"><From><User FriendlyName="Jameš &lt;:o)"/></From><To><User FriendlyName="(b) St&lt;:o)@Do (b)"/><User FriendlyName="y dnt u go  put a condom on ur hed cos if ur gonna act like a dik u mite aswell look like 1 2(#) keisha's a champ(&amp;)"/></To><Text Style="font-family:Trebuchet MS; font-weight:bold; color:#008000; ">Not hey</Text></Message><Message Date="27/04/2004" Time="10:20:20 PM" DateTime="2004-04-27T12:20:20.242Z" SessionID="9"><From><User FriendlyName="y dnt u go  put a condom on ur hed cos if ur gonna act like a dik u mite aswell look like 1 2(#) keisha's a champ(&amp;)"/></From><To><User FriendlyName="Jameš &lt;:o)"/><User FriendlyName="(b) St&lt;:o)@Do (b)"/></To><Text Style="font-family:Comic Sans MS; font-weight:bold; color:#ff00ff; ">hi frend </Text></Message><Message Date="27/04/2004" Time="10:20:26 PM" DateTime="2004-04-27T12:20:26.751Z" SessionID="9"><From><User FriendlyName="Jameš &lt;:o)"/></From><To><User FriendlyName="(b) St&lt;:o)@Do (b)"/><User FriendlyName="y dnt u go  put a condom on ur hed cos if ur gonna act like a dik u mite aswell look like 1 2(#) keisha's a champ(&amp;)"/></To><Text Style="font-family:Trebuchet MS; font-weight:bold; color:#008000; ">hi</Text></Message><Message Date="27/04/2004" Time="10:20:32 PM" DateTime="2004-04-27T12:20:32.890Z" SessionID="9"><From><User FriendlyName="(b) St&lt;:o)@Do (b)"/></From><To><User FriendlyName="Jameš &lt;:o)"/><User FriendlyName="y dnt u go  put a condom on ur hed cos if ur gonna act like a dik u mite aswell look like 1 2(#) keisha's a champ(&amp;)"/></To><Text Style="font-family:Franklin Gothic Book; font-weight:bold; color:#ff0000; ">hi frend</Text></Message><Message Date="27/04/2004" Time="10:20:36 PM" DateTime="2004-04-27T12:20:36.615Z" SessionID="9"><From><User FriendlyName="Jameš &lt;:o)"/></From><To><User FriendlyName="(b) St&lt;:o)@Do (b)"/><User FriendlyName="y dnt u go  put a condom on ur hed cos if ur gonna act like a dik u mite aswell look like 1 2(#) keisha's a champ(&amp;)"/></To><Text Style="font-family:Trebuchet MS; font-weight:bold; color:#008000; ">see , hi s is much more formal</Text></Message><Message Date="27/04/2004" Time="10:20:40 PM" DateTime="2004-04-27T12:20:40.481Z" SessionID="9"><From><User FriendlyName="Jameš &lt;:o)"/></From><To><User FriendlyName="(b) St&lt;:o)@Do (b)"/><User FriendlyName="y dnt u go  put a condom on ur hed cos if ur gonna act like a dik u mite aswell look like 1 2(#) keisha's a champ(&amp;)"/></To><Text Style="font-family:Trebuchet MS; font-weight:bold; color:#008000; ">:)</Text></Message><Message Date="27/04/2004" Time="10:21:04 PM" DateTime="2004-04-27T12:21:04.736Z" SessionID="9"><From><User FriendlyName="y dnt u go  put a condom on ur hed cos if ur gonna act like a dik u mite aswell look like 1 2(#) keisha's a champ(&amp;)"/></From><To><User FriendlyName="Jameš &lt;:o)"/><User FriendlyName="(b) St&lt;:o)@Do (b)"/></To><Text Style="font-family:Comic Sans MS; font-weight:bold; color:#ff00ff; ">he is...</Text></Message><Message Date="27/04/2004" Time="10:21:11 PM" DateTime="2004-04-27T12:21:11.605Z" SessionID="9"><From><User FriendlyName="(b) St&lt;:o)@Do (b)"/></From><To><User FriendlyName="Jameš &lt;:o)"/><User FriendlyName="y dnt u go  put a condom on ur hed cos if ur gonna act like a dik u mite aswell look like 1 2(#) keisha's a champ(&amp;)"/></To><Text Style="font-family:Franklin Gothic Book; font-weight:bold; color:#ff0000; ">hi</Text></Message><Message Date="27/04/2004" Time="10:21:14 PM" DateTime="2004-04-27T12:21:14.069Z" SessionID="9"><From><User FriendlyName="Jameš &lt;:o)"/></From><To><User FriendlyName="(b) St&lt;:o)@Do (b)"/><User FriendlyName="y dnt u go  put a condom on ur hed cos if ur gonna act like a dik u mite aswell look like 1 2(#) keisha's a champ(&amp;)"/></To><Text Style="font-family:Trebuchet MS; font-weight:bold; color:#008000; ">see</Text></Message><Message Date="27/04/2004" Time="10:21:15 PM" DateTime="2004-04-27T12:21:15.251Z" SessionID="9"><From><User FriendlyName="(b) St&lt;:o)@Do (b)"/></From><To><User FriendlyName="Jameš &lt;:o)"/><User FriendlyName="y dnt u go  put a condom on ur hed cos if ur gonna act like a dik u mite aswell look like 1 2(#) keisha's a champ(&amp;)"/></To><Text Style="font-family:Franklin Gothic Book; font-weight:bold; color:#ff0000; ">i g2g</Text></Message><Message Date="27/04/2004" Time="10:21:18 PM" DateTime="2004-04-27T12:21:18.145Z" SessionID="9"><From><User FriendlyName="Jameš &lt;:o)"/></From><To><User FriendlyName="(b) St&lt;:o)@Do (b)"/><User FriendlyName="y dnt u go  put a condom on ur hed cos if ur gonna act like a dik u mite aswell look like 1 2(#) keisha's a champ(&amp;)"/></To><Text Style="font-family:Trebuchet MS; font-weight:bold; color:#008000; ">Ok</Text></Message><Message Date="27/04/2004" Time="10:21:18 PM" DateTime="2004-04-27T12:21:18.626Z" SessionID="9"><From><User FriendlyName="(b) St&lt;:o)@Do (b)"/></From><To><User FriendlyName="Jameš &lt;:o)"/><User FriendlyName="y dnt u go  put a condom on ur hed cos if ur gonna act like a dik u mite aswell look like 1 2(#) keisha's a champ(&amp;)"/></To><Text Style="font-family:Franklin Gothic Book; font-weight:bold; color:#ff0000; ">hi</Text></Message><Message Date="27/04/2004" Time="10:21:19 PM" DateTime="2004-04-27T12:21:19.597Z" SessionID="9"><From><User FriendlyName="(b) St&lt;:o)@Do (b)"/></From><To><User FriendlyName="Jameš &lt;:o)"/><User FriendlyName="y dnt u go  put a condom on ur hed cos if ur gonna act like a dik u mite aswell look like 1 2(#) keisha's a champ(&amp;)"/></To><Text Style="font-family:Franklin Gothic Book; font-weight:bold; color:#ff0000; ">bi</Text></Message><Message Date="27/04/2004" Time="10:21:20 PM" DateTime="2004-04-27T12:21:20.478Z" SessionID="9"><From><User FriendlyName="Jameš &lt;:o)"/></From><To><User FriendlyName="(b) St&lt;:o)@Do (b)"/><User FriendlyName="y dnt u go  put a condom on ur hed cos if ur gonna act like a dik u mite aswell look like 1 2(#) keisha's a champ(&amp;)"/></To><Text Style="font-family:Trebuchet MS; font-weight:bold; color:#008000; ">ne2</Text></Message><Leave Date="27/04/2004" Time="10:21:23 PM" DateTime="2004-04-27T12:21:23.172Z" SessionID="9"><User FriendlyName="(b) St&lt;:o)@Do (b)"/><Text Style="color:#800000; ">(b) St&lt;:o)@Do (b) has left the conversation.</Text></Leave><Message Date="27/04/2004" Time="10:21:23 PM" DateTime="2004-04-27T12:21:23.563Z" SessionID="9"><From><User FriendlyName="Jameš &lt;:o)"/></From><To><User FriendlyName="y dnt u go  put a condom on ur hed cos if ur gonna act like a dik u mite aswell look like 1 2(#) keisha's a champ(&amp;)"/></To><Text Style="font-family:Trebuchet MS; font-weight:bold; color:#008000; ">me2</Text></Message><Message Date="27/04/2004" Time="10:21:26 PM" DateTime="2004-04-27T12:21:26.527Z" SessionID="9"><From><User FriendlyName="y dnt u go  put a condom on ur hed cos if ur gonna act like a dik u mite aswell look like 1 2(#) keisha's a champ(&amp;)"/></From><To><User FriendlyName="Jameš &lt;:o)"/></To><Text Style="font-family:Comic Sans MS; font-weight:bold; color:#ff00ff; ">by</Text></Message><Message Date="27/04/2004" Time="10:21:28 PM" DateTime="2004-04-27T12:21:28.520Z" SessionID="9"><From><User FriendlyName="Jameš &lt;:o)"/></From><To><User FriendlyName="y dnt u go  put a condom on ur hed cos if ur gonna act like a dik u mite aswell look like 1 2(#) keisha's a champ(&amp;)"/></To><Text Style="font-family:Trebuchet MS; font-weight:bold; color:#008000; ">by</Text></Message><Message Date="3/05/2004" Time="9:41:56 PM" DateTime="2004-05-03T11:41:56.484Z" SessionID="10"><From><User FriendlyName="Jameš (um) I probably wont talk As I am watching The legend of Bagger Vance"/></From><To><User FriendlyName="(¯`·._.·[tÂk€ m¥ ß®€ªTh ðWª¥]·._.·´¯)"/></To><Text Style="font-family:Trebuchet MS; font-weight:bold; color:#008000; ">Hey</Text></Message><Message Date="3/05/2004" Time="9:42:07 PM" DateTime="2004-05-03T11:42:07.920Z" SessionID="10"><From><User FriendlyName="Jameš (um) I probably wont talk As I am watching The legend of Bagger Vance"/></From><To><User FriendlyName="(¯`·._.·[tÂk€ m¥ ß®€ªTh ðWª¥]·._.·´¯)"/></To><Text Style="font-family:Trebuchet MS; font-weight:bold; color:#008000; ">wat was the Big Brother Secret</Text></Message><Message Date="3/05/2004" Time="9:42:42 PM" DateTime="2004-05-03T11:42:42.600Z" SessionID="10"><From><User FriendlyName="Jameš (um)"/></From><To><User FriendlyName="(¯`·._.·[tÂk€ m¥ ß®€ªTh ðWª¥]·._.·´¯)"/></To><Text Style="font-family:Trebuchet MS; font-weight:bold; color:#008000; ">hello?</Text></Message><Message Date="3/05/2004" Time="9:42:44 PM" DateTime="2004-05-03T11:42:44.373Z" SessionID="10"><From><User FriendlyName="Jameš (um)"/></From><To><User FriendlyName="(¯`·._.·[tÂk€ m¥ ß®€ªTh ðWª¥]·._.·´¯)"/></To><Text Style="font-family:Trebuchet MS; font-weight:bold; color:#008000; ">u there</Text></Message><Message Date="3/05/2004" Time="9:43:06 PM" DateTime="2004-05-03T11:43:06.334Z" SessionID="11"><From><User FriendlyName="(¯`·._.·[tÂk€ m¥ ß®€ªTh ðWª¥]·._.·´¯)"/></From><To><User FriendlyName="Jameš (um)"/></To><Text Style="font-family:Comic Sans MS; font-weight:bold; color:#ff00ff; ">hi</Text></Message><Message Date="3/05/2004" Time="9:43:10 PM" DateTime="2004-05-03T11:43:10.731Z" SessionID="11"><From><User FriendlyName="(¯`·._.·[tÂk€ m¥ ß®€ªTh ðWª¥]·._.·´¯)"/></From><To><User FriendlyName="Jameš (um)"/></To><Text Style="font-family:Comic Sans MS; font-weight:bold; color:#ff00ff; ">i dno i dnt watch that crap</Text></Message><Message Date="3/05/2004" Time="9:43:14 PM" DateTime="2004-05-03T11:43:14.176Z" SessionID="11"><From><User FriendlyName="Jameš (um)"/></From><To><User FriendlyName="(¯`·._.·[tÂk€ m¥ ß®€ªTh ðWª¥]·._.·´¯)"/></To><Text Style="font-family:Trebuchet MS; font-weight:bold; color:#008000; ">ok</Text></Message><Message Date="3/05/2004" Time="9:43:17 PM" DateTime="2004-05-03T11:43:17.300Z" SessionID="11"><From><User FriendlyName="(¯`·._.·[tÂk€ m¥ ß®€ªTh ðWª¥]·._.·´¯)"/></From><To><User FriendlyName="Jameš (um)"/></To><Text Style="font-family:Comic Sans MS; font-weight:bold; color:#ff00ff; ">mayb big brother is a woman</Text></Message><Message Date="3/05/2004" Time="9:43:25 PM" DateTime="2004-05-03T11:43:25.422Z" SessionID="11"><From><User FriendlyName="Jameš (um)"/></From><To><User FriendlyName="(¯`·._.·[tÂk€ m¥ ß®€ªTh ðWª¥]·._.·´¯)"/></To><Text Style="font-family:Trebuchet MS; font-weight:bold; color:#008000; ">I watched bagger vance</Text></Message><Message Date="3/05/2004" Time="9:43:52 PM" DateTime="2004-05-03T11:43:52.651Z" SessionID="12"><From><User FriendlyName="(¯`·._.·[tÂk€ m¥ ß®€ªTh ðWª¥]·._.·´¯)"/></From><To><User FriendlyName="Jameš (um)"/></To><Text Style="font-family:Comic Sans MS; font-weight:bold; color:#ff00ff; ">rite</Text></Message><Message Date="3/05/2004" Time="9:45:36 PM" DateTime="2004-05-03T11:45:36.250Z" SessionID="12"><From><User FriendlyName="(¯`·._.·[tÂk€ m¥ ß®€ªTh ðWª¥]·._.·´¯)"/></From><To><User FriendlyName="Jameš (um)"/></To><Text Style="font-family:Comic Sans MS; font-weight:bold; color:#ff00ff; ">haha</Text></Message><Message Date="3/05/2004" Time="9:45:39 PM" DateTime="2004-05-03T11:45:39.024Z" SessionID="12"><From><User FriendlyName="(¯`·._.·[tÂk€ m¥ ß®€ªTh ðWª¥]·._.·´¯)"/></From><To><User FriendlyName="Jameš (um)"/></To><Text Style="font-family:Comic Sans MS; font-weight:bold; color:#ff00ff; ">so hows ya</Text></Message><Message Date="3/05/2004" Time="9:47:54 PM" DateTime="2004-05-03T11:47:54.088Z" SessionID="12"><From><User FriendlyName="Jameš (um)"/></From><To><User FriendlyName="(¯`·._.·[tÂk€ m¥ ß®€ªTh ðWª¥]·._.·´¯)"/></To><Text Style="font-family:Trebuchet MS; font-weight:bold; color:#008000; ">Ok</Text></Message><Message Date="3/05/2004" Time="9:48:53 PM" DateTime="2004-05-03T11:48:53.013Z" SessionID="12"><From><User FriendlyName="Jameš (um)"/></From><To><User FriendlyName="(¯`·._.·[tÂk€ m¥ ß®€ªTh ðWª¥]·._.·´¯)"/></To><Text Style="font-family:Trebuchet MS; font-weight:bold; color:#008000; ">how are you?</Text></Message><Message Date="3/05/2004" Time="9:49:00 PM" DateTime="2004-05-03T11:49:00.313Z" SessionID="13"><From><User FriendlyName="(¯`·._.·[tÂk€ m¥ ß®€ªTh ðWª¥]·._.·´¯)"/></From><To><User FriendlyName="Jameš (um)"/></To><Text Style="font-family:Comic Sans MS; font-weight:bold; color:#ff00ff; ">ok</Text></Message><Message Date="3/05/2004" Time="9:49:25 PM" DateTime="2004-05-03T11:49:25.229Z" SessionID="13"><From><User FriendlyName="Jameš (um)"/></From><To><User FriendlyName="(¯`·._.·[tÂk€ m¥ ß®€ªTh ðWª¥]·._.·´¯)"/></To><Text Style="font-family:Trebuchet MS; font-weight:bold; color:#008000; ">wacha bin up 2?</Text></Message><Message Date="3/05/2004" Time="9:49:31 PM" DateTime="2004-05-03T11:49:31.799Z" SessionID="13"><From><User FriendlyName="(¯`·._.·[tÂk€ m¥ ß®€ªTh ðWª¥]·._.·´¯)"/></From><To><User FriendlyName="Jameš (um)"/></To><Text Style="font-family:Comic Sans MS; font-weight:bold; color:#ff00ff; ">not much</Text></Message><Message Date="3/05/2004" Time="9:49:32 PM" DateTime="2004-05-03T11:49:32.570Z" SessionID="13"><From><User FriendlyName="(¯`·._.·[tÂk€ m¥ ß®€ªTh ðWª¥]·._.·´¯)"/></From><To><User FriendlyName="Jameš (um)"/></To><Text Style="font-family:Comic Sans MS; font-weight:bold; color:#ff00ff; ">u?</Text></Message><Message Date="3/05/2004" Time="9:49:36 PM" DateTime="2004-05-03T11:49:36.115Z" SessionID="13"><From><User FriendlyName="Jameš (um)"/></From><To><User FriendlyName="(¯`·._.·[tÂk€ m¥ ß®€ªTh ðWª¥]·._.·´¯)"/></To><Text Style="font-family:Trebuchet MS; font-weight:bold; color:#008000; ">anything intersting happening l8ly</Text></Message><Message Date="3/05/2004" Time="9:49:44 PM" DateTime="2004-05-03T11:49:44.948Z" SessionID="13"><From><User FriendlyName="Jameš (um)"/></From><To><User FriendlyName="(¯`·._.·[tÂk€ m¥ ß®€ªTh ðWª¥]·._.·´¯)"/></To><Text Style="font-family:Trebuchet MS; font-weight:bold; color:#008000; ">My bday is 2 moz</Text></Message><Message Date="3/05/2004" Time="9:49:49 PM" DateTime="2004-05-03T11:49:49.654Z" SessionID="13"><From><User FriendlyName="Jameš (um)"/></From><To><User FriendlyName="(¯`·._.·[tÂk€ m¥ ß®€ªTh ðWª¥]·._.·´¯)"/></To><Text Style="font-family:Trebuchet MS; font-weight:bold; color:#008000; ">but i already had my pressies</Text></Message><Message Date="3/05/2004" Time="9:49:58 PM" DateTime="2004-05-03T11:49:58.818Z" SessionID="13"><From><User FriendlyName="Jameš (um)"/></From><To><User FriendlyName="(¯`·._.·[tÂk€ m¥ ß®€ªTh ðWª¥]·._.·´¯)"/></To><Text Style="font-family:Trebuchet MS; font-weight:bold; color:#008000; ">cuz my dad had  2 go2 LA</Text></Message><Message Date="3/05/2004" Time="9:50:09 PM" DateTime="2004-05-03T11:50:09.884Z" SessionID="13"><From><User FriendlyName="(¯`·._.·[tÂk€ m¥ ß®€ªTh ðWª¥]·._.·´¯)"/></From><To><User FriendlyName="Jameš (um)"/></To><Text Style="font-family:Comic Sans MS; font-weight:bold; color:#ff00ff; ">kool</Text></Message><Message Date="3/05/2004" Time="9:50:14 PM" DateTime="2004-05-03T11:50:14.310Z" SessionID="13"><From><User FriendlyName="(¯`·._.·[tÂk€ m¥ ß®€ªTh ðWª¥]·._.·´¯)"/></From><To><User FriendlyName="Jameš (um)"/></To><Text Style="font-family:Comic Sans MS; font-weight:bold; color:#ff00ff; ">wel the present part</Text></Message><Message Date="3/05/2004" Time="9:50:15 PM" DateTime="2004-05-03T11:50:15.902Z" SessionID="13"><From><User FriendlyName="(¯`·._.·[tÂk€ m¥ ß®€ªTh ðWª¥]·._.·´¯)"/></From><To><User FriendlyName="Jameš (um)"/></To><Text Style="font-family:Comic Sans MS; font-weight:bold; color:#ff00ff; ">hehe</Text></Message><Message Date="3/05/2004" Time="9:50:30 PM" DateTime="2004-05-03T11:50:30.063Z" SessionID="13"><From><User FriendlyName="Jameš (um)"/></From><To><User FriendlyName="(¯`·._.·[tÂk€ m¥ ß®€ªTh ðWª¥]·._.·´¯)"/></To><Text Style="font-family:Trebuchet MS; font-weight:bold; color:#008000; ">yeah</Text></Message><Message Date="3/05/2004" Time="9:50:33 PM" DateTime="2004-05-03T11:50:33.117Z" SessionID="13"><From><User FriendlyName="Jameš (um)"/></From><To><User FriendlyName="(¯`·._.·[tÂk€ m¥ ß®€ªTh ðWª¥]·._.·´¯)"/></To><Text Style="font-family:Trebuchet MS; font-weight:bold; color:#008000; ">My dads a Pilot</Text></Message><Message Date="3/05/2004" Time="9:51:09 PM" DateTime="2004-05-03T11:51:09.579Z" SessionID="13"><From><User FriendlyName="(¯`·._.·[tÂk€ m¥ ß®€ªTh ðWª¥]·._.·´¯)"/></From><To><User FriendlyName="Jameš (um)"/></To><Text Style="font-family:Comic Sans MS; font-weight:bold; color:#ff00ff; ">kool</Text></Message><Message Date="3/05/2004" Time="9:51:31 PM" DateTime="2004-05-03T11:51:31.170Z" SessionID="13"><From><User FriendlyName="Jameš (um)"/></From><To><User FriendlyName="(¯`·._.·[tÂk€ m¥ ß®€ªTh ðWª¥]·._.·´¯)"/></To><Text Style="font-family:Trebuchet MS; font-weight:bold; color:#008000; ">yeah</Text></Message><Message Date="3/05/2004" Time="9:51:32 PM" DateTime="2004-05-03T11:51:32.913Z" SessionID="13"><From><User FriendlyName="Jameš (um)"/></From><To><User FriendlyName="(¯`·._.·[tÂk€ m¥ ß®€ªTh ðWª¥]·._.·´¯)"/></To><Text Style="font-family:Trebuchet MS; font-weight:bold; color:#008000; ">sorta </Text></Message><Message Date="3/05/2004" Time="9:51:36 PM" DateTime="2004-05-03T11:51:36.288Z" SessionID="13"><From><User FriendlyName="(¯`·._.·[tÂk€ m¥ ß®€ªTh ðWª¥]·._.·´¯)"/></From><To><User FriendlyName="Jameš (um)"/></To><Text Style="font-family:Comic Sans MS; font-weight:bold; color:#ff00ff; ">lol</Text></Message><Message Date="3/05/2004" Time="9:51:51 PM" DateTime="2004-05-03T11:51:51.079Z" SessionID="13"><From><User FriendlyName="Jameš (um)"/></From><To><User FriendlyName="(¯`·._.·[tÂk€ m¥ ß®€ªTh ðWª¥]·._.·´¯)"/></To><Text Style="font-family:Trebuchet MS; font-weight:bold; color:#008000; ">I went gliding wunce</Text></Message><Message Date="3/05/2004" Time="9:51:54 PM" DateTime="2004-05-03T11:51:54.724Z" SessionID="13"><From><User FriendlyName="Jameš (um)"/></From><To><User FriendlyName="(¯`·._.·[tÂk€ m¥ ß®€ªTh ðWª¥]·._.·´¯)"/></To><Text Style="font-family:Trebuchet MS; font-weight:bold; color:#008000; ">that was kool</Text></Message><Message Date="3/05/2004" Time="9:52:01 PM" DateTime="2004-05-03T11:52:01.224Z" SessionID="13"><From><User FriendlyName="Jameš (um)"/></From><To><User FriendlyName="(¯`·._.·[tÂk€ m¥ ß®€ªTh ðWª¥]·._.·´¯)"/></To><Text Style="font-family:Trebuchet MS; font-weight:bold; color:#008000; ">up in brissy</Text></Message><Message Date="3/05/2004" Time="9:52:12 PM" DateTime="2004-05-03T11:52:12.480Z" SessionID="13"><From><User FriendlyName="Jameš (um)"/></From><To><User FriendlyName="(¯`·._.·[tÂk€ m¥ ß®€ªTh ðWª¥]·._.·´¯)"/></To><Text Style="font-family:Trebuchet MS; font-weight:bold; color:#008000; ">with my granpa and my dad and my brother</Text></Message><Message Date="3/05/2004" Time="9:52:31 PM" DateTime="2004-05-03T11:52:31.357Z" SessionID="13"><From><User FriendlyName="(¯`·._.·[tÂk€ m¥ ß®€ªTh ðWª¥]·._.·´¯)"/></From><To><User FriendlyName="Jameš (um)"/></To><Text Style="font-family:Comic Sans MS; font-weight:bold; color:#ff00ff; ">way kool</Text></Message><Message Date="3/05/2004" Time="9:52:51 PM" DateTime="2004-05-03T11:52:51.456Z" SessionID="13"><From><User FriendlyName="Jameš (um)"/></From><To><User FriendlyName="(¯`·._.·[tÂk€ m¥ ß®€ªTh ðWª¥]·._.·´¯)"/></To><Text Style="font-family:Trebuchet MS; font-weight:bold; color:#008000; ">yeah</Text></Message><Message Date="3/05/2004" Time="9:52:56 PM" DateTime="2004-05-03T11:52:56.643Z" SessionID="13"><From><User FriendlyName="Jameš (um)"/></From><To><User FriendlyName="(¯`·._.·[tÂk€ m¥ ß®€ªTh ðWª¥]·._.·´¯)"/></To><Text Style="font-family:Trebuchet MS; font-weight:bold; color:#008000; ">its pretty insane</Text></Message><Message Date="3/05/2004" Time="9:53:08 PM" DateTime="2004-05-03T11:53:08.260Z" SessionID="13"><From><User FriendlyName="Jameš (um)"/></From><To><User FriendlyName="(¯`·._.·[tÂk€ m¥ ß®€ªTh ðWª¥]·._.·´¯)"/></To><Text Style="font-family:Trebuchet MS; font-weight:bold; color:#008000; ">Its like a plane, with out engines</Text></Message><Message Date="3/05/2004" Time="9:53:19 PM" DateTime="2004-05-03T11:53:19.506Z" SessionID="13"><From><User FriendlyName="Jameš (um)"/></From><To><User FriendlyName="(¯`·._.·[tÂk€ m¥ ß®€ªTh ðWª¥]·._.·´¯)"/></To><Text Style="font-family:Trebuchet MS; font-weight:bold; color:#008000; ">http://www.princeton.edu/~rvdb/glider.gif</Text></Message><Message Date="3/05/2004" Time="9:53:27 PM" DateTime="2004-05-03T11:53:27.578Z" SessionID="13"><From><User FriendlyName="Jameš (um)"/></From><To><User FriendlyName="(¯`·._.·[tÂk€ m¥ ß®€ªTh ðWª¥]·._.·´¯)"/></To><Text Style="font-family:Trebuchet MS; font-weight:bold; color:#008000; ">you have 2 get towed up by another plane</Text></Message><Message Date="3/05/2004" Time="9:53:43 PM" DateTime="2004-05-03T11:53:43.931Z" SessionID="13"><From><User FriendlyName="(¯`·._.·[tÂk€ m¥ ß®€ªTh ðWª¥]·._.·´¯)"/></From><To><User FriendlyName="Jameš (um)"/></To><Text Style="font-family:Comic Sans MS; font-weight:bold; color:#ff00ff; ">KKOOOL</Text></Message><Message Date="3/05/2004" Time="9:53:46 PM" DateTime="2004-05-03T11:53:46.475Z" SessionID="13"><From><User FriendlyName="(¯`·._.·[tÂk€ m¥ ß®€ªTh ðWª¥]·._.·´¯)"/></From><To><User FriendlyName="Jameš (um)"/></To><Text Style="font-family:Comic Sans MS; font-weight:bold; color:#ff00ff; ">*KOOL</Text></Message><Message Date="3/05/2004" Time="9:55:11 PM" DateTime="2004-05-03T11:55:11.708Z" SessionID="13"><From><User FriendlyName="Jameš (um)"/></From><To><User FriendlyName="(¯`·._.·[tÂk€ m¥ ß®€ªTh ðWª¥]·._.·´¯)"/></To><Text Style="font-family:Trebuchet MS; font-weight:bold; color:#008000; ">sure is</Text></Message><Message Date="3/05/2004" Time="9:55:18 PM" DateTime="2004-05-03T11:55:18.327Z" SessionID="13"><From><User FriendlyName="Jameš (um)"/></From><To><User FriendlyName="(¯`·._.·[tÂk€ m¥ ß®€ªTh ðWª¥]·._.·´¯)"/></To><Text Style="font-family:Trebuchet MS; font-weight:bold; color:#008000; ">i got 2 turn it</Text></Message><Message Date="3/05/2004" Time="9:55:25 PM" DateTime="2004-05-03T11:55:25.167Z" SessionID="13"><From><User FriendlyName="(¯`·._.·[tÂk€ m¥ ß®€ªTh ðWª¥]·._.·´¯)"/></From><To><User FriendlyName="Jameš (um)"/></To><Text Style="font-family:Comic Sans MS; font-weight:bold; color:#ff00ff; ">yay</Text></Message><Message Date="3/05/2004" Time="9:55:38 PM" DateTime="2004-05-03T11:55:38.506Z" SessionID="13"><From><User FriendlyName="Jameš (um)"/></From><To><User FriendlyName="(¯`·._.·[tÂk€ m¥ ß®€ªTh ðWª¥]·._.·´¯)"/></To><Text Style="font-family:Trebuchet MS; font-weight:bold; color:#008000; ">and ther was an eagle floating around</Text></Message><Message Date="3/05/2004" Time="9:55:58 PM" DateTime="2004-05-03T11:55:58.365Z" SessionID="13"><From><User FriendlyName="Jameš (um)"/></From><To><User FriendlyName="(¯`·._.·[tÂk€ m¥ ß®€ªTh ðWª¥]·._.·´¯)"/></To><Text Style="font-family:Trebuchet MS; font-weight:bold; color:#008000; ">its the koolest thing ive ever dun</Text></Message><Message Date="3/05/2004" Time="9:56:00 PM" DateTime="2004-05-03T11:56:00.878Z" SessionID="13"><From><User FriendlyName="(¯`·._.·[tÂk€ m¥ ß®€ªTh ðWª¥]·._.·´¯)"/></From><To><User FriendlyName="Jameš (um)"/></To><Text Style="font-family:Comic Sans MS; font-weight:bold; color:#ff00ff; ">so kool</Text></Message><Message Date="3/05/2004" Time="9:56:03 PM" DateTime="2004-05-03T11:56:03.542Z" SessionID="13"><From><User FriendlyName="Jameš (um)"/></From><To><User FriendlyName="(¯`·._.·[tÂk€ m¥ ß®€ªTh ðWª¥]·._.·´¯)"/></To><Text Style="font-family:Trebuchet MS; font-weight:bold; color:#008000; ">yeah</Text></Message><Message Date="3/05/2004" Time="9:56:07 PM" DateTime="2004-05-03T11:56:07.368Z" SessionID="13"><From><User FriendlyName="Jameš (um)"/></From><To><User FriendlyName="(¯`·._.·[tÂk€ m¥ ß®€ªTh ðWª¥]·._.·´¯)"/></To><Text Style="font-family:Trebuchet MS; font-weight:bold; color:#008000; ">and afterwoods</Text></Message><Message Date="3/05/2004" Time="9:56:12 PM" DateTime="2004-05-03T11:56:12.325Z" SessionID="13"><From><User FriendlyName="Jameš (um)"/></From><To><User FriendlyName="(¯`·._.·[tÂk€ m¥ ß®€ªTh ðWª¥]·._.·´¯)"/></To><Text Style="font-family:Trebuchet MS; font-weight:bold; color:#008000; ">there was a bunch of cuntry kids</Text></Message><Message Date="3/05/2004" Time="9:56:21 PM" DateTime="2004-05-03T11:56:21.718Z" SessionID="13"><From><User FriendlyName="Jameš (um)"/></From><To><User FriendlyName="(¯`·._.·[tÂk€ m¥ ß®€ªTh ðWª¥]·._.·´¯)"/></To><Text Style="font-family:Trebuchet MS; font-weight:bold; color:#008000; ">and we went on this slingshot thing</Text></Message><Message Date="3/05/2004" Time="9:56:24 PM" DateTime="2004-05-03T11:56:24.092Z" SessionID="13"><From><User FriendlyName="Jameš (um)"/></From><To><User FriendlyName="(¯`·._.·[tÂk€ m¥ ß®€ªTh ðWª¥]·._.·´¯)"/></To><Text Style="font-family:Trebuchet MS; font-weight:bold; color:#008000; ">so crazy</Text></Message><Message Date="3/05/2004" Time="9:56:29 PM" DateTime="2004-05-03T11:56:29.179Z" SessionID="13"><From><User FriendlyName="Jameš (um)"/></From><To><User FriendlyName="(¯`·._.·[tÂk€ m¥ ß®€ªTh ðWª¥]·._.·´¯)"/></To><Text Style="font-family:Trebuchet MS; font-weight:bold; color:#008000; ">u are on a harness</Text></Message><Message Date="3/05/2004" Time="9:56:36 PM" DateTime="2004-05-03T11:56:36.940Z" SessionID="13"><From><User FriendlyName="Jameš (um)"/></From><To><User FriendlyName="(¯`·._.·[tÂk€ m¥ ß®€ªTh ðWª¥]·._.·´¯)"/></To><Text Style="font-family:Trebuchet MS; font-weight:bold; color:#008000; ">and then u are attach 2 a tree</Text></Message><Message Date="3/05/2004" Time="9:56:42 PM" DateTime="2004-05-03T11:56:42.628Z" SessionID="13"><From><User FriendlyName="Jameš (um)"/></From><To><User FriendlyName="(¯`·._.·[tÂk€ m¥ ß®€ªTh ðWª¥]·._.·´¯)"/></To><Text Style="font-family:Trebuchet MS; font-weight:bold; color:#008000; ">and then u run off a ramp</Text></Message><Message Date="3/05/2004" Time="9:56:49 PM" DateTime="2004-05-03T11:56:49.458Z" SessionID="13"><From><User FriendlyName="Jameš (um)"/></From><To><User FriendlyName="(¯`·._.·[tÂk€ m¥ ß®€ªTh ðWª¥]·._.·´¯)"/></To><Text Style="font-family:Trebuchet MS; font-weight:bold; color:#008000; ">and then they pull u on the other end</Text></Message><Message Date="3/05/2004" Time="9:56:54 PM" DateTime="2004-05-03T11:56:54.085Z" SessionID="13"><From><User FriendlyName="Jameš (um)"/></From><To><User FriendlyName="(¯`·._.·[tÂk€ m¥ ß®€ªTh ðWª¥]·._.·´¯)"/></To><Text Style="font-family:Trebuchet MS; font-weight:bold; color:#008000; ">and u go weeeeeeeeeeeeeeeeeeeeee</Text></Message><Message Date="3/05/2004" Time="9:56:56 PM" DateTime="2004-05-03T11:56:56.879Z" SessionID="13"><From><User FriendlyName="(¯`·._.·[tÂk€ m¥ ß®€ªTh ðWª¥]·._.·´¯)"/></From><To><User FriendlyName="Jameš (um)"/></To><Text Style="font-family:Comic Sans MS; font-weight:bold; color:#ff00ff; ">lol</Text></Message><Message Date="3/05/2004" Time="9:56:57 PM" DateTime="2004-05-03T11:56:57.530Z" SessionID="13"><From><User FriendlyName="Jameš (um)"/></From><To><User FriendlyName="(¯`·._.·[tÂk€ m¥ ß®€ªTh ðWª¥]·._.·´¯)"/></To><Text Style="font-family:Trebuchet MS; font-weight:bold; color:#008000; ">crazy :)</Text></Message><Message Date="4/05/2004" Time="8:33:07 PM" DateTime="2004-05-04T10:33:07.020Z" SessionID="14"><From><User FriendlyName="(b)..StE&lt;:o) aDo..(b)"/></From><To><User FriendlyName="(8)bounce baby out dat door i anit gonna take dis no more!!(8) i (L) TIMMY!!"/><User FriendlyName="Jameš (um)"/><User FriendlyName="$!Sharkie~Jazza!$"/><User FriendlyName="(¯`·._.·[tÂk€ m¥ ß®€ªTh ðWª¥]·._.·´¯)"/><User FriendlyName="&lt;:o)8-|8-|8-|&lt;:o)"/><User FriendlyName="smiddy99@msn.com"/><User FriendlyName="(A)(6)(A)●○●○…::::**§»¤ my life’s just one big blonde moment ¤«§**::::… ●○●○(A)(6)(A)"/></To><Text Style="font-family:Franklin Gothic Book; font-weight:bold; color:#ff0000; ">ADD EM</Text></Message><Join Date="4/05/2004" Time="8:33:10 PM" DateTime="2004-05-04T10:33:10.756Z" SessionID="14"><User FriendlyName="im not racist!! I have a colour TV!!!"/><Text Style="color:#008000; ">im not racist!! I have a colour TV!!! has been added to the conversation.</Text></Join><Join Date="4/05/2004" Time="8:33:14 PM" DateTime="2004-05-04T10:33:14.461Z" SessionID="14"><User FriendlyName="mum said i was cooll! Are you calling her a liar"/><Text Style="color:#008000; ">mum said i was cooll! Are you calling her a liar has been added to the conversation.</Text></Join><Message Date="4/05/2004" Time="8:33:15 PM" DateTime="2004-05-04T10:33:15.493Z" SessionID="14"><From><User FriendlyName="Jameš (um)"/></From><To><User FriendlyName="mum said i was cooll! Are you calling her a liar"/><User FriendlyName="(8)bounce baby out dat door i anit gonna take dis no more!!(8) i (L) TIMMY!!"/><User FriendlyName="$!Sharkie~Jazza!$"/><User FriendlyName="(b)..StE&lt;:o) aDo..(b)"/><User FriendlyName="im not racist!! I have a colour TV!!!"/><User FriendlyName="(¯`·._.·[tÂk€ m¥ ß®€ªTh ðWª¥]·._.·´¯)"/><User FriendlyName="&lt;:o)8-|8-|8-|&lt;:o)"/><User FriendlyName="smiddy99@msn.com"/><User FriendlyName="(A)(6)(A)●○●○…::::**§»¤ my life’s just one big blonde moment ¤«§**::::… ●○●○(A)(6)(A)"/></To><Text Style="font-family:Trebuchet MS; font-weight:bold; color:#008000; ">Hello</Text></Message><Message Date="4/05/2004" Time="8:33:20 PM" DateTime="2004-05-04T10:33:20.940Z" SessionID="14"><From><User FriendlyName="(¯`·._.·[tÂk€ m¥ ß®€ªTh ðWª¥]·._.·´¯)"/></From><To><User FriendlyName="mum said i was cooll! Are you calling her a liar"/><User FriendlyName="(8)bounce baby out dat door i anit gonna take dis no more!!(8) i (L) TIMMY!!"/><User FriendlyName="Jameš (um)"/><User FriendlyName="$!Sharkie~Jazza!$"/><User FriendlyName="(b)..StE&lt;:o) aDo..(b)"/><User FriendlyName="im not racist!! I have a colour TV!!!"/><User FriendlyName="&lt;:o)8-|8-|8-|&lt;:o)"/><User FriendlyName="smiddy99@msn.com"/><User FriendlyName="(A)(6)(A)●○●○…::::**§»¤ my life’s just one big blonde moment ¤«§**::::… ●○●○(A)(6)(A)"/></To><Text Style="font-family:Comic Sans MS; font-weight:bold; color:#ff00ff; ">y me?????????</Text></Message><Message Date="4/05/2004" Time="8:33:23 PM" DateTime="2004-05-04T10:33:23.294Z" SessionID="14"><From><User FriendlyName="Jameš (um)"/></From><To><User FriendlyName="mum said i was cooll! Are you calling her a liar"/><User FriendlyName="(8)bounce baby out dat door i anit gonna take dis no more!!(8) i (L) TIMMY!!"/><User FriendlyName="$!Sharkie~Jazza!$"/><User FriendlyName="(b)..StE&lt;:o) aDo..(b)"/><User FriendlyName="im not racist!! I have a colour TV!!!"/><User FriendlyName="(¯`·._.·[tÂk€ m¥ ß®€ªTh ðWª¥]·._.·´¯)"/><User FriendlyName="&lt;:o)8-|8-|8-|&lt;:o)"/><User FriendlyName="smiddy99@msn.com"/><User FriendlyName="(A)(6)(A)●○●○…::::**§»¤ my life’s just one big blonde moment ¤«§**::::… ●○●○(A)(6)(A)"/></To><Text Style="font-family:Trebuchet MS; font-weight:bold; color:#008000; ">lol</Text></Message><Message Date="6/05/2004" Time="5:47:56 PM" DateTime="2004-05-06T07:47:56.945Z" SessionID="15"><From><User FriendlyName="Jameš (um)"/></From><To><User FriendlyName="(¯`·._.·[tÂk€ m¥ ß®€ªTh ðWª¥]·._.·´¯)"/></To><Text Style="font-family:Trebuchet MS; font-weight:bold; color:#008000; ">95480450</Text></Message><Message Date="6/05/2004" Time="7:48:38 PM" DateTime="2004-05-06T09:48:38.688Z" SessionID="16"><From><User FriendlyName="Jameš (um)"/></From><To><User FriendlyName="(¯`·._.·[tÂk€ m¥ ß®€ªTh ðWª¥]·._.·´¯)"/></To><Text Style="font-family:Trebuchet MS; font-weight:bold; color:#008000; ">hey:(</Text></Message><Message Date="6/05/2004" Time="7:48:59 PM" DateTime="2004-05-06T09:48:59.278Z" SessionID="16"><From><User FriendlyName="(¯`·._.·[tÂk€ m¥ ß®€ªTh ðWª¥]·._.·´¯)"/></From><To><User FriendlyName="Jameš (um)"/></To><Text Style="font-family:Comic Sans MS; font-weight:bold; color:#ff00ff; ">g2g</Text></Message><Message Date="6/05/2004" Time="7:49:04 PM" DateTime="2004-05-06T09:49:04.125Z" SessionID="16"><From><User FriendlyName="Jameš (um)"/></From><To><User FriendlyName="(¯`·._.·[tÂk€ m¥ ß®€ªTh ðWª¥]·._.·´¯)"/></To><Text Style="font-family:Trebuchet MS; font-weight:bold; color:#008000; ">:(</Text></Message><Message Date="6/05/2004" Time="7:49:15 PM" DateTime="2004-05-06T09:49:15.802Z" SessionID="16"><From><User FriendlyName="(¯`·._.·[tÂk€ m¥ ß®€ªTh ðWª¥]·._.·´¯)"/></From><To><User FriendlyName="Jameš (um)"/></To><Text Style="font-family:Comic Sans MS; font-weight:bold; color:#ff00ff; ">wats rong?</Text></Message><Message Date="6/05/2004" Time="7:49:16 PM" DateTime="2004-05-06T09:49:16.873Z" SessionID="16"><From><User FriendlyName="Jameš (um)"/></From><To><User FriendlyName="(¯`·._.·[tÂk€ m¥ ß®€ªTh ðWª¥]·._.·´¯)"/></To><Text Style="font-family:Trebuchet MS; font-weight:bold; color:#008000; ">no1 will talk 2 me :( Cya</Text></Message><Message Date="6/05/2004" Time="7:49:23 PM" DateTime="2004-05-06T09:49:23.243Z" SessionID="16"><From><User FriendlyName="(¯`·._.·[tÂk€ m¥ ß®€ªTh ðWª¥]·._.·´¯)"/></From><To><User FriendlyName="Jameš (um)"/></To><Text Style="font-family:Comic Sans MS; font-weight:bold; color:#ff00ff; ">soz diuinner</Text></Message><Message Date="6/05/2004" Time="7:49:29 PM" DateTime="2004-05-06T09:49:29.061Z" SessionID="16"><From><User FriendlyName="Jameš (um)"/></From><To><User FriendlyName="(¯`·._.·[tÂk€ m¥ ß®€ªTh ðWª¥]·._.·´¯)"/></To><Text Style="font-family:Trebuchet MS; font-weight:bold; color:#008000; ">just haven wanna those shitty days</Text></Message><Message Date="6/05/2004" Time="7:49:30 PM" DateTime="2004-05-06T09:49:30.944Z" SessionID="16"><From><User FriendlyName="Jameš (um)"/></From><To><User FriendlyName="(¯`·._.·[tÂk€ m¥ ß®€ªTh ðWª¥]·._.·´¯)"/></To><Text Style="font-family:Trebuchet MS; font-weight:bold; color:#008000; ">cya</Text></Message><Message Date="6/05/2004" Time="7:49:31 PM" DateTime="2004-05-06T09:49:31.524Z" SessionID="16"><From><User FriendlyName="(¯`·._.·[tÂk€ m¥ ß®€ªTh ðWª¥]·._.·´¯)"/></From><To><User FriendlyName="Jameš (um)"/></To><Text Style="font-family:Comic Sans MS; font-weight:bold; color:#ff00ff; ">im getin in2 shiut cauz they r dishin</Text></Message><Message Date="6/05/2004" Time="7:49:35 PM" DateTime="2004-05-06T09:49:35.460Z" SessionID="17"><From><User FriendlyName="(¯`·._.·[tÂk€ m¥ ß®€ªTh ðWª¥]·._.·´¯)"/></From><To><User FriendlyName="Jameš (um)"/></To><Text Style="font-family:Comic Sans MS; font-weight:bold; color:#ff00ff; ">okays</Text></Message><Message Date="6/05/2004" Time="7:49:35 PM" DateTime="2004-05-06T09:49:35.951Z" SessionID="17"><From><User FriendlyName="(¯`·._.·[tÂk€ m¥ ß®€ªTh ðWª¥]·._.·´¯)"/></From><To><User FriendlyName="Jameš (um)"/></To><Text Style="font-family:Comic Sans MS; font-weight:bold; color:#ff00ff; ">vy</Text></Message><Message Date="6/05/2004" Time="7:49:44 PM" DateTime="2004-05-06T09:49:44.393Z" SessionID="17"><From><User FriendlyName="Jameš (um)"/></From><To><User FriendlyName="(¯`·._.·[tÂk€ m¥ ß®€ªTh ðWª¥]·._.·´¯)"/></To><Text Style="font-family:Trebuchet MS; font-weight:bold; color:#008000; ">vy?</Text></Message><Message Date="18/05/2004" Time="4:51:34 PM" DateTime="2004-05-18T06:51:34.654Z" SessionID="18"><From><User FriendlyName="Jameš"/></From><To><User FriendlyName="(¯`·._.·[tÂk€ m¥ ß®€ªTh ðWª¥]·._.·´¯)IF U WERE ME ID BE UGLY! says: jeremy sumpter is so hot"/></To><Text Style="font-family:Comic Sans MS; font-weight:bold; color:#000080; ">Would u Agree of Disagreee, That "CellarDoor" is the most Beautiful word in the English Language?</Text></Message><Message Date="18/05/2004" Time="4:52:09 PM" DateTime="2004-05-18T06:52:09.514Z" SessionID="19"><From><User FriendlyName="(¯`·._.·[tÂk€ m¥ ß®€ªTh ðWª¥]·._.·´¯)IF U WERE ME ID BE UGLY! says: jeremy sumpter is so hot"/></From><To><User FriendlyName="Jameš"/></To><Text Style="font-family:Lucida Console; font-weight:bold; color:#ff00ff; ">y?</Text></Message><Message Date="18/05/2004" Time="4:52:20 PM" DateTime="2004-05-18T06:52:20.360Z" SessionID="19"><From><User FriendlyName="Jameš"/></From><To><User FriendlyName="(¯`·._.·[tÂk€ m¥ ß®€ªTh ðWª¥]·._.·´¯)IF U WERE ME ID BE UGLY! says: jeremy sumpter is so hot"/></To><Text Style="font-family:Comic Sans MS; font-weight:bold; color:#000080; ">curious</Text></Message><Message Date="18/05/2004" Time="4:52:28 PM" DateTime="2004-05-18T06:52:28.942Z" SessionID="19"><From><User FriendlyName="Jameš"/></From><To><User FriendlyName="(¯`·._.·[tÂk€ m¥ ß®€ªTh ðWª¥]·._.·´¯)IF U WERE ME ID BE UGLY! says: jeremy sumpter is so hot"/></To><Text Style="font-family:Comic Sans MS; font-weight:bold; color:#000080; ">i think so, But everyone ses no</Text></Message><Message Date="18/05/2004" Time="4:52:54 PM" DateTime="2004-05-18T06:52:54.709Z" SessionID="20"><From><User FriendlyName="(¯`·._.·[tÂk€ m¥ ß®€ªTh ðWª¥]·._.·´¯)IF U WERE ME ID BE UGLY! says: jeremy sumpter is so hot"/></From><To><User FriendlyName="Jameš"/></To><Text Style="font-family:Lucida Console; font-weight:bold; color:#ff00ff; ">i dont think it is</Text></Message><Message Date="18/05/2004" Time="4:52:57 PM" DateTime="2004-05-18T06:52:57.113Z" SessionID="20"><From><User FriendlyName="(¯`·._.·[tÂk€ m¥ ß®€ªTh ðWª¥]·._.·´¯)IF U WERE ME ID BE UGLY! says: jeremy sumpter is so hot"/></From><To><User FriendlyName="Jameš"/></To><Text Style="font-family:Lucida Console; font-weight:bold; color:#ff00ff; ">its 2 words</Text></Message><Message Date="18/05/2004" Time="4:53:08 PM" DateTime="2004-05-18T06:53:08.539Z" SessionID="20"><From><User FriendlyName="Jameš"/></From><To><User FriendlyName="(¯`·._.·[tÂk€ m¥ ß®€ªTh ðWª¥]·._.·´¯)IF U WERE ME ID BE UGLY! says: jeremy sumpter is so hot"/></To><Text Style="font-family:Comic Sans MS; font-weight:bold; color:#000080; ">It is a Conjoined word</Text></Message><Message Date="18/05/2004" Time="4:54:24 PM" DateTime="2004-05-18T06:54:24.208Z" SessionID="21"><From><User FriendlyName="(¯`·._.·[tÂk€ m¥ ß®€ªTh ðWª¥]·._.·´¯)IF U WERE ME ID BE UGLY! says: jeremy sumpter is so hot"/></From><To><User FriendlyName="Jameš"/></To><Text Style="font-family:Lucida Console; font-weight:bold; color:#ff00ff; ">rite</Text></Message><Message Date="18/05/2004" Time="4:54:25 PM" DateTime="2004-05-18T06:54:25.099Z" SessionID="21"><From><User FriendlyName="(¯`·._.·[tÂk€ m¥ ß®€ªTh ðWª¥]·._.·´¯)IF U WERE ME ID BE UGLY! says: jeremy sumpter is so hot"/></From><To><User FriendlyName="Jameš"/></To><Text Style="font-family:Lucida Console; font-weight:bold; color:#ff00ff; ">well its crap</Text></Message><Message Date="18/05/2004" Time="4:54:33 PM" DateTime="2004-05-18T06:54:33.662Z" SessionID="21"><From><User FriendlyName="(¯`·._.·[tÂk€ m¥ ß®€ªTh ðWª¥]·._.·´¯)IF U WERE ME ID BE UGLY! says: jeremy sumpter is so hot"/></From><To><User FriendlyName="Jameš"/></To><Text Style="font-family:Lucida Console; font-weight:bold; color:#ff00ff; ">kinky is a kickars word</Text></Message><Message Date="18/05/2004" Time="4:54:41 PM" DateTime="2004-05-18T06:54:41.573Z" SessionID="21"><From><User FriendlyName="Jameš"/></From><To><User FriendlyName="(¯`·._.·[tÂk€ m¥ ß®€ªTh ðWª¥]·._.·´¯)IF U WERE ME ID BE UGLY! says: jeremy sumpter is so hot"/></To><Text Style="font-family:Comic Sans MS; font-weight:bold; color:#000080; ">YOUR CRAP</Text></Message><Message Date="18/05/2004" Time="4:54:47 PM" DateTime="2004-05-18T06:54:47.311Z" SessionID="22"><From><User FriendlyName="(¯`·._.·[tÂk€ m¥ ß®€ªTh ðWª¥]·._.·´¯)IF U WERE ME ID BE UGLY! says: jeremy sumpter is so hot"/></From><To><User FriendlyName="Jameš"/></To><Text Style="font-family:Lucida Console; font-weight:bold; color:#ff00ff; ">thnx</Text></Message><Message Date="18/05/2004" Time="4:54:56 PM" DateTime="2004-05-18T06:54:56.765Z" SessionID="22"><From><User FriendlyName="Jameš"/></From><To><User FriendlyName="(¯`·._.·[tÂk€ m¥ ß®€ªTh ðWª¥]·._.·´¯)IF U WERE ME ID BE UGLY! says: jeremy sumpter is so hot"/></To><Text Style="font-family:Comic Sans MS; font-weight:bold; color:#000080; ">No Problem</Text></Message><Message Date="1/06/2004" Time="8:42:01 PM" DateTime="2004-06-01T10:42:01.331Z" SessionID="23"><From><User FriendlyName="Jameš *-) &quot;The dreams in which im dying are the best I've ever had...&quot;"/></From><To><User FriendlyName="(¯`·._.·[tÂk€ m¥ ß®€ªTh ðWª¥]·._.·´¯)IF U WERE ME ID BE UGLY! says: brendon is hot hot hot(L)"/></To><Text Style="font-family:Lucida Calligraphy; font-weight:bold; color:#000080; ">I just read the first chapter, of Stephen Hawkings, "A Brief History of Time", A pat on the back if you will :)</Text></Message><Message Date="1/06/2004" Time="8:42:16 PM" DateTime="2004-06-01T10:42:16.062Z" SessionID="24"><From><User FriendlyName="(¯`·._.·[tÂk€ m¥ ß®€ªTh ðWª¥]·._.·´¯)IF U WERE ME ID BE UGLY! says: brendon is hot hot hot(L)"/></From><To><User FriendlyName="Jameš *-) &quot;The dreams in which im dying are the best I've ever had...&quot;"/></To><Text Style="font-family:Lucida Console; font-weight:bold; color:#ff00ff; ">rite</Text></Message><Message Date="1/06/2004" Time="8:42:22 PM" DateTime="2004-06-01T10:42:22.782Z" SessionID="24"><From><User FriendlyName="Jameš *-) &quot;The dreams in which im dying are the best I've ever had...&quot;"/></From><To><User FriendlyName="(¯`·._.·[tÂk€ m¥ ß®€ªTh ðWª¥]·._.·´¯)IF U WERE ME ID BE UGLY! says: brendon is hot hot hot(L)"/></To><Text Style="font-family:Lucida Calligraphy; font-weight:bold; color:#000080; ">:D</Text></Message><Message Date="1/06/2004" Time="8:42:28 PM" DateTime="2004-06-01T10:42:28.700Z" SessionID="24"><From><User FriendlyName="Jameš *-) &quot;The dreams in which im dying are the best I've ever had...&quot;"/></From><To><User FriendlyName="(¯`·._.·[tÂk€ m¥ ß®€ªTh ðWª¥]·._.·´¯)IF U WERE ME ID BE UGLY! says: brendon is hot hot hot(L)"/></To><Text Style="font-family:Lucida Calligraphy; font-weight:bold; color:#000080; ">ask someone smart</Text></Message><Message Date="1/06/2004" Time="8:42:55 PM" DateTime="2004-06-01T10:42:55.979Z" SessionID="25"><From><User FriendlyName="(¯`·._.·[tÂk€ m¥ ß®€ªTh ðWª¥]·._.·´¯)IF U WERE ME ID BE UGLY! says: brendon is hot hot hot(L)"/></From><To><User FriendlyName="Jameš *-) &quot;The dreams in which im dying are the best I've ever had...&quot;"/></To><Text Style="font-family:Lucida Console; font-weight:bold; color:#ff00ff; ">lol not me</Text></Message><Message Date="1/06/2004" Time="8:43:12 PM" DateTime="2004-06-01T10:43:12.173Z" SessionID="25"><From><User FriendlyName="Jameš *-) &quot;The dreams in which im dying are the best I've ever had...&quot;"/></From><To><User FriendlyName="(¯`·._.·[tÂk€ m¥ ß®€ªTh ðWª¥]·._.·´¯)IF U WERE ME ID BE UGLY! says: brendon is hot hot hot(L)"/></To><Text Style="font-family:Lucida Calligraphy; font-weight:bold; color:#000080; ">lol ok</Text></Message><Message Date="10/06/2004" Time="8:52:11 PM" DateTime="2004-06-10T10:52:11.169Z" SessionID="26"><From><User FriendlyName="James &lt;:o)"/></From><To><User FriendlyName="(¯`·._.·[tÂk€ m¥ ß®€ªTh ðWª¥]·._.·´¯)IF U WERE ME ID BE UGLY! says: (k)brendon is hot hot hot(L)yeah! peter pan on dvd!!!&lt;:o)"/></To><Text Style="font-family:Comic Sans MS; font-weight:bold; color:#000080; ">Hi</Text></Message><Message Date="10/06/2004" Time="8:52:17 PM" DateTime="2004-06-10T10:52:17.968Z" SessionID="26"><From><User FriendlyName="(¯`·._.·[tÂk€ m¥ ß®€ªTh ðWª¥]·._.·´¯)IF U WERE ME ID BE UGLY! says: (k)brendon is hot hot hot(L)yeah! peter pan on dvd!!!&lt;:o)"/></From><To><User FriendlyName="James &lt;:o)"/></To><Text Style="font-family:Lucida Console; font-weight:bold; color:#a042ff; ">hey</Text></Message><Message Date="10/06/2004" Time="8:52:49 PM" DateTime="2004-06-10T10:52:49.804Z" SessionID="26"><From><User FriendlyName="James &lt;:o)"/></From><To><User FriendlyName="(¯`·._.·[tÂk€ m¥ ß®€ªTh ðWª¥]·._.·´¯)IF U WERE ME ID BE UGLY! says: (k)brendon is hot hot hot(L)yeah! peter pan on dvd!!!&lt;:o)"/></To><Text Style="font-family:Comic Sans MS; font-weight:bold; color:#000080; ">Wat yuh up to?</Text></Message><Message Date="10/06/2004" Time="8:52:55 PM" DateTime="2004-06-10T10:52:55.272Z" SessionID="27"><From><User FriendlyName="(¯`·._.·[tÂk€ m¥ ß®€ªTh ðWª¥]·._.·´¯)IF U WERE ME ID BE UGLY! says: (k)brendon is hot hot hot(L)yeah! peter pan on dvd!!!&lt;:o)"/></From><To><User FriendlyName="James &lt;:o)"/></To><Text Style="font-family:Lucida Console; font-weight:bold; color:#a042ff; ">nm</Text></Message><Message Date="10/06/2004" Time="8:52:55 PM" DateTime="2004-06-10T10:52:55.282Z" SessionID="27"><From><User FriendlyName="(¯`·._.·[tÂk€ m¥ ß®€ªTh ðWª¥]·._.·´¯)IF U WERE ME ID BE UGLY! says: (k)brendon is hot hot hot(L)yeah! peter pan on dvd!!!&lt;:o)"/></From><To><User FriendlyName="James &lt;:o)"/></To><Text Style="font-family:Lucida Console; font-weight:bold; color:#a042ff; ">u?</Text></Message><Message Date="10/06/2004" Time="8:53:01 PM" DateTime="2004-06-10T10:53:01.180Z" SessionID="27"><From><User FriendlyName="James &lt;:o)"/></From><To><User FriendlyName="(¯`·._.·[tÂk€ m¥ ß®€ªTh ðWª¥]·._.·´¯)IF U WERE ME ID BE UGLY! says: (k)brendon is hot hot hot(L)yeah! peter pan on dvd!!!&lt;:o)"/></To><Text Style="font-family:Comic Sans MS; font-weight:bold; color:#000080; ">nm</Text></Message><Message Date="10/06/2004" Time="8:53:07 PM" DateTime="2004-06-10T10:53:07.099Z" SessionID="27"><From><User FriendlyName="James &lt;:o)"/></From><To><User FriendlyName="(¯`·._.·[tÂk€ m¥ ß®€ªTh ðWª¥]·._.·´¯)IF U WERE ME ID BE UGLY! says: (k)brendon is hot hot hot(L)yeah! peter pan on dvd!!!&lt;:o)"/></To><Text Style="font-family:Comic Sans MS; font-weight:bold; color:#000080; ">;) I follow</Text></Message><Message Date="10/06/2004" Time="8:53:23 PM" DateTime="2004-06-10T10:53:23.042Z" SessionID="28"><From><User FriendlyName="(¯`·._.·[tÂk€ m¥ ß®€ªTh ðWª¥]·._.·´¯)IF U WERE ME ID BE UGLY! says: (k)brendon is hot hot hot(L)yeah! peter pan on dvd!!!&lt;:o)"/></From><To><User FriendlyName="James &lt;:o)"/></To><Text Style="font-family:Lucida Console; font-weight:bold; color:#a042ff; ">rite</Text></Message><Message Date="10/06/2004" Time="8:53:30 PM" DateTime="2004-06-10T10:53:30.102Z" SessionID="28"><From><User FriendlyName="James &lt;:o)"/></From><To><User FriendlyName="(¯`·._.·[tÂk€ m¥ ß®€ªTh ðWª¥]·._.·´¯)IF U WERE ME ID BE UGLY! says: (k)brendon is hot hot hot(L)yeah! peter pan on dvd!!!&lt;:o)"/></To><Text Style="font-family:Comic Sans MS; font-weight:bold; color:#000080; ">3d1</Text></Message><Message Date="10/06/2004" Time="8:53:40 PM" DateTime="2004-06-10T10:53:40.858Z" SessionID="29"><From><User FriendlyName="(¯`·._.·[tÂk€ m¥ ß®€ªTh ðWª¥]·._.·´¯)IF U WERE ME ID BE UGLY! says: (k)brendon is hot hot hot(L)yeah! peter pan on dvd!!!&lt;:o)"/></From><To><User FriendlyName="James &lt;:o)"/></To><Text Style="font-family:Lucida Console; font-weight:bold; color:#a042ff; ">oook</Text></Message><Message Date="10/06/2004" Time="8:54:30 PM" DateTime="2004-06-10T10:54:30.038Z" SessionID="29"><From><User FriendlyName="James &lt;:o)"/></From><To><User FriendlyName="(¯`·._.·[tÂk€ m¥ ß®€ªTh ðWª¥]·._.·´¯)IF U WERE ME ID BE UGLY! says: (k)brendon is hot hot hot(L)yeah! peter pan on dvd!!!&lt;:o)"/></To><Text Style="font-family:Comic Sans MS; font-weight:bold; color:#000080; ">Do u think im evil&gt;</Text></Message><Message Date="10/06/2004" Time="8:55:15 PM" DateTime="2004-06-10T10:55:15.474Z" SessionID="30"><From><User FriendlyName="(¯`·._.·[tÂk€ m¥ ß®€ªTh ðWª¥]·._.·´¯)IF U WERE ME ID BE UGLY! says: (k)brendon is hot hot hot(L)yeah! peter pan on dvd!!!&lt;:o)"/></From><To><User FriendlyName="James &lt;:o)"/></To><Text Style="font-family:Lucida Console; font-weight:bold; color:#a042ff; ">no</Text></Message><Message Date="10/06/2004" Time="8:55:17 PM" DateTime="2004-06-10T10:55:17.146Z" SessionID="30"><From><User FriendlyName="(¯`·._.·[tÂk€ m¥ ß®€ªTh ðWª¥]·._.·´¯)IF U WERE ME ID BE UGLY! says: (k)brendon is hot hot hot(L)yeah! peter pan on dvd!!!&lt;:o)"/></From><To><User FriendlyName="James &lt;:o)"/></To><Text Style="font-family:Lucida Console; font-weight:bold; color:#a042ff; ">shuld i?</Text></Message><Message Date="10/06/2004" Time="8:56:14 PM" DateTime="2004-06-10T10:56:14.328Z" SessionID="30"><From><User FriendlyName="James &lt;:o)"/></From><To><User FriendlyName="(¯`·._.·[tÂk€ m¥ ß®€ªTh ðWª¥]·._.·´¯)IF U WERE ME ID BE UGLY! says: (k)brendon is hot hot hot(L)yeah! peter pan on dvd!!!&lt;:o)"/></To><Text Style="font-family:Comic Sans MS; font-weight:bold; color:#000080; ">----------------------------------------&gt;









</Text></Message><Message Date="10/06/2004" Time="8:56:16 PM" DateTime="2004-06-10T10:56:16.652Z" SessionID="30"><From><User FriendlyName="James &lt;:o)"/></From><To><User FriendlyName="(¯`·._.·[tÂk€ m¥ ß®€ªTh ðWª¥]·._.·´¯)IF U WERE ME ID BE UGLY! says: (k)brendon is hot hot hot(L)yeah! peter pan on dvd!!!&lt;:o)"/></To><Text Style="font-family:Comic Sans MS; font-weight:bold; color:#000080; ">arggh</Text></Message><Message Date="10/06/2004" Time="8:56:19 PM" DateTime="2004-06-10T10:56:19.005Z" SessionID="30"><From><User FriendlyName="James &lt;:o)"/></From><To><User FriendlyName="(¯`·._.·[tÂk€ m¥ ß®€ªTh ðWª¥]·._.·´¯)IF U WERE ME ID BE UGLY! says: (k)brendon is hot hot hot(L)yeah! peter pan on dvd!!!&lt;:o)"/></To><Text Style="font-family:Comic Sans MS; font-weight:bold; color:#000080; ">yeah</Text></Message><Message Date="10/06/2004" Time="8:56:27 PM" DateTime="2004-06-10T10:56:27.357Z" SessionID="31"><From><User FriendlyName="(¯`·._.·[tÂk€ m¥ ß®€ªTh ðWª¥]·._.·´¯)IF U WERE ME ID BE UGLY! says: (k)brendon is hot hot hot(L)yeah! peter pan on dvd!!!&lt;:o)"/></From><To><User FriendlyName="James &lt;:o)"/></To><Text Style="font-family:Lucida Console; font-weight:bold; color:#a042ff; ">wat?</Text></Message><Message Date="10/06/2004" Time="8:56:42 PM" DateTime="2004-06-10T10:56:42.989Z" SessionID="31"><From><User FriendlyName="James &lt;:o)"/></From><To><User FriendlyName="(¯`·._.·[tÂk€ m¥ ß®€ªTh ðWª¥]·._.·´¯)IF U WERE ME ID BE UGLY! says: (k)brendon is hot hot hot(L)yeah! peter pan on dvd!!!&lt;:o)"/></To><Text Style="font-family:Comic Sans MS; font-weight:bold; color:#000080; ">Do u think my pic makes me look evil?</Text></Message><Message Date="10/06/2004" Time="8:57:27 PM" DateTime="2004-06-10T10:57:27.083Z" SessionID="32"><From><User FriendlyName="(¯`·._.·[tÂk€ m¥ ß®€ªTh ðWª¥]·._.·´¯)IF U WERE ME ID BE UGLY! says: (k)brendon is hot hot hot(L)yeah! peter pan on dvd!!!&lt;:o)"/></From><To><User FriendlyName="James &lt;:o)"/></To><Text Style="font-family:Lucida Console; font-weight:bold; color:#a042ff; ">i cnt c ur pic</Text></Message><Message Date="10/06/2004" Time="8:57:31 PM" DateTime="2004-06-10T10:57:31.659Z" SessionID="32"><From><User FriendlyName="James &lt;:o)"/></From><To><User FriendlyName="(¯`·._.·[tÂk€ m¥ ß®€ªTh ðWª¥]·._.·´¯)IF U WERE ME ID BE UGLY! says: (k)brendon is hot hot hot(L)yeah! peter pan on dvd!!!&lt;:o)"/></To><Text Style="font-family:Comic Sans MS; font-weight:bold; color:#000080; ">y not?</Text></Message><Message Date="10/06/2004" Time="8:57:40 PM" DateTime="2004-06-10T10:57:40.813Z" SessionID="32"><From><User FriendlyName="(¯`·._.·[tÂk€ m¥ ß®€ªTh ðWª¥]·._.·´¯)IF U WERE ME ID BE UGLY! says: (k)brendon is hot hot hot(L)yeah! peter pan on dvd!!!&lt;:o)"/></From><To><User FriendlyName="James &lt;:o)"/></To><Text Style="font-family:Lucida Console; font-weight:bold; color:#a042ff; ">i dont think ur an actual contact</Text></Message><Message Date="10/06/2004" Time="8:57:44 PM" DateTime="2004-06-10T10:57:44.718Z" SessionID="32"><From><User FriendlyName="James &lt;:o)"/></From><To><User FriendlyName="(¯`·._.·[tÂk€ m¥ ß®€ªTh ðWª¥]·._.·´¯)IF U WERE ME ID BE UGLY! says: (k)brendon is hot hot hot(L)yeah! peter pan on dvd!!!&lt;:o)"/></To><Text Style="font-family:Comic Sans MS; font-weight:bold; color:#000080; ">oh</Text></Message><Message Date="10/06/2004" Time="8:57:45 PM" DateTime="2004-06-10T10:57:45.499Z" SessionID="32"><From><User FriendlyName="James &lt;:o)"/></From><To><User FriendlyName="(¯`·._.·[tÂk€ m¥ ß®€ªTh ðWª¥]·._.·´¯)IF U WERE ME ID BE UGLY! says: (k)brendon is hot hot hot(L)yeah! peter pan on dvd!!!&lt;:o)"/></To><Text Style="font-family:Comic Sans MS; font-weight:bold; color:#000080; ">sure</Text></Message><Message Date="10/06/2004" Time="8:57:47 PM" DateTime="2004-06-10T10:57:47.342Z" SessionID="32"><From><User FriendlyName="James &lt;:o)"/></From><To><User FriendlyName="(¯`·._.·[tÂk€ m¥ ß®€ªTh ðWª¥]·._.·´¯)IF U WERE ME ID BE UGLY! says: (k)brendon is hot hot hot(L)yeah! peter pan on dvd!!!&lt;:o)"/></To><Text Style="font-family:Comic Sans MS; font-weight:bold; color:#000080; ">thats right</Text></Message><Message Date="10/06/2004" Time="8:57:49 PM" DateTime="2004-06-10T10:57:49.455Z" SessionID="32"><From><User FriendlyName="James &lt;:o)"/></From><To><User FriendlyName="(¯`·._.·[tÂk€ m¥ ß®€ªTh ðWª¥]·._.·´¯)IF U WERE ME ID BE UGLY! says: (k)brendon is hot hot hot(L)yeah! peter pan on dvd!!!&lt;:o)"/></To><Text Style="font-family:Comic Sans MS; font-weight:bold; color:#000080; ">8-)</Text></Message><Message Date="10/06/2004" Time="8:57:50 PM" DateTime="2004-06-10T10:57:50.507Z" SessionID="32"><From><User FriendlyName="James &lt;:o)"/></From><To><User FriendlyName="(¯`·._.·[tÂk€ m¥ ß®€ªTh ðWª¥]·._.·´¯)IF U WERE ME ID BE UGLY! says: (k)brendon is hot hot hot(L)yeah! peter pan on dvd!!!&lt;:o)"/></To><Text Style="font-family:Comic Sans MS; font-weight:bold; color:#000080; ">thanks</Text></Message><Message Date="10/06/2004" Time="8:57:53 PM" DateTime="2004-06-10T10:57:53.631Z" SessionID="32"><From><User FriendlyName="James &lt;:o)"/></From><To><User FriendlyName="(¯`·._.·[tÂk€ m¥ ß®€ªTh ðWª¥]·._.·´¯)IF U WERE ME ID BE UGLY! says: (k)brendon is hot hot hot(L)yeah! peter pan on dvd!!!&lt;:o)"/></To><Text Style="font-family:Comic Sans MS; font-weight:bold; color:#000080; ">that helps</Text></Message><Message Date="10/06/2004" Time="8:57:56 PM" DateTime="2004-06-10T10:57:56.735Z" SessionID="32"><From><User FriendlyName="James &lt;:o)"/></From><To><User FriendlyName="(¯`·._.·[tÂk€ m¥ ß®€ªTh ðWª¥]·._.·´¯)IF U WERE ME ID BE UGLY! says: (k)brendon is hot hot hot(L)yeah! peter pan on dvd!!!&lt;:o)"/></To><Text Style="font-family:Comic Sans MS; font-weight:bold; color:#000080; ">real nice</Text></Message><Message Date="10/06/2004" Time="8:58:04 PM" DateTime="2004-06-10T10:58:04.296Z" SessionID="32"><From><User FriendlyName="(¯`·._.·[tÂk€ m¥ ß®€ªTh ðWª¥]·._.·´¯)IF U WERE ME ID BE UGLY! says: (k)brendon is hot hot hot(L)yeah! peter pan on dvd!!!&lt;:o)"/></From><To><User FriendlyName="James &lt;:o)"/></To><Text Style="font-family:Lucida Console; font-weight:bold; color:#a042ff; ">sorry</Text></Message><Message Date="10/06/2004" Time="8:58:51 PM" DateTime="2004-06-10T10:58:51.404Z" SessionID="32"><From><User FriendlyName="James &lt;:o)"/></From><To><User FriendlyName="(¯`·._.·[tÂk€ m¥ ß®€ªTh ðWª¥]·._.·´¯)IF U WERE ME ID BE UGLY! says: (k)brendon is hot hot hot(L)yeah! peter pan on dvd!!!&lt;:o)"/></To><Text Style="font-family:Comic Sans MS; font-weight:bold; color:#000080; ">lol</Text></Message><Message Date="10/06/2004" Time="8:58:54 PM" DateTime="2004-06-10T10:58:54.018Z" SessionID="32"><From><User FriendlyName="James &lt;:o)"/></From><To><User FriendlyName="(¯`·._.·[tÂk€ m¥ ß®€ªTh ðWª¥]·._.·´¯)IF U WERE ME ID BE UGLY! says: (k)brendon is hot hot hot(L)yeah! peter pan on dvd!!!&lt;:o)"/></To><Text Style="font-family:Comic Sans MS; font-weight:bold; color:#000080; ">Nvm</Text></Message><Message Date="10/06/2004" Time="8:59:22 PM" DateTime="2004-06-10T10:59:22.479Z" SessionID="33"><From><User FriendlyName="(¯`·._.·[tÂk€ m¥ ß®€ªTh ðWª¥]·._.·´¯)IF U WERE ME ID BE UGLY! says: (k)brendon is hot hot hot(L)yeah! peter pan on dvd!!!&lt;:o)"/></From><To><User FriendlyName="James &lt;:o)"/></To><Text Style="font-family:Lucida Console; font-weight:bold; color:#a042ff; ">now i c it</Text></Message><Message Date="10/06/2004" Time="8:59:28 PM" DateTime="2004-06-10T10:59:28.918Z" SessionID="33"><From><User FriendlyName="(¯`·._.·[tÂk€ m¥ ß®€ªTh ðWª¥]·._.·´¯)IF U WERE ME ID BE UGLY! says: (k)brendon is hot hot hot(L)yeah! peter pan on dvd!!!&lt;:o)"/></From><To><User FriendlyName="James &lt;:o)"/></To><Text Style="font-family:Lucida Console; font-weight:bold; color:#a042ff; ">ye u r lookin a tad evil</Text></Message><Message Date="10/06/2004" Time="8:59:37 PM" DateTime="2004-06-10T10:59:37.951Z" SessionID="33"><From><User FriendlyName="James &lt;:o)"/></From><To><User FriendlyName="(¯`·._.·[tÂk€ m¥ ß®€ªTh ðWª¥]·._.·´¯)IF U WERE ME ID BE UGLY! says: (k)brendon is hot hot hot(L)yeah! peter pan on dvd!!!&lt;:o)"/></To><Text Style="font-family:Comic Sans MS; font-weight:bold; color:#000080; ">y thanks you :)</Text></Message><Message Date="10/06/2004" Time="8:59:42 PM" DateTime="2004-06-10T10:59:42.888Z" SessionID="33"><From><User FriendlyName="(¯`·._.·[tÂk€ m¥ ß®€ªTh ðWª¥]·._.·´¯)IF U WERE ME ID BE UGLY! says: (k)brendon is hot hot hot(L)yeah! peter pan on dvd!!!&lt;:o)"/></From><To><User FriendlyName="James &lt;:o)"/></To><Text Style="font-family:Lucida Console; font-weight:bold; color:#a042ff; ">lol</Text></Message><Message Date="10/06/2004" Time="9:08:40 PM" DateTime="2004-06-10T11:08:40.681Z" SessionID="34"><From><User FriendlyName="(¯`·._.·[tÂk€ m¥ ß®€ªTh ðWª¥]·._.·´¯)IF U WERE ME ID BE UGLY! says: (k)brendon is hot hot hot(L)yeah! peter pan on dvd!!!&lt;:o)"/></From><To><User FriendlyName="James &lt;:o)"/></To><Text Style="font-family:Lucida Console; font-weight:bold; color:#a042ff; ">yes</Text></Message><Message Date="10/06/2004" Time="9:08:40 PM" DateTime="2004-06-10T11:08:40.872Z" SessionID="34"><From><User FriendlyName="(¯`·._.·[tÂk€ m¥ ß®€ªTh ðWª¥]·._.·´¯)IF U WERE ME ID BE UGLY! says: (k)brendon is hot hot hot(L)yeah! peter pan on dvd!!!&lt;:o)"/></From><To><User FriendlyName="James &lt;:o)"/></To><Text Style="font-family:Lucida Console; font-weight:bold; color:#a042ff; ">sooo</Text></Message><Message Date="10/06/2004" Time="9:09:03 PM" DateTime="2004-06-10T11:09:03.104Z" SessionID="34"><From><User FriendlyName="James &lt;:o)"/></From><To><User FriendlyName="(¯`·._.·[tÂk€ m¥ ß®€ªTh ðWª¥]·._.·´¯)IF U WERE ME ID BE UGLY! says: (k)brendon is hot hot hot(L)yeah! peter pan on dvd!!!&lt;:o)"/></To><Text Style="font-family:Comic Sans MS; font-weight:bold; color:#000080; ">u no heaths asked out sum super hot chick</Text></Message><Message Date="10/06/2004" Time="9:09:05 PM" DateTime="2004-06-10T11:09:05.527Z" SessionID="34"><From><User FriendlyName="James &lt;:o)"/></From><To><User FriendlyName="(¯`·._.·[tÂk€ m¥ ß®€ªTh ðWª¥]·._.·´¯)IF U WERE ME ID BE UGLY! says: (k)brendon is hot hot hot(L)yeah! peter pan on dvd!!!&lt;:o)"/></To><Text Style="font-family:Comic Sans MS; font-weight:bold; color:#000080; ">and she sed yes</Text></Message><Message Date="10/06/2004" Time="9:09:13 PM" DateTime="2004-06-10T11:09:13.749Z" SessionID="34"><From><User FriendlyName="(¯`·._.·[tÂk€ m¥ ß®€ªTh ðWª¥]·._.·´¯)IF U WERE ME ID BE UGLY! says: (k)brendon is hot hot hot(L)yeah! peter pan on dvd!!!&lt;:o)"/></From><To><User FriendlyName="James &lt;:o)"/></To><Text Style="font-family:Lucida Console; font-weight:bold; color:#a042ff; ">wow</Text></Message><Message Date="10/06/2004" Time="9:09:14 PM" DateTime="2004-06-10T11:09:14.720Z" SessionID="34"><From><User FriendlyName="James &lt;:o)"/></From><To><User FriendlyName="(¯`·._.·[tÂk€ m¥ ß®€ªTh ðWª¥]·._.·´¯)IF U WERE ME ID BE UGLY! says: (k)brendon is hot hot hot(L)yeah! peter pan on dvd!!!&lt;:o)"/></To><Text Style="font-family:Comic Sans MS; font-weight:bold; color:#000080; ">Mind u he did it on MSN which is pretty low</Text></Message><Message Date="10/06/2004" Time="9:09:23 PM" DateTime="2004-06-10T11:09:23.413Z" SessionID="35"><From><User FriendlyName="(¯`·._.·[tÂk€ m¥ ß®€ªTh ðWª¥]·._.·´¯)IF U WERE ME ID BE UGLY! says: (k)brendon is hot hot hot(L)yeah! peter pan on dvd!!!&lt;:o)"/></From><To><User FriendlyName="James &lt;:o)"/></To><Text Style="font-family:Lucida Console; font-weight:bold; color:#a042ff; ">lol</Text></Message><Message Date="10/06/2004" Time="9:09:31 PM" DateTime="2004-06-10T11:09:31.354Z" SessionID="35"><From><User FriendlyName="(¯`·._.·[tÂk€ m¥ ß®€ªTh ðWª¥]·._.·´¯)IF U WERE ME ID BE UGLY! says: (k)brendon is hot hot hot(L)yeah! peter pan on dvd!!!&lt;:o)"/></From><To><User FriendlyName="James &lt;:o)"/></To><Text Style="font-family:Lucida Console; font-weight:bold; color:#a042ff; ">ye u can never tell if sum1 is serious on msn</Text></Message><Message Date="10/06/2004" Time="9:09:50 PM" DateTime="2004-06-10T11:09:50.792Z" SessionID="35"><From><User FriendlyName="James &lt;:o)"/></From><To><User FriendlyName="(¯`·._.·[tÂk€ m¥ ß®€ªTh ðWª¥]·._.·´¯)IF U WERE ME ID BE UGLY! says: (k)brendon is hot hot hot(L)yeah! peter pan on dvd!!!&lt;:o)"/></To><Text Style="font-family:Comic Sans MS; font-weight:bold; color:#000080; ">yeah</Text></Message><Message Date="10/06/2004" Time="9:10:03 PM" DateTime="2004-06-10T11:10:03.000Z" SessionID="35"><From><User FriendlyName="James &lt;:o)"/></From><To><User FriendlyName="(¯`·._.·[tÂk€ m¥ ß®€ªTh ðWª¥]·._.·´¯)IF U WERE ME ID BE UGLY! says: (k)brendon is hot hot hot(L)yeah! peter pan on dvd!!!&lt;:o)"/></To><Text Style="font-family:Comic Sans MS; font-weight:bold; color:#000080; ">well shes gorgus, so how could he not 8-)</Text></Message><Message Date="10/06/2004" Time="9:10:08 PM" DateTime="2004-06-10T11:10:08.758Z" SessionID="35"><From><User FriendlyName="James &lt;:o)"/></From><To><User FriendlyName="(¯`·._.·[tÂk€ m¥ ß®€ªTh ðWª¥]·._.·´¯)IF U WERE ME ID BE UGLY! says: (k)brendon is hot hot hot(L)yeah! peter pan on dvd!!!&lt;:o)"/></To><Text Style="font-family:Comic Sans MS; font-weight:bold; color:#000080; ">but thats heath for u</Text></Message><Message Date="10/06/2004" Time="9:10:10 PM" DateTime="2004-06-10T11:10:10.961Z" SessionID="36"><From><User FriendlyName="(¯`·._.·[tÂk€ m¥ ß®€ªTh ðWª¥]·._.·´¯)IF U WERE ME ID BE UGLY! says: (k)brendon is hot hot hot(L)yeah! peter pan on dvd!!!&lt;:o)"/></From><To><User FriendlyName="James &lt;:o)"/></To><Text Style="font-family:Lucida Console; font-weight:bold; color:#a042ff; ">lol</Text></Message><Message Date="10/06/2004" Time="9:10:24 PM" DateTime="2004-06-10T11:10:24.691Z" SessionID="37"><From><User FriendlyName="(¯`·._.·[tÂk€ m¥ ß®€ªTh ðWª¥]·._.·´¯)IF U WERE ME ID BE UGLY! says: (k)brendon is hot hot hot(L)yeah! peter pan on dvd!!!&lt;:o)"/></From><To><User FriendlyName="James &lt;:o)"/></To><Text Style="font-family:Lucida Console; font-weight:bold; color:#a042ff; ">wat skool?</Text></Message><Message Date="10/06/2004" Time="9:10:28 PM" DateTime="2004-06-10T11:10:28.056Z" SessionID="37"><From><User FriendlyName="(¯`·._.·[tÂk€ m¥ ß®€ªTh ðWª¥]·._.·´¯)IF U WERE ME ID BE UGLY! says: (k)brendon is hot hot hot(L)yeah! peter pan on dvd!!!&lt;:o)"/></From><To><User FriendlyName="James &lt;:o)"/></To><Text Style="font-family:Lucida Console; font-weight:bold; color:#a042ff; ">duz she go 2?</Text></Message><Message Date="10/06/2004" Time="9:10:43 PM" DateTime="2004-06-10T11:10:43.258Z" SessionID="37"><From><User FriendlyName="James &lt;:o)"/></From><To><User FriendlyName="(¯`·._.·[tÂk€ m¥ ß®€ªTh ðWª¥]·._.·´¯)IF U WERE ME ID BE UGLY! says: (k)brendon is hot hot hot(L)yeah! peter pan on dvd!!!&lt;:o)"/></To><Text Style="font-family:Comic Sans MS; font-weight:bold; color:#000080; ">My skool</Text></Message><Message Date="10/06/2004" Time="9:10:50 PM" DateTime="2004-06-10T11:10:50.298Z" SessionID="37"><From><User FriendlyName="James &lt;:o)"/></From><To><User FriendlyName="(¯`·._.·[tÂk€ m¥ ß®€ªTh ðWª¥]·._.·´¯)IF U WERE ME ID BE UGLY! says: (k)brendon is hot hot hot(L)yeah! peter pan on dvd!!!&lt;:o)"/></To><Text Style="font-family:Comic Sans MS; font-weight:bold; color:#000080; ">Nikki Champness</Text></Message><Message Date="10/06/2004" Time="9:10:52 PM" DateTime="2004-06-10T11:10:52.251Z" SessionID="37"><From><User FriendlyName="James &lt;:o)"/></From><To><User FriendlyName="(¯`·._.·[tÂk€ m¥ ß®€ªTh ðWª¥]·._.·´¯)IF U WERE ME ID BE UGLY! says: (k)brendon is hot hot hot(L)yeah! peter pan on dvd!!!&lt;:o)"/></To><Text Style="font-family:Comic Sans MS; font-weight:bold; color:#000080; ">u no here?</Text></Message><Message Date="10/06/2004" Time="9:10:58 PM" DateTime="2004-06-10T11:10:58.490Z" SessionID="38"><From><User FriendlyName="(¯`·._.·[tÂk€ m¥ ß®€ªTh ðWª¥]·._.·´¯)IF U WERE ME ID BE UGLY! says: (k)brendon is hot hot hot(L)yeah! peter pan on dvd!!!&lt;:o)"/></From><To><User FriendlyName="James &lt;:o)"/></To><Text Style="font-family:Lucida Console; font-weight:bold; color:#a042ff; ">ye iv got her msn</Text></Message><Message Date="10/06/2004" Time="9:11:04 PM" DateTime="2004-06-10T11:11:04.658Z" SessionID="38"><From><User FriendlyName="James &lt;:o)"/></From><To><User FriendlyName="(¯`·._.·[tÂk€ m¥ ß®€ªTh ðWª¥]·._.·´¯)IF U WERE ME ID BE UGLY! says: (k)brendon is hot hot hot(L)yeah! peter pan on dvd!!!&lt;:o)"/></To><Text Style="font-family:Comic Sans MS; font-weight:bold; color:#000080; ">yeah</Text></Message><Message Date="10/06/2004" Time="9:11:07 PM" DateTime="2004-06-10T11:11:07.102Z" SessionID="38"><From><User FriendlyName="James &lt;:o)"/></From><To><User FriendlyName="(¯`·._.·[tÂk€ m¥ ß®€ªTh ðWª¥]·._.·´¯)IF U WERE ME ID BE UGLY! says: (k)brendon is hot hot hot(L)yeah! peter pan on dvd!!!&lt;:o)"/></To><Text Style="font-family:Comic Sans MS; font-weight:bold; color:#000080; ">her</Text></Message><Message Date="10/06/2004" Time="9:11:19 PM" DateTime="2004-06-10T11:11:19.159Z" SessionID="39"><From><User FriendlyName="James &lt;:o)"/></From><To><User FriendlyName="(¯`·._.·[tÂk€ m¥ ß®€ªTh ðWª¥]·._.·´¯)IF U WERE ME ID BE UGLY! says: (k)brendon is hot hot hot(L)yeah! peter pan on dvd!!!&lt;:o)"/></To><Text Style="font-family:Comic Sans MS; font-weight:bold; color:#000080; ">cya</Text></Message><Message Date="17/09/2004" Time="11:54:43 PM" DateTime="2004-09-17T13:54:43.802Z" SessionID="40"><From><User FriendlyName="James 8-|"/></From><To><User FriendlyName="u cant fite da tears that aint cumin Or da moment of truth in ur lies Wen evrythin feels lyk da movies u bleed jst 2 kno ur alive"/></To><Text Style="font-family:Comic Sans MS; font-weight:bold; color:#000080; ">thats like my favourite song</Text></Message><Message Date="17/09/2004" Time="11:54:50 PM" DateTime="2004-09-17T13:54:50.802Z" SessionID="41"><From><User FriendlyName="u cant fite da tears that aint cumin Or da moment of truth in ur lies Wen evrythin feels lyk da movies u bleed jst 2 kno ur alive"/></From><To><User FriendlyName="James 8-|"/></To><Text Style="font-family:Comic Sans MS; font-weight:bold; color:#000000; ">really</Text></Message><Message Date="17/09/2004" Time="11:55:07 PM" DateTime="2004-09-17T13:55:07.105Z" SessionID="41"><From><User FriendlyName="James 8-|"/></From><To><User FriendlyName="u cant fite da tears that aint cumin Or da moment of truth in ur lies Wen evrythin feels lyk da movies u bleed jst 2 kno ur alive"/></To><Text Style="font-family:Comic Sans MS; font-weight:bold; color:#000080; ">really really</Text></Message><Message Date="17/09/2004" Time="11:55:43 PM" DateTime="2004-09-17T13:55:43.588Z" SessionID="42"><From><User FriendlyName="u cant fite da tears that aint cumin Or da moment of truth in ur lies Wen evrythin feels lyk da movies u bleed jst 2 kno ur alive"/></From><To><User FriendlyName="James 8-|"/></To><Text Style="font-family:Comic Sans MS; font-weight:bold; color:#000000; ">i luv it</Text></Message><Message Date="17/09/2004" Time="11:55:53 PM" DateTime="2004-09-17T13:55:53.001Z" SessionID="42"><From><User FriendlyName="u cant fite da tears that aint cumin Or da moment of truth in ur lies Wen evrythin feels lyk da movies u bleed jst 2 kno ur alive"/></From><To><User FriendlyName="James 8-|"/></To><Text Style="font-family:Comic Sans MS; font-weight:bold; color:#000000; ">its so describes my feelings lol</Text></Message><Message Date="17/09/2004" Time="11:58:15 PM" DateTime="2004-09-17T13:58:15.516Z" SessionID="42"><From><User FriendlyName="James 8-|"/></From><To><User FriendlyName="u cant fite da tears that aint cumin Or da moment of truth in ur lies Wen evrythin feels lyk da movies u bleed jst 2 kno ur alive"/></To><Text Style="font-family:Comic Sans MS; font-weight:bold; color:#000080; ">i got an MP3 player for chrissy :) its sick</Text></Message><Message Date="17/09/2004" Time="11:58:30 PM" DateTime="2004-09-17T13:58:30.277Z" SessionID="43"><From><User FriendlyName="u cant fite da tears that aint cumin Or da moment of truth in ur lies Wen evrythin feels lyk da movies u bleed jst 2 kno ur alive"/></From><To><User FriendlyName="James 8-|"/></To><Text Style="font-family:Comic Sans MS; font-weight:bold; color:#000000; ">gr8</Text></Message><Message Date="17/09/2004" Time="11:58:33 PM" DateTime="2004-09-17T13:58:33.832Z" SessionID="43"><From><User FriendlyName="u cant fite da tears that aint cumin Or da moment of truth in ur lies Wen evrythin feels lyk da movies u bleed jst 2 kno ur alive"/></From><To><User FriendlyName="James 8-|"/></To><Text Style="font-family:Comic Sans MS; font-weight:bold; color:#000000; ">random comment 4 the day</Text></Message><Message Date="17/09/2004" Time="11:58:37 PM" DateTime="2004-09-17T13:58:37.408Z" SessionID="43"><From><User FriendlyName="James 8-|"/></From><To><User FriendlyName="u cant fite da tears that aint cumin Or da moment of truth in ur lies Wen evrythin feels lyk da movies u bleed jst 2 kno ur alive"/></To><Text Style="font-family:Comic Sans MS; font-weight:bold; color:#000080; ">no</Text></Message><Message Date="17/09/2004" Time="11:58:40 PM" DateTime="2004-09-17T13:58:40.101Z" SessionID="43"><From><User FriendlyName="James 8-|"/></From><To><User FriendlyName="u cant fite da tears that aint cumin Or da moment of truth in ur lies Wen evrythin feels lyk da movies u bleed jst 2 kno ur alive"/></To><Text Style="font-family:Comic Sans MS; font-weight:bold; color:#000080; ">that songs on it</Text></Message><Message Date="9/10/2004" Time="9:23:12 PM" DateTime="2004-10-09T11:23:12.533Z" SessionID="44"><From><User FriendlyName="life of a simple man taught that vry1 else is dirty nd luv is meaningless im so soileed"/></From><To><User FriendlyName="James*-) The fewer things you try, the more things your good at :)"/></To><Text Style="font-family:Comic Sans MS; font-weight:bold; color:#000000; ">hu the fuk r u?</Text></Message><Message Date="9/10/2004" Time="9:23:23 PM" DateTime="2004-10-09T11:23:23.889Z" SessionID="44"><From><User FriendlyName="James*-) The fewer things you try, the more things your good at :)"/></From><To><User FriendlyName="life of a simple man taught that vry1 else is dirty nd luv is meaningless im so soileed"/></To><Text Style="font-family:Comic Sans MS; font-weight:bold; color:#000080; ">I am james</Text></Message><Message Date="9/10/2004" Time="9:23:31 PM" DateTime="2004-10-09T11:23:31.119Z" SessionID="44"><From><User FriendlyName="James*-) The fewer things you try, the more things your good at :)"/></From><To><User FriendlyName="life of a simple man taught that vry1 else is dirty nd luv is meaningless im so soileed"/></To><Text Style="font-family:Comic Sans MS; font-weight:bold; color:#000080; ">ahh the guy in the display pic?</Text></Message><Message Date="9/10/2004" Time="9:23:46 PM" DateTime="2004-10-09T11:23:46.131Z" SessionID="45"><From><User FriendlyName="life of a simple man taught that vry1 else is dirty nd luv is meaningless im so soileed"/></From><To><User FriendlyName="James*-) The fewer things you try, the more things your good at :)"/></To><Text Style="font-family:Comic Sans MS; font-weight:bold; color:#000000; ">shut up</Text></Message><Message Date="9/10/2004" Time="9:23:51 PM" DateTime="2004-10-09T11:23:51.218Z" SessionID="45"><From><User FriendlyName="James*-) The fewer things you try, the more things your good at :)"/></From><To><User FriendlyName="life of a simple man taught that vry1 else is dirty nd luv is meaningless im so soileed"/></To><Text Style="font-family:Comic Sans MS; font-weight:bold; color:#000080; ">???</Text></Message><Message Date="9/10/2004" Time="9:23:55 PM" DateTime="2004-10-09T11:23:55.755Z" SessionID="45"><From><User FriendlyName="James*-) The fewer things you try, the more things your good at :)"/></From><To><User FriendlyName="life of a simple man taught that vry1 else is dirty nd luv is meaningless im so soileed"/></To><Text Style="font-family:Comic Sans MS; font-weight:bold; color:#000080; ">u started talkin 2 me</Text></Message><Message Date="9/10/2004" Time="9:24:09 PM" DateTime="2004-10-09T11:24:09.234Z" SessionID="45"><From><User FriendlyName="James*-) The fewer things you try, the more things your good at :)"/></From><To><User FriendlyName="life of a simple man taught that vry1 else is dirty nd luv is meaningless im so soileed"/></To><Text Style="font-family:Comic Sans MS; font-weight:bold; color:#000080; ">I met u on the train wunth</Text></Message><Message Date="9/10/2004" Time="9:24:10 PM" DateTime="2004-10-09T11:24:10.356Z" SessionID="45"><From><User FriendlyName="James*-) The fewer things you try, the more things your good at :)"/></From><To><User FriendlyName="life of a simple man taught that vry1 else is dirty nd luv is meaningless im so soileed"/></To><Text Style="font-family:Comic Sans MS; font-weight:bold; color:#000080; ">ah</Text></Message><Message Date="9/10/2004" Time="9:24:13 PM" DateTime="2004-10-09T11:24:13.290Z" SessionID="45"><From><User FriendlyName="James*-) The fewer things you try, the more things your good at :)"/></From><To><User FriendlyName="life of a simple man taught that vry1 else is dirty nd luv is meaningless im so soileed"/></To><Text Style="font-family:Comic Sans MS; font-weight:bold; color:#000080; ">heath was there</Text></Message><Message Date="9/10/2004" Time="9:24:24 PM" DateTime="2004-10-09T11:24:24.116Z" SessionID="46"><From><User FriendlyName="life of a simple man taught that vry1 else is dirty nd luv is meaningless im so soileed"/></From><To><User FriendlyName="James*-) The fewer things you try, the more things your good at :)"/></To><Text Style="font-family:Comic Sans MS; font-weight:bold; color:#000000; ">good for u</Text></Message><Message Date="12/10/2004" Time="8:45:00 PM" DateTime="2004-10-12T10:45:00.827Z" SessionID="47"><From><User FriendlyName="(L)i dnt kno much at all i dnt kno rong from rite all i kno is that i luv u 2nite(L)I LUV CHODY(l)"/></From><To><User FriendlyName="James*-)I started a joke, which started the whole crying ... But I didnt see; That the joke was on me..."/></To><Text Style="font-family:Comic Sans MS; font-weight:bold; color:#000000; ">we are very sorry for the problems that MSN are having but they will be fixed. MSN will shut down at 12:00 tonight for a week or so until we can figure out what has been going on. please send this once again to at least 25 people it doesn't matter if they are the same people just do it so that we will not shut your account down thank you</Text></Message></Log>
