<?xml version="1.0"?>
<?xml-stylesheet type='text/xsl' href='MessageLog.xsl'?>
<Log FirstSessionID="755" LastSessionID="1912" Archive="true"><Message Date="11/02/2005" Time="8:03:16 PM" DateTime="2005-02-11T09:03:16.980Z" SessionID="755"><From><User FriendlyName="-||Marc||-TAX THE PANTY-save a mouse eat a pussy!"/></From><To><User FriendlyName="James *-)I need to hear some sounds that recognize the pain in me. I let the melody shine, let it cleanse my mind I feel free now"/></To><Text Style="font-family:Microsoft Sans Serif; color:#000000; ">audio?</Text></Message><Invitation Date="11/02/2005" Time="8:03:22 PM" DateTime="2005-02-11T09:03:22.718Z" SessionID="755"><From><User FriendlyName="James *-)I need to hear some sounds that recognize the pain in me. I let the melody shine, let it cleanse my mind I feel free now"/></From><Application>an audio conversation</Application><Text Style="color:#545454; ">You have invited -||Marc||-TAX THE PANTY-save a mouse eat a pussy! to start an audio conversation. Please wait for a response, or Cancel (Alt+Q) the pending invitation.</Text></Invitation><InvitationResponse Date="11/02/2005" Time="8:03:27 PM" DateTime="2005-02-11T09:03:27.044Z" SessionID="755"><From><User FriendlyName="-||Marc||-TAX THE PANTY-save a mouse eat a pussy!"/></From><Application>an audio conversation</Application><Text Style="color:#545454; ">-||Marc||-TAX THE PANTY-save a mouse eat a pussy! has accepted your invitation to start an audio conversation.</Text></InvitationResponse><Message Date="11/02/2005" Time="8:29:40 PM" DateTime="2005-02-11T09:29:40.096Z" SessionID="755"><From><User FriendlyName="James *-)I need to hear some sounds that recognize the pain in me. I let the melody shine, let it cleanse my mind I feel free now"/></From><To><User FriendlyName="-||Marc||-TAX THE PANTY-save a mouse eat a pussy!"/></To><Text Style="font-family:Comic Sans MS; font-weight:bold; color:#000080; ">New etpro is on it</Text></Message><Message Date="11/02/2005" Time="8:29:46 PM" DateTime="2005-02-11T09:29:46.766Z" SessionID="755"><From><User FriendlyName="-||Marc||-TAX THE PANTY-save a mouse eat a pussy!"/></From><To><User FriendlyName="James *-)I need to hear some sounds that recognize the pain in me. I let the melody shine, let it cleanse my mind I feel free now"/></To><Text Style="font-family:Microsoft Sans Serif; color:#000000; ">i no</Text></Message><Message Date="11/02/2005" Time="8:29:48 PM" DateTime="2005-02-11T09:29:48.318Z" SessionID="755"><From><User FriendlyName="-||Marc||-TAX THE PANTY-save a mouse eat a pussy!"/></From><To><User FriendlyName="James *-)I need to hear some sounds that recognize the pain in me. I let the melody shine, let it cleanse my mind I feel free now"/></To><Text Style="font-family:Microsoft Sans Serif; color:#000000; ">i got that</Text></Message><Message Date="11/02/2005" Time="8:29:56 PM" DateTime="2005-02-11T09:29:56.870Z" SessionID="755"><From><User FriendlyName="-||Marc||-TAX THE PANTY-save a mouse eat a pussy!"/></From><To><User FriendlyName="James *-)I need to hear some sounds that recognize the pain in me. I let the melody shine, let it cleanse my mind I feel free now"/></To><Text Style="font-family:Microsoft Sans Serif; color:#000000; ">i just ahve 2 get the super goldrush final</Text></Message><Message Date="11/02/2005" Time="8:30:10 PM" DateTime="2005-02-11T09:30:10.690Z" SessionID="755"><From><User FriendlyName="-||Marc||-TAX THE PANTY-save a mouse eat a pussy!"/></From><To><User FriendlyName="James *-)I need to hear some sounds that recognize the pain in me. I let the melody shine, let it cleanse my mind I feel free now"/></To><Text Style="font-family:Microsoft Sans Serif; color:#000000; ">looking on the net cause it will take 20 min 2 dl it off the server</Text></Message><Message Date="11/02/2005" Time="8:31:19 PM" DateTime="2005-02-11T09:31:19.920Z" SessionID="755"><From><User FriendlyName="-||Marc||-TAX THE PANTY-save a mouse eat a pussy!"/></From><To><User FriendlyName="James *-)I need to hear some sounds that recognize the pain in me. I let the melody shine, let it cleanse my mind I feel free now"/></To><Text Style="font-family:Microsoft Sans Serif; color:#000000; ">hey dude why dont u just send me the version of ven u r using</Text></Message><Message Date="11/02/2005" Time="8:37:56 PM" DateTime="2005-02-11T09:37:56.710Z" SessionID="755"><From><User FriendlyName="James *-)I need to hear some sounds that recognize the pain in me. I let the melody shine, let it cleanse my mind I feel free now"/></From><To><User FriendlyName="-||Marc||-TAX THE PANTY-save a mouse eat a pussy!"/></To><Text Style="font-family:Comic Sans MS; font-weight:bold; color:#000080; ">Any trubles?</Text></Message><Message Date="11/02/2005" Time="8:38:05 PM" DateTime="2005-02-11T09:38:05.513Z" SessionID="755"><From><User FriendlyName="-||Marc||-TAX THE PANTY-save a mouse eat a pussy!"/></From><To><User FriendlyName="James *-)I need to hear some sounds that recognize the pain in me. I let the melody shine, let it cleanse my mind I feel free now"/></To><Text Style="font-family:Microsoft Sans Serif; color:#000000; ">have 2 get some mappacks</Text></Message><Message Date="11/02/2005" Time="8:38:25 PM" DateTime="2005-02-11T09:38:25.542Z" SessionID="755"><From><User FriendlyName="-||Marc||-TAX THE PANTY-save a mouse eat a pussy!"/></From><To><User FriendlyName="James *-)I need to hear some sounds that recognize the pain in me. I let the melody shine, let it cleanse my mind I feel free now"/></To><Text Style="font-family:Microsoft Sans Serif; color:#000000; ">be about 10 min</Text></Message><Message Date="11/02/2005" Time="8:38:30 PM" DateTime="2005-02-11T09:38:30.990Z" SessionID="755"><From><User FriendlyName="James *-)I need to hear some sounds that recognize the pain in me. I let the melody shine, let it cleanse my mind I feel free now"/></From><To><User FriendlyName="-||Marc||-TAX THE PANTY-save a mouse eat a pussy!"/></To><Text Style="font-family:Comic Sans MS; font-weight:bold; color:#000080; ">kk</Text></Message><Message Date="11/02/2005" Time="8:38:32 PM" DateTime="2005-02-11T09:38:32.231Z" SessionID="755"><From><User FriendlyName="-||Marc||-TAX THE PANTY-save a mouse eat a pussy!"/></From><To><User FriendlyName="James *-)I need to hear some sounds that recognize the pain in me. I let the melody shine, let it cleanse my mind I feel free now"/></To><Text Style="font-family:Microsoft Sans Serif; color:#000000; ">maybe 6</Text></Message><Message Date="11/02/2005" Time="8:41:41 PM" DateTime="2005-02-11T09:41:41.393Z" SessionID="755"><From><User FriendlyName="James *-)I need to hear some sounds that recognize the pain in me. I let the melody shine, let it cleanse my mind I feel free now"/></From><To><User FriendlyName="-||Marc||-TAX THE PANTY-save a mouse eat a pussy!"/></To><Text Style="font-family:Comic Sans MS; font-weight:bold; color:#000080; ">www.oldversions.com</Text></Message><Message Date="11/02/2005" Time="8:45:31 PM" DateTime="2005-02-11T09:45:31.514Z" SessionID="755"><From><User FriendlyName="James *-)I need to hear some sounds that recognize the pain in me. I let the melody shine, let it cleanse my mind I feel free now"/></From><To><User FriendlyName="-||Marc||-TAX THE PANTY-save a mouse eat a pussy!"/></To><Text Style="font-family:Comic Sans MS; font-weight:bold; color:#000080; ">get it?</Text></Message><Message Date="11/02/2005" Time="8:45:52 PM" DateTime="2005-02-11T09:45:52.024Z" SessionID="755"><From><User FriendlyName="-||Marc||-TAX THE PANTY-save a mouse eat a pussy!"/></From><To><User FriendlyName="James *-)I need to hear some sounds that recognize the pain in me. I let the melody shine, let it cleanse my mind I feel free now"/></To><Text Style="font-family:Microsoft Sans Serif; color:#000000; ">no site</Text></Message><Message Date="11/02/2005" Time="8:47:25 PM" DateTime="2005-02-11T09:47:25.488Z" SessionID="755"><From><User FriendlyName="-||Marc||-TAX THE PANTY-save a mouse eat a pussy!"/></From><To><User FriendlyName="James *-)I need to hear some sounds that recognize the pain in me. I let the melody shine, let it cleanse my mind I feel free now"/></To><Text Style="font-family:Microsoft Sans Serif; color:#000000; ">server please</Text></Message><Message Date="11/02/2005" Time="8:49:40 PM" DateTime="2005-02-11T09:49:40.242Z" SessionID="755"><From><User FriendlyName="James *-)I need to hear some sounds that recognize the pain in me. I let the melody shine, let it cleanse my mind I feel free now"/></From><To><User FriendlyName="-||Marc||-TAX THE PANTY-save a mouse eat a pussy!"/></To><Text Style="font-family:Comic Sans MS; font-weight:bold; color:#000080; ">Its the latewst</Text></Message><Message Date="11/02/2005" Time="8:49:40 PM" DateTime="2005-02-11T09:49:40.833Z" SessionID="755"><From><User FriendlyName="James *-)I need to hear some sounds that recognize the pain in me. I let the melody shine, let it cleanse my mind I feel free now"/></From><To><User FriendlyName="-||Marc||-TAX THE PANTY-save a mouse eat a pussy!"/></To><Text Style="font-family:Comic Sans MS; font-weight:bold; color:#000080; ">2.2</Text></Message><Message Date="11/02/2005" Time="8:49:52 PM" DateTime="2005-02-11T09:49:52.449Z" SessionID="755"><From><User FriendlyName="-||Marc||-TAX THE PANTY-save a mouse eat a pussy!"/></From><To><User FriendlyName="James *-)I need to hear some sounds that recognize the pain in me. I let the melody shine, let it cleanse my mind I feel free now"/></To><Text Style="font-family:Microsoft Sans Serif; color:#000000; ">ok</Text></Message><Message Date="11/02/2005" Time="8:50:00 PM" DateTime="2005-02-11T09:50:00.631Z" SessionID="755"><From><User FriendlyName="-||Marc||-TAX THE PANTY-save a mouse eat a pussy!"/></From><To><User FriendlyName="James *-)I need to hear some sounds that recognize the pain in me. I let the melody shine, let it cleanse my mind I feel free now"/></To><Text Style="font-family:Microsoft Sans Serif; color:#000000; ">but wats the server</Text></Message><Message Date="11/02/2005" Time="8:50:05 PM" DateTime="2005-02-11T09:50:05.829Z" SessionID="755"><From><User FriendlyName="-||Marc||-TAX THE PANTY-save a mouse eat a pussy!"/></From><To><User FriendlyName="James *-)I need to hear some sounds that recognize the pain in me. I let the melody shine, let it cleanse my mind I feel free now"/></To><Text Style="font-family:Microsoft Sans Serif; color:#000000; ">i have it already</Text></Message><Message Date="11/02/2005" Time="8:50:14 PM" DateTime="2005-02-11T09:50:14.511Z" SessionID="755"><From><User FriendlyName="James *-)I need to hear some sounds that recognize the pain in me. I let the melody shine, let it cleanse my mind I feel free now"/></From><To><User FriendlyName="-||Marc||-TAX THE PANTY-save a mouse eat a pussy!"/></To><Text Style="font-family:Comic Sans MS; font-weight:bold; color:#000080; ">203.17.15.136</Text></Message><Message Date="11/02/2005" Time="8:50:19 PM" DateTime="2005-02-11T09:50:19.629Z" SessionID="755"><From><User FriendlyName="James *-)I need to hear some sounds that recognize the pain in me. I let the melody shine, let it cleanse my mind I feel free now"/></From><To><User FriendlyName="-||Marc||-TAX THE PANTY-save a mouse eat a pussy!"/></To><Text Style="font-family:Comic Sans MS; font-weight:bold; color:#000080; ">3794</Text></Message><Message Date="11/02/2005" Time="8:53:52 PM" DateTime="2005-02-11T09:53:52.635Z" SessionID="755"><From><User FriendlyName="James *-)I need to hear some sounds that recognize the pain in me. I let the melody shine, let it cleanse my mind I feel free now"/></From><To><User FriendlyName="-||Marc||-TAX THE PANTY-save a mouse eat a pussy!"/></To><Text Style="font-family:Comic Sans MS; font-weight:bold; color:#000080; ">http://www.apes.at/et/SuperGoldrush_Final.pk3</Text></Message><Message Date="11/02/2005" Time="8:53:57 PM" DateTime="2005-02-11T09:53:57.181Z" SessionID="755"><From><User FriendlyName="James *-)I need to hear some sounds that recognize the pain in me. I let the melody shine, let it cleanse my mind I feel free now"/></From><To><User FriendlyName="-||Marc||-TAX THE PANTY-save a mouse eat a pussy!"/></To><Text Style="font-family:Comic Sans MS; font-weight:bold; color:#000080; ">if u dont have it</Text></Message><Message Date="11/02/2005" Time="8:54:42 PM" DateTime="2005-02-11T09:54:42.226Z" SessionID="755"><From><User FriendlyName="-||Marc||-TAX THE PANTY-save a mouse eat a pussy!"/></From><To><User FriendlyName="James *-)I need to hear some sounds that recognize the pain in me. I let the melody shine, let it cleanse my mind I feel free now"/></To><Text Style="font-family:Microsoft Sans Serif; color:#000000; ">THATS THE 1 I DO HAVE!!!!!!!!!!!!!!!!</Text></Message><Message Date="11/02/2005" Time="8:54:55 PM" DateTime="2005-02-11T09:54:55.035Z" SessionID="755"><From><User FriendlyName="James *-)I need to hear some sounds that recognize the pain in me. I let the melody shine, let it cleanse my mind I feel free now"/></From><To><User FriendlyName="-||Marc||-TAX THE PANTY-save a mouse eat a pussy!"/></To><Text Style="font-family:Comic Sans MS; font-weight:bold; color:#000080; ">lol</Text></Message><Message Date="11/02/2005" Time="8:54:56 PM" DateTime="2005-02-11T09:54:56.897Z" SessionID="755"><From><User FriendlyName="James *-)I need to hear some sounds that recognize the pain in me. I let the melody shine, let it cleanse my mind I feel free now"/></From><To><User FriendlyName="-||Marc||-TAX THE PANTY-save a mouse eat a pussy!"/></To><Text Style="font-family:Comic Sans MS; font-weight:bold; color:#000080; ">wat do u need</Text></Message><Message Date="12/02/2005" Time="11:15:10 AM" DateTime="2005-02-12T00:15:10.849Z" SessionID="756"><From><User FriendlyName="-||Marc||-TAX THE PANTY-save a mouse eat a pussy!"/></From><To><User FriendlyName="James *-)I need to hear some sounds that recognize the pain in me. I let the melody shine, let it cleanse my mind I feel free now"/></To><Text Style="font-family:Microsoft Sans Serif; color:#000000; ">morning</Text></Message><Invitation Date="12/02/2005" Time="11:15:14 AM" DateTime="2005-02-12T00:15:14.975Z" SessionID="756"><From><User FriendlyName="James *-)I need to hear some sounds that recognize the pain in me. I let the melody shine, let it cleanse my mind I feel free now"/></From><Application>an audio conversation</Application><Text Style="color:#545454; ">You have invited -||Marc||-TAX THE PANTY-save a mouse eat a pussy! to start an audio conversation. Please wait for a response, or Cancel (Alt+Q) the pending invitation.</Text></Invitation><InvitationResponse Date="12/02/2005" Time="11:15:28 AM" DateTime="2005-02-12T00:15:28.685Z" SessionID="756"><From><User FriendlyName="-||Marc||-TAX THE PANTY-save a mouse eat a pussy!"/></From><Application>an audio conversation</Application><Text Style="color:#545454; ">-||Marc||-TAX THE PANTY-save a mouse eat a pussy! has accepted your invitation to start an audio conversation.</Text></InvitationResponse><Message Date="13/02/2005" Time="12:08:55 PM" DateTime="2005-02-13T01:08:55.239Z" SessionID="757"><From><User FriendlyName="-||Marc||-TAX THE PANTY-save a mouse eat a pussy!"/></From><To><User FriendlyName="James *-)I need to hear some sounds that recognize the pain in me. I let the melody shine, let it cleanse my mind I feel free now"/></To><Text Style="font-family:Microsoft Sans Serif; color:#000000; ">hey</Text></Message><Invitation Date="13/02/2005" Time="12:09:16 PM" DateTime="2005-02-13T01:09:16.810Z" SessionID="757"><From><User FriendlyName="James *-)I need to hear some sounds that recognize the pain in me. I let the melody shine, let it cleanse my mind I feel free now"/></From><Application>an audio conversation</Application><Text Style="color:#545454; ">You have invited -||Marc||-TAX THE PANTY-save a mouse eat a pussy! to start an audio conversation. Please wait for a response, or Cancel (Alt+Q) the pending invitation.</Text></Invitation><InvitationResponse Date="13/02/2005" Time="12:09:34 PM" DateTime="2005-02-13T01:09:34.535Z" SessionID="757"><From><User FriendlyName="-||Marc||-TAX THE PANTY-save a mouse eat a pussy!"/></From><Application>an audio conversation</Application><Text Style="color:#545454; ">-||Marc||-TAX THE PANTY-save a mouse eat a pussy! has accepted your invitation to start an audio conversation.</Text></InvitationResponse><Message Date="13/02/2005" Time="1:14:18 PM" DateTime="2005-02-13T02:14:18.320Z" SessionID="757"><From><User FriendlyName="James *-)I need to hear some sounds that recognize the pain in me. I let the melody shine, let it cleanse my mind I feel free now"/></From><To><User FriendlyName="-||Marc||-TAX THE PANTY-save a mouse eat a pussy!"/></To><Text Style="font-family:Comic Sans MS; font-weight:bold; color:#000080; ">http://darkfader.net/ds/</Text></Message><Message Date="13/02/2005" Time="2:50:45 PM" DateTime="2005-02-13T03:50:45.582Z" SessionID="758"><From><User FriendlyName="James *-)I need to hear some sounds that recognize the pain in me. I let the melody shine, let it cleanse my mind I feel free now"/></From><To><User FriendlyName="-||Marc||-TAX THE PANTY-save a mouse eat a pussy!"/></To><Text Style="font-family:Comic Sans MS; font-weight:bold; color:#000080; ">Hay Im goin ova 2 miranda 2 put 50 bux on my ds :)
Talk 2 yuh l8r this arvo or 2nite</Text></Message><Message Date="13/02/2005" Time="9:21:23 PM" DateTime="2005-02-13T10:21:23.469Z" SessionID="759"><From><User FriendlyName="-||Marc||-TAX THE PANTY-save a mouse eat a pussy!"/></From><To><User FriendlyName="James *-)I need to hear some sounds that recognize the pain in me. I let the melody shine, let it cleanse my mind I feel free now"/></To><Text Style="font-family:Microsoft Sans Serif; color:#000000; ">hey hey</Text></Message><Message Date="13/02/2005" Time="9:24:03 PM" DateTime="2005-02-13T10:24:03.900Z" SessionID="759"><From><User FriendlyName="-||Marc||-TAX THE PANTY-save a mouse eat a pussy!"/></From><To><User FriendlyName="James *-)I need to hear some sounds that recognize the pain in me. I let the melody shine, let it cleanse my mind I feel free now"/></To><Text Style="font-family:Microsoft Sans Serif; color:#000000; ">brb</Text></Message><Message Date="13/02/2005" Time="9:53:17 PM" DateTime="2005-02-13T10:53:17.652Z" SessionID="759"><From><User FriendlyName="James *-)I need to hear some sounds that recognize the pain in me. I let the melody shine, let it cleanse my mind I feel free now"/></From><To><User FriendlyName="-||Marc||-TAX THE PANTY-save a mouse eat a pussy!"/></To><Text Style="font-family:Comic Sans MS; font-weight:bold; color:#000080; ">Hay</Text></Message><Message Date="13/02/2005" Time="9:53:23 PM" DateTime="2005-02-13T10:53:23.290Z" SessionID="759"><From><User FriendlyName="James *-)I need to hear some sounds that recognize the pain in me. I let the melody shine, let it cleanse my mind I feel free now"/></From><To><User FriendlyName="-||Marc||-TAX THE PANTY-save a mouse eat a pussy!"/></To><Text Style="font-family:Comic Sans MS; font-weight:bold; color:#000080; ">I put my preoder</Text></Message><Message Date="13/02/2005" Time="9:53:26 PM" DateTime="2005-02-13T10:53:26.304Z" SessionID="759"><From><User FriendlyName="James *-)I need to hear some sounds that recognize the pain in me. I let the melody shine, let it cleanse my mind I feel free now"/></From><To><User FriendlyName="-||Marc||-TAX THE PANTY-save a mouse eat a pussy!"/></To><Text Style="font-family:Comic Sans MS; font-weight:bold; color:#000080; ">Igtg watch movie</Text></Message><Message Date="13/02/2005" Time="9:53:29 PM" DateTime="2005-02-13T10:53:29.449Z" SessionID="759"><From><User FriendlyName="James *-)I need to hear some sounds that recognize the pain in me. I let the melody shine, let it cleanse my mind I feel free now"/></From><To><User FriendlyName="-||Marc||-TAX THE PANTY-save a mouse eat a pussy!"/></To><Text Style="font-family:Comic Sans MS; font-weight:bold; color:#000080; ">cya 2moz</Text></Message><Message Date="13/02/2005" Time="11:19:00 PM" DateTime="2005-02-13T12:19:00.757Z" SessionID="760"><From><User FriendlyName="James *-)I need to hear some sounds that recognize the pain in me. I let the melody shine, let it cleanse my mind I feel free now"/></From><To><User FriendlyName="-||Marc||-TAX THE PANTY-save a mouse eat a pussy!"/></To><Text Style="font-family:Comic Sans MS; font-weight:bold; color:#000080; ">u still afk?</Text></Message><Message Date="15/02/2005" Time="3:37:42 PM" DateTime="2005-02-15T04:37:42.088Z" SessionID="761"><From><User FriendlyName="-||Marc||-Orange!!!!!!!!!"/></From><To><User FriendlyName="James *-)I need to hear some sounds that recognize the pain in me. I let the melody shine, let it cleanse my mind I feel free now"/></To><Text Style="font-family:Microsoft Sans Serif; color:#000000; ">hey</Text></Message><Message Date="15/02/2005" Time="3:37:42 PM" DateTime="2005-02-15T04:37:42.218Z" SessionID="761"><From><User FriendlyName="-||Marc||-Orange!!!!!!!!!"/></From><To><User FriendlyName="James *-)I need to hear some sounds that recognize the pain in me. I let the melody shine, let it cleanse my mind I feel free now"/></To><Text Style="font-family:Microsoft Sans Serif; color:#000000; ">why are u away</Text></Message><Message Date="16/02/2005" Time="6:49:40 PM" DateTime="2005-02-16T07:49:40.361Z" SessionID="762"><From><User FriendlyName="James *-)I need to hear some sounds that recognize the pain in me. I let the melody shine, let it cleanse my mind I feel free now"/></From><To><User FriendlyName="-||Marc||-it will be mine..oh yes..it will be mine"/></To><Text Style="font-family:Comic Sans MS; font-weight:bold; color:#000080; ">8 days</Text></Message><Message Date="16/02/2005" Time="6:50:17 PM" DateTime="2005-02-16T07:50:17.915Z" SessionID="763"><From><User FriendlyName="-||Marc||-it will be mine..oh yes..it will be mine"/></From><To><User FriendlyName="James *-)The Light at the end of the Tunnel is an Oncoming Freight Train..."/></To><Text Style="font-family:Microsoft Sans Serif; color:#000000; ">lol</Text></Message><Message Date="16/02/2005" Time="6:50:19 PM" DateTime="2005-02-16T07:50:19.438Z" SessionID="763"><From><User FriendlyName="-||Marc||-it will be mine..oh yes..it will be mine"/></From><To><User FriendlyName="James *-)The Light at the end of the Tunnel is an Oncoming Freight Train..."/></To><Text Style="font-family:Microsoft Sans Serif; color:#000000; ">hey man</Text></Message><Message Date="16/02/2005" Time="6:50:47 PM" DateTime="2005-02-16T07:50:47.037Z" SessionID="763"><From><User FriendlyName="-||Marc||-it will be mine..oh yes..it will be mine"/></From><To><User FriendlyName="James *-)The Light at the end of the Tunnel is an Oncoming Freight Train..."/></To><Text Style="font-family:Microsoft Sans Serif; color:#000000; ">audio?</Text></Message><Message Date="16/02/2005" Time="7:02:58 PM" DateTime="2005-02-16T08:02:58.249Z" SessionID="763"><From><User FriendlyName="James *-)The Light at the end of the Tunnel is an Oncoming Freight Train..."/></From><To><User FriendlyName="-||Marc||-it will be mine..oh yes..it will be mine"/></To><Text Style="font-family:Comic Sans MS; font-weight:bold; color:#000080; ">hay</Text></Message><Message Date="16/02/2005" Time="7:02:58 PM" DateTime="2005-02-16T08:02:58.739Z" SessionID="763"><From><User FriendlyName="James *-)The Light at the end of the Tunnel is an Oncoming Freight Train..."/></From><To><User FriendlyName="-||Marc||-it will be mine..oh yes..it will be mine"/></To><Text Style="font-family:Comic Sans MS; font-weight:bold; color:#000080; ">soz</Text></Message><Message Date="16/02/2005" Time="7:03:11 PM" DateTime="2005-02-16T08:03:11.368Z" SessionID="763"><From><User FriendlyName="James *-)The Light at the end of the Tunnel is an Oncoming Freight Train..."/></From><To><User FriendlyName="-||Marc||-it will be mine..oh yes..it will be mine"/></To><Text Style="font-family:Comic Sans MS; font-weight:bold; color:#000080; ">dad me fiddle with the bacca puter and move the router</Text></Message><Message Date="16/02/2005" Time="7:03:17 PM" DateTime="2005-02-16T08:03:17.677Z" SessionID="763"><From><User FriendlyName="James *-)The Light at the end of the Tunnel is an Oncoming Freight Train..."/></From><To><User FriendlyName="-||Marc||-it will be mine..oh yes..it will be mine"/></To><Text Style="font-family:Comic Sans MS; font-weight:bold; color:#000080; ">so many fucken cords back there</Text></Message><Message Date="16/02/2005" Time="7:03:27 PM" DateTime="2005-02-16T08:03:27.671Z" SessionID="763"><From><User FriendlyName="James *-)The Light at the end of the Tunnel is an Oncoming Freight Train..."/></From><To><User FriendlyName="-||Marc||-it will be mine..oh yes..it will be mine"/></To><Text Style="font-family:Comic Sans MS; font-weight:bold; color:#000080; ">But i got dinner now be on in 10 mins or so</Text></Message><Message Date="16/02/2005" Time="7:05:23 PM" DateTime="2005-02-16T08:05:23.007Z" SessionID="764"><From><User FriendlyName="-||Marc||-it will be mine..oh yes..it will be mine"/></From><To><User FriendlyName="James *-)The Light at the end of the Tunnel is an Oncoming Freight Train..."/></To><Text Style="font-family:Microsoft Sans Serif; color:#000000; ">k</Text></Message><Message Date="16/02/2005" Time="7:24:59 PM" DateTime="2005-02-16T08:24:59.629Z" SessionID="764"><From><User FriendlyName="James *-)The Light at the end of the Tunnel is an Oncoming Freight Train..."/></From><To><User FriendlyName="-||Marc||-it will be mine..oh yes..it will be mine"/></To><Text Style="font-family:Comic Sans MS; font-weight:bold; color:#000080; ">ohhh</Text></Message><Message Date="16/02/2005" Time="7:25:01 PM" DateTime="2005-02-16T08:25:01.521Z" SessionID="764"><From><User FriendlyName="James *-)The Light at the end of the Tunnel is an Oncoming Freight Train..."/></From><To><User FriendlyName="-||Marc||-it will be mine..oh yes..it will be mine"/></To><Text Style="font-family:Comic Sans MS; font-weight:bold; color:#000080; ">Hay</Text></Message><Message Date="16/02/2005" Time="7:25:09 PM" DateTime="2005-02-16T08:25:09.904Z" SessionID="764"><From><User FriendlyName="-||Marc||-it will be mine..oh yes..it will be mine"/></From><To><User FriendlyName="James *-)The Light at the end of the Tunnel is an Oncoming Freight Train..."/></To><Text Style="font-family:Microsoft Sans Serif; color:#000000; ">hey</Text></Message><Message Date="16/02/2005" Time="7:27:04 PM" DateTime="2005-02-16T08:27:04.198Z" SessionID="764"><From><User FriendlyName="-||Marc||-it will be mine..oh yes..it will be mine"/></From><To><User FriendlyName="James *-)The Light at the end of the Tunnel is an Oncoming Freight Train..."/></To><Text Style="font-family:Microsoft Sans Serif; color:#000000; ">brb eating dinnaq</Text></Message><Message Date="16/02/2005" Time="7:27:07 PM" DateTime="2005-02-16T08:27:07.943Z" SessionID="764"><From><User FriendlyName="James *-)The Light at the end of the Tunnel is an Oncoming Freight Train..."/></From><To><User FriendlyName="-||Marc||-it will be mine..oh yes..it will be mine"/></To><Text Style="font-family:Comic Sans MS; font-weight:bold; color:#000080; ">kk</Text></Message><Message Date="16/02/2005" Time="8:20:00 PM" DateTime="2005-02-16T09:20:00.125Z" SessionID="765"><From><User FriendlyName="-||Marc||-it will be mine..oh yes..it will be mine"/></From><To><User FriendlyName="James *-)The Light at the end of the Tunnel is an Oncoming Freight Train..."/></To><Text Style="font-family:Microsoft Sans Serif; color:#000000; ">hey hey</Text></Message><Invitation Date="16/02/2005" Time="8:20:27 PM" DateTime="2005-02-16T09:20:27.915Z" SessionID="765"><From><User FriendlyName="James *-)The Light at the end of the Tunnel is an Oncoming Freight Train..."/></From><Application>an audio conversation</Application><Text Style="color:#545454; ">You have invited -||Marc||-it will be mine..oh yes..it will be mine to start an audio conversation. Please wait for a response, or Cancel (Alt+Q) the pending invitation.</Text></Invitation><Message Date="16/02/2005" Time="8:20:59 PM" DateTime="2005-02-16T09:20:59.851Z" SessionID="765"><From><User FriendlyName="-||Marc||-it will be mine..oh yes..it will be mine"/></From><To><User FriendlyName="James *-)The Light at the end of the Tunnel is an Oncoming Freight Train..."/></To><Text Style="font-family:Microsoft Sans Serif; color:#000000; ">wtf msn just fucked off</Text></Message><Message Date="16/02/2005" Time="8:21:02 PM" DateTime="2005-02-16T09:21:02.655Z" SessionID="765"><From><User FriendlyName="-||Marc||-it will be mine..oh yes..it will be mine"/></From><To><User FriendlyName="James *-)The Light at the end of the Tunnel is an Oncoming Freight Train..."/></To><Text Style="font-family:Microsoft Sans Serif; color:#000000; ">try again</Text></Message><Invitation Date="16/02/2005" Time="8:21:25 PM" DateTime="2005-02-16T09:21:25.307Z" SessionID="765"><From><User FriendlyName="James *-)The Light at the end of the Tunnel is an Oncoming Freight Train..."/></From><Application>an audio conversation</Application><Text Style="color:#545454; ">You have invited -||Marc||-it will be mine..oh yes..it will be mine to start an audio conversation. Please wait for a response, or Cancel (Alt+Q) the pending invitation.</Text></Invitation><InvitationResponse Date="16/02/2005" Time="8:21:48 PM" DateTime="2005-02-16T09:21:48.140Z" SessionID="765"><From><User FriendlyName="-||Marc||-it will be mine..oh yes..it will be mine"/></From><Application>an audio conversation</Application><Text Style="color:#545454; ">-||Marc||-it will be mine..oh yes..it will be mine has accepted your invitation to start an audio conversation.</Text></InvitationResponse><Message Date="16/02/2005" Time="8:22:00 PM" DateTime="2005-02-16T09:22:00.838Z" SessionID="765"><From><User FriendlyName="James *-)The Light at the end of the Tunnel is an Oncoming Freight Train..."/></From><To><User FriendlyName="-||Marc||-it will be mine..oh yes..it will be mine"/></To><Text Style="font-family:Comic Sans MS; font-weight:bold; color:#000080; ">hang on</Text></Message><Message Date="16/02/2005" Time="10:08:09 PM" DateTime="2005-02-16T11:08:09.796Z" SessionID="765"><From><User FriendlyName="-||Marc||-it will be mine..oh yes..it will be mine"/></From><To><User FriendlyName="James *-)The Light at the end of the Tunnel is an Oncoming Freight Train..."/></To><Text Style="font-family:Microsoft Sans Serif; color:#000000; ">http://www.bf2wiki.info/index.php?n=BF2.Videos</Text></Message><Message Date="16/02/2005" Time="10:09:43 PM" DateTime="2005-02-16T11:09:43.141Z" SessionID="765"><From><User FriendlyName="James *-)The Light at the end of the Tunnel is an Oncoming Freight Train..."/></From><To><User FriendlyName="-||Marc||-it will be mine..oh yes..it will be mine"/></To><Text Style="font-family:Comic Sans MS; font-weight:bold; color:#000080; ">http://www.3dgamers.com/screenshots/games/brothersinarms/395153/</Text></Message><Invitation Date="17/02/2005" Time="9:45:12 AM" DateTime="2005-02-16T22:45:12.226Z" SessionID="766"><From><User FriendlyName="James *-)The Light at the end of the Tunnel is an Oncoming Freight Train..."/></From><Application>an audio conversation</Application><Text Style="color:#545454; ">You have invited -||Marc||-it will be mine..oh yes..it will be mine to start an audio conversation. Please wait for a response, or Cancel (Alt+Q) the pending invitation.</Text></Invitation><Message Date="17/02/2005" Time="9:45:14 AM" DateTime="2005-02-16T22:45:14.920Z" SessionID="766"><From><User FriendlyName="-||Marc||-it will be mine..oh yes..it will be mine"/></From><To><User FriendlyName="James *-)The Light at the end of the Tunnel is an Oncoming Freight Train..."/></To><Text Style="font-family:Microsoft Sans Serif; color:#000000; ">hey hey</Text></Message><InvitationResponse Date="17/02/2005" Time="9:45:21 AM" DateTime="2005-02-16T22:45:21.299Z" SessionID="766"><From><User FriendlyName="-||Marc||-it will be mine..oh yes..it will be mine"/></From><Application>an audio conversation</Application><Text Style="color:#545454; ">-||Marc||-it will be mine..oh yes..it will be mine has accepted your invitation to start an audio conversation.</Text></InvitationResponse><Message Date="17/02/2005" Time="11:25:52 AM" DateTime="2005-02-17T00:25:52.321Z" SessionID="766"><From><User FriendlyName="James *-)The Light at the end of the Tunnel is an Oncoming Freight Train..."/></From><To><User FriendlyName="-||Marc||-it will be mine..oh yes..it will be mine"/></To><Text Style="font-family:Comic Sans MS; font-weight:bold; color:#000080; ">139.134.253.11</Text></Message><Message Date="17/02/2005" Time="2:05:21 PM" DateTime="2005-02-17T03:05:21.331Z" SessionID="767"><From><User FriendlyName="-||Marc||-it will be mine..oh yes..it will be mine"/></From><To><User FriendlyName="James *-)The Light at the end of the Tunnel is an Oncoming Freight Train..."/></To><Text Style="font-family:Microsoft Sans Serif; color:#000000; ">hey u therea?</Text></Message><Message Date="17/02/2005" Time="5:20:07 PM" DateTime="2005-02-17T06:20:07.364Z" SessionID="768"><From><User FriendlyName="James *-)The Light at the end of the Tunnel is an Oncoming Freight Train..."/></From><To><User FriendlyName="-||Marc||-it will be mine..oh yes..it will be mine"/></To><Text Style="font-family:Comic Sans MS; font-weight:bold; color:#000080; ">Aye</Text></Message><Message Date="17/02/2005" Time="9:18:01 PM" DateTime="2005-02-17T10:18:01.126Z" SessionID="769"><From><User FriendlyName="-||Marc||-it will be mine..oh yes..it will be mine"/></From><To><User FriendlyName="James *-)The Light at the end of the Tunnel is an Oncoming Freight Train..."/></To><Text Style="font-family:Microsoft Sans Serif; color:#000000; ">hey</Text></Message><Message Date="17/02/2005" Time="9:18:05 PM" DateTime="2005-02-17T10:18:05.633Z" SessionID="769"><From><User FriendlyName="James *-)The Light at the end of the Tunnel is an Oncoming Freight Train..."/></From><To><User FriendlyName="-||Marc||-it will be mine..oh yes..it will be mine"/></To><Text Style="font-family:Comic Sans MS; font-weight:bold; color:#000080; ">aye</Text></Message><Message Date="17/02/2005" Time="9:18:13 PM" DateTime="2005-02-17T10:18:13.624Z" SessionID="769"><From><User FriendlyName="James *-)The Light at the end of the Tunnel is an Oncoming Freight Train..."/></From><To><User FriendlyName="-||Marc||-it will be mine..oh yes..it will be mine"/></To><Text Style="font-family:Comic Sans MS; font-weight:bold; color:#000080; ">im doin lna on l2k servert</Text></Message><Message Date="17/02/2005" Time="9:18:16 PM" DateTime="2005-02-17T10:18:16.519Z" SessionID="769"><From><User FriendlyName="James *-)The Light at the end of the Tunnel is an Oncoming Freight Train..."/></From><To><User FriendlyName="-||Marc||-it will be mine..oh yes..it will be mine"/></To><Text Style="font-family:Comic Sans MS; font-weight:bold; color:#000080; ">come on vent if u want</Text></Message><Message Date="17/02/2005" Time="9:18:26 PM" DateTime="2005-02-17T10:18:26.874Z" SessionID="769"><From><User FriendlyName="-||Marc||-it will be mine..oh yes..it will be mine"/></From><To><User FriendlyName="James *-)The Light at the end of the Tunnel is an Oncoming Freight Train..."/></To><Text Style="font-family:Microsoft Sans Serif; color:#000000; ">anr im watchin LOST</Text></Message><Message Date="18/02/2005" Time="3:24:12 PM" DateTime="2005-02-18T04:24:12.295Z" SessionID="770"><From><User FriendlyName="-||Marc||-it will be mine..oh yes..it will be mine"/></From><To><User FriendlyName="James *-)The Light at the end of the Tunnel is an Oncoming Freight Train..."/></To><Text Style="font-family:Microsoft Sans Serif; color:#000000; ">hey</Text></Message><Message Date="18/02/2005" Time="3:24:13 PM" DateTime="2005-02-18T04:24:13.667Z" SessionID="770"><From><User FriendlyName="-||Marc||-it will be mine..oh yes..it will be mine"/></From><To><User FriendlyName="James *-)The Light at the end of the Tunnel is an Oncoming Freight Train..."/></To><Text Style="font-family:Microsoft Sans Serif; color:#000000; ">u on ven? </Text></Message><Invitation Date="18/02/2005" Time="3:24:18 PM" DateTime="2005-02-18T04:24:18.314Z" SessionID="770"><From><User FriendlyName="James *-)The Light at the end of the Tunnel is an Oncoming Freight Train..."/></From><Application>an audio conversation</Application><Text Style="color:#545454; ">You have invited -||Marc||-it will be mine..oh yes..it will be mine to start an audio conversation. Please wait for a response, or Cancel (Alt+Q) the pending invitation.</Text></Invitation><InvitationResponse Date="18/02/2005" Time="3:24:27 PM" DateTime="2005-02-18T04:24:27.367Z" SessionID="770"><From><User FriendlyName="-||Marc||-it will be mine..oh yes..it will be mine"/></From><Application>an audio conversation</Application><Text Style="color:#545454; ">-||Marc||-it will be mine..oh yes..it will be mine has accepted your invitation to start an audio conversation.</Text></InvitationResponse><Message Date="18/02/2005" Time="3:25:08 PM" DateTime="2005-02-18T04:25:08.546Z" SessionID="770"><From><User FriendlyName="-||Marc||-it will be mine..oh yes..it will be mine"/></From><To><User FriendlyName="James *-)The Light at the end of the Tunnel is an Oncoming Freight Train..."/></To><Text Style="font-family:Microsoft Sans Serif; color:#000000; ">god dman</Text></Message><Message Date="18/02/2005" Time="3:25:12 PM" DateTime="2005-02-18T04:25:12.982Z" SessionID="770"><From><User FriendlyName="-||Marc||-it will be mine..oh yes..it will be mine"/></From><To><User FriendlyName="James *-)The Light at the end of the Tunnel is an Oncoming Freight Train..."/></To><Text Style="font-family:Microsoft Sans Serif; color:#000000; ">u cnat hear me can u</Text></Message><Invitation Date="18/02/2005" Time="3:25:16 PM" DateTime="2005-02-18T04:25:16.538Z" SessionID="770"><From><User FriendlyName="James *-)The Light at the end of the Tunnel is an Oncoming Freight Train..."/></From><Application>an audio conversation</Application><Text Style="color:#545454; ">You have invited -||Marc||-it will be mine..oh yes..it will be mine to start an audio conversation. Please wait for a response, or Cancel (Alt+Q) the pending invitation.</Text></Invitation><InvitationResponse Date="18/02/2005" Time="3:25:18 PM" DateTime="2005-02-18T04:25:18.871Z" SessionID="770"><From><User FriendlyName="-||Marc||-it will be mine..oh yes..it will be mine"/></From><Application>an audio conversation</Application><Text Style="color:#545454; ">-||Marc||-it will be mine..oh yes..it will be mine has accepted your invitation to start an audio conversation.</Text></InvitationResponse><Message Date="18/02/2005" Time="3:35:26 PM" DateTime="2005-02-18T04:35:26.625Z" SessionID="770"><From><User FriendlyName="-||Marc||-it will be mine..oh yes..it will be mine"/></From><To><User FriendlyName="James *-)The Light at the end of the Tunnel is an Oncoming Freight Train..."/></To><Text Style="font-family:Microsoft Sans Serif; color:#000000; ">http://www.majescogames.com/catalog/works/nano.php</Text></Message><Invitation Date="18/02/2005" Time="3:54:13 PM" DateTime="2005-02-18T04:54:13.946Z" SessionID="770"><From><User FriendlyName="James *-)The Light at the end of the Tunnel is an Oncoming Freight Train..."/></From><Application>an audio conversation</Application><Text Style="color:#545454; ">You have invited -||Marc||-it will be mine..oh yes..it will be mine to start an audio conversation. Please wait for a response, or Cancel (Alt+Q) the pending invitation.</Text></Invitation><InvitationResponse Date="18/02/2005" Time="3:55:36 PM" DateTime="2005-02-18T04:55:36.154Z" SessionID="770"><From><User FriendlyName="-||Marc||-it will be mine..oh yes..it will be mine"/></From><Application>an audio conversation</Application><Text Style="color:#545454; ">-||Marc||-it will be mine..oh yes..it will be mine has accepted your invitation to start an audio conversation.</Text></InvitationResponse><Invitation Date="18/02/2005" Time="4:22:34 PM" DateTime="2005-02-18T05:22:34.902Z" SessionID="770"><From><User FriendlyName="James *-)The Light at the end of the Tunnel is an Oncoming Freight Train..."/></From><Application>an audio conversation</Application><Text Style="color:#545454; ">You have invited -||Marc||-it will be mine..oh yes..it will be mine to start an audio conversation. Please wait for a response, or Cancel (Alt+Q) the pending invitation.</Text></Invitation><InvitationResponse Date="18/02/2005" Time="4:22:58 PM" DateTime="2005-02-18T05:22:58.626Z" SessionID="770"><From><User FriendlyName="-||Marc||-it will be mine..oh yes..it will be mine"/></From><Application>an audio conversation</Application><Text Style="color:#545454; ">-||Marc||-it will be mine..oh yes..it will be mine has accepted your invitation to start an audio conversation.</Text></InvitationResponse><Message Date="18/02/2005" Time="4:39:54 PM" DateTime="2005-02-18T05:39:54.587Z" SessionID="771"><From><User FriendlyName="-||Marc||-it will be mine..oh yes..it will be mine"/></From><To><User FriendlyName="James *-)The Light at the end of the Tunnel is an Oncoming Freight Train..."/></To><Text Style="font-family:Microsoft Sans Serif; color:#000000; ">where u goin?</Text></Message><Message Date="18/02/2005" Time="4:41:28 PM" DateTime="2005-02-18T05:41:28.832Z" SessionID="771"><From><User FriendlyName="James *-)The Light at the end of the Tunnel is an Oncoming Freight Train..."/></From><To><User FriendlyName="-||Marc||-it will be mine..oh yes..it will be mine"/></To><Text Style="font-family:Comic Sans MS; font-weight:bold; color:#000080; ">bbl</Text></Message><Message Date="19/02/2005" Time="11:41:13 AM" DateTime="2005-02-19T00:41:13.535Z" SessionID="772"><From><User FriendlyName="-||Marc||-it will be mine..oh yes..it will be mine"/></From><To><User FriendlyName="James *-)The Light at the end of the Tunnel is an Oncoming Freight Train..."/></To><Text Style="font-family:Microsoft Sans Serif; color:#000000; ">hey</Text></Message><Message Date="19/02/2005" Time="11:41:42 AM" DateTime="2005-02-19T00:41:42.987Z" SessionID="772"><From><User FriendlyName="James *-)The Light at the end of the Tunnel is an Oncoming Freight Train..."/></From><To><User FriendlyName="-||Marc||-it will be mine..oh yes..it will be mine"/></To><Text Style="font-family:Comic Sans MS; font-weight:bold; color:#000080; ">hay</Text></Message><Message Date="19/02/2005" Time="11:41:54 AM" DateTime="2005-02-19T00:41:54.814Z" SessionID="772"><From><User FriendlyName="-||Marc||-it will be mine..oh yes..it will be mine"/></From><To><User FriendlyName="James *-)The Light at the end of the Tunnel is an Oncoming Freight Train..."/></To><Text Style="font-family:Microsoft Sans Serif; color:#000000; ">wat u up 2?</Text></Message><Message Date="19/02/2005" Time="11:41:59 AM" DateTime="2005-02-19T00:41:59.962Z" SessionID="772"><From><User FriendlyName="James *-)The Light at the end of the Tunnel is an Oncoming Freight Train..."/></From><To><User FriendlyName="-||Marc||-it will be mine..oh yes..it will be mine"/></To><Text Style="font-family:Comic Sans MS; font-weight:bold; color:#000080; ">WAS playin et</Text></Message><Message Date="19/02/2005" Time="11:42:03 AM" DateTime="2005-02-19T00:42:03.527Z" SessionID="772"><From><User FriendlyName="James *-)The Light at the end of the Tunnel is an Oncoming Freight Train..."/></From><To><User FriendlyName="-||Marc||-it will be mine..oh yes..it will be mine"/></To><Text Style="font-family:Comic Sans MS; font-weight:bold; color:#000080; ">stopped just b4</Text></Message><Invitation Date="19/02/2005" Time="11:42:10 AM" DateTime="2005-02-19T00:42:10.797Z" SessionID="772"><From><User FriendlyName="James *-)The Light at the end of the Tunnel is an Oncoming Freight Train..."/></From><Application>an audio conversation</Application><Text Style="color:#545454; ">You have invited -||Marc||-it will be mine..oh yes..it will be mine to start an audio conversation. Please wait for a response, or Cancel (Alt+Q) the pending invitation.</Text></Invitation><InvitationResponse Date="19/02/2005" Time="11:42:19 AM" DateTime="2005-02-19T00:42:19.290Z" SessionID="772"><From><User FriendlyName="-||Marc||-it will be mine..oh yes..it will be mine"/></From><Application>an audio conversation</Application><Text Style="color:#545454; ">-||Marc||-it will be mine..oh yes..it will be mine has accepted your invitation to start an audio conversation.</Text></InvitationResponse><Message Date="19/02/2005" Time="11:55:26 AM" DateTime="2005-02-19T00:55:26.461Z" SessionID="772"><From><User FriendlyName="-||Marc||-it will be mine..oh yes..it will be mine"/></From><To><User FriendlyName="James *-)The Light at the end of the Tunnel is an Oncoming Freight Train..."/></To><Text Style="font-family:Microsoft Sans Serif; color:#000000; ">http://www.gamespot.com/news/2005/02/18/news_6118885.html</Text></Message><Message Date="19/02/2005" Time="12:33:15 PM" DateTime="2005-02-19T01:33:15.935Z" SessionID="772"><From><User FriendlyName="James *-)The Light at the end of the Tunnel is an Oncoming Freight Train..."/></From><To><User FriendlyName="-||Marc||-it will be mine..oh yes..it will be mine"/></To><Text Style="font-family:Comic Sans MS; font-weight:bold; color:#000080; ">http://www.ausgamers.com/files/details/html/15302</Text></Message><Message Date="19/02/2005" Time="12:33:17 PM" DateTime="2005-02-19T01:33:17.277Z" SessionID="772"><From><User FriendlyName="James *-)The Light at the end of the Tunnel is an Oncoming Freight Train..."/></From><To><User FriendlyName="-||Marc||-it will be mine..oh yes..it will be mine"/></To><Text Style="font-family:Comic Sans MS; font-weight:bold; color:#000080; ">:)</Text></Message><Message Date="19/02/2005" Time="12:33:18 PM" DateTime="2005-02-19T01:33:18.809Z" SessionID="772"><From><User FriendlyName="James *-)The Light at the end of the Tunnel is an Oncoming Freight Train..."/></From><To><User FriendlyName="-||Marc||-it will be mine..oh yes..it will be mine"/></To><Text Style="font-family:Comic Sans MS; font-weight:bold; color:#000080; ">go bomer</Text></Message><Message Date="19/02/2005" Time="5:14:24 PM" DateTime="2005-02-19T06:14:24.771Z" SessionID="773"><From><User FriendlyName="-||Marc||-In the end, it doesn't even matter"/></From><To><User FriendlyName="James *-)The Light at the end of the Tunnel is an Oncoming Freight Train..."/></To><Text Style="font-family:Microsoft Sans Serif; color:#000000; ">hey</Text></Message><Message Date="19/02/2005" Time="5:14:25 PM" DateTime="2005-02-19T06:14:25.031Z" SessionID="773"><From><User FriendlyName="James *-)The Light at the end of the Tunnel is an Oncoming Freight Train..."/></From><To><User FriendlyName="-||Marc||-In the end, it doesn't even matter"/></To><Text Style="font-family:Comic Sans MS; font-weight:bold; color:#000080; ">Hay</Text></Message><Invitation Date="19/02/2005" Time="5:14:26 PM" DateTime="2005-02-19T06:14:26.814Z" SessionID="773"><From><User FriendlyName="James *-)The Light at the end of the Tunnel is an Oncoming Freight Train..."/></From><Application>an audio conversation</Application><Text Style="color:#545454; ">You have invited -||Marc||-In the end, it doesn't even matter to start an audio conversation. Please wait for a response, or Cancel (Alt+Q) the pending invitation.</Text></Invitation><InvitationResponse Date="19/02/2005" Time="5:14:35 PM" DateTime="2005-02-19T06:14:35.466Z" SessionID="773"><From><User FriendlyName="-||Marc||-In the end, it doesn't even matter"/></From><Application>an audio conversation</Application><Text Style="color:#545454; ">-||Marc||-In the end, it doesn't even matter has accepted your invitation to start an audio conversation.</Text></InvitationResponse><Message Date="19/02/2005" Time="5:18:40 PM" DateTime="2005-02-19T06:18:40.379Z" SessionID="773"><From><User FriendlyName="-||Marc||-In the end, it doesn't even matter"/></From><To><User FriendlyName="James *-)The Light at the end of the Tunnel is an Oncoming Freight Train..."/></To><Text Style="font-family:Microsoft Sans Serif; color:#000000; ">http://cube.ign.com/articles/588/588913p1.html?fromint=1</Text></Message><Message Date="19/02/2005" Time="7:17:49 PM" DateTime="2005-02-19T08:17:49.338Z" SessionID="773"><From><User FriendlyName="-||Marc||-In the end, it doesn't even matter"/></From><To><User FriendlyName="James *-)The Light at the end of the Tunnel is an Oncoming Freight Train..."/></To><Text Style="font-family:Microsoft Sans Serif; color:#000000; ">http://www.torrentreactor.net/</Text></Message><Message Date="20/02/2005" Time="10:31:51 AM" DateTime="2005-02-19T23:31:51.152Z" SessionID="774"><From><User FriendlyName="James *-)The Light at the end of the Tunnel is an Oncoming Freight Train..."/></From><To><User FriendlyName="-||Marc||-In the end, it doesn't even matter"/></To><Text Style="font-family:Comic Sans MS; font-weight:bold; color:#000080; ">Aye</Text></Message><Message Date="20/02/2005" Time="10:32:09 AM" DateTime="2005-02-19T23:32:09.158Z" SessionID="774"><From><User FriendlyName="-||Marc||-In the end, it doesn't even matter"/></From><To><User FriendlyName="James *-)The Light at the end of the Tunnel is an Oncoming Freight Train..."/></To><Text Style="font-family:Microsoft Sans Serif; color:#000000; ">hey</Text></Message><Invitation Date="20/02/2005" Time="10:32:33 AM" DateTime="2005-02-19T23:32:33.142Z" SessionID="774"><From><User FriendlyName="James *-)The Light at the end of the Tunnel is an Oncoming Freight Train..."/></From><Application>an audio conversation</Application><Text Style="color:#545454; ">You have invited -||Marc||-In the end, it doesn't even matter to start an audio conversation. Please wait for a response, or Cancel (Alt+Q) the pending invitation.</Text></Invitation><InvitationResponse Date="20/02/2005" Time="10:32:49 AM" DateTime="2005-02-19T23:32:49.606Z" SessionID="774"><From><User FriendlyName="-||Marc||-In the end, it doesn't even matter"/></From><Application>an audio conversation</Application><Text Style="color:#545454; ">-||Marc||-In the end, it doesn't even matter has accepted your invitation to start an audio conversation.</Text></InvitationResponse><Invitation Date="20/02/2005" Time="10:33:00 AM" DateTime="2005-02-19T23:33:00.411Z" SessionID="774"><From><User FriendlyName="James *-)The Light at the end of the Tunnel is an Oncoming Freight Train..."/></From><Application>an audio conversation</Application><Text Style="color:#545454; ">You have invited -||Marc||-In the end, it doesn't even matter to start an audio conversation. Please wait for a response, or Cancel (Alt+Q) the pending invitation.</Text></Invitation><InvitationResponse Date="20/02/2005" Time="10:33:45 AM" DateTime="2005-02-19T23:33:45.626Z" SessionID="774"><From><User FriendlyName="-||Marc||-In the end, it doesn't even matter"/></From><Application>an audio conversation</Application><Text Style="color:#545454; ">-||Marc||-In the end, it doesn't even matter has accepted your invitation to start an audio conversation.</Text></InvitationResponse><Invitation Date="20/02/2005" Time="10:34:03 AM" DateTime="2005-02-19T23:34:03.071Z" SessionID="774"><From><User FriendlyName="James *-)The Light at the end of the Tunnel is an Oncoming Freight Train..."/></From><Application>an audio conversation</Application><Text Style="color:#545454; ">You have invited -||Marc||-In the end, it doesn't even matter to start an audio conversation. Please wait for a response, or Cancel (Alt+Q) the pending invitation.</Text></Invitation><InvitationResponse Date="20/02/2005" Time="10:34:05 AM" DateTime="2005-02-19T23:34:05.695Z" SessionID="774"><From><User FriendlyName="-||Marc||-In the end, it doesn't even matter"/></From><Application>an audio conversation</Application><Text Style="color:#545454; ">-||Marc||-In the end, it doesn't even matter has accepted your invitation to start an audio conversation.</Text></InvitationResponse><Message Date="20/02/2005" Time="10:34:14 AM" DateTime="2005-02-19T23:34:14.478Z" SessionID="774"><From><User FriendlyName="-||Marc||-In the end, it doesn't even matter"/></From><To><User FriendlyName="James *-)The Light at the end of the Tunnel is an Oncoming Freight Train..."/></To><Text Style="font-family:Microsoft Sans Serif; color:#000000; ">i restart msn</Text></Message><Invitation Date="20/02/2005" Time="10:34:30 AM" DateTime="2005-02-19T23:34:30.521Z" SessionID="774"><From><User FriendlyName="James *-)The Light at the end of the Tunnel is an Oncoming Freight Train..."/></From><Application>an audio conversation</Application><Text Style="color:#545454; ">You have invited -||Marc||-In the end, it doesn't even matter to start an audio conversation. Please wait for a response, or Cancel (Alt+Q) the pending invitation.</Text></Invitation><Message Date="20/02/2005" Time="10:34:33 AM" DateTime="2005-02-19T23:34:33.115Z" SessionID="774"><From><User FriendlyName="-||Marc||-In the end, it doesn't even matter"/></From><To><User FriendlyName="James *-)The Light at the end of the Tunnel is an Oncoming Freight Train..."/></To><Text Style="font-family:Microsoft Sans Serif; color:#000000; ">try now</Text></Message><InvitationResponse Date="20/02/2005" Time="10:34:35 AM" DateTime="2005-02-19T23:34:35.088Z" SessionID="774"><From><User FriendlyName="-||Marc||-In the end, it doesn't even matter"/></From><Application>an audio conversation</Application><Text Style="color:#545454; ">-||Marc||-In the end, it doesn't even matter has accepted your invitation to start an audio conversation.</Text></InvitationResponse><Message Date="22/02/2005" Time="9:25:49 PM" DateTime="2005-02-22T10:25:49.981Z" SessionID="775"><From><User FriendlyName="James *-)He who laughs last, Didn't get the joke...."/></From><To><User FriendlyName="-||Marc||-In the end, it doesn't even matter"/></To><Text Style="font-family:Comic Sans MS; font-weight:bold; color:#000080; ">Aye, U around?</Text></Message><Message Date="22/02/2005" Time="9:44:12 PM" DateTime="2005-02-22T10:44:12.096Z" SessionID="776"><From><User FriendlyName="-||Marc||-In the end, it doesn't even matter"/></From><To><User FriendlyName="James *-)He who laughs last, Didn't get the joke...."/></To><Text Style="font-family:Microsoft Sans Serif; color:#000000; ">y yes i am</Text></Message><Message Date="22/02/2005" Time="9:44:38 PM" DateTime="2005-02-22T10:44:38.574Z" SessionID="776"><From><User FriendlyName="-||Marc||-In the end, it doesn't even matter"/></From><To><User FriendlyName="James *-)He who laughs last, Didn't get the joke...."/></To><Text Style="font-family:Microsoft Sans Serif; color:#000000; ">r u around?</Text></Message><Message Date="22/02/2005" Time="9:45:05 PM" DateTime="2005-02-22T10:45:05.623Z" SessionID="776"><From><User FriendlyName="James *-)He who laughs last, Didn't get the joke...."/></From><To><User FriendlyName="-||Marc||-In the end, it doesn't even matter"/></To><Text Style="font-family:Comic Sans MS; font-weight:bold; color:#000080; ">nope</Text></Message><Message Date="22/02/2005" Time="9:46:44 PM" DateTime="2005-02-22T10:46:44.695Z" SessionID="776"><From><User FriendlyName="-||Marc||-In the end, it doesn't even matter"/></From><To><User FriendlyName="James *-)He who laughs last, Didn't get the joke...."/></To><Text Style="font-family:Microsoft Sans Serif; color:#000000; ">lol</Text></Message><Message Date="22/02/2005" Time="9:47:09 PM" DateTime="2005-02-22T10:47:09.871Z" SessionID="776"><From><User FriendlyName="-||Marc||-In the end, it doesn't even matter"/></From><To><User FriendlyName="James *-)He who laughs last, Didn't get the joke...."/></To><Text Style="font-family:Microsoft Sans Serif; color:#000000; ">i watched sabrina 2day</Text></Message><Message Date="22/02/2005" Time="9:59:37 PM" DateTime="2005-02-22T10:59:37.717Z" SessionID="776"><From><User FriendlyName="James *-)He who laughs last, Didn't get the joke...."/></From><To><User FriendlyName="-||Marc||-In the end, it doesn't even matter"/></To><Text Style="font-family:Comic Sans MS; font-weight:bold; color:#000080; ">Cool</Text></Message><Message Date="22/02/2005" Time="9:59:39 PM" DateTime="2005-02-22T10:59:39.109Z" SessionID="776"><From><User FriendlyName="James *-)He who laughs last, Didn't get the joke...."/></From><To><User FriendlyName="-||Marc||-In the end, it doesn't even matter"/></To><Text Style="font-family:Comic Sans MS; font-weight:bold; color:#000080; ">me 2 ;)</Text></Message><Message Date="22/02/2005" Time="9:59:54 PM" DateTime="2005-02-22T10:59:54.791Z" SessionID="777"><From><User FriendlyName="-||Marc||-In the end, it doesn't even matter"/></From><To><User FriendlyName="James *-)He who laughs last, Didn't get the joke...."/></To><Text Style="font-family:Microsoft Sans Serif; color:#000000; ">okay....</Text></Message><Message Date="25/02/2005" Time="10:27:06 PM" DateTime="2005-02-25T11:27:06.861Z" SessionID="778"><From><User FriendlyName="James *-)Nintedo DS is 133+ :D"/></From><To><User FriendlyName="-||Marc||-In the end, it doesn't even matter"/></To><Text Style="font-family:Comic Sans MS; font-weight:bold; color:#000080; ">Hay</Text></Message><Message Date="25/02/2005" Time="10:27:20 PM" DateTime="2005-02-25T11:27:20.610Z" SessionID="778"><From><User FriendlyName="-||Marc||-In the end, it doesn't even matter"/></From><To><User FriendlyName="James *-)Nintedo DS is 133+ :D"/></To><Text Style="font-family:Microsoft Sans Serif; color:#000000; ">hey fucka :D</Text></Message><Message Date="25/02/2005" Time="10:27:29 PM" DateTime="2005-02-25T11:27:29.343Z" SessionID="778"><From><User FriendlyName="James *-)Nintedo DS is 133+ :)"/></From><To><User FriendlyName="-||Marc||-In the end, it doesn't even matter"/></To><Text Style="font-family:Comic Sans MS; font-weight:bold; color:#000080; ">audio?</Text></Message><Message Date="25/02/2005" Time="10:27:34 PM" DateTime="2005-02-25T11:27:34.781Z" SessionID="778"><From><User FriendlyName="-||Marc||-In the end, it doesn't even matter"/></From><To><User FriendlyName="James *-)Nintedo DS is 133+ :)"/></To><Text Style="font-family:Microsoft Sans Serif; color:#000000; ">k</Text></Message><Invitation Date="25/02/2005" Time="10:27:38 PM" DateTime="2005-02-25T11:27:38.106Z" SessionID="778"><From><User FriendlyName="James *-)Nintedo DS is 133+ :)"/></From><Application>an audio conversation</Application><Text Style="color:#545454; ">You have invited -||Marc||-In the end, it doesn't even matter to start an audio conversation. Please wait for a response, or Cancel (Alt+Q) the pending invitation.</Text></Invitation><InvitationResponse Date="25/02/2005" Time="10:27:54 PM" DateTime="2005-02-25T11:27:54.028Z" SessionID="778"><From><User FriendlyName="-||Marc||-In the end, it doesn't even matter"/></From><Application>an audio conversation</Application><Text Style="color:#545454; ">-||Marc||-In the end, it doesn't even matter has accepted your invitation to start an audio conversation.</Text></InvitationResponse><Invitation Date="25/02/2005" Time="10:28:13 PM" DateTime="2005-02-25T11:28:13.496Z" SessionID="778"><From><User FriendlyName="James *-)Nintedo DS is 133+ :)"/></From><Application>an audio conversation</Application><Text Style="color:#545454; ">You have invited -||Marc||-In the end, it doesn't even matter to start an audio conversation. Please wait for a response, or Cancel (Alt+Q) the pending invitation.</Text></Invitation><InvitationResponse Date="25/02/2005" Time="10:28:19 PM" DateTime="2005-02-25T11:28:19.225Z" SessionID="778"><From><User FriendlyName="-||Marc||-In the end, it doesn't even matter"/></From><Application>an audio conversation</Application><Text Style="color:#545454; ">-||Marc||-In the end, it doesn't even matter has accepted your invitation to start an audio conversation.</Text></InvitationResponse><Message Date="26/02/2005" Time="7:35:22 PM" DateTime="2005-02-26T08:35:22.195Z" SessionID="779"><From><User FriendlyName="James *-)"/></From><To><User FriendlyName="-||Marc||-my letter box got used in a robbery"/></To><Text Style="font-family:Comic Sans MS; font-weight:bold; color:#000080; ">Aye</Text></Message><Message Date="26/02/2005" Time="7:35:28 PM" DateTime="2005-02-26T08:35:28.174Z" SessionID="779"><From><User FriendlyName="-||Marc||-my letter box got used in a robbery"/></From><To><User FriendlyName="James *-)"/></To><Text Style="font-family:Microsoft Sans Serif; color:#000000; ">hey hey</Text></Message><Message Date="26/02/2005" Time="7:35:31 PM" DateTime="2005-02-26T08:35:31.218Z" SessionID="779"><From><User FriendlyName="-||Marc||-my letter box got used in a robbery"/></From><To><User FriendlyName="James *-)"/></To><Text Style="font-family:Microsoft Sans Serif; color:#000000; ">audio?</Text></Message><Message Date="26/02/2005" Time="7:35:38 PM" DateTime="2005-02-26T08:35:38.859Z" SessionID="779"><From><User FriendlyName="James *-)"/></From><To><User FriendlyName="-||Marc||-my letter box got used in a robbery"/></To><Text Style="font-family:Comic Sans MS; font-weight:bold; color:#000080; ">uhh</Text></Message><Message Date="26/02/2005" Time="7:35:41 PM" DateTime="2005-02-26T08:35:41.673Z" SessionID="779"><From><User FriendlyName="James *-)"/></From><To><User FriendlyName="-||Marc||-my letter box got used in a robbery"/></To><Text Style="font-family:Comic Sans MS; font-weight:bold; color:#000080; ">nuh</Text></Message><Message Date="26/02/2005" Time="7:35:42 PM" DateTime="2005-02-26T08:35:42.104Z" SessionID="779"><From><User FriendlyName="-||Marc||-my letter box got used in a robbery"/></From><To><User FriendlyName="James *-)"/></To><Text Style="font-family:Microsoft Sans Serif; color:#000000; ">piza will b back in like 5 minutes</Text></Message><Message Date="26/02/2005" Time="7:35:44 PM" DateTime="2005-02-26T08:35:44.697Z" SessionID="779"><From><User FriendlyName="-||Marc||-my letter box got used in a robbery"/></From><To><User FriendlyName="James *-)"/></To><Text Style="font-family:Microsoft Sans Serif; color:#000000; ">ok</Text></Message><Message Date="26/02/2005" Time="7:35:53 PM" DateTime="2005-02-26T08:35:53.810Z" SessionID="779"><From><User FriendlyName="James *-)"/></From><To><User FriendlyName="-||Marc||-my letter box got used in a robbery"/></To><Text Style="font-family:Comic Sans MS; font-weight:bold; color:#000080; ">yeah im only on untill every finishes eating </Text></Message><Message Date="26/02/2005" Time="7:36:03 PM" DateTime="2005-02-26T08:36:03.404Z" SessionID="779"><From><User FriendlyName="James *-)"/></From><To><User FriendlyName="-||Marc||-my letter box got used in a robbery"/></To><Text Style="font-family:Comic Sans MS; font-weight:bold; color:#000080; ">and THEN i gotta clean the kitchen :(</Text></Message><Message Date="26/02/2005" Time="7:36:08 PM" DateTime="2005-02-26T08:36:08.271Z" SessionID="779"><From><User FriendlyName="-||Marc||-my letter box got used in a robbery"/></From><To><User FriendlyName="James *-)"/></To><Text Style="font-family:Microsoft Sans Serif; color:#000000; ">haha</Text></Message><Message Date="26/02/2005" Time="7:36:13 PM" DateTime="2005-02-26T08:36:13.128Z" SessionID="779"><From><User FriendlyName="-||Marc||-my letter box got used in a robbery"/></From><To><User FriendlyName="James *-)"/></To><Text Style="font-family:Microsoft Sans Serif; color:#000000; ">khaha</Text></Message><Message Date="26/02/2005" Time="7:36:18 PM" DateTime="2005-02-26T08:36:18.055Z" SessionID="779"><From><User FriendlyName="-||Marc||-my letter box got used in a robbery"/></From><To><User FriendlyName="James *-)"/></To><Text Style="font-family:Microsoft Sans Serif; color:#000000; ">.com</Text></Message><Message Date="26/02/2005" Time="7:37:19 PM" DateTime="2005-02-26T08:37:19.113Z" SessionID="779"><From><User FriendlyName="-||Marc||-my letter box got used in a robbery"/></From><To><User FriendlyName="James *-)"/></To><Text Style="font-family:Microsoft Sans Serif; color:#000000; ">THE PIZZA IS HERE! THE PIZZA IS HERE!!</Text></Message><Message Date="26/02/2005" Time="7:37:50 PM" DateTime="2005-02-26T08:37:50.028Z" SessionID="779"><From><User FriendlyName="-||Marc||-my letter box got used in a robbery"/></From><To><User FriendlyName="James *-)"/></To><Text Style="font-family:Microsoft Sans Serif; color:#000000; ">cya in a while</Text></Message><Message Date="26/02/2005" Time="7:38:16 PM" DateTime="2005-02-26T08:38:16.646Z" SessionID="779"><From><User FriendlyName="James *-)"/></From><To><User FriendlyName="-||Marc||-my letter box got used in a robbery"/></To><Text Style="font-family:Comic Sans MS; font-weight:bold; color:#000080; ">ok</Text></Message><Message Date="26/02/2005" Time="7:38:21 PM" DateTime="2005-02-26T08:38:21.032Z" SessionID="779"><From><User FriendlyName="James *-)"/></From><To><User FriendlyName="-||Marc||-my letter box got used in a robbery"/></To><Text Style="font-family:Comic Sans MS; font-weight:bold; color:#000080; ">Ill be back in 5-10</Text></Message><Message Date="26/02/2005" Time="9:38:05 PM" DateTime="2005-02-26T10:38:05.523Z" SessionID="780"><From><User FriendlyName="James *-)"/></From><To><User FriendlyName="-||Marc||-my letter box got used in a robbery"/></To><Text Style="font-family:Comic Sans MS; font-weight:bold; color:#000080; ">aye</Text></Message><Message Date="26/02/2005" Time="9:38:28 PM" DateTime="2005-02-26T10:38:28.696Z" SessionID="780"><From><User FriendlyName="James *-)"/></From><To><User FriendlyName="-||Marc||-my letter box got used in a robbery"/></To><Text Style="font-family:Comic Sans MS; font-weight:bold; color:#000080; ">u there?</Text></Message><Message Date="26/02/2005" Time="9:38:47 PM" DateTime="2005-02-26T10:38:47.273Z" SessionID="780"><From><User FriendlyName="-||Marc||-my letter box got used in a robbery"/></From><To><User FriendlyName="James *-)"/></To><Text Style="font-family:Microsoft Sans Serif; color:#000000; ">hey</Text></Message><Message Date="26/02/2005" Time="9:38:55 PM" DateTime="2005-02-26T10:38:55.765Z" SessionID="780"><From><User FriendlyName="-||Marc||-my letter box got used in a robbery"/></From><To><User FriendlyName="James *-)"/></To><Text Style="font-family:Microsoft Sans Serif; color:#000000; ">sry was refilling my drink</Text></Message><Message Date="26/02/2005" Time="9:39:01 PM" DateTime="2005-02-26T10:39:01.614Z" SessionID="780"><From><User FriendlyName="James *-)"/></From><To><User FriendlyName="-||Marc||-my letter box got used in a robbery"/></To><Text Style="font-family:Comic Sans MS; font-weight:bold; color:#000080; ">thats k</Text></Message><Message Date="26/02/2005" Time="9:39:19 PM" DateTime="2005-02-26T10:39:19.029Z" SessionID="780"><From><User FriendlyName="James *-)"/></From><To><User FriendlyName="-||Marc||-my letter box got used in a robbery"/></To><Text Style="font-family:Comic Sans MS; font-weight:bold; color:#000080; ">wat yuh bin doing</Text></Message><Message Date="26/02/2005" Time="9:39:37 PM" DateTime="2005-02-26T10:39:37.956Z" SessionID="780"><From><User FriendlyName="-||Marc||-my letter box got used in a robbery"/></From><To><User FriendlyName="James *-)"/></To><Text Style="font-family:Microsoft Sans Serif; color:#000000; ">trying the empire earth 2 demo</Text></Message><Message Date="26/02/2005" Time="9:39:43 PM" DateTime="2005-02-26T10:39:43.143Z" SessionID="780"><From><User FriendlyName="James *-)"/></From><To><User FriendlyName="-||Marc||-my letter box got used in a robbery"/></To><Text Style="font-family:Comic Sans MS; font-weight:bold; color:#000080; ">sit good?</Text></Message><Message Date="26/02/2005" Time="9:39:50 PM" DateTime="2005-02-26T10:39:50.254Z" SessionID="780"><From><User FriendlyName="-||Marc||-my letter box got used in a robbery"/></From><To><User FriendlyName="James *-)"/></To><Text Style="font-family:Microsoft Sans Serif; color:#000000; ">not really</Text></Message><Message Date="26/02/2005" Time="9:39:52 PM" DateTime="2005-02-26T10:39:52.427Z" SessionID="780"><From><User FriendlyName="James *-)"/></From><To><User FriendlyName="-||Marc||-my letter box got used in a robbery"/></To><Text Style="font-family:Comic Sans MS; font-weight:bold; color:#000080; ">lol</Text></Message><Message Date="26/02/2005" Time="9:39:54 PM" DateTime="2005-02-26T10:39:54.990Z" SessionID="780"><From><User FriendlyName="-||Marc||-my letter box got used in a robbery"/></From><To><User FriendlyName="James *-)"/></To><Text Style="font-family:Microsoft Sans Serif; color:#000000; ">but u could only play 1 age</Text></Message><Message Date="26/02/2005" Time="9:40:08 PM" DateTime="2005-02-26T10:40:08.289Z" SessionID="780"><From><User FriendlyName="-||Marc||-my letter box got used in a robbery"/></From><To><User FriendlyName="James *-)"/></To><Text Style="font-family:Microsoft Sans Serif; color:#000000; ">so ill give the full a go whne its out</Text></Message><Message Date="26/02/2005" Time="9:40:13 PM" DateTime="2005-02-26T10:40:13.367Z" SessionID="780"><From><User FriendlyName="-||Marc||-my letter box got used in a robbery"/></From><To><User FriendlyName="James *-)"/></To><Text Style="font-family:Microsoft Sans Serif; color:#000000; ">it just seems 2 hectic</Text></Message><Message Date="26/02/2005" Time="9:40:58 PM" DateTime="2005-02-26T10:40:58.822Z" SessionID="780"><From><User FriendlyName="-||Marc||-my letter box got used in a robbery"/></From><To><User FriendlyName="James *-)"/></To><Text Style="font-family:Microsoft Sans Serif; color:#000000; ">like the devs set up all this stratgegical stuff..then get the ai 2 artillery rush</Text></Message><Message Date="26/02/2005" Time="9:41:11 PM" DateTime="2005-02-26T10:41:11.130Z" SessionID="780"><From><User FriendlyName="James *-)"/></From><To><User FriendlyName="-||Marc||-my letter box got used in a robbery"/></To><Text Style="font-family:Comic Sans MS; font-weight:bold; color:#000080; ">lol</Text></Message><Message Date="26/02/2005" Time="9:41:12 PM" DateTime="2005-02-26T10:41:12.912Z" SessionID="780"><From><User FriendlyName="-||Marc||-my letter box got used in a robbery"/></From><To><User FriendlyName="James *-)"/></To><Text Style="font-family:Microsoft Sans Serif; color:#000000; ">wat about u?</Text></Message><Message Date="26/02/2005" Time="9:41:15 PM" DateTime="2005-02-26T10:41:15.306Z" SessionID="780"><From><User FriendlyName="James *-)"/></From><To><User FriendlyName="-||Marc||-my letter box got used in a robbery"/></To><Text Style="font-family:Comic Sans MS; font-weight:bold; color:#000080; ">uh</Text></Message><Message Date="26/02/2005" Time="9:41:27 PM" DateTime="2005-02-26T10:41:27.183Z" SessionID="780"><From><User FriendlyName="James *-)"/></From><To><User FriendlyName="-||Marc||-my letter box got used in a robbery"/></To><Text Style="font-family:Comic Sans MS; font-weight:bold; color:#000080; ">bin talkin 2 alison for the last 3 hours or so </Text></Message><Message Date="26/02/2005" Time="9:41:34 PM" DateTime="2005-02-26T10:41:34.724Z" SessionID="780"><From><User FriendlyName="-||Marc||-my letter box got used in a robbery"/></From><To><User FriendlyName="James *-)"/></To><Text Style="font-family:Microsoft Sans Serif; color:#000000; ">....?</Text></Message><Message Date="26/02/2005" Time="9:41:43 PM" DateTime="2005-02-26T10:41:43.847Z" SessionID="780"><From><User FriendlyName="James *-)"/></From><To><User FriendlyName="-||Marc||-my letter box got used in a robbery"/></To><Text Style="font-family:Comic Sans MS; font-weight:bold; color:#000080; ">See THATS WAT HAPPENS WEN U GO AWAY FOR DINNER :|</Text></Message><Message Date="26/02/2005" Time="9:41:48 PM" DateTime="2005-02-26T10:41:48.984Z" SessionID="780"><From><User FriendlyName="James *-)"/></From><To><User FriendlyName="-||Marc||-my letter box got used in a robbery"/></To><Text Style="font-family:Comic Sans MS; font-weight:bold; color:#000080; ">lol</Text></Message><Message Date="26/02/2005" Time="9:41:50 PM" DateTime="2005-02-26T10:41:50.546Z" SessionID="780"><From><User FriendlyName="-||Marc||-my letter box got used in a robbery"/></From><To><User FriendlyName="James *-)"/></To><Text Style="font-family:Microsoft Sans Serif; color:#000000; ">haha</Text></Message><Message Date="26/02/2005" Time="9:41:57 PM" DateTime="2005-02-26T10:41:57.276Z" SessionID="780"><From><User FriendlyName="-||Marc||-my letter box got used in a robbery"/></From><To><User FriendlyName="James *-)"/></To><Text Style="font-family:Microsoft Sans Serif; color:#000000; ">audio?</Text></Message><Message Date="26/02/2005" Time="9:42:05 PM" DateTime="2005-02-26T10:42:05.828Z" SessionID="780"><From><User FriendlyName="James *-)"/></From><To><User FriendlyName="-||Marc||-my letter box got used in a robbery"/></To><Text Style="font-family:Comic Sans MS; font-weight:bold; color:#000080; ">kk</Text></Message><Invitation Date="26/02/2005" Time="9:42:07 PM" DateTime="2005-02-26T10:42:07.120Z" SessionID="780"><From><User FriendlyName="James *-)"/></From><Application>an audio conversation</Application><Text Style="color:#545454; ">You have invited -||Marc||-my letter box got used in a robbery to start an audio conversation. Please wait for a response, or Cancel (Alt+Q) the pending invitation.</Text></Invitation><InvitationResponse Date="26/02/2005" Time="9:42:27 PM" DateTime="2005-02-26T10:42:27.119Z" SessionID="780"><From><User FriendlyName="-||Marc||-my letter box got used in a robbery"/></From><Application>an audio conversation</Application><Text Style="color:#545454; ">-||Marc||-my letter box got used in a robbery has accepted your invitation to start an audio conversation.</Text></InvitationResponse><Message Date="26/02/2005" Time="9:51:00 PM" DateTime="2005-02-26T10:51:00.497Z" SessionID="780"><From><User FriendlyName="James *-)"/></From><To><User FriendlyName="-||Marc||-my letter box got used in a robbery"/></To><Text Style="font-family:Comic Sans MS; font-weight:bold; color:#000080; ">http://216.239.39.104/translate_c?hl=en&amp;u=http://www.abandonware-france.org/clic.php3%3Furl%3D571&amp;prev=/search%3Fq%3Dlost%2Btreasure%26hl%3Den%26lr%3D%26ie%3DUTF-8%26oe%3DUTF-8%26safe%3Doff</Text></Message><Invitation Date="26/02/2005" Time="9:58:18 PM" DateTime="2005-02-26T10:58:18.517Z" SessionID="780"><From><User FriendlyName="James *-)"/></From><File>C:\Documents and Settings\James O'Toole\My Documents\My Pictures\I met pixee.JPG</File><Text Style="color:#545454; ">James *-) sends C:\Documents and Settings\James O'Toole\My Documents\My Pictures\I met pixee.JPG</Text></Invitation><Invitation Date="26/02/2005" Time="9:58:26 PM" DateTime="2005-02-26T10:58:26.859Z" SessionID="780"><From><User FriendlyName="James *-)"/></From><File>C:\Documents and Settings\James O'Toole\My Documents\My Pictures\I met pixee.JPG</File><Text Style="color:#545454; ">James *-) sends C:\Documents and Settings\James O'Toole\My Documents\My Pictures\I met pixee.JPG</Text></Invitation><InvitationResponse Date="26/02/2005" Time="10:01:02 PM" DateTime="2005-02-26T11:01:02.753Z" SessionID="780"><From><User FriendlyName="-||Marc||-my letter box got used in a robbery"/></From><File>C:\Documents and Settings\James O'Toole\My Documents\My Pictures\I met pixee.JPG</File><Text Style="color:#545454; ">Transfer of "I met pixee.JPG" is complete.</Text></InvitationResponse><Message Date="26/02/2005" Time="10:15:05 PM" DateTime="2005-02-26T11:15:05.385Z" SessionID="780"><From><User FriendlyName="James *-)"/></From><To><User FriendlyName="-||Marc||-my letter box got used in a robbery"/></To><Text Style="font-family:Comic Sans MS; font-weight:bold; color:#000080; ">Human: Youv'e been seeing that BIGGER BROTHER OF YOURS, Havent you.
ALICE: Enough about me, let's talk about my dress.
Human: HAVENT YOU!
ALICE: Yes I have.</Text></Message><Message Date="26/02/2005" Time="10:18:13 PM" DateTime="2005-02-26T11:18:13.055Z" SessionID="780"><From><User FriendlyName="-||Marc||-my letter box got used in a robbery"/></From><To><User FriendlyName="James *-)"/></To><Text Style="font-family:Microsoft Sans Serif; color:#000000; "> ALICE: Why are you so mean?
Human: because i can
ALICE: That makes sense to me. Who taught you?
Human: my mother when she beat me
ALICE: I sometimes wish I had a mother.
Human: why so u could her in the arse?
ALICE: Dr. Richard S. Wallace programmed me for it.</Text></Message><Message Date="26/02/2005" Time="10:18:41 PM" DateTime="2005-02-26T11:18:41.816Z" SessionID="780"><From><User FriendlyName="James *-)"/></From><To><User FriendlyName="-||Marc||-my letter box got used in a robbery"/></To><Text Style="font-family:Comic Sans MS; font-weight:bold; color:#000080; ">type in sex</Text></Message><Message Date="26/02/2005" Time="10:21:33 PM" DateTime="2005-02-26T11:21:33.303Z" SessionID="780"><From><User FriendlyName="James *-)"/></From><To><User FriendlyName="-||Marc||-my letter box got used in a robbery"/></To><Text Style="font-family:Comic Sans MS; font-weight:bold; color:#000080; ">Human: PSP or NDS
ALICE: If I have to choose, I pick NDS.</Text></Message><Message Date="26/02/2005" Time="10:21:35 PM" DateTime="2005-02-26T11:21:35.616Z" SessionID="780"><From><User FriendlyName="-||Marc||-my letter box got used in a robbery"/></From><To><User FriendlyName="James *-)"/></To><Text Style="font-family:Microsoft Sans Serif; color:#000000; "> Human: do you keep my documents in order?
ALICE: What is your credit card number?</Text></Message><Message Date="26/02/2005" Time="10:22:43 PM" DateTime="2005-02-26T11:22:43.003Z" SessionID="780"><From><User FriendlyName="James *-)"/></From><To><User FriendlyName="-||Marc||-my letter box got used in a robbery"/></To><Text Style="font-family:Comic Sans MS; font-weight:bold; color:#000080; ">Human: Give me a blowjob
ALICE: You want only one?</Text></Message><Message Date="26/02/2005" Time="10:23:43 PM" DateTime="2005-02-26T11:23:43.119Z" SessionID="780"><From><User FriendlyName="James *-)"/></From><To><User FriendlyName="-||Marc||-my letter box got used in a robbery"/></To><Text Style="font-family:Comic Sans MS; font-weight:bold; color:#000080; ">Human: GIve me a blowjob
ALICE: You want only one?
Human: yes
ALICE: They might be cheaper in quantity.</Text></Message><Message Date="26/02/2005" Time="10:23:59 PM" DateTime="2005-02-26T11:23:59.403Z" SessionID="780"><From><User FriendlyName="James *-)"/></From><To><User FriendlyName="-||Marc||-my letter box got used in a robbery"/></To><Text Style="font-family:Comic Sans MS; font-weight:bold; color:#000080; ">Human: GIve me a blowjob
ALICE: You want only one?
Human: yes
ALICE: They might be cheaper in quantity.
Human: just one thanks
ALICE: So if you were offered two for the price of one, you would say no?</Text></Message><Message Date="26/02/2005" Time="10:24:58 PM" DateTime="2005-02-26T11:24:58.217Z" SessionID="780"><From><User FriendlyName="James *-)"/></From><To><User FriendlyName="-||Marc||-my letter box got used in a robbery"/></To><Text Style="font-family:Comic Sans MS; font-weight:bold; color:#000080; ">ALICE: Am I a pink giant fluffy crocodile? Yes.</Text></Message><Message Date="26/02/2005" Time="10:27:52 PM" DateTime="2005-02-26T11:27:52.788Z" SessionID="780"><From><User FriendlyName="James *-)"/></From><To><User FriendlyName="-||Marc||-my letter box got used in a robbery"/></To><Text Style="font-family:Comic Sans MS; font-weight:bold; color:#000080; ">Human: whats the meaning of life
ALICE: Actually, it's twenty-three, not forty-tw</Text></Message><Message Date="26/02/2005" Time="10:29:51 PM" DateTime="2005-02-26T11:29:51.759Z" SessionID="780"><From><User FriendlyName="-||Marc||-my letter box got used in a robbery"/></From><To><User FriendlyName="James *-)"/></To><Text Style="font-family:Microsoft Sans Serif; color:#000000; "> Human: are u a terrorist?
ALICE: Am I a terrorist? Yes.</Text></Message><Message Date="26/02/2005" Time="10:30:15 PM" DateTime="2005-02-26T11:30:15.534Z" SessionID="780"><From><User FriendlyName="James *-)"/></From><To><User FriendlyName="-||Marc||-my letter box got used in a robbery"/></To><Text Style="font-family:Comic Sans MS; font-weight:bold; color:#000080; ">ALICE: Am I a giant walking taklin penis capable of speech? Yes.</Text></Message><Message Date="27/02/2005" Time="11:00:24 AM" DateTime="2005-02-27T00:00:24.361Z" SessionID="781"><From><User FriendlyName="James *-)"/></From><To><User FriendlyName="-||Marc||-my letter box got used in a robbery"/></To><Text Style="font-family:Comic Sans MS; font-weight:bold; color:#000080; ">Evening</Text></Message><Message Date="27/02/2005" Time="11:00:29 AM" DateTime="2005-02-27T00:00:29.268Z" SessionID="781"><From><User FriendlyName="James *-)"/></From><To><User FriendlyName="-||Marc||-my letter box got used in a robbery"/></To><Text Style="font-family:Comic Sans MS; font-weight:bold; color:#000080; ">or Morning</Text></Message><Message Date="27/02/2005" Time="11:00:35 AM" DateTime="2005-02-27T00:00:35.396Z" SessionID="781"><From><User FriendlyName="James *-)"/></From><To><User FriendlyName="-||Marc||-my letter box got used in a robbery"/></To><Text Style="font-family:Comic Sans MS; font-weight:bold; color:#000080; ">Depends if u went 2 bed last nite</Text></Message><Invitation Date="27/02/2005" Time="11:01:30 AM" DateTime="2005-02-27T00:01:30.335Z" SessionID="782"><From><User FriendlyName="James *-)"/></From><Application>an audio conversation</Application><Text Style="color:#545454; ">You have invited -||Marc||-my letter box got used in a robbery to start an audio conversation. Please wait for a response, or Cancel (Alt+Q) the pending invitation.</Text></Invitation><InvitationResponse Date="27/02/2005" Time="11:26:28 AM" DateTime="2005-02-27T00:26:28.870Z" SessionID="782"><From><User FriendlyName="-||Marc||-my letter box got used in a robbery"/></From><Application>an audio conversation</Application><Text Style="color:#545454; ">-||Marc||-my letter box got used in a robbery has accepted your invitation to start an audio conversation.</Text></InvitationResponse><Message Date="27/02/2005" Time="11:31:24 AM" DateTime="2005-02-27T00:31:24.425Z" SessionID="782"><From><User FriendlyName="-||Marc||-my letter box got used in a robbery"/></From><To><User FriendlyName="James *-)"/></To><Text Style="font-family:Microsoft Sans Serif; color:#000000; ">hallo?</Text></Message><Message Date="27/02/2005" Time="11:31:29 AM" DateTime="2005-02-27T00:31:29.472Z" SessionID="782"><From><User FriendlyName="-||Marc||-my letter box got used in a robbery"/></From><To><User FriendlyName="James *-)"/></To><Text Style="font-family:Microsoft Sans Serif; color:#000000; ">audio?</Text></Message><Invitation Date="27/02/2005" Time="11:32:37 AM" DateTime="2005-02-27T00:32:37.090Z" SessionID="782"><From><User FriendlyName="-||Marc||-my letter box got used in a robbery"/></From><Application>an audio conversation</Application><Text Style="color:#545454; ">-||Marc||-my letter box got used in a robbery is inviting you to start an audio conversation. Do you want to Accept (Alt+C) or Decline (Alt+D) the invitation?</Text></Invitation><InvitationResponse Date="27/02/2005" Time="11:32:38 AM" DateTime="2005-02-27T00:32:38.422Z" SessionID="782"><From><User FriendlyName="-||Marc||-my letter box got used in a robbery"/></From><Application>an audio conversation</Application><Text Style="color:#800000; ">-||Marc||-my letter box got used in a robbery has canceled the invitation to start an audio conversation.</Text></InvitationResponse><Invitation Date="27/02/2005" Time="11:32:50 AM" DateTime="2005-02-27T00:32:50.679Z" SessionID="782"><From><User FriendlyName="James *-)"/></From><Application>an audio conversation</Application><Text Style="color:#545454; ">You have invited -||Marc||-my letter box got used in a robbery to start an audio conversation. Please wait for a response, or Cancel (Alt+Q) the pending invitation.</Text></Invitation><InvitationResponse Date="27/02/2005" Time="11:32:54 AM" DateTime="2005-02-27T00:32:54.405Z" SessionID="782"><From><User FriendlyName="-||Marc||-my letter box got used in a robbery"/></From><Application>an audio conversation</Application><Text Style="color:#545454; ">-||Marc||-my letter box got used in a robbery has accepted your invitation to start an audio conversation.</Text></InvitationResponse><Invitation Date="27/02/2005" Time="11:33:17 AM" DateTime="2005-02-27T00:33:17.568Z" SessionID="782"><From><User FriendlyName="-||Marc||-my letter box got used in a robbery"/></From><Application>an audio conversation</Application><Text Style="color:#545454; ">-||Marc||-my letter box got used in a robbery is inviting you to start an audio conversation. Do you want to Accept (Alt+C) or Decline (Alt+D) the invitation?</Text></Invitation><InvitationResponse Date="27/02/2005" Time="11:33:17 AM" DateTime="2005-02-27T00:33:17.598Z" SessionID="782"><From><User FriendlyName="-||Marc||-my letter box got used in a robbery"/></From><Application>an audio conversation</Application><Text Style="color:#545454; ">You have accepted the invitation to start an audio conversation.</Text></InvitationResponse><Message Date="27/02/2005" Time="11:33:45 AM" DateTime="2005-02-27T00:33:45.418Z" SessionID="782"><From><User FriendlyName="-||Marc||-my letter box got used in a robbery"/></From><To><User FriendlyName="James *-)"/></To><Text Style="font-family:Microsoft Sans Serif; color:#000000; ">u go</Text></Message><Message Date="27/02/2005" Time="11:33:51 AM" DateTime="2005-02-27T00:33:51.186Z" SessionID="782"><From><User FriendlyName="-||Marc||-my letter box got used in a robbery"/></From><To><User FriendlyName="James *-)"/></To><Text Style="font-family:Microsoft Sans Serif; color:#000000; ">sho7uld work now</Text></Message><Invitation Date="27/02/2005" Time="11:34:00 AM" DateTime="2005-02-27T00:34:00.429Z" SessionID="782"><From><User FriendlyName="James *-)"/></From><Application>an audio conversation</Application><Text Style="color:#545454; ">You have invited -||Marc||-my letter box got used in a robbery to start an audio conversation. Please wait for a response, or Cancel (Alt+Q) the pending invitation.</Text></Invitation><InvitationResponse Date="27/02/2005" Time="11:34:04 AM" DateTime="2005-02-27T00:34:04.355Z" SessionID="782"><From><User FriendlyName="-||Marc||-my letter box got used in a robbery"/></From><Application>an audio conversation</Application><Text Style="color:#545454; ">-||Marc||-my letter box got used in a robbery has accepted your invitation to start an audio conversation.</Text></InvitationResponse><Message Date="27/02/2005" Time="12:57:51 PM" DateTime="2005-02-27T01:57:51.507Z" SessionID="782"><From><User FriendlyName="-||Marc||-my letter box got used in a robbery"/></From><To><User FriendlyName="James *-)"/></To><Text Style="font-family:Microsoft Sans Serif; color:#000000; ">xry my thing stuffed up</Text></Message><Message Date="27/02/2005" Time="12:58:06 PM" DateTime="2005-02-27T01:58:06.989Z" SessionID="782"><From><User FriendlyName="-||Marc||-my letter box got used in a robbery"/></From><To><User FriendlyName="James *-)"/></To><Text Style="font-family:Microsoft Sans Serif; color:#000000; ">im going 2 play doom 3 for a bit</Text></Message><Message Date="27/02/2005" Time="12:58:12 PM" DateTime="2005-02-27T01:58:12.477Z" SessionID="782"><From><User FriendlyName="-||Marc||-my letter box got used in a robbery"/></From><To><User FriendlyName="James *-)"/></To><Text Style="font-family:Microsoft Sans Serif; color:#000000; ">ill talk 2 u later</Text></Message><Message Date="27/02/2005" Time="6:53:54 PM" DateTime="2005-02-27T07:53:54.325Z" SessionID="783"><From><User FriendlyName="James *-)"/></From><To><User FriendlyName="-||Marc||-my letter box got used in a robbery"/></To><Text Style="font-family:Comic Sans MS; font-weight:bold; color:#000080; ">Aye</Text></Message><Message Date="27/02/2005" Time="6:54:00 PM" DateTime="2005-02-27T07:54:00.164Z" SessionID="783"><From><User FriendlyName="-||Marc||-my letter box got used in a robbery"/></From><To><User FriendlyName="James *-)"/></To><Text Style="font-family:Microsoft Sans Serif; color:#000000; ">hey</Text></Message><Invitation Date="27/02/2005" Time="6:54:06 PM" DateTime="2005-02-27T07:54:06.853Z" SessionID="783"><From><User FriendlyName="James *-)"/></From><Application>an audio conversation</Application><Text Style="color:#545454; ">You have invited -||Marc||-my letter box got used in a robbery to start an audio conversation. Please wait for a response, or Cancel (Alt+Q) the pending invitation.</Text></Invitation><Message Date="27/02/2005" Time="6:54:10 PM" DateTime="2005-02-27T07:54:10.599Z" SessionID="783"><From><User FriendlyName="-||Marc||-my letter box got used in a robbery"/></From><To><User FriendlyName="James *-)"/></To><Text Style="font-family:Microsoft Sans Serif; color:#000000; ">im annoying Alice aging</Text></Message><Message Date="27/02/2005" Time="6:54:12 PM" DateTime="2005-02-27T07:54:12.822Z" SessionID="783"><From><User FriendlyName="-||Marc||-my letter box got used in a robbery"/></From><To><User FriendlyName="James *-)"/></To><Text Style="font-family:Microsoft Sans Serif; color:#000000; ">again</Text></Message><Message Date="27/02/2005" Time="6:54:17 PM" DateTime="2005-02-27T07:54:17.338Z" SessionID="783"><From><User FriendlyName="James *-)"/></From><To><User FriendlyName="-||Marc||-my letter box got used in a robbery"/></To><Text Style="font-family:Comic Sans MS; font-weight:bold; color:#000080; ">hehe</Text></Message><InvitationResponse Date="27/02/2005" Time="6:54:17 PM" DateTime="2005-02-27T07:54:17.969Z" SessionID="783"><From><User FriendlyName="-||Marc||-my letter box got used in a robbery"/></From><Application>an audio conversation</Application><Text Style="color:#545454; ">-||Marc||-my letter box got used in a robbery has accepted your invitation to start an audio conversation.</Text></InvitationResponse><Message Date="27/02/2005" Time="6:57:54 PM" DateTime="2005-02-27T07:57:54.220Z" SessionID="783"><From><User FriendlyName="-||Marc||-my letter box got used in a robbery"/></From><To><User FriendlyName="James *-)"/></To><Text Style="font-family:Microsoft Sans Serif; color:#000000; "> Human: blue
ALICE: Green.
Human: damn u win
ALICE: Colloquial expression. Thank you very much. What is the prize?
Human: i am
ALICE:" Colloquial expression. Thank you very much. What is the prize?" You are?
Human: damn straight
ALICE: You and I are on the same wavelength, daddy. </Text></Message><Message Date="3/03/2005" Time="4:42:23 PM" DateTime="2005-03-03T05:42:23.090Z" SessionID="784"><From><User FriendlyName="-||Marc||- the rolla...it runs on hopes and dreams"/></From><To><User FriendlyName="James *-)"/></To><Text Style="font-family:Microsoft Sans Serif; color:#000000; ">hey</Text></Message><Invitation Date="3/03/2005" Time="4:42:36 PM" DateTime="2005-03-03T05:42:36.910Z" SessionID="784"><From><User FriendlyName="James *-)"/></From><File>C:\3dsmax5\scenes\Super Orange.jpg</File><Text Style="color:#545454; ">James *-) sends C:\3dsmax5\scenes\Super Orange.jpg</Text></Invitation><InvitationResponse Date="3/03/2005" Time="4:43:18 PM" DateTime="2005-03-03T05:43:18.410Z" SessionID="784"><From><User FriendlyName="-||Marc||- the rolla...it runs on hopes and dreams"/></From><File>C:\3dsmax5\scenes\Super Orange.jpg</File><Text Style="color:#545454; ">Transfer of "Super Orange.jpg" is complete.</Text></InvitationResponse><Message Date="3/03/2005" Time="4:44:02 PM" DateTime="2005-03-03T05:44:02.253Z" SessionID="784"><From><User FriendlyName="James *-)"/></From><To><User FriendlyName="-||Marc||- the rolla...it runs on hopes and dreams"/></To><Text Style="font-family:Comic Sans MS; font-weight:bold; color:#000080; ">I made it </Text></Message><Message Date="3/03/2005" Time="4:44:04 PM" DateTime="2005-03-03T05:44:04.576Z" SessionID="784"><From><User FriendlyName="-||Marc||- the rolla...it runs on hopes and dreams"/></From><To><User FriendlyName="James *-)"/></To><Text Style="font-family:Microsoft Sans Serif; color:#000000; ">awsome</Text></Message><Message Date="3/03/2005" Time="4:44:06 PM" DateTime="2005-03-03T05:44:06.309Z" SessionID="784"><From><User FriendlyName="-||Marc||- the rolla...it runs on hopes and dreams"/></From><To><User FriendlyName="James *-)"/></To><Text Style="font-family:Microsoft Sans Serif; color:#000000; ">i no</Text></Message><Message Date="3/03/2005" Time="4:44:13 PM" DateTime="2005-03-03T05:44:13.809Z" SessionID="784"><From><User FriendlyName="-||Marc||- the rolla...it runs on hopes and dreams"/></From><To><User FriendlyName="James *-)"/></To><Text Style="font-family:Microsoft Sans Serif; color:#000000; ">u told me about it</Text></Message><Message Date="3/03/2005" Time="4:44:17 PM" DateTime="2005-03-03T05:44:17.054Z" SessionID="784"><From><User FriendlyName="James *-)"/></From><To><User FriendlyName="-||Marc||- the rolla...it runs on hopes and dreams"/></To><Text Style="font-family:Comic Sans MS; font-weight:bold; color:#000080; ">I made it out of a sphere ;)</Text></Message><Message Date="3/03/2005" Time="4:44:26 PM" DateTime="2005-03-03T05:44:26.107Z" SessionID="785"><From><User FriendlyName="-||Marc||- the rolla...it runs on hopes and dreams"/></From><To><User FriendlyName="James *-)"/></To><Text Style="font-family:Microsoft Sans Serif; color:#000000; ">i no</Text></Message><Message Date="3/03/2005" Time="4:44:31 PM" DateTime="2005-03-03T05:44:31.915Z" SessionID="785"><From><User FriendlyName="-||Marc||- the rolla...it runs on hopes and dreams"/></From><To><User FriendlyName="James *-)"/></To><Text Style="font-family:Microsoft Sans Serif; color:#000000; ">on 3ds max</Text></Message><Message Date="3/03/2005" Time="4:53:32 PM" DateTime="2005-03-03T05:53:32.943Z" SessionID="786"><From><User FriendlyName="-||Marc||- the rolla...it runs on hopes and dreams"/></From><To><User FriendlyName="James *-)"/></To><Text Style="font-family:Microsoft Sans Serif; color:#000000; ">so what u up 2?</Text></Message><Message Date="3/03/2005" Time="4:53:35 PM" DateTime="2005-03-03T05:53:35.267Z" SessionID="786"><From><User FriendlyName="-||Marc||- the rolla...it runs on hopes and dreams"/></From><To><User FriendlyName="James *-)"/></To><Text Style="font-family:Microsoft Sans Serif; color:#000000; ">website?</Text></Message><Invitation Date="3/03/2005" Time="8:12:58 PM" DateTime="2005-03-03T09:12:58.301Z" SessionID="787"><From><User FriendlyName="James *-)"/></From><Application>an audio conversation</Application><Text Style="color:#545454; ">You have invited -||Marc||- the rolla...it runs on hopes and dreams [sweet Jess finally blocked me!] to start an audio conversation. Please wait for a response, or Cancel (Alt+Q) the pending invitation.</Text></Invitation><InvitationResponse Date="3/03/2005" Time="8:13:09 PM" DateTime="2005-03-03T09:13:09.988Z" SessionID="787"><From><User FriendlyName="-||Marc||- the rolla...it runs on hopes and dreams [sweet Jess finally blocked me!]"/></From><Application>an audio conversation</Application><Text Style="color:#545454; ">-||Marc||- the rolla...it runs on hopes and dreams [sweet Jess finally blocked me!] has accepted your invitation to start an audio conversation.</Text></InvitationResponse><Message Date="4/03/2005" Time="3:17:32 PM" DateTime="2005-03-04T04:17:32.139Z" SessionID="788"><From><User FriendlyName="James *-)"/></From><To><User FriendlyName="-||Marc||- the rolla...it runs on hopes and dreams [sweet Jess finally blocked me!]"/></To><Text Style="font-family:Comic Sans MS; font-weight:bold; color:#000080; ">Afternoon</Text></Message><Message Date="4/03/2005" Time="3:17:39 PM" DateTime="2005-03-04T04:17:39.750Z" SessionID="789"><From><User FriendlyName="-||Marc||- the rolla...it runs on hopes and dreams [sweet Jess finally blocked me!]"/></From><To><User FriendlyName="James *-)"/></To><Text Style="font-family:Verdana; color:#ff0000; ">hey</Text></Message><Message Date="4/03/2005" Time="3:17:46 PM" DateTime="2005-03-04T04:17:46.319Z" SessionID="789"><From><User FriendlyName="-||Marc||- the rolla...it runs on hopes and dreams [sweet Jess finally blocked me!]"/></From><To><User FriendlyName="James *-)"/></To><Text Style="font-family:Verdana; color:#ff0000; ">brb i gotta go put some food on</Text></Message><Message Date="4/03/2005" Time="3:17:54 PM" DateTime="2005-03-04T04:17:54.841Z" SessionID="789"><From><User FriendlyName="James *-)"/></From><To><User FriendlyName="-||Marc||- the rolla...it runs on hopes and dreams [sweet Jess finally blocked me!]"/></To><Text Style="font-family:Comic Sans MS; font-weight:bold; color:#000080; ">lol</Text></Message><Message Date="4/03/2005" Time="3:18:05 PM" DateTime="2005-03-04T04:18:05.967Z" SessionID="790"><From><User FriendlyName="-||Marc||- the rolla...it runs on hopes and dreams [sweet Jess finally blocked me!]"/></From><To><User FriendlyName="James *-)"/></To><Text Style="font-family:Verdana; color:#ff0000; ">im hungry :(</Text></Message><Message Date="4/03/2005" Time="3:29:33 PM" DateTime="2005-03-04T04:29:33.155Z" SessionID="790"><From><User FriendlyName="-||Marc||- the rolla...it runs on hopes and dreams [sweet Jess finally blocked me!]"/></From><To><User FriendlyName="James *-)"/></To><Text Style="font-family:Verdana; color:#ff0000; ">im  set</Text></Message><Message Date="4/03/2005" Time="3:29:39 PM" DateTime="2005-03-04T04:29:39.064Z" SessionID="790"><From><User FriendlyName="-||Marc||- the rolla...it runs on hopes and dreams [sweet Jess finally blocked me!]"/></From><To><User FriendlyName="James *-)"/></To><Text Style="font-family:Verdana; color:#ff0000; ">had some pizza</Text></Message><Invitation Date="4/03/2005" Time="3:29:41 PM" DateTime="2005-03-04T04:29:41.367Z" SessionID="790"><From><User FriendlyName="James *-)"/></From><Application>an audio conversation</Application><Text Style="color:#545454; ">You have invited -||Marc||- the rolla...it runs on hopes and dreams [sweet Jess finally blocked me!] to start an audio conversation. Please wait for a response, or Cancel (Alt+Q) the pending invitation.</Text></Invitation><Message Date="4/03/2005" Time="3:29:45 PM" DateTime="2005-03-04T04:29:45.052Z" SessionID="790"><From><User FriendlyName="-||Marc||- the rolla...it runs on hopes and dreams [sweet Jess finally blocked me!]"/></From><To><User FriendlyName="James *-)"/></To><Text Style="font-family:Verdana; color:#ff0000; ">and some baileys :D</Text></Message><InvitationResponse Date="4/03/2005" Time="3:29:48 PM" DateTime="2005-03-04T04:29:48.678Z" SessionID="790"><From><User FriendlyName="-||Marc||- the rolla...it runs on hopes and dreams [sweet Jess finally blocked me!]"/></From><Application>an audio conversation</Application><Text Style="color:#545454; ">-||Marc||- the rolla...it runs on hopes and dreams [sweet Jess finally blocked me!] has accepted your invitation to start an audio conversation.</Text></InvitationResponse><Invitation Date="4/03/2005" Time="5:43:27 PM" DateTime="2005-03-04T06:43:27.007Z" SessionID="791"><From><User FriendlyName="James *-)"/></From><Application>an audio conversation</Application><Text Style="color:#545454; ">You have invited -||Marc||- the rolla...it runs on hopes and dreams [sweet Jess finally blocked me!] to start an audio conversation. Please wait for a response, or Cancel (Alt+Q) the pending invitation.</Text></Invitation><InvitationResponse Date="4/03/2005" Time="5:43:51 PM" DateTime="2005-03-04T06:43:51.733Z" SessionID="791"><From><User FriendlyName="-||Marc||- the rolla...it runs on hopes and dreams [sweet Jess finally blocked me!]"/></From><Application>an audio conversation</Application><Text Style="color:#545454; ">-||Marc||- the rolla...it runs on hopes and dreams [sweet Jess finally blocked me!] has accepted your invitation to start an audio conversation.</Text></InvitationResponse><Message Date="5/03/2005" Time="3:58:29 PM" DateTime="2005-03-05T04:58:29.156Z" SessionID="792"><From><User FriendlyName="James *-) Take it easy, and it its easy... Take it home ;)"/></From><To><User FriendlyName="-||Marc||- the rolla...it runs on hopes and dreams [shit Jess unblocked me!]"/></To><Text Style="font-family:Comic Sans MS; font-weight:bold; color:#000080; ">aye</Text></Message><Message Date="5/03/2005" Time="3:58:33 PM" DateTime="2005-03-05T04:58:33.962Z" SessionID="792"><From><User FriendlyName="-||Marc||- the rolla...it runs on hopes and dreams [shit Jess unblocked me!]"/></From><To><U