<?xml version="1.0"?>
<?xml-stylesheet type='text/xsl' href='MessageLog.xsl'?>
<Log FirstSessionID="1" LastSessionID="163"><Message Date="2/11/2004" Time="4:17:47 PM" DateTime="2004-11-02T05:17:47.853Z" SessionID="1"><From><User FriendlyName="iD.Syd // steve-0 | Status: here | I Own LozzaY :)"/></From><To><User FriendlyName="James*-) 15 Days To Half Life 2 :D"/></To><Text Style="font-family:MS Shell Dlg; color:#000000; ">http://fuseRADIO.com.au/s3.pls</Text></Message><Message Date="2/11/2004" Time="4:19:26 PM" DateTime="2004-11-02T05:19:26.435Z" SessionID="2"><From><User FriendlyName="James*-) 15 Days To Half Life 2 :D"/></From><To><User FriendlyName="iD.Syd // steve-0 | Status: here | I Own LozzaY :)"/></To><Text Style="font-family:Comic Sans MS; font-weight:bold; color:#000080; ">Am listening</Text></Message><Message Date="2/11/2004" Time="4:19:31 PM" DateTime="2004-11-02T05:19:31.512Z" SessionID="3"><From><User FriendlyName="iD.Syd // steve-0 | Status: here | I Own LozzaY :)"/></From><To><User FriendlyName="James*-) 15 Days To Half Life 2 :D"/></To><Text Style="font-family:MS Shell Dlg; color:#000000; ">kickass</Text></Message><Message Date="2/11/2004" Time="4:19:39 PM" DateTime="2004-11-02T05:19:39.774Z" SessionID="3"><From><User FriendlyName="James*-) 15 Days To Half Life 2 :D"/></From><To><User FriendlyName="iD.Syd // steve-0 | Status: here | I Own LozzaY :)"/></To><Text Style="font-family:Comic Sans MS; font-weight:bold; color:#000080; ">RAHHHHHHHHHHHHHHHH!</Text></Message><Message Date="2/11/2004" Time="4:19:43 PM" DateTime="2004-11-02T05:19:43.390Z" SessionID="3"><From><User FriendlyName="iD.Syd // steve-0 | Status: here | I Own LozzaY :)"/></From><To><User FriendlyName="James*-) 15 Days To Half Life 2 :D"/></To><Text Style="font-family:MS Shell Dlg; color:#000000; ">what?</Text></Message><Message Date="2/11/2004" Time="4:19:44 PM" DateTime="2004-11-02T05:19:44.301Z" SessionID="3"><From><User FriendlyName="James*-) 15 Days To Half Life 2 :D"/></From><To><User FriendlyName="iD.Syd // steve-0 | Status: here | I Own LozzaY :)"/></To><Text Style="font-family:Comic Sans MS; font-weight:bold; color:#000080; ">say sumfin</Text></Message><Message Date="2/11/2004" Time="4:19:56 PM" DateTime="2004-11-02T05:19:56.238Z" SessionID="3"><From><User FriendlyName="James*-) 15 Days To Half Life 2 :D"/></From><To><User FriendlyName="iD.Syd // steve-0 | Status: here | I Own LozzaY :)"/></To><Text Style="font-family:Comic Sans MS; font-weight:bold; color:#000080; ">This songs very screamy</Text></Message><Message Date="2/11/2004" Time="4:20:02 PM" DateTime="2004-11-02T05:20:02.477Z" SessionID="3"><From><User FriendlyName="iD.Syd // steve-0 | Status: here | I Own LozzaY :)"/></From><To><User FriendlyName="James*-) 15 Days To Half Life 2 :D"/></To><Text Style="font-family:MS Shell Dlg; color:#000000; ">i cant uleh, i havnt got it set up</Text></Message><Message Date="2/11/2004" Time="4:26:59 PM" DateTime="2004-11-02T05:26:59.346Z" SessionID="4"><From><User FriendlyName="iD.Syd // steve-0 | Status: here | I Own LozzaY :)"/></From><To><User FriendlyName="James*-) Pics or It didn't Happen..."/></To><Text Style="font-family:MS Shell Dlg; color:#000000; ">i got pics :)</Text></Message><Message Date="2/11/2004" Time="4:27:09 PM" DateTime="2004-11-02T05:27:09.501Z" SessionID="4"><From><User FriendlyName="James*-) Pics or It didn't Happen..."/></From><To><User FriendlyName="iD.Syd // steve-0 | Status: here | I Own LozzaY :)"/></To><Text Style="font-family:Comic Sans MS; font-weight:bold; color:#000080; ">hehe</Text></Message><Message Date="2/11/2004" Time="4:27:23 PM" DateTime="2004-11-02T05:27:23.241Z" SessionID="5"><From><User FriendlyName="James*-) Pics or It didn't Happen..."/></From><To><User FriendlyName="iD.Syd // steve-0 | Status: here | I Own LozzaY :)"/></To><Text Style="font-family:Comic Sans MS; font-weight:bold; color:#000080; ">Pics or shes a 40 year old bald biker</Text></Message><Message Date="2/11/2004" Time="4:27:48 PM" DateTime="2004-11-02T05:27:48.627Z" SessionID="6"><From><User FriendlyName="iD.Syd // steve-0 | Status: here | I Own LozzaY :)"/></From><To><User FriendlyName="James*-) Pics or It didn't Happen..."/></To><Text Style="font-family:MS Shell Dlg; color:#000000; ">ok i send pics :)</Text></Message><Message Date="2/11/2004" Time="4:27:52 PM" DateTime="2004-11-02T05:27:52.823Z" SessionID="6"><From><User FriendlyName="James*-) Pics or It didn't Happen..."/></From><To><User FriendlyName="iD.Syd // steve-0 | Status: here | I Own LozzaY :)"/></To><Text Style="font-family:Comic Sans MS; font-weight:bold; color:#000080; ">lol</Text></Message><Message Date="2/11/2004" Time="4:28:01 PM" DateTime="2004-11-02T05:28:01.726Z" SessionID="6"><From><User FriendlyName="James*-) Pics or It didn't Happen..."/></From><To><User FriendlyName="iD.Syd // steve-0 | Status: here | I Own LozzaY :)"/></To><Text Style="font-family:Comic Sans MS; font-weight:bold; color:#000080; ">Im trying 2 get my m8 to send pics of his "model</Text></Message><Message Date="2/11/2004" Time="4:28:29 PM" DateTime="2004-11-02T05:28:29.015Z" SessionID="7"><From><User FriendlyName="iD.Syd // steve-0 | Status: here | I Own LozzaY :)"/></From><To><User FriendlyName="James*-) Pics or It didn't Happen..."/></To><Text Style="font-family:MS Shell Dlg; color:#000000; ">my girl</Text></Message><Invitation Date="2/11/2004" Time="4:28:29 PM" DateTime="2004-11-02T05:28:29.266Z" SessionID="7"><From><User FriendlyName="iD.Syd // steve-0 | Status: here | I Own LozzaY :)"/></From><File>hm lozzay.JPG</File><Text Style="color:#545454; ">iD.Syd // steve-0 | Status: here | I Own LozzaY :) sends hm lozzay.JPG</Text></Invitation><Message Date="2/11/2004" Time="4:29:06 PM" DateTime="2004-11-02T05:29:06.800Z" SessionID="7"><From><User FriendlyName="James*-) Pics or It didn't Happen..."/></From><To><User FriendlyName="iD.Syd // steve-0 | Status: here | I Own LozzaY :)"/></To><Text Style="font-family:Comic Sans MS; font-weight:bold; color:#000080; ">lol</Text></Message><InvitationResponse Date="2/11/2004" Time="4:29:10 PM" DateTime="2004-11-02T05:29:10.094Z" SessionID="7"><From><User FriendlyName="iD.Syd // steve-0 | Status: here | I Own LozzaY :)"/></From><File>C:\Documents and Settings\James O'Toole\My Documents\My Received Files\hm lozzay.JPG</File><Text Style="color:#545454; ">You have successfully received C:\Documents and Settings\James O'Toole\My Documents\My Received Files\hm lozzay.JPG from iD.Syd // steve-0 | Status: here | I Own LozzaY :).</Text></InvitationResponse><Message Date="2/11/2004" Time="4:29:45 PM" DateTime="2004-11-02T05:29:45.295Z" SessionID="7"><From><User FriendlyName="iD.Syd // steve-0 | Status: here | I Own LozzaY :)"/></From><To><User FriendlyName="James*-) Pics or It didn't Happen..."/></To><Text Style="font-family:MS Shell Dlg; color:#000000; ">i love her :)</Text></Message><Message Date="2/11/2004" Time="4:30:10 PM" DateTime="2004-11-02T05:30:10.151Z" SessionID="7"><From><User FriendlyName="James*-) Pics or It didn't Happen..."/></From><To><User FriendlyName="iD.Syd // steve-0 | Status: here | I Own LozzaY :)"/></To><Text Style="font-family:Comic Sans MS; font-weight:bold; color:#000080; ">Good 4 u :P</Text></Message><Message Date="4/11/2004" Time="5:20:57 PM" DateTime="2004-11-04T06:20:57.820Z" SessionID="8"><From><User FriendlyName="James*-) I think therefore I am... I think."/></From><To><User FriendlyName="iD.Syd // steve-0 | Status: here | &lt;3 (L) s2 :) | Can you feel the love?!? :)"/></To><Text Style="font-family:Comic Sans MS; font-weight:bold; color:#000080; ">G'day Steve-o</Text></Message><Message Date="4/11/2004" Time="5:21:07 PM" DateTime="2004-11-04T06:21:07.674Z" SessionID="9"><From><User FriendlyName="iD.Syd // steve-0 | Status: here | &lt;3 (L) s2 :) | Can you feel the love?!? :)"/></From><To><User FriendlyName="James*-) I think therefore I am... I think."/></To><Text Style="font-family:Comic Sans MS; font-weight:bold; color:#000000; ">whens hl2 comin out?</Text></Message><Message Date="4/11/2004" Time="5:21:21 PM" DateTime="2004-11-04T06:21:21.915Z" SessionID="9"><From><User FriendlyName="James*-) I think therefore I am... I think."/></From><To><User FriendlyName="iD.Syd // steve-0 | Status: here | &lt;3 (L) s2 :) | Can you feel the love?!? :)"/></To><Text Style="font-family:Comic Sans MS; font-weight:bold; color:#000080; ">12 dats</Text></Message><Message Date="4/11/2004" Time="5:21:24 PM" DateTime="2004-11-04T06:21:24.168Z" SessionID="9"><From><User FriendlyName="James*-) I think therefore I am... I think."/></From><To><User FriendlyName="iD.Syd // steve-0 | Status: here | &lt;3 (L) s2 :) | Can you feel the love?!? :)"/></To><Text Style="font-family:Comic Sans MS; font-weight:bold; color:#000080; ">day*</Text></Message><Message Date="4/11/2004" Time="5:21:28 PM" DateTime="2004-11-04T06:21:28.264Z" SessionID="9"><From><User FriendlyName="iD.Syd // steve-0 | Status: here | &lt;3 (L) s2 :) | Can you feel the love?!? :)"/></From><To><User FriendlyName="James*-) I think therefore I am... I think."/></To><Text Style="font-family:Comic Sans MS; font-weight:bold; color:#000000; ">YAY</Text></Message><Message Date="4/11/2004" Time="5:21:30 PM" DateTime="2004-11-04T06:21:30.457Z" SessionID="9"><From><User FriendlyName="James*-) I think therefore I am... I think."/></From><To><User FriendlyName="iD.Syd // steve-0 | Status: here | &lt;3 (L) s2 :) | Can you feel the love?!? :)"/></To><Text Style="font-family:Comic Sans MS; font-weight:bold; color:#000080; ">come out on the 16th</Text></Message><Message Date="4/11/2004" Time="5:21:33 PM" DateTime="2004-11-04T06:21:33.602Z" SessionID="9"><From><User FriendlyName="iD.Syd // steve-0 | Status: here | &lt;3 (L) s2 :) | Can you feel the love?!? :)"/></From><To><User FriendlyName="James*-) I think therefore I am... I think."/></To><Text Style="font-family:Comic Sans MS; font-weight:bold; color:#000000; ">i cant wait ^^</Text></Message><Message Date="4/11/2004" Time="5:21:38 PM" DateTime="2004-11-04T06:21:38.699Z" SessionID="9"><From><User FriendlyName="James*-) I think therefore I am... I think."/></From><To><User FriendlyName="iD.Syd // steve-0 | Status: here | &lt;3 (L) s2 :) | Can you feel the love?!? :)"/></To><Text Style="font-family:Comic Sans MS; font-weight:bold; color:#000080; ">:D</Text></Message><Message Date="4/11/2004" Time="5:21:40 PM" DateTime="2004-11-04T06:21:40.081Z" SessionID="9"><From><User FriendlyName="James*-) I think therefore I am... I think."/></From><To><User FriendlyName="iD.Syd // steve-0 | Status: here | &lt;3 (L) s2 :) | Can you feel the love?!? :)"/></To><Text Style="font-family:Comic Sans MS; font-weight:bold; color:#000080; ">i no eh</Text></Message><Message Date="4/11/2004" Time="5:21:48 PM" DateTime="2004-11-04T06:21:48.113Z" SessionID="9"><From><User FriendlyName="James*-) I think therefore I am... I think."/></From><To><User FriendlyName="iD.Syd // steve-0 | Status: here | &lt;3 (L) s2 :) | Can you feel the love?!? :)"/></To><Text Style="font-family:Comic Sans MS; font-weight:bold; color:#000080; ">Im gonner upgrade 2 silver soon</Text></Message><Message Date="4/11/2004" Time="5:21:56 PM" DateTime="2004-11-04T06:21:56.895Z" SessionID="9"><From><User FriendlyName="iD.Syd // steve-0 | Status: here | &lt;3 (L) s2 :) | Can you feel the love?!? :)"/></From><To><User FriendlyName="James*-) I think therefore I am... I think."/></To><Text Style="font-family:Comic Sans MS; font-weight:bold; color:#000000; ">kool</Text></Message><Message Date="4/11/2004" Time="5:22:02 PM" DateTime="2004-11-04T06:22:02.854Z" SessionID="9"><From><User FriendlyName="iD.Syd // steve-0 | Status: here | &lt;3 (L) s2 :) | Can you feel the love?!? :)"/></From><To><User FriendlyName="James*-) I think therefore I am... I think."/></To><Text Style="font-family:Comic Sans MS; font-weight:bold; color:#000000; ">cbf with the others</Text></Message><Message Date="4/11/2004" Time="5:22:12 PM" DateTime="2004-11-04T06:22:12.167Z" SessionID="9"><From><User FriendlyName="James*-) I think therefore I am... I think."/></From><To><User FriendlyName="iD.Syd // steve-0 | Status: here | &lt;3 (L) s2 :) | Can you feel the love?!? :)"/></To><Text Style="font-family:Comic Sans MS; font-weight:bold; color:#000080; ">ahh</Text></Message><Message Date="4/11/2004" Time="5:22:20 PM" DateTime="2004-11-04T06:22:20.739Z" SessionID="9"><From><User FriendlyName="James*-) I think therefore I am... I think."/></From><To><User FriendlyName="iD.Syd // steve-0 | Status: here | &lt;3 (L) s2 :) | Can you feel the love?!? :)"/></To><Text Style="font-family:Comic Sans MS; font-weight:bold; color:#000080; ">Half Life Source looks pretty kick ass tho...</Text></Message><Message Date="4/11/2004" Time="5:22:26 PM" DateTime="2004-11-04T06:22:26.197Z" SessionID="10"><From><User FriendlyName="iD.Syd // steve-0 | Status: here | &lt;3 (L) s2 :) | Can you feel the love?!? :)"/></From><To><User FriendlyName="James*-) I think therefore I am... I think."/></To><Text Style="font-family:Comic Sans MS; font-weight:bold; color:#000000; ">yeh</Text></Message><Message Date="4/11/2004" Time="5:22:27 PM" DateTime="2004-11-04T06:22:27.189Z" SessionID="10"><From><User FriendlyName="iD.Syd // steve-0 | Status: here | &lt;3 (L) s2 :) | Can you feel the love?!? :)"/></From><To><User FriendlyName="James*-) I think therefore I am... I think."/></To><Text Style="font-family:Comic Sans MS; font-weight:bold; color:#000000; ">been there</Text></Message><Message Date="4/11/2004" Time="5:22:28 PM" DateTime="2004-11-04T06:22:28.901Z" SessionID="10"><From><User FriendlyName="iD.Syd // steve-0 | Status: here | &lt;3 (L) s2 :) | Can you feel the love?!? :)"/></From><To><User FriendlyName="James*-) I think therefore I am... I think."/></To><Text Style="font-family:Comic Sans MS; font-weight:bold; color:#000000; ">done that</Text></Message><Message Date="4/11/2004" Time="5:22:33 PM" DateTime="2004-11-04T06:22:33.388Z" SessionID="10"><From><User FriendlyName="James*-) I think therefore I am... I think."/></From><To><User FriendlyName="iD.Syd // steve-0 | Status: here | &lt;3 (L) s2 :) | Can you feel the love?!? :)"/></To><Text Style="font-family:Comic Sans MS; font-weight:bold; color:#000080; ">eh</Text></Message><Message Date="4/11/2004" Time="5:22:40 PM" DateTime="2004-11-04T06:22:40.638Z" SessionID="10"><From><User FriendlyName="James*-) I think therefore I am... I think."/></From><To><User FriendlyName="iD.Syd // steve-0 | Status: here | &lt;3 (L) s2 :) | Can you feel the love?!? :)"/></To><Text Style="font-family:Comic Sans MS; font-weight:bold; color:#000080; ">There making Half Life 2 deathmatch</Text></Message><Message Date="4/11/2004" Time="5:22:50 PM" DateTime="2004-11-04T06:22:50.733Z" SessionID="10"><From><User FriendlyName="James*-) I think therefore I am... I think."/></From><To><User FriendlyName="iD.Syd // steve-0 | Status: here | &lt;3 (L) s2 :) | Can you feel the love?!? :)"/></To><Text Style="font-family:Comic Sans MS; font-weight:bold; color:#000080; ">Cuz there no Half life 2 multiplayer</Text></Message><Message Date="4/11/2004" Time="5:23:30 PM" DateTime="2004-11-04T06:23:30.760Z" SessionID="10"><From><User FriendlyName="James*-) I think therefore I am... I think."/></From><To><User FriendlyName="iD.Syd // steve-0 | Status: here | &lt;3 (L) s2 :) | Can you feel the love?!? :)"/></To><Text Style="font-family:Comic Sans MS; font-weight:bold; color:#000080; ">HL-2 Multiplayer Is CS Source</Text></Message><Message Date="4/11/2004" Time="5:23:36 PM" DateTime="2004-11-04T06:23:36.689Z" SessionID="10"><From><User FriendlyName="iD.Syd // steve-0 | Status: here | &lt;3 (L) s2 :) | Can you feel the love?!? :)"/></From><To><User FriendlyName="James*-) I think therefore I am... I think."/></To><Text Style="font-family:Comic Sans MS; font-weight:bold; color:#000000; ">kool</Text></Message><Message Date="4/11/2004" Time="5:24:53 PM" DateTime="2004-11-04T06:24:53.850Z" SessionID="10"><From><User FriendlyName="James*-) I think therefore I am... I think."/></From><To><User FriendlyName="iD.Syd // steve-0 | Status: here | &lt;3 (L) s2 :) | Can you feel the love?!? :)"/></To><Text Style="font-family:Comic Sans MS; font-weight:bold; color:#000080; ">Have u Used Game Maker</Text></Message><Message Date="4/11/2004" Time="5:24:57 PM" DateTime="2004-11-04T06:24:57.595Z" SessionID="10"><From><User FriendlyName="iD.Syd // steve-0 | Status: here | &lt;3 (L) s2 :) | Can you feel the love?!? :)"/></From><To><User FriendlyName="James*-) I think therefore I am... I think."/></To><Text Style="font-family:Comic Sans MS; font-weight:bold; color:#000000; ">nope</Text></Message><Message Date="4/11/2004" Time="5:24:58 PM" DateTime="2004-11-04T06:24:58.616Z" SessionID="10"><From><User FriendlyName="iD.Syd // steve-0 | Status: here | &lt;3 (L) s2 :) | Can you feel the love?!? :)"/></From><To><User FriendlyName="James*-) I think therefore I am... I think."/></To><Text Style="font-family:Comic Sans MS; font-weight:bold; color:#000000; ">what is it</Text></Message><Message Date="4/11/2004" Time="5:25:12 PM" DateTime="2004-11-04T06:25:12.967Z" SessionID="10"><From><User FriendlyName="James*-) I think therefore I am... I think."/></From><To><User FriendlyName="iD.Syd // steve-0 | Status: here | &lt;3 (L) s2 :) | Can you feel the love?!? :)"/></To><Text Style="font-family:Comic Sans MS; font-weight:bold; color:#000080; ">A simplistic game making app</Text></Message><Message Date="4/11/2004" Time="5:25:18 PM" DateTime="2004-11-04T06:25:18.876Z" SessionID="10"><From><User FriendlyName="James*-) I think therefore I am... I think."/></From><To><User FriendlyName="iD.Syd // steve-0 | Status: here | &lt;3 (L) s2 :) | Can you feel the love?!? :)"/></To><Text Style="font-family:Comic Sans MS; font-weight:bold; color:#000080; ">but its allso a language or sumfin</Text></Message><Message Date="4/11/2004" Time="5:25:24 PM" DateTime="2004-11-04T06:25:24.394Z" SessionID="10"><From><User FriendlyName="James*-) I think therefore I am... I think."/></From><To><User FriendlyName="iD.Syd // steve-0 | Status: here | &lt;3 (L) s2 :) | Can you feel the love?!? :)"/></To><Text Style="font-family:Comic Sans MS; font-weight:bold; color:#000080; ">Where doin it in sckool next year</Text></Message><Message Date="4/11/2004" Time="5:25:40 PM" DateTime="2004-11-04T06:25:40.086Z" SessionID="11"><From><User FriendlyName="iD.Syd // steve-0 | Status: here | &lt;3 (L) s2 :) | Can you feel the love?!? :)"/></From><To><User FriendlyName="James*-) I think therefore I am... I think."/></To><Text Style="font-family:Comic Sans MS; font-weight:bold; color:#000000; ">kewl</Text></Message><Message Date="4/11/2004" Time="5:25:58 PM" DateTime="2004-11-04T06:25:58.773Z" SessionID="11"><From><User FriendlyName="James*-) I think therefore I am... I think."/></From><To><User FriendlyName="iD.Syd // steve-0 | Status: here | &lt;3 (L) s2 :) | Can you feel the love?!? :)"/></To><Text Style="font-family:Comic Sans MS; font-weight:bold; color:#000080; ">Yeah</Text></Message><Message Date="4/11/2004" Time="5:26:10 PM" DateTime="2004-11-04T06:26:10.690Z" SessionID="11"><From><User FriendlyName="James*-) I think therefore I am... I think."/></From><To><User FriendlyName="iD.Syd // steve-0 | Status: here | &lt;3 (L) s2 :) | Can you feel the love?!? :)"/></To><Text Style="font-family:Comic Sans MS; font-weight:bold; color:#000080; ">Im not ment 2 be on but i convinced my mum its kinda usefull </Text></Message><Message Date="4/11/2004" Time="5:26:11 PM" DateTime="2004-11-04T06:26:11.641Z" SessionID="11"><From><User FriendlyName="James*-) I think therefore I am... I think."/></From><To><User FriendlyName="iD.Syd // steve-0 | Status: here | &lt;3 (L) s2 :) | Can you feel the love?!? :)"/></To><Text Style="font-family:Comic Sans MS; font-weight:bold; color:#000080; ">;)</Text></Message><Message Date="4/11/2004" Time="5:26:16 PM" DateTime="2004-11-04T06:26:16.939Z" SessionID="11"><From><User FriendlyName="James*-) I think therefore I am... I think."/></From><To><User FriendlyName="iD.Syd // steve-0 | Status: workies | &lt;3 (L) s2 :) | Can you feel the love?!? :)"/></To><Text Style="font-family:Comic Sans MS; font-weight:bold; color:#000080; ">So im reading a tutorial</Text></Message><Message Date="4/11/2004" Time="5:26:22 PM" DateTime="2004-11-04T06:26:22.637Z" SessionID="11"><From><User FriendlyName="iD.Syd // steve-0 | Status: workies | &lt;3 (L) s2 :) | Can you feel the love?!? :)"/></From><To><User FriendlyName="James*-) I think therefore I am... I think."/></To><Text Style="font-family:Comic Sans MS; font-weight:bold; color:#000000; ">:P</Text></Message><Message Date="4/11/2004" Time="5:26:25 PM" DateTime="2004-11-04T06:26:25.261Z" SessionID="11"><From><User FriendlyName="James*-) I think therefore I am... I think."/></From><To><User FriendlyName="iD.Syd // steve-0 | Status: workies | &lt;3 (L) s2 :) | Can you feel the love?!? :)"/></To><Text Style="font-family:Comic Sans MS; font-weight:bold; color:#000080; ">Game Maker is only 4mb :)</Text></Message><Message Date="4/11/2004" Time="5:26:36 PM" DateTime="2004-11-04T06:26:36.317Z" SessionID="12"><From><User FriendlyName="iD.Syd // steve-0 | Status: workies | &lt;3 (L) s2 :) | Can you feel the love?!? :)"/></From><To><User FriendlyName="James*-) I think therefore I am... I think."/></To><Text Style="font-family:Comic Sans MS; font-weight:bold; color:#000000; ">kewl</Text></Message><Message Date="4/11/2004" Time="5:27:00 PM" DateTime="2004-11-04T06:27:00.342Z" SessionID="12"><From><User FriendlyName="James*-) I think therefore I am... I think."/></From><To><User FriendlyName="iD.Syd // steve-0 | Status: workies | &lt;3 (L) s2 :) | Can you feel the love?!? :)"/></To><Text Style="font-family:Comic Sans MS; font-weight:bold; color:#000080; ">http://www.gamemaker.nl/download.html Looks pretty interesting</Text></Message><Message Date="5/11/2004" Time="3:31:05 PM" DateTime="2004-11-05T04:31:05.358Z" SessionID="13"><From><User FriendlyName="iD.Syd // steve-0 | Status: Here| SMGL 2 Morro :) Bringing Video Camera 2 Report on it :)"/></From><To><User FriendlyName="James*-) I think therefore I am... I think."/></To><Text Style="font-family:Comic Sans MS; font-weight:bold; color:#000000; ">suppp bomaar!:)</Text></Message><Message Date="5/11/2004" Time="7:10:26 PM" DateTime="2004-11-05T08:10:26.794Z" SessionID="13"><From><User FriendlyName="iD.Syd // steve-0 | Status: Here| SMGL 2 Morro :) Bringing Video Camera 2 Report on it :)"/></From><To><User FriendlyName="James*-) I think therefore I am... I think."/></To><Text Style="font-family:Comic Sans MS; font-weight:bold; color:#000000; ">( dj steve-0 playing past, present, and future hits ) Station 3 is ( ON AIR ) ( http://fuseRADIO.com.au/s3.pls )</Text></Message><Message Date="5/11/2004" Time="10:40:24 PM" DateTime="2004-11-05T11:40:24.389Z" SessionID="14"><From><User FriendlyName="iD.Syd // steve-0 | Status: Here| SMGL 2 Morro :) Bringing Video Camera 2 Report on it :)"/></From><To><User FriendlyName="James*-) I think therefore I am... I think."/></To><Text Style="font-family:Comic Sans MS; font-weight:bold; color:#000000; ">hey james</Text></Message><Message Date="7/11/2004" Time="11:43:52 AM" DateTime="2004-11-07T00:43:52.704Z" SessionID="15"><From><User FriendlyName="iD.Syd // steve-0 | Status: Home | TAKESHIS CASTLE IS SO FKN FUNNY BAHAHA!"/></From><To><User FriendlyName="James*-) I think therefore I am... I think."/></To><Text Style="font-family:Comic Sans MS; font-weight:bold; color:#000000; ">hey james</Text></Message><Message Date="7/11/2004" Time="11:43:54 AM" DateTime="2004-11-07T00:43:54.797Z" SessionID="15"><From><User FriendlyName="iD.Syd // steve-0 | Status: Home | TAKESHIS CASTLE IS SO FKN FUNNY BAHAHA!"/></From><To><User FriendlyName="James*-) I think therefore I am... I think."/></To><Text Style="font-family:Comic Sans MS; font-weight:bold; color:#000000; ">ur in yr 10 ye?</Text></Message><Message Date="7/11/2004" Time="11:43:59 AM" DateTime="2004-11-07T00:43:59.984Z" SessionID="15"><From><User FriendlyName="James*-) I think therefore I am... I think."/></From><To><User FriendlyName="iD.Syd // steve-0 | Status: Home | TAKESHIS CASTLE IS SO FKN FUNNY BAHAHA!"/></To><Text Style="font-family:Comic Sans MS; font-weight:bold; color:#000080; ">9</Text></Message><Message Date="7/11/2004" Time="11:44:04 AM" DateTime="2004-11-07T00:44:04.971Z" SessionID="15"><From><User FriendlyName="iD.Syd // steve-0 | Status: Home | TAKESHIS CASTLE IS SO FKN FUNNY BAHAHA!"/></From><To><User FriendlyName="James*-) I think therefore I am... I think."/></To><Text Style="font-family:Comic Sans MS; font-weight:bold; color:#000000; ">ah hokay</Text></Message><Message Date="7/11/2004" Time="11:44:25 AM" DateTime="2004-11-07T00:44:25.270Z" SessionID="15"><From><User FriendlyName="James*-) I think therefore I am... I think."/></From><To><User FriendlyName="iD.Syd // steve-0 | Status: Home | TAKESHIS CASTLE IS SO FKN FUNNY BAHAHA!"/></To><Text Style="font-family:Comic Sans MS; font-weight:bold; color:#000080; ">y?</Text></Message><Message Date="7/11/2004" Time="11:44:29 AM" DateTime="2004-11-07T00:44:29.807Z" SessionID="16"><From><User FriendlyName="iD.Syd // steve-0 | Status: Home | TAKESHIS CASTLE IS SO FKN FUNNY BAHAHA!"/></From><To><User FriendlyName="James*-) I think therefore I am... I think."/></To><Text Style="font-family:Comic Sans MS; font-weight:bold; color:#000000; ">wonderinz</Text></Message><Message Date="7/11/2004" Time="11:44:34 AM" DateTime="2004-11-07T00:44:34.113Z" SessionID="16"><From><User FriendlyName="James*-) I think therefore I am... I think."/></From><To><User FriendlyName="iD.Syd // steve-0 | Status: Home | TAKESHIS CASTLE IS SO FKN FUNNY BAHAHA!"/></To><Text Style="font-family:Comic Sans MS; font-weight:bold; color:#000080; ">uhh</Text></Message><Message Date="7/11/2004" Time="11:44:35 AM" DateTime="2004-11-07T00:44:35.815Z" SessionID="16"><From><User FriendlyName="James*-) I think therefore I am... I think."/></From><To><User FriendlyName="iD.Syd // steve-0 | Status: Home | TAKESHIS CASTLE IS SO FKN FUNNY BAHAHA!"/></To><Text Style="font-family:Comic Sans MS; font-weight:bold; color:#000080; ">ok weird</Text></Message><Message Date="7/11/2004" Time="11:44:48 AM" DateTime="2004-11-07T00:44:48.464Z" SessionID="17"><From><User FriendlyName="iD.Syd // steve-0 | Status: Home | TAKESHIS CASTLE IS SO FKN FUNNY BAHAHA!"/></From><To><User FriendlyName="James*-) I think therefore I am... I think."/></To><Text Style="font-family:Comic Sans MS; font-weight:bold; color:#000000; ">cause like i thort u were in ur 10</Text></Message><Message Date="7/11/2004" Time="11:44:49 AM" DateTime="2004-11-07T00:44:49.585Z" SessionID="17"><From><User FriendlyName="iD.Syd // steve-0 | Status: Home | TAKESHIS CASTLE IS SO FKN FUNNY BAHAHA!"/></From><To><User FriendlyName="James*-) I think therefore I am... I think."/></To><Text Style="font-family:Comic Sans MS; font-weight:bold; color:#000000; ">yr*</Text></Message><Message Date="7/11/2004" Time="11:44:55 AM" DateTime="2004-11-07T00:44:55.223Z" SessionID="17"><From><User FriendlyName="iD.Syd // steve-0 | Status: Home | TAKESHIS CASTLE IS SO FKN FUNNY BAHAHA!"/></From><To><User FriendlyName="James*-) I think therefore I am... I think."/></To><Text Style="font-family:Comic Sans MS; font-weight:bold; color:#000000; ">cause we got exams monday</Text></Message><Message Date="7/11/2004" Time="6:12:44 PM" DateTime="2004-11-07T07:12:44.781Z" SessionID="18"><From><User FriendlyName="iD.Syd // steve-0 | Status: Puting Movies onto my server"/></From><To><User FriendlyName="James*-) I think therefore I am... I think."/></To><Text Style="font-family:Comic Sans MS; font-weight:bold; color:#000000; ">3.5" IDE Hard Drive-Seagate-Barracuda 7200.7 Plus 200GB 7200rpm Ultra ATA/100 8mb Buffer  
Points Value:8273   Award Points:154  
Price(Inc.GST):$167.20  
</Text></Message><Message Date="7/11/2004" Time="6:12:44 PM" DateTime="2004-11-07T07:12:44.811Z" SessionID="18"><From><User FriendlyName="iD.Syd // steve-0 | Status: Puting Movies onto my server"/></From><To><User FriendlyName="James*-) I think therefore I am... I think."/></To><Text Style="font-family:Comic Sans MS; font-weight:bold; color:#000000; ">whops</Text></Message><Message Date="7/11/2004" Time="6:12:49 PM" DateTime="2004-11-07T07:12:49.909Z" SessionID="18"><From><User FriendlyName="iD.Syd // steve-0 | Status: Puting Movies onto my server"/></From><To><User FriendlyName="James*-) I think therefore I am... I think."/></To><Text Style="font-family:Comic Sans MS; font-weight:bold; color:#000000; ">( dj steve-0? ) Station 3 ( ON AIR ) ( http://fuseRADIO.com.au/s3.pls )</Text></Message><Message Date="14/11/2004" Time="10:59:32 AM" DateTime="2004-11-13T23:59:32.130Z" SessionID="19"><From><User FriendlyName="iD.Syd // steve-0 | AT ISTAR!"/></From><To><User FriendlyName="James*-) I think therefore I am... I think."/></To><Text Style="font-family:MS Shell Dlg; color:#000000; ">ey james</Text></Message><Message Date="14/11/2004" Time="10:59:36 AM" DateTime="2004-11-13T23:59:36.516Z" SessionID="19"><From><User FriendlyName="iD.Syd // steve-0 | AT ISTAR!"/></From><To><User FriendlyName="James*-) I think therefore I am... I think."/></To><Text Style="font-family:MS Shell Dlg; color:#000000; ">wanna come down 2 the city?</Text></Message><Message Date="14/11/2004" Time="10:59:41 AM" DateTime="2004-11-13T23:59:41.253Z" SessionID="19"><From><User FriendlyName="iD.Syd // steve-0 | AT ISTAR!"/></From><To><User FriendlyName="James*-) I think therefore I am... I think."/></To><Text Style="font-family:MS Shell Dlg; color:#000000; ">come 2 a net cafe</Text></Message><Message Date="14/11/2004" Time="11:26:00 AM" DateTime="2004-11-14T00:26:00.954Z" SessionID="19"><From><User FriendlyName="James*-) I think therefore I am... I think."/></From><To><User FriendlyName="iD.Syd // steve-0 | AT ISTAR!"/></To><Text Style="font-family:Comic Sans MS; font-weight:bold; color:#000080; ">er,,h</Text></Message><Message Date="14/11/2004" Time="11:26:06 AM" DateTime="2004-11-14T00:26:06.162Z" SessionID="19"><From><User FriendlyName="James*-) I think therefore I am... I think."/></From><To><User FriendlyName="iD.Syd // steve-0 | AT ISTAR!"/></To><Text Style="font-family:Comic Sans MS; font-weight:bold; color:#000080; ">probly not :)</Text></Message><Message Date="14/11/2004" Time="7:54:35 PM" DateTime="2004-11-14T08:54:35.482Z" SessionID="20"><From><User FriendlyName="James*-)"/></From><To><User FriendlyName="iD.Syd // steve-0  :D"/></To><Text Style="font-family:Comic Sans MS; font-weight:bold; color:#000080; ">Hay man</Text></Message><Message Date="14/11/2004" Time="8:06:55 PM" DateTime="2004-11-14T09:06:55.636Z" SessionID="21"><From><User FriendlyName="iD.Syd // steve-0  :D"/></From><To><User FriendlyName="James*-)"/></To><Text Style="font-family:Comic Sans MS; font-weight:bold; color:#000000; ">hey dude</Text></Message><Message Date="14/11/2004" Time="8:07:15 PM" DateTime="2004-11-14T09:07:15.405Z" SessionID="21"><From><User FriendlyName="James*-)"/></From><To><User FriendlyName="iD.Syd // steve-0  :D"/></To><Text Style="font-family:Comic Sans MS; font-weight:bold; color:#000080; ">Hay Hay</Text></Message><Message Date="14/11/2004" Time="8:07:19 PM" DateTime="2004-11-14T09:07:19.401Z" SessionID="21"><From><User FriendlyName="James*-)"/></From><To><User FriendlyName="iD.Syd // steve-0  :D"/></To><Text Style="font-family:Comic Sans MS; font-weight:bold; color:#000080; ">Damn that chicks fine</Text></Message><Message Date="14/11/2004" Time="8:07:24 PM" DateTime="2004-11-14T09:07:24.618Z" SessionID="22"><From><User FriendlyName="iD.Syd // steve-0  :D"/></From><To><User FriendlyName="James*-)"/></To><Text Style="font-family:Comic Sans MS; font-weight:bold; color:#000000; ">rkn</Text></Message><Message Date="14/11/2004" Time="8:07:41 PM" DateTime="2004-11-14T09:07:41.142Z" SessionID="22"><From><User FriendlyName="James*-)"/></From><To><User FriendlyName="iD.Syd // steve-0  :D"/></To><Text Style="font-family:Comic Sans MS; font-weight:bold; color:#000080; ">ok now there so way u took that 1</Text></Message><Message Date="14/11/2004" Time="8:07:42 PM" DateTime="2004-11-14T09:07:42.063Z" SessionID="22"><From><User FriendlyName="James*-)"/></From><To><User FriendlyName="iD.Syd // steve-0  :D"/></To><Text Style="font-family:Comic Sans MS; font-weight:bold; color:#000080; ">lol</Text></Message><Message Date="14/11/2004" Time="8:07:44 PM" DateTime="2004-11-14T09:07:44.507Z" SessionID="22"><From><User FriendlyName="James*-)"/></From><To><User FriendlyName="iD.Syd // steve-0  :D"/></To><Text Style="font-family:Comic Sans MS; font-weight:bold; color:#000080; ">gtg play ET</Text></Message><Message Date="14/11/2004" Time="8:07:46 PM" DateTime="2004-11-14T09:07:46.770Z" SessionID="22"><From><User FriendlyName="James*-)"/></From><To><User FriendlyName="iD.Syd // steve-0  :D"/></To><Text Style="font-family:Comic Sans MS; font-weight:bold; color:#000080; ">if u wanna come</Text></Message><Message Date="14/11/2004" Time="8:07:47 PM" DateTime="2004-11-14T09:07:47.120Z" SessionID="22"><From><User FriendlyName="James*-)"/></From><To><User FriendlyName="iD.Syd // steve-0  :D"/></To><Text Style="font-family:Comic Sans MS; font-weight:bold; color:#000080; ">203.17.15.208:20222</Text></Message><Message Date="16/11/2004" Time="6:51:15 PM" DateTime="2004-11-16T07:51:15.287Z" SessionID="23"><From><User FriendlyName="James*-) Im not as think as you drunk I am..."/></From><To><User FriendlyName="iD.Syd // steve-0  :D | HL2 RELEASED SOON OMG!!!"/></To><Text Style="font-family:Comic Sans MS; font-weight:bold; color:#000080; ">oi im pretty sure its 7:30</Text></Message><Message Date="16/11/2004" Time="6:51:15 PM" DateTime="2004-11-16T07:51:15.788Z" SessionID="23"><From><User FriendlyName="iD.Syd // steve-0  :D | HL2 RELEASED SOON OMG!!!"/></From><To><User FriendlyName="James*-) Im not as think as you drunk I am..."/></To><Text Style="font-family:Comic Sans MS; font-weight:bold; color:#000000; ">S ALMOST HERE!</Text></Message><Message Date="16/11/2004" Time="6:51:20 PM" DateTime="2004-11-16T07:51:20.875Z" SessionID="24"><From><User FriendlyName="iD.Syd // steve-0  :D | HL2 RELEASED SOON OMG!!!"/></From><To><User FriendlyName="James*-) Im not as think as you drunk I am..."/></To><Text Style="font-family:Comic Sans MS; font-weight:bold; color:#000000; ">http://www.users.on.net/~etchells/hl2/</Text></Message><Message Date="16/11/2004" Time="6:51:21 PM" DateTime="2004-11-16T07:51:21.015Z" SessionID="24"><From><User FriendlyName="iD.Syd // steve-0  :D | HL2 RELEASED SOON OMG!!!"/></From><To><User FriendlyName="James*-) Im not as think as you drunk I am..."/></To><Text Style="font-family:Comic Sans MS; font-weight:bold; color:#000000; ">OMG!!!</Text></Message><Message Date="16/11/2004" Time="6:51:42 PM" DateTime="2004-11-16T07:51:42.666Z" SessionID="24"><From><User FriendlyName="James*-) Im not as think as you drunk I am..."/></From><To><User FriendlyName="iD.Syd // steve-0  :D | HL2 RELEASED SOON OMG!!!"/></To><Text Style="font-family:Comic Sans MS; font-weight:bold; color:#000080; ">:-O</Text></Message><Message Date="16/11/2004" Time="6:51:43 PM" DateTime="2004-11-16T07:51:43.157Z" SessionID="24"><From><User FriendlyName="James*-) Im not as think as you drunk I am..."/></From><To><User FriendlyName="iD.Syd // steve-0  :D | HL2 RELEASED SOON OMG!!!"/></To><Text Style="font-family:Comic Sans MS; font-weight:bold; color:#000080; ">:D</Text></Message><Message Date="16/11/2004" Time="6:51:44 PM" DateTime="2004-11-16T07:51:44.479Z" SessionID="24"><From><User FriendlyName="James*-) Im not as think as you drunk I am..."/></From><To><User FriendlyName="iD.Syd // steve-0  :D | HL2 RELEASED SOON OMG!!!"/></To><Text Style="font-family:Comic Sans MS; font-weight:bold; color:#000080; ">:D</Text></Message><Message Date="16/11/2004" Time="6:51:46 PM" DateTime="2004-11-16T07:51:46.992Z" SessionID="24"><From><User FriendlyName="iD.Syd // steve-0  :D | HL2 RELEASED SOON OMG!!!"/></From><To><User FriendlyName="James*-) Im not as think as you drunk I am..."/></To><Text Style="font-family:Comic Sans MS; font-weight:bold; color:#000000; ">OMG OMG!</Text></Message><Message Date="16/11/2004" Time="6:51:52 PM" DateTime="2004-11-16T07:51:52.661Z" SessionID="24"><From><User FriendlyName="iD.Syd // steve-0  :D | HL2 RELEASED SOON OMG!!!"/></From><To><User FriendlyName="James*-) Im not as think as you drunk I am..."/></To><Text Style="font-family:Comic Sans MS; font-weight:bold; color:#000000; ">I CANT WAIT OMG!!!</Text></Message><Message Date="16/11/2004" Time="6:52:02 PM" DateTime="2004-11-16T07:52:02.885Z" SessionID="24"><From><User FriendlyName="James*-) Im not as think as you drunk I am..."/></From><To><User FriendlyName="iD.Syd // steve-0  :D | HL2 RELEASED SOON OMG!!!"/></To><Text Style="font-family:Comic Sans MS; font-weight:bold; color:#000080; ">* minutes</Text></Message><Message Date="16/11/2004" Time="6:52:04 PM" DateTime="2004-11-16T07:52:04.267Z" SessionID="24"><From><User FriendlyName="James*-) Im not as think as you drunk I am..."/></From><To><User FriendlyName="iD.Syd // steve-0  :D | HL2 RELEASED SOON OMG!!!"/></To><Text Style="font-family:Comic Sans MS; font-weight:bold; color:#000080; ">8</Text></Message><Message Date="16/11/2004" Time="6:52:25 PM" DateTime="2004-11-16T07:52:25.087Z" SessionID="24"><From><User FriendlyName="iD.Syd // steve-0  :D | HL2 RELEASED SOON OMG!!!"/></From><To><User FriendlyName="James*-) Im not as think as you drunk I am..."/></To><Text Style="font-family:Comic Sans MS; font-weight:bold; color:#000000; ">&lt;Zmur&gt; HL2 RELEASED IN: 7mins 51secs !!!</Text></Message><Invitation Date="16/11/2004" Time="6:52:27 PM" DateTime="2004-11-16T07:52:27.901Z" SessionID="24"><From><User FriendlyName="James*-) Im not as think as you drunk I am..."/></From><File>C:\Documents and Settings\James O'Toole\Local Settings\Temporary Internet Files\Content.IE5\OPQRSTUV\6[1].jpg</File><Text Style="color:#545454; ">James*-) Im not as think as you drunk I am... sends C:\Documents and Settings\James O'Toole\Local Settings\Temporary Internet Files\Content.IE5\OPQRSTUV\6[1].jpg</Text></Invitation><Message Date="16/11/2004" Time="6:52:32 PM" DateTime="2004-11-16T07:52:32.097Z" SessionID="24"><From><User FriendlyName="iD.Syd // steve-0  :D | HL2 RELEASED SOON OMG!!!"/></From><To><User FriendlyName="James*-) Im not as think as you drunk I am..."/></To><Text Style="font-family:Comic Sans MS; font-weight:bold; color:#000000; ">no wait</Text></Message><Message Date="16/11/2004" Time="6:52:37 PM" DateTime="2004-11-16T07:52:37.775Z" SessionID="24"><From><User FriendlyName="James*-) Im not as think as you drunk I am..."/></From><To><User FriendlyName="iD.Syd // steve-0  :D | HL2 RELEASED SOON OMG!!!"/></To><Text Style="font-family:Comic Sans MS; font-weight:bold; color:#000080; ">7 minutes :D</Text></Message><Message Date="16/11/2004" Time="6:55:35 PM" DateTime="2004-11-16T07:55:35.171Z" SessionID="25"><From><User FriendlyName="iD.Syd // steve-0  :D | HL2 RELEASED SOON OMG!!!"/></From><To><User FriendlyName="James*-) Im not as think as you drunk I am..."/></To><Text Style="font-family:Comic Sans MS; font-weight:bold; color:#000000; ">OMG MAN ITS FINALLY HERE!</Text></Message><Message Date="16/11/2004" Time="6:55:39 PM" DateTime="2004-11-16T07:55:39.206Z" SessionID="25"><From><User FriendlyName="iD.Syd // steve-0  :D | HL2 RELEASED SOON OMG!!!"/></From><To><User FriendlyName="James*-) Im not as think as you drunk I am..."/></To><Text Style="font-family:Comic Sans MS; font-weight:bold; color:#000000; ">AFTER ALL THIS TIME</Text></Message><Message Date="16/11/2004" Time="6:55:52 PM" DateTime="2004-11-16T07:55:52.616Z" SessionID="25"><From><User FriendlyName="iD.Syd // steve-0  :D | HL2 RELEASED SOON OMG!!!"/></From><To><User FriendlyName="James*-) Im not as think as you drunk I am..."/></To><Text Style="font-family:Comic Sans MS; font-weight:bold; color:#000000; ">3 MINS!</Text></Message><Message Date="16/11/2004" Time="6:56:08 PM" DateTime="2004-11-16T07:56:08.098Z" SessionID="25"><From><User FriendlyName="James*-) Im not as think as you drunk I am..."/></From><To><User FriendlyName="iD.Syd // steve-0  :D | HL2 RELEASED SOON OMG!!!"/></To><Text Style="font-family:Comic Sans MS; font-weight:bold; color:#000080; ">ITS JUST SO BEAUTIFUL! :D</Text></Message><Message Date="16/11/2004" Time="6:56:18 PM" DateTime="2004-11-16T07:56:18.242Z" SessionID="26"><From><User FriendlyName="iD.Syd // steve-0  :D | HL2 RELEASED SOON OMG!!!"/></From><To><User FriendlyName="James*-) Im not as think as you drunk I am..."/></To><Text Style="font-family:Comic Sans MS; font-weight:bold; color:#000000; ">steam is getting hammered rofl</Text></Message><Message Date="16/11/2004" Time="6:56:28 PM" DateTime="2004-11-16T07:56:28.677Z" SessionID="26"><From><User FriendlyName="James*-) Im not as think as you drunk I am..."/></From><To><User FriendlyName="iD.Syd // steve-0  :D | HL2 RELEASED SOON OMG!!!"/></To><Text Style="font-family:Comic Sans MS; font-weight:bold; color:#000080; ">lol</Text></Message><Message Date="16/11/2004" Time="6:56:32 PM" DateTime="2004-11-16T07:56:32.463Z" SessionID="26"><From><User FriendlyName="James*-) Im not as think as you drunk I am..."/></From><To><User FriendlyName="iD.Syd // steve-0  :D | HL2 RELEASED SOON OMG!!!"/></To><Text Style="font-family:Comic Sans MS; font-weight:bold; color:#000080; ">CMON!</Text></Message><Message Date="16/11/2004" Time="6:56:37 PM" DateTime="2004-11-16T07:56:37.100Z" SessionID="26"><From><User FriendlyName="iD.Syd // steve-0  :D | HL2 RELEASED SOON OMG!!!"/></From><To><User FriendlyName="James*-) Im not as think as you drunk I am..."/></To><Text Style="font-family:Comic Sans MS; font-weight:bold; color:#000000; ">OMG OGM</Text></Message><Message Date="16/11/2004" Time="6:56:37 PM" DateTime="2004-11-16T07:56:37.841Z" SessionID="26"><From><User FriendlyName="James*-) Im not as think as you drunk I am..."/></From><To><User FriendlyName="iD.Syd // steve-0  :D | HL2 RELEASED SOON OMG!!!"/></To><Text Style="font-family:Comic Sans MS; font-weight:bold; color:#000080; ">im like jumping around the room</Text></Message><Message Date="16/11/2004" Time="6:56:41 PM" DateTime="2004-11-16T07:56:41.266Z" SessionID="26"><From><User FriendlyName="iD.Syd // steve-0  :D | HL2 RELEASED SOON OMG!!!"/></From><To><User FriendlyName="James*-) Im not as think as you drunk I am..."/></To><Text Style="font-family:Comic Sans MS; font-weight:bold; color:#000000; ">BAHHA!</Text></Message><Message Date="16/11/2004" Time="6:56:45 PM" DateTime="2004-11-16T07:56:45.071Z" SessionID="26"><From><User FriendlyName="iD.Syd // steve-0  :D | HL2 RELEASED SOON OMG!!!"/></From><To><User FriendlyName="James*-) Im not as think as you drunk I am..."/></To><Text Style="font-family:Comic Sans MS; font-weight:bold; color:#000000; ">OMG OMG OMG OMG COME ONNNN!</Text></Message><Message Date="16/11/2004" Time="6:56:46 PM" DateTime="2004-11-16T07:56:46.513Z" SessionID="26"><From><User FriendlyName="James*-) Im not as think as you drunk I am..."/></From><To><User FriendlyName="iD.Syd // steve-0  :D | HL2 RELEASED SOON OMG!!!"/></To><Text Style="font-family:Comic Sans MS; font-weight:bold; color:#000080; ">I just got back </Text></Message><Message Date="16/11/2004" Time="6:56:51 PM" DateTime="2004-11-16T07:56:51.480Z" SessionID="26"><From><User FriendlyName="James*-) Im not as think as you drunk I am..."/></From><To><User FriendlyName="iD.Syd // steve-0  :D | HL2 RELEASED SOON OMG!!!"/></To><Text Style="font-family:Comic Sans MS; font-weight:bold; color:#000080; ">i was outside</Text></Message><Message Date="16/11/2004" Time="6:57:18 PM" DateTime="2004-11-16T07:57:18.339Z" SessionID="26"><From><User FriendlyName="James*-) Im not as think as you drunk I am..."/></From><To><User FriendlyName="iD.Syd // steve-0  :D | HL2 RELEASED SOON OMG!!!"/></To><Text Style="font-family:Comic Sans MS; font-weight:bold; color:#000080; ">I ran down the back of the garden ( i have bout half and acre in my back yard) and back.</Text></Message><Message Date="16/11/2004" Time="6:57:26 PM" DateTime="2004-11-16T07:57:26.511Z" SessionID="26"><From><User FriendlyName="James*-) Im not as think as you drunk I am..."/></From><To><User FriendlyName="iD.Syd // steve-0  :D | HL2 RELEASED SOON OMG!!!"/></To><Text Style="font-family:Comic Sans MS; font-weight:bold; color:#000080; ">in about 20 seconds</Text></Message><Message Date="16/11/2004" Time="6:57:28 PM" DateTime="2004-11-16T07:57:28.814Z" SessionID="26"><From><User FriendlyName="iD.Syd // steve-0  :D | HL2 RELEASED SOON OMG!!!"/></From><To><User FriendlyName="James*-) Im not as think as you drunk I am..."/></To><Text Style="font-family:Comic Sans MS; font-weight:bold; color:#000000; ">nice</Text></Message><Message Date="16/11/2004" Time="6:57:33 PM" DateTime="2004-11-16T07:57:33.250Z" SessionID="26"><From><User FriendlyName="James*-) Im not as think as you drunk I am..."/></From><To><User FriendlyName="iD.Syd // steve-0  :D | HL2 RELEASED SOON OMG!!!"/></To><Text Style="font-family:Comic Sans MS; font-weight:bold; color:#000080; ">and im not a fast person</Text></Message><Message Date="16/11/2004" Time="6:57:35 PM" DateTime="2004-11-16T07:57:35.704Z" SessionID="26"><From><User FriendlyName="James*-) Im not as think as you drunk I am..."/></From><To><User FriendlyName="iD.Syd // steve-0  :D | HL2 RELEASED SOON OMG!!!"/></To><Text Style="font-family:Comic Sans MS; font-weight:bold; color:#000080; ">oi ill brb</Text></Message><Message Date="16/11/2004" Time="6:57:38 PM" DateTime="2004-11-16T07:57:38.288Z" SessionID="26"><From><User FriendlyName="iD.Syd // steve-0  :D | HL2 RELEASED SOON OMG!!!"/></From><To><User FriendlyName="James*-) Im not as think as you drunk I am..."/></To><Text Style="font-family:Comic Sans MS; font-weight:bold; color:#000000; ">WAIT</Text></Message><Message Date="16/11/2004" Time="6:57:39 PM" DateTime="2004-11-16T07:57:39.209Z" SessionID="26"><From><User FriendlyName="iD.Syd // steve-0  :D | HL2 RELEASED SOON OMG!!!"/></From><To><User FriendlyName="James*-) Im not as think as you drunk I am..."/></To><Text Style="font-family:Comic Sans MS; font-weight:bold; color:#000000; ">COME BACK</Text></Message><Message Date="16/11/2004" Time="6:57:39 PM" DateTime="2004-11-16T07:57:39.700Z" SessionID="26"><From><User FriendlyName="James*-) Im not as think as you drunk I am..."/></From><To><User FriendlyName="iD.Syd // steve-0  :D | HL2 RELEASED SOON OMG!!!"/></To><Text Style="font-family:Comic Sans MS; font-weight:bold; color:#000080; ">Need 2 do it again</Text></Message><Message Date="16/11/2004" Time="6:57:41 PM" DateTime="2004-11-16T07:57:41.162Z" SessionID="26"><From><User FriendlyName="iD.Syd // steve-0  :D | HL2 RELEASED SOON OMG!!!"/></From><To><User FriendlyName="James*-) Im not as think as you drunk I am..."/></To><Text Style="font-family:Comic Sans MS; font-weight:bold; color:#000000; ">COUNT DOWN!</Text></Message><Message Date="16/11/2004" Time="6:57:41 PM" DateTime="2004-11-16T07:57:41.743Z" SessionID="26"><From><User FriendlyName="James*-) Im not as think as you drunk I am..."/></From><To><User FriendlyName="iD.Syd // steve-0  :D | HL2 RELEASED SOON OMG!!!"/></To><Text Style="font-family:Comic Sans MS; font-weight:bold; color:#000080; ">lol</Text></Message><Message Date="16/11/2004" Time="6:57:48 PM" DateTime="2004-11-16T07:57:48.632Z" SessionID="26"><From><User FriendlyName="James*-) Im not as think as you drunk I am..."/></From><To><User FriendlyName="iD.Syd // steve-0  :D | HL2 RELEASED SOON OMG!!!"/></To><Text Style="font-family:Comic Sans MS; font-weight:bold; color:#000080; ">it will take 20 seconds</Text></Message><Message Date="16/11/2004" Time="6:57:56 PM" DateTime="2004-11-16T07:57:56.354Z" SessionID="26"><From><User FriendlyName="iD.Syd // steve-0  :D | HL2 RELEASED SOON OMG!!!"/></From><To><User FriendlyName="James*-) Im not as think as you drunk I am..."/></To><Text Style="font-family:Comic Sans MS; font-weight:bold; color:#000000; ">no wait</Text></Message><Message Date="16/11/2004" Time="6:57:57 PM" DateTime="2004-11-16T07:57:57.455Z" SessionID="26"><From><User FriendlyName="iD.Syd // steve-0  :D | HL2 RELEASED SOON OMG!!!"/></From><To><User FriendlyName="James*-) Im not as think as you drunk I am..."/></To><Text Style="font-family:Comic Sans MS; font-weight:bold; color:#000000; ">:P</Text></Message><Message Date="16/11/2004" Time="6:58:26 PM" DateTime="2004-11-16T07:58:26.327Z" SessionID="26"><From><User FriendlyName="James*-) Im not as think as you drunk I am..."/></From><To><User FriendlyName="iD.Syd // steve-0  :D | HL2 RELEASED SOON OMG!!!"/></To><Text Style="font-family:Comic Sans MS; font-weight:bold; color:#000080; ">ok</Text></Message><Message Date="16/11/2004" Time="6:58:27 PM" DateTime="2004-11-16T07:58:27.088Z" SessionID="26"><From><User FriendlyName="James*-) Im not as think as you drunk I am..."/></From><To><User FriendlyName="iD.Syd // steve-0  :D | HL2 RELEASED SOON OMG!!!"/></To><Text Style="font-family:Comic Sans MS; font-weight:bold; color:#000080; ">back</Text></Message><Message Date="16/11/2004" Time="6:58:32 PM" DateTime="2004-11-16T07:58:32.786Z" SessionID="26"><From><User FriendlyName="James*-) Im not as think as you drunk I am..."/></From><To><User FriendlyName="iD.Syd // steve-0  :D | HL2 RELEASED SOON OMG!!!"/></To><Text Style="font-family:Comic Sans MS; font-weight:bold; color:#000080; ">1:40</Text></Message><Message Date="16/11/2004" Time="6:59:10 PM" DateTime="2004-11-16T07:59:10.350Z" SessionID="26"><From><User FriendlyName="James*-) Im not as think as you drunk I am..."/></From><To><User FriendlyName="iD.Syd // steve-0  :D | HL2 RELEASED SOON OMG!!!"/></To><Text Style="font-family:Comic Sans MS; font-weight:bold; color:#000080; ">DUDE!</Text></Message><Message Date="16/11/2004" Time="6:59:13 PM" DateTime="2004-11-16T07:59:13.725Z" SessionID="26"><From><User FriendlyName="James*-) Im not as think as you drunk I am..."/></From><To><User FriendlyName="iD.Syd // steve-0  :D | HL2 RELEASED SOON OMG!!!"/></To><Text Style="font-family:Comic Sans MS; font-weight:bold; color:#000080; ">1:00 :D</Text></Message><Message Date="16/11/2004" Time="6:59:20 PM" DateTime="2004-11-16T07:59:20.194Z" SessionID="26"><From><User FriendlyName="iD.Syd // steve-0  :D | HL2 RELEASED SOON OMG!!!"/></From><To><User FriendlyName="James*-) Im not as think as you drunk I am..."/></To><Text Style="font-family:Comic Sans MS; font-weight:bold; color:#000000; ">OMG NO!</Text></Message><Message Date="16/11/2004" Time="6:59:21 PM" DateTime="2004-11-16T07:59:21.366Z" SessionID="26"><From><User FriendlyName="iD.Syd // steve-0  :D | HL2 RELEASED SOON OMG!!!"/></From><To><User FriendlyName="James*-) Im not as think as you drunk I am..."/></To><Text Style="font-family:Comic Sans MS; font-weight:bold; color:#000000; ">ITS OUT</Text></Message><Message Date="16/11/2004" Time="6:59:22 PM" DateTime="2004-11-16T07:59:22.227Z" SessionID="26"><From><User FriendlyName="iD.Syd // steve-0  :D | HL2 RELEASED SOON OMG!!!"/></From><To><User FriendlyName="James*-) Im not as think as you drunk I am..."/></To><Text Style="font-family:Comic Sans MS; font-weight:bold; color:#000000; ">D:</Text></Message><Message Date="16/11/2004" Time="6:59:31 PM" DateTime="2004-11-16T07:59:31.120Z" SessionID="26"><From><User FriendlyName="James*-) Im not as think as you drunk I am..."/></From><To><User FriendlyName="iD.Syd // steve-0  :D | HL2 RELEASED SOON OMG!!!"/></To><Text Style="font-family:Comic Sans MS; font-weight:bold; color:#000080; ">:-O</Text></Message><Message Date="16/11/2004" Time="6:59:33 PM" DateTime="2004-11-16T07:59:33.203Z" SessionID="26"><From><User FriendlyName="James*-) Im not as think as you drunk I am..."/></From><To><User FriendlyName="iD.Syd // steve-0  :D | HL2 RELEASED SOON OMG!!!"/></To><Text Style="font-family:Comic Sans MS; font-weight:bold; color:#000080; ">wHERE!</Text></Message><Message Date="16/11/2004" Time="6:59:40 PM" DateTime="2004-11-16T07:59:40.503Z" SessionID="27"><From><User FriendlyName="iD.Syd // steve-0  :D | HL2 RELEASED SOON OMG!!!"/></From><To><User FriendlyName="James*-) Im not as think as you drunk I am..."/></To><Text Style="font-family:Comic Sans MS; font-weight:bold; color:#000000; ">I restarts steam</Text></Message><Message Date="16/11/2004" Time="6:59:44 PM" DateTime="2004-11-16T07:59:44.970Z" SessionID="27"><From><User FriendlyName="James*-) Im not as think as you drunk I am..."/></From><To><User FriendlyName="iD.Syd // steve-0  :D | HL2 RELEASED SOON OMG!!!"/></To><Text Style="font-family:Comic Sans MS; font-weight:bold; color:#000080; ">ok</Text></Message><Message Date="16/11/2004" Time="6:59:47 PM" DateTime="2004-11-16T07:59:47.043Z" SessionID="27"><From><User FriendlyName="James*-) Im not as think as you drunk I am..."/></From><To><User FriendlyName="iD.Syd // steve-0  :D | HL2 RELEASED SOON OMG!!!"/></To><Text Style="font-family:Comic Sans MS; font-weight:bold; color:#000080; ">doing now</Text></Message><Message Date="16/11/2004" Time="6:59:48 PM" DateTime="2004-11-16T07:59:48.675Z" SessionID="27"><From><User FriendlyName="James*-) Im not as think as you drunk I am..."/></From><To><User FriendlyName="iD.Syd // steve-0  :D | HL2 RELEASED SOON OMG!!!"/></To><Text Style="font-family:Comic Sans MS; font-weight:bold; color:#000080; ">30 seconds</Text></Message><Message Date="16/11/2004" Time="7:01:35 PM" DateTime="2004-11-16T08:01:35.859Z" SessionID="28"><From><User FriendlyName="iD.Syd // steve-0  :D | OMG OMG OMG YAYY!"/></From><To><User FriendlyName="James*-)HALF LIFE 2 IS OUT!!!!!!!!!!!! :D"/></To><Text Style="font-family:Comic Sans MS; font-weight:bold; color:#000000; ">OMG MAN!</Text></Message><Message Date="16/11/2004" Time="7:01:36 PM" DateTime="2004-11-16T08:01:36.600Z" SessionID="28"><From><User FriendlyName="James*-)HALF LIFE 2 IS OUT!!!!!!!!!!!! :D"/></From><To><User FriendlyName="iD.Syd // steve-0  :D | OMG OMG OMG YAYY!"/></To><Text Style="font-family:Comic Sans MS; font-weight:bold; color:#000080; ">24 percent validated :D</Text></Message><Message Date="16/11/2004" Time="7:01:37 PM" DateTime="2004-11-16T08:01:37.121Z" SessionID="28"><From><User FriendlyName="iD.Syd // steve-0  :D | OMG OMG OMG YAYY!"/></From><To><User FriendlyName="James*-)HALF LIFE 2 IS OUT!!!!!!!!!!!! :D"/></To><Text Style="font-family:Comic Sans MS; font-weight:bold; color:#000000; ">ITS UPDATING</Text></Message><Message Date="16/11/2004" Time="7:01:40 PM" DateTime="2004-11-16T08:01:40.756Z" SessionID="28"><From><User FriendlyName="James*-)HALF LIFE 2 IS OUT!!!!!!!!!!!! :D"/></From><To><User FriendlyName="iD.Syd // steve-0  :D | OMG OMG OMG YAYY!"/></To><Text Style="font-family:Comic Sans MS; font-weight:bold; color:#000080; ">24</Text></Message><Message Date="16/11/2004" Time="7:01:42 PM" DateTime="2004-11-16T08:01:42.599Z" SessionID="28"><From><User FriendlyName="James*-)HALF LIFE 2 IS OUT!!!!!!!!!!!! :D"/></From><To><User FriendlyName="iD.Syd // steve-0  :D | OMG OMG OMG YAYY!"/></To><Text Style="font-family:Comic Sans MS; font-weight:bold; color:#000080; ">25:D</Text></Message><Message Date="16/11/2004" Time="7:01:45 PM" DateTime="2004-11-16T08:01:45.133Z" SessionID="28"><From><User FriendlyName="iD.Syd // steve-0  :D | OMG OMG OMG YAYY!"/></From><To><User FriendlyName="James*-)HALF LIFE 2 IS OUT!!!!!!!!!!!! :D"/></To><Text Style="font-family:Comic Sans MS; font-weight:bold; color:#000000; ">THIS IS FOR REAL!</Text></Message><Message Date="16/11/2004" Time="7:01:46 PM" DateTime="2004-11-16T08:01:46.124Z" SessionID="28"><From><User FriendlyName="iD.Syd // steve-0  :D | OMG OMG OMG YAYY!"/></From><To><User FriendlyName="James*-)HALF LIFE 2 IS OUT!!!!!!!!!!!! :D"/></To><Text Style="font-family:Comic Sans MS; font-weight:bold; color:#000000; ">FFS!</Text></Message><Message Date="16/11/2004" Time="7:01:49 PM" DateTime="2004-11-16T08:01:49.629Z" SessionID="28"><From><User FriendlyName="James*-)HALF LIFE 2 IS OUT!!!!!!!!!!!! :D"/></From><To><User FriendlyName="iD.Syd // steve-0  :D | OMG OMG OMG YAYY!"/></To><Text Style="font-family:Comic Sans MS; font-weight:bold; color:#000080; ">LOL</Text></Message><Message Date="16/11/2004" Time="7:01:50 PM" DateTime="2004-11-16T08:01:50.110Z" SessionID="28"><From><User FriendlyName="James*-)HALF LIFE 2 IS OUT!!!!!!!!!!!! :D"/></From><To><User FriendlyName="iD.Syd // steve-0  :D | OMG OMG OMG YAYY!"/></To><Text Style="font-family:Comic Sans MS; font-weight:bold; color:#000080; ">26</Text></Message><Message Date="16/11/2004" Time="7:01:50 PM" DateTime="2004-11-16T08:01:50.210Z" SessionID="28"><From><User FriendlyName="iD.Syd // steve-0  :D | OMG OMG OMG YAYY!"/></From><To><User FriendlyName="James*-)HALF LIFE 2 IS OUT!!!!!!!!!!!! :D"/></To><Text Style="font-family:Comic Sans MS; font-weight:bold; color:#000000; ">I hugs james</Text></Message><Message Date="16/11/2004" Time="7:01:52 PM" DateTime="2004-11-16T08:01:52.133Z" SessionID="28"><From><User FriendlyName="James*-)HALF LIFE 2 IS OUT!!!!!!!!!!!! :D"/></From><To><User FriendlyName="iD.Syd // steve-0  :D | OMG OMG OMG YAYY!"/></To><Text Style="font-family:Comic Sans MS; font-weight:bold; color:#000080; ">:D</Text></Message><Message Date="16/11/2004" Time="7:02:01 PM" DateTime="2004-11-16T08:02:01.847Z" SessionID="28"><From><User FriendlyName="James*-)HALF LIFE 2 IS OUT!!!!!!!!!!!! :D"/></From><To><User FriendlyName="iD.Syd // steve-0  :D | OMG OMG OMG YAYY!"/></To><Text Style="font-family:Comic Sans MS; font-weight:bold; color:#000080; ">&lt;&lt; Begins Crying&gt;&gt;</Text></Message><Message Date="16/11/2004" Time="7:02:09 PM" DateTime="2004-11-16T08:02:09.848Z" SessionID="28"><From><User FriendlyName="James*-)HALF LIFE 2 IS OUT!!!!!!!!!!!! :D"/></From><To><User FriendlyName="iD.Syd // steve-0  :D | OMG OMG OMG YAYY!"/></To><Text Style="font-family:Comic Sans MS; font-weight:bold; color:#000080; ">ITS JSUT SO BEAUTIFUL!</Text></Message><Message Date="16/11/2004" Time="7:02:14 PM" DateTime="2004-11-16T08:02:14.104Z" SessionID="28"><From><User FriendlyName="iD.Syd // steve-0  :D | OMG OMG OMG YAYY!"/></From><To><User FriendlyName="James*-)HALF LIFE 2 IS OUT!!!!!!!!!!!! :D"/></To><Text Style="font-family:Comic Sans MS; font-weight:bold; color:#000000; ">rkn</Text></Message><Message Date="16/11/2004" Time="7:02:15 PM" DateTime="2004-11-16T08:02:15.276Z" SessionID="28"><From><User FriendlyName="James*-)HALF LIFE 2 IS OUT!!!!!!!!!!!! :D"/></From><To><User FriendlyName="iD.Syd // steve-0  :D | OMG OMG OMG YAYY!"/></To><Text Style="font-family:Comic Sans MS; font-weight:bold; color:#000080; ">TO THE PCPP FORUMS!</Text></Message><Message Date="16/11/2004" Time="7:02:17 PM" DateTime="2004-11-16T08:02:17.088Z" SessionID="28"><From><User FriendlyName="James*-)HALF LIFE 2 IS OUT!!!!!!!!!!!! :D"/></From><To><User FriendlyName="iD.Syd // steve-0  :D | OMG OMG OMG YAYY!"/></To><Text Style="font-family:Comic Sans MS; font-weight:bold; color:#000080; ">oi</Text></Message><Message Date="16/11/2004" Time="7:02:24 PM" DateTime="2004-11-16T08:02:24.970Z" SessionID="28"><From><User FriendlyName="James*-)HALF LIFE 2 IS OUT!!!!!!!!!!!! :D"/></From><To><User FriendlyName="iD.Syd // steve-0  :D | OMG OMG OMG YAYY!"/></To><Text Style="font-family:Comic Sans MS; font-weight:bold; color:#000080; ">I might give it a lil overclcok eh?</Text></Message><Message Date="16/11/2004" Time="7:02:26 PM" DateTime="2004-11-16T08:02:26.061Z" SessionID="28"><From><User FriendlyName="iD.Syd // steve-0  :D | OMG OMG OMG YAYY!"/></From><To><User FriendlyName="James*-)HALF LIFE 2 IS OUT!!!!!!!!!!!! :D"/></To><Text Style="font-family:Comic Sans MS; font-weight:bold; color:#000000; ">27 percent</Text></Message><Message Date="16/11/2004" Time="7:02:40 PM" DateTime="2004-11-16T08:02:40.572Z" SessionID="28"><From><User FriendlyName="iD.Syd // steve-0  :D | OMG OMG OMG YAYY!"/></From><To><User FriendlyName="James*-)HALF LIFE 2 IS OUT!!!!!!!!!!!! :D"/></To><Text Style="font-family:Comic Sans MS; font-weight:bold; color:#000000; ">rkn</Text></Message><Message Date="16/11/2004" Time="7:03:17 PM" DateTime="2004-11-16T08:03:17.165Z" SessionID="28"><From><User FriendlyName="James*-)HALF LIFE 2 IS OUT!!!!!!!!!!!! :D"/></From><To><User FriendlyName="iD.Syd // steve-0  :D | OMG OMG OMG YAYY!"/></To><Text Style="font-family:Comic Sans MS; font-weight:bold; color:#000080; ">omg omg</Text></Message><Message Date="16/11/2004" Time="7:03:21 PM" DateTime="2004-11-16T08:03:21.521Z" SessionID="28"><From><User FriendlyName="iD.Syd // steve-0  :D | OMG OMG OMG YAYY!"/></From><To><User FriendlyName="James*-)HALF LIFE 2 IS OUT!!!!!!!!!!!! :D"/></To><Text Style="font-family:Comic Sans MS; font-weight:bold; color:#000000; ">DUDE</Text></Message><Message Date="16/11/2004" Time="7:03:24 PM" DateTime="2004-11-16T08:03:24.736Z" SessionID="28"><From><User FriendlyName="iD.Syd // steve-0  :D | OMG OMG OMG YAYY!"/></From><To><User FriendlyName="James*-)HALF LIFE 2 IS OUT!!!!!!!!!!!! :D"/></To><Text Style="font-family:Comic Sans MS; font-weight:bold; color:#000000; ">I CANT BELIVE ITS HERE</Text></Message><Message Date="16/11/2004" Time="7:03:26 PM" DateTime="2004-11-16T08:03:26.008Z" SessionID="28"><From><User FriendlyName="James*-)HALF LIFE 2 IS OUT!!!!!!!!!!!! :D"/></From><To><User FriendlyName="iD.Syd // steve-0  :D | OMG OMG OMG YAYY!"/></To><Text Style="font-family:Comic Sans MS; font-weight:bold; color:#000080; ">HURRY THE FUCK UP STEA&lt;!</Text></Message><Message Date="16/11/2004" Time="7:03:28 PM" DateTime="2004-11-16T08:03:28.101Z" SessionID="28"><From><User FriendlyName="James*-)HALF LIFE 2 IS OUT!!!!!!!!!!!! :D"/></From><To><User FriendlyName="iD.Syd // steve-0  :D | OMG OMG OMG YAYY!"/></To><Text Style="font-family:Comic Sans MS; font-weight:bold; color:#000080; ">m</Text></Message><Message Date="16/11/2004" Time="7:03:40 PM" DateTime="2004-11-16T08:03:40.358Z" SessionID="29"><From><User FriendlyName="iD.Syd // steve-0  :D | OMG OMG OMG YAYY!"/></From><To><User FriendlyName="James*-)HALF LIFE 2 IS OUT!!!!!!!!!!!! :D"/></To><Text Style="font-family:Comic Sans MS; font-weight:bold; color:#000000; ">im at 31 percent</Text></Message><Message Date="16/11/2004" Time="7:04:10 PM" DateTime="2004-11-16T08:04:10.031Z" SessionID="29"><From><User FriendlyName="James*-)HALF LIFE 2 IS OUT!!!!!!!!!!!! :D"/></From><To><User FriendlyName="iD.Syd // steve-0  :D | OMG OMG OMG YAYY!"/></To><Text Style="font-family:Comic Sans MS; font-weight:bold; color:#000080; ">Me 2 :)</Text></Message><Message Date="19/11/2004" Time="4:26:23 PM" DateTime="2004-11-19T05:26:23.601Z" SessionID="30"><From><User FriendlyName="James*-)HALF LIFE 2 IS OUT!!!!!!!!!!!! :D"/></From><To><User FriendlyName="iD.Syd // steve-0  :D | In the words of Blink 182 &quot;it would be nice to have a blowjob :D&quot;"/></To><Text Style="font-family:Comic Sans MS; font-weight:bold; color:#000080; ">Hay steveo</Text></Message><Message Date="19/11/2004" Time="4:26:28 PM" DateTime="2004-11-19T05:26:28.447Z" SessionID="30"><From><User FriendlyName="James*-)HALF LIFE 2 IS OUT!!!!!!!!!!!! :D"/></From><To><User FriendlyName="iD.Syd // steve-0  :D | In the words of Blink 182 &quot;it would be nice to have a blowjob :D&quot;"/></To><Text Style="font-family:Comic Sans MS; font-weight:bold; color:#000080; ">Hows HL2 Goin?</Text></Message><Invitation Date="21/11/2004" Time="5:53:30 PM" DateTime="2004-11-21T06:53:30.836Z" SessionID="31"><From><User FriendlyName="James*-)HALF LIFE 2 IS OUT!!!!!!!!!!!! :D"/></From><Application>an audio conversation</Application><Text Style="color:#545454; ">You have invited iD.Syd // steve-0  :D | Sgl was cooooooool :D to start an audio conversation. Please wait for a response, or Cancel (Alt+Q) the pending invitation.</Text></Invitation><Message Date="21/11/2004" Time="5:53:35 PM" DateTime="2004-11-21T06:53:35.953Z" SessionID="31"><From><User FriendlyName="James*-)HALF LIFE 2 IS OUT!!!!!!!!!!!! :D"/></From><To><User FriendlyName="iD.Syd // steve-0  :D | Sgl was cooooooool :D"/></To><Text Style="font-family:Comic Sans MS; font-weight:bold; color:#000080; ">hay</Text></Message><Message Date="21/11/2004" Time="5:53:59 PM" DateTime="2004-11-21T06:53:59.707Z" SessionID="31"><From><User FriendlyName="James*-)HALF LIFE 2 IS OUT!!!!!!!!!!!! :D"/></From><To><User FriendlyName="iD.Syd // steve-0  :D | Sgl was cooooooool :D"/></To><Text Style="font-family:Comic Sans MS; font-weight:bold; color:#000080; ">U there steveo?</Text></Message><Message Date="21/11/2004" Time="6:20:37 PM" DateTime="2004-11-21T07:20:37.274Z" SessionID="32"><From><User FriendlyName="iD.Syd // steve-0  :D | Sgl was cooooooool :D"/></From><To><User FriendlyName="James*-)HALF LIFE 2 IS OUT!!!!!!!!!!!! :D"/></To><Text Style="font-family:Comic Sans MS; font-weight:bold; color:#000000; ">now i am</Text></Message><Message Date="21/11/2004" Time="6:21:02 PM" DateTime="2004-11-21T07:21:02.060Z" SessionID="32"><From><User FriendlyName="James*-)HALF LIFE 2 IS OUT!!!!!!!!!!!! :D"/></From><To><User FriendlyName="iD.Syd // steve-0  :D | Sgl was cooooooool :D"/></To><Text Style="font-family:Comic Sans MS; font-weight:bold; color:#000080; ">ok</Text></Message><Message Date="21/11/2004" Time="6:21:07 PM" DateTime="2004-11-21T07:21:07.888Z" SessionID="32"><From><User FriendlyName="James*-)HALF LIFE 2 IS OUT!!!!!!!!!!!! :D"/></From><To><User FriendlyName="iD.Syd // steve-0  :D | Sgl was cooooooool :D"/></To><Text Style="font-family:Comic Sans MS; font-weight:bold; color:#000080; ">where r u in HL2</Text></Message><Message Date="21/11/2004" Time="6:21:11 PM" DateTime="2004-11-21T07:21:11.474Z" SessionID="32"><From><User FriendlyName="iD.Syd // steve-0  :D | Sgl was cooooooool :D"/></From><To><User FriendlyName="James*-)HALF LIFE 2 IS OUT!!!!!!!!!!!! :D"/></To><Text Style="font-family:Comic Sans MS; font-weight:bold; color:#000000; ">umm</Text></Message><Message Date="21/11/2004" Time="6:21:26 PM" DateTime="2004-11-21T07:21:26.545Z" SessionID="32"><From><User FriendlyName="iD.Syd // steve-0  :D | Sgl was cooooooool :D"/></From><To><User FriendlyName="James*-)HALF LIFE 2 IS OUT!!!!!!!!!!!! :D"/></To><Text Style="font-family:Comic Sans MS; font-weight:bold; color:#000000; ">im back at the start but like weeks later</Text></Message><Message Date="21/11/2004" Time="6:21:29 PM" DateTime="2004-11-21T07:21:29.900Z" SessionID="32"><From><User FriendlyName="James*-)HALF LIFE 2 IS OUT!!!!!!!!!!!! :D"/></From><To><User FriendlyName="iD.Syd // steve-0  :D | Sgl was cooooooool :D"/></To><Text Style="font-family:Comic Sans MS; font-weight:bold; color:#000080; ">how sicks the gravity gun</Text></Message><Message Date="21/11/2004" Time="6:21:33 PM" DateTime="2004-11-21T07:21:33.535Z" SessionID="32"><From><User FriendlyName="iD.Syd // steve-0  :D | Sgl was cooooooool :D"/></From><To><User FriendlyName="James*-)HALF LIFE 2 IS OUT!!!!!!!!!!!! :D"/></To><Text Style="font-family:Comic Sans MS; font-weight:bold; color:#000000; ">rkn ay</Text></Message><Message Date="21/11/2004" Time="6:21:45 PM" DateTime="2004-11-21T07:21:45.202Z" SessionID="32"><From><User FriendlyName="James*-)HALF LIFE 2 IS OUT!!!!!!!!!!!! :D"/></From><To><User FriendlyName="iD.Syd // steve-0  :D | Sgl was cooooooool :D"/></To><Text Style="font-family:Comic Sans MS; font-weight:bold; color:#000080; ">its rox</Text></Message><Message Date="21/11/2004" Time="6:21:55 PM" DateTime="2004-11-21T07:21:55.397Z" SessionID="32"><From><User FriendlyName="James*-)HALF LIFE 2 IS OUT!!!!!!!!!!!! :D"/></From><To><User FriendlyName="iD.Syd // steve-0  :D | Sgl was cooooooool :D"/></To><Text Style="font-family:Comic Sans MS; font-weight:bold; color:#000080; ">Im at the part with the buggy</Text></Message><Message Date="21/11/2004" Time="6:22:02 PM" DateTime="2004-11-21T07:22:02.888Z" SessionID="32"><From><User FriendlyName="iD.Syd // steve-0  :D | Sgl was cooooooool :D"/></From><To><User FriendlyName="James*-)HALF LIFE 2 IS OUT!!!!!!!!!!!! :D"/></To><Text Style="font-family:Comic Sans MS; font-weight:bold; color:#000000; ">passed that</Text></Message><Message Date="21/11/2004" Time="6:22:04 PM" DateTime="2004-11-21T07:22:04.971Z" SessionID="32"><From><User FriendlyName="James*-)HALF LIFE 2 IS OUT!!!!!!!!!!!! :D"/></From><To><User FriendlyName="iD.Syd // steve-0  :D | Sgl was cooooooool :D"/></To><Text Style="font-family:Comic Sans MS; font-weight:bold; color:#000080; ">I blew up the big flying thing</Text></Message><Message Date="21/11/2004" Time="6:22:07 PM" DateTime="2004-11-21T07:22:07.364Z" SessionID="32"><From><User FriendlyName="James*-)HALF LIFE 2 IS OUT!!!!!!!!!!!! :D"/></From><To><User FriendlyName="iD.Syd // steve-0  :D | Sgl was cooooooool :D"/></To><Text Style="font-family:Comic Sans MS; font-weight:bold; color:#000080; ">yeah i no</Text></Message><Message Date="21/11/2004" Time="6:22:13 PM" DateTime="2004-11-21T07:22:13.913Z" SessionID="32"><From><User FriendlyName="James*-)HALF LIFE 2 IS OUT!!!!!!!!!!!! :D"/></From><To><User FriendlyName="iD.Syd // steve-0  :D | Sgl was cooooooool :D"/></To><Text Style="font-family:Comic Sans MS; font-weight:bold; color:#000080; ">im not that far</Text></Message><Message Date="21/11/2004" Time="6:22:22 PM" DateTime="2004-11-21T07:22:22.546Z" SessionID="32"><From><User FriendlyName="James*-)HALF LIFE 2 IS OUT!!!!!!!!!!!! :D"/></From><To><User FriendlyName="iD.Syd // steve-0  :D | Sgl was cooooooool :D"/></To><Text Style="font-family:Comic Sans MS; font-weight:bold; color:#000080; ">My rams so sahzbo</Text></Message><Message Date="21/11/2004" Time="6:22:26 PM" DateTime="2004-11-21T07:22:26.562Z" SessionID="33"><From><User FriendlyName="iD.Syd // steve-0  :D | Sgl was cooooooool :D"/></From><To><User FriendlyName="James*-)HALF LIFE 2 IS OUT!!!!!!!!!!!! :D"/></To><Text Style="font-family:Comic Sans MS; font-weight:bold; color:#000000; ">:P</Text></Message><Message Date="21/11/2004" Time="8:37:48 PM" DateTime="2004-11-21T09:37:48.751Z" SessionID="34"><From><User FriendlyName="iD.Syd // steve-0  :D | Sgl was cooooooool :D"/></From><To><User FriendlyName="James*-) I sure hope thats glue in my ear....."/></To><Text Style="font-family:Comic Sans MS; font-weight:bold; color:#000000; ">hey</Text></Message><Message Date="21/11/2004" Time="8:37:54 PM" DateTime="2004-11-21T09:37:54.679Z" SessionID="34"><From><User FriendlyName="James*-) I sure hope thats glue in my ear....."/></From><To><User FriendlyName="iD.Syd // steve-0  :D | Sgl was cooooooool :D"/></To><Text Style="font-family:Comic Sans MS; font-weight:bold; color:#000080; ">Hay Hay</Text></Message><Message Date="21/11/2004" Time="8:37:59 PM" DateTime="2004-11-21T09:37:59.506Z" SessionID="35"><From><User FriendlyName="iD.Syd // steve-0  :D | Sgl was cooooooool :D"/></From><To><User FriendlyName="James*-) I sure hope thats glue in my ear....."/></To><Text Style="font-family:Comic Sans MS; font-weight:bold; color:#000000; ">sup?</Text></Message><Message Date="21/11/2004" Time="8:38:13 PM" DateTime="2004-11-21T09:38:13.016Z" SessionID="35"><From><User FriendlyName="James*-) I sure hope thats glue in my ear....."/></From><To><User FriendlyName="iD.Syd // steve-0  :D | Sgl was cooooooool :D"/></To><Text Style="font-family:Comic Sans MS; font-weight:bold; color:#000080; ">Kinky MSN convos</Text></Message><Message Date="21/11/2004" Time="8:38:29 PM" DateTime="2004-11-21T09:38:29.870Z" SessionID="36"><From><User FriendlyName="iD.Syd // steve-0  :D | Sgl was cooooooool :D"/></From><To><User FriendlyName="James*-) I sure hope thats glue in my ear....."/></To><Text Style="font-family:Comic Sans MS; font-weight:bold; color:#000000; ">:P</Text></Message><Message Date="21/11/2004" Time="8:38:29 PM" DateTime="2004-11-21T09:38:29.930Z" SessionID="36"><From><User FriendlyName="iD.Syd // steve-0  :D | Sgl was cooooooool :D"/></From><To><User FriendlyName="James*-) I sure hope thats glue in my ear....."/></To><Text Style="font-family:Comic Sans MS; font-weight:bold; color:#000000; ">bbl</Text></Message><Message Date="22/11/2004" Time="4:46:40 PM" DateTime="2004-11-22T05:46:40.378Z" SessionID="37"><From><User FriendlyName="James*-) I sure hope thats glue in my ear....."/></From><To><User FriendlyName="iD.Syd // steve-0  :D | I don't need this shit, You stupid s..."/></To><Text Style="font-family:Comic Sans MS; font-weight:bold; color:#000080; ">hay</Text></Message><Message Date="22/11/2004" Time="4:46:45 PM" DateTime="2004-11-22T05:46:45.876Z" SessionID="38"><From><User FriendlyName="iD.Syd // steve-0  :D | I don't need this shit, You stupid s..."/></From><To><User FriendlyName="James*-) I sure hope thats glue in my ear....."/></To><Text Style="font-family:Comic Sans MS; font-weight:bold; color:#000000; ">hihi</Text></Message><Invitation Date="22/11/2004" Time="4:46:53 PM" DateTime="2004-11-22T05:46:53.307Z" SessionID="38"><From><User FriendlyName="James*-) I sure hope thats glue in my ear....."/></From><Application>an audio conversation</Application><Text Style="color:#545454; ">You have invited iD.Syd // steve-0  :D | I don't need this shit, You stupid s... to start an audio conversation. Please wait for a response, or Cancel (Alt+Q) the pending invitation.</Text></Invitation><InvitationResponse Date="22/11/2004" Time="4:47:01 PM" DateTime="2004-11-22T05:47:01.218Z" SessionID="38"><From><User FriendlyName="iD.Syd // steve-0  :D | I don't need this shit, You stupid s..."/></From><Application>an audio conversation</Application><Text Style="color:#800000; ">iD.Syd // steve-0  :D | I don't need this shit, You stupid s... has declined your invitation to start an audio conversation.</Text></InvitationResponse><Message Date="22/11/2004" Time="4:47:03 PM" DateTime="2004-11-22T05:47:03.141Z" SessionID="38"><From><User FriendlyName="iD.Syd // steve-0  :D | I don't need this shit, You stupid s..."/></From><To><User FriendlyName="James*-) I sure hope thats glue in my ear....."/></To><Text Style="font-family:Comic Sans MS; font-weight:bold; color:#000000; ">bbl</Text></Message><Message Date="22/11/2004" Time="4:47:03 PM" DateTime="2004-11-22T05:47:03.571Z" SessionID="38"><From><User FriendlyName="James*-) I sure hope thats glue in my ear....."/></From><To><User FriendlyName="iD.Syd // steve-0  :D | I don't need this shit, You stupid s..."/></To><Text Style="font-family:Comic Sans MS; font-weight:bold; color:#000080; ">ohhh</Text></Message><Message Date="22/11/2004" Time="5:32:45 PM" DateTime="2004-11-22T06:32:45.534Z" SessionID="39"><From><User FriendlyName="James*-) I sure hope thats glue in my ear....."/></From><To><User FriendlyName="iD.Syd // steve-0  :D | I don't need this shit, You stupid s..."/></To><Text Style="font-family:Comic Sans MS; font-weight:bold; color:#000080; ">U there?</Text></Message><Message Date="22/11/2004" Time="5:34:17 PM" DateTime="2004-11-22T06:34:17.687Z" SessionID="40"><From><User FriendlyName="James*-) I sure hope thats glue in my ear....."/></From><To><User FriendlyName="iD.Syd // steve-0  :D | I don't need this shit, You stupid s..."/></To><Text Style="font-family:Comic Sans MS; font-weight:bold; color:#000080; ">??</Text></Message><Message Date="25/11/2004" Time="8:20:48 PM" DateTime="2004-11-25T09:20:48.911Z" SessionID="41"><From><User FriendlyName="James*-) You got me a GUN RACK! a GUN RACK! I dont even own A gun, let alone MANY guns which would nessecitate an entire RACK!"/></From><To><User FriendlyName="iD.Syd // steve-0  :D | NEW EVANESCENCE ALBUM ROCKORZ MY SOXORS!"/></To><Text Style="font-family:Comic Sans MS; font-weight:bold; color:#000080; ">evanesance ^o)</Text></Message><Message Date="25/11/2004" Time="8:22:42 PM" DateTime="2004-11-25T09:22:42.024Z" SessionID="42"><From><User FriendlyName="iD.Syd // steve-0  :D | NEW EVANESCENCE ALBUM ROCKORZ MY SOXORS!"/></From><To><User FriendlyName="James*-) You got me a GUN RACK! a GUN RACK! I dont even own A gun, let alone MANY guns which would nessecitate an entire RACK!"/></To><Text Style="font-family:Comic Sans MS; font-weight:bold; color:#000000; ">yeh</Text></Message><Message Date="25/11/2004" Time="8:22:44 PM" DateTime="2004-11-25T09:22:44.387Z" SessionID="42"><From><User FriendlyName="iD.Syd // steve-0  :D | NEW EVANESCENCE ALBUM ROCKORZ MY SOXORS!"/></From><To><User FriendlyName="James*-) You got me a GUN RACK! a GUN RACK! I dont even own A gun, let alone MANY guns which would nessecitate an entire RACK!"/></To><Text Style="font-family:Comic Sans MS; font-weight:bold; color:#000000; ">dude i finished hl2</Text></Message><Message Date="25/11/2004" Time="8:22:46 PM" DateTime="2004-11-25T09:22:46.711Z" SessionID="42"><From><User FriendlyName="James*-) You got me a GUN RACK! a GUN RACK! I dont even own A gun, let alone MANY guns which would nessecitate an entire RACK!"/></From><To><User FriendlyName="iD.Syd // steve-0  :D | NEW EVANESCENCE ALBUM ROCKORZ MY SOXORS!"/></To><Text Style="font-family:Comic Sans MS; font-weight:bold; color:#000080; ">lol</Text></Message><Message Date="25/11/2004" Time="8:22:49 PM" DateTime="2004-11-25T09:22:49.084Z" SessionID="42"><From><User FriendlyName="James*-) You got me a GUN RACK! a GUN RACK! I dont even own A gun, let alone MANY guns which would nessecitate an entire RACK!"/></From><To><User FriendlyName="iD.Syd // steve-0  :D | NEW EVANESCENCE ALBUM ROCKORZ MY SOXORS!"/></To><Text Style="font-family:Comic Sans MS; font-weight:bold; color:#000080; ">good ending?</Text></Message><Message Date="25/11/2004" Time="8:22:52 PM" DateTime="2004-11-25T09:22:52.870Z" SessionID="43"><From><User FriendlyName="iD.Syd // steve-0  :D | NEW EVANESCENCE ALBUM ROCKORZ MY SOXORS!"/></From><To><User FriendlyName="James*-) You got me a GUN RACK! a GUN RACK! I dont even own A gun, let alone MANY guns which would nessecitate an entire RACK!"/></To><Text Style="font-family:Comic Sans MS; font-weight:bold; color:#000000; ">yeh man</Text></Message><Message Date="25/11/2004" Time="8:22:57 PM" DateTime="2004-11-25T09:22:57.066Z" SessionID="43"><From><User FriendlyName="iD.Syd // steve-0  :D | NEW EVANESCENCE ALBUM ROCKORZ MY SOXORS!"/></From><To><User FriendlyName="James*-) You got me a GUN RACK! a GUN RACK! I dont even own A gun, let alone MANY guns which would nessecitate an entire RACK!"/></To><Text Style="font-family:Comic Sans MS; font-weight:bold; color:#000000; ">gman comes back</Text></Message><Message Date="25/11/2004" Time="8:22:59 PM" DateTime="2004-11-25T09:22:59.369Z" SessionID="43"><From><User FriendlyName="iD.Syd // steve-0  :D | NEW EVANESCENCE ALBUM ROCKORZ MY SOXORS!"/></From><To><User FriendlyName="James*-) You got me a GUN RACK! a GUN RACK! I dont even own A gun, let alone MANY guns which would nessecitate an entire RACK!"/></To><Text Style="font-family:Comic Sans MS; font-weight:bold; color:#000000; ">:P</Text></Message><Message Date="25/11/2004" Time="8:23:12 PM" DateTime="2004-11-25T09:23:12.708Z" SessionID="43"><From><User FriendlyName="James*-) You got me a GUN RACK! a GUN RACK! I dont even own A gun, let alone MANY guns which would nessecitate an entire RACK!"/></From><To><User FriendlyName="iD.Syd // steve-0  :D | NEW EVANESCENCE ALBUM ROCKORZ MY SOXORS!"/></To><Text Style="font-family:Comic Sans MS; font-weight:bold; color:#000080; ">hehe cool</Text></Message><Message Date="26/11/2004" Time="9:06:46 PM" DateTime="2004-11-26T10:06:46.430Z" SessionID="44"><From><User FriendlyName="James:)Maybe Life is like a ride on a freeway, dodgin bullets while ur trying 2 find ur way....."/></From><To><User FriendlyName="iD.Syd // steve-0  :D | Lets go, dont wait, this nights almost over, honest, lets make,  this one last forever, FOREVER!! FOREVER"/></To><Text Style="font-family:Comic Sans MS; font-weight:bold; color:#000080; ">Hay Hay</Text></Message><Message Date="26/11/2004" Time="9:07:03 PM" DateTime="2004-11-26T10:07:03.474Z" SessionID="44"><From><User FriendlyName="iD.Syd // steve-0  :D | Lets go, dont wait, this nights almost over, honest, lets make,  this one last forever, FOREVER!! FOREVER"/></From><To><User FriendlyName="James:)Maybe Life is like a ride on a freeway, dodgin bullets while ur trying 2 find ur way....."/></To><Text Style="font-family:Comic Sans MS; font-weight:bold; color:#000000; ">yo</Text></Message><Message Date="26/11/2004" Time="9:07:42 PM" DateTime="2004-11-26T10:07:42.781Z" SessionID="45"><From><User FriendlyName="James:)Maybe Life is like a ride on a freeway, dodgin bullets while ur trying 2 find ur way....."/></From><To><User FriendlyName="iD.Syd // steve-0  :D | Lets go, dont wait, this nights almost over, honest, lets make,  this one last forever, FOREVER!! FOREVER"/></To><Text Style="font-family:Comic Sans MS; font-weight:bold; color:#000080; ">Im up2 the place with the crane and the buggy</Text></Message><Message Date="26/11/2004" Time="9:07:54 PM" DateTime="2004-11-26T10:07:54.167Z" SessionID="46"><From><User FriendlyName="iD.Syd // steve-0  :D | Lets go, dont wait, this nights almost over, honest, lets make,  this one last forever, FOREVER!! FOREVER"/></From><To><User FriendlyName="James:)Maybe Life is like a ride on a freeway, dodgin bullets while ur trying 2 find ur way....."/></To><Text Style="font-family:Comic Sans MS; font-weight:bold; color:#000000; ">i clocked it</Text></Message><Message Date="26/11/2004" Time="9:08:03 PM" DateTime="2004-11-26T10:08:03.230Z" SessionID="46"><From><User FriendlyName="James:)Maybe Life is like a ride on a freeway, dodgin bullets while ur trying 2 find ur way....."/></From><To><User FriendlyName="iD.Syd // steve-0  :D | Lets go, dont wait, this nights almost over, honest, lets make,  this one last forever, FOREVER!! FOREVER"/></To><Text Style="font-family:Comic Sans MS; font-weight:bold; color:#000080; ">???</Text></Message><Message Date="26/11/2004" Time="10:21:41 PM" DateTime="2004-11-26T11:21:41.383Z" SessionID="47"><From><User FriendlyName="iD.Syd // steve-0  :D | Lets go, dont wait, this nights almost over, honest, lets make,  this one last forever, FOREVER!! FOREVER"/></From><To><User FriendlyName="James:)Maybe Life is like a ride on a freeway, dodgin bullets while ur trying 2 find ur way....."/></To><Text Style="font-family:Comic Sans MS; font-weight:bold; color:#000000; ">JAMES</Text></Message><Message Date="26/11/2004" Time="10:21:50 PM" DateTime="2004-11-26T11:21:50.426Z" SessionID="47"><From><User FriendlyName="iD.Syd // steve-0  :D | Lets go, dont wait, this nights almost over, honest, lets make,  this one last forever, FOREVER!! FOREVER"/></From><To><User FriendlyName="James:)Maybe Life is like a ride on a freeway, dodgin bullets while ur trying 2 find ur way....."/></To><Text Style="font-family:Comic Sans MS; font-weight:bold; color:#000000; ">202.172.112.70:27030 kgo plz</Text></Message><Message Date="26/11/2004" Time="10:21:56 PM" DateTime="2004-11-26T11:21:56.265Z" SessionID="47"><From><User FriendlyName="James:)Maybe Life is like a ride on a freeway, dodgin bullets while ur trying 2 find ur way....."/></From><To><User FriendlyName="iD.Syd // steve-0  :D | Lets go, dont wait, this nights almost over, honest, lets make,  this one last forever, FOREVER!! FOREVER"/></To><Text Style="font-family:Comic Sans MS; font-weight:bold; color:#000080; ">soz cant</Text></Message><Message Date="26/11/2004" Time="10:21:58 PM" DateTime="2004-11-26T11:21:58.448Z" SessionID="47"><From><User FriendlyName="James:)Maybe Life is like a ride on a freeway, dodgin bullets while ur trying 2 find ur way....."/></From><To><User FriendlyName="iD.Syd // steve-0  :D | Lets go, dont wait, this nights almost over, honest, lets make,  this one last forever, FOREVER!! FOREVER"/></To><Text Style="font-family:Comic Sans MS; font-weight:bold; color:#000080; ">bout2 go</Text></Message><Message Date="27/11/2004" Time="11:57:20 AM" DateTime="2004-11-27T00:57:20.154Z" SessionID="48"><From><User FriendlyName="iD.Syd // steve-0  :D | Lets go, dont wait, this nights almost over, honest, lets make,  this one last forever, FOREVER!! FOREVER"/></From><To><User FriendlyName="James:) &quot;Let go your concious self, And act on Instinct...&quot;"/></To><Text Style="font-family:Comic Sans MS; font-weight:bold; color:#000000; ">hey james</Text></Message><Message Date="27/11/2004" Time="11:57:24 AM" DateTime="2004-11-27T00:57:24.991Z" SessionID="48"><From><User FriendlyName="iD.Syd // steve-0  :D | Lets go, dont wait, this nights almost over, honest, lets make,  this one last forever, FOREVER!! FOREVER"/></From><To><User FriendlyName="James:) &quot;Let go your concious self, And act on Instinct...&quot;"/></To><Text Style="font-family:Comic Sans MS; font-weight:bold; color:#000000; ">lol last night i was on my other account hacking :P</Text></Message><Message Date="27/11/2004" Time="11:57:36 AM" DateTime="2004-11-27T00:57:36.968Z" SessionID="48"><From><User FriendlyName="James:) &quot;Let go your concious self, And act on Instinct...&quot;"/></From><To><User FriendlyName="iD.Syd // steve-0  :D | Lets go, dont wait, this nights almost over, honest, lets make,  this one last forever, FOREVER!! FOREVER"/></To><Text Style="font-family:Comic Sans MS; font-weight:bold; color:#000080; ">ermmh ok</Text></Message><Message Date="27/11/2004" Time="11:57:45 AM" DateTime="2004-11-27T00:57:45.420Z" SessionID="48"><From><User FriendlyName="iD.Syd // steve-0  :D | Lets go, dont wait, this nights almost over, honest, lets make,  this one last forever, FOREVER!! FOREVER"/></From><To><User FriendlyName="James:) &quot;Let go your concious self, And act on Instinct...&quot;"/></To><Text Style="font-family:Comic Sans MS; font-weight:bold; color:#000000; ">wanna c?</Text></Message><Message Date="27/11/2004" Time="11:58:06 AM" DateTime="2004-11-27T00:58:06.511Z" SessionID="48"><From><User FriendlyName="James:) &quot;Let go your concious self, And act on Instinct...&quot;"/></From><To><User FriendlyName="iD.Syd // steve-0  :D | Lets go, dont wait, this nights almost over, honest, lets make,  this one last forever, FOREVER!! FOREVER"/></To><Text Style="font-family:Comic Sans MS; font-weight:bold; color:#000080; ">ok</Text></Message><Message Date="27/11/2004" Time="11:58:38 AM" DateTime="2004-11-27T00:58:38.627Z" SessionID="48"><From><User FriendlyName="iD.Syd // steve-0  :D | Lets go, dont wait, this nights almost over, honest, lets make,  this one last forever, FOREVER!! FOREVER"/></From><To><User FriendlyName="James:) &quot;Let go your concious self, And act on Instinct...&quot;"/></To><Text Style="font-family:Comic Sans MS; font-weight:bold; color:#000000; ">202.172.112.70:27030</Text></Message><Message Date="27/11/2004" Time="12:02:36 PM" DateTime="2004-11-27T01:02:36.789Z" SessionID="49"><From><User FriendlyName="iD.Syd // steve-0  :D | Lets go, dont wait, this nights almost over, honest, lets make,  this one last forever, FOREVER!! FOREVER"/></From><To><User FriendlyName="James:) &quot;Let go your concious self, And act on Instinct...&quot;"/></To><Text Style="font-family:Comic Sans MS; font-weight:bold; color:#000000; ">jump in dude</Text></Message><Message Date="27/11/2004" Time="12:02:39 PM" DateTime="2004-11-27T01:02:39.623Z" SessionID="49"><From><User FriendlyName="iD.Syd // steve-0  :D | Lets go, dont wait, this nights almost over, honest, lets make,  this one last forever, FOREVER!! FOREVER"/></From><To><User FriendlyName="James:) &quot;Let go your concious self, And act on Instinct...&quot;"/></To><Text Style="font-family:Comic Sans MS; font-weight:bold; color:#000000; ">202.172.112.70:27030</Text></Message><Message Date="27/11/2004" Time="12:02:51 PM" DateTime="2004-11-27T01:02:51.701Z" SessionID="49"><From><User FriendlyName="James:) &quot;Let go your concious self, And act on Instinct...&quot;"/></From><To><User FriendlyName="iD.Syd // steve-0  :D | Lets go, dont wait, this nights almost over, honest, lets make,  this one last forever, FOREVER!! FOREVER"/></To><Text Style="font-family:Comic Sans MS; font-weight:bold; color:#000080; ">css or cs</Text></Message><Message Date="27/11/2004" Time="12:03:34 PM" DateTime="2004-11-27T01:03:34.953Z" SessionID="49"><From><User FriendlyName="iD.Syd // steve-0  :D | Lets go, dont wait, this nights almost over, honest, lets make,  this one last forever, FOREVER!! FOREVER"/></From><To><User FriendlyName="James:) &quot;Let go your concious self, And act on Instinct...&quot;"/></To><Text Style="font-family:Comic Sans MS; font-weight:bold; color:#000000; ">cs</Text></Message><Message Date="2/12/2004" Time="6:05:32 PM" DateTime="2004-12-02T07:05:32.474Z" SessionID="50"><From><User FriendlyName="iD.Syd // steve-0  :D | YES!, NO MORE FUCKING SCHOOL FOR 2 MONTHS w00t w00t | westside?"/></From><To><User FriendlyName="James:)Hold me like you'll never let em go. Cuz im a leaving on a jet Plane, Dont know when ill be back again!!!!!!!!"/></To><Text Style="font-family:Comic Sans MS; font-weight:bold; color:#000000; ">hey james </Text></Message><Message Date="2/12/2004" Time="6:05:37 PM" DateTime="2004-12-02T07:05:37.491Z" SessionID="50"><From><User FriendlyName="James:)Hold me like you'll never let em go. Cuz im a leaving on a jet Plane, Dont know when ill be back again!!!!!!!!"/></From><To><User FriendlyName="iD.Syd // steve-0  :D | YES!, NO MORE FUCKING SCHOOL FOR 2 MONTHS w00t w00t | westside?"/></To><Text Style="font-family:Comic Sans MS; font-weight:bold; color:#000080; ">Hey</Text></Message><Invitation Date="2/12/2004" Time="6:05:46 PM" DateTime="2004-12-02T07:05:46.975Z" SessionID="50"><From><User FriendlyName="iD.Syd // steve-0  :D | YES!, NO MORE FUCKING SCHOOL FOR 2 MONTHS w00t w00t | westside?"/></From><Application>viewing webcam</Application><Text Style="color:#545454; ">iD.Syd // steve-0  :D | YES!, NO MORE FUCKING SCHOOL FOR 2 MONTHS w00t w00t | westside? is inviting you to start viewing webcam. Do you want to Accept (Alt+C) or Decline (Alt+D) the invitation?</Text></Invitation><InvitationResponse Date="2/12/2004" Time="6:05:51 PM" DateTime="2004-12-02T07:05:51.421Z" SessionID="50"><From><User FriendlyName="iD.Syd // steve-0  :D | YES!, NO MORE FUCKING SCHOOL FOR 2 MONTHS w00t w00t | westside?"/></From><Application>viewing webcam</Application><Text Style="color:#545454; ">You have accepted the invitation to start viewing webcam.</Text></InvitationResponse><Invitation Date="2/12/2004" Time="6:06:24 PM" DateTime="2004-12-02T07:06:24.489Z" SessionID="50"><From><User FriendlyName="James:)Hold me like you'll never let em go. Cuz im a leaving on a jet Plane, Dont know when ill be back again!!!!!!!!"/></From><Application>an audio conversation</Application><Text Style="color:#545454; ">You have invited iD.Syd // steve-0  :D | YES!, NO MORE FUCKING SCHOOL FOR 2 MONTHS w00t w00t | westside? to start an audio conversation. Please wait for a response, or Cancel (Alt+Q) the pending invitation.</Text></Invitation><InvitationResponse Date="2/12/2004" Time="6:06:37 PM" DateTime="2004-12-02T07:06:37.958Z" SessionID="50"><From><User FriendlyName="iD.Syd // steve-0  :D | YES!, NO MORE FUCKING SCHOOL FOR 2 MONTHS w00t w00t | westside?"/></From><Application>an audio conversation</Application><Text Style="color:#545454; ">iD.Syd // steve-0  :D | YES!, NO MORE FUCKING SCHOOL FOR 2 MONTHS w00t w00t | westside? has accepted your invitation to start an audio conversation.</Text></InvitationResponse><Invitation Date="2/12/2004" Time="6:06:56 PM" DateTime="2004-12-02T07:06:56.995Z" SessionID="50"><From><User FriendlyName="James:)Hold me like you'll never let em go. Cuz im a leaving on a jet Plane, Dont know when ill be back again!!!!!!!!"/></From><Application>an audio conversation</Application><Text Style="color:#545454; ">You have invited iD.Syd // steve-0  :D | YES!, NO MORE FUCKING SCHOOL FOR 2 MONTHS w00t w00t | westside? to start an audio conversation. Please wait for a response, or Cancel (Alt+Q) the pending invitation.</Text></Invitation><Message Date="2/12/2004" Time="6:06:59 PM" DateTime="2004-12-02T07:06:59.329Z" SessionID="50"><From><User FriendlyName="James:)Hold me like you'll never let em go. Cuz im a leaving on a jet Plane, Dont know when ill be back again!!!!!!!!"/></From><To><User FriendlyName="iD.Syd // steve-0  :D | YES!, NO MORE FUCKING SCHOOL FOR 2 MONTHS w00t w00t | westside?"/></To><Text Style="font-family:Comic Sans MS; font-weight:bold; color:#000080; ">try agn</Text></Message><InvitationResponse Date="2/12/2004" Time="6:06:59 PM" DateTime="2004-12-02T07:06:59.449Z" SessionID="50"><From><User FriendlyName="iD.Syd // steve-0  :D | YES!, NO MORE FUCKING SCHOOL FOR 2 MONTHS w00t w00t | westside?"/></From><Application>an audio conversation</Application><Text Style="color:#545454; ">iD.Syd // steve-0  :D | YES!, NO MORE FUCKING SCHOOL FOR 2 MONTHS w00t w00t | westside? has accepted your invitation to start an audio conversation.</Text></InvitationResponse><Message Date="2/12/2004" Time="6:13:41 PM" DateTime="2004-12-02T07:13:41.827Z" SessionID="50"><From><User FriendlyName="iD.Syd // steve-0  :D | YES!, NO MORE FUCKING SCHOOL FOR 2 MONTHS w00t w00t | westside?"/></From><To><User FriendlyName="James:)Hold me like you'll never let em go. Cuz im a leaving on a jet Plane, Dont know when ill be back again!!!!!!!!"/></To><Text Style="font-family:Comic Sans MS; font-weight:bold; color:#000000; ">218.214.17.76:27017</Text></Message><Invitation Date="2/12/2004" Time="6:38:47 PM" DateTime="2004-12-02T07:38:47.693Z" SessionID="50"><From><User FriendlyName="iD.Syd // steve-0  :D | YES!, NO MORE FUCKING SCHOOL FOR 2 MONTHS w00t w00t | westside?"/></From><File>NFSU2 car.JPG</File><Text Style="color:#545454; ">iD.Syd // steve-0  :D | YES!, NO MORE FUCKING SCHOOL FOR 2 MONTHS w00t w00t | westside? sends NFSU2 car.JPG</Text></Invitation><InvitationResponse Date="2/12/2004" Time="6:39:29 PM" DateTime="2004-12-02T07:39:29.263Z" SessionID="50"><From><User FriendlyName="iD.Syd // steve-0  :D | YES!, NO MORE FUCKING SCHOOL FOR 2 MONTHS w00t w00t | westside?"/></From><File>C:\Documents and Settings\James O'Toole\My Documents\My Received Files\NFSU2 car.JPG</File><Text Style="color:#545454; ">You have successfully received C:\Documents and Settings\James O'Toole\My Documents\My Received Files\NFSU2 car.JPG from iD.Syd // steve-0  :D | YES!, NO MORE FUCKING SCHOOL FOR 2 MONTHS w00t w00t | westside?.</Text></InvitationResponse><Invitation Date="2/12/2004" Time="6:40:06 PM" DateTime="2004-12-02T07:40:06.426Z" SessionID="50"><From><User FriendlyName="iD.Syd // steve-0  :D | YES!, NO MORE FUCKING SCHOOL FOR 2 MONTHS w00t w00t | westside?"/></From><File>OVERCLOCK!.JPG</File><Text Style="color:#545454; ">iD.Syd // steve-0  :D | YES!, NO MORE FUCKING SCHOOL FOR 2 MONTHS w00t w00t | westside? sends OVERCLOCK!.JPG</Text></Invitation><Message Date="2/12/2004" Time="6:40:55 PM" DateTime="2004-12-02T07:40:55.156Z" SessionID="50"><From><User FriendlyName="iD.Syd // steve-0  :D | YES!, NO MORE FUCKING SCHOOL FOR 2 MONTHS w00t w00t | westside?"/></From><To><User FriendlyName="James:)Hold me like you'll never let em go. Cuz im a leaving on a jet Plane, Dont know when ill be back again!!!!!!!!"/></To><Text Style="font-family:Comic Sans MS; font-weight:bold; color:#000000; ">accept </Text></Message><Message Date="2/12/2004" Time="6:40:56 PM" DateTime="2004-12-02T07:40:56.849Z" SessionID="50"><From><User FriendlyName="iD.Syd // steve-0  :D | YES!, NO MORE FUCKING SCHOOL FOR 2 MONTHS w00t w00t | westside?"/></From><To><User FriendlyName="James:)Hold me like you'll never let em go. Cuz im a leaving on a jet Plane, Dont know when ill be back again!!!!!!!!"/></To><Text Style="font-family:Comic Sans MS; font-weight:bold; color:#000000; ">u doofus</Text></Message><InvitationResponse Date="2/12/2004" Time="6:41:57 PM" DateTime="2004-12-02T07:41:57.295Z" SessionID="50"><From><User FriendlyName="iD.Syd // steve-0  :D | YES!, NO MORE FUCKING SCHOOL FOR 2 MONTHS w00t w00t | westside?"/></From><File>C:\Documents and Settings\James O'Toole\My Documents\My Received Files\OVERCLOCK!.JPG</File><Text Style="color:#545454; ">You have successfully received C:\Documents and Settings\James O'Toole\My Documents\My Received Files\OVERCLOCK!.JPG from iD.Syd // steve-0  :D | YES!, NO MORE FUCKING SCHOOL FOR 2 MONTHS w00t w00t | westside?.</Text></InvitationResponse><Message Date="2/12/2004" Time="6:42:52 PM" DateTime="2004-12-02T07:42:52.264Z" SessionID="50"><From><User FriendlyName="James:)Hold me like you'll never let em go. Cuz im a leaving on a jet Plane, Dont know when ill be back again!!!!!!!!"/></From><To><User FriendlyName="iD.Syd // steve-0  :D | YES!, NO MORE FUCKING SCHOOL FOR 2 MONTHS w00t w00t | westside?"/></To><Text Style="font-family:Comic Sans MS; font-weight:bold; color:#000080; ">Lol</Text></Message><Message Date="2/12/2004" Time="6:43:00 PM" DateTime="2004-12-02T07:43:00.817Z" SessionID="50"><From><User FriendlyName="James:)Hold me like you'll never let em go. Cuz im a leaving on a jet Plane, Dont know when ill be back again!!!!!!!!"/></From><To><User FriendlyName="iD.Syd // steve-0  :D | YES!, NO MORE FUCKING SCHOOL FOR 2 MONTHS w00t w00t | westside?"/></To><Text Style="font-family:Comic Sans MS; font-weight:bold; color:#000080; ">thats why u got ur big fan eh?</Text></Message><Message Date="3/12/2004" Time="3:49:53 PM" DateTime="2004-12-03T04:49:53.824Z" SessionID="51"><From><User FriendlyName="steve | Its Christmas time....again...its time to be nice to the peoplllle u cant stand!...all year :) &lt;3 u all"/></From><To><User FriendlyName="James:)BeeeeeeeeeeeeW!"/></To><Text Style="font-family:Comic Sans MS; font-weight:bold; color:#000000; ">ey man</Text></Message><Invitation Date="3/12/2004" Time="3:49:57 PM" DateTime="2004-12-03T04:49:57.089Z" SessionID="51"><From><User FriendlyName="steve | Its Christmas time....again...its time to be nice to the peoplllle u cant stand!...all year :) &lt;3 u all"/></From><Application>viewing webcam</Application><Text Style="color:#545454; ">steve | Its Christmas time....again...its time to be nice to the peoplllle u cant stand!...all year :) &lt;3 u all is inviting you to start viewing webcam. Do you want to Accept (Alt+C) or Decline (Alt+D) the invitation?</Text></Invitation><InvitationResponse Date="3/12/2004" Time="3:50:12 PM" DateTime="2004-12-03T04:50:12.831Z" SessionID="51"><From><User FriendlyName="steve | Its Christmas time....again...its time to be nice to the peoplllle u cant stand!...all year :) &lt;3 u all"/></From><Application>viewing webcam</Application><Text Style="color:#800000; ">steve | Its Christmas time....again...its time to be nice to the peoplllle u cant stand!...all year :) &lt;3 u all has canceled the invitation to start viewing webcam.</Text></InvitationResponse><Message Date="4/12/2004" Time="9:12:23 PM" DateTime="2004-12-04T10:12:23.021Z" SessionID="52"><From><User FriendlyName="steve | lol at dude on train (fr0z3n) :P"/></From><To><User FriendlyName="James:)I have Lots of Ram, BOOOYAH!!!!!"/></To><Text Style="font-family:Comic Sans MS; font-weight:bold; color:#000000; ">ey james</Text></Message><Message Date="4/12/2004" Time="9:12:27 PM" DateTime="2004-12-04T10:12:27.898Z" SessionID="52"><From><User FriendlyName="James:)I have Lots of Ram, BOOOYAH!!!!!"/></From><To><User FriendlyName="steve | lol at dude on train (fr0z3n) :P"/></To><Text Style="font-family:Comic Sans MS; font-weight:bold; color:#000080; ">aye</Text></Message><Message Date="4/12/2004" Time="9:12:34 PM" DateTime="2004-12-04T10:12:34.618Z" SessionID="52"><From><User FriendlyName="steve | lol at dude on train (fr0z3n) :P"/></From><To><User FriendlyName="James:)I have Lots of Ram, BOOOYAH!!!!!"/></To><Text Style="font-family:Comic Sans MS; font-weight:bold; color:#000000; ">sup man</Text></Message><Message Date="4/12/2004" Time="9:12:47 PM" DateTime="2004-12-04T10:12:47.196Z" SessionID="52"><From><User FriendlyName="James:)I have Lots of Ram, BOOOYAH!!!!!"/></From><To><User FriendlyName="steve | lol at dude on train (fr0z3n) :P"/></To><Text Style="font-family:Comic Sans MS; font-weight:bold; color:#000080; ">Im wathcin Star Was fantom menace</Text></Message><Message Date="4/12/2004" Time="9:12:51 PM" DateTime="2004-12-04T10:12:51.111Z" SessionID="52"><From><User FriendlyName="steve | lol at dude on train (fr0z3n) :P"/></From><To><User FriendlyNa