<?xml version="1.0"?>
<?xml-stylesheet type='text/xsl' href='MessageLog.xsl'?>
<Log FirstSessionID="1" LastSessionID="95"><Message Date="2/05/2008" Time="9:17:58 PM" DateTime="2008-05-02T11:17:58.555Z" SessionID="1"><From><User FriendlyName="Patrick"/></From><To><User FriendlyName="- James O'"/></To><Text Style="font-family:MS Shell Dlg; color:#000000; ">Hey</Text></Message><Message Date="2/05/2008" Time="9:18:18 PM" DateTime="2008-05-02T11:18:18.635Z" SessionID="1"><From><User FriendlyName="Patrick"/></From><To><User FriendlyName="- James O'"/></To><Text Style="font-family:MS Shell Dlg; color:#000000; ">I am Patrick from isit102 group</Text></Message><Message Date="4/05/2008" Time="11:41:49 AM" DateTime="2008-05-04T01:41:49.631Z" SessionID="2"><From><User FriendlyName="Patrick"/></From><To><User FriendlyName="- James O'"/></To><Text Style="font-family:MS Shell Dlg; color:#000000; ">Hey</Text></Message><Message Date="4/05/2008" Time="11:41:54 AM" DateTime="2008-05-04T01:41:54.342Z" SessionID="2"><From><User FriendlyName="- James O'"/></From><To><User FriendlyName="Patrick"/></To><Text Style="font-family:Microsoft Sans Serif; color:#000000; ">Hay</Text></Message><Message Date="4/05/2008" Time="11:42:59 AM" DateTime="2008-05-04T01:42:59.453Z" SessionID="2"><From><User FriendlyName="Patrick"/></From><To><User FriendlyName="- James O'"/></To><Text Style="font-family:MS Shell Dlg; color:#000000; ">I've broken down into a cold and i don't think i can make it to the meeting, is that ok with you? i am really sorry. I will try and make it but if i can't really talk then i don't think it will be much use if i go anyways</Text></Message><Message Date="4/05/2008" Time="11:43:31 AM" DateTime="2008-05-04T01:43:31.675Z" SessionID="2"><From><User FriendlyName="- James O'"/></From><To><User FriendlyName="Patrick"/></To><Text Style="font-family:Microsoft Sans Serif; color:#000000; ">haha, don't worry about it mate</Text></Message><Message Date="4/05/2008" Time="11:44:00 AM" DateTime="2008-05-04T01:44:00.830Z" SessionID="2"><From><User FriendlyName="- James O'"/></From><To><User FriendlyName="Patrick"/></To><Text Style="font-family:Microsoft Sans Serif; color:#000000; ">I don't think it'll be that productive, but its only a 2000 word essay, we'll get ti done</Text></Message><Message Date="4/05/2008" Time="11:44:20 AM" DateTime="2008-05-04T01:44:20.317Z" SessionID="2"><From><User FriendlyName="Patrick"/></From><To><User FriendlyName="- James O'"/></To><Text Style="font-family:MS Shell Dlg; color:#000000; ">cool, thank you and once again sorry</Text></Message><Message Date="4/05/2008" Time="11:44:41 AM" DateTime="2008-05-04T01:44:41.698Z" SessionID="2"><From><User FriendlyName="- James O'"/></From><To><User FriendlyName="Patrick"/></To><Text Style="font-family:Microsoft Sans Serif; color:#000000; ">No worries</Text></Message><Message Date="4/05/2008" Time="11:44:51 AM" DateTime="2008-05-04T01:44:51.984Z" SessionID="2"><From><User FriendlyName="- James O'"/></From><To><User FriendlyName="Patrick"/></To><Text Style="font-family:Microsoft Sans Serif; color:#000000; ">really, don't sweat it</Text></Message><Message Date="4/05/2008" Time="11:45:33 AM" DateTime="2008-05-04T01:45:33.523Z" SessionID="2"><From><User FriendlyName="- James O'"/></From><To><User FriendlyName="Patrick"/></To><Text Style="font-family:Microsoft Sans Serif; color:#000000; ">we'll see ya if we see ya</Text></Message><Message Date="4/05/2008" Time="11:45:39 AM" DateTime="2008-05-04T01:45:39.075Z" SessionID="2"><From><User FriendlyName="- James O'"/></From><To><User FriendlyName="Patrick"/></To><Text Style="font-family:Microsoft Sans Serif; color:#000000; ">Get better soon eh</Text></Message><Message Date="4/05/2008" Time="11:46:37 AM" DateTime="2008-05-04T01:46:37.993Z" SessionID="3"><From><User FriendlyName="Patrick"/></From><To><User FriendlyName="- James O'"/></To><Text Style="font-family:MS Shell Dlg; color:#000000; ">thanks</Text></Message><Message Date="5/8/2008" Time="9:18:45 PM" DateTime="2008-05-08T11:18:45.282Z" SessionID="4"><From><User FriendlyName="Patrick .Gec Loc"/></From><To><User FriendlyName="- James O'"/></To><Text Style="font-family:High Tower Text; color:#000000; ">Hi, meeting Monday 1:30?</Text></Message><Message Date="5/8/2008" Time="9:23:08 PM" DateTime="2008-05-08T11:23:08.035Z" SessionID="4"><From><User FriendlyName="- James O'"/></From><To><User FriendlyName="Patrick .Gec Loc"/></To><Text Style="font-family:MS Shell Dlg; color:#000000; ">uhh I believe so</Text></Message><Message Date="5/8/2008" Time="9:23:24 PM" DateTime="2008-05-08T11:23:24.226Z" SessionID="4"><From><User FriendlyName="- James O'"/></From><To><User FriendlyName="Patrick .Gec Loc"/></To><Text Style="font-family:MS Shell Dlg; color:#000000; ">I was only at uni this wednesday</Text></Message><Message Date="5/8/2008" Time="9:23:29 PM" DateTime="2008-05-08T11:23:29.186Z" SessionID="4"><From><User FriendlyName="- James O'"/></From><To><User FriendlyName="Patrick .Gec Loc"/></To><Text Style="font-family:MS Shell Dlg; color:#000000; ">I think i got a sinus infection</Text></Message><Message Date="5/8/2008" Time="9:23:34 PM" DateTime="2008-05-08T11:23:34.929Z" SessionID="4"><From><User FriendlyName="- James O'"/></From><To><User FriendlyName="Patrick .Gec Loc"/></To><Text Style="font-family:MS Shell Dlg; color:#000000; ">but hopefully I'll be ther munday</Text></Message><Message Date="5/8/2008" Time="9:23:50 PM" DateTime="2008-05-08T11:23:50.277Z" SessionID="5"><From><User FriendlyName="Patrick .Gec Loc"/></From><To><User FriendlyName="- James O'"/></To><Text Style="font-family:High Tower Text; color:#000000; ">cool, u were the one sick on monday</Text></Message><Message Date="5/8/2008" Time="9:23:56 PM" DateTime="2008-05-08T11:23:56.695Z" SessionID="5"><From><User FriendlyName="- James O'"/></From><To><User FriendlyName="Patrick .Gec Loc"/></To><Text Style="font-family:MS Shell Dlg; color:#000000; ">Yah</Text></Message><Message Date="5/8/2008" Time="9:24:14 PM" DateTime="2008-05-08T11:24:14.126Z" SessionID="5"><From><User FriendlyName="Patrick .Gec Loc"/></From><To><User FriendlyName="- James O'"/></To><Text Style="font-family:High Tower Text; color:#000000; ">same, lol, thanks to you i didn't need to catch up on the meeting</Text></Message><Message Date="5/8/2008" Time="9:24:40 PM" DateTime="2008-05-08T11:24:40.835Z" SessionID="5"><From><User FriendlyName="- James O'"/></From><To><User FriendlyName="Patrick .Gec Loc"/></To><Text Style="font-family:MS Shell Dlg; color:#000000; ">haha, ya, I dont think its that big a deal</Text></Message><Message Date="5/8/2008" Time="9:24:48 PM" DateTime="2008-05-08T11:24:48.304Z" SessionID="5"><From><User FriendlyName="- James O'"/></From><To><User FriendlyName="Patrick .Gec Loc"/></To><Text Style="font-family:MS Shell Dlg; color:#000000; ">Wats with the #178 in australia?</Text></Message><Message Date="5/8/2008" Time="9:27:35 PM" DateTime="2008-05-08T11:27:35.102Z" SessionID="5"><From><User FriendlyName="Patrick .Gec Loc"/></From><To><User FriendlyName="- James O'"/></To><Text Style="font-family:High Tower Text; color:#000000; ">do you play with Boinc? like seti@home etc.?</Text></Message><Message Date="5/8/2008" Time="9:28:04 PM" DateTime="2008-05-08T11:28:04.126Z" SessionID="5"><From><User FriendlyName="Patrick .Gec Loc"/></From><To><User FriendlyName="- James O'"/></To><Text Style="font-family:High Tower Text; color:#000000; ">I am a member of Boinc-Australia and i am crunching for Milkyway, and am in 178 place</Text></Message><Message Date="5/8/2008" Time="9:28:07 PM" DateTime="2008-05-08T11:28:07.947Z" SessionID="5"><From><User FriendlyName="- James O'"/></From><To><User FriendlyName="Patrick .Gec Loc"/></To><Text Style="font-family:MS Shell Dlg; color:#000000; ">Oh, I did folding@home</Text></Message><Message Date="5/8/2008" Time="9:28:44 PM" DateTime="2008-05-08T11:28:44.809Z" SessionID="5"><From><User FriendlyName="- James O'"/></From><To><User FriendlyName="Patrick .Gec Loc"/></To><Text Style="font-family:MS Shell Dlg; color:#000000; ">Just to sorta check it out</Text></Message><Message Date="5/8/2008" Time="9:28:47 PM" DateTime="2008-05-08T11:28:47.232Z" SessionID="5"><From><User FriendlyName="Patrick .Gec Loc"/></From><To><User FriendlyName="- James O'"/></To><Text Style="font-family:High Tower Text; color:#000000; ">yeah i 've joined in Boinc-Australia.net, to fight for no. 1 fo Australia</Text></Message><Message Date="5/8/2008" Time="9:28:59 PM" DateTime="2008-05-08T11:28:59.669Z" SessionID="5"><From><User FriendlyName="- James O'"/></From><To><User FriendlyName="Patrick .Gec Loc"/></To><Text Style="font-family:MS Shell Dlg; color:#000000; ">haha epic goal</Text></Message><Message Date="5/8/2008" Time="9:29:28 PM" DateTime="2008-05-08T11:29:28.699Z" SessionID="5"><From><User FriendlyName="Patrick .Gec Loc"/></From><To><User FriendlyName="- James O'"/></To><Text Style="font-family:High Tower Text; color:#000000; ">yeah, its also just to show off my pcs which are now out of date as you can see with 178th, lol</Text></Message><Message Date="5/12/2008" Time="8:36:04 AM" DateTime="2008-05-11T22:36:04.365Z" SessionID="6"><From><User FriendlyName="Patrick [Gec Loc]"/></From><To><User FriendlyName="- James O'"/></To><Text Style="font-family:MS Shell Dlg; color:#000000; ">hey u there?</Text></Message><Message Date="5/12/2008" Time="11:28:35 AM" DateTime="2008-05-12T01:28:35.751Z" SessionID="6"><From><User FriendlyName="Patrick :"/></From><To><User FriendlyName="- James O'"/></To><Text Style="font-family:Arial; color:#000000; ">Hey</Text></Message><Message Date="5/12/2008" Time="11:28:41 AM" DateTime="2008-05-12T01:28:41.737Z" SessionID="6"><From><User FriendlyName="Patrick :"/></From><To><User FriendlyName="- James O'"/></To><Text Style="font-family:Arial; color:#000000; ">r u signed in at uni??</Text></Message><Message Date="5/21/2008" Time="12:18:37 PM" DateTime="2008-05-21T02:18:37.569Z" SessionID="7"><From><User FriendlyName="Patrick [Gec Loc] 140"/></From><To><User FriendlyName="- James O'"/></To><Text Style="font-family:Microsoft Sans Serif; color:#800000; ">Hey man</Text></Message><Message Date="5/21/2008" Time="12:18:38 PM" DateTime="2008-05-21T02:18:38.274Z" SessionID="7"><From><User FriendlyName="Patrick [Gec Loc] 140"/></From><To><User FriendlyName="- James O'"/></To><Text Style="font-family:Microsoft Sans Serif; color:#800000; ">u there?</Text></Message><Message Date="5/21/2008" Time="12:21:52 PM" DateTime="2008-05-21T02:21:52.713Z" SessionID="7"><From><User FriendlyName="- James O'"/></From><To><User FriendlyName="Patrick [Gec Loc] 140"/></To><Text Style="font-family:MS Shell Dlg; color:#000000; ">Hay</Text></Message><Message Date="5/21/2008" Time="12:21:58 PM" DateTime="2008-05-21T02:21:58.767Z" SessionID="7"><From><User FriendlyName="- James O'"/></From><To><User FriendlyName="Patrick [Gec Loc] 140"/></To><Text Style="font-family:MS Shell Dlg; color:#000000; ">Yeah</Text></Message><Message Date="5/21/2008" Time="12:23:43 PM" DateTime="2008-05-21T02:23:43.255Z" SessionID="8"><From><User FriendlyName="Patrick [Gec Loc] 140"/></From><To><User FriendlyName="- James O'"/></To><Text Style="font-family:Microsoft Sans Serif; color:#800000; ">hav u done your part yet?</Text></Message><Message Date="5/21/2008" Time="12:24:05 PM" DateTime="2008-05-21T02:24:05.699Z" SessionID="8"><From><User FriendlyName="- James O'"/></From><To><User FriendlyName="Patrick [Gec Loc] 140"/></To><Text Style="font-family:MS Shell Dlg; color:#000000; ">Not entirely...</Text></Message><Message Date="5/21/2008" Time="12:24:35 PM" DateTime="2008-05-21T02:24:35.990Z" SessionID="8"><From><User FriendlyName="- James O'"/></From><To><User FriendlyName="Patrick [Gec Loc] 140"/></To><Text Style="font-family:MS Shell Dlg; color:#000000; ">doing some study on stuff I missed out on yesterday</Text></Message><Message Date="5/21/2008" Time="12:24:40 PM" DateTime="2008-05-21T02:24:40.939Z" SessionID="8"><From><User FriendlyName="Patrick [Gec Loc] 140"/></From><To><User FriendlyName="- James O'"/></To><Text Style="font-family:Microsoft Sans Serif; color:#800000; ">haven't started yet, hopign to do so today, maybe</Text></Message><Message Date="5/21/2008" Time="12:24:43 PM" DateTime="2008-05-21T02:24:43.935Z" SessionID="8"><From><User FriendlyName="- James O'"/></From><To><User FriendlyName="Patrick [Gec Loc] 140"/></To><Text Style="font-family:MS Shell Dlg; color:#000000; ">Gonner work on it this arvo</Text></Message><Message Date="5/21/2008" Time="12:24:46 PM" DateTime="2008-05-21T02:24:46.869Z" SessionID="8"><From><User FriendlyName="- James O'"/></From><To><User FriendlyName="Patrick [Gec Loc] 140"/></To><Text Style="font-family:MS Shell Dlg; color:#000000; ">Yeah,</Text></Message><Message Date="5/21/2008" Time="12:24:50 PM" DateTime="2008-05-21T02:24:50.380Z" SessionID="8"><From><User FriendlyName="- James O'"/></From><To><User FriendlyName="Patrick [Gec Loc] 140"/></To><Text Style="font-family:MS Shell Dlg; color:#000000; ">It'll work out</Text></Message><Message Date="5/21/2008" Time="12:25:01 PM" DateTime="2008-05-21T02:25:01.444Z" SessionID="9"><From><User FriendlyName="Patrick [Gec Loc] 140"/></From><To><User FriendlyName="- James O'"/></To><Text Style="font-family:Microsoft Sans Serif; color:#800000; ">It due this Sunday, i thought it was wek 13</Text></Message><Message Date="5/21/2008" Time="12:25:18 PM" DateTime="2008-05-21T02:25:18.877Z" SessionID="9"><From><User FriendlyName="Patrick [Gec Loc] 140"/></From><To><User FriendlyName="- James O'"/></To><Text Style="font-family:Microsoft Sans Serif; color:#800000; ">dam, lucky i read, i was going to finish my current webpage team work first</Text></Message><Message Date="5/21/2008" Time="1:22:58 PM" DateTime="2008-05-21T03:22:58.466Z" SessionID="9"><From><User FriendlyName="Patrick [Gec Loc] 140"/></From><To><User FriendlyName="- James O'"/></To><Text Style="font-family:Microsoft Sans Serif; color:#800000; ">do you have any good resources for risks?? in erp?</Text></Message><Message Date="5/21/2008" Time="1:22:59 PM" DateTime="2008-05-21T03:22:59.340Z" SessionID="9"><From><User FriendlyName="Patrick [Gec Loc] 140"/></From><To><User FriendlyName="- James O'"/></To><Text Style="font-family:Microsoft Sans Serif; color:#800000; ">thanks</Text></Message><Message Date="5/21/2008" Time="1:23:02 PM" DateTime="2008-05-21T03:23:02.116Z" SessionID="9"><From><User FriendlyName="Patrick [Gec Loc] 140"/></From><To><User FriendlyName="- James O'"/></To><Text Style="font-family:Microsoft Sans Serif; color:#800000; ">and what section are you doing??</Text></Message><Message Date="5/21/2008" Time="1:24:15 PM" DateTime="2008-05-21T03:24:15.302Z" SessionID="9"><From><User FriendlyName="Patrick [Gec Loc] 140"/></From><To><User FriendlyName="- James O'"/></To><Text Style="font-family:Microsoft Sans Serif; color:#800000; ">If you want i can send you what i am currently using and see if it is any help.

Hey, i've got to go to uni, I'll chat onight</Text></Message><Message Date="5/21/2008" Time="1:24:16 PM" DateTime="2008-05-21T03:24:16.326Z" SessionID="9"><From><User FriendlyName="Patrick [Gec Loc] 140"/></From><To><User FriendlyName="- James O'"/></To><Text Style="font-family:Microsoft Sans Serif; color:#800000; ">cya</Text></Message><Message Date="5/21/2008" Time="10:24:45 PM" DateTime="2008-05-21T12:24:45.374Z" SessionID="10"><From><User FriendlyName="Patrick [Gec Loc] 139"/></From><To><User FriendlyName="- James O'"/></To><Text Style="font-family:Microsoft Sans Serif; color:#800000; ">Hey</Text></Message><Message Date="5/22/2008" Time="8:16:57 PM" DateTime="2008-05-22T10:16:57.862Z" SessionID="11"><From><User FriendlyName="- James O'"/></From><To><User FriendlyName="Patrick [Gec Loc] 139"/></To><Text Style="font-family:MS Shell Dlg; color:#000000; ">Hay man</Text></Message><Message Date="5/22/2008" Time="8:17:06 PM" DateTime="2008-05-22T10:17:06.970Z" SessionID="11"><From><User FriendlyName="- James O'"/></From><To><User FriendlyName="Patrick [Gec Loc] 139"/></To><Text Style="font-family:MS Shell Dlg; color:#000000; ">Did u want us to fang us my part now?</Text></Message><Message Date="5/22/2008" Time="8:17:09 PM" DateTime="2008-05-22T10:17:09.626Z" SessionID="11"><From><User FriendlyName="- James O'"/></From><To><User FriendlyName="Patrick [Gec Loc] 139"/></To><Text Style="font-family:MS Shell Dlg; color:#000000; ">or get it tommorow?</Text></Message><Message Date="5/22/2008" Time="8:35:59 PM" DateTime="2008-05-22T10:35:59.412Z" SessionID="12"><From><User FriendlyName="Patrick [Gec Loc] 139"/></From><To><User FriendlyName="- James O'"/></To><Text Style="font-family:Microsoft Sans Serif; color:#800000; ">tomorrow</Text></Message><Message Date="5/22/2008" Time="8:36:00 PM" DateTime="2008-05-22T10:36:00.879Z" SessionID="12"><From><User FriendlyName="Patrick [Gec Loc] 139"/></From><To><User FriendlyName="- James O'"/></To><Text Style="font-family:Microsoft Sans Serif; color:#800000; ">i guess</Text></Message><Message Date="5/22/2008" Time="8:36:11 PM" DateTime="2008-05-22T10:36:11.556Z" SessionID="12"><From><User FriendlyName="Patrick [Gec Loc] 139"/></From><To><User FriendlyName="- James O'"/></To><Text Style="font-family:Microsoft Sans Serif; color:#800000; ">I am yet to find more references for my part</Text></Message><Message Date="5/22/2008" Time="8:36:22 PM" DateTime="2008-05-22T10:36:22.366Z" SessionID="12"><From><User FriendlyName="Patrick [Gec Loc] 139"/></From><To><User FriendlyName="- James O'"/></To><Text Style="font-family:Microsoft Sans Serif; color:#800000; ">did you get about 500 words? I am maining that</Text></Message><Message Date="5/23/2008" Time="11:06:33 PM" DateTime="2008-05-23T13:06:33.884Z" SessionID="13"><From><User FriendlyName="Patrick [Gec Loc] 139 - Dam it can't beat Gavin Lang"/></From><To><User FriendlyName="- James O'"/></To><Text Style="font-family:Microsoft Sans Serif; color:#800000; ">Hey man, what is a good way to contact everyone in one go?? does everyone check their UOW mail often?? Thanks</Text></Message><Message Date="5/23/2008" Time="11:06:42 PM" DateTime="2008-05-23T13:06:42.741Z" SessionID="13"><From><User FriendlyName="- James O'"/></From><To><User FriendlyName="Patrick [Gec Loc] 139 - Dam it can't beat Gavin Lang"/></To><Text Style="font-family:MS Shell Dlg; color:#000000; ">No, never</Text></Message><Message Date="5/23/2008" Time="11:06:46 PM" DateTime="2008-05-23T13:06:46.611Z" SessionID="13"><From><User FriendlyName="- James O'"/></From><To><User FriendlyName="Patrick [Gec Loc] 139 - Dam it can't beat Gavin Lang"/></To><Text Style="font-family:MS Shell Dlg; color:#000000; ">MSN is the best way</Text></Message><Message Date="5/23/2008" Time="11:06:47 PM" DateTime="2008-05-23T13:06:47.885Z" SessionID="13"><From><User FriendlyName="Patrick [Gec Loc] 139 - Dam it can't beat Gavin Lang"/></From><To><User FriendlyName="- James O'"/></To><Text Style="font-family:Microsoft Sans Serif; color:#800000; ">lol</Text></Message><Message Date="5/23/2008" Time="11:06:56 PM" DateTime="2008-05-23T13:06:56.348Z" SessionID="13"><From><User FriendlyName="- James O'"/></From><To><User FriendlyName="Patrick [Gec Loc] 139 - Dam it can't beat Gavin Lang"/></To><Text Style="font-family:MS Shell Dlg; color:#000000; ">I'm gonner work on my bit, for the second time</Text></Message><Message Date="5/23/2008" Time="11:06:57 PM" DateTime="2008-05-23T13:06:57.634Z" SessionID="13"><From><User FriendlyName="- James O'"/></From><To><User FriendlyName="Patrick [Gec Loc] 139 - Dam it can't beat Gavin Lang"/></To><Text Style="font-family:MS Shell Dlg; color:#000000; ">sigh</Text></Message><Message Date="5/23/2008" Time="11:06:59 PM" DateTime="2008-05-23T13:06:59.776Z" SessionID="13"><From><User FriendlyName="Patrick [Gec Loc] 139 - Dam it can't beat Gavin Lang"/></From><To><User FriendlyName="- James O'"/></To><Text Style="font-family:Microsoft Sans Serif; color:#800000; ">I can't remember who is doing what question</Text></Message><Message Date="5/23/2008" Time="11:07:05 PM" DateTime="2008-05-23T13:07:05.334Z" SessionID="13"><From><User FriendlyName="Patrick [Gec Loc] 139 - Dam it can't beat Gavin Lang"/></From><To><User FriendlyName="- James O'"/></To><Text Style="font-family:Microsoft Sans Serif; color:#800000; ">i need it for the reflections</Text></Message><Message Date="5/23/2008" Time="11:07:17 PM" DateTime="2008-05-23T13:07:17.171Z" SessionID="13"><From><User FriendlyName="- James O'"/></From><To><User FriendlyName="Patrick [Gec Loc] 139 - Dam it can't beat Gavin Lang"/></To><Text Style="font-family:MS Shell Dlg; color:#000000; ">I sware we decided I'd to part 1 cuz jono cant write well and we want the first bit to look good</Text></Message><Message Date="5/23/2008" Time="11:07:22 PM" DateTime="2008-05-23T13:07:22.416Z" SessionID="13"><From><User FriendlyName="- James O'"/></From><To><User FriendlyName="Patrick [Gec Loc] 139 - Dam it can't beat Gavin Lang"/></To><Text Style="font-family:MS Shell Dlg; color:#000000; ">but watever, I'll do it 2moro</Text></Message><Message Date="5/23/2008" Time="11:09:30 PM" DateTime="2008-05-23T13:09:30.201Z" SessionID="14"><From><User FriendlyName="Patrick [Gec Loc] 139 - Dam it can't beat Gavin Lang"/></From><To><User FriendlyName="- James O'"/></To><Text Style="font-family:Microsoft Sans Serif; color:#800000; ">lol</Text></Message><Message Date="5/23/2008" Time="11:09:36 PM" DateTime="2008-05-23T13:09:36.348Z" SessionID="14"><From><User FriendlyName="Patrick [Gec Loc] 139 - Dam it can't beat Gavin Lang"/></From><To><User FriendlyName="- James O'"/></To><Text Style="font-family:Microsoft Sans Serif; color:#800000; ">good my part is last so it can be crap</Text></Message><Message Date="5/23/2008" Time="11:11:42 PM" DateTime="2008-05-23T13:11:42.747Z" SessionID="14"><From><User FriendlyName="Patrick [Gec Loc] 139 - Dam it can't beat Gavin Lang"/></From><To><User FriendlyName="- James O'"/></To><Text Style="font-family:Microsoft Sans Serif; color:#800000; ">So the team members are : James, Jonathan, Mohummad?? can you please correct any spelling errors i may have </Text></Message><Message Date="5/23/2008" Time="11:12:51 PM" DateTime="2008-05-23T13:12:51.684Z" SessionID="14"><From><User FriendlyName="- James O'"/></From><To><User FriendlyName="Patrick [Gec Loc] 139 - Dam it can't beat Gavin Lang"/></To><Text Style="font-family:MS Shell Dlg; color:#000000; ">Mohummad's name is actually Nohad</Text></Message><Message Date="5/23/2008" Time="11:13:09 PM" DateTime="2008-05-23T13:13:09.968Z" SessionID="14"><From><User FriendlyName="- James O'"/></From><To><User FriendlyName="Patrick [Gec Loc] 139 - Dam it can't beat Gavin Lang"/></To><Text Style="font-family:MS Shell Dlg; color:#000000; ">yeah weird I know, dont ask, everyone just calls him Mo</Text></Message><Message Date="5/23/2008" Time="11:15:39 PM" DateTime="2008-05-23T13:15:39.313Z" SessionID="14"><From><User FriendlyName="Patrick [Gec Loc] 139 - Dam it can't beat Gavin Lang"/></From><To><User FriendlyName="- James O'"/></To><Text Style="font-family:Microsoft Sans Serif; color:#800000; ">cool, so should i use his real name in report?</Text></Message><Message Date="5/23/2008" Time="11:15:46 PM" DateTime="2008-05-23T13:15:46.654Z" SessionID="14"><From><User FriendlyName="- James O'"/></From><To><User FriendlyName="Patrick [Gec Loc] 139 - Dam it can't beat Gavin Lang"/></To><Text Style="font-family:MS Shell Dlg; color:#000000; ">yeah</Text></Message><Message Date="5/23/2008" Time="11:16:41 PM" DateTime="2008-05-23T13:16:41.861Z" SessionID="14"><From><User FriendlyName="Patrick [Gec Loc] 139 - Dam it can't beat Gavin Lang"/></From><To><User FriendlyName="- James O'"/></To><Text Style="font-family:Microsoft Sans Serif; color:#800000; ">thanks for the help man,if you chat to the others just tell them to stick around on msn tomorrow or leave it signed in so i can send stuff and ask questions etc.</Text></Message><Message Date="5/23/2008" Time="11:17:25 PM" DateTime="2008-05-23T13:17:25.700Z" SessionID="14"><From><User FriendlyName="- James O'"/></From><To><User FriendlyName="Patrick [Gec Loc] 139 - Dam it can't beat Gavin Lang"/></To><Text Style="font-family:MS Shell Dlg; color:#000000; ">yeah sure</Text></Message><Message Date="5/23/2008" Time="11:17:28 PM" DateTime="2008-05-23T13:17:28.986Z" SessionID="14"><From><User FriendlyName="- James O'"/></From><To><User FriendlyName="Patrick [Gec Loc] 139 - Dam it can't beat Gavin Lang"/></To><Text Style="font-family:MS Shell Dlg; color:#000000; ">Im gonner goto bed now</Text></Message><Message Date="5/23/2008" Time="11:17:31 PM" DateTime="2008-05-23T13:17:31.338Z" SessionID="14"><From><User FriendlyName="- James O'"/></From><To><User FriendlyName="Patrick [Gec Loc] 139 - Dam it can't beat Gavin Lang"/></To><Text Style="font-family:MS Shell Dlg; color:#000000; ">fare tired</Text></Message><Message Date="5/23/2008" Time="11:17:41 PM" DateTime="2008-05-23T13:17:41.465Z" SessionID="14"><From><User FriendlyName="- James O'"/></From><To><User FriendlyName="Patrick [Gec Loc] 139 - Dam it can't beat Gavin Lang"/></To><Text Style="font-family:MS Shell Dlg; color:#000000; ">I'll doo part 3 tommorow morning</Text></Message><Message Date="5/23/2008" Time="11:17:45 PM" DateTime="2008-05-23T13:17:45.198Z" SessionID="14"><From><User FriendlyName="Patrick [Gec Loc] 139 - Dam it can't beat Gavin Lang"/></From><To><User FriendlyName="- James O'"/></To><Text Style="font-family:Microsoft Sans Serif; color:#800000; ">alright, thanks again</Text></Message><Message Date="5/23/2008" Time="11:17:53 PM" DateTime="2008-05-23T13:17:53.657Z" SessionID="14"><From><User FriendlyName="- James O'"/></From><To><User FriendlyName="Patrick [Gec Loc] 139 - Dam it can't beat Gavin Lang"/></To><Text Style="font-family:MS Shell Dlg; color:#000000; ">Being that I've already done 500 words for part 1, i can't guarentee any ammount fo quality</Text></Message><Message Date="5/23/2008" Time="11:18:03 PM" DateTime="2008-05-23T13:18:03.956Z" SessionID="15"><From><User FriendlyName="Patrick [Gec Loc] 139 - Dam it can't beat Gavin Lang"/></From><To><User FriendlyName="- James O'"/></To><Text Style="font-family:Microsoft Sans Serif; color:#800000; ">lol</Text></Message><Message Date="5/23/2008" Time="11:18:20 PM" DateTime="2008-05-23T13:18:20.022Z" SessionID="15"><From><User FriendlyName="- James O'"/></From><To><User FriendlyName="Patrick [Gec Loc] 139 - Dam it can't beat Gavin Lang"/></To><Text Style="font-family:MS Shell Dlg; color:#000000; ">just throwing that out there</Text></Message><Message Date="5/23/2008" Time="11:18:39 PM" DateTime="2008-05-23T13:18:39.565Z" SessionID="16"><From><User FriendlyName="Patrick [Gec Loc] 139 - Dam it can't beat Gavin Lang"/></From><To><User FriendlyName="- James O'"/></To><Text Style="font-family:Microsoft Sans Serif; color:#800000; ">lifes like that, anyway, good night</Text></Message><Message Date="5/23/2008" Time="11:18:49 PM" DateTime="2008-05-23T13:18:49.802Z" SessionID="16"><From><User FriendlyName="- James O'"/></From><To><User FriendlyName="Patrick [Gec Loc] 139 - Dam it can't beat Gavin Lang"/></To><Text Style="font-family:MS Shell Dlg; color:#000000; ">night man</Text></Message><Invitation Date="5/24/2008" Time="1:51:23 PM" DateTime="2008-05-24T03:51:23.513Z" SessionID="17"><From><User FriendlyName="Patrick [Gec Loc] 139 - Dam it can't beat Gavin Lang"/></From><File>ERP-.doc</File><Text Style="color:#545454; ">Patrick [Gec Loc] 139 - Dam it can't beat Gavin Lang sends ERP-.doc</Text></Invitation><Message Date="5/24/2008" Time="1:51:50 PM" DateTime="2008-05-24T03:51:50.556Z" SessionID="17"><From><User FriendlyName="Patrick [Gec Loc] 139 - Dam it can't beat Gavin Lang"/></From><To><User FriendlyName="- James O'"/></To><Text Style="font-family:Microsoft Sans Serif; color:#800000; ">Early Draft, tell me if you find any errors, thanks</Text></Message><InvitationResponse Date="5/24/2008" Time="2:22:54 PM" DateTime="2008-05-24T04:22:54.116Z" SessionID="17"><From><User FriendlyName="Patrick [Gec Loc] 135 - beat Gavin Lang"/></From><File>C:\Users\James\Documents\My Received Files\ERP-.doc</File><Text Style="color:#545454; ">You have successfully received C:\Users\James\Documents\My Received Files\ERP-.doc from Patrick [Gec Loc] 135 - beat Gavin Lang.</Text></InvitationResponse><Message Date="5/24/2008" Time="3:33:05 PM" DateTime="2008-05-24T05:33:05.662Z" SessionID="18"><From><User FriendlyName="- James O'"/></From><To><User FriendlyName="Patrick [Gec Loc] 135 - beat Gavin Lang"/></To><Text Style="font-family:MS Shell Dlg; color:#000000; ">Should be done in half an hour ro so</Text></Message><Message Date="5/24/2008" Time="3:43:08 PM" DateTime="2008-05-24T05:43:08.557Z" SessionID="18"><From><User FriendlyName="- James O'"/></From><To><User FriendlyName="Patrick [Gec Loc] 135 - beat Gavin Lang"/></To><Text Style="font-family:MS Shell Dlg; color:#000000; ">U there?</Text></Message><Message Date="5/24/2008" Time="3:56:59 PM" DateTime="2008-05-24T05:56:59.248Z" SessionID="19"><From><User FriendlyName="- James O'"/></From><To><User FriendlyName="Patrick [Gec Loc] 135 - beat Gavin Lang"/></To><Text Style="font-family:MS Shell Dlg; color:#000000; ">Patrick? Come on I wanna palm of my horrible work already.</Text></Message><Invitation Date="5/24/2008" Time="4:11:23 PM" DateTime="2008-05-24T06:11:23.950Z" SessionID="19"><From><User FriendlyName="- James O'"/></From><File>C:\Users\James\Documents\Technical Feasability.doc</File><Text Style="color:#545454; ">- James O' sends C:\Users\James\Documents\Technical Feasability.doc</Text></Invitation><Message Date="5/24/2008" Time="4:12:56 PM" DateTime="2008-05-24T06:12:56.777Z" SessionID="19"><From><User FriendlyName="- James O'"/></From><To><User FriendlyName="Patrick [Gec Loc] 135 - beat Gavin Lang"/></To><Text Style="font-family:MS Shell Dlg; color:#000000; "> I emailed it to you</Text></Message><Message Date="5/24/2008" Time="9:27:07 PM" DateTime="2008-05-24T11:27:07.583Z" SessionID="20"><From><User FriendlyName="- James O'"/></From><To><User FriendlyName="Patrick [Gec Loc] 135 - beat Gavin Lang"/></To><Text Style="font-family:MS Shell Dlg; color:#000000; ">Hay</Text></Message><Message Date="5/24/2008" Time="9:27:10 PM" DateTime="2008-05-24T11:27:10.792Z" SessionID="20"><From><User FriendlyName="- James O'"/></From><To><User FriendlyName="Patrick [Gec Loc] 135 - beat Gavin Lang"/></To><Text Style="font-family:MS Shell Dlg; color:#000000; ">u get the email&gt;?</Text></Message><Message Date="5/24/2008" Time="9:32:32 PM" DateTime="2008-05-24T11:32:32.942Z" SessionID="21"><From><User FriendlyName="Patrick [Gec Loc] 135 - beat Gavin Lang"/></From><To><User FriendlyName="- James O'"/></To><Text Style="font-family:Microsoft Sans Serif; color:#800000; ">Yep, thanks man</Text></Message><Message Date="5/24/2008" Time="9:32:41 PM" DateTime="2008-05-24T11:32:41.067Z" SessionID="21"><From><User FriendlyName="- James O'"/></From><To><User FriendlyName="Patrick [Gec Loc] 135 - beat Gavin Lang"/></To><Text Style="font-family:MS Shell Dlg; color:#000000; ">mmk</Text></Message><Message Date="5/24/2008" Time="9:32:45 PM" DateTime="2008-05-24T11:32:45.481Z" SessionID="21"><From><User FriendlyName="- James O'"/></From><To><User FriendlyName="Patrick [Gec Loc] 135 - beat Gavin Lang"/></To><Text Style="font-family:MS Shell Dlg; color:#000000; ">sick</Text></Message><Message Date="5/24/2008" Time="9:32:55 PM" DateTime="2008-05-24T11:32:55.104Z" SessionID="21"><From><User FriendlyName="- James O'"/></From><To><User FriendlyName="Patrick [Gec Loc] 135 - beat Gavin Lang"/></To><Text Style="font-family:MS Shell Dlg; color:#000000; ">did it come up with like 50 spelling mistakes?</Text></Message><Message Date="5/24/2008" Time="9:33:03 PM" DateTime="2008-05-24T11:33:03.312Z" SessionID="21"><From><User FriendlyName="- James O'"/></From><To><User FriendlyName="Patrick [Gec Loc] 135 - beat Gavin Lang"/></To><Text Style="font-family:MS Shell Dlg; color:#000000; ">cuz my spellchecker appeard to have died on word 07</Text></Message><Message Date="5/24/2008" Time="9:33:28 PM" DateTime="2008-05-24T11:33:28.066Z" SessionID="22"><From><User FriendlyName="Patrick [Gec Loc] 135 - beat Gavin Lang"/></From><To><User FriendlyName="- James O'"/></To><Text Style="font-family:Microsoft Sans Serif; color:#800000; ">lol, i'll check it now</Text></Message><Message Date="5/24/2008" Time="9:33:50 PM" DateTime="2008-05-24T11:33:50.029Z" SessionID="22"><From><User FriendlyName="Patrick [Gec Loc] 135 - beat Gavin Lang"/></From><To><User FriendlyName="- James O'"/></To><Text Style="font-family:Microsoft Sans Serif; color:#800000; ">nothing man</Text></Message><Message Date="5/24/2008" Time="9:33:57 PM" DateTime="2008-05-24T11:33:57.542Z" SessionID="22"><From><User FriendlyName="Patrick [Gec Loc] 135 - beat Gavin Lang"/></From><To><User FriendlyName="- James O'"/></To><Text Style="font-family:Microsoft Sans Serif; color:#800000; ">fairly amazing without spell check</Text></Message><Message Date="5/24/2008" Time="9:34:17 PM" DateTime="2008-05-24T11:34:17.072Z" SessionID="22"><From><User FriendlyName="Patrick [Gec Loc] 135 - beat Gavin Lang"/></From><To><User FriendlyName="- James O'"/></To><Text Style="font-family:Microsoft Sans Serif; color:#800000; ">IMine works and i still let 4 to 5 spelling typos go through each essays i write</Text></Message><Message Date="5/24/2008" Time="9:34:39 PM" DateTime="2008-05-24T11:34:39.853Z" SessionID="22"><From><User FriendlyName="Patrick [Gec Loc] 135 - beat Gavin Lang"/></From><To><User FriendlyName="- James O'"/></To><Text Style="font-family:Microsoft Sans Serif; color:#800000; ">and good word count man</Text></Message><Message Date="5/24/2008" Time="9:36:01 PM" DateTime="2008-05-24T11:36:01.580Z" SessionID="22"><From><User FriendlyName="- James O'"/></From><To><User FriendlyName="Patrick [Gec Loc] 135 - beat Gavin Lang"/></To><Text Style="font-family:MS Shell Dlg; color:#000000; ">Yeah, I cranked it out this arvo, ugh</Text></Message><Message Date="5/24/2008" Time="9:36:06 PM" DateTime="2008-05-24T11:36:06.497Z" SessionID="22"><From><User FriendlyName="- James O'"/></From><To><User FriendlyName="Patrick [Gec Loc] 135 - beat Gavin Lang"/></To><Text Style="font-family:MS Shell Dlg; color:#000000; ">I hope I answered the question right</Text></Message><Message Date="5/24/2008" Time="9:36:26 PM" DateTime="2008-05-24T11:36:26.363Z" SessionID="23"><From><User FriendlyName="Patrick [Gec Loc] 135 - beat Gavin Lang"/></From><To><User FriendlyName="- James O'"/></To><Text Style="font-family:Microsoft Sans Serif; color:#800000; ">any suggestions or corrections you want to make to the report?</Text></Message><Message Date="5/24/2008" Time="9:37:07 PM" DateTime="2008-05-24T11:37:07.850Z" SessionID="23"><From><User FriendlyName="- James O'"/></From><To><User FriendlyName="Patrick [Gec Loc] 135 - beat Gavin Lang"/></To><Text Style="font-family:MS Shell Dlg; color:#000000; ">It was all looking pretty top notch</Text></Message><Message Date="5/24/2008" Time="9:37:19 PM" DateTime="2008-05-24T11:37:19.450Z" SessionID="23"><From><User FriendlyName="- James O'"/></From><To><User FriendlyName="Patrick [Gec Loc] 135 - beat Gavin Lang"/></To><Text Style="font-family:MS Shell Dlg; color:#000000; ">If u wanna re-word my last paragraph or intro u can, its a bit sloppy</Text></Message><Message Date="5/24/2008" Time="9:37:40 PM" DateTime="2008-05-24T11:37:40.297Z" SessionID="23"><From><User FriendlyName="Patrick [Gec Loc] 135 - beat Gavin Lang"/></From><To><User FriendlyName="- James O'"/></To><Text Style="font-family:Microsoft Sans Serif; color:#800000; ">ok i'll have a read first</Text></Message><Message Date="5/24/2008" Time="9:37:51 PM" DateTime="2008-05-24T11:37:51.704Z" SessionID="23"><From><User FriendlyName="Patrick [Gec Loc] 135 - beat Gavin Lang"/></From><To><User FriendlyName="- James O'"/></To><Text Style="font-family:Microsoft Sans Serif; color:#800000; ">references, can you provide any? thanks</Text></Message><Message Date="5/24/2008" Time="9:38:24 PM" DateTime="2008-05-24T11:38:24.020Z" SessionID="23"><From><User FriendlyName="Patrick [Gec Loc] 135 - beat Gavin Lang"/></From><To><User FriendlyName="- James O'"/></To><Text Style="font-family:Microsoft Sans Serif; color:#800000; ">I need Mohumad to send me his as well</Text></Message><Message Date="5/24/2008" Time="9:38:37 PM" DateTime="2008-05-24T11:38:37.147Z" SessionID="23"><From><User FriendlyName="- James O'"/></From><To><User FriendlyName="Patrick [Gec Loc] 135 - beat Gavin Lang"/></To><Text Style="font-family:MS Shell Dlg; color:#000000; ">Not really, I used wiki pedia</Text></Message><Message Date="5/24/2008" Time="9:38:50 PM" DateTime="2008-05-24T11:38:50.407Z" SessionID="23"><From><User FriendlyName="- James O'"/></From><To><User FriendlyName="Patrick [Gec Loc] 135 - beat Gavin Lang"/></To><Text Style="font-family:MS Shell Dlg; color:#000000; ">for the last bit</Text></Message><Message Date="5/24/2008" Time="9:39:37 PM" DateTime="2008-05-24T11:39:37.211Z" SessionID="23"><From><User FriendlyName="- James O'"/></From><To><User FriendlyName="Patrick [Gec Loc] 135 - beat Gavin Lang"/></To><Text Style="font-family:MS Shell Dlg; color:#000000; ">but I dont think thats a reosurce to get all excited about using</Text></Message><Message Date="5/24/2008" Time="9:39:40 PM" DateTime="2008-05-24T11:39:40.178Z" SessionID="23"><From><User FriendlyName="- James O'"/></From><To><User FriendlyName="Patrick [Gec Loc] 135 - beat Gavin Lang"/></To><Text Style="font-family:MS Shell Dlg; color:#000000; ">theres was one other</Text></Message><Message Date="5/24/2008" Time="9:39:45 PM" DateTime="2008-05-24T11:39:45.665Z" SessionID="23"><From><User FriendlyName="- James O'"/></From><To><User FriendlyName="Patrick [Gec Loc] 135 - beat Gavin Lang"/></To><Text Style="font-family:MS Shell Dlg; color:#000000; ">but u can use the links from my part 1?</Text></Message><Message Date="5/24/2008" Time="9:39:53 PM" DateTime="2008-05-24T11:39:53.073Z" SessionID="23"><From><User FriendlyName="- James O'"/></From><To><User FriendlyName="Patrick [Gec Loc] 135 - beat Gavin Lang"/></To><Text Style="font-family:MS Shell Dlg; color:#000000; ">for jono's part 1</Text></Message><Message Date="5/24/2008" Time="9:39:56 PM" DateTime="2008-05-24T11:39:56.815Z" SessionID="23"><From><User FriendlyName="- James O'"/></From><To><User FriendlyName="Patrick [Gec Loc] 135 - beat Gavin Lang"/></To><Text Style="font-family:MS Shell Dlg; color:#000000; ">cuz he only had 1 link</Text></Message><Message Date="5/24/2008" Time="9:40:43 PM" DateTime="2008-05-24T11:40:43.140Z" SessionID="23"><From><User FriendlyName="Patrick [Gec Loc] 135 - beat Gavin Lang"/></From><To><User FriendlyName="- James O'"/></To><Text Style="font-family:Microsoft Sans Serif; color:#800000; ">I am not sure which person's part one i used</Text></Message><Message Date="5/24/2008" Time="9:40:55 PM" DateTime="2008-05-24T11:40:55.507Z" SessionID="23"><From><User FriendlyName="- James O'"/></From><To><User FriendlyName="Patrick [Gec Loc] 135 - beat Gavin Lang"/></To><Text Style="font-family:MS Shell Dlg; color:#000000; ">it was jonos in the one u sent me</Text></Message><Message Date="5/24/2008" Time="9:41:03 PM" DateTime="2008-05-24T11:41:03.238Z" SessionID="23"><From><User FriendlyName="Patrick [Gec Loc] 135 - beat Gavin Lang"/></From><To><User FriendlyName="- James O'"/></To><Text Style="font-family:Microsoft Sans Serif; color:#800000; ">is it ok?</Text></Message><Message Date="5/24/2008" Time="9:41:14 PM" DateTime="2008-05-24T11:41:14.080Z" SessionID="23"><From><User FriendlyName="- James O'"/></From><To><User FriendlyName="Patrick [Gec Loc] 135 - beat Gavin Lang"/></To><Text Style="font-family:MS Shell Dlg; color:#000000; ">?</Text></Message><Message Date="5/24/2008" Time="9:41:28 PM" DateTime="2008-05-24T11:41:28.453Z" SessionID="23"><From><User FriendlyName="Patrick [Gec Loc] 135 - beat Gavin Lang"/></From><To><User FriendlyName="- James O'"/></To><Text Style="font-family:Microsoft Sans Serif; color:#800000; ">Everyone had some flow problems in the sentences they wrote but i fixed them, wasn't too bad</Text></Message><Message Date="5/24/2008" Time="9:41:37 PM" DateTime="2008-05-24T11:41:37.618Z" SessionID="23"><From><User FriendlyName="Patrick [Gec Loc] 135 - beat Gavin Lang"/></From><To><User FriendlyName="- James O'"/></To><Text Style="font-family:Microsoft Sans Serif; color:#800000; ">is Jono's part alrgiht to use??</Text></Message><Message Date="5/24/2008" Time="9:41:44 PM" DateTime="2008-05-24T11:41:44.285Z" SessionID="23"><From><User FriendlyName="Patrick [Gec Loc] 135 - beat Gavin Lang"/></From><To><User FriendlyName="- James O'"/></To><Text Style="font-family:Microsoft Sans Serif; color:#800000; ">or do you think your one was better?</Text></Message><Message Date="5/24/2008" Time="9:41:47 PM" DateTime="2008-05-24T11:41:47.119Z" SessionID="23"><From><User FriendlyName="- James O'"/></From><To><User FriendlyName="Patrick [Gec Loc] 135 - beat Gavin Lang"/></To><Text Style="font-family:MS Shell Dlg; color:#000000; ">I didn't read thru all of his</Text></Message><Message Date="5/24/2008" Time="9:41:53 PM" DateTime="2008-05-24T11:41:53.603Z" SessionID="23"><From><User FriendlyName="- James O'"/></From><To><User FriendlyName="Patrick [Gec Loc] 135 - beat Gavin Lang"/></To><Text Style="font-family:MS Shell Dlg; color:#000000; ">but it looked ok...</Text></Message><Message Date="5/24/2008" Time="9:42:27 PM" DateTime="2008-05-24T11:42:27.510Z" SessionID="23"><From><User FriendlyName="Patrick [Gec Loc] 135 - beat Gavin Lang"/></From><To><User FriendlyName="- James O'"/></To><Text Style="font-family:Microsoft Sans Serif; color:#800000; ">I guess if it is ok we should use it otherswise it won't be nice to have him contributing nothing</Text></Message><Message Date="5/24/2008" Time="9:42:50 PM" DateTime="2008-05-24T11:42:50.311Z" SessionID="23"><From><User FriendlyName="- James O'"/></From><To><User FriendlyName="Patrick [Gec Loc] 135 - beat Gavin Lang"/></To><Text Style="font-family:MS Shell Dlg; color:#000000; ">yeah, course, I just didn't really read what he wrote</Text></Message><Message Date="5/24/2008" Time="9:43:04 PM" DateTime="2008-05-24T11:43:04.101Z" SessionID="23"><From><User FriendlyName="Patrick [Gec Loc] 135 - beat Gavin Lang"/></From><To><User FriendlyName="- James O'"/></To><Text Style="font-family:Microsoft Sans Serif; color:#800000; ">So in the reflections you want me to write you did Q3 and jono did Q2? </Text></Message><Message Date="5/24/2008" Time="9:43:07 PM" DateTime="2008-05-24T11:43:07.999Z" SessionID="23"><From><User FriendlyName="Patrick [Gec Loc] 135 - beat Gavin Lang"/></From><To><User FriendlyName="- James O'"/></To><Text Style="font-family:Microsoft Sans Serif; color:#800000; ">me either, lol</Text></Message><Message Date="5/24/2008" Time="9:43:36 PM" DateTime="2008-05-24T11:43:36.653Z" SessionID="23"><From><User FriendlyName="Patrick [Gec Loc] 135 - beat Gavin Lang"/></From><To><User FriendlyName="- James O'"/></To><Text Style="font-family:Microsoft Sans Serif; color:#800000; ">I have to do some stupid Celm test asap for Commerce subjects, its like doing the ILIP all over again, stupid thing</Text></Message><Message Date="5/24/2008" Time="9:43:38 PM" DateTime="2008-05-24T11:43:38.833Z" SessionID="23"><From><User FriendlyName="- James O'"/></From><To><User FriendlyName="Patrick [Gec Loc] 135 - beat Gavin Lang"/></To><Text Style="font-family:MS Shell Dlg; color:#000000; ">yeah, sure if my stuff wasn't used,</Text></Message><Message Date="5/24/2008" Time="9:43:49 PM" DateTime="2008-05-24T11:43:49.318Z" SessionID="23"><From><User FriendlyName="- James O'"/></From><To><User FriendlyName="Patrick [Gec Loc] 135 - beat Gavin Lang"/></To><Text Style="font-family:MS Shell Dlg; color:#000000; ">argh gay</Text></Message><Message Date="5/24/2008" Time="9:44:23 PM" DateTime="2008-05-24T11:44:23.643Z" SessionID="23"><From><User FriendlyName="- James O'"/></From><To><User FriendlyName="Patrick [Gec Loc] 135 - beat Gavin Lang"/></To><Text Style="font-family:MS Shell Dlg; color:#000000; ">Im watching some english starcraft tourney matches</Text></Message><Message Date="5/24/2008" Time="9:44:45 PM" DateTime="2008-05-24T11:44:45.081Z" SessionID="23"><From><User FriendlyName="- James O'"/></From><To><User FriendlyName="Patrick [Gec Loc] 135 - beat Gavin Lang"/></To><Text Style="font-family:MS Shell Dlg; color:#000000; ">(korean match, english shoutcast)</Text></Message><Message Date="5/24/2008" Time="9:45:16 PM" DateTime="2008-05-24T11:45:16.543Z" SessionID="23"><From><User FriendlyName="Patrick [Gec Loc] 135 - beat Gavin Lang"/></From><To><User FriendlyName="- James O'"/></To><Text Style="font-family:Microsoft Sans Serif; color:#800000; ">I'll try and finish it off tonight and then send to everyone for a final look and then submit tomorrow, so if i don't catch you online I'll just send it to your e-mail and if you don't send me suggestions or whatever I'll submit it by 3-4ish</Text></Message><Message Date="5/24/2008" Time="9:45:48 PM" DateTime="2008-05-24T11:45:48.437Z" SessionID="23"><From><User FriendlyName="Patrick [Gec Loc] 135 - beat Gavin Lang"/></From><To><User FriendlyName="- James O'"/></To><Text Style="font-family:Microsoft Sans Serif; color:#800000; ">what is it? I've never heard of it, and also my weak 256kb broadband won't load much video, lol</Text></Message><Message Date="5/24/2008" Time="9:45:50 PM" DateTime="2008-05-24T11:45:50.363Z" SessionID="23"><From><User FriendlyName="- James O'"/></From><To><User FriendlyName="Patrick [Gec Loc] 135 - beat Gavin Lang"/></To><Text Style="font-family:MS Shell Dlg; color:#000000; ">yeah thats fine, you've done so much man, we trust you to submit as u see fit</Text></Message><Message Date="5/24/2008" Time="9:46:16 PM" DateTime="2008-05-24T11:46:16.566Z" SessionID="23"><From><User FriendlyName="- James O'"/></From><To><User FriendlyName="Patrick [Gec Loc] 135 - beat Gavin Lang"/></To><Text Style="font-family:MS Shell Dlg; color:#000000; ">Its in there own flash video, thers a tourny going on at the moment,</Text></Message><Message Date="5/24/2008" Time="9:46:28 PM" DateTime="2008-05-24T11:46:28.771Z" SessionID="23"><From><User FriendlyName="Patrick [Gec Loc] 135 - beat Gavin Lang"/></From><To><User FriendlyName="- James O'"/></To><Text Style="font-family:Microsoft Sans Serif; color:#800000; ">link?</Text></Message><Message Date="5/24/2008" Time="9:46:50 PM" DateTime="2008-05-24T11:46:50.135Z" SessionID="23"><From><User FriendlyName="- James O'"/></From><To><User FriendlyName="Patrick [Gec Loc] 135 - beat Gavin Lang"/></To><Text Style="font-family:MS Shell Dlg; color:#000000; ">http://www.gomtv.net/classic/vod/165</Text></Message><Message Date="5/24/2008" Time="9:46:57 PM" DateTime="2008-05-24T11:46:57.665Z" SessionID="23"><From><User FriendlyName="- James O'"/></From><To><User FriendlyName="Patrick [Gec Loc] 135 - beat Gavin Lang"/></To><Text Style="font-family:MS Shell Dlg; color:#000000; ">This is the one I'm watching atm</Text></Message><Message Date="5/24/2008" Time="9:47:07 PM" DateTime="2008-05-24T11:47:07.080Z" SessionID="23"><From><User FriendlyName="Patrick [Gec Loc] 135 - beat Gavin Lang"/></From><To><User FriendlyName="- James O'"/></To><Text Style="font-family:Microsoft Sans Serif; color:#800000; ">cool, i'll check it out, thanks man</Text></Message><Message Date="5/24/2008" Time="9:47:12 PM" DateTime="2008-05-24T11:47:12.081Z" SessionID="23"><From><User FriendlyName="- James O'"/></From><To><User FriendlyName="Patrick [Gec Loc] 135 - beat Gavin Lang"/></To><Text Style="font-family:MS Shell Dlg; color:#000000; ">np</Text></Message><Message Date="5/24/2008" Time="9:47:54 PM" DateTime="2008-05-24T11:47:54.098Z" SessionID="23"><From><User FriendlyName="- James O'"/></From><To><User FriendlyName="Patrick [Gec Loc] 135 - beat Gavin Lang"/></To><Text Style="font-family:MS Shell Dlg; color:#000000; ">that ones a bit short</Text></Message><Message Date="5/24/2008" Time="9:48:02 PM" DateTime="2008-05-24T11:48:02.961Z" SessionID="23"><From><User FriendlyName="- James O'"/></From><To><User FriendlyName="Patrick [Gec Loc] 135 - beat Gavin Lang"/></To><Text Style="font-family:MS Shell Dlg; color:#000000; ">check this oen out</Text></Message><Message Date="5/24/2008" Time="9:48:04 PM" DateTime="2008-05-24T11:48:04.873Z" SessionID="23"><From><User FriendlyName="- James O'"/></From><To><User FriendlyName="Patrick [Gec Loc] 135 - beat Gavin Lang"/></To><Text Style="font-family:MS Shell Dlg; color:#000000; ">http://www.gomtv.net/classic/vod/164</Text></Message><Message Date="5/24/2008" Time="9:48:07 PM" DateTime="2008-05-24T11:48:07.608Z" SessionID="23"><From><User FriendlyName="- James O'"/></From><To><User FriendlyName="Patrick [Gec Loc] 135 - beat Gavin Lang"/></To><Text Style="font-family:MS Shell Dlg; color:#000000; ">Final match</Text></Message><Message Date="5/24/2008" Time="9:48:08 PM" DateTime="2008-05-24T11:48:08.944Z" SessionID="23"><From><User FriendlyName="- James O'"/></From><To><User FriendlyName="Patrick [Gec Loc] 135 - beat Gavin Lang"/></To><Text Style="font-family:MS Shell Dlg; color:#000000; ">so hectic</Text></Message><Message Date="5/24/2008" Time="9:48:40 PM" DateTime="2008-05-24T11:48:40.988Z" SessionID="23"><From><User FriendlyName="- James O'"/></From><To><User FriendlyName="Patrick [Gec Loc] 135 - beat Gavin Lang"/></To><Text Style="font-family:MS Shell Dlg; color:#000000; ">better watch than the first one</Text></Message><Message Date="5/24/2008" Time="10:12:39 PM" DateTime="2008-05-24T12:12:39.936Z" SessionID="23"><From><User FriendlyName="Patrick [Gec Loc] 135 - beat Gavin Lang"/></From><To><User FriendlyName="- James O'"/></To><Text Style="font-family:Microsoft Sans Serif; color:#800000; ">that is the maddest game show</Text></Message><Message Date="5/24/2008" Time="10:13:11 PM" DateTime="2008-05-24T12:13:11.670Z" SessionID="23"><From><User FriendlyName="- James O'"/></From><To><User FriendlyName="Patrick [Gec Loc] 135 - beat Gavin Lang"/></To><Text Style="font-family:MS Shell Dlg; color:#000000; ">haha yeah, Mad to watch ay</Text></Message><Message Date="5/24/2008" Time="10:13:21 PM" DateTime="2008-05-24T12:13:21.155Z" SessionID="23"><From><User FriendlyName="- James O'"/></From><To><User FriendlyName="Patrick [Gec Loc] 135 - beat Gavin Lang"/></To><Text Style="font-family:MS Shell Dlg; color:#000000; ">Played starcraft?</Text></Message><Message Date="5/24/2008" Time="10:13:44 PM" DateTime="2008-05-24T12:13:44.249Z" SessionID="23"><From><User FriendlyName="Patrick [Gec Loc] 135 - beat Gavin Lang"/></From><To><User FriendlyName="- James O'"/></To><Text Style="font-family:Microsoft Sans Serif; color:#800000; ">nah, HSC killed all my gaming abilities</Text></Message><Message Date="5/24/2008" Time="10:13:57 PM" DateTime="2008-05-24T12:13:57.593Z" SessionID="23"><From><User FriendlyName="- James O'"/></From><To><User FriendlyName="Patrick [Gec Loc] 135 - beat Gavin Lang"/></To><Text Style="font-family:MS Shell Dlg; color:#000000; ">well not like these guys</Text></Message><Message Date="5/24/2008" Time="10:13:57 PM" DateTime="2008-05-24T12:13:57.876Z" SessionID="23"><From><User FriendlyName="Patrick [Gec Loc] 135 - beat Gavin Lang"/></From><To><User FriendlyName="- James O'"/></To><Text Style="font-family:Microsoft Sans Serif; color:#800000; ">i got all the equiptment for it now, just have to find a good game</Text></Message><Message Date="5/24/2008" Time="10:14:26 PM" DateTime="2008-05-24T12:14:26.633Z" SessionID="23"><From><User FriendlyName="Patrick [Gec Loc] 135 - beat Gavin Lang"/></From><To><User FriendlyName="- James O'"/></To><Text Style="font-family:Microsoft Sans Serif; color:#800000; ">lol, yeah they must have like a trainner or something, lol, its crazy</Text></Message><Message Date="5/24/2008" Time="10:14:36 PM" DateTime="2008-05-24T12:14:36.098Z" SessionID="23"><From><User FriendlyName="Patrick [Gec Loc] 135 - beat Gavin Lang"/></From><To><User FriendlyName="- James O'"/></To><Text Style="font-family:Microsoft Sans Serif; color:#800000; ">I wonder if they OC</Text></Message><Message Date="5/24/2008" Time="10:14:54 PM" DateTime="2008-05-24T12:14:54.979Z" SessionID="23"><From><User FriendlyName="- James O'"/></From><To><User FriendlyName="Patrick [Gec Loc] 135 - beat Gavin Lang"/></To><Text Style="font-family:MS Shell Dlg; color:#000000; ">Overclock?</Text></Message><Message Date="5/24/2008" Time="10:14:56 PM" DateTime="2008-05-24T12:14:56.984Z" SessionID="23"><From><User FriendlyName="- James O'"/></From><To><User FriendlyName="Patrick [Gec Loc] 135 - beat Gavin Lang"/></To><Text Style="font-family:MS Shell Dlg; color:#000000; ">for starcraft?</Text></Message><Message Date="5/24/2008" Time="10:15:06 PM" DateTime="2008-05-24T12:15:06.680Z" SessionID="23"><From><User FriendlyName="Patrick [Gec Loc] 135 - beat Gavin Lang"/></From><To><User FriendlyName="- James O'"/></To><Text Style="font-family:Microsoft Sans Serif; color:#800000; ">yeah</Text></Message><Message Date="5/24/2008" Time="10:15:12 PM" DateTime="2008-05-24T12:15:12.216Z" SessionID="23"><From><User FriendlyName="Patrick [Gec Loc] 135 - beat Gavin Lang"/></From><To><User FriendlyName="- James O'"/></To><Text Style="font-family:Microsoft Sans Serif; color:#800000; ">don't need it?</Text></Message><Message Date="5/24/2008" Time="10:15:23 PM" DateTime="2008-05-24T12:15:23.207Z" SessionID="23"><From><User FriendlyName="- James O'"/></From><To><User FriendlyName="Patrick [Gec Loc] 135 - beat Gavin Lang"/></To><Text Style="font-family:MS Shell Dlg; color:#000000; ">game runs on a penitum 2</Text></Message><Message Date="5/24/2008" Time="10:15:31 PM" DateTime="2008-05-24T12:15:31.268Z" SessionID="23"><From><User FriendlyName="Patrick [Gec Loc] 135 - beat Gavin Lang"/></From><To><User FriendlyName="- James O'"/></To><Text Style="font-family:Microsoft Sans Serif; color:#800000; ">I am looking at playing GTA, but want the prices to coem down</Text></Message><Message Date="5/24/2008" Time="10:15:41 PM" DateTime="2008-05-24T12:15:41.060Z" SessionID="23"><From><User FriendlyName="Patrick [Gec Loc] 135 - beat Gavin Lang"/></From><To><User FriendlyName="- James O'"/></To><Text Style="font-family:Microsoft Sans Serif; color:#800000; ">lol, so tis a long time ago</Text></Message><Message Date="5/24/2008" Time="10:15:42 PM" DateTime="2008-05-24T12:15:42.260Z" SessionID="23"><From><User FriendlyName="- James O'"/></From><To><User FriendlyName="Patrick [Gec Loc] 135 - beat Gavin Lang"/></To><Text Style="font-family:MS Shell Dlg; color:#000000; ">GTA IV?</Text></Message><Message Date="5/24/2008" Time="10:15:47 PM" DateTime="2008-05-24T12:15:47.614Z" SessionID="23"><From><User FriendlyName="Patrick [Gec Loc] 135 - beat Gavin Lang"/></From><To><User FriendlyName="- James O'"/></To><Text Style="font-family:Microsoft Sans Serif; color:#800000; ">yeah the new one</Text></Message><Message Date="5/24/2008" Time="10:15:52 PM" DateTime="2008-05-24T12:15:52.787Z" SessionID="23"><From><User FriendlyName="- James O'"/></From><To><User FriendlyName="Patrick [Gec Loc] 135 - beat Gavin Lang"/></To><Text Style="font-family:MS Shell Dlg; color:#000000; ">Got a 360 or PS3?</Text></Message><Message Date="5/24/2008" Time="10:16:05 PM" DateTime="2008-05-24T12:16:05.618Z" SessionID="23"><From><User FriendlyName="Patrick [Gec Loc] 135 - beat Gavin Lang"/></From><To><User FriendlyName="- James O'"/></To><Text Style="font-family:Microsoft Sans Serif; color:#800000; ">Vice City was alright and i heard this one is overkill </Text></Message><Message Date="5/24/2008" Time="10:16:17 PM" DateTime="2008-05-24T12:16:17.278Z" SessionID="23"><From><User FriendlyName="Patrick [Gec Loc] 135 - beat Gavin Lang"/></From><To><User FriendlyName="- James O'"/></To><Text Style="font-family:Microsoft Sans Serif; color:#800000; ">nah, waiting for PC version</Text></Message><Message Date="5/24/2008" Time="10:16:20 PM" DateTime="2008-05-24T12:16:20.976Z" SessionID="23"><From><User FriendlyName="- James O'"/></From><To><User FriendlyName="Patrick [Gec Loc] 135 - beat Gavin Lang"/></To><Text Style="font-family:MS Shell Dlg; color:#000000; ">Yeah same as</Text></Message><Message Date="5/24/2008" Time="10:16:21 PM" DateTime="2008-05-24T12:16:21.768Z" SessionID="23"><From><User FriendlyName="- James O'"/></From><To><User FriendlyName="Patrick [Gec Loc] 135 - beat Gavin Lang"/></To><Text Style="font-family:MS Shell Dlg; color:#000000; ">:(</Text></Message><Message Date="5/24/2008" Time="10:16:28 PM" DateTime="2008-05-24T12:16:28.462Z" SessionID="23"><From><User FriendlyName="- James O'"/></From><To><User FriendlyName="Patrick [Gec Loc] 135 - beat Gavin Lang"/></To><Text Style="font-family:MS Shell Dlg; color:#000000; ">I was thinking of buying a 360 for it</Text></Message><Message Date="5/24/2008" Time="10:16:36 PM" DateTime="2008-05-24T12:16:36.538Z" SessionID="23"><From><User FriendlyName="Patrick [Gec Loc] 135 - beat Gavin Lang"/></From><To><User FriendlyName="- James O'"/></To><Text Style="font-family:Microsoft Sans Serif; color:#800000; ">lol, thats extreme</Text></Message><Message Date="5/24/2008" Time="10:16:38 PM" DateTime="2008-05-24T12:16:38.488Z" SessionID="23"><From><User FriendlyName="- James O'"/></From><To><User FriendlyName="Patrick [Gec Loc] 135 - beat Gavin Lang"/></To><Text Style="font-family:MS Shell Dlg; color:#000000; ">But I know it will come to PC... eventually</Text></Message><Message Date="5/24/2008" Time="10:16:50 PM" DateTime="2008-05-24T12:16:50.710Z" SessionID="23"><From><User FriendlyName="Patrick [Gec Loc] 135 - beat Gavin Lang"/></From><To><User FriendlyName="- James O'"/></To><Text Style="font-family:Microsoft Sans Serif; color:#800000; ">I've learnt to love the mouse and wasd for games</Text></Message><Message Date="5/24/2008" Time="10:17:03 PM" DateTime="2008-05-24T12:17:03.988Z" SessionID="23"><From><User FriendlyName="Patrick [Gec Loc] 135 - beat Gavin Lang"/></From><To><User FriendlyName="- James O'"/></To><Text Style="font-family:Microsoft Sans Serif; color:#800000; ">Sony had good controlelrs but i don't like the others</Text></Message><Message Date="5/24/2008" Time="10:17:19 PM" DateTime="2008-05-24T12:17:19.489Z" SessionID="23"><From><User FriendlyName="- James O'"/></From><To><User FriendlyName="Patrick [Gec Loc] 135 - beat Gavin Lang"/></To><Text Style="font-family:MS Shell Dlg; color:#000000; ">yeah, I'm not a big console gamer, I got a Wii and ds/psp</Text></Message><Message Date="5/24/2008" Time="10:18:01 PM" DateTime="2008-05-24T12:18:01.528Z" SessionID="23"><From><User FriendlyName="Patrick [Gec Loc] 135 - beat Gavin Lang"/></From><To><User FriendlyName="- James O'"/></To><Text Style="font-family:Microsoft Sans Serif; color:#800000; ">I want a protable gaming device for bus rides, my lapotp was going to be my solution in mind but it is way too big for the space provided on the bus</Text></Message><Message Date="5/24/2008" Time="10:18:32 PM" DateTime="2008-05-24T12:18:32.666Z" SessionID="23"><From><User FriendlyName="- James O'"/></From><To><User FriendlyName="Patrick [Gec Loc] 135 - beat Gavin Lang"/></To><Text Style="font-family:MS Shell Dlg; color:#000000; ">Yeah, laptops good, but u need a bitta room</Text></Message><Message Date="5/24/2008" Time="10:18:45 PM" DateTime="2008-05-24T12:18:45.342Z" SessionID="23"><From><User FriendlyName="- James O'"/></From><To><User FriendlyName="Patrick [Gec Loc] 135 - beat Gavin Lang"/></To><Text Style="font-family:MS Shell Dlg; color:#000000; ">It depends wat sorta games u wanna play, both are great systems</Text></Message><Message Date="5/24/2008" Time="10:19:06 PM" DateTime="2008-05-24T12:19:06.315Z" SessionID="23"><From><User FriendlyName="- James O'"/></From><To><User FriendlyName="Patrick [Gec Loc] 135 - beat Gavin Lang"/></To><Text Style="font-family:MS Shell Dlg; color:#000000; ">brb</Text></Message><Message Date="5/24/2008" Time="10:19:12 PM" DateTime="2008-05-24T12:19:12.528Z" SessionID="23"><From><User FriendlyName="Patrick [Gec Loc] 135 - beat Gavin Lang"/></From><To><User FriendlyName="- James O'"/></To><Text Style="font-family:Microsoft Sans Serif; color:#800000; ">k</Text></Message><Message Date="5/24/2008" Time="10:33:12 PM" DateTime="2008-05-24T12:33:12.106Z" SessionID="23"><From><User FriendlyName="Patrick [Gec Loc] 135 - beat Gavin Lang"/></From><To><User FriendlyName="- James O'"/></To><Text Style="font-family:Microsoft Sans Serif; color:#800000; ">LOL, for some reason the document you sent me doesn't detect spelling errors either, I copy and pasted into report and came up with ~18 typos</Text></Message><Message Date="5/24/2008" Time="10:33:55 PM" DateTime="2008-05-24T12:33:55.480Z" SessionID="23"><From><User FriendlyName="- James O'"/></From><To><User FriendlyName="Patrick [Gec Loc] 135 - beat Gavin Lang"/></To><Text Style="font-family:MS Shell Dlg; color:#000000; ">yeah...</Text></Message><Message Date="5/24/2008" Time="10:34:01 PM" DateTime="2008-05-24T12:34:01.549Z" SessionID="23"><From><User FriendlyName="- James O'"/></From><To><User FriendlyName="Patrick [Gec Loc] 135 - beat Gavin Lang"/></To><Text Style="font-family:MS Shell Dlg; color:#000000; ">Something funky happend there</Text></Message><Message Date="5/24/2008" Time="10:34:07 PM" DateTime="2008-05-24T12:34:07.244Z" SessionID="23"><From><User FriendlyName="- James O'"/></From><To><User FriendlyName="Patrick [Gec Loc] 135 - beat Gavin Lang"/></To><Text Style="font-family:MS Shell Dlg; color:#000000; ">I gtg</Text></Message><Message Date="5/24/2008" Time="10:34:16 PM" DateTime="2008-05-24T12:34:16.475Z" SessionID="23"><From><User FriendlyName="- James O'"/></From><To><User FriendlyName="Patrick [Gec Loc] 135 - beat Gavin Lang"/></To><Text Style="font-family:MS Shell Dlg; color:#000000; ">suprise outing</Text></Message><Message Date="5/24/2008" Time="10:34:22 PM" DateTime="2008-05-24T12:34:22.608Z" SessionID="23"><From><User FriendlyName="Patrick [Gec Loc] 135 - beat Gavin Lang"/></From><To><User FriendlyName="- James O'"/></To><Text Style="font-family:Microsoft Sans Serif; color:#800000; ">kk</Text></Message><Message Date="5/25/2008" Time="12:46:08 PM" DateTime="2008-05-25T02:46:08.306Z" SessionID="24"><From><User FriendlyName="- James O'"/></From><To><User FriendlyName="Patrick [Gec Loc] 134"/></To><Text Style="font-family:MS Shell Dlg; color:#000000; ">hay, howsit going?</Text></Message><Message Date="5/25/2008" Time="1:22:36 PM" DateTime="2008-05-25T03:22:36.274Z" SessionID="25"><From><User FriendlyName="Patrick [Gec Loc] 134"/></From><To><User FriendlyName="- James O'"/></To><Text Style="font-family:Microsoft Sans Serif; color:#800000; ">hi, sorry man, was playing wormux</Text></Message><Message Date="5/25/2008" Time="1:22:39 PM" DateTime="2008-05-25T03:22:39.759Z" SessionID="25"><From><User FriendlyName="Patrick [Gec Loc] 134"/></From><To><User FriendlyName="- James O'"/></To><Text Style="font-family:Microsoft Sans Serif; color:#800000; ">got addictive</Text></Message><Message Date="5/25/2008" Time="1:28:08 PM" DateTime="2008-05-25T03:28:08.178Z" SessionID="25"><From><User FriendlyName="Patrick [Gec Loc] 134"/></From><To><User FriendlyName="- James O'"/></To><Text Style="font-family:Microsoft Sans Serif; color:#800000; ">Do you want anything done to the report? i'll send it at about 4.30</Text></Message><Message Date="5/25/2008" Time="1:28:23 PM" DateTime="2008-05-25T03:28:23.824Z" SessionID="25"><From><User FriendlyName="Patrick [Gec Loc] 134"/></From><To><User FriendlyName="- James O'"/></To><Text Style="font-family:Microsoft Sans Serif; color:#800000; ">thanks for such a nice team member</Text></Message><Message Date="5/25/2008" Time="2:15:55 PM" DateTime="2008-05-25T04:15:55.505Z" SessionID="25"><From><User FriendlyName="- James O'"/></From><To><User FriendlyName="Patrick [Gec Loc] 134"/></To><Text Style="font-family:MS Shell Dlg; color:#000000; ">hay</Text></Message><Message Date="5/25/2008" Time="2:16:13 PM" DateTime="2008-05-25T04:16:13.604Z" SessionID="25"><From><User FriendlyName="Patrick [Gec Loc] 134"/></From><To><User FriendlyName="- James O'"/></To><Text Style="font-family:Microsoft Sans Serif; color:#800000; ">Hey</Text></Message><Message Date="5/25/2008" Time="2:16:18 PM" DateTime="2008-05-25T04:16:18.711Z" SessionID="25"><From><User FriendlyName="- James O'"/></From><To><User FriendlyName="Patrick [Gec Loc] 134"/></To><Text Style="font-family:MS Shell Dlg; color:#000000; ">sorry, my mums putting on a classical piano concert thing in our house today</Text></Message><Message Date="5/25/2008" Time="2:16:24 PM" DateTime="2008-05-25T04:16:24.701Z" SessionID="25"><From><User FriendlyName="- James O'"/></From><To><User FriendlyName="Patrick [Gec Loc] 134"/></To><Text Style="font-family:MS Shell Dlg; color:#000000; ">so its a bitta chaos over her</Text></Message><Message Date="5/25/2008" Time="2:16:53 PM" DateTime="2008-05-25T04:16:53.355Z" SessionID="25"><From><User FriendlyName="Patrick [Gec Loc] 134"/></From><To><User FriendlyName="- James O'"/></To><Text Style="font-family:Microsoft Sans Serif; color:#800000; ">lol, thats cool</Text></Message><Message Date="5/25/2008" Time="2:16:58 PM" DateTime="2008-05-25T04:16:58.066Z" SessionID="25"><From><User FriendlyName="- James O'"/></From><To><User FriendlyName="Patrick [Gec Loc] 134"/></To><Text Style="font-family:MS Shell Dlg; color:#000000; ">making sure the house is spotless and that bully</Text></Message><Message Date="5/25/2008" Time="2:21:47 PM" DateTime="2008-05-25T04:21:47.913Z" SessionID="26"><From><User FriendlyName="- James O'"/></From><To><User FriendlyName="Patrick [Gec Loc] 134"/></To><Text Style="font-family:MS Shell Dlg; color:#000000; ">So all good for submission?</Text></Message><Message Date="5/25/2008" Time="2:22:16 PM" DateTime="2008-05-25T04:22:16.902Z" SessionID="26"><From><User FriendlyName="Patrick [Gec Loc] 134"/></From><To><User FriendlyName="- James O'"/></To><Text Style="font-family:Microsoft Sans Serif; color:#800000; ">yep unless if anyone has anything to add</Text></Message><Message Date="5/25/2008" Time="2:22:33 PM" DateTime="2008-05-25T04:22:33.643Z" SessionID="26"><From><User FriendlyName="- James O'"/></From><To><User FriendlyName="Patrick [Gec Loc] 134"/></To><Text Style="font-family:MS Shell Dlg; color:#000000; ">haha,</Text></Message><Message Date="5/25/2008" Time="2:22:36 PM" DateTime="2008-05-25T04:22:36.970Z" SessionID="26"><From><User FriendlyName="- James O'"/></From><To><User FriendlyName="Patrick [Gec Loc] 134"/></To><Text Style="font-family:MS Shell Dlg; color:#000000; ">I somehow doubt so</Text></Message><Message Date="5/25/2008" Time="2:23:04 PM" DateTime="2008-05-25T04:23:04.303Z" SessionID="27"><From><User FriendlyName="Patrick [Gec Loc] 134"/></From><To><User FriendlyName="- James O'"/></To><Text Style="font-family:Microsoft Sans Serif; color:#800000; ">lol, yeah but i think its alright</Text></Message><Message Date="5/25/2008" Time="2:23:11 PM" DateTime="2008-05-25T04:23:11.716Z" SessionID="27"><From><User FriendlyName="Patrick [Gec Loc] 134"/></From><To><User FriendlyName="- James O'"/></To><Text Style="font-family:Microsoft Sans Serif; color:#800000; ">unless we need an intro and conclusion'</Text></Message><Message Date="5/25/2008" Time="2:27:30 PM" DateTime="2008-05-25T04:27:30.554Z" SessionID="27"><From><User FriendlyName="- James O'"/></From><To><User FriendlyName="Patrick [Gec Loc] 134"/></To><Text Style="font-family:MS Shell Dlg; color:#000000; ">nah, it's a report</Text></Message><Message Date="5/25/2008" Time="2:27:57 PM" DateTime="2008-05-25T04:27:57.178Z" SessionID="27"><From><User FriendlyName="Patrick [Gec Loc] 134"/></From><To><User FriendlyName="- James O'"/></To><Text Style="font-family:Microsoft Sans Serif; color:#800000; ">cool and good cause were alright with word count</Text></Message><Message Date="5/25/2008" Time="2:28:05 PM" DateTime="2008-05-25T04:28:05.229Z" SessionID="27"><From><User FriendlyName="- James O'"/></From><To><User FriendlyName="Patrick [Gec Loc] 134"/></To><Text Style="font-family:MS Shell Dlg; color:#000000; ">sweet cheeks</Text></Message><Message Date="5/25/2008" Time="2:28:24 PM" DateTime="2008-05-25T04:28:24.875Z" SessionID="27"><From><User FriendlyName="Patrick [Gec Loc] 134"/></From><To><User FriendlyName="- James O'"/></To><Text Style="font-family:Microsoft Sans Serif; color:#800000; ">some groups hit like 3000 and they can't understand how they can make it lower and didn't want to remove their intro and con</Text></Message><Message Date="5/25/2008" Time="2:28:51 PM" DateTime="2008-05-25T04:28:51.272Z" SessionID="27"><From><User FriendlyName="- James O'"/></From><To><User FriendlyName="Patrick [Gec Loc] 134"/></To><Text Style="font-family:MS Shell Dlg; color:#000000; ">lol, how efficient of them</Text></Message><Message Date="5/25/2008" Time="2:30:32 PM" DateTime="2008-05-25T04:30:32.511Z" SessionID="28"><From><User FriendlyName="Patrick [Gec Loc] 134"/></From><To><User FriendlyName="- James O'"/></To><Text Style="font-family:Microsoft Sans Serif; color:#800000; ">Do you know anything about naming convertion of file?? </Text></Message><Message Date="5/25/2008" Time="2:30:47 PM" DateTime="2008-05-25T04:30:47.167Z" SessionID="28"><From><User FriendlyName="Patrick [Gec Loc] 134"/></From><To><User FriendlyName="- James O'"/></To><Text Style="font-family:Microsoft Sans Serif; color:#800000; ">there is no marking critera so i can't make any last minute checks for the report</Text></Message><Message Date="5/25/2008" Time="2:31:45 PM" DateTime="2008-05-25T04:31:45.900Z" SessionID="28"><From><User FriendlyName="- James O'"/></From><To><User FriendlyName="Patrick [Gec Loc] 134"/></To><Text Style="font-family:MS Shell Dlg; color:#000000; ">Having a lookg now</Text></Message><Message Date="5/25/2008" Time="2:32:09 PM" DateTime="2008-05-25T04:32:09.397Z" SessionID="28"><From><User FriendlyName="Patrick [Gec Loc] 134"/></From><To><User FriendlyName="- James O'"/></To><Text Style="font-family:Microsoft Sans Serif; color:#800000; ">kool</Text></Message><Message Date="5/25/2008" Time="2:35:45 PM" DateTime="2008-05-25T04:35:45.953Z" SessionID="28"><From><User FriendlyName="- James O'"/></From><To><User FriendlyName="Patrick [Gec Loc] 134"/></To><Text Style="font-family:MS Shell Dlg; color:#000000; ">cant see anything, I presume its the same as the others, subjectnameGroupassStudneyID</Text></Message><Message Date="5/25/2008" Time="2:36:01 PM" DateTime="2008-05-25T04:36:01.329Z" SessionID="28"><From><User FriendlyName="Patrick [Gec Loc] 134"/></From><To><User FriendlyName="- James O'"/></To><Text Style="font-family:Microsoft Sans Serif; color:#800000; ">yeah</Text></Message><Message Date="5/25/2008" Time="2:36:16 PM" DateTime="2008-05-25T04:36:16.499Z" SessionID="28"><From><User FriendlyName="Patrick [Gec Loc] 134"/></From><To><User FriendlyName="- James O'"/></To><Text Style="font-family:Microsoft Sans Serif; color:#800000; ">they've really lost a lot of ppl on this assingment'</Text></Message><Message Date="5/25/2008" Time="3:44:24 PM" DateTime="2008-05-25T05:44:24.938Z" SessionID="29"><From><User FriendlyName="- James O'"/></From><To><User FriendlyName="Patrick [Gec Loc] 134"/></To><Text Style="font-family:MS Shell Dlg; color:#000000; ">submitted?</Text></Message><Message Date="5/25/2008" Time="3:45:18 PM" DateTime="2008-05-25T05:45:18.697Z" SessionID="29"><From><User FriendlyName="Patrick [Gec Loc] 134"/></From><To><User FriendlyName="- James O'"/></To><Text Style="font-family:Microsoft Sans Serif; color:#800000; ">not yet</Text></Message><Message Date="5/25/2008" Time="3:45:29 PM" DateTime="2008-05-25T05:45:29.951Z" SessionID="29"><From><User FriendlyName="Patrick [Gec Loc] 134"/></From><To><User FriendlyName="- James O'"/></To><Text Style="font-family:Microsoft Sans Serif; color:#800000; ">doing that now, just having a last look for naming </Text></Message><Message Date="5/25/2008" Time="3:45:33 PM" DateTime="2008-05-25T05:45:33.673Z" SessionID="29"><From><User FriendlyName="- James O'"/></From><To><User FriendlyName="Patrick [Gec Loc] 134"/></To><Text Style="font-family:MS Shell Dlg; color:#000000; ">wilco</Text></Message><Message Date="5/25/2008" Time="3:45:34 PM" DateTime="2008-05-25T05:45:34.647Z" SessionID="29"><From><User FriendlyName="- James O'"/></From><To><User FriendlyName="Patrick [Gec Loc] 134"/></To><Text Style="font-family:MS Shell Dlg; color:#000000; ">I gtg</Text></Message><Message Date="5/25/2008" Time="3:45:37 PM" DateTime="2008-05-25T05:45:37.952Z" SessionID="29"><From><User FriendlyName="- James O'"/></From><To><User FriendlyName="Patrick [Gec Loc] 134"/></To><Text Style="font-family:MS Shell Dlg; color:#000000; ">party's a starting</Text></Message><Message Date="5/25/2008" Time="8:20:42 PM" DateTime="2008-05-25T10:20:42.604Z" SessionID="30"><From><User FriendlyName="Patrick [Gec Loc] 133"/></From><To><User FriendlyName="- James O'"/></To><Text Style="font-family:Microsoft Sans Serif; color:#800000; ">Does your drop box say there is no more assignmentes??</Text></Message><Message Date="5/25/2008" Time="8:31:44 PM" DateTime="2008-05-25T10:31:44.382Z" SessionID="30"><From><User FriendlyName="- James O'"/></From><To><User FriendlyName="Patrick [Gec Loc] 133"/></To><Text Style="font-family:MS Shell Dlg; color:#000000; ">Yeah, all good</Text></Message><Message Date="5/25/2008" Time="8:31:49 PM" DateTime="2008-05-25T10:31:49.948Z" SessionID="30"><From><User FriendlyName="Patrick [Gec Loc] 133"/></From><To><User FriendlyName="- James O'"/></To><Text Style="font-family:Microsoft Sans Serif; color:#800000; ">excellent</Text></Message><Message Date="5/26/2008" Time="12:07:09 AM" DateTime="2008-05-25T14:07:09.181Z" SessionID="31"><From><User FriendlyName="Patrick [Gec Loc] 133"/></From><To><User FriendlyName="- James O'"/></To><Text Style="font-family:Microsoft Sans Serif; color:#800000; ">Wii hacked?</Text></Message><Message Date="5/26/2008" Time="12:08:02 AM" DateTime="2008-05-25T14:08:02.424Z" SessionID="31"><From><User FriendlyName="- James O'"/></From><To><User FriendlyName="Patrick [Gec Loc] 133"/></To><Text Style="font-family:MS Shell Dlg; color:#000000; ">yes sir</Text></Message><Message Date="5/26/2008" Time="12:08:40 AM" DateTime="2008-05-25T14:08:40.765Z" SessionID="31"><From><User FriendlyName="Patrick [Gec Loc] 133"/></From><To><User FriendlyName="- James O'"/></To><Text Style="font-family:Microsoft Sans Serif; color:#800000; ">mad</Text></Message><Message Date="5/26/2008" Time="12:08:49 AM" DateTime="2008-05-25T14:08:49.895Z" SessionID="31"><From><User FriendlyName="Patrick [Gec Loc] 133"/></From><To><User FriendlyName="- James O'"/></To><Text Style="font-family:Microsoft Sans Serif; color:#800000; ">make a bit of money if you don't get sued</Text></Message><Message Date="5/26/2008" Time="12:08:59 AM" DateTime="2008-05-25T14:08:59.073Z" SessionID="31"><From><User FriendlyName="- James O'"/></From><To><User FriendlyName="Patrick [Gec Loc] 133"/></To><Text Style="font-family:MS Shell Dlg; color:#000000; ">?</Text></Message><Message Date="5/26/2008" Time="12:09:22 AM" DateTime="2008-05-25T14:09:22.882Z" SessionID="31"><From><User FriendlyName="Patrick [Gec Loc] 133"/></From><To><User FriendlyName="- James O'"/></To><Text Style="font-family:Microsoft Sans Serif; color:#800000; ">the person who hacked it</Text></Message><Message Date="5/26/2008" Time="12:09:31 AM" DateTime="2008-05-25T14:09:31.672Z" SessionID="31"><From><User FriendlyName="Patrick [Gec Loc] 133"/></From><To><User FriendlyName="- James O'"/></To><Text Style="font-family:Microsoft Sans Serif; color:#800000; ">don't they sell chips and stuff?</Text></Message><Message Date="5/26/2008" Time="12:09:46 AM" DateTime="2008-05-25T14:09:46.500Z" SessionID="31"><From><User FriendlyName="- James O'"/></From><To><User FriendlyName="Patrick [Gec Loc] 133"/></To><Text Style="font-family:MS Shell Dlg; color:#000000; ">U dont need a chip</Text></Message><Message Date="5/26/2008" Time="12:11:21 AM" DateTime="2008-05-25T14:11:21.969Z" SessionID="31"><From><User FriendlyName="- James O'"/></From><To><User FriendlyName="Patrick [Gec Loc] 133"/></To><Text Style="font-family:MS Shell Dlg; color:#000000; ">I'd say atleast 4/5 would be illegal</Text></Message><Message Date="5/26/2008" Time="12:11:51 AM" DateTime="2008-05-25T14:11:51.102Z" SessionID="32"><From><User FriendlyName="Patrick [Gec Loc] 133"/></From><To><User FriendlyName="- James O'"/></To><Text Style="font-family:Microsoft Sans Serif; color:#800000; ">yeah agreed, lol</Text></Message><Message Date="5/26/2008" Time="12:12:19 AM" DateTime="2008-05-25T14:12:19.891Z" SessionID="32"><From><User FriendlyName="- James O'"/></From><To><User FriendlyName="Patrick [Gec Loc] 133"/></To><Text Style="font-family:MS Shell Dlg; color:#000000; ">Dont particuarly care in this instance</Text></Message><Message Date="5/27/2008" Time="10:35:31 PM" DateTime="2008-05-27T12:35:31.110Z" SessionID="33"><From><User FriendlyName="- James O'"/></From><To><User FriendlyName="Patrick [Gec Loc] 131"/></To><Text Style="font-family:MS Shell Dlg; color:#000000; ">Hay</Text></Message><Message Date="5/27/2008" Time="10:35:58 PM" DateTime="2008-05-27T12:35:58.983Z" SessionID="33"><From><User FriendlyName="Patrick [Gec Loc] 131"/></From><To><User FriendlyName="- James O'"/></To><Text Style="font-family:Microsoft Sans Serif; color:#800000; ">Hi man</Text></Message><Message Date="5/27/2008" Time="10:36:07 PM" DateTime="2008-05-27T12:36:07.255Z" SessionID="33"><From><User FriendlyName="Patrick [Gec Loc] 131"/></From><To><User FriendlyName="- James O'"/></To><Text Style="font-family:Microsoft Sans Serif; color:#800000; ">what up?</Text></Message><Message Date="5/27/2008" Time="10:36:16 PM" DateTime="2008-05-27T12:36:16.874Z" SessionID="33"><From><User FriendlyName="- James O'"/></From><To><User FriendlyName="Patrick [Gec Loc] 131"/></To><Text Style="font-family:MS Shell Dlg; color:#000000; ">Dont suppose you have BroodWar? :D</Text></Message><Message Date="5/27/2008" Time="10:36:27 PM" DateTime="2008-05-27T12:36:27.942Z" SessionID="33"><From><User FriendlyName="- James O'"/></From><To><User FriendlyName="Patrick [Gec Loc] 131"/></To><Text Style="font-family:MS Shell Dlg; color:#000000; ">I'm up for a game and my sparring partner has backed out</Text></Message><Message Date="5/27/2008" Time="10:36:37 PM" DateTime="2008-05-27T12:36:37.466Z" SessionID="33"><From><User FriendlyName="Patrick [Gec Loc] 131"/></From><To><User FriendlyName="- James O'"/></To><Text Style="font-family:Microsoft Sans Serif; color:#800000; ">lol, no sorry</Text></Message><Message Date="5/27/2008" Time="10:36:44 PM" DateTime="2008-05-27T12:36:44.069Z" SessionID="33"><From><User FriendlyName="Patrick [Gec Loc] 131"/></From><To><User FriendlyName="- James O'"/></To><Text Style="font-family:Microsoft Sans Serif; color:#800000; ">shouldn't u be studying for 102?</Text></Message><Message Date="5/27/2008" Time="10:36:57 PM" DateTime="2008-05-27T12:36:57.379Z" SessionID="33"><From><User FriendlyName="- James O'"/></From><To><User FriendlyName="Patrick [Gec Loc] 131"/></To><Text Style="font-family:MS Shell Dlg; color:#000000; ">roffle</Text></Message><Message Date="5/27/2008" Time="10:37:00 PM" DateTime="2008-05-27T12:37:00.682Z" SessionID="33"><From><User FriendlyName="- James O'"/></From><To><User FriendlyName="Patrick [Gec Loc] 131"/></To><Text Style="font-family:MS Shell Dlg; color:#000000; ">good one!</Text></Message><Message Date="5/27/2008" Time="10:38:09 PM" DateTime="2008-05-27T12:38:09.211Z" SessionID="33"><From><User FriendlyName="- James O'"/></From><To><User FriendlyName="Patrick [Gec Loc] 131"/></To><Text Style="font-family:MS Shell Dlg; color:#000000; ">Study... 102</Text></Message><Message Date="5/27/2008" Time="10:38:10 PM" DateTime="2008-05-27T12:38:10.746Z" SessionID="33"><From><User FriendlyName="- James O'"/></From><To><User FriendlyName="Patrick [Gec Loc] 131"/></To><Text Style="font-family:MS Shell Dlg; color:#000000; ">hahahaha</Text></Message><Message Date="5/27/2008" Time="10:38:18 PM" DateTime="2008-05-27T12:38:18.092Z" SessionID="33"><From><User FriendlyName="Patrick [Gec Loc] 131"/></From><To><User FriendlyName="- James O'"/></To><Text Style="font-family:Microsoft Sans Serif; color:#800000; ">lol, did u go today?</Text></Message><Message Date="5/27/2008" Time="10:38:23 PM" DateTime="2008-05-27T12:38:23.898Z" SessionID="33"><From><User FriendlyName="- James O'"/></From><To><User FriendlyName="Patrick [Gec Loc] 131"/></To><Text Style="font-family:MS Shell Dlg; color:#000000; ">yuh</Text></Message><Message Date="5/27/2008" Time="10:38:36 PM" DateTime="2008-05-27T12:38:36.987Z" SessionID="33"><From><User FriendlyName="Patrick [Gec Loc] 131"/></From><To><User FriendlyName="- James O'"/></To><Text Style="font-family:Microsoft Sans Serif; color:#800000; ">are u laughing cause u know if you passed SAMs and assesments your done?</Text></Message><Message Date="5/27/2008" Time="10:38:39 PM" DateTime="2008-05-27T12:38:39.368Z" SessionID="33"><From><User FriendlyName="- James O'"/></From><To><User FriendlyName="Patrick [Gec Loc] 131"/></To><Text Style="font-family:MS Shell Dlg; color:#000000; ">For like half an hour whilst I played UT2004</Text></Message><Message Date="5/27/2008" Time="10:38:57 PM" DateTime="2008-05-27T12:38:57.247Z" SessionID="33"><From><User FriendlyName="Patrick [Gec Loc] 131"/></From><To><User FriendlyName="- James O'"/></To><Text Style="font-family:Microsoft Sans Serif; color:#800000; ">u got UT2004?</Text></Message><Message Date="5/27/2008" Time="10:38:58 PM" DateTime="2008-05-27T12:38:58.937Z" SessionID="33"><From><User FriendlyName="Patrick [Gec Loc] 131"/></From><To><User FriendlyName="- James O'"/></To><Text Style="font-family:Microsoft Sans Serif; color:#800000; ">oh man</Text></Message><Message Date="5/27/2008" Time="10:39:02 PM" DateTime="2008-05-27T12:39:02.270Z" SessionID="33"><From><User FriendlyName="- James O'"/></From><To><User FriendlyName="Patrick [Gec Loc] 131"/></To><Text Style="font-family:MS Shell Dlg; color:#000000; ">no, laughing cause I aint doing study till day beyond</Text></Message><Message Date="5/27/2008" Time="10:39:19 PM" DateTime="2008-05-27T12:39:19.354Z" SessionID="33"><From><User FriendlyName="- James O'"/></From><To><User FriendlyName="Patrick [Gec Loc] 131"/></To><Text Style="font-family:MS Shell Dlg; color:#000000; ">haha, yeah, I been practicing a bit</Text></Message><Message Date="5/27/2008" Time="10:39:20 PM" DateTime="2008-05-27T12:39:20.922Z" SessionID="33"><From><User FriendlyName="- James O'"/></From><To><User FriendlyName="Patrick [Gec Loc] 131"/></To><Text Style="font-family:MS Shell Dlg; color:#000000; ">buying UT3</Text></Message><Message Date="5/27/2008" Time="10:39:23 PM" DateTime="2008-05-27T12:39:23.929Z" SessionID="33"><From><User FriendlyName="- James O'"/></From><To><User FriendlyName="Patrick [Gec Loc] 131"/></To><Text Style="font-family:MS Shell Dlg; color:#000000; ">right now actually</Text></Message><Message Date="5/27/2008" Time="10:39:34 PM" DateTime="2008-05-27T12:39:34.785Z" SessionID="33"><From><User FriendlyName="Patrick [Gec Loc] 131"/></From><To><User FriendlyName="- James O'"/></To><Text Style="font-family:Microsoft Sans Serif; color:#800000; ">lol</Text></Message><Message Date="5/27/2008" Time="10:39:52 PM" DateTime="2008-05-27T12:39:52.699Z" SessionID="33"><From><User FriendlyName="Patrick [Gec Loc] 131"/></From><To><User FriendlyName="- James O'"/></To><Text Style="font-family:Microsoft Sans Serif; color:#800000; ">man why can't i study the night before and play games at least once a week?</Text></Message><Message Date="5/27/2008" Time="10:40:01 PM" DateTime="2008-05-27T12:40:01.893Z" SessionID="33"><From><User FriendlyName="Patrick [Gec Loc] 131"/></From><To><User FriendlyName="- James O'"/></To><Text Style="font-family:Microsoft Sans Serif; color:#800000; ">did u do that for HSC? </Text></Message><Message Date="5/27/2008" Time="10:40:23 PM" DateTime="2008-05-27T12:40:23.932Z" SessionID="33"><From><User FriendlyName="- James O'"/></From><To><User FriendlyName="Patrick [Gec Loc] 131"/></To><Text Style="font-family:MS Shell Dlg; color:#000000; ">haha, pretty much</Text></Message><Message Date="5/27/2008" Time="10:40:26 PM" DateTime="2008-05-27T12:40:26.380Z" SessionID="33"><From><User FriendlyName="Patrick [Gec Loc] 131"/></From><To><User FriendlyName="- James O'"/></To><Text Style="font-family:Microsoft Sans Serif; color:#800000; ">i am finding uni so hard cause i can't learn stuff each wek incrementally and have to cram during study breaks</Text></Message><Message Date="5/27/2008" Time="10:40:32 PM" DateTime="2008-05-27T12:40:32.413Z" SessionID="33"><From><User FriendlyName="Patrick [Gec Loc] 131"/></From><To><User FriendlyName="- James O'"/></To><Text Style="font-family:Microsoft Sans Serif; color:#800000; ">dm it</Text></Message><Message Date="5/27/2008" Time="10:40:52 PM" DateTime="2008-05-27T12:40:52.149Z" SessionID="33"><From><User FriendlyName="Patrick [Gec Loc] 131"/></From><To><User FriendlyName="- James O'"/></To><Text Style="font-family:Microsoft Sans Serif; color:#800000; ">i need cramming powers or photographic memory, or a flash card reader in my head will do</Text></Message><Message Date="5/27/2008" Time="10:41:02 PM" DateTime="2008-05-27T12:41:02.145Z" SessionID="33"><From><User FriendlyName="- James O'"/></From><To><User FriendlyName="Patrick [Gec Loc] 131"/></To><Text Style="font-family:MS Shell Dlg; color:#000000; ">You're talking to the "barely passing remember"</Text></Message><Message Date="5/27/2008" Time="10:41:32 PM" DateTime="2008-05-27T12:41:32.578Z" SessionID="33"><From><User FriendlyName="- James O'"/></From><To><User FriendlyName="Patrick [Gec Loc] 131"/></To><Text Style="font-family:MS Shell Dlg; color:#000000; ">Most the stuff in ISIT is pretty self explanatory, i'll do a few hours study in stu-vac</Text></Message><Message Date="5/27/2008" Time="10:41:48 PM" DateTime="2008-05-27T12:41:48.785Z" SessionID="33"><From><User FriendlyName="- James O'"/></From><To><User FriendlyName="Patrick [Gec Loc] 131"/></To><Text Style="font-family:MS Shell Dlg; color:#000000; ">algorithms is damn easy, all year 12 work for us, I'll do some study on some of the later concepts</Text></Message><Message Date="5/27/2008" Time="10:42:00 PM" DateTime="2008-05-27T12:42:00.034Z" SessionID="33"><From><User FriendlyName="Patrick [Gec Loc] 131"/></From><To><User FriendlyName="- James O'"/></To><Text Style="font-family:Microsoft Sans Serif; color:#800000; ">yeah crap i am doing management as elective, stupid as, 20 multi choice plus 3 essays</Text></Message><Message Date="5/27/2008" Time="10:42:03 PM" DateTime="2008-05-27T12:42:03.167Z" SessionID="33"><From><User FriendlyName="- James O'"/></From><To><User FriendlyName="Patrick [Gec Loc] 131"/></To><Text Style="font-family:MS Shell Dlg; color:#000000; ">Maths is were I may fail, but we worked it out we only need to get like 45% in the final exam to pass</Text></Message><Message Date="5/27/2008" Time="10:42:09 PM" DateTime="2008-05-27T12:42:09.633Z" SessionID="33"><From><User FriendlyName="Patrick [Gec Loc] 131"/></From><To><User FriendlyName="- James O'"/></To><Text Style="font-family:Microsoft Sans Serif; color:#800000; ">my hands going to fall off, its like the hsc all over
</Text></Message><Message Date="5/27/2008" Time="10:42:15 PM" DateTime="2008-05-27T12:42:15.872Z" SessionID="33"><From><User FriendlyName="- James O'"/></From><To><User FriendlyName="Patrick [Gec Loc] 131"/></To><Text Style="font-family:MS Shell Dlg; color:#000000; ">gross as</Text></Message><Message Date="5/27/2008" Time="10:42:33 PM" DateTime="2008-05-27T12:42:33.988Z" SessionID="33"><From><User FriendlyName="- James O'"/></From><To><User FriendlyName="Patrick [Gec Loc] 131"/></To><Text Style="font-family:MS Shell Dlg; color:#000000; ">Gaming is what I love, I always make time for it</Text></Message><Message Date="5/27/2008" Time="10:42:45 PM" DateTime="2008-05-27T12:42:45.035Z" SessionID="33"><From><User FriendlyName="- James O'"/></From><To><User FriendlyName="Patrick [Gec Loc] 131"/></To><Text Style="font-family:MS Shell Dlg; color:#000000; ">plus like 2+ hours of commuting on the train each day</Text></Message><Message Date="5/27/2008" Time="10:42:49 PM" DateTime="2008-05-27T12:42:49.452Z" SessionID="33"><From><User FriendlyName="Patrick [Gec Loc] 131"/></From><To><User FriendlyName="- James O'"/></To><Text Style="font-family:Microsoft Sans Serif; color:#800000; ">i can but it means taking time from study, lol</Text></Message><Message Date="5/27/2008" Time="10:42:53 PM" DateTime="2008-05-27T12:42:53.744Z" SessionID="33"><From><User FriendlyName="- James O'"/></From><To><User FriendlyName="Patrick [Gec Loc] 131"/></To><Text Style="font-family:MS Shell Dlg; color:#000000; ">gives time for portable (DS+PSP+laptop) gaming time</Text></Message><Message Date="5/27/2008" Time="10:43:34 PM" DateTime="2008-05-27T12:43:34.661Z" SessionID="33"><From><User FriendlyName="Patrick [Gec Loc] 131"/></From><To><User FriendlyName="- James O'"/></To><Text Style="font-family:Microsoft Sans Serif; color:#800000; ">i take bus but can't fit a 15.3" in the spce provided so i can play games but hav no idea what is happenin</Text></Message><Message Date="5/27/2008" Time="10:43:51 PM" DateTime="2008-05-27T12:43:51.221Z" SessionID="33"><From><User FriendlyName="- James O'"/></From><To><User FriendlyName="Patrick [Gec Loc] 131"/></To><Text Style="font-family:MS Shell Dlg; color:#000000; ">haha, yeah that'd be a pain</Text></Message><Message Date="5/27/2008" Time="10:43:56 PM" DateTime="2008-05-27T12:43:56.214Z" SessionID="33"><From><User FriendlyName="- James O'"/></From><To><User FriendlyName="Patrick [Gec Loc] 131"/></To><Text Style="font-family:MS Shell Dlg; color:#000000; ">how longs the bus ride?</Text></Message><Message Date="5/27/2008" Time="10:44:04 PM" DateTime="2008-05-27T12:44:04.671Z" SessionID="33"><From><User FriendlyName="Patrick [Gec Loc] 131"/></From><To><User FriendlyName="- James O'"/></To><Text Style="font-family:Microsoft Sans Serif; color:#800000; ">1 hr 20 min</Text></Message><Message Date="5/27/2008" Time="10:44:11 PM" DateTime="2008-05-27T12:44:11.651Z" SessionID="33"><From><User FriendlyName="- James O'"/></From><To><User FriendlyName="Patrick [Gec Loc] 131"/></To><Text Style="font-family:MS Shell Dlg; color:#000000; ">shizer</Text></Message><Message Date="5/27/2008" Time="10:44:13 PM" DateTime="2008-05-27T12:44:13.009Z" SessionID="33"><From><User FriendlyName="- James O'"/></From><To><User FriendlyName="Patrick [Gec Loc] 131"/></To><Text Style="font-family:MS Shell Dlg; color:#000000; ">where from?</Text></Message><Message Date="5/27/2008" Time="10:44:39 PM" DateTime="2008-05-27T12:44:39.663Z" SessionID="33"><From><User FriendlyName="Patrick [Gec Loc] 131"/></From><To><User FriendlyName="- James O'"/></To><Text Style="font-family:Microsoft Sans Serif; color:#800000; ">Uni to Shellharbour (a little bit from 
Albion Park if u know where that is)</Text></Message><Message Date="5/27/2008" Time="10:46:06 PM" DateTime="2008-05-27T12:46:06.510Z" SessionID="33"><From><User FriendlyName="- James O'"/></From><To><User FriendlyName="Patrick [Gec Loc] 131"/></To><Text Style="font-family:MS Shell Dlg; color:#000000; ">Ah yeah, bit of a drag</Text></Message><Message Date="5/27/2008" Time="10:46:12 PM" DateTime="2008-05-27T12:46:12.563Z" SessionID="33"><From><User FriendlyName="- James O'"/></From><To><User FriendlyName="Patrick [Gec Loc] 131"/></To><Text Style="font-family:MS Shell Dlg; color:#000000; ">Atleast the train is pretty quiet</Text></Message><Message Date="5/27/2008" Time="10:46:17 PM" DateTime="2008-05-27T12:46:17.754Z" SessionID="33"><From><User FriendlyName="- James O'"/></From><To><User FriendlyName="Patrick [Gec Loc] 131"/></To><Text Style="font-family:MS Shell Dlg; color:#000000; ">and u can spread out and such</Text></Message><Message Date="5/27/2008" Time="10:48:55 PM" DateTime="2008-05-27T12:48:55.966Z" SessionID="33"><From><User FriendlyName="Patrick [Gec Loc] 131"/></From><To><User FriendlyName="- James O'"/></To><Text Style="font-family:Microsoft Sans Serif; color:#800000; ">http://xkcd.com/422/</Text></Message><Message Date="5/27/2008" Time="10:49:02 PM" DateTime="2008-05-27T12:49:02.959Z" SessionID="33"><From><User FriendlyName="Patrick [Gec Loc] 131"/></From><To><User FriendlyName="- James O'"/></To><Text Style="font-family:Microsoft Sans Serif; color:#800000; ">yeah but is it safe to use a laptop on train?</Text></Message><Message Date="5/27/2008" Time="10:49:09 PM" DateTime="2008-05-27T12:49:09.208Z" SessionID="33"><From><User FriendlyName="Patrick [Gec Loc] 131"/></From><To><User FriendlyName="- James O'"/></To><Text Style="font-family:Microsoft Sans Serif; color:#800000; ">that was my concern</Text></Message><Message Date="5/27/2008" Time="10:49:15 PM" DateTime="2008-05-27T12:49:15.128Z" SessionID="33"><From><User FriendlyName="- James O'"/></From><To><User FriendlyName="Patrick [Gec Loc] 131"/></To><Text Style="font-family:MS Shell Dlg; color:#000000; ">Yeah, fine as</Text></Message><Message Date="5/27/2008" Time="10:49:23 PM" DateTime="2008-05-27T12:49:23.427Z" SessionID="33"><From><User FriendlyName="- James O'"/></From><To><User FriendlyName="Patrick [Gec Loc] 131"/></To><Text Style="font-family:MS Shell Dlg; color:#000000; ">The country trains have the flippy seats</Text></Message><Message Date="5/27/2008" Time="10:49:31 PM" DateTime="2008-05-27T12:49:31.988Z" SessionID="33"><From><User FriendlyName="- James O'"/></From><To><User FriendlyName="Patrick [Gec Loc] 131"/></To><Text Style="font-family:MS Shell Dlg; color:#000000; ">so u get like 4 or 6 seats</Text></Message><Message Date="5/27/2008" Time="10:49:37 PM" DateTime="2008-05-27T12:49:37.251Z" SessionID="33"><From><User FriendlyName="- James O'"/></From><To><User FriendlyName="Patrick [Gec Loc] 131"/></To><Text Style="font-family:MS Shell Dlg; color:#000000; ">plenty of room for the screen and that</Text></Message><Message Date="5/27/2008" Time="10:49:49 PM" DateTime="2008-05-27T12:49:49.727Z" SessionID="33"><From><User FriendlyName="Patrick [Gec Loc] 131"/></From><To><User FriendlyName="- James O'"/></To><Text Style="font-family:Microsoft Sans Serif; color:#800000; ">cool</Text></Message><Message Date="5/27/2008" Time="10:49:56 PM" DateTime="2008-05-27T12:49:56.163Z" SessionID="33"><From><User FriendlyName="Patrick [Gec Loc] 131"/></From><To><User FriendlyName="- James O'"/></To><Text Style="font-family:Microsoft Sans Serif; color:#800000; ">where do u guys live?</Text></Message><Message Date="5/27/2008" Time="10:50:00 PM" DateTime="2008-05-27T12:50:00.477Z" SessionID="33"><From><User FriendlyName="- James O'"/></From><To><User FriendlyName="Patrick [Gec Loc] 131"/></To><Text Style="font-family:MS Shell Dlg; color:#000000; ">Im in Jannali</Text></Message><Message Date="5/27/2008" Time="10:50:07 PM" DateTime="2008-05-27T12:50:07.857Z" SessionID="33"><From><User FriendlyName="- James O'"/></From><To><User FriendlyName="Patrick [Gec Loc] 131"/></To><Text Style="font-family:MS Shell Dlg; color:#000000; ">like stop before sutherland</Text></Message><Message Date="5/27/2008" Time="10:51:12 PM" DateTime="2008-05-27T12:51:12.929Z" SessionID="33"><From><User FriendlyName="- James O'"/></From><To><User FriendlyName="Patrick [Gec Loc] 131"/></To><Text Style="font-family:MS Shell Dlg; color:#000000; ">(nice pic)</Text></Message><Message Date="5/27/2008" Time="10:51:20 PM" DateTime="2008-05-27T12:51:20.731Z" SessionID="33"><From><User FriendlyName="Patrick [Gec Loc] 131"/></From><To><User FriendlyName="- James O'"/></To><Text Style="font-family:Microsoft Sans Serif; color:#800000; ">lol</Text></Message><Message Date="5/27/2008" Time="10:51:36 PM" DateTime="2008-05-27T12:51:36.328Z" SessionID="33"><From><User FriendlyName="- James O'"/></From><To><User FriendlyName="Patrick [Gec Loc] 131"/></To><Text Style="font-family:MS Shell Dlg; color:#000000; ">Jono's in menai, like 5-10 mintues car trip away from us</Text></Message><Message Date="5/27/2008" Time="10:51:41 PM" DateTime="2008-05-27T12:51:41.137Z" SessionID="33"><From><User FriendlyName="Patrick [Gec Loc] 131"/></From><To><User FriendlyName="- James O'"/></To><Text Style="font-family:Microsoft Sans Serif; color:#800000; ">wow my bus trip is probabley the same as your trin ride except i live like 40KM from uni</Text></Message><Message Date="5/27/2008" Time="10:52:17 PM" DateTime="2008-05-27T12:52:17.515Z" SessionID="33"><From><User FriendlyName="- James O'"/></From><To><User FriendlyName="Patrick [Gec Loc] 131"/></To><Text Style="font-family:MS Shell Dlg; color:#000000; ">haha, yeah</Text></Message><Message Date="5/27/2008" Time="10:52:24 PM" DateTime="2008-05-27T12:52:24.481Z" SessionID="33"><From><User FriendlyName="- James O'"/></From><To><User FriendlyName="Patrick [Gec Loc] 131"/></To><Text Style="font-family:MS Shell Dlg; color:#000000; ">its about an hour train ride</Text></Message><Message Date="5/27/2008" Time="10:52:28 PM" DateTime="2008-05-27T12:52:28.096Z" SessionID="33"><From><User FriendlyName="- James O'"/></From><To><User FriendlyName="Patrick [Gec Loc] 131"/></To><Text Style="font-family:MS Shell Dlg; color:#000000; ">depending on how many stops</Text></Message><Message Date="5/27/2008" Time="10:52:52 PM" DateTime="2008-05-27T12:52:52.006Z" SessionID="33"><From><User FriendlyName="- James O'"/></From><To><User FriendlyName="Patrick [Gec Loc] 131"/></To><Text Style="font-family:MS Shell Dlg; color:#000000; ">Sometimes like an ~65- mins or so for all stations</Text></Message><Message Date="5/27/2008" Time="10:59:01 PM" DateTime="2008-05-27T12:59:01.739Z" SessionID="33"><From><User FriendlyName="- James O'"/></From><To><User FriendlyName="Patrick [Gec Loc] 131"/></To><Text Style="font-family:MS Shell Dlg; color:#000000; ">So u dont have brood war...?</Text></Message><Message Date="5/27/2008" Time="10:59:17 PM" DateTime="2008-05-27T12:59:17.186Z" SessionID="33"><From><User FriendlyName="- James O'"/></From><To><User FriendlyName="Patrick [Gec Loc] 131"/></To><Text Style="font-family:MS Shell Dlg; color:#000000; ">Been watching those pro tourney matches and I wanna play some</Text></Message><Message Date="5/27/2008" Time="10:59:18 PM" DateTime="2008-05-27T12:59:18.145Z" SessionID="33"><From><User FriendlyName="Patrick [Gec Loc] 131"/></From><To><User FriendlyName="- James O'"/></To><Text Style="font-family:Microsoft Sans Serif; color:#800000; ">no iam afraid not</Text></Message><Message Date="5/27/2008" Time="10:59:21 PM" DateTime="2008-05-27T12:59:21.658Z" SessionID="33"><From><User FriendlyName="- James O'"/></From><To><User FriendlyName="Patrick [Gec Loc] 131"/></To><Text Style="font-family:MS Shell Dlg; color:#000000; ">ah well</Text></Message><Message Date="5/28/2008" Time="12:47:10 PM" DateTime="2008-05-28T02:47:10.035Z" SessionID="34"><From><User FriendlyName="Patrick [Gec Loc] 131"/></From><To><User FriendlyName="- James O'"/></To><Text Style="font-family:Microsoft Sans Serif; color:#800000; ">do u know if we still have a tut for 102?</Text></Message><Message Date="5/28/2008" Time="12:48:34 PM" DateTime="2008-05-28T02:48:34.824Z" SessionID="34"><From><User FriendlyName="- James O'"/></From><To><User FriendlyName="Patrick [Gec Loc] 131"/></To><Text Style="font-family:MS Shell Dlg; color:#000000; ">no idea :S</Text></Message><Message Date="5/28/2008" Time="12:48:36 PM" DateTime="2008-05-28T02:48:36.102Z" SessionID="34"><From><User FriendlyName="- James O'"/></From><To><User FriendlyName="Patrick [Gec Loc] 131"/></To><Text Style="font-family:MS Shell Dlg; color:#000000; ">hope not</Text></Message><Message Date="5/28/2008" Time="12:48:43 PM" DateTime="2008-05-28T02:48:43.140Z" SessionID="34"><From><User FriendlyName="Patrick [Gec Loc] 131"/></From><To><User FriendlyName="- James O'"/></To><Text Style="font-family:Microsoft Sans Serif; color:#800000; ">me too</Text></Message><Me