<?xml version="1.0"?>
<?xml-stylesheet type='text/xsl' href='MessageLog.xsl'?>
<Log FirstSessionID="1" LastSessionID="165"><Message Date="26/12/2004" Time="6:20:45 PM" DateTime="2004-12-26T07:20:45.850Z" SessionID="1"><From><User FriendlyName="&lt;&lt;ReWiNd&lt;&lt;   &quot;She's ma world,  she's so rad! She's the best ride i eva had!&quot; - FoX |  -MiLlEnCoLiN-|"/></From><To><User FriendlyName="James *-)"/></To><Text Style="font-family:Old English Text MT; color:#000000; ">hey hey jimmeh!</Text></Message><Message Date="26/12/2004" Time="6:21:06 PM" DateTime="2004-12-26T07:21:06.740Z" SessionID="1"><From><User FriendlyName="James *-)"/></From><To><User FriendlyName="&lt;&lt;ReWiNd&lt;&lt;   &quot;She's ma world,  she's so rad! She's the best ride i eva had!&quot; - FoX |  -MiLlEnCoLiN-|"/></To><Text Style="font-family:Comic Sans MS; font-weight:bold; color:#000080; ">He Hey</Text></Message><Message Date="26/12/2004" Time="6:21:15 PM" DateTime="2004-12-26T07:21:15.974Z" SessionID="1"><From><User FriendlyName="James *-)"/></From><To><User FriendlyName="&lt;&lt;ReWiNd&lt;&lt;   &quot;She's ma world,  she's so rad! She's the best ride i eva had!&quot; - FoX |  -MiLlEnCoLiN-|"/></To><Text Style="font-family:Comic Sans MS; font-weight:bold; color:#000080; ">Wadyuh get for chrissy</Text></Message><Message Date="26/12/2004" Time="6:21:46 PM" DateTime="2004-12-26T07:21:46.578Z" SessionID="2"><From><User FriendlyName="&lt;&lt;ReWiNd&lt;&lt;   &quot;She's ma world,  she's so rad! She's the best ride i eva had!&quot; - FoX |  -MiLlEnCoLiN-|"/></From><To><User FriendlyName="James *-)"/></To><Text Style="font-family:Old English Text MT; color:#000000; ">clothes clothes clothes books a hyperlite pfd dvd's money chocalate and i preordered ma b'day [prezzy!</Text></Message><Message Date="26/12/2004" Time="6:21:47 PM" DateTime="2004-12-26T07:21:47.829Z" SessionID="2"><From><User FriendlyName="&lt;&lt;ReWiNd&lt;&lt;   &quot;She's ma world,  she's so rad! She's the best ride i eva had!&quot; - FoX |  -MiLlEnCoLiN-|"/></From><To><User FriendlyName="James *-)"/></To><Text Style="font-family:Old English Text MT; color:#000000; ">u?</Text></Message><Message Date="26/12/2004" Time="6:22:19 PM" DateTime="2004-12-26T07:22:19.675Z" SessionID="2"><From><User FriendlyName="James *-)"/></From><To><User FriendlyName="&lt;&lt;ReWiNd&lt;&lt;   &quot;She's ma world,  she's so rad! She's the best ride i eva had!&quot; - FoX |  -MiLlEnCoLiN-|"/></To><Text Style="font-family:Comic Sans MS; font-weight:bold; color:#000080; ">Cool</Text></Message><Message Date="26/12/2004" Time="6:22:23 PM" DateTime="2004-12-26T07:22:23.781Z" SessionID="2"><From><User FriendlyName="James *-)"/></From><To><User FriendlyName="&lt;&lt;ReWiNd&lt;&lt;   &quot;She's ma world,  she's so rad! She's the best ride i eva had!&quot; - FoX |  -MiLlEnCoLiN-|"/></To><Text Style="font-family:Comic Sans MS; font-weight:bold; color:#000080; ">New moniter</Text></Message><Message Date="26/12/2004" Time="6:22:25 PM" DateTime="2004-12-26T07:22:25.954Z" SessionID="2"><From><User FriendlyName="James *-)"/></From><To><User FriendlyName="&lt;&lt;ReWiNd&lt;&lt;   &quot;She's ma world,  she's so rad! She's the best ride i eva had!&quot; - FoX |  -MiLlEnCoLiN-|"/></To><Text Style="font-family:Comic Sans MS; font-weight:bold; color:#000080; ">clothes</Text></Message><Message Date="26/12/2004" Time="6:22:27 PM" DateTime="2004-12-26T07:22:27.947Z" SessionID="2"><From><User FriendlyName="James *-)"/></From><To><User FriendlyName="&lt;&lt;ReWiNd&lt;&lt;   &quot;She's ma world,  she's so rad! She's the best ride i eva had!&quot; - FoX |  -MiLlEnCoLiN-|"/></To><Text Style="font-family:Comic Sans MS; font-weight:bold; color:#000080; ">few books</Text></Message><Message Date="26/12/2004" Time="6:22:28 PM" DateTime="2004-12-26T07:22:28.968Z" SessionID="2"><From><User FriendlyName="&lt;&lt;ReWiNd&lt;&lt;   &quot;She's ma world,  she's so rad! She's the best ride i eva had!&quot; - FoX |  -MiLlEnCoLiN-|"/></From><To><User FriendlyName="James *-)"/></To><Text Style="font-family:Old English Text MT; color:#000000; ">size?</Text></Message><Message Date="26/12/2004" Time="6:22:32 PM" DateTime="2004-12-26T07:22:32.073Z" SessionID="2"><From><User FriendlyName="&lt;&lt;ReWiNd&lt;&lt;   &quot;She's ma world,  she's so rad! She's the best ride i eva had!&quot; - FoX |  -MiLlEnCoLiN-|"/></From><To><User FriendlyName="James *-)"/></To><Text Style="font-family:Old English Text MT; color:#000000; ">not the clothes</Text></Message><Message Date="26/12/2004" Time="6:22:35 PM" DateTime="2004-12-26T07:22:35.238Z" SessionID="2"><From><User FriendlyName="&lt;&lt;ReWiNd&lt;&lt;   &quot;She's ma world,  she's so rad! She's the best ride i eva had!&quot; - FoX |  -MiLlEnCoLiN-|"/></From><To><User FriendlyName="James *-)"/></To><Text Style="font-family:Old English Text MT; color:#000000; ">the monitor!</Text></Message><Message Date="26/12/2004" Time="6:22:36 PM" DateTime="2004-12-26T07:22:36.700Z" SessionID="2"><From><User FriendlyName="&lt;&lt;ReWiNd&lt;&lt;   &quot;She's ma world,  she's so rad! She's the best ride i eva had!&quot; - FoX |  -MiLlEnCoLiN-|"/></From><To><User FriendlyName="James *-)"/></To><Text Style="font-family:Old English Text MT; color:#000000; ">;P;</Text></Message><Message Date="26/12/2004" Time="6:22:37 PM" DateTime="2004-12-26T07:22:37.411Z" SessionID="2"><From><User FriendlyName="James *-)"/></From><To><User FriendlyName="&lt;&lt;ReWiNd&lt;&lt;   &quot;She's ma world,  she's so rad! She's the best ride i eva had!&quot; - FoX |  -MiLlEnCoLiN-|"/></To><Text Style="font-family:Comic Sans MS; font-weight:bold; color:#000080; ">bit over 17</Text></Message><Message Date="26/12/2004" Time="6:22:39 PM" DateTime="2004-12-26T07:22:39.183Z" SessionID="3"><From><User FriendlyName="&lt;&lt;ReWiNd&lt;&lt;   &quot;She's ma world,  she's so rad! She's the best ride i eva had!&quot; - FoX |  -MiLlEnCoLiN-|"/></From><To><User FriendlyName="James *-)"/></To><Text Style="font-family:Old English Text MT; color:#000000; ">LOL</Text></Message><Message Date="26/12/2004" Time="6:22:44 PM" DateTime="2004-12-26T07:22:44.130Z" SessionID="3"><From><User FriendlyName="&lt;&lt;ReWiNd&lt;&lt;   &quot;She's ma world,  she's so rad! She's the best ride i eva had!&quot; - FoX |  -MiLlEnCoLiN-|"/></From><To><User FriendlyName="James *-)"/></To><Text Style="font-family:Old English Text MT; color:#000000; ">ohok nice</Text></Message><Message Date="27/12/2004" Time="2:55:18 PM" DateTime="2004-12-27T03:55:18.932Z" SessionID="4"><From><User FriendlyName="&lt;&lt;ReWiNd&lt;&lt;   &quot;She's ma world,  she's so rad! She's the best ride i eva had!&quot; - FoX |  -MiLlEnCoLiN-|"/></From><To><User FriendlyName="James *-)"/></To><Text Style="font-family:Old English Text MT; color:#000000; ">hey jimmeh</Text></Message><Message Date="27/12/2004" Time="2:56:26 PM" DateTime="2004-12-27T03:56:26.560Z" SessionID="5"><From><User FriendlyName="&lt;&lt;ReWiNd&lt;&lt;   &quot;She's ma world,  she's so rad! She's the best ride i eva had!&quot; - FoX |  -MiLlEnCoLiN-|"/></From><To><User FriendlyName="James *-)"/></To><Text Style="font-family:Old English Text MT; color:#000000; ">u thar?</Text></Message><Message Date="20/01/2005" Time="6:36:34 PM" DateTime="2005-01-20T07:36:34.120Z" SessionID="6"><From><User FriendlyName="El Distroto De Melodica (M.Y.G.) DI.fm Hardcore"/></From><To><User FriendlyName="James *-) I've been having these weird thoughts lately... like is any of this for real or not?"/></To><Text Style="font-family:Old English Text MT; font-weight:bold; color:#800080; ">hey man</Text></Message><Message Date="20/01/2005" Time="6:36:42 PM" DateTime="2005-01-20T07:36:42.592Z" SessionID="6"><From><User FriendlyName="James *-) I've been having these weird thoughts lately... like is any of this for real or not?"/></From><To><User FriendlyName="El Distroto De Melodica (M.Y.G.) DI.fm Hardcore"/></To><Text Style="font-family:Comic Sans MS; font-weight:bold; color:#000080; ">Hey</Text></Message><Message Date="20/01/2005" Time="6:36:50 PM" DateTime="2005-01-20T07:36:50.573Z" SessionID="7"><From><User FriendlyName="El Distroto De Melodica (M.Y.G.) DI.fm Hardcore"/></From><To><User FriendlyName="James *-) I've been having these weird thoughts lately... like is any of this for real or not?"/></To><Text Style="font-family:Old English Text MT; font-weight:bold; color:#800080; ">what's doin?</Text></Message><Message Date="20/01/2005" Time="6:36:57 PM" DateTime="2005-01-20T07:36:57.844Z" SessionID="7"><From><User FriendlyName="James *-) I've been having these weird thoughts lately... like is any of this for real or not?"/></From><To><User FriendlyName="El Distroto De Melodica (M.Y.G.) DI.fm Hardcore"/></To><Text Style="font-family:Comic Sans MS; font-weight:bold; color:#000080; ">Just playing ET</Text></Message><Message Date="20/01/2005" Time="6:37:03 PM" DateTime="2005-01-20T07:37:03.382Z" SessionID="7"><From><User FriendlyName="El Distroto De Melodica (M.Y.G.) DI.fm Hardcore"/></From><To><User FriendlyName="James *-) I've been having these weird thoughts lately... like is any of this for real or not?"/></To><Text Style="font-family:Old English Text MT; font-weight:bold; color:#800080; ">nice</Text></Message><Message Date="20/01/2005" Time="6:37:11 PM" DateTime="2005-01-20T07:37:11.604Z" SessionID="7"><From><User FriendlyName="El Distroto De Melodica (M.Y.G.) DI.fm Hardcore"/></From><To><User FriendlyName="James *-) I've been having these weird thoughts lately... like is any of this for real or not?"/></To><Text Style="font-family:Old English Text MT; font-weight:bold; color:#800080; ">i just gave sum1 ur addy</Text></Message><Message Date="20/01/2005" Time="6:37:15 PM" DateTime="2005-01-20T07:37:15.019Z" SessionID="7"><From><User FriendlyName="El Distroto De Melodica (M.Y.G.) DI.fm Hardcore"/></From><To><User FriendlyName="James *-) I've been having these weird thoughts lately... like is any of this for real or not?"/></To><Text Style="font-family:Old English Text MT; font-weight:bold; color:#800080; ">lol u dun mind?</Text></Message><Message Date="20/01/2005" Time="6:56:43 PM" DateTime="2005-01-20T07:56:43.980Z" SessionID="7"><From><User FriendlyName="James *-) I've been having these weird thoughts lately... like is any of this for real or not?"/></From><To><User FriendlyName="El Distroto De Melodica (M.Y.G.) DI.fm Hardcore"/></To><Text Style="font-family:Comic Sans MS; font-weight:bold; color:#000080; ">nah</Text></Message><Message Date="22/01/2005" Time="5:23:42 PM" DateTime="2005-01-22T06:23:42.020Z" SessionID="8"><From><User FriendlyName="El Distroto De Melodica (M.Y.G.) Stop Burning Bridges ... And Drive Off Of Them! So I Can Forget About You(BuRy Me In MeMoRy)"/></From><To><User FriendlyName="James *-) I've been having these weird thoughts lately... like is any of this for real or not?"/></To><Text Style="font-family:Maiandra GD; font-weight:bold; color:#800080; ">u there?</Text></Message><Message Date="6/02/2005" Time="9:57:24 AM" DateTime="2005-02-05T22:57:24.782Z" SessionID="9"><From><User FriendlyName="She's drunk like a school girl, Dressed to kill. I swear i'm not in love with you!   |   mhc rg 222   |"/></From><To><User FriendlyName="James *-) Hun, I cant do this anymore see my heart just falls out when yo walk in the door..."/></To><Text Style="font-family:Georgia Ref; font-weight:bold; color:#000080; ">hey</Text></Message><Message Date="6/02/2005" Time="9:57:31 AM" DateTime="2005-02-05T22:57:31.001Z" SessionID="9"><From><User FriendlyName="James *-) Hun, I cant do this anymore see my heart just falls out when yo walk in the door..."/></From><To><User FriendlyName="She's drunk like a school girl, Dressed to kill. I swear i'm not in love with you!   |   mhc rg 222   |"/></To><Text Style="font-family:Comic Sans MS; font-weight:bold; color:#000080; ">ullo</Text></Message><Message Date="6/02/2005" Time="9:57:36 AM" DateTime="2005-02-05T22:57:36.969Z" SessionID="10"><From><User FriendlyName="She's drunk like a school girl, Dressed to kill. I swear i'm not in love with you!   |   mhc rg 222   |"/></From><To><User FriendlyName="James *-) Hun, I cant do this anymore see my heart just falls out when yo walk in the door..."/></To><Text Style="font-family:Georgia Ref; font-weight:bold; color:#000080; ">how'z it goin?</Text></Message><Message Date="6/02/2005" Time="9:58:02 AM" DateTime="2005-02-05T22:58:02.947Z" SessionID="10"><From><User FriendlyName="James *-) Hun, I cant do this anymore see my heart just falls out when yo walk in the door..."/></From><To><User FriendlyName="She's drunk like a school girl, Dressed to kill. I swear i'm not in love with you!   |   mhc rg 222   |"/></To><Text Style="font-family:Comic Sans MS; font-weight:bold; color:#000080; ">meh cant complain</Text></Message><Message Date="6/02/2005" Time="10:12:43 AM" DateTime="2005-02-05T23:12:43.152Z" SessionID="11"><From><User FriendlyName="She's drunk like a school girl, Dressed to kill. I swear i'm not in love with you!   |   mhc rg 222   |"/></From><To><User FriendlyName="James *-) Hun, I cant do this anymore see my heart just falls out when yo walk in the door..."/></To><Text Style="font-family:Georgia Ref; font-weight:bold; color:#000080; ">what r u upto today?</Text></Message><Message Date="6/02/2005" Time="10:14:00 AM" DateTime="2005-02-05T23:14:00.333Z" SessionID="11"><From><User FriendlyName="She's drunk like a school girl, Dressed to kill. I swear i'm not in love with you!   |   mhc rg 222   |"/></From><To><User FriendlyName="James *-) Hun, I cant do this anymore see my heart just falls out when yo walk in the door..."/></To><Text Style="font-family:Georgia Ref; font-weight:bold; color:#000080; ">jimmeh?</Text></Message><Message Date="6/02/2005" Time="10:14:08 AM" DateTime="2005-02-05T23:14:08.595Z" SessionID="11"><From><User FriendlyName="James *-) Hun, I cant do this anymore see my heart just falls out when yo walk in the door..."/></From><To><User FriendlyName="She's drunk like a school girl, Dressed to kill. I swear i'm not in love with you!   |   mhc rg 222   |"/></To><Text Style="font-family:Comic Sans MS; font-weight:bold; color:#000080; ">uh </Text></Message><Message Date="6/02/2005" Time="10:14:09 AM" DateTime="2005-02-05T23:14:09.546Z" SessionID="11"><From><User FriendlyName="James *-) Hun, I cant do this anymore see my heart just falls out when yo walk in the door..."/></From><To><User FriendlyName="She's drunk like a school girl, Dressed to kill. I swear i'm not in love with you!   |   mhc rg 222   |"/></To><Text Style="font-family:Comic Sans MS; font-weight:bold; color:#000080; ">well</Text></Message><Message Date="6/02/2005" Time="10:14:11 AM" DateTime="2005-02-05T23:14:11.900Z" SessionID="11"><From><User FriendlyName="James *-) Hun, I cant do this anymore see my heart just falls out when yo walk in the door..."/></From><To><User FriendlyName="She's drunk like a school girl, Dressed to kill. I swear i'm not in love with you!   |   mhc rg 222   |"/></To><Text Style="font-family:Comic Sans MS; font-weight:bold; color:#000080; ">probly not much</Text></Message><Message Date="6/02/2005" Time="10:14:17 AM" DateTime="2005-02-05T23:14:17.037Z" SessionID="11"><From><User FriendlyName="She's drunk like a school girl, Dressed to kill. I swear i'm not in love with you!   |   mhc rg 222   |"/></From><To><User FriendlyName="James *-) Hun, I cant do this anymore see my heart just falls out when yo walk in the door..."/></To><Text Style="font-family:Georgia Ref; font-weight:bold; color:#000080; ">wanna do sumthin</Text></Message><Message Date="6/02/2005" Time="10:14:26 AM" DateTime="2005-02-05T23:14:26.721Z" SessionID="11"><From><User FriendlyName="She's drunk like a school girl, Dressed to kill. I swear i'm not in love with you!   |   mhc rg 222   |"/></From><To><User FriendlyName="James *-) Hun, I cant do this anymore see my heart just falls out when yo walk in the door..."/></To><Text Style="font-family:Georgia Ref; font-weight:bold; color:#000080; ">i'm at ma mumz n got nuthin planned 4 today</Text></Message><Message Date="6/02/2005" Time="10:15:21 AM" DateTime="2005-02-05T23:15:21.240Z" SessionID="11"><From><User FriendlyName="She's drunk like a school girl, Dressed to kill. I swear i'm not in love with you!   |   mhc rg 222   |"/></From><To><User FriendlyName="James *-) Hun, I cant do this anymore see my heart just falls out when yo walk in the door..."/></To><Text Style="font-family:Georgia Ref; font-weight:bold; color:#000080; ">?</Text></Message><Message Date="6/02/2005" Time="10:15:52 AM" DateTime="2005-02-05T23:15:52.675Z" SessionID="11"><From><User FriendlyName="James *-) Hun, I cant do this anymore see my heart just falls out when yo walk in the door..."/></From><To><User FriendlyName="She's drunk like a school girl, Dressed to kill. I swear i'm not in love with you!   |   mhc rg 222   |"/></To><Text Style="font-family:Comic Sans MS; font-weight:bold; color:#000080; ">umm watever</Text></Message><Message Date="6/02/2005" Time="10:16:10 AM" DateTime="2005-02-05T23:16:10.030Z" SessionID="11"><From><User FriendlyName="James *-) Hun, I cant do this anymore see my heart just falls out when yo walk in the door..."/></From><To><User FriendlyName="She's drunk like a school girl, Dressed to kill. I swear i'm not in love with you!   |   mhc rg 222   |"/></To><Text Style="font-family:Comic Sans MS; font-weight:bold; color:#000080; ">i dun have anything planned</Text></Message><Message Date="6/02/2005" Time="10:16:36 AM" DateTime="2005-02-05T23:16:36.237Z" SessionID="11"><From><User FriendlyName="She's drunk like a school girl, Dressed to kill. I swear i'm not in love with you!   |   mhc rg 222   |"/></From><To><User FriendlyName="James *-) Hun, I cant do this anymore see my heart just falls out when yo walk in the door..."/></To><Text Style="font-family:Georgia Ref; font-weight:bold; color:#000080; ">k kewl</Text></Message><Message Date="6/02/2005" Time="10:16:40 AM" DateTime="2005-02-05T23:16:40.554Z" SessionID="11"><From><User FriendlyName="She's drunk like a school girl, Dressed to kill. I swear i'm not in love with you!   |   mhc rg 222   |"/></From><To><User FriendlyName="James *-) Hun, I cant do this anymore see my heart just falls out when yo walk in the door..."/></To><Text Style="font-family:Georgia Ref; font-weight:bold; color:#000080; ">well what do u wanna do?</Text></Message><Message Date="6/02/2005" Time="10:18:11 AM" DateTime="2005-02-05T23:18:11.124Z" SessionID="11"><From><User FriendlyName="James *-) Hun, I cant do this anymore see my heart just falls out when yo walk in the door..."/></From><To><User FriendlyName="She's drunk like a school girl, Dressed to kill. I swear i'm not in love with you!   |   mhc rg 222   |"/></To><Text Style="font-family:Comic Sans MS; font-weight:bold; color:#000080; ">lol uh dunno</Text></Message><Message Date="6/02/2005" Time="10:18:16 AM" DateTime="2005-02-05T23:18:16.662Z" SessionID="11"><From><User FriendlyName="She's drunk like a school girl, Dressed to kill. I swear i'm not in love with you!   |   mhc rg 222   |"/></From><To><User FriendlyName="James *-) Hun, I cant do this anymore see my heart just falls out when yo walk in the door..."/></To><Text Style="font-family:Georgia Ref; font-weight:bold; color:#000080; ">i waz gonna head on over to ma dadz and have a halo  fest</Text></Message><Message Date="6/02/2005" Time="10:18:29 AM" DateTime="2005-02-05T23:18:29.640Z" SessionID="11"><From><User FriendlyName="James *-) Hun, I cant do this anymore see my heart just falls out when yo walk in the door..."/></From><To><User FriendlyName="She's drunk like a school girl, Dressed to kill. I swear i'm not in love with you!   |   mhc rg 222   |"/></To><Text Style="font-family:Comic Sans MS; font-weight:bold; color:#000080; ">lol</Text></Message><Message Date="6/02/2005" Time="10:18:31 AM" DateTime="2005-02-05T23:18:31.143Z" SessionID="11"><From><User FriendlyName="James *-) Hun, I cant do this anymore see my heart just falls out when yo walk in the door..."/></From><To><User FriendlyName="She's drunk like a school girl, Dressed to kill. I swear i'm not in love with you!   |   mhc rg 222   |"/></To><Text Style="font-family:Comic Sans MS; font-weight:bold; color:#000080; ">1 or 2</Text></Message><Message Date="6/02/2005" Time="10:18:39 AM" DateTime="2005-02-05T23:18:39.845Z" SessionID="11"><From><User FriendlyName="She's drunk like a school girl, Dressed to kill. I swear i'm not in love with you!   |   mhc rg 222   |"/></From><To><User FriendlyName="James *-) Hun, I cant do this anymore see my heart just falls out when yo walk in the door..."/></To><Text Style="font-family:Georgia Ref; font-weight:bold; color:#000080; ">1 or 2 what?</Text></Message><Message Date="6/02/2005" Time="10:19:07 AM" DateTime="2005-02-05T23:19:07.385Z" SessionID="11"><From><User FriendlyName="James *-) Hun, I cant do this anymore see my heart just falls out when yo walk in the door..."/></From><To><User FriendlyName="She's drunk like a school girl, Dressed to kill. I swear i'm not in love with you!   |   mhc rg 222   |"/></To><Text Style="font-family:Comic Sans MS; font-weight:bold; color:#000080; ">halo</Text></Message><Message Date="6/02/2005" Time="10:19:16 AM" DateTime="2005-02-05T23:19:16.368Z" SessionID="11"><From><User FriendlyName="She's drunk like a school girl, Dressed to kill. I swear i'm not in love with you!   |   mhc rg 222   |"/></From><To><User FriendlyName="James *-) Hun, I cant do this anymore see my heart just falls out when yo walk in the door..."/></To><Text Style="font-family:Georgia Ref; font-weight:bold; color:#000080; ">1</Text></Message><Message Date="6/02/2005" Time="10:19:20 AM" DateTime="2005-02-05T23:19:20.053Z" SessionID="11"><From><User FriendlyName="She's drunk like a school girl, Dressed to kill. I swear i'm not in love with you!   |   mhc rg 222   |"/></From><To><User FriendlyName="James *-) Hun, I cant do this anymore see my heart just falls out when yo walk in the door..."/></To><Text Style="font-family:Georgia Ref; font-weight:bold; color:#000080; ">i dun have 2 yet</Text></Message><Message Date="6/02/2005" Time="10:19:25 AM" DateTime="2005-02-05T23:19:25.901Z" SessionID="11"><From><User FriendlyName="James *-) Hun, I cant do this anymore see my heart just falls out when yo walk in the door..."/></From><To><User FriendlyName="She's drunk like a school girl, Dressed to kill. I swear i'm not in love with you!   |   mhc rg 222   |"/></To><Text Style="font-family:Comic Sans MS; font-weight:bold; color:#000080; ">yaeh its not that good</Text></Message><Message Date="6/02/2005" Time="10:19:28 AM" DateTime="2005-02-05T23:19:28.805Z" SessionID="12"><From><User FriendlyName="She's drunk like a school girl, Dressed to kill. I swear i'm not in love with you!   |   mhc rg 222   |"/></From><To><User FriendlyName="James *-) Hun, I cant do this anymore see my heart just falls out when yo walk in the door..."/></To><Text Style="font-family:Georgia Ref; font-weight:bold; color:#000080; ">* bows head in shame*</Text></Message><Message Date="6/02/2005" Time="10:19:44 AM" DateTime="2005-02-05T23:19:44.238Z" SessionID="12"><From><User FriendlyName="She's drunk like a school girl, Dressed to kill. I swear i'm not in love with you!   |   mhc rg 222   |"/></From><To><User FriendlyName="James *-) Hun, I cant do this anymore see my heart just falls out when yo walk in the door..."/></To><Text Style="font-family:Georgia Ref; font-weight:bold; color:#000080; ">yer i reckon 1 is pretty gun</Text></Message><Message Date="6/02/2005" Time="10:19:50 AM" DateTime="2005-02-05T23:19:50.957Z" SessionID="12"><From><User FriendlyName="She's drunk like a school girl, Dressed to kill. I swear i'm not in love with you!   |   mhc rg 222   |"/></From><To><User FriendlyName="James *-) Hun, I cant do this anymore see my heart just falls out when yo walk in the door..."/></To><Text Style="font-family:Georgia Ref; font-weight:bold; color:#000080; ">wanna joni me?</Text></Message><Message Date="6/02/2005" Time="10:19:59 AM" DateTime="2005-02-05T23:19:59.179Z" SessionID="12"><From><User FriendlyName="She's drunk like a school girl, Dressed to kill. I swear i'm not in love with you!   |   mhc rg 222   |"/></From><To><User FriendlyName="James *-) Hun, I cant do this anymore see my heart just falls out when yo walk in the door..."/></To><Text Style="font-family:Georgia Ref; font-weight:bold; color:#000080; ">in am nerd fest?</Text></Message><Message Date="6/02/2005" Time="10:20:02 AM" DateTime="2005-02-05T23:20:02.394Z" SessionID="12"><From><User FriendlyName="She's drunk like a school girl, Dressed to kill. I swear i'm not in love with you!   |   mhc rg 222   |"/></From><To><User FriendlyName="James *-) Hun, I cant do this anymore see my heart just falls out when yo walk in the door..."/></To><Text Style="font-family:Georgia Ref; font-weight:bold; color:#000080; ">me*</Text></Message><Message Date="6/02/2005" Time="10:20:16 AM" DateTime="2005-02-05T23:20:16.805Z" SessionID="12"><From><User FriendlyName="James *-) Hun, I cant do this anymore see my heart just falls out when yo walk in the door..."/></From><To><User FriendlyName="She's drunk like a school girl, Dressed to kill. I swear i'm not in love with you!   |   mhc rg 222   |"/></To><Text Style="font-family:Comic Sans MS; font-weight:bold; color:#000080; ">How man ppl?</Text></Message><Message Date="6/02/2005" Time="10:20:21 AM" DateTime="2005-02-05T23:20:21.952Z" SessionID="12"><From><User FriendlyName="She's drunk like a school girl, Dressed to kill. I swear i'm not in love with you!   |   mhc rg 222   |"/></From><To><User FriendlyName="James *-) Hun, I cant do this anymore see my heart just falls out when yo walk in the door..."/></To><Text Style="font-family:Georgia Ref; font-weight:bold; color:#000080; ">lol 2</Text></Message><Message Date="6/02/2005" Time="10:22:52 AM" DateTime="2005-02-05T23:22:52.438Z" SessionID="12"><From><User FriendlyName="She's drunk like a school girl, Dressed to kill. I swear i'm not in love with you!   |   mhc rg 222   |"/></From><To><User FriendlyName="James *-) Hun, I cant do this anymore see my heart just falls out when yo walk in the door..."/></To><Text Style="font-family:Georgia Ref; font-weight:bold; color:#000080; ">my god i hate gc</Text></Message><Message Date="6/02/2005" Time="10:23:03 AM" DateTime="2005-02-05T23:23:03.254Z" SessionID="12"><From><User FriendlyName="James *-) Hun, I cant do this anymore see my heart just falls out when yo walk in the door..."/></From><To><User FriendlyName="She's drunk like a school girl, Dressed to kill. I swear i'm not in love with you!   |   mhc rg 222   |"/></To><Text Style="font-family:Comic Sans MS; font-weight:bold; color:#000080; ">gamecube?</Text></Message><Message Date="6/02/2005" Time="10:23:13 AM" DateTime="2005-02-05T23:23:13.699Z" SessionID="12"><From><User FriendlyName="She's drunk like a school girl, Dressed to kill. I swear i'm not in love with you!   |   mhc rg 222   |"/></From><To><User FriendlyName="James *-) Hun, I cant do this anymore see my heart just falls out when yo walk in the door..."/></To><Text Style="font-family:Georgia Ref; font-weight:bold; color:#000080; ">no</Text></Message><Message Date="6/02/2005" Time="10:23:16 AM" DateTime="2005-02-05T23:23:16.813Z" SessionID="12"><From><User FriendlyName="She's drunk like a school girl, Dressed to kill. I swear i'm not in love with you!   |   mhc rg 222   |"/></From><To><User FriendlyName="James *-) Hun, I cant do this anymore see my heart just falls out when yo walk in the door..."/></To><Text Style="font-family:Georgia Ref; font-weight:bold; color:#000080; ">good chalotte</Text></Message><Message Date="6/02/2005" Time="10:23:27 AM" DateTime="2005-02-05T23:23:27.399Z" SessionID="12"><From><User FriendlyName="She's drunk like a school girl, Dressed to kill. I swear i'm not in love with you!   |   mhc rg 222   |"/></From><To><User FriendlyName="James *-) Hun, I cant do this anymore see my heart just falls out when yo walk in the door..."/></To><Text Style="font-family:Georgia Ref; font-weight:bold; color:#000080; ">charlotte*</Text></Message><Message Date="6/02/2005" Time="10:28:14 AM" DateTime="2005-02-05T23:28:14.231Z" SessionID="12"><From><User FriendlyName="James *-) Hun, I cant do this anymore see my heart just falls out when yo walk in the door..."/></From><To><User FriendlyName="She's drunk like a school girl, Dressed to kill. I swear i'm not in love with you!   |   mhc rg 222   |"/></To><Text Style="font-family:Comic Sans MS; font-weight:bold; color:#000080; ">lol</Text></Message><Message Date="6/02/2005" Time="10:42:39 AM" DateTime="2005-02-05T23:42:39.716Z" SessionID="12"><From><User FriendlyName="She's drunk like a school girl, Dressed to kill. I swear i'm not in love with you!   |   mhc rg 222   |"/></From><To><User FriendlyName="James *-) Hun, I cant do this anymore see my heart just falls out when yo walk in the door..."/></To><Text Style="font-family:Georgia Ref; font-weight:bold; color:#000080; ">hmmmmm</Text></Message><Message Date="6/02/2005" Time="1:10:09 PM" DateTime="2005-02-06T02:10:09.080Z" SessionID="13"><From><User FriendlyName="She's drunk like a school girl, Dressed to kill. I swear i'm not in love with you!   |   mhc rg 222   |"/></From><To><User FriendlyName="James *-) Hun, I cant do this anymore see my heart just falls out when yo walk in the door..."/></To><Text Style="font-family:Georgia Ref; font-weight:bold; color:#000080; ">hey</Text></Message><Message Date="6/02/2005" Time="1:10:28 PM" DateTime="2005-02-06T02:10:28.278Z" SessionID="13"><From><User FriendlyName="She's drunk like a school girl, Dressed to kill. I swear i'm not in love with you!   |   mhc rg 222   |"/></From><To><User FriendlyName="James *-) Hun, I cant do this anymore see my heart just falls out when yo walk in the door..."/></To><Text Style="font-family:Georgia Ref; font-weight:bold; color:#000080; ">what's our geo hw?</Text></Message><Message Date="6/02/2005" Time="1:11:51 PM" DateTime="2005-02-06T02:11:51.908Z" SessionID="13"><From><User FriendlyName="She's drunk like a school girl, Dressed to kill. I swear i'm not in love with you!   |   mhc rg 222   |"/></From><To><User FriendlyName="James *-) Hun, I cant do this anymore see my heart just falls out when yo walk in the door..."/></To><Text Style="font-family:Georgia Ref; font-weight:bold; color:#000080; ">?</Text></Message><Message Date="6/02/2005" Time="2:15:36 PM" DateTime="2005-02-06T03:15:36.057Z" SessionID="14"><From><User FriendlyName="She's drunk like a school girl, Dressed to kill. I swear i'm not in love with you!   |   mhc rg 222   |"/></From><To><User FriendlyName="James *-) Hun, I cant do this anymore see my heart just falls out when yo walk in the door..."/></To><Text Style="font-family:Georgia Ref; font-weight:bold; color:#000080; ">u there?</Text></Message><Message Date="21/02/2005" Time="6:22:27 PM" DateTime="2005-02-21T07:22:27.403Z" SessionID="15"><From><User FriendlyName="James *-)The Light at the end of the Tunnel is an Oncoming Freight Train..."/></From><To><User FriendlyName="-#.1 Something to write home about. , ' I'm a matreial Boy ' _*"/></To><Text Style="font-family:Comic Sans MS; font-weight:bold; color:#000080; ">Have u dun ur geopgrahy</Text></Message><Message Date="21/02/2005" Time="6:22:38 PM" DateTime="2005-02-21T07:22:38.769Z" SessionID="15"><From><User FriendlyName="-#.1 Something to write home about. , ' I'm a matreial Boy ' _*"/></From><To><User FriendlyName="James *-)The Light at the end of the Tunnel is an Oncoming Freight Train..."/></To><Text Style="font-family:Maiandra GD; font-weight:bold; color:#000080; ">not yet</Text></Message><Message Date="21/02/2005" Time="6:22:48 PM" DateTime="2005-02-21T07:22:48.714Z" SessionID="15"><From><User FriendlyName="James *-)The Light at the end of the Tunnel is an Oncoming Freight Train..."/></From><To><User FriendlyName="-#.1 Something to write home about. , ' I'm a matreial Boy ' _*"/></To><Text Style="font-family:Comic Sans MS; font-weight:bold; color:#000080; ">its deu next week</Text></Message><Message Date="21/02/2005" Time="6:22:55 PM" DateTime="2005-02-21T07:22:55.994Z" SessionID="15"><From><User FriendlyName="James *-)The Light at the end of the Tunnel is an Oncoming Freight Train..."/></From><To><User FriendlyName="-#.1 Something to write home about. , ' I'm a matreial Boy ' _*"/></To><Text Style="font-family:Comic Sans MS; font-weight:bold; color:#000080; ">ive dun nearly all of part A</Text></Message><Message Date="21/02/2005" Time="6:23:00 PM" DateTime="2005-02-21T07:23:00.641Z" SessionID="15"><From><User FriendlyName="-#.1 Something to write home about. , ' I'm a matreial Boy ' _*"/></From><To><User FriendlyName="James *-)The Light at the end of the Tunnel is an Oncoming Freight Train..."/></To><Text Style="font-family:Maiandra GD; font-weight:bold; color:#000080; ">no it's not</Text></Message><Message Date="21/02/2005" Time="6:23:07 PM" DateTime="2005-02-21T07:23:07.471Z" SessionID="15"><From><User FriendlyName="James *-)The Light at the end of the Tunnel is an Oncoming Freight Train..."/></From><To><User FriendlyName="-#.1 Something to write home about. , ' I'm a matreial Boy ' _*"/></To><Text Style="font-family:Comic Sans MS; font-weight:bold; color:#000080; ">uhh u sure</Text></Message><Message Date="21/02/2005" Time="6:23:12 PM" DateTime="2005-02-21T07:23:12.177Z" SessionID="15"><From><User FriendlyName="-#.1 Something to write home about. , ' I'm a matreial Boy ' _*"/></From><To><User FriendlyName="James *-)The Light at the end of the Tunnel is an Oncoming Freight Train..."/></To><Text Style="font-family:Maiandra GD; font-weight:bold; color:#000080; ">pretty</Text></Message><Message Date="21/02/2005" Time="6:23:17 PM" DateTime="2005-02-21T07:23:17.094Z" SessionID="15"><From><User FriendlyName="James *-)The Light at the end of the Tunnel is an Oncoming Freight Train..."/></From><To><User FriendlyName="-#.1 Something to write home about. , ' I'm a matreial Boy ' _*"/></To><Text Style="font-family:Comic Sans MS; font-weight:bold; color:#000080; ">week after?</Text></Message><Message Date="21/02/2005" Time="6:23:25 PM" DateTime="2005-02-21T07:23:25.516Z" SessionID="15"><From><User FriendlyName="-#.1 Something to write home about. , ' I'm a matreial Boy ' _*"/></From><To><User FriendlyName="James *-)The Light at the end of the Tunnel is an Oncoming Freight Train..."/></To><Text Style="font-family:Maiandra GD; font-weight:bold; color:#000080; ">7</Text></Message><Message Date="21/02/2005" Time="6:26:31 PM" DateTime="2005-02-21T07:26:31.784Z" SessionID="16"><From><User FriendlyName="-#.1 Something to write home about. , ' I'm a matreial Boy ' _*"/></From><To><User FriendlyName="James *-)The Light at the end of the Tunnel is an Oncoming Freight Train..."/></To><Text Style="font-family:Maiandra GD; font-weight:bold; color:#000080; ">yer def week 7</Text></Message><Message Date="21/02/2005" Time="6:26:38 PM" DateTime="2005-02-21T07:26:38.724Z" SessionID="16"><From><User FriendlyName="James *-)The Light at the end of the Tunnel is an Oncoming Freight Train..."/></From><To><User FriendlyName="-#.1 Something to write home about. , ' I'm a matreial Boy ' _*"/></To><Text Style="font-family:Comic Sans MS; font-weight:bold; color:#000080; ">ah aight</Text></Message><Message Date="21/02/2005" Time="6:26:52 PM" DateTime="2005-02-21T07:26:52.224Z" SessionID="16"><From><User FriendlyName="James *-)The Light at the end of the Tunnel is an Oncoming Freight Train..."/></From><To><User FriendlyName="-#.1 Something to write home about. , ' I'm a matreial Boy ' _*"/></To><Text Style="font-family:Comic Sans MS; font-weight:bold; color:#000080; ">well i wanna finish it soon cuz im not gonner do it AFTER i get my nintedo DS</Text></Message><Message Date="21/02/2005" Time="6:26:54 PM" DateTime="2005-02-21T07:26:54.767Z" SessionID="16"><From><User FriendlyName="James *-)The Light at the end of the Tunnel is an Oncoming Freight Train..."/></From><To><User FriendlyName="-#.1 Something to write home about. , ' I'm a matreial Boy ' _*"/></To><Text Style="font-family:Comic Sans MS; font-weight:bold; color:#000080; ">:)</Text></Message><Message Date="21/02/2005" Time="6:27:04 PM" DateTime="2005-02-21T07:27:04.011Z" SessionID="16"><From><User FriendlyName="-#.1 Something to write home about. , ' I'm a matreial Boy ' _*"/></From><To><User FriendlyName="James *-)The Light at the end of the Tunnel is an Oncoming Freight Train..."/></To><Text Style="font-family:Maiandra GD; font-weight:bold; color:#000080; ">yer</Text></Message><Message Date="21/02/2005" Time="6:27:27 PM" DateTime="2005-02-21T07:27:27.665Z" SessionID="16"><From><User FriendlyName="James *-)The Light at the end of the Tunnel is an Oncoming Freight Train..."/></From><To><User FriendlyName="-#.1 Something to write home about. , ' I'm a matreial Boy ' _*"/></To><Text Style="font-family:Comic Sans MS; font-weight:bold; color:#000080; ">cant wait</Text></Message><Invitation Date="24/02/2005" Time="6:51:14 PM" DateTime="2005-02-24T07:51:14.971Z" SessionID="17"><From><User FriendlyName="James *-)Nintedo DS is 133+ :D"/></From><File>C:\Documents and Settings\James O'Toole\My Documents\Nintedo DS Smaller.JPG</File><Text Style="color:#545454; ">James *-)Nintedo DS is 133+ :D sends C:\Documents and Settings\James O'Toole\My Documents\Nintedo DS Smaller.JPG</Text></Invitation><InvitationResponse Date="24/02/2005" Time="6:51:48 PM" DateTime="2005-02-24T07:51:48.710Z" SessionID="17"><From><User FriendlyName="-#.1 |KCALB|label|&quot; You say you need me more than anyone else... Well, Go to hell! Where have you been?&quot; #.-2"/></From><File>C:\Documents and Settings\James O'Toole\My Documents\Nintedo DS Smaller.JPG</File><Text Style="color:#545454; ">Transfer of "Nintedo DS Smaller.JPG" is complete.</Text></InvitationResponse><Message Date="24/02/2005" Time="6:52:04 PM" DateTime="2005-02-24T07:52:04.032Z" SessionID="17"><From><User FriendlyName="James *-)Nintedo DS is 133+ :D"/></From><To><User FriendlyName="-#.1 |KCALB|label|&quot; You say you need me more than anyone else... Well, Go to hell! Where have you been?&quot; #.-2"/></To><Text Style="font-family:Comic Sans MS; font-weight:bold; color:#000080; ">Godamn its sxc :S</Text></Message><Message Date="24/02/2005" Time="6:52:05 PM" DateTime="2005-02-24T07:52:05.474Z" SessionID="17"><From><User FriendlyName="James *-)Nintedo DS is 133+ :D"/></From><To><User FriendlyName="-#.1 |KCALB|label|&quot; You say you need me more than anyone else... Well, Go to hell! Where have you been?&quot; #.-2"/></To><Text Style="font-family:Comic Sans MS; font-weight:bold; color:#000080; ">:D</Text></Message><Message Date="24/02/2005" Time="6:52:33 PM" DateTime="2005-02-24T07:52:33.013Z" SessionID="18"><From><User FriendlyName="-#.1 |KCALB|label|&quot; You say you need me more than anyone else... Well, Go to hell! Where have you been?&quot; #.-2"/></From><To><User FriendlyName="James *-)Nintedo DS is 133+ :D"/></To><Text Style="font-family:Georgia Ref; font-weight:bold; color:#000080; ">haha</Text></Message><Message Date="24/02/2005" Time="6:52:44 PM" DateTime="2005-02-24T07:52:44.420Z" SessionID="18"><From><User FriendlyName="-#.1 |KCALB|label|&quot; You say you need me more than anyone else... Well, Go to hell! Where have you been?&quot; #.-2"/></From><To><User FriendlyName="James *-)Nintedo DS is 133+ :D"/></To><Text Style="font-family:Georgia Ref; font-weight:bold; color:#000080; ">nice</Text></Message><Message Date="25/02/2005" Time="3:43:20 PM" DateTime="2005-02-25T04:43:20.676Z" SessionID="19"><From><User FriendlyName="-#.1 |KCALB|label|&quot; And i still no the way to make your makup run!!!&quot; #.-2  -FaLlOuT+bOy-(PeNgUiNz N' pOlAr BeArZ)"/></From><To><User FriendlyName="James *-)Nintedo DS is 133+ :D"/></To><Text Style="font-family:Maiandra GD; font-weight:bold; color:#000080; ">i fkn want a nintendo ds!</Text></Message><Message Date="25/02/2005" Time="3:43:25 PM" DateTime="2005-02-25T04:43:25.714Z" SessionID="19"><From><User FriendlyName="James *-)Nintedo DS is 133+ :D"/></From><To><User FriendlyName="-#.1 |KCALB|label|&quot; And i still no the way to make your makup run!!!&quot; #.-2  -FaLlOuT+bOy-(PeNgUiNz N' pOlAr BeArZ)"/></To><Text Style="font-family:Comic Sans MS; font-weight:bold; color:#000080; ">lol</Text></Message><Message Date="25/02/2005" Time="3:43:29 PM" DateTime="2005-02-25T04:43:29.349Z" SessionID="19"><From><User FriendlyName="James *-)Nintedo DS is 133+ :D"/></From><To><User FriendlyName="-#.1 |KCALB|label|&quot; And i still no the way to make your makup run!!!&quot; #.-2  -FaLlOuT+bOy-(PeNgUiNz N' pOlAr BeArZ)"/></To><Text Style="font-family:Comic Sans MS; font-weight:bold; color:#000080; ">Buy wun :P</Text></Message><Message Date="25/02/2005" Time="3:43:37 PM" DateTime="2005-02-25T04:43:37.571Z" SessionID="19"><From><User FriendlyName="-#.1 |KCALB|label|&quot; And i still no the way to make your makup run!!!&quot; #.-2  -FaLlOuT+bOy-(PeNgUiNz N' pOlAr BeArZ)"/></From><To><User FriendlyName="James *-)Nintedo DS is 133+ :D"/></To><Text Style="font-family:Maiandra GD; font-weight:bold; color:#000080; ">nah man b'day!</Text></Message><Message Date="25/02/2005" Time="3:43:54 PM" DateTime="2005-02-25T04:43:54.705Z" SessionID="20"><From><User FriendlyName="-#.1 |KCALB|label|&quot; And i still no the way to make your makup run!!!&quot; #.-2  -FaLlOuT+bOy-(PeNgUiNz N' pOlAr BeArZ)"/></From><To><User FriendlyName="James *-)Nintedo DS is 133+ :D"/></To><Text Style="font-family:Maiandra GD; font-weight:bold; color:#000080; ">then i dun pay for it ma rents do</Text></Message><InvitationResponse Date="25/02/2005" Time="8:42:50 PM" DateTime="2005-02-25T09:42:50.985Z" SessionID="21"><From><User FriendlyName="-#.1 |KCALB|label|&quot; And i still no the way to make your makup run!!!&quot; #.-2  -FaLlOuT+bOy-(PeNgUiNz N' pOlAr BeArZ)"/></From><Application></Application><Text>-#.1 |KCALB|label|" And i still no the way to make your makup run!!!" #.-2  -FaLlOuT+bOy-(PeNgUiNz N' pOlAr BeArZ) sent the wink "Sunflower"</Text></InvitationResponse><Message Date="25/02/2005" Time="8:43:06 PM" DateTime="2005-02-25T09:43:06.517Z" SessionID="21"><From><User FriendlyName="James *-)Nintedo DS is 133+ :D"/></From><To><User FriendlyName="-#.1 |KCALB|label|&quot; And i still no the way to make your makup run!!!&quot; #.-2  -FaLlOuT+bOy-(PeNgUiNz N' pOlAr BeArZ)"/></To><Text Style="font-family:Comic Sans MS; font-weight:bold; color:#000080; ">rofl</Text></Message><Message Date="25/02/2005" Time="8:43:39 PM" DateTime="2005-02-25T09:43:39.295Z" SessionID="22"><From><User FriendlyName="-#.1 |KCALB|label|&quot; And i still no the way to make your makup run!!!&quot; #.-2  -FaLlOuT+bOy-(PeNgUiNz N' pOlAr BeArZ)"/></From><To><User FriendlyName="James *-)Nintedo DS is 133+ :D"/></To><Text Style="font-family:Maiandra GD; font-weight:bold; color:#000080; ">:| whoz cream face?</Text></Message><Message Date="25/02/2005" Time="8:44:05 PM" DateTime="2005-02-25T09:44:05.412Z" SessionID="22"><From><User FriendlyName="James *-)Nintedo DS is 133+ :D"/></From><To><User FriendlyName="-#.1 |KCALB|label|&quot; And i still no the way to make your makup run!!!&quot; #.-2  -FaLlOuT+bOy-(PeNgUiNz N' pOlAr BeArZ)"/></To><Text Style="font-family:Comic Sans MS; font-weight:bold; color:#000080; ">not a CLUE!</Text></Message><Message Date="25/02/2005" Time="8:44:21 PM" DateTime="2005-02-25T09:44:21.095Z" SessionID="23"><From><User FriendlyName="-#.1 |KCALB|label|&quot; And i still no the way to make your makup run!!!&quot; #.-2  -FaLlOuT+bOy-(PeNgUiNz N' pOlAr BeArZ)"/></From><To><User FriendlyName="James *-)Nintedo DS is 133+ :D"/></To><Text Style="font-family:Maiandra GD; font-weight:bold; color:#000080; ">lol fair good</Text></Message><Message Date="26/02/2005" Time="2:38:37 PM" DateTime="2005-02-26T03:38:37.944Z" SessionID="24"><From><User FriendlyName="-#.1 |KCALB|label|&quot;Pleaz.... Don't leave me, Without saying goodbye #-(The Starting Line-Leaving-)-#  *Free4ALL"/></From><To><User FriendlyName="James *-)Nintedo DS is 133+ :)"/></To><Text Style="font-family:Maiandra GD; font-weight:bold; color:#000080; ">hey</Text></Message><Message Date="26/02/2005" Time="2:40:37 PM" DateTime="2005-02-26T03:40:37.446Z" SessionID="24"><From><User FriendlyName="James *-)Nintedo DS is 133+ :)"/></From><To><User FriendlyName="-#.1 |KCALB|label|&quot;Pleaz.... Don't leave me, Without saying goodbye #-(The Starting Line-Leaving-)-#  *Free4ALL"/></To><Text Style="font-family:Comic Sans MS; font-weight:bold; color:#000080; ">aye</Text></Message><Message Date="26/02/2005" Time="2:40:45 PM" DateTime="2005-02-26T03:40:45.768Z" SessionID="25"><From><User FriendlyName="-#.1 |KCALB|label|&quot;Pleaz.... Don't leave me, Without saying goodbye #-(The Starting Line-Leaving-)-#  *Free4ALL"/></From><To><User FriendlyName="James *-)Nintedo DS is 133+ :)"/></To><Text Style="font-family:Maiandra GD; font-weight:bold; color:#000080; ">whatz doin?</Text></Message><Message Date="26/02/2005" Time="2:43:17 PM" DateTime="2005-02-26T03:43:17.355Z" SessionID="25"><From><User FriendlyName="James *-)Nintedo DS is 133+ :)"/></From><To><User FriendlyName="-#.1 |KCALB|label|&quot;Pleaz.... Don't leave me, Without saying goodbye #-(The Starting Line-Leaving-)-#  *Free4ALL"/></To><Text Style="font-family:Comic Sans MS; font-weight:bold; color:#000080; ">ds</Text></Message><Message Date="26/02/2005" Time="2:43:29 PM" DateTime="2005-02-26T03:43:29.142Z" SessionID="25"><From><User FriendlyName="-#.1 |KCALB|label|&quot;Pleaz.... Don't leave me, Without saying goodbye #-(The Starting Line-Leaving-)-#  *Free4ALL"/></From><To><User FriendlyName="James *-)Nintedo DS is 133+ :)"/></To><Text Style="font-family:Maiandra GD; font-weight:bold; color:#000080; ">lol shoulda known</Text></Message><Message Date="1/03/2005" Time="3:25:03 PM" DateTime="2005-03-01T04:25:03.275Z" SessionID="26"><From><User FriendlyName="-#.1 |KCALB|label|&quot;I Love You Like A Bullet To The Back Of The Head&quot; #-|-#-&quot;Insurrection 2&quot;-#&gt;InCuBuS&lt;"/></From><To><User FriendlyName="James *-)"/></To><Text Style="font-family:Georgia Ref; font-weight:bold; color:#000080; ">T fkn 3!!!!!!!111</Text></Message><Message Date="1/03/2005" Time="3:25:06 PM" DateTime="2005-03-01T04:25:06.750Z" SessionID="26"><From><User FriendlyName="-#.1 |KCALB|label|&quot;I Love You Like A Bullet To The Back Of The Head&quot; #-|-#-&quot;Insurrection 2&quot;-#&gt;InCuBuS&lt;"/></From><To><User FriendlyName="James *-)"/></To><Text Style="font-family:Georgia Ref; font-weight:bold; color:#000080; ">it's 3 not 1!!!!!!!!!!!!!!!!11</Text></Message><Message Date="1/03/2005" Time="3:25:11 PM" DateTime="2005-03-01T04:25:11.346Z" SessionID="26"><From><User FriendlyName="-#.1 |KCALB|label|&quot;I Love You Like A Bullet To The Back Of The Head&quot; #-|-#-&quot;Insurrection 2&quot;-#&gt;InCuBuS&lt;"/></From><To><User FriendlyName="James *-)"/></To><Text Style="font-family:Georgia Ref; font-weight:bold; color:#000080; ">mtuha fukin fuka!</Text></Message><Message Date="1/03/2005" Time="3:25:42 PM" DateTime="2005-03-01T04:25:42.471Z" SessionID="26"><From><User FriendlyName="-#.1 |KCALB|label|&quot;I Love You Like A Bullet To The Back Of The Head&quot; #-|-#-&quot;Insurrection 2&quot;-#&gt;InCuBuS&lt;"/></From><To><User FriendlyName="James *-)"/></To><Text Style="font-family:Georgia Ref; font-weight:bold; color:#000080; ">i just clicked on bear share to downlaod ... n it didn;t come up.... n i'm, liek shti its not workin</Text></Message><Message Date="1/03/2005" Time="3:25:51 PM" DateTime="2005-03-01T04:25:51.294Z" SessionID="26"><From><User FriendlyName="-#.1 |KCALB|label|&quot;I Love You Like A Bullet To The Back Of The Head&quot; #-|-#-&quot;Insurrection 2&quot;-#&gt;InCuBuS&lt;"/></From><To><User FriendlyName="James *-)"/></To><Text Style="font-family:Georgia Ref; font-weight:bold; color:#000080; ">n then i realised it downloaded already</Text></Message><Message Date="8/03/2005" Time="5:41:20 PM" DateTime="2005-03-08T06:41:20.407Z" SessionID="27"><From><User FriendlyName="James *-)A friend will help you move.A really good friend will help you move a body:)"/></From><To><User FriendlyName="-#.1 |KCALB|(w)|label| -I remember like yesterday, The time of my life..."/></To><Text Style="font-family:Comic Sans MS; font-weight:bold; color:#000080; ">oi try n bring my magnets 2moz eh</Text></Message><Message Date="14/03/2005" Time="8:51:59 PM" DateTime="2005-03-14T09:51:59.755Z" SessionID="28"><From><User FriendlyName="James*-)Hey, come on try a little,Nothing is forever,There's got to be something better than in the Middle."/></From><To><User FriendlyName="-#.1 |KCALB|(w)|label|Can me and all my friends come back for cones?"/></To><Text Style="font-family:Comic Sans MS; font-weight:bold; color:#000080; ">thats a pretty week evil pic</Text></Message><Message Date="14/03/2005" Time="8:52:15 PM" DateTime="2005-03-14T09:52:15.688Z" SessionID="28"><From><User FriendlyName="James*-)Hey, come on try a little,Nothing is forever,There's got to be something better than in the Middle."/></From><To><User FriendlyName="-#.1 |KCALB|(w)|label|Can me and all my friends come back for cones?"/></To><Text Style="font-family:Comic Sans MS; font-weight:bold; color:#000080; ">ur eyes rnt even all white</Text></Message><Message Date="14/03/2005" Time="8:53:37 PM" DateTime="2005-03-14T09:53:37.636Z" SessionID="29"><From><User FriendlyName="-#.1 |KCALB|(w)|label|Can me and all my friends come back for cones?"/></From><To><User FriendlyName="James*-)Hey, come on try a little,Nothing is forever,There's got to be something better than in the Middle."/></To><Text Style="font-family:Times New Roman; font-weight:bold; color:#ff00ff; ">tru ey</Text></Message><Message Date="14/03/2005" Time="8:53:49 PM" DateTime="2005-03-14T09:53:49.943Z" SessionID="29"><From><User FriendlyName="-#.1 |KCALB|(w)|label|Can me and all my friends come back for cones?"/></From><To><User FriendlyName="James*-)Hey, come on try a little,Nothing is forever,There's got to be something better than in the Middle."/></To><Text Style="font-family:Times New Roman; font-weight:bold; color:#ff00ff; ">how's it goin?</Text></Message><Message Date="14/03/2005" Time="8:53:55 PM" DateTime="2005-03-14T09:53:55.191Z" SessionID="29"><From><User FriendlyName="James*-)Hey, come on try a little,Nothing is forever,There's got to be something better than in the Middle."/></From><To><User FriendlyName="-#.1 |KCALB|(w)|label|Can me and all my friends come back for cones?"/></To><Text Style="font-family:Comic Sans MS; font-weight:bold; color:#000080; ">ah fine</Text></Message><Message Date="14/03/2005" Time="8:54:00 PM" DateTime="2005-03-14T09:54:00.148Z" SessionID="29"><From><User FriendlyName="James*-)Hey, come on try a little,Nothing is forever,There's got to be something better than in the Middle."/></From><To><User FriendlyName="-#.1 |KCALB|(w)|label|Can me and all my friends come back for cones?"/></To><Text Style="font-family:Comic Sans MS; font-weight:bold; color:#000080; ">doin geography 8-)</Text></Message><Message Date="14/03/2005" Time="8:54:04 PM" DateTime="2005-03-14T09:54:04.104Z" SessionID="29"><From><User FriendlyName="James*-)Hey, come on try a little,Nothing is forever,There's got to be something better than in the Middle."/></From><To><User FriendlyName="-#.1 |KCALB|(w)|label|Can me and all my friends come back for cones?"/></To><Text Style="font-family:Comic Sans MS; font-weight:bold; color:#000080; ">bou 2 watch southpark tho</Text></Message><Message Date="14/03/2005" Time="8:54:19 PM" DateTime="2005-03-14T09:54:19.636Z" SessionID="30"><From><User FriendlyName="-#.1 |KCALB|(w)|label|Can me and all my friends come back for cones?"/></From><To><User FriendlyName="James*-)Hey, come on try a little,Nothing is forever,There's got to be something better than in the Middle."/></To><Text Style="font-family:Times New Roman; font-weight:bold; color:#ff00ff; ">awww fuk forgot about that.... thanks mate</Text></Message><Message Date="14/03/2005" Time="8:54:38 PM" DateTime="2005-03-14T09:54:38.583Z" SessionID="30"><From><User FriendlyName="James*-)Hey, come on try a little,Nothing is forever,There's got to be something better than in the Middle."/></From><To><User FriendlyName="-#.1 |KCALB|(w)|label|Can me and all my friends come back for cones?"/></To><Text Style="font-family:Comic Sans MS; font-weight:bold; color:#000080; ">lol I woodnt be thanking me...</Text></Message><Message Date="14/03/2005" Time="8:54:41 PM" DateTime="2005-03-14T09:54:41.928Z" SessionID="30"><From><User FriendlyName="James*-)Hey, come on try a little,Nothing is forever,There's got to be something better than in the Middle."/></From><To><User FriendlyName="-#.1 |KCALB|(w)|label|Can me and all my friends come back for cones?"/></To><Text Style="font-family:Comic Sans MS; font-weight:bold; color:#000080; ">wait</Text></Message><Message Date="14/03/2005" Time="8:54:48 PM" DateTime="2005-03-14T09:54:48.678Z" SessionID="30"><From><User FriendlyName="James*-)Hey, come on try a little,Nothing is forever,There's got to be something better than in the Middle."/></From><To><User FriendlyName="-#.1 |KCALB|(w)|label|Can me and all my friends come back for cones?"/></To><Text Style="font-family:Comic Sans MS; font-weight:bold; color:#000080; ">bout southpark or geography?</Text></Message><Message Date="14/03/2005" Time="8:54:55 PM" DateTime="2005-03-14T09:54:55.648Z" SessionID="30"><From><User FriendlyName="-#.1 |KCALB|(w)|label|Can me and all my friends come back for cones?"/></From><To><User FriendlyName="James*-)Hey, come on try a little,Nothing is forever,There's got to be something better than in the Middle."/></To><Text Style="font-family:Times New Roman; font-weight:bold; color:#ff00ff; ">south park</Text></Message><Message Date="14/03/2005" Time="8:54:59 PM" DateTime="2005-03-14T09:54:59.563Z" SessionID="30"><From><User FriendlyName="James*-)Hey, come on try a little,Nothing is forever,There's got to be something better than in the Middle."/></From><To><User FriendlyName="-#.1 |KCALB|(w)|label|Can me and all my friends come back for cones?"/></To><Text Style="font-family:Comic Sans MS; font-weight:bold; color:#000080; ">lol</Text></Message><Message Date="14/03/2005" Time="8:55:00 PM" DateTime="2005-03-14T09:55:00.895Z" SessionID="30"><From><User FriendlyName="James*-)Hey, come on try a little,Nothing is forever,There's got to be something better than in the Middle."/></From><To><User FriendlyName="-#.1 |KCALB|(w)|label|Can me and all my friends come back for cones?"/></To><Text Style="font-family:Comic Sans MS; font-weight:bold; color:#000080; ">u dun geo</Text></Message><Message Date="14/03/2005" Time="8:55:10 PM" DateTime="2005-03-14T09:55:10.029Z" SessionID="30"><From><User FriendlyName="-#.1 |KCALB|(w)|label|Can me and all my friends come back for cones?"/></From><To><User FriendlyName="James*-)Hey, come on try a little,Nothing is forever,There's got to be something better than in the Middle."/></To><Text Style="font-family:Times New Roman; font-weight:bold; color:#ff00ff; ">yer i did it liek 3 weeks ago</Text></Message><Message Date="14/03/2005" Time="8:55:13 PM" DateTime="2005-03-14T09:55:13.203Z" SessionID="30"><From><User FriendlyName="James*-)Hey, come on try a little,Nothing is forever,There's got to be something better than in the Middle."/></From><To><User FriendlyName="-#.1 |KCALB|(w)|label|Can me and all my friends come back for cones?"/></To><Text Style="font-family:Comic Sans MS; font-weight:bold; color:#000080; ">oh;)</Text></Message><Message Date="14/03/2005" Time="8:55:23 PM" DateTime="2005-03-14T09:55:23.768Z" SessionID="30"><From><User FriendlyName="James*-)Hey, come on try a little,Nothing is forever,There's got to be something better than in the Middle."/></From><To><User FriendlyName="-#.1 |KCALB|(w)|label|Can me and all my friends come back for cones?"/></To><Text Style="font-family:Comic Sans MS; font-weight:bold; color:#000080; ">u dun part b of sciene</Text></Message><Message Date="14/03/2005" Time="8:55:32 PM" DateTime="2005-03-14T09:55:32.791Z" SessionID="30"><From><User FriendlyName="-#.1 |KCALB|(w)|label|Can me and all my friends come back for cones?"/></From><To><User FriendlyName="James*-)Hey, come on try a little,Nothing is forever,There's got to be something better than in the Middle."/></To><Text Style="font-family:Times New Roman; font-weight:bold; color:#ff00ff; ">nup not yet</Text></Message><Message Date="14/03/2005" Time="8:56:10 PM" DateTime="2005-03-14T09:56:10.566Z" SessionID="30"><From><User FriendlyName="James*-)Hey, come on try a little,Nothing is forever,There's got to be something better than in the Middle."/></From><To><User FriendlyName="-#.1 |KCALB|(w)|label|Can me and all my friends come back for cones?"/></To><Text Style="font-family:Comic Sans MS; font-weight:bold; color:#000080; ">ok</Text></Message><Message Date="14/03/2005" Time="8:56:12 PM" DateTime="2005-03-14T09:56:12.919Z" SessionID="30"><From><User FriendlyName="James*-)Hey, come on try a little,Nothing is forever,There's got to be something better than in the Middle."/></From><To><User FriendlyName="-#.1 |KCALB|(w)|label|Can me and all my friends come back for cones?"/></To><Text Style="font-family:Comic Sans MS; font-weight:bold; color:#000080; ">thats easy as</Text></Message><Message Date="14/03/2005" Time="8:56:14 PM" DateTime="2005-03-14T09:56:14.131Z" SessionID="30"><From><User FriendlyName="James*-)Hey, come on try a little,Nothing is forever,There's got to be something better than in the Middle."/></From><To><User FriendlyName="-#.1 |KCALB|(w)|label|Can me and all my friends come back for cones?"/></To><Text Style="font-family:Comic Sans MS; font-weight:bold; color:#000080; ">dun that</Text></Message><Message Date="14/03/2005" Time="8:56:19 PM" DateTime="2005-03-14T09:56:19.919Z" SessionID="31"><From><User FriendlyName="-#.1 |KCALB|(w)|label|Can me and all my friends come back for cones?"/></From><To><User FriendlyName="James*-)Hey, come on try a little,Nothing is forever,There's got to be something better than in the Middle."/></To><Text Style="font-family:Times New Roman; font-weight:bold; color:#ff00ff; ">yer? nice</Text></Message><Message Date="14/03/2005" Time="8:56:36 PM" DateTime="2005-03-14T09:56:36.713Z" SessionID="31"><From><User FriendlyName="-#.1 |KCALB|(w)|label|Can me and all my friends come back for cones?"/></From><To><User FriendlyName="James*-)Hey, come on try a little,Nothing is forever,There's got to be something better than in the Middle."/></To><Text Style="font-family:Times New Roman; font-weight:bold; color:#ff00ff; ">where were you at today?</Text></Message><Message Date="14/03/2005" Time="8:57:04 PM" DateTime="2005-03-14T09:57:04.884Z" SessionID="31"><From><User FriendlyName="James*-)Hey, come on try a little,Nothing is forever,There's got to be something better than in the Middle."/></From><To><User FriendlyName="-#.1 |KCALB|(w)|label|Can me and all my friends come back for cones?"/></To><Text Style="font-family:Comic Sans MS; font-weight:bold; color:#000080; ">The Netherlands</Text></Message><Message Date="14/03/2005" Time="8:57:30 PM" DateTime="2005-03-14T09:57:30.721Z" SessionID="32"><From><User FriendlyName="-#.1 |KCALB|(w)|label|Can me and all my friends come back for cones?"/></From><To><User FriendlyName="James*-)Hey, come on try a little,Nothing is forever,There's got to be something better than in the Middle."/></To><Text Style="font-family:Times New Roman; font-weight:bold; color:#ff00ff; ">:| are you bein a dumb cunt or are you bein serious?</Text></Message><Message Date="14/03/2005" Time="8:57:45 PM" DateTime="2005-03-14T09:57:45.762Z" SessionID="32"><From><User FriendlyName="James*-)Hey, come on try a little,Nothing is forever,There's got to be something better than in the Middle."/></From><To><User FriendlyName="-#.1 |KCALB|(w)|label|Can me and all my friends come back for cones?"/></To><Text Style="font-family:Comic Sans MS; font-weight:bold; color:#000080; ">Were the fuck do u think i was</Text></Message><Message Date="14/03/2005" Time="8:58:01 PM" DateTime="2005-03-14T09:58:01.235Z" SessionID="33"><From><User FriendlyName="-#.1 |KCALB|(w)|label|Can me and all my friends come back for cones?"/></From><To><User FriendlyName="James*-)Hey, come on try a little,Nothing is forever,There's got to be something better than in the Middle."/></To><Text Style="font-family:Times New Roman; font-weight:bold; color:#ff00ff; ">so u were in the netherlands???</Text></Message><Message Date="14/03/2005" Time="8:58:19 PM" DateTime="2005-03-14T09:58:19.531Z" SessionID="33"><From><User FriendlyName="James*-)Hey, come on try a little,Nothing is forever,There's got to be something better than in the Middle."/></From><To><User FriendlyName="-#.1 |KCALB|(w)|label|Can me and all my friends come back for cones?"/></To><Text Style="font-family:Comic Sans MS; font-weight:bold; color:#000080; ">no</Text></Message><Message Date="14/03/2005" Time="8:58:22 PM" DateTime="2005-03-14T09:58:22.585Z" SessionID="33"><From><User FriendlyName="James*-)Hey, come on try a little,Nothing is forever,There's got to be something better than in the Middle."/></From><To><User FriendlyName="-#.1 |KCALB|(w)|label|Can me and all my friends come back for cones?"/></To><Text Style="font-family:Comic Sans MS; font-weight:bold; color:#000080; ">I was at home 8-)</Text></Message><Message Date="14/03/2005" Time="8:58:26 PM" DateTime="2005-03-14T09:58:26.161Z" SessionID="34"><From><User FriendlyName="-#.1 |KCALB|(w)|label|Can me and all my friends come back for cones?"/></From><To><User FriendlyName="James*-)Hey, come on try a little,Nothing is forever,There's got to be something better than in the Middle."/></To><Text Style="font-family:Times New Roman; font-weight:bold; color:#ff00ff; ">oh....</Text></Message><Message Date="14/03/2005" Time="8:58:32 PM" DateTime="2005-03-14T09:58:32.720Z" SessionID="34"><From><User FriendlyName="-#.1 |KCALB|(w)|label|Can me and all my friends come back for cones?"/></From><To><User FriendlyName="James*-)Hey, come on try a little,Nothing is forever,There's got to be something better than in the Middle."/></To><Text Style="font-family:Times New Roman; font-weight:bold; color:#ff00ff; ">mmmk</Text></Message><Message Date="14/03/2005" Time="8:58:35 PM" DateTime="2005-03-14T09:58:35.504Z" SessionID="34"><From><User FriendlyName="James*-)Hey, come on try a little,Nothing is forever,There's got to be something better than in the Middle."/></From><To><User FriendlyName="-#.1 |KCALB|(w)|label|Can me and all my friends come back for cones?"/></To><Text Style="font-family:Comic Sans MS; font-weight:bold; color:#000080; ">lol</Text></Message><Message Date="14/03/2005" Time="8:58:56 PM" DateTime="2005-03-14T09:58:56.394Z" SessionID="35"><From><User FriendlyName="-#.1 |KCALB|(w)|label|Can me and all my friends come back for cones?"/></From><To><User FriendlyName="James*-)Hey, come on try a little,Nothing is forever,There's got to be something better than in the Middle."/></To><Text Style="font-family:Times New Roman; font-weight:bold; color:#ff00ff; ">dude i fkn thought u went to the ntherlands for a day trip or sumthin</Text></Message><Message Date="14/03/2005" Time="8:59:05 PM" DateTime="2005-03-14T09:59:05.087Z" SessionID="35"><From><User FriendlyName="James*-)Hey, come on try a little,Nothing is forever,There's got to be something better than in the Middle."/></From><To><User FriendlyName="-#.1 |KCALB|(w)|label|Can me and all my friends come back for cones?"/></To><Text Style="font-family:Comic Sans MS; font-weight:bold; color:#000080; ">lol</Text></Message><Message Date="14/03/2005" Time="8:59:07 PM" DateTime="2005-03-14T09:59:07.911Z" SessionID="35"><From><User FriendlyName="James*-)Hey, come on try a little,Nothing is forever,There's got to be something better than in the Middle."/></From><To><User FriendlyName="-#.1 |KCALB|(w)|label|Can me and all my friends come back for cones?"/></To><Text Style="font-family:Comic Sans MS; font-weight:bold; color:#000080; ">lol</Text></Message><Message Date="14/03/2005" Time="8:59:10 PM" DateTime="2005-03-14T09:59:10.915Z" SessionID="35"><From><User FriendlyName="James*-)Hey, come on try a little,Nothing is forever,There's got to be something better than in the Middle."/></From><To><User FriendlyName="-#.1 |KCALB|(w)|label|Can me and all my friends come back for cones?"/></To><Text Style="font-family:Comic Sans MS; font-weight:bold; color:#000080; ">hahah</Text></Message><Message Date="14/03/2005" Time="8:59:19 PM" DateTime="2005-03-14T09:59:19.758Z" SessionID="35"><From><User FriendlyName="James*-)Hey, come on try a little,Nothing is forever,There's got to be something better than in the Middle."/></From><To><User FriendlyName="-#.1 |KCALB|(w)|label|Can me and all my friends come back for cones?"/></To><Text Style="font-family:Comic Sans MS; font-weight:bold; color:#000080; ">Oi i gtg South parks almost on</Text></Message><Message Date="14/03/2005" Time="8:59:29 PM" DateTime="2005-03-14T09:59:29.892Z" SessionID="36"><From><User FriendlyName="-#.1 |KCALB|(w)|label|Can me and all my friends come back for cones?"/></From><To><User FriendlyName="James*-)Hey, come on try a little,Nothing is forever,There's got to be something better than in the Middle."/></To><Text Style="font-family:Times New Roman; font-weight:bold; color:#ff00ff; ">ye ri'm on sbs ey</Text></Message><Message Date="14/03/2005" Time="8:59:35 PM" DateTime="2005-03-14T09:59:35.010Z" SessionID="36"><From><User FriendlyName="-#.1 |KCALB|(w)|label|Can me and all my friends come back for cones?"/></From><To><User FriendlyName="James*-)Hey, come on try a little,Nothing is forever,There's got to be something better than in the Middle."/></To><Text Style="font-family:Times New Roman; font-weight:bold; color:#ff00ff; ">lol catchya man</Text></Message><Message Date="14/03/2005" Time="8:59:49 PM" DateTime="2005-03-14T09:59:49.490Z" SessionID="36"><From><User FriendlyName="James*-)Hey, come on try a little,Nothing is forever,There's got to be something better than in the Middle."/></From><To><User FriendlyName="-#.1 |KCALB|(w)|label|Can me and all my friends come back for cones?"/></To><Text Style="font-family:Comic Sans MS; font-weight:bold; color:#000080; ">Cya laters</Text></Message><Message Date="21/03/2005" Time="3:31:18 PM" DateTime="2005-03-21T04:31:18.202Z" SessionID="37"><From><User FriendlyName="James*-)"/></From><To><User FriendlyName="-#.1 |KCALB|(w)|label| - I'm Jaded, Stupid and Wreckless... I'll Never Regret These Years ..."/></To><Text Style="font-family:Comic Sans MS; font-weight:bold; color:#000080; ">http://www.bordergatewayprotocol.net/jon/humor/video/castin.mov</Text></Message><Message Date="21/03/2005" Time="6:21:46 PM" DateTime="2005-03-21T07:21:46.459Z" SessionID="38"><From><User FriendlyName="-#.1 |KCALB|(w)|label| -Erin: i was so proud of myself yesterday i said fuk u to my mumma for the very first time ..."/></From><To><User FriendlyName="James*-)"/></To><Text Style="font-family:Palatino Linotype; font-weight:bold; color:#ff00ff; ">jimmeh</Text></Message><Message Date="21/03/2005" Time="6:21:53 PM" DateTime="2005-03-21T07:21:53.760Z" SessionID="38"><From><User FriendlyName="-#.1 |KCALB|(w)|label| -Erin: i was so proud of myself yesterday i said fuk u to my mumma for the very first time ..."/></From><To><User FriendlyName="James*-)"/></To><Text Style="font-family:Palatino Linotype; font-weight:bold; color:#ff00ff; ">pack the games...</Text></Message><Message Date="21/03/2005" Time="6:21:54 PM" DateTime="2005-03-21T07:21:54.441Z" SessionID="38"><From><User FriendlyName="James*-)"/></From><To><User FriendlyName="-#.1 |KCALB|(w)|label| -Erin: i was so proud of myself yesterday i said fuk u to my mumma for the very first time ..."/></To><Text Style="font-family:Comic Sans MS; font-weight:bold; color:#000080; ">yasam</Text></Message><Invitation Date="21/03/2005" Time="6:21:58 PM" DateTime="2005-03-21T07:21:58.376Z" SessionID="38"><From><User FriendlyName="James*-)"/></From><Application>viewing webcam</Application><Text Style="color:#545454; ">You have invited -#.1 |KCALB|(w)|label| -Erin: i was so proud of myself yesterday i said fuk u to my mumma for the very first time ... to start viewing webcam. Please wait for a response or Cancel (Alt+Q) the pending invitation.</Text></Invitation><InvitationResponse Date="21/03/2005" Time="6:22:19 PM" DateTime="2005-03-21T07:22:19.216Z" SessionID="38"><From><User FriendlyName="-#.1 |KCALB|(w)|label| -Erin: i was so proud of myself yesterday i said fuk u to my mumma for the very first time ..."/></From><Application>viewing webcam</Application><Text Style="color:#545454; ">-#.1 |KCALB|(w)|label| -Erin: i was so proud of myself yesterday i said fuk u to my mumma for the very first time ... has accepted your invitation to start viewing webcam.</Text></InvitationResponse><Message Date="21/03/2005" Time="6:22:21 PM" DateTime="2005-03-21T07:22:21.560Z" SessionID="38"><From><User FriendlyName="-#.1 |KCALB|(w)|label| -Erin: i was so proud of myself yesterday i said fuk u to my mumma for the very first time ..."/></From><To><User FriendlyName="James*-)"/></To><Text Style="font-family:Palatino Linotype; font-weight:bold; color:#ff00ff; ">thanks</Text></Message><Message Date="21/03/2005" Time="6:22:29 PM" DateTime="2005-03-21T07:22:29.301Z" SessionID="38"><From><User FriendlyName="-#.1 |KCALB|(w)|label| -Erin: i was so proud of myself yesterday i said fuk u to my mumma for the very first time ..."/></From><To><User FriendlyName="James*-)"/></To><Text Style="font-family:Palatino Linotype; font-weight:bold; color:#ff00ff; ">can u send the code thingy... the crakc?</Text></Message><Message Date="21/03/2005" Time="6:22:55 PM" DateTime="2005-03-21T07:22:55.288Z" SessionID="38"><From><User FriendlyName="-#.1 |KCALB|(w)|label| -Erin: i was so proud of myself yesterday i said fuk u to my mumma for the very first time ..."/></From><To><User FriendlyName="James*-)"/></To><Text Style="font-family:Palatino Linotype; font-weight:bold; color:#ff00ff; ">haha nice work man</Text></Message><Message Date="21/03/2005" Time="6:22:58 PM" DateTime="2005-03-21T07:22:58.563Z" SessionID="38"><From><User FriendlyName="James*-)"/></From><To><User FriendlyName="-#.1 |KCALB|(w)|label| -Erin: i was so proud of myself yesterday i said fuk u to my mumma for the very first time ..."/></To><Text Style="font-family:Comic Sans MS; font-weight:bold; color:#000080; ">sure thing</Text></Message><Message Date="21/03/2005" Time="6:23:03 PM" DateTime="2005-03-21T07:23:03.961Z" SessionID="38"><From><User FriendlyName="-#.1 |KCALB|(w)|label| -Erin: i was so proud of myself yesterday i said fuk u to my mumma for the very first time ..."/></From><To><User FriendlyName="James*-)"/></To><Text Style="font-family:Palatino Linotype; font-weight:bold; color:#ff00ff; ">i trusted ya newayz</Text></Message><Message Date="21/03/2005" Time="6:27:31 PM" DateTime="2005-03-21T07:27:31.976Z" SessionID="39"><From><User FriendlyName="-#.1 |KCALB|(w)|label| -&quot;Erin says: i was so proud of myself yesterday i said fuk u to my mumma for the very first time ..."/></From><To><User FriendlyName="James*-)"/></To><Text Style="font-family:Palatino Linotype; font-weight:bold; color:#ff00ff; ">can u send the crack?</Text></Message><Message Date="21/03/2005" Time="6:29:38 PM" DateTime="2005-03-21T07:29:38.878Z" SessionID="39"><From><User FriendlyName="James*-)"/></From><To><User FriendlyName="-#.1 |KCALB|(w)|label| -&quot;Erin says: i was so proud of myself yesterday i said fuk u to my mumma for the very first time ..."/></To><Text Style="font-family:Comic Sans MS; font-weight:bold; color:#000080; ">umm ill send it 2moz wen u got the game</Text></Message><Message Date="21/03/2005" Time="6:29:50 PM" DateTime="2005-03-21T07:29:50.725Z" SessionID="40"><From><User FriendlyName="-#.1 |KCALB|(w)|label| -&quot;Erin says: i was so proud of myself yesterday i said fuk u to my mumma for the very first time ..."/></From><To><User FriendlyName="James*-)"/></To><Text Style="font-family:Palatino Linotype; font-weight:bold; color:#ff00ff; ">mmk thnaks mate</Text></Message><Message Date="21/03/2005" Time="7:06:13 PM" DateTime="2005-03-21T08:06:13.254Z" SessionID="41"><From><User FriendlyName="-#.1 |KCALB|(w)|label| -&quot;Erin says: i was so proud of myself yesterday i said fuk u to my mumma for the very first time ..."/></From><To><User FriendlyName="James*-)"/></To><Text Style="font-family:Palatino Linotype; font-weight:bold; color:#ff00ff; ">do u knwo where i could get an xbox soft mod?</Text></Message><Message Date="21/03/2005" Time="8:18:53 PM" DateTime="2005-03-21T09:18:53.081Z" SessionID="41"><From><User FriendlyName="James*-)"/></From><To><User FriendlyName="-#.1 |KCALB|(w)|label| -I don't think she needs me... Half as much as i need her..."/></To><Text Style="font-family:Comic Sans MS; font-weight:bold; color:#000080; ">oi marcs got wun</Text></Message><Message Date="21/03/2005" Time="8:20:19 PM" DateTime="2005-03-21T09:20:19.095Z" SessionID="42"><From><User FriendlyName="-#.1 |KCALB|(w)|label| -I don't think she needs me... Half as much as i need her..."/></From><To><User FriendlyName="James*-)"/></To><Text Style="font-family:Palatino Linotype; font-weight:bold; color:#ff00ff; ">yer i kno</Text></Message><Message Date="21/03/2005" Time="8:20:28 PM" DateTime="2005-03-21T09:20:28.208Z" SessionID="42"><From><User FriendlyName="-#.1 |KCALB|(w)|label| -I don't think she needs me... Half as much as i need her..."/></From><To><User FriendlyName="James*-)"/></To><Text Style="font-family:Palatino Linotype; font-weight:bold; color:#ff00ff; ">hey man what server do u go on on ET?</Text></Message><Message Date="21/03/2005" Time="8:20:38 PM" DateTime="2005-03-21T09:20:38.974Z" SessionID="42"><From><User FriendlyName="James*-)"/></From><To><User FriendlyName="-#.1 |KCALB|(w)|label| -I don't think she needs me... Half as much as i need her..."/></To><Text Style="font-family:Comic Sans MS; font-weight:bold; color:#000080; ">u got it?</Text></Message><Message Date="21/03/2005" Time="8:20:42 PM" DateTime="2005-03-21T09:20:42.659Z" SessionID="42"><From><User FriendlyName="-#.1 |KCALB|(w)|label| -I don't think she needs me... Half as much as i need her..."/></From><To><User FriendlyName="James*-)"/></To><Text Style="font-family:Palatino Linotype; font-weight:bold; color:#ff00ff; ">coz i keepp on goin on empty ones</Text></Message><Message Date="21/03/2005" Time="8:20:48 PM" DateTime="2005-03-21T09:20:48.097Z" SessionID="42"><From><User FriendlyName="-#.1 |KCALB|(w)|label| -I don't think she needs me... Half as much as i need her..."/></From><To><User FriendlyName="James*-)"/></To><Text Style="font-family:Palatino Linotype; font-weight:bold; color:#ff00ff; ">yer i do</Text></Message><Message Date="21/03/2005" Time="8:20:56 PM" DateTime="2005-03-21T09:20:56.328Z" SessionID="42"><From><User FriendlyName="-#.1 |KCALB|(w)|label| -I don't think she needs me... Half as much as i need her..."/></From><To><User FriendlyName="James*-)"/></To><Text Style="font-family:Palatino Linotype; font-weight:bold; color:#ff00ff; ">i'm kinda kenw to the whole gamin thing....</Text></Message><Message Date="21/03/2005" Time="8:21:07 PM" DateTime="2005-03-21T09:21:07.414Z" SessionID="42"><From><User FriendlyName="James*-)"/></From><To><User FriendlyName="-#.1 |KCALB|(w)|label| -I don't think she needs me... Half as much as i need her..."/></To><Text Style="font-family:Comic Sans MS; font-weight:bold; color:#000080; ">yeah</Text></Message><Message Date="21/03/2005" Time="8:21:09 PM" DateTime="2005-03-21T09:21:09.878Z" SessionID="42"><From><User FriendlyName="James*-)"/></From><To><User FriendlyName="-#.1 |KCALB|(w)|label| -I don't think she needs me... Half as much as i need her..."/></To><Text Style="font-family:Comic Sans MS; font-weight:bold; color:#000080; ">Do u have a mic?</Text></Message><Message Date="21/03/2005" Time="8:21:14 PM" DateTime="2005-03-21T09:21:14.144Z" SessionID="43"><From><User FriendlyName="-#.1 |KCALB|(w)|label| -I don't think she needs me... Half as much as i need her..."/></From><To><User FriendlyName="James*-)"/></To><Text Style="font-family:Palatino Linotype; font-weight:bold; color:#ff00ff; ">nup</Text></Message><Message Date="21/03/2005" Time="8:21:25 PM" DateTime="2005-03-21T09:21:25.721Z" SessionID="43"><From><User FriendlyName="-#.1 |KCALB|(w)|label| -I don't think she needs me... Half as much as i need her..."/></From><To><User FriendlyName="James*-)"/></To><Text Style="font-family:Palatino Linotype; font-weight:bold; color:#ff00ff; ">hey can i ring u man?</Text></Message><Message Date="21/03/2005" Time="8:21:28 PM" DateTime="2005-03-21T09:21:28.775Z" SessionID="43"><From><User FriendlyName="James*-)"/></From><To><User FriendlyName="-#.1 |KCALB|(w)|label| -I don't think she needs me... Half as much as i need her..."/></To><Text Style="font-family:Comic Sans MS; font-weight:bold; color:#000080; ">yeah sure</Text></Message><Message Date="21/03/2005" Time="8:21:34 PM" DateTime="2005-03-21T09:21:34.323Z" SessionID="43"><From><User FriendlyName="-#.1 |KCALB|(w)|label| -I don't think she needs me... Half as much as i need her..."/></From><To><User FriendlyName="James*-)"/></To><Text Style="font-family:Palatino Linotype; font-weight:bold; color:#ff00ff; ">whats ur numebr?</Text></Message><Message Date="21/03/2005" Time="8:21:48 PM" DateTime="2005-03-21T09:21:48.604Z" SessionID="43"><From><User FriendlyName="James*-)"/></From><To><User FriendlyName="-#.1 |KCALB|(w)|label| -I don't think she needs me... Half as much as i need her..."/></To><Text Style="font-family:Comic Sans MS; font-weight:bold; color:#000080; ">95287576</Text></Message><Message Date="21/03/2005" Time="8:22:17 PM" DateTime="2005-03-21T09:22:17.285Z" SessionID="43"><From><User FriendlyName="-#.1 |KCALB|(w)|label| -I don't think she needs me... Half as much as i need her..."/></From><To><User FriendlyName="James*-)"/></To><Text Style="font-family:Palatino Linotype; font-weight:bold; color:#ff00ff; ">thats east</Text></Message><Message Date="21/03/2005" Time="8:22:29 PM" DateTime="2005-03-21T09:22:29.793Z" SessionID="43"><From><User FriendlyName="-#.1 |KCALB|(w)|label| -I don't think she needs me... Half as much as i need her..."/></From><To><User FriendlyName="James*-)"/></To><Text Style="font-family:Palatino Linotype; font-weight:bold; color:#ff00ff; ">easy*</Text></Message><Message Date="21/03/2005" Time="8:22:36 PM" DateTime="2005-03-21T09:22:36.372Z" SessionID="43"><From><User FriendlyName="James*-)"/></From><To><User FriendlyName="-#.1 |KCALB|(w)|label| -I don't think she needs me... Half as much as i need her..."/></To><Text Style="font-family:Comic Sans MS; font-weight:bold; color:#000080; ">yuh</Text></Message><Message Date="21/03/2005" Time="8:22:46 PM" DateTime="2005-03-21T09:22:46.377Z" SessionID="43"><From><User FriendlyName="James*-)"/></From><To><User FriendlyName="-#.1 |KCALB|(w)|label| -I don't think she needs me... Half as much as i need her..."/></To><Text Style="font-family:Comic Sans MS; font-weight:bold; color:#000080; ">http://gamesdomain.yahoo.com/ase/register</Text></Message><Message Date="21/03/2005" Time="8:22:48 PM" DateTime="2005-03-21T09:22:48.710Z" SessionID="43"><From><User FriendlyName="James*-)"/></From><To><User FriendlyName="-#.1 |KCALB|(w)|label| -I don't think she needs me... Half as much as i need her..."/></To><Text Style="font-family:Comic Sans MS; font-weight:bold; color:#000080; ">download that</Text></Message><Message Date="21/03/2005" Time="8:22:49 PM" DateTime="2005-03-21T09:22:49.491Z" SessionID="43"><From><User FriendlyName="-#.1 |KCALB|(w)|label| -I don't think she needs me... Half as much as i need her..."/></From><To><User FriendlyName="James*-)"/></To><Text Style="font-family:Palatino Linotype; font-weight:bold; color:#ff00ff; ">umm r u sure?</Text></Message><Message Date="21/03/2005" Time="8:22:56 PM" DateTime="2005-03-21T09:22:56.451Z" SessionID="43"><From><User FriendlyName="James*-)"/></From><To><User FriendlyName="-#.1 |KCALB|(w)|label| -I don't think she needs me... Half as much as i need her..."/></To><Text Style="font-family:Comic Sans MS; font-weight:bold; color:#000080; ">nope</Text></Message><Message Date="21/03/2005" Time="8:22:59 PM" DateTime="2005-03-21T09:22:59.846Z" SessionID="43"><From><User FriendlyName="-#.1 |KCALB|(w)|label| -I don't think she needs me... Half as much as i need her..."/></From><To><User FriendlyName="James*-)"/></To><Text Style="font-family:Palatino Linotype; font-weight:bold; color:#ff00ff; ">ur call could not be connected</Text></Message><Message Date="21/03/2005" Time="8:23:00 PM" DateTime="2005-03-21T09:23:00.988Z" SessionID="43"><From><User FriendlyName="James*-)"/></From><To><User FriendlyName="-#.1 |KCALB|(w)|label| -I don't think she needs me... Half as much as i need her..."/></To><Text Style="font-family:Comic Sans MS; font-weight:bold; color:#000080; ">95287476</Text></Message><Message Date="21/03/2005" Time="8:23:04 PM" DateTime="2005-03-21T09:23:04.262Z" SessionID="43"><From><User FriendlyName="James*-)"/></From><To><User FriendlyName="-#.1 |KCALB|(w)|label| -I don't think she needs me... Half as much as i need her..."/></To><Text Style="font-family:Comic Sans MS; font-weight:bold; color:#000080; ">soz</Text></Message><Message Date="21/03/2005" Time="8:23:08 PM" DateTime="2005-03-21T09:23:08.088Z" SessionID="43"><From><User FriendlyName="-#.1 |KCALB|(w)|label| -I don't think she needs me... Half as much as i need her..."/></From><To><User FriendlyName="James*-)"/></To><Text Style="font-family:Palatino Linotype; font-weight:bold; color:#ff00ff; ">lol</Text></Message><Message Date="21/03/2005" Time="8:23:16 PM" DateTime="2005-03-21T09:23:16.550Z" SessionID="43"><From><User FriendlyName="James*-)"/></From><To><User FriendlyName="-#.1 |KCALB|(w)|label| -I don't think she needs me... Half as much as i need her..."/></To><Text Style="font-family:Comic Sans MS; font-weight:bold; color:#000080; ">http://gamesdomain.yahoo.com/ase/register</Text></Message><Message Date="21/03/2005" Time="8:23:18 PM" DateTime="2005-03-21T09:23:18.042Z" SessionID="43"><From><User FriendlyName="James*-)"/></From><To><User FriendlyName="-#.1 |KCALB|(w)|label| -I don't think she needs me... Half as much as i need her..."/></To><Text Style="font-family:Comic Sans MS; font-weight:bold; color:#000080; ">download</Text></Message><Message Date="21/03/2005" Time="8:26:05 PM" DateTime="2005-03-21T09:26:05.072Z" SessionID="43"><From><User FriendlyName="James*-)"/></From><To><User FriendlyName="-#.1 |KCALB|(w)|label| -I don't think she needs me... Half as much as i need her..."/></To><Text Style="font-family:Comic Sans MS; font-weight:bold; color:#000080; ">http://gamesdomain.yahoo.com/ase/current</Text></Message><Message Date="21/03/2005" Time="8:34:25 PM" DateTime="2005-03-21T09:34:25.896Z" SessionID="44"><From><User FriendlyName="-#.1 |KCALB|(w)|label| -I don't think she needs me... Half as much as i need her..."/></From><To><User FriendlyName="James*-)"/></To><Text Style="font-family:Palatino Linotype; font-weight:bold; color:#ff00ff; ">not workin</Text></Message><Message Date="21/03/2005" Time="8:34:33 PM" DateTime="2005-03-21T09:34:33.597Z" SessionID="44"><From><User FriendlyName="James*-)"/></From><To><User FriendlyName="-#.1 |KCALB|(w)|label| -I don't think she needs me... Half as much as i need her..."/></To><Text Style="font-family:Comic Sans MS; font-weight:bold; color:#000080; ">wasit say</Text></Message><Message Date="21/03/2005" Time="8:34:39 PM" DateTime="2005-03-21T09:34:39.705Z" SessionID="44"><From><User FriendlyName="-#.1 |KCALB|(w)|label| -I don't think she needs me... Half as much as i need her..."/></From><To><User FriendlyName="James*-)"/></To><Text Style="font-family:Palatino Linotype; font-weight:bold; color:#ff00ff; ">that server is incomplete or sutmhin</Text></Message><Message Date="21/03/2005" Time="8:34:51 PM" DateTime="2005-03-21T09:34:51.613Z" SessionID="44"><From><User FriendlyName="James*-)"/></From><To><User FriendlyName="-#.1 |KCALB|(w)|label| -I don't think she needs me... Half as much as i need her..."/></To><Text Style="font-family:Comic Sans MS; font-weight:bold; color:#000080; ">just press reconnect</Text></Message><Message Date="21/03/2005" Time="8:34:56 PM" DateTime="2005-03-21T09:34:56.019Z" SessionID="44"><From><User FriendlyName="-#.1 |KCALB|(w)|label| -I don't think she needs me... Half as much as i need her..."/></From><To><User FriendlyName="James*-)"/></To><Text Style="font-family:Palatino Linotype; font-weight:bold; color:#000000; ">i did</Text></Message><Message Date="21/03/2005" Time="8:34:57 PM" DateTime="2005-03-21T09:34:57.581Z" SessionID="44"><From><User FriendlyName="James*-)"/></From><To><User FriendlyName="-#.1 |KCALB|(w)|label| -I don't think she needs me... Half as much as i need her..."/></To><Text Style="font-family:Comic Sans MS; font-weight:bold; color:#000080; ">sumtimes it mite take a few times</Text></Message><Message Date="21/03/2005" Time="8:35:05 PM" DateTime="2005-03-21T09:35:05.733Z" SessionID="44"><From><User FriendlyName="-#.1 |KCALB|(w)|label| -I don't think she needs me... Half as much as i need her..."/></From><To><User FriendlyName="James*-)"/></To><Text Style="font-family:Palatino Linotype; font-weight:bold; color:#000000; ">mmk r u in it?</Text></Message><Message Date="21/03/2005" Time="8:35:08 PM" DateTime="2005-03-21T09:35:08.497Z" SessionID="44"><From><User FriendlyName="James*-)"/></From><To><User FriendlyName="-#.1 |KCALB|(w)|label| -I don't think she needs me... Half as much as i need her..."/></To><Text Style="font-family:Comic Sans MS; font-weight:bold; color:#000080; ">workin fine for m</Text></Message><Message Date="21/03/2005" Time="8:35:09 PM" DateTime="2005-03-21T09:35:09.468Z" SessionID="44"><From><User FriendlyName="James*-)"/></From><To><User FriendlyName="-#.1 |KCALB|(w)|label| -I don't think she needs me... Half as much as i need her..."/></To><Text Style="font-family:Comic Sans MS; font-weight:bold; color:#000080; ">yuh</Text></Message><Message Date="21/03/2005" Time="8:35:32 PM" DateTime="2005-03-21T09:35:32.351Z" SessionID="44"><From><User FriendlyName="James*-)"/></From><To><User FriendlyName="-#.1 |KCALB|(w)|label| -I don't think she needs me... Half as much as i need her..."/></To><Text Style="font-family:Comic Sans MS; font-weight:bold; color:#000080; ">wat is the error msg?</Text></Message><Message Date="21/03/2005" Time="8:36:13 PM" DateTime="2005-03-21T09:36:13.500Z" SessionID="44"><From><User FriendlyName="-#.1 |KCALB|(w)|label| -I don't think she needs me... Half as much as i need her..."/></From><To><User FriendlyName="James*-)"/></To><Text Style="font-family:Palatino Linotype; font-weight:bold; color:#000000; ">protocol mismatch</Text></Message><Message Date="21/03/2005" Time="8:36:16 PM" DateTime="2005-03-21T09:36:16.515Z" SessionID="44"><From><User FriendlyName="-#.1 |KCALB|(w)|label| -I don't think she needs me... Half as much as i need her..."/></From><To><User FriendlyName="James*-)"/></To><Text Style="font-family:Palatino Linotype; font-weight:bold; color:#000000; ">def nto workin</Text></Message><Message Date="21/03/2005" Time="8:36:23 PM" DateTime="2005-03-21T09:36:23.385Z" SessionID="44"><From><User FriendlyName="James*-)"/></From><To><User FriendlyName="-#.1 |KCALB|(w)|label| -I don't think she needs me... Half as much as i need her..."/></To><Text Style="font-family:Comic Sans MS; font-weight:bold; color:#000080; ">oh</Text></Message><Message Date="21/03/2005" Time="8:36:27 PM" DateTime="2005-03-21T09:36:27.991Z" SessionID="44"><From><User FriendlyName="James*-)"/></From><To><User FriendlyName="-#.1 |KCALB|(w)|label| -I don't think she needs me... Half as much as i need her..."/></To><Text Style="font-family:Comic Sans MS; font-weight:bold; color:#000080; ">u probably havent got the patch eh</Text></Message><Message Date="21/03/2005" Time="8:36:34 PM" DateTime="2005-03-21T09:36:34.961Z" SessionID="44"><From><User FriendlyName="-#.1 |KCALB|(w)|label| -I don't think she needs me... Half as much as i need her..."/></From><To><User FriendlyName="James*-)"/></To><Text Style="font-family:Palatino Linotype; font-weight:bold; color:#000000; ">what patch /?</Text></Message><Message Date="21/03/2005" Time="8:36:56 PM" DateTime="2005-03-21T09:36:56.292Z" SessionID="44"><From><User FriendlyName="James*-)"/></From><To><User FriendlyName="-#.1 |KCALB|(w)|label| -I don't think she needs me... Half as much as i need her..."/></To><Text Style="font-family:Comic Sans MS; font-weight:bold; color:#000080; ">oi ill give yuh link</Text></Message><Message Date="21/03/2005" Time="8:36:57 PM" DateTime="2005-03-21T09:36:57.854Z" SessionID="44"><From><User FriendlyName="James*-)"/></From><To><User FriendlyName="-#.1 |KCALB|(w)|label| -I don't think she needs me... Half as much as i need her..."/></To><Text Style="font-family:Comic Sans MS; font-weight:bold; color:#000080; ">just a sec</Text></Message><Message Date="21/03/2005" Time="8:37:01 PM" DateTime="2005-03-21T09:37:01.870Z" SessionID="44"><From><User FriendlyName="-#.1 |KCALB|(w)|label| -I don't think she needs me... Half as much as i need her..."/></From><To><User FriendlyName="James*-)"/></To><Text Style="font-family:Palatino Linotype; font-weight:bold; color:#000000; ">lol thansk mate</Text></Message><Message Date="21/03/2005" Time="8:37:04 PM" DateTime="2005-03-21T09:37:04.764Z" SessionID="44"><From><User FriendlyName="-#.1 |KCALB|(w)|label| -I don't think she needs me... Half as much as i need her..."/></From><To><User FriendlyName="James*-)"/></To><Text Style="font-family:Palatino Linotype; font-weight:bold; color:#000000; ">i appreciate it</Text></Message><Message Date="21/03/2005" Time="8:37:41 PM" DateTime="2005-03-21T09:37:41.447Z" SessionID="44"><From><User FriendlyName="James*-)"/></From><To><User FriendlyName="-#.1 |KCALB|(w)|label| -I don't think she needs me... Half as much as i need her..."/></To><Text Style="font-family:Comic Sans MS; font-weight:bold; color:#000080; ">http://files.ausgamers.com:85/downloads/1111398161/ET_Patch_1.02.exe</Text></Message><Message Date="21/03/2005" Time="8:37:56 PM" DateTime="2005-03-21T09:37:56.709Z" SessionID="44"><From><User FriendlyName="James*-)"/></From><To><User FriendlyName="-#.1 |KCALB|(w)|label| -I don't think she needs me... Half as much as i need her..."/></To><Text Style="font-family:Comic Sans MS; font-weight:bold; color:#000080; ">:D</Text></Message><Message Date="21/03/2005" Time="8:38:15 PM" DateTime="2005-03-21T09:38:15.946Z" SessionID="44"><From><User FriendlyName="James*-)"/></From><To><User FriendlyName="-#.1 |KCALB|(w)|label| -I don't think she needs me... Half as much as i need her..."/></To><Text Style="font-family:Comic Sans MS; font-weight:bold; color:#000080; ">getting it</Text></Message><Message Date="21/03/2005" Time="8:38:31 PM" DateTime="2005-03-21T09:38:31.218Z" SessionID="44"><From><User FriendlyName="James*-)"/></From><To><User FriendlyName="-#.1 |KCALB|(w)|label| -I don't think she needs me... Half as much as i need her..."/></To><Text Style="font-family:Comic Sans MS; font-weight:bold; color:#000080; ">?</Text></Message><Message Date="21/03/2005" Time="8:38:46 PM" DateTime="2005-03-21T09:38:46.921Z" SessionID="44"><From><User FriendlyName="James*-)"/></From><To><User FriendlyName="-#.1 |KCALB|(w)|label| -I don't think she needs me... Half as much as i need her..."/></To><Text Style="font-family:Comic Sans MS; font-weight:bold; color:#000080; ">Got it?</Text></Message><Message Date="21/03/2005" Time="8:38:52 PM" DateTime="2005-03-21T09:38:52.930Z" SessionID="44"><From><User FriendlyName="-#.1 |KCALB|(w)|label| -I don't think she needs me... Half as much as i need her..."/></From><To><User FriendlyName="James*-)"/></To><Text Style="font-family:Palatino Linotype; font-weight:bold; color:#000000; ">yer</Text></Message><Message Date="21/03/2005" Time="8:38:59 PM" DateTime="2005-03-21T09:38:59.209Z" SessionID="44"><From><User FriendlyName="James*-)"/></From><To><User FriendlyName="-#.1 |KCALB|(w)|label| -I don't think she needs me... Half as much as i need her..."/></To><Text Style="font-family:Comic Sans MS; font-weight:bold; color:#000080; ">installed?</Text></Message><Message Date="21/03/2005" Time="8:39:03 PM" DateTime="2005-03-21T09:39:03.685Z" SessionID="44"><From><User FriendlyName="-#.1 |KCALB|(w)|label| -I don't think she needs me... Half as much as i need her..."/></From><To><User FriendlyName="James*-)"/></To><Text Style="font-family:Palatino Linotype; font-weight:bold; color:#000000; ">doin ma hw so i can get it outa the way</Text></Message><Message Date="21/03/2005" Time="8:39:24 PM" DateTime="2005-03-21T09:39:24.235Z" SessionID="44"><From><User FriendlyName="James*-)"/></From><To><User FriendlyName="-#.1 |KCALB|(w)|label| -I don't think she needs me... Half as much as i need her..."/></To><Text Style="font-family:Comic Sans MS; font-weight:bold; color:#000080; ">I gotta watch indiana jones soon</Text></Message><Message Date="21/03/2005" Time="8:39:25 PM" DateTime="2005-03-21T09:39:25.396Z" SessionID="44"><From><User FriendlyName="-#.1 |KCALB|(w)|label| -I don't think she needs me... Half as much as i need her..."/></From><To><User FriendlyName="James*-)"/></To><Text Style="font-family:Palatino Linotype; font-weight:bold; color:#000000; ">not yet</Text></Message><Message Date="21/03/2005" Time="8:39:30 PM" DateTime="2005-03-21T09:39:30.474Z" SessionID="44"><From><User FriendlyName="-#.1 |KCALB|(w)|label| -I don't think she needs me... Half as much as i need her..."/></From><To><User FriendlyName="James*-)"/></To><Text Style="font-family:Palatino Linotype; font-weight:bold; color:#000000; ">lol</Text></Message><Message Date="21/03/2005" Time="8:39:46 PM" DateTime="2005-03-21T09:39:46.647Z" SessionID="44"><From><User FriendlyName="James*-)"/></From><To><User FriendlyName="-#.1 |KCALB|(w)|label| -I don't think she needs me... Half as much as i need her..."/></To><Text Style="font-family:Comic Sans MS; font-weight:bold; color:#000080; ">is it downloaded :S</Text></Message><Message Date="21/03/2005" Time="8:40:04 PM" DateTime="2005-03-21T09:40:04.783Z" SessionID="44"><From><User FriendlyName="-#.1 |KCALB|(w)|label| -I don't think she needs me... Half as much as i need her..."/></From><To><User FriendlyName="James*-)"/></To><Text Style="font-family:Palatino Linotype; font-weight:bold; color:#000000; ">70%</Text></Message><Message Date="21/03/2005" Time="8:40:51 PM" DateTime="2005-03-21T09:40:51.330Z" SessionID="44"><From><User FriendlyName="James*-)"/></From><To><User FriendlyName="-#.1 |KCALB|(w)|label| -I don't think she needs me... Half as much as i need her..."/></To><Text Style="font-family:Comic Sans MS; font-weight:bold; color:#000080; ">dun yeeeeeeeeeeeeeeeet&gt;</Text></Message><Message Date="21/03/2005" Time="8:40:52 PM" DateTime="2005-03-21T09:40:52.311Z" SessionID="44"><From><User FriendlyName="James*-)"/></From><To><User FriendlyName="-#.1 |KCALB|(w)|label| -I don't think she needs me... Half as much as i need her..."/></To><Text Style="font-family:Comic Sans MS; font-weight:bold; color:#000080; ">?</Text></Message><Message Date="21/03/2005" Time="8:41:22 PM" DateTime="2005-03-21T09:41:22.064Z" SessionID="45"><From><User FriendlyName="-#.1 |KCALB|(w)|label| -I don't think she needs me... Half as much as i need her..."/></From><To><User FriendlyName="James*-)"/></To><Text Style="font-family:Palatino Linotype; font-weight:bold; color:#000000; ">yer</Text></Message><Message Date="21/03/2005" Time="8:41:29 PM" DateTime="2005-03-21T09:41:29.675Z" SessionID="45"><From><User FriendlyName="James*-)"/></From><To><User FriendlyName="-#.1 |KCALB|(w)|label| -I don't think she needs me... Half as much as i need her..."/></To><Text Style="font-family:Comic Sans MS; font-weight:bold; color:#000080; ">kk</Text></Message><Message Date="21/03/2005" Time="8:42:03 PM" DateTime="2005-03-21T09:42:03.894Z" SessionID="45"><From><User FriendlyName="James*-)"/></From><To><User FriendlyName="-#.1 |KCALB|(w)|label| -I don't think she needs me... Half as much as i need her..."/></To><Text Style="font-family:Comic Sans MS; font-weight:bold; color:#000080; ">installed it?</Text></Message><Message Date="21/03/2005" Time="8:43:16 PM" DateTime="2005-03-21T09:43:16.509Z" SessionID="45"><From><User FriendlyName="James*-)"/></From><To><User FriendlyName="-#.1 |KCALB|(w)|label| -I don't think she needs me... Half as much as i need her..."/></To><Text Style="font-family:Comic Sans MS; font-weight:bold; color:#000080; ">???</Text></Message><Message Date="21/03/2005" Time="8:43:38 PM" DateTime="2005-03-21T09:43:38.971Z" SessionID="45"><From><User FriendlyName="James*-)"/></From><To><User FriendlyName="-#.1 |KCALB|(w)|label| -I don't think she needs me... Half as much as i need her..."/></To><Text Style="font-family:Comic Sans MS; font-weight:bold; color:#000080; ">HELLO!</Text></Message><Message Date="21/03/2005" Time="8:44:25 PM" DateTime="2005-03-21T09:44:25.247Z" SessionID="45"><From><User FriendlyName="James*-)"/></From><To><User FriendlyName="-#.1 |KCALB|(w)|label| -I don't think she needs me... Half as much as i need her..."/></To><Text Style="font-family:Comic Sans MS; font-weight:bold; color:#000080; ">U there man?</Text></Message><Message Date="21/03/2005" Time="8:46:40 PM" DateTime="2005-03-21T09:46:40.522Z" SessionID="46"><From><User FriendlyName="-#.1 |KCALB|(w)|label| -I don't think she needs me... Half as much as i need her..."/></From><To><User FriendlyName="James*-)"/></To><Text Style="font-family:Palatino Linotype; font-weight:bold; color:#000000; ">yer sorry man</Text></Message><Message Date="21/03/2005" Time="8:46:47 PM" DateTime="2005-03-21T09:46:47.632Z" SessionID="46"><From><User FriendlyName="-#.1 |KCALB|(w)|label| -I don't think she needs me... Half as much as i need her..."/></From><To><User FriendlyName="James*-)"/></To><Text Style="font-family:Palatino Linotype; font-weight:bold; color:#000000; ">not workin</Text></Message><Message Date="21/03/2005" Time="8:46:54 PM" DateTime="2005-03-21T09:46:54.362Z" SessionID="46"><From><User FriendlyName="James*-)"/></From><To><User FriendlyName="-#.1 |KCALB|(w)|label| -I don't think she needs me... Half as much as i need her..."/></To><Text Style="font-family:Comic Sans MS; font-weight:bold; color:#000080; ">???</Text></Message><Message Date="21/03/2005" Time="8:46:57 PM" DateTime="2005-03-21T09:46:57.366Z" SessionID="46"><From><User FriendlyName="James*-)"/></From><To><User FriendlyName="-#.1 |KCALB|(w)|label| -I don't think she needs me... Half as much as i need her..."/></To><Text Style="font-family:Comic Sans MS; font-weight:bold; color:#000080; ">the patch?</Text></Message><Message Date="21/03/2005" Time="8:47:03 PM" DateTime="2005-03-21T09:47:03.124Z" SessionID="47"><From><User FriendlyName="-#.1 |KCALB|(w)|label| -I don't think she needs me... Half as much as i need her..."/></From><To><User FriendlyName="James*-)"/></To><Text Style="font-family:Palatino Linotype; font-weight:bold; color:#000000; ">no the game]</Text></Message><Message Date="21/03/2005" Time="8:47:10 PM" DateTime="2005-03-21T09:47:10.515Z" SessionID="47"><From><User FriendlyName="-#.1 |KCALB|(w)|label| -I don't think she needs me... Half as much as i need her..."/></From><To><User FriendlyName="James*-)"/></To><Text Style="font-family:Palatino Linotype; font-weight:bold; color:#000000; ">it loads then goes back to the main menu</Text></Message><Message Date="21/03/2005" Time="8:48:00 PM" DateTime="2005-03-21T09:48:00.237Z" SessionID="47"><From><User FriendlyName="James*-)"/></From><To><User FriendlyName="-#.1 |KCALB|(w)|label| -I don't think she needs me... Half as much as i need her..."/></To><Text Style="font-family:Comic Sans MS; font-weight:bold; color:#000080; ">...</Text></Message><Message Date="21/03/2005" Time="8:48:06 PM" 