<?xml version="1.0"?>
<?xml-stylesheet type='text/xsl' href='MessageLog.xsl'?>
<Log FirstSessionID="1" LastSessionID="161"><Message Date="9/7/2008" Time="12:26:23 PM" DateTime="2008-09-07T02:26:23.205Z" SessionID="1"><From><User FriendlyName="- alison"/></From><To><User FriendlyName="- James O'"/></To><Text Style="font-family:Eras Medium ITC; color:#0000ff; ">New email</Text></Message><Message Date="9/7/2008" Time="12:26:29 PM" DateTime="2008-09-07T02:26:29.458Z" SessionID="1"><From><User FriendlyName="- James O'"/></From><To><User FriendlyName="- alison"/></To><Text Style="font-family:MS Shell Dlg; color:#000000; ">yup</Text></Message><Message Date="9/7/2008" Time="12:26:35 PM" DateTime="2008-09-07T02:26:35.181Z" SessionID="1"><From><User FriendlyName="- alison"/></From><To><User FriendlyName="- James O'"/></To><Text Style="font-family:Eras Medium ITC; color:#0000ff; ">cool</Text></Message><Message Date="9/7/2008" Time="12:27:31 PM" DateTime="2008-09-07T02:27:31.842Z" SessionID="1"><From><User FriendlyName="- alison"/></From><To><User FriendlyName="- James O'"/></To><Text Style="font-family:Eras Medium ITC; color:#0000ff; ">anyways i didnt mean to come on msn.. </Text></Message><Message Date="9/7/2008" Time="12:27:33 PM" DateTime="2008-09-07T02:27:33.854Z" SessionID="1"><From><User FriendlyName="- alison"/></From><To><User FriendlyName="- James O'"/></To><Text Style="font-family:Eras Medium ITC; color:#0000ff; ">see ya</Text></Message><Message Date="9/7/2008" Time="12:27:44 PM" DateTime="2008-09-07T02:27:44.332Z" SessionID="1"><From><User FriendlyName="- James O'"/></From><To><User FriendlyName="- alison"/></To><Text Style="font-family:MS Shell Dlg; color:#000000; ">bai</Text></Message><Message Date="9/12/2008" Time="10:49:32 AM" DateTime="2008-09-12T00:49:32.202Z" SessionID="2"><From><User FriendlyName="- alison"/></From><To><User FriendlyName="- James O'"/></To><Text Style="font-family:Eras Medium ITC; color:#0000ff; ">hey</Text></Message><Message Date="9/12/2008" Time="11:08:58 AM" DateTime="2008-09-12T01:08:58.962Z" SessionID="2"><From><User FriendlyName="- alison"/></From><To><User FriendlyName="- James O'"/></To><Text Style="font-family:Eras Medium ITC; color:#0000ff; ">NEW Joshua Radin CD</Text></Message><Message Date="9/12/2008" Time="11:09:51 AM" DateTime="2008-09-12T01:09:51.636Z" SessionID="2"><From><User FriendlyName="- alison"/></From><To><User FriendlyName="- James O'"/></To><Text Style="font-family:Eras Medium ITC; color:#0000ff; ">'Simple Times'</Text></Message><Message Date="9/12/2008" Time="4:13:01 PM" DateTime="2008-09-12T06:13:01.943Z" SessionID="3"><From><User FriendlyName="- alison"/></From><To><User FriendlyName="- James O'"/></To><Text Style="font-family:Eras Medium ITC; color:#0000ff; ">hey</Text></Message><Message Date="9/13/2008" Time="1:02:32 PM" DateTime="2008-09-13T03:02:32.214Z" SessionID="4"><From><User FriendlyName="- alison"/></From><To><User FriendlyName="- James O'"/></To><Text Style="font-family:Eras Medium ITC; color:#0000ff; ">hey</Text></Message><Message Date="9/13/2008" Time="1:03:00 PM" DateTime="2008-09-13T03:03:00.538Z" SessionID="4"><From><User FriendlyName="- alison"/></From><To><User FriendlyName="- James O'"/></To><Text Style="font-family:Eras Medium ITC; color:#0000ff; ">how are you?</Text></Message><Message Date="9/13/2008" Time="1:06:42 PM" DateTime="2008-09-13T03:06:42.945Z" SessionID="4"><From><User FriendlyName="- James O'"/></From><To><User FriendlyName="- alison"/></To><Text Style="font-family:MS Shell Dlg; color:#000000; ">hi</Text></Message><Message Date="9/13/2008" Time="1:06:52 PM" DateTime="2008-09-13T03:06:52.176Z" SessionID="4"><From><User FriendlyName="- James O'"/></From><To><User FriendlyName="- alison"/></To><Text Style="font-family:MS Shell Dlg; color:#000000; ">fine, enjoying the sun</Text></Message><Message Date="9/13/2008" Time="1:07:22 PM" DateTime="2008-09-13T03:07:22.433Z" SessionID="5"><From><User FriendlyName="- alison"/></From><To><User FriendlyName="- James O'"/></To><Text Style="font-family:Eras Medium ITC; color:#0000ff; ">yeh me too</Text></Message><Message Date="9/13/2008" Time="1:07:27 PM" DateTime="2008-09-13T03:07:27.814Z" SessionID="5"><From><User FriendlyName="- alison"/></From><To><User FriendlyName="- James O'"/></To><Text Style="font-family:Eras Medium ITC; color:#0000ff; ">did u vote today?</Text></Message><Message Date="9/13/2008" Time="1:07:35 PM" DateTime="2008-09-13T03:07:35.651Z" SessionID="5"><From><User FriendlyName="- James O'"/></From><To><User FriendlyName="- alison"/></To><Text Style="font-family:MS Shell Dlg; color:#000000; ">Im not registered?</Text></Message><Message Date="9/13/2008" Time="1:07:40 PM" DateTime="2008-09-13T03:07:40.532Z" SessionID="5"><From><User FriendlyName="- alison"/></From><To><User FriendlyName="- James O'"/></To><Text Style="font-family:Eras Medium ITC; color:#0000ff; ">really?</Text></Message><Message Date="9/13/2008" Time="1:07:44 PM" DateTime="2008-09-13T03:07:44.730Z" SessionID="5"><From><User FriendlyName="- James O'"/></From><To><User FriendlyName="- alison"/></To><Text Style="font-family:MS Shell Dlg; color:#000000; ">mm</Text></Message><Message Date="9/13/2008" Time="1:08:03 PM" DateTime="2008-09-13T03:08:03.008Z" SessionID="5"><From><User FriendlyName="- alison"/></From><To><User FriendlyName="- James O'"/></To><Text Style="font-family:Eras Medium ITC; color:#0000ff; ">oh. they sent me a letter before i was 18 to register</Text></Message><Message Date="9/13/2008" Time="1:08:41 PM" DateTime="2008-09-13T03:08:41.241Z" SessionID="5"><From><User FriendlyName="- alison"/></From><To><User FriendlyName="- James O'"/></To><Text Style="font-family:Eras Medium ITC; color:#0000ff; ">i had no idea wat i was doing anyways</Text></Message><Message Date="9/13/2008" Time="1:09:27 PM" DateTime="2008-09-13T03:09:27.497Z" SessionID="5"><From><User FriendlyName="- alison"/></From><To><User FriendlyName="- James O'"/></To><Text Style="font-family:Eras Medium ITC; color:#0000ff; ">Im joining the airforce at the end of the year :)</Text></Message><Message Date="9/13/2008" Time="1:09:42 PM" DateTime="2008-09-13T03:09:42.539Z" SessionID="5"><From><User FriendlyName="- James O'"/></From><To><User FriendlyName="- alison"/></To><Text Style="font-family:MS Shell Dlg; color:#000000; ">yeh?</Text></Message><Message Date="9/13/2008" Time="1:10:21 PM" DateTime="2008-09-13T03:10:21.196Z" SessionID="6"><From><User FriendlyName="- alison"/></From><To><User FriendlyName="- James O'"/></To><Text Style="font-family:Eras Medium ITC; color:#0000ff; ">yeh. they will pay me to finish my course at uni then i have to work for 2 years then i get signed up for 5 years</Text></Message><Message Date="9/13/2008" Time="1:10:33 PM" DateTime="2008-09-13T03:10:33.327Z" SessionID="6"><From><User FriendlyName="- alison"/></From><To><User FriendlyName="- James O'"/></To><Text Style="font-family:Eras Medium ITC; color:#0000ff; ">i will get 30 000 a year to finish uni</Text></Message><Message Date="9/13/2008" Time="1:10:54 PM" DateTime="2008-09-13T03:10:54.881Z" SessionID="6"><From><User FriendlyName="- alison"/></From><To><User FriendlyName="- James O'"/></To><Text Style="font-family:Eras Medium ITC; color:#0000ff; ">then after uni i will get $47 000</Text></Message><Message Date="9/13/2008" Time="1:11:12 PM" DateTime="2008-09-13T03:11:12.414Z" SessionID="6"><From><User FriendlyName="- alison"/></From><To><User FriendlyName="- James O'"/></To><Text Style="font-family:Eras Medium ITC; color:#0000ff; ">Plus u get to travel and it sounds really good</Text></Message><Message Date="9/13/2008" Time="1:11:25 PM" DateTime="2008-09-13T03:11:25.011Z" SessionID="6"><From><User FriendlyName="- James O'"/></From><To><User FriendlyName="- alison"/></To><Text Style="font-family:MS Shell Dlg; color:#000000; ">very cool</Text></Message><Message Date="9/13/2008" Time="1:11:32 PM" DateTime="2008-09-13T03:11:32.867Z" SessionID="7"><From><User FriendlyName="- alison"/></From><To><User FriendlyName="- James O'"/></To><Text Style="font-family:Eras Medium ITC; color:#0000ff; ">yeh</Text></Message><Message Date="9/13/2008" Time="1:11:45 PM" DateTime="2008-09-13T03:11:45.364Z" SessionID="7"><From><User FriendlyName="- alison"/></From><To><User FriendlyName="- James O'"/></To><Text Style="font-family:Eras Medium ITC; color:#0000ff; ">though i have to be really fit</Text></Message><Message Date="9/13/2008" Time="1:12:01 PM" DateTime="2008-09-13T03:12:01.853Z" SessionID="7"><From><User FriendlyName="- alison"/></From><To><User FriendlyName="- James O'"/></To><Text Style="font-family:Eras Medium ITC; color:#0000ff; ">after this semester of uni im getting a personal trainer :S</Text></Message><Message Date="9/13/2008" Time="1:12:12 PM" DateTime="2008-09-13T03:12:12.752Z" SessionID="7"><From><User FriendlyName="- alison"/></From><To><User FriendlyName="- James O'"/></To><Text Style="font-family:Eras Medium ITC; color:#0000ff; ">and a gym membership</Text></Message><Message Date="9/13/2008" Time="1:12:29 PM" DateTime="2008-09-13T03:12:29.148Z" SessionID="7"><From><User FriendlyName="- alison"/></From><To><User FriendlyName="- James O'"/></To><Text Style="font-family:Eras Medium ITC; color:#0000ff; ">the only downfall</Text></Message><Message Date="9/13/2008" Time="1:21:18 PM" DateTime="2008-09-13T03:21:18.874Z" SessionID="8"><From><User FriendlyName="- alison"/></From><To><User FriendlyName="- James O'"/></To><Text Style="font-family:Eras Medium ITC; color:#0000ff; ">anyways gotta scoot</Text></Message><Message Date="9/13/2008" Time="1:21:25 PM" DateTime="2008-09-13T03:21:25.019Z" SessionID="8"><From><User FriendlyName="- alison"/></From><To><User FriendlyName="- James O'"/></To><Text Style="font-family:Eras Medium ITC; color:#0000ff; ">oh hows uni?</Text></Message><Message Date="9/13/2008" Time="1:21:43 PM" DateTime="2008-09-13T03:21:43.329Z" SessionID="8"><From><User FriendlyName="- James O'"/></From><To><User FriendlyName="- alison"/></To><Text Style="font-family:MS Shell Dlg; color:#000000; ">soso</Text></Message><Message Date="9/13/2008" Time="1:21:55 PM" DateTime="2008-09-13T03:21:55.917Z" SessionID="9"><From><User FriendlyName="- alison"/></From><To><User FriendlyName="- James O'"/></To><Text Style="font-family:Eras Medium ITC; color:#0000ff; ">do u have midterm holidays?</Text></Message><Message Date="9/13/2008" Time="1:22:09 PM" DateTime="2008-09-13T03:22:09.813Z" SessionID="9"><From><User FriendlyName="- James O'"/></From><To><User FriendlyName="- alison"/></To><Text Style="font-family:MS Shell Dlg; color:#000000; ">Umm, yeh coming up?</Text></Message><Message Date="9/13/2008" Time="1:22:15 PM" DateTime="2008-09-13T03:22:15.076Z" SessionID="9"><From><User FriendlyName="- alison"/></From><To><User FriendlyName="- James O'"/></To><Text Style="font-family:Eras Medium ITC; color:#0000ff; ">cool</Text></Message><Message Date="9/13/2008" Time="1:22:19 PM" DateTime="2008-09-13T03:22:19.692Z" SessionID="9"><From><User FriendlyName="- James O'"/></From><To><User FriendlyName="- alison"/></To><Text Style="font-family:MS Shell Dlg; color:#000000; ">cant remember when but I got a week off soon</Text></Message><Message Date="9/13/2008" Time="1:22:41 PM" DateTime="2008-09-13T03:22:41.786Z" SessionID="10"><From><User FriendlyName="- alison"/></From><To><User FriendlyName="- James O'"/></To><Text Style="font-family:Eras Medium ITC; color:#0000ff; ">i have another week of uni then i have a week off</Text></Message><Message Date="9/13/2008" Time="1:22:48 PM" DateTime="2008-09-13T03:22:48.047Z" SessionID="10"><From><User FriendlyName="- alison"/></From><To><User FriendlyName="- James O'"/></To><Text Style="font-family:Eras Medium ITC; color:#0000ff; ">then clincal practice for 2 weeks</Text></Message><Message Date="9/13/2008" Time="1:23:24 PM" DateTime="2008-09-13T03:23:24.934Z" SessionID="10"><From><User FriendlyName="- alison"/></From><To><User FriendlyName="- James O'"/></To><Text Style="font-family:Eras Medium ITC; color:#0000ff; ">ur holidays maybe during the long weekend coming up?</Text></Message><Message Date="9/13/2008" Time="1:23:53 PM" DateTime="2008-09-13T03:23:53.780Z" SessionID="10"><From><User FriendlyName="- James O'"/></From><To><User FriendlyName="- alison"/></To><Text Style="font-family:MS Shell Dlg; color:#000000; ">Umm, end of week 9, so I that'd be end of next week I think</Text></Message><Message Date="9/13/2008" Time="1:24:12 PM" DateTime="2008-09-13T03:24:12.004Z" SessionID="10"><From><User FriendlyName="- alison"/></From><To><User FriendlyName="- James O'"/></To><Text Style="font-family:Eras Medium ITC; color:#0000ff; ">ahh so maybe the same as mine</Text></Message><Message Date="9/13/2008" Time="1:24:43 PM" DateTime="2008-09-13T03:24:43.196Z" SessionID="10"><From><User FriendlyName="- alison"/></From><To><User FriendlyName="- James O'"/></To><Text Style="font-family:Eras Medium ITC; color:#0000ff; ">well anyways im going to go and sit out in the sun and do an assessment</Text></Message><Message Date="9/13/2008" Time="1:24:44 PM" DateTime="2008-09-13T03:24:44.798Z" SessionID="10"><From><User FriendlyName="- alison"/></From><To><User FriendlyName="- James O'"/></To><Text Style="font-family:Eras Medium ITC; color:#0000ff; ">ciao</Text></Message><Message Date="9/13/2008" Time="1:25:10 PM" DateTime="2008-09-13T03:25:10.994Z" SessionID="10"><From><User FriendlyName="- James O'"/></From><To><User FriendlyName="- alison"/></To><Text Style="font-family:MS Shell Dlg; color:#000000; ">29 September – 5 October	</Text></Message><Message Date="9/13/2008" Time="1:25:12 PM" DateTime="2008-09-13T03:25:12.334Z" SessionID="10"><From><User FriendlyName="- James O'"/></From><To><User FriendlyName="- alison"/></To><Text Style="font-family:MS Shell Dlg; color:#000000; ">chow</Text></Message><Message Date="9/13/2008" Time="1:25:23 PM" DateTime="2008-09-13T03:25:23.151Z" SessionID="11"><From><User FriendlyName="- alison"/></From><To><User FriendlyName="- James O'"/></To><Text Style="font-family:Eras Medium ITC; color:#0000ff; ">week after mine</Text></Message><Message Date="9/13/2008" Time="1:25:28 PM" DateTime="2008-09-13T03:25:28.689Z" SessionID="11"><From><User FriendlyName="- alison"/></From><To><User FriendlyName="- James O'"/></To><Text Style="font-family:Eras Medium ITC; color:#0000ff; ">haha anyways bye</Text></Message><Message Date="9/13/2008" Time="1:25:34 PM" DateTime="2008-09-13T03:25:34.349Z" SessionID="11"><From><User FriendlyName="- James O'"/></From><To><User FriendlyName="- alison"/></To><Text Style="font-family:MS Shell Dlg; color:#000000; ">bibi</Text></Message><Message Date="9/13/2008" Time="3:05:13 PM" DateTime="2008-09-13T05:05:13.490Z" SessionID="12"><From><User FriendlyName="- alison"/></From><To><User FriendlyName="- James O'"/></To><Text Style="font-family:Eras Medium ITC; color:#0000ff; ">have u listened to the new JR cd?</Text></Message><Message Date="9/13/2008" Time="3:05:41 PM" DateTime="2008-09-13T05:05:41.703Z" SessionID="12"><From><User FriendlyName="- alison"/></From><To><User FriendlyName="- James O'"/></To><Text Style="font-family:Eras Medium ITC; color:#0000ff; ">albumn watever</Text></Message><Message Date="9/14/2008" Time="11:17:48 PM" DateTime="2008-09-14T13:17:48.963Z" SessionID="13"><From><User FriendlyName="- alison"/></From><To><User FriendlyName="- James O'"/></To><Text Style="font-family:Eras Medium ITC; color:#0000ff; ">hey</Text></Message><Message Date="9/14/2008" Time="11:17:55 PM" DateTime="2008-09-14T13:17:55.157Z" SessionID="13"><From><User FriendlyName="- James O'"/></From><To><User FriendlyName="- alison"/></To><Text Style="font-family:MS Shell Dlg; color:#000000; ">hi</Text></Message><Message Date="9/14/2008" Time="11:18:02 PM" DateTime="2008-09-14T13:18:02.263Z" SessionID="13"><From><User FriendlyName="- alison"/></From><To><User FriendlyName="- James O'"/></To><Text Style="font-family:Eras Medium ITC; color:#0000ff; ">hows it going?</Text></Message><Message Date="9/14/2008" Time="11:18:11 PM" DateTime="2008-09-14T13:18:11.595Z" SessionID="13"><From><User FriendlyName="- James O'"/></From><To><User FriendlyName="- alison"/></To><Text Style="font-family:MS Shell Dlg; color:#000000; ">alright</Text></Message><Message Date="9/14/2008" Time="11:18:24 PM" DateTime="2008-09-14T13:18:24.241Z" SessionID="13"><From><User FriendlyName="- alison"/></From><To><User FriendlyName="- James O'"/></To><Text Style="font-family:Eras Medium ITC; color:#0000ff; ">cool</Text></Message><Message Date="9/14/2008" Time="11:20:00 PM" DateTime="2008-09-14T13:20:00.375Z" SessionID="13"><From><User FriendlyName="- alison"/></From><To><User FriendlyName="- James O'"/></To><Text Style="font-family:Eras Medium ITC; color:#0000ff; ">i havent started this assessment which is due on wed :S</Text></Message><Message Date="9/14/2008" Time="11:20:09 PM" DateTime="2008-09-14T13:20:09.205Z" SessionID="13"><From><User FriendlyName="- James O'"/></From><To><User FriendlyName="- alison"/></To><Text Style="font-family:MS Shell Dlg; color:#000000; ">mm</Text></Message><Message Date="9/14/2008" Time="11:20:38 PM" DateTime="2008-09-14T13:20:38.408Z" SessionID="13"><From><User FriendlyName="- James O'"/></From><To><User FriendlyName="- alison"/></To><Text Style="font-family:MS Shell Dlg; color:#000000; ">I got programming due tuesday, but its long and I've barely started, I think I may just submit a half assed attempt of what I've done so far</Text></Message><Message Date="9/14/2008" Time="11:20:43 PM" DateTime="2008-09-14T13:20:43.472Z" SessionID="13"><From><User FriendlyName="- James O'"/></From><To><User FriendlyName="- alison"/></To><Text Style="font-family:MS Shell Dlg; color:#000000; ">only worth 6 marks</Text></Message><Message Date="9/14/2008" Time="11:20:54 PM" DateTime="2008-09-14T13:20:54.431Z" SessionID="13"><From><User FriendlyName="- James O'"/></From><To><User FriendlyName="- alison"/></To><Text Style="font-family:MS Shell Dlg; color:#000000; ">and I've got a 15 min presentation next monday</Text></Message><Message Date="9/14/2008" Time="11:20:57 PM" DateTime="2008-09-14T13:20:57.510Z" SessionID="13"><From><User FriendlyName="- James O'"/></From><To><User FriendlyName="- alison"/></To><Text Style="font-family:MS Shell Dlg; color:#000000; ">yeh, bloody terrific</Text></Message><Message Date="9/14/2008" Time="11:21:23 PM" DateTime="2008-09-14T13:21:23.729Z" SessionID="13"><From><User FriendlyName="- alison"/></From><To><User FriendlyName="- James O'"/></To><Text Style="font-family:Eras Medium ITC; color:#0000ff; ">sounds like a blast</Text></Message><Message Date="9/14/2008" Time="11:21:40 PM" DateTime="2008-09-14T13:21:40.792Z" SessionID="13"><From><User FriendlyName="- alison"/></From><To><User FriendlyName="- James O'"/></To><Text Style="font-family:Eras Medium ITC; color:#0000ff; ">haha well i got an asessment due next monday but its not too bad</Text></Message><Message Date="9/14/2008" Time="11:21:50 PM" DateTime="2008-09-14T13:21:50.666Z" SessionID="13"><From><User FriendlyName="- alison"/></From><To><User FriendlyName="- James O'"/></To><Text Style="font-family:Eras Medium ITC; color:#0000ff; ">will take me 2 days</Text></Message><Message Date="9/14/2008" Time="11:22:20 PM" DateTime="2008-09-14T13:22:20.598Z" SessionID="13"><From><User FriendlyName="- James O'"/></From><To><User FriendlyName="- alison"/></To><Text Style="font-family:MS Shell Dlg; color:#000000; ">k</Text></Message><Message Date="9/14/2008" Time="11:22:27 PM" DateTime="2008-09-14T13:22:27.796Z" SessionID="13"><From><User FriendlyName="- James O'"/></From><To><User FriendlyName="- alison"/></To><Text Style="font-family:MS Shell Dlg; color:#000000; ">I should go</Text></Message><Message Date="9/14/2008" Time="11:22:30 PM" DateTime="2008-09-14T13:22:30.659Z" SessionID="13"><From><User FriendlyName="- James O'"/></From><To><User FriendlyName="- alison"/></To><Text Style="font-family:MS Shell Dlg; color:#000000; ">gotta be up at 7</Text></Message><Message Date="9/14/2008" Time="11:22:35 PM" DateTime="2008-09-14T13:22:35.194Z" SessionID="13"><From><User FriendlyName="- James O'"/></From><To><User FriendlyName="- alison"/></To><Text Style="font-family:MS Shell Dlg; color:#000000; ">went to get past 3 last night</Text></Message><Message Date="9/14/2008" Time="11:22:47 PM" DateTime="2008-09-14T13:22:47.642Z" SessionID="13"><From><User FriendlyName="- alison"/></From><To><User FriendlyName="- James O'"/></To><Text Style="font-family:Eras Medium ITC; color:#0000ff; ">ouch</Text></Message><Message Date="9/14/2008" Time="11:22:52 PM" DateTime="2008-09-14T13:22:52.561Z" SessionID="13"><From><User FriendlyName="- alison"/></From><To><User FriendlyName="- James O'"/></To><Text Style="font-family:Eras Medium ITC; color:#0000ff; ">i have to get up at 530</Text></Message><Message Date="9/14/2008" Time="11:22:54 PM" DateTime="2008-09-14T13:22:54.258Z" SessionID="13"><From><User FriendlyName="- alison"/></From><To><User FriendlyName="- James O'"/></To><Text Style="font-family:Eras Medium ITC; color:#0000ff; ">lol</Text></Message><Message Date="9/14/2008" Time="11:23:07 PM" DateTime="2008-09-14T13:23:07.104Z" SessionID="13"><From><User FriendlyName="- alison"/></From><To><User FriendlyName="- James O'"/></To><Text Style="font-family:Eras Medium ITC; color:#0000ff; ">but ahh well</Text></Message><Message Date="9/14/2008" Time="11:23:08 PM" DateTime="2008-09-14T13:23:08.227Z" SessionID="13"><From><User FriendlyName="- alison"/></From><To><User FriendlyName="- James O'"/></To><Text Style="font-family:Eras Medium ITC; color:#0000ff; ">night</Text></Message><Message Date="9/14/2008" Time="11:23:37 PM" DateTime="2008-09-14T13:23:37.428Z" SessionID="13"><From><User FriendlyName="- James O'"/></From><To><User FriendlyName="- alison"/></To><Text Style="font-family:MS Shell Dlg; color:#000000; ">wait</Text></Message><Message Date="9/14/2008" Time="11:23:38 PM" DateTime="2008-09-14T13:23:38.171Z" SessionID="13"><From><User FriendlyName="- James O'"/></From><To><User FriendlyName="- alison"/></To><Text Style="font-family:MS Shell Dlg; color:#000000; ">http://vimeo.com/1654340</Text></Message><Message Date="9/14/2008" Time="11:23:39 PM" DateTime="2008-09-14T13:23:39.994Z" SessionID="13"><From><User FriendlyName="- James O'"/></From><To><User FriendlyName="- alison"/></To><Text Style="font-family:MS Shell Dlg; color:#000000; ">watch that first</Text></Message><Message Date="9/14/2008" Time="11:23:40 PM" DateTime="2008-09-14T13:23:40.458Z" SessionID="13"><From><User FriendlyName="- James O'"/></From><To><User FriendlyName="- alison"/></To><Text Style="font-family:MS Shell Dlg; color:#000000; ">it</Text></Message><Message Date="9/14/2008" Time="11:23:44 PM" DateTime="2008-09-14T13:23:44.034Z" SessionID="13"><From><User FriendlyName="- James O'"/></From><To><User FriendlyName="- alison"/></To><Text Style="font-family:MS Shell Dlg; color:#000000; ">will blow ur mind</Text></Message><Message Date="9/14/2008" Time="11:23:49 PM" DateTime="2008-09-14T13:23:49.576Z" SessionID="13"><From><User FriendlyName="- alison"/></From><To><User FriendlyName="- James O'"/></To><Text Style="font-family:Eras Medium ITC; color:#0000ff; ">haha okay</Text></Message><Message Date="9/14/2008" Time="11:23:55 PM" DateTime="2008-09-14T13:23:55.866Z" SessionID="13"><From><User FriendlyName="- James O'"/></From><To><User FriendlyName="- alison"/></To><Text Style="font-family:MS Shell Dlg; color:#000000; ">(kablamo)</Text></Message><Message Date="9/14/2008" Time="11:24:05 PM" DateTime="2008-09-14T13:24:05.150Z" SessionID="13"><From><User FriendlyName="- alison"/></From><To><User FriendlyName="- James O'"/></To><Text Style="font-family:Eras Medium ITC; color:#0000ff; ">im scared</Text></Message><Message Date="9/14/2008" Time="11:24:08 PM" DateTime="2008-09-14T13:24:08.437Z" SessionID="13"><From><User FriendlyName="- alison"/></From><To><User FriendlyName="- James O'"/></To><Text Style="font-family:Eras Medium ITC; color:#0000ff; ">hehe</Text></Message><Message Date="9/14/2008" Time="11:24:19 PM" DateTime="2008-09-14T13:24:19.639Z" SessionID="13"><From><User FriendlyName="- James O'"/></From><To><User FriendlyName="- alison"/></To><Text Style="font-family:MS Shell Dlg; color:#000000; ">Its in hd, might take a sec to load</Text></Message><Message Date="9/14/2008" Time="11:25:16 PM" DateTime="2008-09-14T13:25:16.788Z" SessionID="13"><From><User FriendlyName="- alison"/></From><To><User FriendlyName="- James O'"/></To><Text Style="font-family:Eras Medium ITC; color:#0000ff; ">(watching)</Text></Message><Message Date="9/14/2008" Time="11:27:29 PM" DateTime="2008-09-14T13:27:29.062Z" SessionID="13"><From><User FriendlyName="- alison"/></From><To><User FriendlyName="- James O'"/></To><Text Style="font-family:Eras Medium ITC; color:#0000ff; ">geez</Text></Message><Message Date="9/14/2008" Time="11:27:35 PM" DateTime="2008-09-14T13:27:35.945Z" SessionID="13"><From><User FriendlyName="- alison"/></From><To><User FriendlyName="- James O'"/></To><Text Style="font-family:Eras Medium ITC; color:#0000ff; ">thats fast</Text></Message><Message Date="9/14/2008" Time="11:28:07 PM" DateTime="2008-09-14T13:28:07.580Z" SessionID="13"><From><User FriendlyName="- James O'"/></From><To><User FriendlyName="- alison"/></To><Text Style="font-family:MS Shell Dlg; color:#000000; ">intense+1</Text></Message><Message Date="9/14/2008" Time="11:28:09 PM" DateTime="2008-09-14T13:28:09.946Z" SessionID="13"><From><User FriendlyName="- James O'"/></From><To><User FriendlyName="- alison"/></To><Text Style="font-family:MS Shell Dlg; color:#000000; ">anyways, gtg</Text></Message><Message Date="9/14/2008" Time="11:28:12 PM" DateTime="2008-09-14T13:28:12.234Z" SessionID="13"><From><User FriendlyName="- James O'"/></From><To><User FriendlyName="- alison"/></To><Text Style="font-family:MS Shell Dlg; color:#000000; ">noight</Text></Message><Message Date="9/14/2008" Time="11:28:15 PM" DateTime="2008-09-14T13:28:15.193Z" SessionID="13"><From><User FriendlyName="- alison"/></From><To><User FriendlyName="- James O'"/></To><Text Style="font-family:Eras Medium ITC; color:#0000ff; ">night</Text></Message><Message Date="9/14/2008" Time="11:28:58 PM" DateTime="2008-09-14T13:28:58.963Z" SessionID="13"><From><User FriendlyName="- alison"/></From><To><User FriendlyName="- James O'"/></To><Text Style="font-family:Eras Medium ITC; color:#0000ff; ">how dud they record it lol</Text></Message><Message Date="9/14/2008" Time="11:29:13 PM" DateTime="2008-09-14T13:29:13.492Z" SessionID="13"><From><User FriendlyName="- James O'"/></From><To><User FriendlyName="- alison"/></To><Text Style="font-family:MS Shell Dlg; color:#000000; ">big camera, in the second hill u see it in the shadow</Text></Message><Message Date="9/14/2008" Time="11:29:16 PM" DateTime="2008-09-14T13:29:16.730Z" SessionID="13"><From><User FriendlyName="- James O'"/></From><To><User FriendlyName="- alison"/></To><Text Style="font-family:MS Shell Dlg; color:#000000; ">and they pass it to one another</Text></Message><Message Date="9/14/2008" Time="11:29:29 PM" DateTime="2008-09-14T13:29:29.482Z" SessionID="13"><From><User FriendlyName="- alison"/></From><To><User FriendlyName="- James O'"/></To><Text Style="font-family:Eras Medium ITC; color:#0000ff; ">oh ok</Text></Message><Message Date="9/14/2008" Time="11:29:33 PM" DateTime="2008-09-14T13:29:33.890Z" SessionID="13"><From><User FriendlyName="- James O'"/></From><To><User FriendlyName="- alison"/></To><Text Style="font-family:MS Shell Dlg; color:#000000; ">tata</Text></Message><Message Date="9/15/2008" Time="10:48:38 PM" DateTime="2008-09-15T12:48:38.014Z" SessionID="14"><From><User FriendlyName="- alison"/></From><To><User FriendlyName="- James O'"/></To><Text Style="font-family:Eras Medium ITC; color:#0000ff; ">hey</Text></Message><Message Date="9/15/2008" Time="10:49:07 PM" DateTime="2008-09-15T12:49:07.614Z" SessionID="14"><From><User FriendlyName="- alison"/></From><To><User FriendlyName="- James O'"/></To><Text Style="font-family:Eras Medium ITC; color:#0000ff; ">wen ur ipod ear phones went funny did u have to buy new ones or did they fix them selves :S odd question yes</Text></Message><Message Date="9/15/2008" Time="11:08:53 PM" DateTime="2008-09-15T13:08:53.151Z" SessionID="14"><From><User FriendlyName="- James O'"/></From><To><User FriendlyName="- alison"/></To><Text Style="font-family:MS Shell Dlg; color:#000000; ">Wiring usually goes bad in one ear</Text></Message><Message Date="9/15/2008" Time="11:09:00 PM" DateTime="2008-09-15T13:09:00.485Z" SessionID="14"><From><User FriendlyName="- James O'"/></From><To><User FriendlyName="- alison"/></To><Text Style="font-family:MS Shell Dlg; color:#000000; ">needs replacement</Text></Message><Message Date="9/15/2008" Time="11:09:23 PM" DateTime="2008-09-15T13:09:23.123Z" SessionID="14"><From><User FriendlyName="- James O'"/></From><To><User FriendlyName="- alison"/></To><Text Style="font-family:MS Shell Dlg; color:#000000; ">I prefer in ear headphones, block out sound, better sound quality and requires less volume</Text></Message><Message Date="9/15/2008" Time="11:09:34 PM" DateTime="2008-09-15T13:09:34.181Z" SessionID="14"><From><User FriendlyName="- alison"/></From><To><User FriendlyName="- James O'"/></To><Text Style="font-family:Eras Medium ITC; color:#0000ff; ">yeh i twisted it down near where the plug is and it is just holding in both ears</Text></Message><Message Date="9/15/2008" Time="11:09:44 PM" DateTime="2008-09-15T13:09:44.581Z" SessionID="14"><From><User FriendlyName="- alison"/></From><To><User FriendlyName="- James O'"/></To><Text Style="font-family:Eras Medium ITC; color:#0000ff; ">ahh</Text></Message><Message Date="9/15/2008" Time="11:10:17 PM" DateTime="2008-09-15T13:10:17.853Z" SessionID="15"><From><User FriendlyName="- alison"/></From><To><User FriendlyName="- James O'"/></To><Text Style="font-family:Eras Medium ITC; color:#0000ff; ">i remembered u did it once lol so i tried it and it works</Text></Message><Message Date="9/15/2008" Time="11:10:44 PM" DateTime="2008-09-15T13:10:44.804Z" SessionID="15"><From><User FriendlyName="- alison"/></From><To><User FriendlyName="- James O'"/></To><Text Style="font-family:Eras Medium ITC; color:#0000ff; ">my headset doesnt work anymore (chewed through the wire :S)</Text></Message><Message Date="9/15/2008" Time="11:11:13 PM" DateTime="2008-09-15T13:11:13.135Z" SessionID="15"><From><User FriendlyName="- alison"/></From><To><User FriendlyName="- James O'"/></To><Text Style="font-family:Eras Medium ITC; color:#0000ff; ">wel the plastic covering and yeh</Text></Message><Message Date="9/15/2008" Time="11:11:31 PM" DateTime="2008-09-15T13:11:31.764Z" SessionID="15"><From><User FriendlyName="- James O'"/></From><To><User FriendlyName="- alison"/></To><Text Style="font-family:MS Shell Dlg; color:#000000; ">most headphones are not built to last</Text></Message><Message Date="9/15/2008" Time="11:11:43 PM" DateTime="2008-09-15T13:11:43.722Z" SessionID="15"><From><User FriendlyName="- alison"/></From><To><User FriendlyName="- James O'"/></To><Text Style="font-family:Eras Medium ITC; color:#0000ff; ">yeh</Text></Message><Message Date="9/15/2008" Time="11:12:23 PM" DateTime="2008-09-15T13:12:23.395Z" SessionID="15"><From><User FriendlyName="- alison"/></From><To><User FriendlyName="- James O'"/></To><Text Style="font-family:Eras Medium ITC; color:#0000ff; ">u know the headphones that u were talking about.. were they the big chunky ones?</Text></Message><Message Date="9/15/2008" Time="11:13:00 PM" DateTime="2008-09-15T13:13:00.824Z" SessionID="15"><From><User FriendlyName="- alison"/></From><To><User FriendlyName="- James O'"/></To><Text Style="font-family:Eras Medium ITC; color:#0000ff; ">the sound cancelling</Text></Message><Message Date="9/15/2008" Time="11:13:09 PM" DateTime="2008-09-15T13:13:09.575Z" SessionID="15"><From><User FriendlyName="- James O'"/></From><To><User FriendlyName="- alison"/></To><Text Style="font-family:MS Shell Dlg; color:#000000; ">no</Text></Message><Message Date="9/15/2008" Time="11:13:19 PM" DateTime="2008-09-15T13:13:19.277Z" SessionID="15"><From><User FriendlyName="- James O'"/></From><To><User FriendlyName="- alison"/></To><Text Style="font-family:MS Shell Dlg; color:#000000; ">ones I got with my laptop</Text></Message><Message Date="9/15/2008" Time="11:13:23 PM" DateTime="2008-09-15T13:13:23.461Z" SessionID="15"><From><User FriendlyName="- James O'"/></From><To><User FriendlyName="- alison"/></To><Text Style="font-family:MS Shell Dlg; color:#000000; ">creative in ear</Text></Message><Message Date="9/15/2008" Time="11:13:36 PM" DateTime="2008-09-15T13:13:36.577Z" SessionID="15"><From><User FriendlyName="- alison"/></From><To><User FriendlyName="- James O'"/></To><Text Style="font-family:Eras Medium ITC; color:#0000ff; ">o okay</Text></Message><Message Date="9/15/2008" Time="11:13:49 PM" DateTime="2008-09-15T13:13:49.668Z" SessionID="15"><From><User FriendlyName="- James O'"/></From><To><User FriendlyName="- alison"/></To><Text Style="font-family:MS Shell Dlg; color:#000000; ">but they died</Text></Message><Message Date="9/15/2008" Time="11:13:51 PM" DateTime="2008-09-15T13:13:51.128Z" SessionID="15"><From><User FriendlyName="- alison"/></From><To><User FriendlyName="- James O'"/></To><Text Style="font-family:Eras Medium ITC; color:#0000ff; ">coz i need ones to wear out when i go walking/running</Text></Message><Message Date="9/15/2008" Time="11:13:53 PM" DateTime="2008-09-15T13:13:53.464Z" SessionID="15"><From><User FriendlyName="- alison"/></From><To><User FriendlyName="- James O'"/></To><Text Style="font-family:Eras Medium ITC; color:#0000ff; ">oh</Text></Message><Message Date="9/15/2008" Time="11:13:53 PM" DateTime="2008-09-15T13:13:53.584Z" SessionID="15"><From><User FriendlyName="- James O'"/></From><To><User FriendlyName="- alison"/></To><Text Style="font-family:MS Shell Dlg; color:#000000; ">in one ear</Text></Message><Message Date="9/15/2008" Time="11:13:55 PM" DateTime="2008-09-15T13:13:55.707Z" SessionID="15"><From><User FriendlyName="- James O'"/></From><To><User FriendlyName="- alison"/></To><Text Style="font-family:MS Shell Dlg; color:#000000; ">http://www.trustedreviews.com/multimedia/review/2005/12/12/Creative-EP-630-Headphones/p1</Text></Message><Message Date="9/15/2008" Time="11:14:07 PM" DateTime="2008-09-15T13:14:07.735Z" SessionID="15"><From><User FriendlyName="- James O'"/></From><To><User FriendlyName="- alison"/></To><Text Style="font-family:MS Shell Dlg; color:#000000; ">they're the ones I had,</Text></Message><Message Date="9/15/2008" Time="11:14:22 PM" DateTime="2008-09-15T13:14:22.558Z" SessionID="15"><From><User FriendlyName="- James O'"/></From><To><User FriendlyName="- alison"/></To><Text Style="font-family:MS Shell Dlg; color:#000000; ">Im replacing em with some cheap ones online that marc recommended</Text></Message><Message Date="9/15/2008" Time="11:14:25 PM" DateTime="2008-09-15T13:14:25.485Z" SessionID="15"><From><User FriendlyName="- James O'"/></From><To><User FriendlyName="- alison"/></To><Text Style="font-family:MS Shell Dlg; color:#000000; ">similiar thing but smaller</Text></Message><Message Date="9/15/2008" Time="11:14:27 PM" DateTime="2008-09-15T13:14:27.910Z" SessionID="15"><From><User FriendlyName="- James O'"/></From><To><User FriendlyName="- alison"/></To><Text Style="font-family:MS Shell Dlg; color:#000000; ">and orange</Text></Message><Message Date="9/15/2008" Time="11:14:34 PM" DateTime="2008-09-15T13:14:34.211Z" SessionID="16"><From><User FriendlyName="- alison"/></From><To><User FriendlyName="- James O'"/></To><Text Style="font-family:Eras Medium ITC; color:#0000ff; ">ahh pretty :)</Text></Message><Message Date="9/15/2008" Time="11:14:35 PM" DateTime="2008-09-15T13:14:35.073Z" SessionID="16"><From><User FriendlyName="- alison"/></From><To><User FriendlyName="- James O'"/></To><Text Style="font-family:Eras Medium ITC; color:#0000ff; ">hehe</Text></Message><Message Date="9/15/2008" Time="11:14:55 PM" DateTime="2008-09-15T13:14:55.456Z" SessionID="16"><From><User FriendlyName="- alison"/></From><To><User FriendlyName="- James O'"/></To><Text Style="font-family:Eras Medium ITC; color:#0000ff; ">i might just go to tandy at menai in the next few days and get some earphones</Text></Message><Message Date="9/15/2008" Time="11:15:47 PM" DateTime="2008-09-15T13:15:47.282Z" SessionID="16"><From><User FriendlyName="- alison"/></From><To><User FriendlyName="- James O'"/></To><Text Style="font-family:Eras Medium ITC; color:#0000ff; ">i like ipod earphones, coz i have sony ones and they are too big for the opening of my ear :S haha it just hurts</Text></Message><Message Date="9/15/2008" Time="11:16:05 PM" DateTime="2008-09-15T13:16:05.089Z" SessionID="16"><From><User FriendlyName="- James O'"/></From><To><User FriendlyName="- alison"/></To><Text Style="font-family:MS Shell Dlg; color:#000000; ">http://www.dealextreme.com/products.dx/category.207</Text></Message><Message Date="9/15/2008" Time="11:16:20 PM" DateTime="2008-09-15T13:16:20.798Z" SessionID="16"><From><User FriendlyName="- James O'"/></From><To><User FriendlyName="- alison"/></To><Text Style="font-family:MS Shell Dlg; color:#000000; ">Im getting the orange ones, but they have origanal ipod ones for cheap</Text></Message><Message Date="9/15/2008" Time="11:16:45 PM" DateTime="2008-09-15T13:16:45.835Z" SessionID="16"><From><User FriendlyName="- alison"/></From><To><User FriendlyName="- James O'"/></To><Text Style="font-family:Eras Medium ITC; color:#0000ff; ">the top right hand?</Text></Message><Message Date="9/15/2008" Time="11:16:53 PM" DateTime="2008-09-15T13:16:53.671Z" SessionID="16"><From><User FriendlyName="- alison"/></From><To><User FriendlyName="- James O'"/></To><Text Style="font-family:Eras Medium ITC; color:#0000ff; ">i mean left</Text></Message><Message Date="9/15/2008" Time="11:17:12 PM" DateTime="2008-09-15T13:17:12.051Z" SessionID="16"><From><User FriendlyName="- James O'"/></From><To><User FriendlyName="- alison"/></To><Text Style="font-family:MS Shell Dlg; color:#000000; ">yes,</Text></Message><Message Date="9/15/2008" Time="11:17:57 PM" DateTime="2008-09-15T13:17:57.491Z" SessionID="16"><From><User FriendlyName="- alison"/></From><To><User FriendlyName="- James O'"/></To><Text Style="font-family:Eras Medium ITC; color:#0000ff; ">these are extremely cheap?</Text></Message><Message Date="9/15/2008" Time="11:18:21 PM" DateTime="2008-09-15T13:18:21.253Z" SessionID="16"><From><User FriendlyName="- James O'"/></From><To><User FriendlyName="- alison"/></To><Text Style="font-family:MS Shell Dlg; color:#000000; ">yup</Text></Message><Message Date="9/15/2008" Time="11:18:31 PM" DateTime="2008-09-15T13:18:31.416Z" SessionID="16"><From><User FriendlyName="- James O'"/></From><To><User FriendlyName="- alison"/></To><Text Style="font-family:MS Shell Dlg; color:#000000; ">and free shipping</Text></Message><Message Date="9/15/2008" Time="11:19:21 PM" DateTime="2008-09-15T13:19:21.983Z" SessionID="16"><From><User FriendlyName="- alison"/></From><To><User FriendlyName="- James O'"/></To><Text Style="font-family:Eras Medium ITC; color:#0000ff; ">lol im broke till next year.. this site will be directed to my brother, so he can buy them for me :)</Text></Message><Message Date="9/15/2008" Time="11:23:29 PM" DateTime="2008-09-15T13:23:29.135Z" SessionID="16"><From><User FriendlyName="- alison"/></From><To><User FriendlyName="- James O'"/></To><Text Style="font-family:Eras Medium ITC; color:#0000ff; ">i like this song :)</Text></Message><Message Date="9/15/2008" Time="11:24:07 PM" DateTime="2008-09-15T13:24:07.107Z" SessionID="16"><From><User FriendlyName="- alison"/></From><To><User FriendlyName="- James O'"/></To><Text Style="font-family:Eras Medium ITC; color:#0000ff; ">... in one ear now :S</Text></Message><Message Date="9/15/2008" Time="11:26:30 PM" DateTime="2008-09-15T13:26:30.543Z" SessionID="16"><From><User FriendlyName="- James O'"/></From><To><User FriendlyName="- alison"/></To><Text Style="font-family:MS Shell Dlg; color:#000000; ">mmk</Text></Message><Message Date="9/15/2008" Time="11:26:38 PM" DateTime="2008-09-15T13:26:38.501Z" SessionID="16"><From><User FriendlyName="- James O'"/></From><To><User FriendlyName="- alison"/></To><Text Style="font-family:MS Shell Dlg; color:#000000; ">I gotta scoot</Text></Message><Message Date="9/15/2008" Time="11:26:49 PM" DateTime="2008-09-15T13:26:49.836Z" SessionID="16"><From><User FriendlyName="- James O'"/></From><To><User FriendlyName="- alison"/></To><Text Style="font-family:MS Shell Dlg; color:#000000; ">tired maximus</Text></Message><Message Date="9/15/2008" Time="11:27:00 PM" DateTime="2008-09-15T13:27:00.522Z" SessionID="17"><From><User FriendlyName="- alison"/></From><To><User FriendlyName="- James O'"/></To><Text Style="font-family:Eras Medium ITC; color:#0000ff; ">hmm i have an assessment</Text></Message><Message Date="9/15/2008" Time="11:27:03 PM" DateTime="2008-09-15T13:27:03.355Z" SessionID="17"><From><User FriendlyName="- alison"/></From><To><User FriendlyName="- James O'"/></To><Text Style="font-family:Eras Medium ITC; color:#0000ff; ">fun for me</Text></Message><Message Date="9/15/2008" Time="11:27:09 PM" DateTime="2008-09-15T13:27:09.162Z" SessionID="17"><From><User FriendlyName="- alison"/></From><To><User FriendlyName="- James O'"/></To><Text Style="font-family:Eras Medium ITC; color:#0000ff; ">night</Text></Message><Message Date="9/15/2008" Time="11:27:13 PM" DateTime="2008-09-15T13:27:13.610Z" SessionID="17"><From><User FriendlyName="- James O'"/></From><To><User FriendlyName="- alison"/></To><Text Style="font-family:MS Shell Dlg; color:#000000; ">night</Text></Message><Message Date="9/18/2008" Time="2:07:15 PM" DateTime="2008-09-18T04:07:15.763Z" SessionID="18"><From><User FriendlyName="- alison"/></From><To><User FriendlyName="- James O'"/></To><Text Style="font-family:Eras Medium ITC; color:#0000ff; ">i bought head phone thingies today</Text></Message><Message Date="9/18/2008" Time="2:07:28 PM" DateTime="2008-09-18T04:07:28.384Z" SessionID="18"><From><User FriendlyName="- James O'"/></From><To><User FriendlyName="- alison"/></To><Text Style="font-family:MS Shell Dlg; color:#000000; ">a huh?</Text></Message><Message Date="9/18/2008" Time="2:08:05 PM" DateTime="2008-09-18T04:08:05.252Z" SessionID="18"><From><User FriendlyName="- alison"/></From><To><User FriendlyName="- James O'"/></To><Text Style="font-family:Eras Medium ITC; color:#0000ff; ">hmm they sit over my ear? lol i dno.. i was going to get the noise isolation ones but then i decided not too</Text></Message><Message Date="9/18/2008" Time="2:08:10 PM" DateTime="2008-09-18T04:08:10.599Z" SessionID="18"><From><User FriendlyName="- alison"/></From><To><User FriendlyName="- James O'"/></To><Text Style="font-family:Eras Medium ITC; color:#0000ff; ">i spent $40 on em</Text></Message><Message Date="9/18/2008" Time="2:08:11 PM" DateTime="2008-09-18T04:08:11.637Z" SessionID="18"><From><User FriendlyName="- alison"/></From><To><User FriendlyName="- James O'"/></To><Text Style="font-family:Eras Medium ITC; color:#0000ff; ">lol</Text></Message><Message Date="9/18/2008" Time="2:08:40 PM" DateTime="2008-09-18T04:08:40.704Z" SessionID="18"><From><User FriendlyName="- James O'"/></From><To><User FriendlyName="- alison"/></To><Text Style="font-family:MS Shell Dlg; color:#000000; ">sound good?</Text></Message><Message Date="9/18/2008" Time="2:08:52 PM" DateTime="2008-09-18T04:08:52.097Z" SessionID="19"><From><User FriendlyName="- alison"/></From><To><User FriendlyName="- James O'"/></To><Text Style="font-family:Eras Medium ITC; color:#0000ff; ">havent opened the packet</Text></Message><Message Date="9/18/2008" Time="2:08:56 PM" DateTime="2008-09-18T04:08:56.168Z" SessionID="19"><From><User FriendlyName="- alison"/></From><To><User FriendlyName="- James O'"/></To><Text Style="font-family:Eras Medium ITC; color:#0000ff; ">currently trying to</Text></Message><Message Date="9/18/2008" Time="2:10:31 PM" DateTime="2008-09-18T04:10:31.421Z" SessionID="19"><From><User FriendlyName="- alison"/></From><To><User FriendlyName="- James O'"/></To><Text Style="font-family:Eras Medium ITC; color:#0000ff; ">they have interchangable cap thingies though</Text></Message><Message Date="9/18/2008" Time="2:17:18 PM" DateTime="2008-09-18T04:17:18.597Z" SessionID="19"><From><User FriendlyName="- alison"/></From><To><User FriendlyName="- James O'"/></To><Text Style="font-family:Eras Medium ITC; color:#0000ff; ">lol the only picture i could find</Text></Message><Message Date="9/18/2008" Time="2:17:19 PM" DateTime="2008-09-18T04:17:19.434Z" SessionID="19"><From><User FriendlyName="- alison"/></From><To><User FriendlyName="- James O'"/></To><Text Style="font-family:Eras Medium ITC; color:#0000ff; ">http://www.365batteries.com/image/shs3701-2.jpg</Text></Message><Message Date="9/18/2008" Time="2:19:38 PM" DateTime="2008-09-18T04:19:38.616Z" SessionID="19"><From><User FriendlyName="- alison"/></From><To><User FriendlyName="- James O'"/></To><Text Style="font-family:Eras Medium ITC; color:#0000ff; ">actually
http://www.fdc.net.nz/include/showimage.asp?id=86921</Text></Message><Message Date="9/18/2008" Time="2:19:53 PM" DateTime="2008-09-18T04:19:53.263Z" SessionID="19"><From><User FriendlyName="- alison"/></From><To><User FriendlyName="- James O'"/></To><Text Style="font-family:Eras Medium ITC; color:#0000ff; ">hmm but they are good</Text></Message><Message Date="9/18/2008" Time="3:24:41 PM" DateTime="2008-09-18T05:24:41.958Z" SessionID="19"><From><User FriendlyName="- James O'"/></From><To><User FriendlyName="- alison"/></To><Text Style="font-family:MS Shell Dlg; color:#000000; ">I just bought, a 20 pack of 3mm sphere magnets, 2 sets of in ear stero earbuds, metallic orange, a retractable iPod data cable, a 6 pack of microfibre cleaning clothes and 2 tiny LED key ring flash lights</Text></Message><Message Date="9/18/2008" Time="3:24:46 PM" DateTime="2008-09-18T05:24:46.900Z" SessionID="19"><From><User FriendlyName="- James O'"/></From><To><User FriendlyName="- alison"/></To><Text Style="font-family:MS Shell Dlg; color:#000000; ">for $18.34</Text></Message><Message Date="9/18/2008" Time="3:24:55 PM" DateTime="2008-09-18T05:24:55.346Z" SessionID="19"><From><User FriendlyName="- James O'"/></From><To><User FriendlyName="- alison"/></To><Text Style="font-family:MS Shell Dlg; color:#000000; ">(us, so 20 something)</Text></Message><Message Date="9/18/2008" Time="3:25:04 PM" DateTime="2008-09-18T05:25:04.278Z" SessionID="19"><From><User FriendlyName="- alison"/></From><To><User FriendlyName="- James O'"/></To><Text Style="font-family:Eras Medium ITC; color:#0000ff; ">ahh cool</Text></Message><Message Date="9/18/2008" Time="3:25:25 PM" DateTime="2008-09-18T05:25:25.912Z" SessionID="20"><From><User FriendlyName="- alison"/></From><To><User FriendlyName="- James O'"/></To><Text Style="font-family:Eras Medium ITC; color:#0000ff; ">sphere magnets?</Text></Message><Message Date="9/18/2008" Time="3:25:36 PM" DateTime="2008-09-18T05:25:36.110Z" SessionID="20"><From><User FriendlyName="- James O'"/></From><To><User FriendlyName="- alison"/></To><Text Style="font-family:MS Shell Dlg; color:#000000; ">mm</Text></Message><Message Date="9/18/2008" Time="3:25:55 PM" DateTime="2008-09-18T05:25:55.755Z" SessionID="20"><From><User FriendlyName="- James O'"/></From><To><User FriendlyName="- alison"/></To><Text Style="font-family:MS Shell Dlg; color:#000000; ">for funsies</Text></Message><Message Date="9/18/2008" Time="3:25:59 PM" DateTime="2008-09-18T05:25:59.619Z" SessionID="20"><From><User FriendlyName="- James O'"/></From><To><User FriendlyName="- alison"/></To><Text Style="font-family:MS Shell Dlg; color:#000000; ">new house out btw</Text></Message><Message Date="9/18/2008" Time="3:26:03 PM" DateTime="2008-09-18T05:26:03.058Z" SessionID="20"><From><User FriendlyName="- James O'"/></From><To><User FriendlyName="- alison"/></To><Text Style="font-family:MS Shell Dlg; color:#000000; ">s05e01</Text></Message><Message Date="9/18/2008" Time="3:26:12 PM" DateTime="2008-09-18T05:26:12.423Z" SessionID="20"><From><User FriendlyName="- alison"/></From><To><User FriendlyName="- James O'"/></To><Text Style="font-family:Eras Medium ITC; color:#0000ff; ">Wow :)</Text></Message><Message Date="9/18/2008" Time="3:26:17 PM" DateTime="2008-09-18T05:26:17.361Z" SessionID="20"><From><User FriendlyName="- alison"/></From><To><User FriendlyName="- James O'"/></To><Text Style="font-family:Eras Medium ITC; color:#0000ff; ">its heroes out yet?</Text></Message><Message Date="9/18/2008" Time="3:26:26 PM" DateTime="2008-09-18T05:26:26.200Z" SessionID="20"><From><User FriendlyName="- alison"/></From><To><User FriendlyName="- James O'"/></To><Text Style="font-family:Eras Medium ITC; color:#0000ff; ">is*</Text></Message><Message Date="9/18/2008" Time="3:26:38 PM" DateTime="2008-09-18T05:26:38.110Z" SessionID="20"><From><User FriendlyName="- James O'"/></From><To><User FriendlyName="- alison"/></To><Text Style="font-family:MS Shell Dlg; color:#000000; ">4 days</Text></Message><Message Date="9/18/2008" Time="3:26:47 PM" DateTime="2008-09-18T05:26:47.047Z" SessionID="20"><From><User FriendlyName="- alison"/></From><To><User FriendlyName="- James O'"/></To><Text Style="font-family:Eras Medium ITC; color:#0000ff; ">i knew it was close</Text></Message><Message Date="9/18/2008" Time="3:26:51 PM" DateTime="2008-09-18T05:26:51.566Z" SessionID="20"><From><User FriendlyName="- James O'"/></From><To><User FriendlyName="- alison"/></To><Text Style="font-family:MS Shell Dlg; color:#000000; ">and speaking of which, going to go watch season 2</Text></Message><Message Date="9/18/2008" Time="3:26:56 PM" DateTime="2008-09-18T05:26:56.615Z" SessionID="20"><From><User FriendlyName="- alison"/></From><To><User FriendlyName="- James O'"/></To><Text Style="font-family:Eras Medium ITC; color:#0000ff; ">alright</Text></Message><Message Date="9/18/2008" Time="3:26:58 PM" DateTime="2008-09-18T05:26:58.080Z" SessionID="20"><From><User FriendlyName="- alison"/></From><To><User FriendlyName="- James O'"/></To><Text Style="font-family:Eras Medium ITC; color:#0000ff; ">see ya</Text></Message><Message Date="9/18/2008" Time="3:27:01 PM" DateTime="2008-09-18T05:27:01.454Z" SessionID="20"><From><User FriendlyName="- James O'"/></From><To><User FriendlyName="- alison"/></To><Text Style="font-family:MS Shell Dlg; color:#000000; ">baibai</Text></Message><Message Date="9/19/2008" Time="3:31:25 PM" DateTime="2008-09-19T05:31:25.317Z" SessionID="21"><From><User FriendlyName="- alison [assessmenting]"/></From><To><User FriendlyName="- James O'"/></To><Text Style="font-family:Eras Medium ITC; color:#0000ff; ">u still going to marcs?</Text></Message><Message Date="9/19/2008" Time="3:31:39 PM" DateTime="2008-09-19T05:31:39.578Z" SessionID="21"><From><User FriendlyName="- alison [assessmenting]"/></From><To><User FriendlyName="- James O'"/></To><Text Style="font-family:Eras Medium ITC; color:#0000ff; ">im not going but he sed he might invite others</Text></Message><Message Date="9/19/2008" Time="3:34:20 PM" DateTime="2008-09-19T05:34:20.384Z" SessionID="21"><From><User FriendlyName="- James O'"/></From><To><User FriendlyName="- alison [assessmenting]"/></To><Text Style="font-family:MS Shell Dlg; color:#000000; ">nah, gotta work on a speech</Text></Message><Message Date="9/19/2008" Time="4:06:18 PM" DateTime="2008-09-19T06:06:18.469Z" SessionID="22"><From><User FriendlyName="- alison [assessmenting]"/></From><To><User FriendlyName="- James O'"/></To><Text Style="font-family:Eras Medium ITC; color:#0000ff; ">sounds likw fun</Text></Message><Message Date="9/19/2008" Time="4:06:38 PM" DateTime="2008-09-19T06:06:38.472Z" SessionID="22"><From><User FriendlyName="- alison [assessmenting]"/></From><To><User FriendlyName="- James O'"/></To><Text Style="font-family:Eras Medium ITC; color:#0000ff; ">i have an assessment due monday :( </Text></Message><Message Date="9/19/2008" Time="4:06:47 PM" DateTime="2008-09-19T06:06:47.396Z" SessionID="22"><From><User FriendlyName="- alison [assessmenting]"/></From><To><User FriendlyName="- James O'"/></To><Text Style="font-family:Eras Medium ITC; color:#0000ff; ">cant be bothered to do it</Text></Message><Message Date="9/19/2008" Time="4:07:10 PM" DateTime="2008-09-19T06:07:10.012Z" SessionID="22"><From><User FriendlyName="- alison [assessmenting]"/></From><To><User FriendlyName="- James O'"/></To><Text Style="font-family:Eras Medium ITC; color:#0000ff; ">anyways i have to try</Text></Message><Message Date="9/19/2008" Time="4:07:25 PM" DateTime="2008-09-19T06:07:25.052Z" SessionID="22"><From><User FriendlyName="- alison [assessmenting]"/></From><To><User FriendlyName="- James O'"/></To><Text Style="font-family:Eras Medium ITC; color:#0000ff; ">good luck with ur speech</Text></Message><Message Date="9/19/2008" Time="4:07:27 PM" DateTime="2008-09-19T06:07:27.739Z" SessionID="22"><From><User FriendlyName="- alison [assessmenting]"/></From><To><User FriendlyName="- James O'"/></To><Text Style="font-family:Eras Medium ITC; color:#0000ff; ">ciao</Text></Message><Message Date="9/20/2008" Time="1:31:05 PM" DateTime="2008-09-20T03:31:05.602Z" SessionID="23"><From><User FriendlyName="- alison [assessmenting]"/></From><To><User FriendlyName="- James O'"/></To><Text Style="font-family:Eras Medium ITC; color:#0000ff; ">hows the speech going?</Text></Message><Message Date="9/21/2008" Time="8:55:20 AM" DateTime="2008-09-20T22:55:20.766Z" SessionID="24"><From><User FriendlyName="- alison [assessmenting]"/></From><To><User FriendlyName="- James O'"/></To><Text Style="font-family:Eras Medium ITC; color:#0000ff; ">With Heroes, wat is the new volumes' name</Text></Message><Message Date="9/21/2008" Time="11:44:42 AM" DateTime="2008-09-21T01:44:42.903Z" SessionID="24"><From><User FriendlyName="- James O'"/></From><To><User FriendlyName="- alison [assessmenting]"/></To><Text Style="font-family:MS Shell Dlg; color:#000000; ">villians</Text></Message><Message Date="9/21/2008" Time="11:53:15 AM" DateTime="2008-09-21T01:53:15.367Z" SessionID="25"><From><User FriendlyName="- James O'"/></From><To><User FriendlyName="- alison [assessmenting]"/></To><Text Style="font-family:MS Shell Dlg; color:#000000; ">http://de.sevenload.com/videos/pP4attt-Ausbruch-5</Text></Message><Message Date="9/21/2008" Time="12:16:26 PM" DateTime="2008-09-21T02:16:26.275Z" SessionID="26"><From><User FriendlyName="- alison [assessmenting]"/></From><To><User FriendlyName="- James O'"/></To><Text Style="font-family:Eras Medium ITC; color:#0000ff; ">ahh thanks :)</Text></Message><Message Date="9/21/2008" Time="12:17:13 PM" DateTime="2008-09-21T02:17:13.904Z" SessionID="26"><From><User FriendlyName="- alison [assessmenting]"/></From><To><User FriendlyName="- James O'"/></To><Text Style="font-family:Eras Medium ITC; color:#0000ff; ">wow</Text></Message><Message Date="9/21/2008" Time="12:18:17 PM" DateTime="2008-09-21T02:18:17.996Z" SessionID="26"><From><User FriendlyName="- alison [assessmenting]"/></From><To><User FriendlyName="- James O'"/></To><Text Style="font-family:Eras Medium ITC; color:#0000ff; ">thats a crazy viseo</Text></Message><Message Date="9/21/2008" Time="12:19:03 PM" DateTime="2008-09-21T02:19:03.798Z" SessionID="26"><From><User FriendlyName="- James O'"/></From><To><User FriendlyName="- alison [assessmenting]"/></To><Text Style="font-family:MS Shell Dlg; color:#000000; ">indeed</Text></Message><Message Date="9/21/2008" Time="12:20:15 PM" DateTime="2008-09-21T02:20:15.592Z" SessionID="27"><From><User FriendlyName="- alison [assessmenting]"/></From><To><User FriendlyName="- James O'"/></To><Text Style="font-family:Eras Medium ITC; color:#0000ff; ">omg</Text></Message><Message Date="9/21/2008" Time="12:20:28 PM" DateTime="2008-09-21T02:20:28.025Z" SessionID="27"><From><User FriendlyName="- alison [assessmenting]"/></From><To><User FriendlyName="- James O'"/></To><Text Style="font-family:Eras Medium ITC; color:#0000ff; ">thats the funniest video :) beagles too</Text></Message><Message Date="9/21/2008" Time="12:20:53 PM" DateTime="2008-09-21T02:20:53.777Z" SessionID="27"><From><User FriendlyName="- James O'"/></From><To><User FriendlyName="- alison [assessmenting]"/></To><Text Style="font-family:MS Shell Dlg; color:#000000; ">haha,yeh pretty nifty trick</Text></Message><Message Date="9/21/2008" Time="12:21:23 PM" DateTime="2008-09-21T02:21:23.984Z" SessionID="28"><From><User FriendlyName="- alison [assessmenting]"/></From><To><User FriendlyName="- James O'"/></To><Text Style="font-family:Eras Medium ITC; color:#0000ff; ">haha that video made my day.. haha. Been pretty crappy so far. and its so frrriken hot</Text></Message><Message Date="9/21/2008" Time="12:22:21 PM" DateTime="2008-09-21T02:22:21.216Z" SessionID="28"><From><User FriendlyName="- James O'"/></From><To><User FriendlyName="- alison [assessmenting]"/></To><Text Style="font-family:MS Shell Dlg; color:#000000; ">assignments?</Text></Message><Message Date="9/21/2008" Time="12:22:27 PM" DateTime="2008-09-21T02:22:27.022Z" SessionID="28"><From><User FriendlyName="- alison [assessmenting]"/></From><To><User FriendlyName="- James O'"/></To><Text Style="font-family:Eras Medium ITC; color:#0000ff; ">yeh</Text></Message><Message Date="9/21/2008" Time="12:22:39 PM" DateTime="2008-09-21T02:22:39.188Z" SessionID="28"><From><User FriendlyName="- James O'"/></From><To><User FriendlyName="- alison [assessmenting]"/></To><Text Style="font-family:MS Shell Dlg; color:#000000; ">mm, i gotta 20 minute presentation I gotta finish today</Text></Message><Message Date="9/21/2008" Time="12:22:40 PM" DateTime="2008-09-21T02:22:40.012Z" SessionID="28"><From><User FriendlyName="- James O'"/></From><To><User FriendlyName="- alison [assessmenting]"/></To><Text Style="font-family:MS Shell Dlg; color:#000000; ">ugh</Text></Message><Message Date="9/21/2008" Time="12:22:50 PM" DateTime="2008-09-21T02:22:50.777Z" SessionID="28"><From><User FriendlyName="- alison [assessmenting]"/></From><To><User FriendlyName="- James O'"/></To><Text Style="font-family:Eras Medium ITC; color:#0000ff; ">how much have u prepared?</Text></Message><Message Date="9/21/2008" Time="12:23:00 PM" DateTime="2008-09-21T02:23:00.135Z" SessionID="28"><From><User FriendlyName="- James O'"/></From><To><User FriendlyName="- alison [assessmenting]"/></To><Text Style="font-family:MS Shell Dlg; color:#000000; ">I started yesterday</Text></Message><Message Date="9/21/2008" Time="12:23:00 PM" DateTime="2008-09-21T02:23:00.823Z" SessionID="28"><From><User FriendlyName="- James O'"/></From><To><User FriendlyName="- alison [assessmenting]"/></To><Text Style="font-family:MS Shell Dlg; color:#000000; ">eh</Text></Message><Message Date="9/21/2008" Time="12:23:04 PM" DateTime="2008-09-21T02:23:04.150Z" SessionID="28"><From><User FriendlyName="- James O'"/></From><To><User FriendlyName="- alison [assessmenting]"/></To><Text Style="font-family:MS Shell Dlg; color:#000000; ">its just a seminar</Text></Message><Message Date="9/21/2008" Time="12:23:35 PM" DateTime="2008-09-21T02:23:35.869Z" SessionID="28"><From><User FriendlyName="- alison [assessmenting]"/></From><To><User FriendlyName="- James O'"/></To><Text Style="font-family:Eras Medium ITC; color:#0000ff; ">ahh okay.. some of those things u can kinda make up on the spot.. well minor details</Text></Message><Message Date="9/21/2008" Time="12:23:59 PM" DateTime="2008-09-21T02:23:59.951Z" SessionID="28"><From><User FriendlyName="- alison [assessmenting]"/></From><To><User FriendlyName="- James O'"/></To><Text Style="font-family:Eras Medium ITC; color:#0000ff; ">it would mostly be computer presentation though, right?</Text></Message><Message Date="9/21/2008" Time="12:24:05 PM" DateTime="2008-09-21T02:24:05.346Z" SessionID="28"><From><User FriendlyName="- James O'"/></From><To><User FriendlyName="- alison [assessmenting]"/></To><Text Style="font-family:MS Shell Dlg; color:#000000; ">mm</Text></Message><Message Date="9/21/2008" Time="12:24:27 PM" DateTime="2008-09-21T02:24:27.692Z" SessionID="29"><From><User FriendlyName="- alison [assessmenting]"/></From><To><User FriendlyName="- James O'"/></To><Text Style="font-family:Eras Medium ITC; color:#0000ff; ">fun, at least its not a 2000 word essay on wound infection and wound healing</Text></Message><Message Date="9/21/2008" Time="12:24:32 PM" DateTime="2008-09-21T02:24:32.156Z" SessionID="29"><From><User FriendlyName="- alison [assessmenting]"/></From><To><User FriendlyName="- James O'"/></To><Text Style="font-family:Eras Medium ITC; color:#0000ff; ">thats not as fun</Text></Message><Message Date="9/21/2008" Time="12:25:12 PM" DateTime="2008-09-21T02:25:12.839Z" SessionID="29"><From><User FriendlyName="- James O'"/></From><To><User FriendlyName="- alison [assessmenting]"/></To><Text Style="font-family:MS Shell Dlg; color:#000000; ">not nearly as</Text></Message><Message Date="9/21/2008" Time="12:25:49 PM" DateTime="2008-09-21T02:25:49.499Z" SessionID="30"><From><User FriendlyName="- alison [assessmenting]"/></From><To><User FriendlyName="- James O'"/></To><Text Style="font-family:Eras Medium ITC; color:#0000ff; ">its interesting but i hate actually doing it</Text></Message><Message Date="9/21/2008" Time="12:40:52 PM" DateTime="2008-09-21T02:40:52.216Z" SessionID="30"><From><User FriendlyName="- alison [assessmenting]"/></From><To><User FriendlyName="- James O'"/></To><Text Style="font-family:Eras Medium ITC; color:#0000ff; ">swap assessments much? :S</Text></Message><Message Date="9/21/2008" Time="9:41:03 PM" DateTime="2008-09-21T11:41:03.338Z" SessionID="31"><From><User FriendlyName="- alison [assessmenting]"/></From><To><User FriendlyName="- James O'"/></To><Text Style="font-family:Eras Medium ITC; color:#0000ff; ">u all ready for tomoro</Text></Message><Message Date="9/21/2008" Time="9:41:17 PM" DateTime="2008-09-21T11:41:17.929Z" SessionID="31"><From><User FriendlyName="- James O'"/></From><To><User FriendlyName="- alison [assessmenting]"/></To><Text Style="font-family:MS Shell Dlg; color:#000000; ">Ready as I'll never be</Text></Message><Message Date="9/21/2008" Time="9:41:31 PM" DateTime="2008-09-21T11:41:31.645Z" SessionID="32"><From><User FriendlyName="- alison [assessmenting]"/></From><To><User FriendlyName="- James O'"/></To><Text Style="font-family:Eras Medium ITC; color:#0000ff; ">kool</Text></Message><Message Date="9/21/2008" Time="10:15:01 PM" DateTime="2008-09-21T12:15:01.290Z" SessionID="33"><From><User FriendlyName="- alison [assessmenting]"/></From><To><User FriendlyName="- James O'"/></To><Text Style="font-family:Eras Medium ITC; color:#0000ff; ">ahh well im going full throttle now.. good luck tomoro with the seminar thingy</Text></Message><Message Date="9/21/2008" Time="10:15:01 PM" DateTime="2008-09-21T12:15:01.531Z" SessionID="33"><From><User FriendlyName="- alison [assessmenting]"/></From><To><User FriendlyName="- James O'"/></To><Text Style="font-family:Eras Medium ITC; color:#0000ff; ">night </Text></Message><Message Date="9/21/2008" Time="10:15:13 PM" DateTime="2008-09-21T12:15:13.335Z" SessionID="33"><From><User FriendlyName="- James O'"/></From><To><User FriendlyName="- alison [assessmenting]"/></To><Text Style="font-family:MS Shell Dlg; color:#000000; ">Night</Text></Message><Message Date="9/23/2008" Time="11:25:00 PM" DateTime="2008-09-23T13:25:00.698Z" SessionID="34"><From><User FriendlyName="- alison"/></From><To><User FriendlyName="- James O'"/></To><Text>your watching buffy?</Text></Message><Message Date="9/29/2008" Time="10:37:52 PM" DateTime="2008-09-29T12:37:52.068Z" SessionID="35"><From><User FriendlyName="- alison"/></From><To><User FriendlyName="- James O'"/></To><Text Style="font-family:Eras Medium ITC; color:#0000ff; ">hey</Text></Message><Message Date="9/29/2008" Time="10:38:05 PM" DateTime="2008-09-29T12:38:05.600Z" SessionID="35"><From><User FriendlyName="- James O'"/></From><To><User FriendlyName="- alison"/></To><Text Style="font-family:MS Shell Dlg; color:#000000; ">hi</Text></Message><Message Date="9/29/2008" Time="10:38:17 PM" DateTime="2008-09-29T12:38:17.153Z" SessionID="36"><From><User FriendlyName="- alison"/></From><To><User FriendlyName="- James O'"/></To><Text Style="font-family:Eras Medium ITC; color:#0000ff; ">how are you?</Text></Message><Message Date="9/29/2008" Time="10:38:26 PM" DateTime="2008-09-29T12:38:26.726Z" SessionID="36"><From><User FriendlyName="- James O'"/></From><To><User FriendlyName="- alison"/></To><Text Style="font-family:MS Shell Dlg; color:#000000; ">Cant complain</Text></Message><Message Date="9/29/2008" Time="10:39:17 PM" DateTime="2008-09-29T12:39:17.973Z" SessionID="37"><From><User FriendlyName="- alison"/></From><To><User FriendlyName="- James O'"/></To><Text Style="font-family:Eras Medium ITC; color:#0000ff; ">thts good</Text></Message><Message Date="9/29/2008" Time="10:39:22 PM" DateTime="2008-09-29T12:39:22.248Z" SessionID="37"><From><User FriendlyName="- alison"/></From><To><User FriendlyName="- James O'"/></To><Text Style="font-family:Eras Medium ITC; color:#0000ff; ">im bloody tired</Text></Message><Message Date="9/29/2008" Time="10:45:26 PM" DateTime="2008-09-29T12:45:26.210Z" SessionID="37"><From><User FriendlyName="- James O'"/></From><To><User FriendlyName="- alison"/></To><Text Style="font-family:MS Shell Dlg; color:#000000; ">I am creating a CD Cover</Text></Message><Message Date="9/29/2008" Time="10:45:38 PM" DateTime="2008-09-29T12:45:38.679Z" SessionID="38"><From><User FriendlyName="- alison"/></From><To><User FriendlyName="- James O'"/></To><Text Style="font-family:Eras Medium ITC; color:#0000ff; ">yeh, wat for?</Text></Message><Message Date="9/29/2008" Time="10:45:59 PM" DateTime="2008-09-29T12:45:59.240Z" SessionID="38"><From><User FriendlyName="- James O'"/></From><To><User FriendlyName="- alison"/></To><Text Style="font-family:MS Shell Dlg; color:#000000; ">mums friend</Text></Message><Message Date="9/29/2008" Time="10:46:08 PM" DateTime="2008-09-29T12:46:08.513Z" SessionID="39"><From><User FriendlyName="- alison"/></From><To><User FriendlyName="- James O'"/></To><Text Style="font-family:Eras Medium ITC; color:#0000ff; ">ahh kool</Text></Message><Message Date="9/29/2008" Time="10:47:59 PM" DateTime="2008-09-29T12:47:59.433Z" SessionID="39"><From><User FriendlyName="- James O'"/></From><To><User FriendlyName="- alison"/></To><Text Style="font-family:MS Shell Dlg; color:#000000; ">if he's happy with it I get some money too</Text></Message><Message Date="9/29/2008" Time="10:48:11 PM" DateTime="2008-09-29T12:48:11.130Z" SessionID="39"><From><User FriendlyName="- alison"/></From><To><User FriendlyName="- James O'"/></To><Text Style="font-family:Eras Medium ITC; color:#0000ff; ">yay :)</Text></Message><Message Date="9/29/2008" Time="10:57:03 PM" DateTime="2008-09-29T12:57:03.312Z" SessionID="39"><From><User FriendlyName="- James O'"/></From><To><User FriendlyName="- alison"/></To><Text Style="font-family:MS Shell Dlg; color:#000000; ">indeed</Text></Message><Message Date="9/29/2008" Time="10:57:12 PM" DateTime="2008-09-29T12:57:12.774Z" SessionID="39"><From><User FriendlyName="- James O'"/></From><To><User FriendlyName="- alison"/></To><Text Style="font-family:MS Shell Dlg; color:#000000; ">Never really done something like this on a profession level though</Text></Message><Message Date="9/29/2008" Time="10:57:36 PM" DateTime="2008-09-29T12:57:36.354Z" SessionID="39"><From><User FriendlyName="- alison"/></From><To><User FriendlyName="- James O'"/></To><Text Style="font-family:Eras Medium ITC; color:#0000ff; ">wat sort of cover are u doing?</Text></Message><Message Date="9/29/2008" Time="10:57:45 PM" DateTime="2008-09-29T12:57:45.110Z" SessionID="39"><From><User FriendlyName="- alison"/></From><To><User FriendlyName="- James O'"/></To><Text Style="font-family:Eras Medium ITC; color:#0000ff; ">u doing something in photoshop</Text></Message><Message Date="9/29/2008" Time="10:58:09 PM" DateTime="2008-09-29T12:58:09.112Z" SessionID="39"><From><User FriendlyName="- James O'"/></From><To><User FriendlyName="- alison"/></To><Text Style="font-family:MS Shell Dlg; color:#000000; ">Indesign mostly</Text></Message><Message Date="9/29/2008" Time="10:58:15 PM" DateTime="2008-09-29T12:58:15.582Z" SessionID="39"><From><User FriendlyName="- James O'"/></From><To><User FriendlyName="- alison"/></To><Text Style="font-family:MS Shell Dlg; color:#000000; ">which I've never worked with before</Text></Message><Message Date="9/29/2008" Time="10:58:23 PM" DateTime="2008-09-29T12:58:23.726Z" SessionID="39"><From><User FriendlyName="- alison"/></From><To><User FriendlyName="- James O'"/></To><Text Style="font-family:Eras Medium ITC; color:#0000ff; ">ahh ok\</Text></Message><Message Date="9/29/2008" Time="11:09:28 PM" DateTime="2008-09-29T13:09:28.995Z" SessionID="39"><From><User FriendlyName="- alison"/></From><To><User FriendlyName="- James O'"/></To><Text Style="font-family:Eras Medium ITC; color:#0000ff; ">anyways im dying of tiredness.. 8,5 hour shifts are hard</Text></Message><Message Date="9/29/2008" Time="11:09:37 PM" DateTime="2008-09-29T13:09:37.648Z" SessionID="39"><From><User FriendlyName="- alison"/></From><To><User FriendlyName="- James O'"/></To><Text Style="font-family:Eras Medium ITC; color:#0000ff; ">ttyl</Text></Message><Message Date="10/2/2008" Time="10:20:06 PM" DateTime="2008-10-02T12:20:06.400Z" SessionID="40"><From><User FriendlyName="- alison"/></From><To><User FriendlyName="- James O'"/></To><Text Style="font-family:Eras Medium ITC; color:#0000ff; ">hey</Text></Message><Message Date="10/2/2008" Time="10:21:00 PM" DateTime="2008-10-02T12:21:00.792Z" SessionID="40"><From><User FriendlyName="- James O'"/></From><To><User FriendlyName="- alison"/></To><Text Style="font-family:MS Shell Dlg; color:#000000; ">hi</Text></Message><Message Date="10/2/2008" Time="10:21:16 PM" DateTime="2008-10-02T12:21:16.810Z" SessionID="41"><From><User FriendlyName="- alison"/></From><To><User FriendlyName="- James O'"/></To><Text Style="font-family:Eras Medium ITC; color:#0000ff; ">wat episode are you up to in Heroes?</Text></Message><Message Date="10/2/2008" Time="10:21:36 PM" DateTime="2008-10-02T12:21:36.795Z" SessionID="41"><From><User FriendlyName="- James O'"/></From><To><User FriendlyName="- alison"/></To><Text Style="font-family:MS Shell Dlg; color:#000000; ">3...</Text></Message><Message Date="10/2/2008" Time="10:21:57 PM" DateTime="2008-10-02T12:21:57.201Z" SessionID="41"><From><User FriendlyName="- alison"/></From><To><User FriendlyName="- James O'"/></To><Text Style="font-family:Eras Medium ITC; color:#0000ff; ">ok</Text></Message><Message Date="10/2/2008" Time="10:23:50 PM" DateTime="2008-10-02T12:23:50.796Z" SessionID="41"><From><User FriendlyName="- James O'"/></From><To><User FriendlyName="- alison"/></To><Text Style="font-family:MS Shell Dlg; color:#000000; ">You been watching it?</Text></Message><Message Date="10/2/2008" Time="10:24:06 PM" DateTime="2008-10-02T12:24:06.574Z" SessionID="41"><From><User FriendlyName="- alison"/></From><To><User FriendlyName="- James O'"/></To><Text Style="font-family:Eras Medium ITC; color:#0000ff; ">nope:(</Text></Message><Message Date="10/2/2008" Time="10:24:31 PM" DateTime="2008-10-02T12:24:31.463Z" SessionID="41"><From><User FriendlyName="- alison"/></From><To><User FriendlyName="- James O'"/></To><Text Style="font-family:Eras Medium ITC; color:#0000ff; ">capped and very little time to watch if i wasnt capped</Text></Message><Message Date="10/2/2008" Time="10:25:34 PM" DateTime="2008-10-02T12:25:34.429Z" SessionID="41"><From><User FriendlyName="- alison"/></From><To><User FriendlyName="- James O'"/></To><Text Style="font-family:Eras Medium ITC; color:#0000ff; ">i cant wait for the weekend, huh. your on holidays?</Text></Message><Message Date="10/2/2008" Time="10:25:41 PM" DateTime="2008-10-02T12:25:41.988Z" SessionID="41"><From><User FriendlyName="- James O'"/></From><To><User FriendlyName="- alison"/></To><Text Style="font-family:MS Shell Dlg; color:#000000; ">yeh</Text></Message><Message Date="10/2/2008" Time="10:25:45 PM" DateTime="2008-10-02T12:25:45.972Z" SessionID="41"><From><User FriendlyName="- James O'"/></From><To><User FriendlyName="- alison"/></To><Text Style="font-family:MS Shell Dlg; color:#000000; ">lots of work to do</Text></Message><Message Date="10/2/2008" Time="10:25:51 PM" DateTime="2008-10-02T12:25:51.363Z" SessionID="41"><From><User FriendlyName="- James O'"/></From><To><User FriendlyName="- alison"/></To><Text Style="font-family:MS Shell Dlg; color:#000000; ">very little being done</Text></Message><Message Date="10/2/2008" Time="10:26:08 PM" DateTime="2008-10-02T12:26:08.145Z" SessionID="42"><From><User FriendlyName="- alison"/></From><To><User FriendlyName="- James O'"/></To><Text Style="font-family:Eras Medium ITC; color:#0000ff; ">do u have work for the holidays to do?</Text></Message><Message Date="10/2/2008" Time="10:26:15 PM" DateTime="2008-10-02T12:26:15.938Z" SessionID="42"><From><User FriendlyName="- James O'"/></From><To><User FriendlyName="- alison"/></To><Text Style="font-family:MS Shell Dlg; color:#000000; ">*shrugs*</Text></Message><Message Date="10/2/2008" Time="10:26:17 PM" DateTime="2008-10-02T12:26:17.664Z" SessionID="42"><From><User FriendlyName="- James O'"/></From><To><User FriendlyName="- alison"/></To><Text Style="font-family:MS Shell Dlg; color:#000000; ">Dont think so</Text></Message><Message Date="10/2/2008" Time="10:26:53 PM" DateTime="2008-10-02T12:26:53.581Z" SessionID="42"><From><User FriendlyName="- James O'"/></From><To><User FriendlyName="- alison"/></To><Text Style="font-family:MS Shell Dlg; color:#000000; ">I'll hopefully finally have some free programming time though</Text></Message><Message Date="10/2/2008" Time="10:28:00 PM" DateTime="2008-10-02T12:28:00.830Z" SessionID="43"><From><User FriendlyName="- alison"/></From><To><User FriendlyName="- James O'"/></To><Text Style="font-family:Eras Medium ITC; color:#0000ff; ">ahh thats good.. during my break i had to do an assessment. and i have been working at hosp all this week</Text></Message><Message Date="10/2/2008" Time="10:28:03 PM" DateTime="2008-10-02T12:28:03.833Z" SessionID="43"><From><User FriendlyName="- alison"/></From><To><User FriendlyName="- James O'"/></To><Text Style="font-family:Eras Medium ITC; color:#0000ff; ">very tiring</Text></Message><Message Date="10/2/2008" Time="10:30:46 PM" DateTime="2008-10-02T12:30:46.337Z" SessionID="43"><From><User FriendlyName="- James O'"/></From><To><User FriendlyName="- alison"/></To><Text Style="font-family:MS Shell Dlg; color:#000000; ">I bet</Text></Message><Message Date="10/2/2008" Time="10:30:50 PM" DateTime="2008-10-02T12:30:50.224Z" SessionID="43"><From><User FriendlyName="- James O'"/></From><To><User FriendlyName="- alison"/></To><Text Style="font-family:MS Shell Dlg; color:#000000; ">Enjoying it though?</Text></Message><Message Date="10/2/2008" Time="10:31:02 PM" DateTime="2008-10-02T12:31:02.694Z" SessionID="43"><From><User FriendlyName="- James O'"/></From><To><User FriendlyName="- alison"/></To><Text Style="font-family:MS Shell Dlg; color:#000000; ">Or atleast, enjoying the new experiences?</Text></Message><Message Date="10/2/2008" Time="10:33:44 PM" DateTime="2008-10-02T12:33:44.698Z" SessionID="44"><From><User FriendlyName="- alison"/></From><To><User FriendlyName="- James O'"/></To><Text Style="font-family:Eras Medium ITC; color:#0000ff; ">yeh im liking it, im working in an orthopaedic ward which is practically about repairing bones post operatively. i have to bed pans, showering, obs (blood pressure, temp, pulse) and helping with eating. Its pretty much just old people. But i honestly havent hated it, but yeh.. </Text></Message><Message Date="10/2/2008" Time="10:34:06 PM" DateTime="2008-10-02T12:34:06.912Z" SessionID="44"><From><User FriendlyName="- alison"/></From><To><User FriendlyName="- James O'"/></To><Text Style="font-family:Eras Medium ITC; color:#0000ff; ">i wouldnt want to do it forevr</Text></Message><Message Date="10/2/2008" Time="10:34:20 PM" DateTime="2008-10-02T12:34:20.294Z" SessionID="44"><From><User FriendlyName="- alison"/></From><To><User FriendlyName="- James O'"/></To><Text Style="font-family:Eras Medium ITC; color:#0000ff; ">one week is enough.. changing wards next week</Text></Message><Message Date="10/2/2008" Time="10:39:00 PM" DateTime="2008-10-02T12:39:00.888Z" SessionID="44"><From><User FriendlyName="- alison"/></From><To><User FriendlyName="- James O'"/></To><Text Style="font-family:Eras Medium ITC; color:#0000ff; ">im getting assessed on the admin. of a subcutaneous injection tomoro. :S im scareded</Text></Message><Message Date="10/2/2008" Time="10:44:56 PM" DateTime="2008-10-02T12:44:56.368Z" SessionID="44"><From><User FriendlyName="- James O'"/></From><To><User FriendlyName="- alison"/></To><Text Style="font-family:MS Shell Dlg; color:#000000; ">omg I found it!</Text></Message><Message Date="10/2/2008" Time="10:45:26 PM" DateTime="2008-10-02T12:45:26.491Z" SessionID="44"><From><User FriendlyName="- James O'"/></From><To><User FriendlyName="- alison"/></To><Text Style="font-family:MS Shell Dlg; color:#000000; ">wait, sorry wrong convo</Text></Message><Message Date="10/2/2008" Time="10:46:03 PM" DateTime="2008-10-02T12:46:03.431Z" SessionID="45"><From><User FriendlyName="- alison"/></From><To><User FriendlyName="- James O'"/></To><Text Style="font-family:Eras Medium ITC; color:#0000ff; ">lol</Text></Message><Message Date="10/2/2008" Time="10:46:13 PM" DateTime="2008-10-02T12:46:13.486Z" SessionID="45"><From><User FriendlyName="- James O'"/></From><To><User FriendlyName="- alison"/></To><Text Style="font-family:MS Shell Dlg; color:#000000; ">sorry, I found some sheet music </Text></Message><Message Date="10/2/2008" Time="10:46:26 PM" DateTime="2008-10-02T12:46:26.280Z" SessionID="46"><From><User FriendlyName="- alison"/></From><To><User FriendlyName="- James O'"/></To><Text Style="font-family:Eras Medium ITC; color:#0000ff; ">coolio</Text></Message><Message Date="10/2/2008" Time="10:46:48 PM" DateTime="2008-10-02T12:46:48.503Z" SessionID="46"><From><User FriendlyName="- alison"/></From><To><User FriendlyName="- James O'"/></To><Text Style="font-family:Eras Medium ITC; color:#0000ff; ">hows the Banjo? im guessing its sheet music for piano</Text></Message><Message Date="10/2/2008" Time="10:48:05 PM" DateTime="2008-10-02T12:48:05.112Z" SessionID="46"><From><User FriendlyName="- James O'"/></From><To><User FriendlyName="- alison"/></To><Text Style="font-family:MS Shell Dlg; color:#000000; ">yeh, banjo does tabs,</Text></Message><Message Date="10/2/2008" Time="10:48:15 PM" DateTime="2008-10-02T12:48:15.989Z" SessionID="46"><From><User FriendlyName="- James O'"/></From><To><User FriendlyName="- alison"/></To><Text Style="font-family:MS Shell Dlg; color:#000000; ">its good, can strum out a few songs now</Text></Message><Message Date="10/2/2008" Time="10:48:26 PM" DateTime="2008-10-02T12:48:26.707Z" SessionID="47"><From><User FriendlyName="- alison"/></From><To><User FriendlyName="- James O'"/></To><Text Style="font-family:Eras Medium ITC; color:#0000ff; ">nod1</Text></Message><Message Date="10/2/2008" Time="10:48:55 PM" DateTime="2008-10-02T12:48:55.506Z" SessionID="47"><From><User FriendlyName="- alison"/></From><To><User FriendlyName="- James O'"/></To><Text Style="font-family:Eras Medium ITC; color:#0000ff; ">my dads into guitars</Text></Message><Message Date="10/2/2008" Time="10:49:36 PM" DateTime="2008-10-02T12:49:36.394Z" SessionID="47"><From><User FriendlyName="- alison"/></From><To><User FriendlyName="- James O'"/></To><Text Style="font-family:Eras Medium ITC; color:#0000ff; ">he bought an amp the other day, and didnt like it much so he went out and bought a fender amp. lol he spent more than a grand on amps</Text></Message><Message Date="10/2/2008" Time="10:49:49 PM" DateTime="2008-10-02T12:49:49.171Z" SessionID="47"><From><User FriendlyName="- alison"/></From><To><User FriendlyName="- James O'"/></To><Text Style="font-family:Eras Medium ITC; color:#0000ff; ">in 2 weeks</Text></Message><Message Date="10/2/2008" Time="10:55:50 PM" DateTime="2008-10-02T12:55:50.348Z" SessionID="48"><From><User FriendlyName="- alison"/></From><To><User FriendlyName="- James O'"/></To><Text Style="font-family:Eras Medium ITC; color:#0000ff; ">im going to bed</Text></Message><Message Date="10/2/2008" Time="10:55:51 PM" DateTime="2008-10-02T12:55:51.485Z" SessionID="48"><From><User FriendlyName="- alison"/></From><To><User FriendlyName="- James O'"/></To><Text Style="font-family:Eras Medium ITC; color:#0000ff; ">nigh</Text></Message><Message Date="10/2/2008" Time="10:55:52 PM" DateTime="2008-10-02T12:55:52.614Z" SessionID="48"><From><User FriendlyName="- alison"/></From><To><User FriendlyName="- James O'"/></To><Text Style="font-family:Eras Medium ITC; color:#0000ff; ">t</Text></Message><Message Date="10/2/2008" Time="10:56:32 PM" DateTime="2008-10-02T12:56:32.473Z" SessionID="48"><From><User FriendlyName="- James O'"/></From><To><User FriendlyName="- alison"/></To><Text Style="font-family:MS Shell Dlg; color:#000000; ">night
t</Text></Message><Message Date="10/5/2008" Time="1:42:09 PM" DateTime="2008-10-05T02:42:09.478Z" SessionID="49"><From><User FriendlyName="- alison"/></From><To><User FriendlyName="- James O'"/></To><Text Style="font-family:Eras Medium ITC; color:#0000ff; ">Heya</Text></Message><Message Date="10/6/2008" Time="12:44:22 AM" DateTime="2008-10-05T13:44:22.112Z" SessionID="50"><From><User FriendlyName="- James O'"/></From><To><User FriendlyName="- alison"/></To><Text Style="font-family:MS Shell Dlg; color:#000000; ">http://www.youtube.com/watch?v=4DxU1wJgSHE</Text></Message><Message Date="10/6/2008" Time="2:54:12 PM" DateTime="2008-10-06T03:54:12.162Z" SessionID="51"><From><User FriendlyName="- alison"/></From><To><User FriendlyName="- James O'"/></To><Text Style="font-family:Eras Medium ITC; color:#0000ff; ">heya</Text></Message><Message Date="10/6/2008" Time="2:54:41 PM" DateTime="2008-10-06T03:54:41.079Z" SessionID="51"><From><User FriendlyName="- alison"/></From><To><User FriendlyName="- James O'"/></To><Text Style="font-family:Eras Medium ITC; color:#0000ff; ">that accapella group is really good huh. Got ya link from last night ^^</Text></Message><Message Date="10/6/2008" Time="2:56:21 PM" DateTime="2008-10-06T03:56:21.882Z" SessionID="51"><From><User FriendlyName="- alison"/></From><To><User FriendlyName="- James O'"/></To><Text Style="font-family:Eras Medium ITC; color:#0000ff; ">and is your personal message a quote from Scrubs? the one where Brendan frasers' character dies?</Text></Message><Message Date="10/6/2008" Time="2:56:38 PM" DateTime="2008-10-06T03:56:38.792Z" SessionID="51"><From><User FriendlyName="- James O'"/></From><To><User FriendlyName="- alison"/></To><Text Style="font-family:MS Shell Dlg; color:#000000; ">Yes</Text></Message><Message Date="10/6/2008" Time="2:57:01 PM" DateTime="2008-10-06T03:57:01.722Z" SessionID="52"><From><User FriendlyName="- alison"/></From><To><User FriendlyName="- James O'"/></To><Text Style="font-family:Eras Medium ITC; color:#0000ff; ">Have no idea how i picked up on that :S</Text></Message><Message Date="10/6/2008" Time="2:57:03 PM" DateTime="2008-10-06T03:57:03.105Z" SessionID="52"><From><User FriendlyName="- alison"/></From><To><User FriendlyName="- James O'"/></To><Text Style="font-family:Eras Medium ITC; color:#0000ff; ">hah</Text></Message><Message Date="10/6/2008" Time="2:58:25 PM" DateTime="2008-10-06T03:58:25.320Z" SessionID="53"><From><User FriendlyName="- alison"/></From><To><User FriendlyName="- James O'"/></To><Text Style="font-family:Eras Medium ITC; color:#0000ff; ">what are you up to?</Text></Message><Message Date="10/6/2008" Time="2:59:05 PM" DateTime="2008-10-06T03:59:05.230Z" SessionID="53"><From><User FriendlyName="- James O'"/></From><To><User FriendlyName="- alison"/></To><Text Style="font-family:MS Shell Dlg; color:#000000; ">Not a lot</Text></Message><Message Date="10/6/2008" Time="2:59:33 PM" DateTime="2008-10-06T03:59:33.813Z" SessionID="53"><From><User FriendlyName="- alison"/></From><To><User FriendlyName="- James O'"/></To><Text Style="font-family:Eras Medium ITC; color:#0000ff; ">im so glad i had today odd</Text></Message><Message Date="10/6/2008" Time="2:59:35 PM" DateTime="2008-10-06T03:59:35.053Z" SessionID="53"><From><User FriendlyName="- alison"/></From><To><User FriendlyName="- James O'"/></To><Text Style="font-family:Eras Medium ITC; color:#0000ff; ">off</Text></Message><Message Date="10/6/2008" Time="3:06:45 PM" DateTime="2008-10-06T04:06:45.835Z" SessionID="54"><From><User FriendlyName="- alison"/></From><To><User FriendlyName="- James O'"/></To><Text Style="font-family:Eras Medium ITC; color:#0000ff; ">anyways back to work :(</Text></Message><Message Date="10/6/2008" Time="3:06:47 PM" DateTime="2008-10-06T04:06:47.791Z" SessionID="54"><From><User FriendlyName="- alison"/></From><To><User FriendlyName="- James O'"/></To><Text Style="font-family:Eras Medium ITC; color:#0000ff; ">bye </Text></Message><Message Date="10/6/2008" Time="3:07:08 PM" DateTime="2008-10-06T04:07:08.450Z" SessionID="54"><From><User FriendlyName="- James O'"/></From><To><User FriendlyName="- alison"/></To><Text Style="font-family:MS Shell Dlg; color:#000000; ">bibi</Text></Message><Message Date="10/7/2008" Time="12:52:27 AM" DateTime="2008-10-06T13:52:27.457Z" SessionID="55"><From><User FriendlyName="- alison"/></From><To><User FriendlyName="- James O'"/></To><Text Style="font-family:Eras Medium ITC; color:#0000ff; ">do you ever go to bed early?</Text></Message><Message Date="10/7/2008" Time="12:52:44 AM" DateTime="2008-10-06T13:52:44.102Z" SessionID="55"><From><User FriendlyName="- James O'"/></From><To><User FriendlyName="- alison"/></To><Text Style="font-family:MS Shell Dlg; color:#000000; ">not really</Text></Message><Message Date="10/7/2008" Time="12:53:05 AM" DateTime="2008-10-06T13:53:05.513Z" SessionID="55"><From><User FriendlyName="- alison"/></From><To><User FriendlyName="- James O'"/></To><Text Style="font-family:Eras Medium ITC; color:#0000ff; ">haha</Text></Message><Message Date="10/7/2008" Time="12:57:06 AM" DateTime="2008-10-06T13:57:06.504Z" SessionID="55"><From><User FriendlyName="- alison"/></From><To><User FriendlyName="- James O'"/></To><Text Style="font-family:Eras Medium ITC; color:#0000ff; ">uni tomoro? early?</Text></Message><Message Date="10/7/2008" Time="12:57:14 AM" DateTime="2008-10-06T13:57:14.199Z" SessionID="55"><From><User FriendlyName="- James O'"/></From><To><User FriendlyName="- alison"/></To><Text Style="font-family:MS Shell Dlg; color:#000000; ">no and no</Text></Message><Message Date="10/7/2008" Time="12:57:40 AM" DateTime="2008-10-06T13:57:40.747Z" SessionID="55"><From><User FriendlyName="- alison"/></From><To><User FriendlyName="- James O'"/></To><Text Style="font-family:Eras Medium ITC; color:#0000ff; ">day off? or week off?</Text></Message><Message Date="10/7/2008" Time="12:58:01 AM" DateTime="2008-10-06T13:58:01.507Z" SessionID="55"><From><User FriendlyName="- James O'"/></From><To><User FriendlyName="- alison"/></To><Text Style="font-family:MS Shell Dlg; color:#000000; ">careful time management planning and compromise</Text></Message><Message Date="10/7/2008" Time="12:58:12 AM" DateTime="2008-10-06T13:58:12.896Z" SessionID="55"><From><User FriendlyName="- James O'"/></From><To><User FriendlyName="- alison"/></To><Text Style="font-family:MS Shell Dlg; color:#000000; ">ie, only got a lecture on</Text></Message><Message Date="10/7/2008" Time="12:58:19 AM" DateTime="2008-10-06T13:58:19.471Z" SessionID="55"><From><User FriendlyName="- James O'"/></From><To><User FriendlyName="- alison"/></To><Text Style="font-family:MS Shell Dlg; color:#000000; ">and trains aren't running</Text></Message><Message Date="10/7/2008" Time="12:58:35 AM" DateTime="2008-10-06T13:58:35.896Z" SessionID="55"><From><User FriendlyName="- alison"/></From><To><User FriendlyName="- James O'"/></To><Text Style="font-family:Eras Medium ITC; color:#0000ff; ">trains arent running?</Text></Message><Message Date="10/7/2008" Time="12:58:43 AM" DateTime="2008-10-06T13:58:43.305Z" SessionID="55"><From><User FriendlyName="- James O'"/></From><To><User FriendlyName="- alison"/></To><Text Style="font-family:MS Shell Dlg; color:#000000; ">on the country line</Text></Message><Message Date="10/7/2008" Time="12:58:59 AM" DateTime="2008-10-06T13:58:59.837Z" SessionID="55"><From><User FriendlyName="- alison"/></From><To><User FriendlyName="- James O'"/></To><Text Style="font-family:Eras Medium ITC; color:#0000ff; ">ahh ok</Text></Message><Message Date="10/7/2008" Time="1:01:42 AM" DateTime="2008-10-06T14:01:42.903Z" SessionID="55"><From><User FriendlyName="- James O'"/></From><To><User FriendlyName="- alison"/></To><Text Style="font-family:MS Shell Dlg; color:#000000; ">jess and jon broke up</Text></Message><Message Date="10/7/2008" Time="1:01:55 AM" DateTime="2008-10-06T14:01:55.390Z" SessionID="55"><From><User FriendlyName="- alison"/></From><To><User FriendlyName="- James O'"/></To><Text Style="font-family:Eras Medium ITC; color:#0000ff; ">really?</Text></Message><Message Date="10/7/2008" Time="1:02:12 AM" DateTime="2008-10-06T14:02:12.693Z" SessionID="55"><From><User FriendlyName="- alison"/></From><To><User FriendlyName="- James O'"/></To><Text Style="font-family:Eras Medium ITC; color:#0000ff; ">geez, never thought that would happen</Text></Message><Message Date="10/7/2008" Time="1:03:04 AM" DateTime="2008-10-06T14:03:04.886Z" SessionID="55"><From><User FriendlyName="- alison"/></From><To><User FriendlyName="- James O'"/></To><Text Style="font-family:Eras Medium ITC; color:#0000ff; ">after deep and meaninful with her a few months back :S</Text></Message><Message Date="10/7/2008" Time="1:03:20 AM" DateTime="2008-10-06T14:03:20.203Z" SessionID="55"><From><User FriendlyName="- alison"/></From><To><User FriendlyName="- James O'"/></To><Text Style="font-family:Eras Medium ITC; color:#0000ff; ">anyways im going to sleep</Text></Message><Message Date="10/7/2008" Time="1:03:26 AM" DateTime="2008-10-06T14:03:26.235Z" SessionID="55"><From><User FriendlyName="- James O'"/></From><To><User FriendlyName="- alison"/></To><Text Style="font-family:MS Shell Dlg; color:#000000; ">Likewise</Text></Message><Message Date="10/7/2008" Time="1:03:39 AM" DateTime="2008-10-06T14:03:39.267Z" SessionID="55"><From><User FriendlyName="- James O'"/></From><To><User FriendlyName="- alison"/></To><Text Style="font-family:MS Shell Dlg; color:#000000; ">Podcasts to catch up on</Text></Message><Message Date="10/7/2008" Time="1:03:55 AM" DateTime="2008-10-06T14:03:55.313Z" SessionID="55"><From><User FriendlyName="- James O'"/></From><To><User FriendlyName="- alison"/></To><Text Style="font-family:MS Shell Dlg; color:#000000; ">It happend cause of a parental intervention I believe</Text></Message><Message Date="10/7/2008" Time="1:04:09 AM" DateTime="2008-10-06T14:04:09.738Z" SessionID="55"><From><User FriendlyName="- alison"/></From><To><User FriendlyName="- James O'"/></To><Text Style="font-family:Eras Medium ITC; color:#0000ff; ">oh</Text></Message><Message Date="10/7/2008" Time="1:04:11 AM" DateTime="2008-10-06T14:04:11.377Z" SessionID="55"><From><User FriendlyName="- James O'"/></From><To><User FriendlyName="- alison"/></To><Text Style="font-family:MS Shell Dlg; color:#000000; ">Family got involved, both sides says the other is not allowed in there house</Text></Message><Message Date="10/7/2008" Time="1:04:41 AM" DateTime="2008-10-06T14:04:41.304Z" SessionID="55"><From><User FriendlyName="- alison"/></From><To><User FriendlyName="- James O'"/></To><Text Style="font-family:Eras Medium ITC; color:#0000ff; ">ahh :S sounds crazy</Text></Message><Message Date="10/7/2008" Time="1:04:47 AM" DateTime="2008-10-06T14:04:47.474Z" SessionID="55"><From><User FriendlyName="- James O'"/></From><To><User FriendlyName="- alison"/></To><Text Style="font-family:MS Shell Dlg; color:#000000; ">mm indeed</Text></Message><Message Date="10/7/2008" Time="1:05:01 AM" DateTime="2008-10-06T14:05:01.641Z" SessionID="55"><From><User FriendlyName="- James O'"/></From><To><User FriendlyName="- alison"/></To><Text Style="font-family:MS Shell Dlg; color:#000000; ">Anywho, bibi</Text></Message><Message Date="10/7/2008" Time="1:05:11 AM" DateTime="2008-10-06T14:05:11.910Z" SessionID="55"><From><User FriendlyName="- James O'"/></From><To><User FriendlyName="- alison"/></To><Text Style="font-family:MS Shell Dlg; color:#000000; ">gotta see a man about a podcast</Text></Message><Message Date="10/9/2008" Time="10:49:23 AM" DateTime="2008-10-08T23:49:23.259Z" SessionID="56"><From><User FriendlyName="- alison"/></From><To><User FriendlyName="- James O'"/></To><Text Style="font-family:Eras Medium ITC; color:#0000ff; ">are you going to oatley on friday night?</Text></Message><Message Date="10/9/2008" Time="10:49:56 AM" DateTime="2008-10-08T23:49:56.530Z" SessionID="56"><From><User FriendlyName="- James O'"/></From><To><User FriendlyName="- alison"/></To><Text Style="font-family:MS Shell Dlg; color:#000000; ">apparently not</Text></Message><Message Date="10/9/2008" Time="10:51:28 AM" DateTime="2008-10-08T23:51:28.886Z" SessionID="57"><From><User FriendlyName="- alison"/></From><To><User FriendlyName="- James O'"/></To><Text Style="font-family:Eras Medium ITC; color:#0000ff; ">I was going to, but jess wants to get smashed.. so im going to pick her up after work and take her home.. Her and nikki and some other girls are going to Cronulla RSl.. so i will have fun driving drunk people around *-)</Text></Message><Message Date="10/9/2008" Time="10:51:49 AM" DateTime="2008-10-08T23:51:49.760Z" SessionID="57"><From><User FriendlyName="- James O'"/></From><To><User FriendlyName="- alison"/></To><Text Style="font-family:MS Shell Dlg; color:#000000; ">Ah</Text></Message><Message Date="10/9/2008" Time="10:51:50 AM" DateTime="2008-10-08T23:51:50.614Z" SessionID="57"><From><User FriendlyName="- James O'"/></From><To><User FriendlyName="- alison"/></To><Text Style="font-family:MS Shell Dlg; color:#000000; ">enjoy</Text></Message><Message Date="10/9/2008" Time="10:52:01 AM" DateTime="2008-10-08T23:52:01.059Z" SessionID="58"><From><User FriendlyName="- alison"/></From><To><User FriendlyName="- James O'"/></To><Text Style="font-family:Eras Medium ITC; color:#0000ff; ">yeh</Text></Message><Message Date="10/9/2008" Time="10:52:48 AM" DateTime="2008-10-08T23:52:48.120Z" SessionID="58"><From><User FriendlyName="- alison"/></From><To><User FriendlyName="- James O'"/></To><Text Style="font-family:Eras Medium ITC; color:#0000ff; ">but if i was going to oatley i would drink anyways.. im not allowed to anymore.. but i dont really care... </Text></Message><Message Date="10/9/2008" Time="10:54:12 AM" DateTime="2008-10-08T23:54:12.589Z" SessionID="59"><From><User FriendlyName="- alison"/></From><To><User FriendlyName="- James O'"/></To><Text Style="font-family:Eras Medium ITC; color:#0000ff; ">driving is just an excuse to not drink for my reasons</Text></Message><Message Date="10/9/2008" Time="10:54:25 AM" DateTime="2008-10-08T23:54:25.228Z" SessionID="59"><From><User FriendlyName="- James O'"/></From><To><User FriendlyName="- alison"/></To><Text Style="font-family:MS Shell Dlg; color:#000000; ">ok...</Text></Message><Message Date="10/9/2008" Time="10:56:50 AM" DateTime="2008-10-08T23:56:50.790Z" SessionID="60"><From><User FriendlyName="- alison"/></From><To><User FriendlyName="- James O'"/></To><Text Style="font-family:Eras Medium ITC; color:#0000ff; ">anyways gtg, going for a run before work</Text></Message><Message Date="10/9/2008" Time="10:56:52 AM" DateTime="2008-10-08T23:56:52.047Z" SessionID="60"><From><User FriendlyName="- alison"/></From><To><User FriendlyName="- James O'"/></To><Text Style="font-family:Eras Medium ITC; color:#0000ff; ">ciao</Text></Message><Message Date="10/9/2008" Time="10:57:22 AM" DateTime="2008-10-08T23:57:22.728Z" SessionID="60"><From><User FriendlyName="- James O'"/></From><To><User FriendlyName="- alison"/></To><Text Style="font-family:MS Shell Dlg; color:#000000; ">bye</Text></Message><Message Date="10/11/2008" Time="12:08:56 AM" DateTime="2008-10-10T13:08:56.171Z" SessionID="61"><From><User FriendlyName="- alison"/></From><To><User FriendlyName="- James O'"/></To><Text Style="font-family:Eras Medium ITC; color:#0000ff; ">hey</Text></Message><Message Date="10/11/2008" Time="12:09:08 AM" DateTime="2008-10-10T13:09:08.029Z" SessionID="61"><From><User FriendlyName="- James O'"/></From><To><User FriendlyName="- alison"/></To><Text Style="font-family:MS Shell Dlg; color:#000000; ">hi</Text></Message><Message Date="10/11/2008" Time="12:09:16 AM" DateTime="2008-10-10T13:09:16.495Z" SessionID="61"><From><User FriendlyName="- alison"/></From><To><User FriendlyName="- James O'"/></To><Text Style="font-family:Eras Medium ITC; color:#0000ff; ">how was the party?</Text></Message><Message Date="10/11/2008" Time="12:09:23 AM" DateTime="2008-10-10T13:09:23.515Z" SessionID="61"><From><User FriendlyName="- James O'"/></From><To><User FriendlyName="- alison"/></To><Text Style="font-family:MS Shell Dlg; color:#000000; ">good</Text></Message><Message Date="10/11/2008" Time="12:09:41 AM" DateTime="2008-10-10T13:09:41.280Z" SessionID="61"><From><User FriendlyName="- alison"/></From><To><User FriendlyName="- James O'"/></To><Text Style="font-family:Eras Medium ITC; color:#0000ff; ">did u say bexelly park?</Text></Message><Message Date="10/11/2008" Time="12:09:55 AM" DateTime="2008-10-10T13:09:55.134Z" SessionID="61"><From><User FriendlyName="- James O'"/></From><To><User FriendlyName="- alison"/></To><Text Style="font-family:MS Shell Dlg; color:#000000; ">No</Text></Message><Message Date="10/11/2008" Time="12:10:04 AM" DateTime="2008-10-10T13:10:04.276Z" SessionID="61"><From><User FriendlyName="- James O'"/></From><To><User FriendlyName="- alison"/></To><Text Style="font-family:MS Shell Dlg; color:#000000; ">Umm, Beverely</Text></Message><Message Date="10/11/2008" Time="12:10:14 AM" DateTime="2008-10-10T13:10:14.094Z" SessionID="61"><From><User FriendlyName="- alison"/></From><To><User FriendlyName="- James O'"/></To><Text Style="font-family:Eras Medium ITC; color:#0000ff; ">is that near beverly hills?</Text></Message><Message Date="10/11/2008" Time="12:10:32 AM" DateTime="2008-10-10T13:10:32.923Z" SessionID="61"><From><User FriendlyName="- James O'"/></From><To><User FriendlyName="- alison"/></To><Text Style="font-family:MS Shell Dlg; color:#000000; ">Its, round kograh area?</Text></Message><Message Date="10/11/2008" Time="12:10:35 AM" DateTime="2008-10-10T13:10:35.432Z" SessionID="61"><From><User FriendlyName="- James O'"/></From><To><User FriendlyName="- alison"/></To><Text Style="font-family:MS Shell Dlg; color:#000000; ">perhaps</Text></Message><Message Date="10/11/2008" Time="12:10:39 AM" DateTime="2008-10-10T13:10:39.968Z" SessionID="61"><From><User FriendlyName="- James O'"/></From><To><User FriendlyName="- alison"/></To><Text Style="font-family:MS Shell Dlg; color:#000000; ">just off the princess highway</Text></Message><Message Date="10/11/2008" Time="12:10:48 AM" DateTime="2008-10-10T13:10:48.709Z" SessionID="61"><From><User FriendlyName="- alison"/></From><To><User FriendlyName="- James O'"/></To><Text Style="font-family:Eras Medium ITC; color:#0000ff; ">beverly hills is practically next to kograh</Text></Message><Message Date="10/11/2008" Time="12:10:50 AM" DateTime="2008-10-10T13:10:50.968Z" SessionID="61"><From><User FriendlyName="- James O'"/></From><To><User FriendlyName="- alison"/></To><Text Style="font-family:MS Shell Dlg; color:#000000; ">nicer area than I though</Text></Message><Message Date="10/11/2008" Time="12:10:58 AM" DateTime="2008-10-10T13:10:58.270Z" SessionID="61"><From><User FriendlyName="- James O'"/></From><To><User FriendlyName="- alison"/></To><Text Style="font-family:MS Shell 