<?xml version="1.0"?>
<?xml-stylesheet type='text/xsl' href='MessageLog.xsl'?>
<Log FirstSessionID="1" LastSessionID="82"><Message Date="9/11/2008" Time="7:35:46 PM" DateTime="2008-09-11T09:35:46.844Z" SessionID="1"><From><User FriendlyName="- James O'"/></From><To><User FriendlyName="Pierreth"/></To><Text Style="font-family:MS Shell Dlg; color:#000000; ">I said I wouldnt</Text></Message><Message Date="9/11/2008" Time="7:35:53 PM" DateTime="2008-09-11T09:35:53.903Z" SessionID="1"><From><User FriendlyName="- James O'"/></From><To><User FriendlyName="Pierreth"/></To><Text Style="font-family:MS Shell Dlg; color:#000000; ">but Im playing another free korean MMO</Text></Message><Message Date="9/11/2008" Time="7:37:58 PM" DateTime="2008-09-11T09:37:58.079Z" SessionID="1"><From><User FriendlyName="- James O'"/></From><To><User FriendlyName="Pierreth"/></To><Text Style="font-family:MS Shell Dlg; color:#000000; ">and its awesome</Text></Message><Message Date="9/12/2008" Time="7:06:02 PM" DateTime="2008-09-12T09:06:02.182Z" SessionID="2"><From><User FriendlyName="- James O'"/></From><To><User FriendlyName="Pierreth"/></To><Text Style="font-family:MS Shell Dlg; color:#000000; ">fable in a month:-O</Text></Message><Message Date="9/12/2008" Time="7:06:36 PM" DateTime="2008-09-12T09:06:36.048Z" SessionID="3"><From><User FriendlyName="Pierreth"/></From><To><User FriendlyName="- James O'"/></To><Text Style="font-family:Times New Roman; font-weight:bold; font-style:italic; color:#000000; ">im getting my xbox chipped 2morro</Text></Message><Message Date="9/12/2008" Time="7:06:48 PM" DateTime="2008-09-12T09:06:48.734Z" SessionID="3"><From><User FriendlyName="- James O'"/></From><To><User FriendlyName="Pierreth"/></To><Text Style="font-family:MS Shell Dlg; color:#000000; ">Exsquizzed</Text></Message><Message Date="9/12/2008" Time="7:07:20 PM" DateTime="2008-09-12T09:07:20.313Z" SessionID="3"><From><User FriendlyName="Pierreth"/></From><To><User FriendlyName="- James O'"/></To><Text Style="font-family:Times New Roman; font-weight:bold; font-style:italic; color:#000000; ">it costs me 50 buckos</Text></Message><Message Date="9/12/2008" Time="7:07:28 PM" DateTime="2008-09-12T09:07:28.430Z" SessionID="3"><From><User FriendlyName="Pierreth"/></From><To><User FriendlyName="- James O'"/></To><Text Style="font-family:Times New Roman; font-weight:bold; font-style:italic; color:#000000; ">should i get some games also?</Text></Message><Message Date="9/12/2008" Time="7:07:40 PM" DateTime="2008-09-12T09:07:40.171Z" SessionID="3"><From><User FriendlyName="Pierreth"/></From><To><User FriendlyName="- James O'"/></To><Text Style="font-family:Times New Roman; font-weight:bold; font-style:italic; color:#000000; ">10 bucks each when getting a mod with this d00d</Text></Message><Message Date="9/12/2008" Time="7:07:45 PM" DateTime="2008-09-12T09:07:45.423Z" SessionID="3"><From><User FriendlyName="- James O'"/></From><To><User FriendlyName="Pierreth"/></To><Text Style="font-family:MS Shell Dlg; color:#000000; ">:-O</Text></Message><Message Date="9/12/2008" Time="7:07:47 PM" DateTime="2008-09-12T09:07:47.070Z" SessionID="3"><From><User FriendlyName="- James O'"/></From><To><User FriendlyName="Pierreth"/></To><Text Style="font-family:MS Shell Dlg; color:#000000; ">o rly?</Text></Message><Message Date="9/12/2008" Time="7:07:52 PM" DateTime="2008-09-12T09:07:52.997Z" SessionID="3"><From><User FriendlyName="- James O'"/></From><To><User FriendlyName="Pierreth"/></To><Text Style="font-family:MS Shell Dlg; color:#000000; ">he sells illegitimate games</Text></Message><Message Date="9/12/2008" Time="7:07:55 PM" DateTime="2008-09-12T09:07:55.684Z" SessionID="3"><From><User FriendlyName="- James O'"/></From><To><User FriendlyName="Pierreth"/></To><Text Style="font-family:MS Shell Dlg; color:#000000; ">thats fare awesom</Text></Message><Message Date="9/12/2008" Time="7:07:56 PM" DateTime="2008-09-12T09:07:56.985Z" SessionID="3"><From><User FriendlyName="Pierreth"/></From><To><User FriendlyName="- James O'"/></To><Text Style="font-family:Times New Roman; font-weight:bold; font-style:italic; color:#000000; ">yeh</Text></Message><Message Date="9/12/2008" Time="7:08:02 PM" DateTime="2008-09-12T09:08:02.402Z" SessionID="3"><From><User FriendlyName="Pierreth"/></From><To><User FriendlyName="- James O'"/></To><Text Style="font-family:Times New Roman; font-weight:bold; font-style:italic; color:#000000; ">he's pro naughty</Text></Message><Message Date="9/12/2008" Time="7:08:04 PM" DateTime="2008-09-12T09:08:04.589Z" SessionID="3"><From><User FriendlyName="- James O'"/></From><To><User FriendlyName="Pierreth"/></To><Text Style="font-family:MS Shell Dlg; color:#000000; ">since the discs are like $6</Text></Message><Message Date="9/12/2008" Time="7:08:10 PM" DateTime="2008-09-12T09:08:10.875Z" SessionID="3"><From><User FriendlyName="- James O'"/></From><To><User FriendlyName="Pierreth"/></To><Text Style="font-family:MS Shell Dlg; color:#000000; ">lol, does he run a shop or something?</Text></Message><Message Date="9/12/2008" Time="7:08:18 PM" DateTime="2008-09-12T09:08:18.164Z" SessionID="3"><From><User FriendlyName="Pierreth"/></From><To><User FriendlyName="- James O'"/></To><Text Style="font-family:Times New Roman; font-weight:bold; font-style:italic; color:#000000; ">nah its all from his apartment</Text></Message><Message Date="9/12/2008" Time="7:08:19 PM" DateTime="2008-09-12T09:08:19.010Z" SessionID="3"><From><User FriendlyName="- James O'"/></From><To><User FriendlyName="Pierreth"/></To><Text Style="font-family:MS Shell Dlg; color:#000000; ">or is it just a, "I know a guy"</Text></Message><Message Date="9/12/2008" Time="7:08:24 PM" DateTime="2008-09-12T09:08:24.625Z" SessionID="3"><From><User FriendlyName="- James O'"/></From><To><User FriendlyName="Pierreth"/></To><Text Style="font-family:MS Shell Dlg; color:#000000; ">oh ok, wikked</Text></Message><Message Date="9/12/2008" Time="7:08:29 PM" DateTime="2008-09-12T09:08:29.912Z" SessionID="3"><From><User FriendlyName="Pierreth"/></From><To><User FriendlyName="- James O'"/></To><Text Style="font-family:Times New Roman; font-weight:bold; font-style:italic; color:#000000; ">yeh</Text></Message><Message Date="9/12/2008" Time="7:08:32 PM" DateTime="2008-09-12T09:08:32.530Z" SessionID="3"><From><User FriendlyName="Pierreth"/></From><To><User FriendlyName="- James O'"/></To><Text Style="font-family:Times New Roman; font-weight:bold; font-style:italic; color:#000000; ">want any games?</Text></Message><Message Date="9/12/2008" Time="7:09:07 PM" DateTime="2008-09-12T09:09:07.359Z" SessionID="3"><From><User FriendlyName="Pierreth"/></From><To><User FriendlyName="- James O'"/></To><Text Style="font-family:Times New Roman; font-weight:bold; font-style:italic; color:#000000; ">coz i mean $6 a disc plus at least $2 hire from a video shop</Text></Message><Message Date="9/12/2008" Time="7:09:14 PM" DateTime="2008-09-12T09:09:14.343Z" SessionID="3"><From><User FriendlyName="Pierreth"/></From><To><User FriendlyName="- James O'"/></To><Text Style="font-family:Times New Roman; font-weight:bold; font-style:italic; color:#000000; ">it's well worth saving the effort</Text></Message><Message Date="9/12/2008" Time="7:09:17 PM" DateTime="2008-09-12T09:09:17.292Z" SessionID="3"><From><User FriendlyName="- James O'"/></From><To><User FriendlyName="Pierreth"/></To><Text Style="font-family:MS Shell Dlg; color:#000000; ">yeah, its a score</Text></Message><Message Date="9/12/2008" Time="7:09:41 PM" DateTime="2008-09-12T09:09:41.929Z" SessionID="3"><From><User FriendlyName="- James O'"/></From><To><User FriendlyName="Pierreth"/></To><Text Style="font-family:MS Shell Dlg; color:#000000; ">There's a few games I'm interested in *-)</Text></Message><Message Date="9/12/2008" Time="7:09:47 PM" DateTime="2008-09-12T09:09:47.839Z" SessionID="3"><From><User FriendlyName="- James O'"/></From><To><User FriendlyName="Pierreth"/></To><Text Style="font-family:MS Shell Dlg; color:#000000; ">Depends, are u getting anything?</Text></Message><Message Date="9/12/2008" Time="7:10:09 PM" DateTime="2008-09-12T09:10:09.837Z" SessionID="3"><From><User FriendlyName="- James O'"/></From><To><User FriendlyName="Pierreth"/></To><Text Style="font-family:MS Shell Dlg; color:#000000; ">Soul Caliber IV, maybe Tiger Woods 09</Text></Message><Message Date="9/12/2008" Time="7:10:29 PM" DateTime="2008-09-12T09:10:29.243Z" SessionID="3"><From><User FriendlyName="Pierreth"/></From><To><User FriendlyName="- James O'"/></To><Text Style="font-family:Times New Roman; font-weight:bold; font-style:italic; color:#000000; ">yeh i was think SC4 and Too Human</Text></Message><Message Date="9/12/2008" Time="7:10:31 PM" DateTime="2008-09-12T09:10:31.155Z" SessionID="3"><From><User FriendlyName="- James O'"/></From><To><User FriendlyName="Pierreth"/></To><Text Style="font-family:MS Shell Dlg; color:#000000; ">I have to check wat janali have, I know they got bad company</Text></Message><Message Date="9/12/2008" Time="7:10:47 PM" DateTime="2008-09-12T09:10:47.200Z" SessionID="3"><From><User FriendlyName="- James O'"/></From><To><User FriendlyName="Pierreth"/></To><Text Style="font-family:MS Shell Dlg; color:#000000; ">I've heard pretty mixed things about too human</Text></Message><Message Date="9/12/2008" Time="7:10:54 PM" DateTime="2008-09-12T09:10:54.010Z" SessionID="3"><From><User FriendlyName="Pierreth"/></From><To><User FriendlyName="- James O'"/></To><Text Style="font-family:Times New Roman; font-weight:bold; font-style:italic; color:#000000; ">yeh its shit</Text></Message><Message Date="9/12/2008" Time="7:10:58 PM" DateTime="2008-09-12T09:10:58.648Z" SessionID="3"><From><User FriendlyName="Pierreth"/></From><To><User FriendlyName="- James O'"/></To><Text Style="font-family:Times New Roman; font-weight:bold; font-style:italic; color:#000000; ">but id play it for $10</Text></Message><Message Date="9/12/2008" Time="7:11:02 PM" DateTime="2008-09-12T09:11:02.600Z" SessionID="3"><From><User FriendlyName="- James O'"/></From><To><User FriendlyName="Pierreth"/></To><Text Style="font-family:MS Shell Dlg; color:#000000; ">btw, nice list of games, http://www.metacritic.com/games/xbox360/scores/</Text></Message><Message Date="9/12/2008" Time="7:11:14 PM" DateTime="2008-09-12T09:11:14.294Z" SessionID="3"><From><User FriendlyName="- James O'"/></From><To><User FriendlyName="Pierreth"/></To><Text Style="font-family:MS Shell Dlg; color:#000000; ">Just incase U forget something, also can look at new releases</Text></Message><Message Date="9/12/2008" Time="7:11:24 PM" DateTime="2008-09-12T09:11:24.476Z" SessionID="3"><From><User FriendlyName="- James O'"/></From><To><User FriendlyName="Pierreth"/></To><Text Style="font-family:MS Shell Dlg; color:#000000; ">anything over a 60 is worth playing</Text></Message><Message Date="9/12/2008" Time="7:11:25 PM" DateTime="2008-09-12T09:11:25.104Z" SessionID="3"><From><User FriendlyName="Pierreth"/></From><To><User FriendlyName="- James O'"/></To><Text Style="font-family:Times New Roman; font-weight:bold; font-style:italic; color:#000000; ">nah he has his own list</Text></Message><Message Date="9/12/2008" Time="7:11:30 PM" DateTime="2008-09-12T09:11:30.699Z" SessionID="3"><From><User FriendlyName="Pierreth"/></From><To><User FriendlyName="- James O'"/></To><Text Style="font-family:Times New Roman; font-weight:bold; font-style:italic; color:#000000; ">ones that he has stockpiled in his house</Text></Message><Message Date="9/12/2008" Time="7:11:33 PM" DateTime="2008-09-12T09:11:33.212Z" SessionID="3"><From><User FriendlyName="- James O'"/></From><To><User FriendlyName="Pierreth"/></To><Text Style="font-family:MS Shell Dlg; color:#000000; ">ah right</Text></Message><Message Date="9/12/2008" Time="7:11:40 PM" DateTime="2008-09-12T09:11:40.618Z" SessionID="3"><From><User FriendlyName="Pierreth"/></From><To><User FriendlyName="- James O'"/></To><Text Style="font-family:Times New Roman; font-weight:bold; font-style:italic; color:#000000; ">i need to tell him now so he can burn em 4 pickup 2moz</Text></Message><Message Date="9/12/2008" Time="7:12:25 PM" DateTime="2008-09-12T09:12:25.002Z" SessionID="3"><From><User FriendlyName="Pierreth"/></From><To><User FriendlyName="- James O'"/></To><Text Style="font-family:Times New Roman; font-weight:bold; font-style:italic; color:#000000; ">berb</Text></Message><Message Date="9/12/2008" Time="7:12:25 PM" DateTime="2008-09-12T09:12:25.770Z" SessionID="3"><From><User FriendlyName="Pierreth"/></From><To><User FriendlyName="- James O'"/></To><Text Style="font-family:Times New Roman; font-weight:bold; font-style:italic; color:#000000; ">dinner</Text></Message><Message Date="9/12/2008" Time="7:12:32 PM" DateTime="2008-09-12T09:12:32.437Z" SessionID="3"><From><User FriendlyName="- James O'"/></From><To><User FriendlyName="Pierreth"/></To><Text Style="font-family:MS Shell Dlg; color:#000000; ">Jannali has bad company, I may pirate that</Text></Message><Message Date="9/12/2008" Time="7:12:33 PM" DateTime="2008-09-12T09:12:33.780Z" SessionID="3"><From><User FriendlyName="- James O'"/></From><To><User FriendlyName="Pierreth"/></To><Text Style="font-family:MS Shell Dlg; color:#000000; ">kks</Text></Message><Message Date="9/12/2008" Time="7:19:44 PM" DateTime="2008-09-12T09:19:44.450Z" SessionID="4"><From><User FriendlyName="- James O'"/></From><To><User FriendlyName="Pierreth"/></To><Text Style="font-family:MS Shell Dlg; color:#000000; ">atm, of current releases, I'd want Soul Caliber 4 (which ur prolly getting), tiger woods 09 and Tales of Vesperia (which he probably doesn't have)...</Text></Message><Message Date="9/12/2008" Time="7:30:03 PM" DateTime="2008-09-12T09:30:03.090Z" SessionID="5"><From><User FriendlyName="- James O'"/></From><To><User FriendlyName="Pierreth"/></To><Text Style="font-family:MS Shell Dlg; color:#000000; ">watching heroes bbl</Text></Message><Message Date="9/12/2008" Time="7:51:29 PM" DateTime="2008-09-12T09:51:29.828Z" SessionID="6"><From><User FriendlyName="Pierreth"/></From><To><User FriendlyName="- James O'"/></To><Text Style="font-family:Times New Roman; font-weight:bold; font-style:italic; color:#000000; ">i got him to get tiger woods 09 for ya</Text></Message><Message Date="9/12/2008" Time="7:51:37 PM" DateTime="2008-09-12T09:51:37.586Z" SessionID="6"><From><User FriendlyName="Pierreth"/></From><To><User FriendlyName="- James O'"/></To><Text Style="font-family:Times New Roman; font-weight:bold; font-style:italic; color:#000000; ">so i'll bring it overz whenevz</Text></Message><Message Date="9/12/2008" Time="8:15:28 PM" DateTime="2008-09-12T10:15:28.698Z" SessionID="6"><From><User FriendlyName="- James O'"/></From><To><User FriendlyName="Pierreth"/></To><Text Style="font-family:MS Shell Dlg; color:#000000; ">suhweet</Text></Message><Message Date="9/12/2008" Time="8:15:43 PM" DateTime="2008-09-12T10:15:43.800Z" SessionID="6"><From><User FriendlyName="- James O'"/></From><To><User FriendlyName="Pierreth"/></To><Text Style="font-family:MS Shell Dlg; color:#000000; ">can u bring SoulCal iv also, so I can burnsies</Text></Message><Message Date="9/12/2008" Time="8:15:46 PM" DateTime="2008-09-12T10:15:46.887Z" SessionID="6"><From><User FriendlyName="- James O'"/></From><To><User FriendlyName="Pierreth"/></To><Text Style="font-family:MS Shell Dlg; color:#000000; ">that looks like fun</Text></Message><Message Date="9/13/2008" Time="3:12:01 PM" DateTime="2008-09-13T05:12:01.070Z" SessionID="7"><From><User FriendlyName="Pierreth"/></From><To><User FriendlyName="- James O'"/></To><Text Style="font-family:Times New Roman; font-weight:bold; font-style:italic; color:#000000; ">u ther jimface?</Text></Message><Message Date="9/28/2008" Time="5:52:23 PM" DateTime="2008-09-28T07:52:23.970Z" SessionID="8"><From><User FriendlyName="Pierreth"/></From><To><User FriendlyName="- James O'"/></To><Text Style="font-family:Times New Roman; font-weight:bold; font-style:italic; color:#000000; ">yo sanka</Text></Message><Message Date="9/28/2008" Time="5:52:34 PM" DateTime="2008-09-28T07:52:34.503Z" SessionID="8"><From><User FriendlyName="Pierreth"/></From><To><User FriendlyName="- James O'"/></To><Text Style="font-family:Times New Roman; font-weight:bold; font-style:italic; color:#000000; ">ya ded man?</Text></Message><Message Date="9/29/2008" Time="11:26:30 AM" DateTime="2008-09-29T01:26:30.396Z" SessionID="9"><From><User FriendlyName="Pierreth"/></From><To><User FriendlyName="- James O'"/></To><Text Style="font-family:Times New Roman; font-weight:bold; font-style:italic; color:#000000; ">hey man</Text></Message><Message Date="9/29/2008" Time="11:26:36 AM" DateTime="2008-09-29T01:26:36.921Z" SessionID="9"><From><User FriendlyName="Pierreth"/></From><To><User FriendlyName="- James O'"/></To><Text Style="font-family:Times New Roman; font-weight:bold; font-style:italic; color:#000000; ">i was gonna leave soon</Text></Message><Message Date="9/29/2008" Time="11:26:51 AM" DateTime="2008-09-29T01:26:51.065Z" SessionID="9"><From><User FriendlyName="Pierreth"/></From><To><User FriendlyName="- James O'"/></To><Text Style="font-family:Times New Roman; font-weight:bold; font-style:italic; color:#000000; ">saccy is comin too so we can set up the burn and then go to randa if u want</Text></Message><Message Date="9/29/2008" Time="11:27:04 AM" DateTime="2008-09-29T01:27:04.765Z" SessionID="9"><From><User FriendlyName="- James O'"/></From><To><User FriendlyName="Pierreth"/></To><Text Style="font-family:MS Shell Dlg; color:#000000; ">O yah?</Text></Message><Message Date="9/29/2008" Time="11:27:07 AM" DateTime="2008-09-29T01:27:07.163Z" SessionID="9"><From><User FriendlyName="- James O'"/></From><To><User FriendlyName="Pierreth"/></To><Text Style="font-family:MS Shell Dlg; color:#000000; ">wikked</Text></Message><Message Date="9/29/2008" Time="11:27:10 AM" DateTime="2008-09-29T01:27:10.337Z" SessionID="10"><From><User FriendlyName="Pierreth"/></From><To><User FriendlyName="- James O'"/></To><Text Style="font-family:Times New Roman; font-weight:bold; font-style:italic; color:#000000; ">yah yah</Text></Message><Message Date="9/29/2008" Time="11:27:12 AM" DateTime="2008-09-29T01:27:12.987Z" SessionID="10"><From><User FriendlyName="Pierreth"/></From><To><User FriendlyName="- James O'"/></To><Text Style="font-family:Times New Roman; font-weight:bold; font-style:italic; color:#000000; ">kkz</Text></Message><Message Date="9/29/2008" Time="11:27:19 AM" DateTime="2008-09-29T01:27:19.570Z" SessionID="10"><From><User FriendlyName="Pierreth"/></From><To><User FriendlyName="- James O'"/></To><Text Style="font-family:Times New Roman; font-weight:bold; font-style:italic; color:#000000; ">so its cool if we come now?</Text></Message><Message Date="9/29/2008" Time="11:29:07 AM" DateTime="2008-09-29T01:29:07.095Z" SessionID="10"><From><User FriendlyName="- James O'"/></From><To><User FriendlyName="Pierreth"/></To><Text Style="font-family:MS Shell Dlg; color:#000000; ">yup</Text></Message><Message Date="9/29/2008" Time="11:29:18 AM" DateTime="2008-09-29T01:29:18.347Z" SessionID="10"><From><User FriendlyName="- James O'"/></From><To><User FriendlyName="Pierreth"/></To><Text Style="font-family:MS Shell Dlg; color:#000000; ">I wanna just grab some shorts and boxers from lowes</Text></Message><Message Date="9/29/2008" Time="11:29:29 AM" DateTime="2008-09-29T01:29:29.655Z" SessionID="10"><From><User FriendlyName="Pierreth"/></From><To><User FriendlyName="- James O'"/></To><Text Style="font-family:Times New Roman; font-weight:bold; font-style:italic; color:#000000; ">i heart lowes</Text></Message><Message Date="9/29/2008" Time="11:29:42 AM" DateTime="2008-09-29T01:29:42.737Z" SessionID="10"><From><User FriendlyName="- James O'"/></From><To><User FriendlyName="Pierreth"/></To><Text Style="font-family:MS Shell Dlg; color:#000000; ">I know there fucking wikked</Text></Message><Message Date="9/29/2008" Time="11:30:01 AM" DateTime="2008-09-29T01:30:01.821Z" SessionID="10"><From><User FriendlyName="Pierreth"/></From><To><User FriendlyName="- James O'"/></To><Text Style="font-family:Times New Roman; font-weight:bold; font-style:italic; color:#000000; ">alright man</Text></Message><Message Date="9/29/2008" Time="11:30:04 AM" DateTime="2008-09-29T01:30:04.702Z" SessionID="10"><From><User FriendlyName="Pierreth"/></From><To><User FriendlyName="- James O'"/></To><Text Style="font-family:Times New Roman; font-weight:bold; font-style:italic; color:#000000; ">i'll cya soon</Text></Message><Message Date="10/3/2008" Time="2:49:53 PM" DateTime="2008-10-03T04:49:53.593Z" SessionID="11"><From><User FriendlyName="Pierreth"/></From><To><User FriendlyName="- James O'"/></To><Text Style="font-family:Times New Roman; font-weight:bold; font-style:italic; color:#000000; ">hey d00d</Text></Message><Message Date="10/3/2008" Time="2:49:55 PM" DateTime="2008-10-03T04:49:55.478Z" SessionID="11"><From><User FriendlyName="Pierreth"/></From><To><User FriendlyName="- James O'"/></To><Text Style="font-family:Times New Roman; font-weight:bold; font-style:italic; color:#000000; ">how the games goin?</Text></Message><Message Date="10/3/2008" Time="3:21:10 PM" DateTime="2008-10-03T05:21:10.389Z" SessionID="11"><From><User FriendlyName="- James O'"/></From><To><User FriendlyName="Pierreth"/></To><Text Style="font-family:MS Shell Dlg; color:#000000; ">hay</Text></Message><Message Date="10/3/2008" Time="3:21:15 PM" DateTime="2008-10-03T05:21:15.956Z" SessionID="11"><From><User FriendlyName="- James O'"/></From><To><User FriendlyName="Pierreth"/></To><Text Style="font-family:MS Shell Dlg; color:#000000; ">havent played much lately</Text></Message><Message Date="10/3/2008" Time="3:21:19 PM" DateTime="2008-10-03T05:21:19.955Z" SessionID="11"><From><User FriendlyName="- James O'"/></From><To><User FriendlyName="Pierreth"/></To><Text Style="font-family:MS Shell Dlg; color:#000000; ">lotta tv watching</Text></Message><Message Date="10/3/2008" Time="3:21:23 PM" DateTime="2008-10-03T05:21:23.323Z" SessionID="11"><From><User FriendlyName="- James O'"/></From><To><User FriendlyName="Pierreth"/></To><Text Style="font-family:MS Shell Dlg; color:#000000; ">buffy</Text></Message><Message Date="10/3/2008" Time="3:21:34 PM" DateTime="2008-10-03T05:21:34.218Z" SessionID="11"><From><User FriendlyName="- James O'"/></From><To><User FriendlyName="Pierreth"/></To><Text Style="font-family:MS Shell Dlg; color:#000000; ">plus new heroes, gossip girl, ugly betty, house</Text></Message><Message Date="10/3/2008" Time="3:21:42 PM" DateTime="2008-10-03T05:21:42.137Z" SessionID="11"><From><User FriendlyName="- James O'"/></From><To><User FriendlyName="Pierreth"/></To><Text Style="font-family:MS Shell Dlg; color:#000000; ">very little assignments being done</Text></Message><Message Date="10/3/2008" Time="3:21:47 PM" DateTime="2008-10-03T05:21:47.471Z" SessionID="11"><From><User FriendlyName="Pierreth"/></From><To><User FriendlyName="- James O'"/></To><Text Style="font-family:Times New Roman; font-weight:bold; font-style:italic; color:#000000; ">californication</Text></Message><Message Date="10/3/2008" Time="3:22:57 PM" DateTime="2008-10-03T05:22:57.193Z" SessionID="11"><From><User FriendlyName="- James O'"/></From><To><User FriendlyName="Pierreth"/></To><Text Style="font-family:MS Shell Dlg; color:#000000; ">like &lt;20 days for fable 2</Text></Message><Message Date="10/3/2008" Time="3:24:22 PM" DateTime="2008-10-03T05:24:22.167Z" SessionID="12"><From><User FriendlyName="- James O'"/></From><To><User FriendlyName="Pierreth"/></To><Text Style="font-family:MS Shell Dlg; color:#000000; ">bbl, more buffy awaits me</Text></Message><Message Date="10/4/2008" Time="7:52:27 PM" DateTime="2008-10-04T09:52:27.538Z" SessionID="13"><From><User FriendlyName="- James O'"/></From><To><User FriendlyName="Pierreth"/></To><Text Style="font-family:MS Shell Dlg; color:#000000; ">3,166 views on my greensleeves piano video</Text></Message><Message Date="10/4/2008" Time="7:52:28 PM" DateTime="2008-10-04T09:52:28.984Z" SessionID="13"><From><User FriendlyName="- James O'"/></From><To><User FriendlyName="Pierreth"/></To><Text Style="font-family:MS Shell Dlg; color:#000000; ">Huzzah!</Text></Message><Message Date="10/4/2008" Time="7:52:41 PM" DateTime="2008-10-04T09:52:41.834Z" SessionID="13"><From><User FriendlyName="Pierreth"/></From><To><User FriendlyName="- James O'"/></To><Text Style="font-family:Times New Roman; font-weight:bold; font-style:italic; color:#000000; ">congrats</Text></Message><Message Date="10/4/2008" Time="7:52:47 PM" DateTime="2008-10-04T09:52:47.586Z" SessionID="13"><From><User FriendlyName="Pierreth"/></From><To><User FriendlyName="- James O'"/></To><Text Style="font-family:Times New Roman; font-weight:bold; font-style:italic; color:#000000; ">im not one of them</Text></Message><Message Date="10/4/2008" Time="7:52:51 PM" DateTime="2008-10-04T09:52:51.569Z" SessionID="13"><From><User FriendlyName="Pierreth"/></From><To><User FriendlyName="- James O'"/></To><Text Style="font-family:Times New Roman; font-weight:bold; font-style:italic; color:#000000; ">when did u post it?</Text></Message><Message Date="10/4/2008" Time="7:52:56 PM" DateTime="2008-10-04T09:52:56.753Z" SessionID="13"><From><User FriendlyName="- James O'"/></From><To><User FriendlyName="Pierreth"/></To><Text Style="font-family:MS Shell Dlg; color:#000000; ">f'ages ago</Text></Message><Message Date="10/4/2008" Time="7:53:07 PM" DateTime="2008-10-04T09:53:07.987Z" SessionID="13"><From><User FriendlyName="- James O'"/></From><To><User FriendlyName="Pierreth"/></To><Text Style="font-family:MS Shell Dlg; color:#000000; ">about a year</Text></Message><Message Date="10/4/2008" Time="7:53:10 PM" DateTime="2008-10-04T09:53:10.043Z" SessionID="13"><From><User FriendlyName="- James O'"/></From><To><User FriendlyName="Pierreth"/></To><Text Style="font-family:MS Shell Dlg; color:#000000; ">http://www.youtube.com/watch?v=0BLUJI54Ax4</Text></Message><Message Date="10/4/2008" Time="7:53:13 PM" DateTime="2008-10-04T09:53:13.593Z" SessionID="13"><From><User FriendlyName="- James O'"/></From><To><User FriendlyName="Pierreth"/></To><Text Style="font-family:MS Shell Dlg; color:#000000; ">please, be 3,167</Text></Message><Message Date="10/4/2008" Time="7:53:27 PM" DateTime="2008-10-04T09:53:27.522Z" SessionID="14"><From><User FriendlyName="- James O'"/></From><To><User FriendlyName="Pierreth"/></To><Text Style="font-family:MS Shell Dlg; color:#000000; ">its not even that good a recording or nuthing</Text></Message><Message Date="10/4/2008" Time="7:55:19 PM" DateTime="2008-10-04T09:55:19.507Z" SessionID="15"><From><User FriendlyName="Pierreth"/></From><To><User FriendlyName="- James O'"/></To><Text Style="font-family:Times New Roman; font-weight:bold; font-style:italic; color:#000000; ">i commented</Text></Message><Message Date="10/4/2008" Time="7:55:20 PM" DateTime="2008-10-04T09:55:20.439Z" SessionID="15"><From><User FriendlyName="Pierreth"/></From><To><User FriendlyName="- James O'"/></To><Text Style="font-family:Times New Roman; font-weight:bold; font-style:italic; color:#000000; ">:D</Text></Message><Message Date="10/4/2008" Time="7:56:55 PM" DateTime="2008-10-04T09:56:55.120Z" SessionID="15"><From><User FriendlyName="Pierreth"/></From><To><User FriendlyName="- James O'"/></To><Text Style="font-family:Times New Roman; font-weight:bold; font-style:italic; color:#000000; ">my comment seems to have gone missing</Text></Message><Message Date="10/5/2008" Time="11:55:06 AM" DateTime="2008-10-05T00:55:06.853Z" SessionID="16"><From><User FriendlyName="- James O'"/></From><To><User FriendlyName="Pierreth"/></To><Text Style="font-family:MS Shell Dlg; color:#000000; ">likey?</Text></Message><Message Date="10/5/2008" Time="11:55:21 AM" DateTime="2008-10-05T00:55:21.472Z" SessionID="16"><From><User FriendlyName="Pierreth"/></From><To><User FriendlyName="- James O'"/></To><Text>yeah its sweet</Text></Message><Message Date="10/5/2008" Time="11:55:27 AM" DateTime="2008-10-05T00:55:27.329Z" SessionID="16"><From><User FriendlyName="Pierreth"/></From><To><User FriendlyName="- James O'"/></To><Text>veteren all the way man</Text></Message><Message Date="10/5/2008" Time="11:55:34 AM" DateTime="2008-10-05T00:55:34.512Z" SessionID="16"><From><User FriendlyName="Pierreth"/></From><To><User FriendlyName="- James O'"/></To><Text>makes cod games so much better</Text></Message><Message Date="10/5/2008" Time="11:55:40 AM" DateTime="2008-10-05T00:55:40.877Z" SessionID="16"><From><User FriendlyName="Pierreth"/></From><To><User FriendlyName="- James O'"/></To><Text>and more frustrating</Text></Message><Message Date="10/5/2008" Time="11:55:47 AM" DateTime="2008-10-05T00:55:47.743Z" SessionID="16"><From><User FriendlyName="Pierreth"/></From><To><User FriendlyName="- James O'"/></To><Text>but heaps mor rewarding</Text></Message><Message Date="10/5/2008" Time="11:55:50 AM" DateTime="2008-10-05T00:55:50.783Z" SessionID="16"><From><User FriendlyName="- James O'"/></From><To><User FriendlyName="Pierreth"/></To><Text Style="font-family:MS Shell Dlg; color:#000000; ">Haha, I played through most of it on my PC, but I'll give it a go today</Text></Message><Message Date="10/5/2008" Time="11:55:52 AM" DateTime="2008-10-05T00:55:52.101Z" SessionID="16"><From><User FriendlyName="- James O'"/></From><To><User FriendlyName="Pierreth"/></To><Text Style="font-family:MS Shell Dlg; color:#000000; ">Ugh</Text></Message><Message Date="10/5/2008" Time="11:55:56 AM" DateTime="2008-10-05T00:55:56.212Z" SessionID="16"><From><User FriendlyName="- James O'"/></From><To><User FriendlyName="Pierreth"/></To><Text Style="font-family:MS Shell Dlg; color:#000000; ">I like one up from easy</Text></Message><Message Date="10/5/2008" Time="11:55:58 AM" DateTime="2008-10-05T00:55:58.692Z" SessionID="16"><From><User FriendlyName="- James O'"/></From><To><User FriendlyName="Pierreth"/></To><Text Style="font-family:MS Shell Dlg; color:#000000; ">dunno what that is</Text></Message><Message Date="10/5/2008" Time="11:56:03 AM" DateTime="2008-10-05T00:56:03.811Z" SessionID="16"><From><User FriendlyName="- James O'"/></From><To><User FriendlyName="Pierreth"/></To><Text Style="font-family:MS Shell Dlg; color:#000000; ">anything more and you end up replaying sections</Text></Message><Message Date="10/5/2008" Time="11:56:07 AM" DateTime="2008-10-05T00:56:07.721Z" SessionID="16"><From><User FriendlyName="Pierreth"/></From><To><User FriendlyName="- James O'"/></To><Text>normal</Text></Message><Message Date="10/5/2008" Time="11:56:13 AM" DateTime="2008-10-05T00:56:13.572Z" SessionID="16"><From><User FriendlyName="- James O'"/></From><To><User FriendlyName="Pierreth"/></To><Text Style="font-family:MS Shell Dlg; color:#000000; ">to much replaying and you start seeing the curtains behind the scenes</Text></Message><Message Date="10/5/2008" Time="11:56:25 AM" DateTime="2008-10-05T00:56:25.505Z" SessionID="16"><From><User FriendlyName="- James O'"/></From><To><User FriendlyName="Pierreth"/></To><Text Style="font-family:MS Shell Dlg; color:#000000; ">it becomes really obvious where the spawn points are and stuff</Text></Message><Message Date="10/5/2008" Time="11:56:33 AM" DateTime="2008-10-05T00:56:33.600Z" SessionID="16"><From><User FriendlyName="- James O'"/></From><To><User FriendlyName="Pierreth"/></To><Text Style="font-family:MS Shell Dlg; color:#000000; ">and the frustartionness</Text></Message><Message Date="10/5/2008" Time="12:00:54 PM" DateTime="2008-10-05T01:00:54.175Z" SessionID="16"><From><User FriendlyName="Pierreth"/></From><To><User FriendlyName="- James O'"/></To><Text>i just finished a mission</Text></Message><Message Date="10/5/2008" Time="12:00:54 PM" DateTime="2008-10-05T01:00:54.209Z" SessionID="16"><From><User FriendlyName="Pierreth"/></From><To><User FriendlyName="- James O'"/></To><Text>w00t</Text></Message><Message Date="10/5/2008" Time="12:01:08 PM" DateTime="2008-10-05T01:01:08.697Z" SessionID="16"><From><User FriendlyName="- James O'"/></From><To><User FriendlyName="Pierreth"/></To><Text Style="font-family:MS Shell Dlg; color:#000000; ">huzzah</Text></Message><Message Date="10/7/2008" Time="7:58:33 PM" DateTime="2008-10-07T08:58:33.708Z" SessionID="17"><From><User FriendlyName="- James O'"/></From><To><User FriendlyName="Pierreth"/></To><Text Style="font-family:MS Shell Dlg; color:#000000; ">Hay</Text></Message><Message Date="10/7/2008" Time="7:58:44 PM" DateTime="2008-10-07T08:58:44.254Z" SessionID="17"><From><User FriendlyName="- James O'"/></From><To><User FriendlyName="Pierreth"/></To><Text Style="font-family:MS Shell Dlg; color:#000000; ">Wired my 360 up today (L)</Text></Message><Message Date="10/7/2008" Time="8:09:49 PM" DateTime="2008-10-07T09:09:49.101Z" SessionID="18"><From><User FriendlyName="- James O'"/></From><To><User FriendlyName="Pierreth"/></To><Text Style="font-family:MS Shell Dlg; color:#000000; ">oh and</Text></Message><Message Date="10/7/2008" Time="8:09:49 PM" DateTime="2008-10-07T09:09:49.499Z" SessionID="18"><From><User FriendlyName="- James O'"/></From><To><User FriendlyName="Pierreth"/></To><Text Style="font-family:MS Shell Dlg; color:#000000; ">http://www.jasper1675.com/australian12gold.html</Text></Message><Message Date="10/7/2008" Time="8:09:56 PM" DateTime="2008-10-07T09:09:56.705Z" SessionID="18"><From><User FriendlyName="- James O'"/></From><To><User FriendlyName="Pierreth"/></To><Text Style="font-family:MS Shell Dlg; color:#000000; ">$55 dollar for 13 months of xbox liveness</Text></Message><Message Date="10/7/2008" Time="8:09:57 PM" DateTime="2008-10-07T09:09:57.321Z" SessionID="18"><From><User FriendlyName="- James O'"/></From><To><User FriendlyName="Pierreth"/></To><Text Style="font-family:MS Shell Dlg; color:#000000; ">&lt;3</Text></Message><Message Date="10/7/2008" Time="9:47:57 PM" DateTime="2008-10-07T10:47:57.746Z" SessionID="19"><From><User FriendlyName="- James O'"/></From><To><User FriendlyName="Pierreth"/></To><Text Style="font-family:MS Shell Dlg; color:#000000; ">hai?</Text></Message><Message Date="10/7/2008" Time="10:28:11 PM" DateTime="2008-10-07T11:28:11.015Z" SessionID="20"><From><User FriendlyName="Pierreth"/></From><To><User FriendlyName="- James O'"/></To><Text Style="font-family:Times New Roman; font-weight:bold; font-style:italic; color:#000000; ">yo</Text></Message><Message Date="10/7/2008" Time="10:28:16 PM" DateTime="2008-10-07T11:28:16.126Z" SessionID="20"><From><User FriendlyName="Pierreth"/></From><To><User FriendlyName="- James O'"/></To><Text Style="font-family:Times New Roman; font-weight:bold; font-style:italic; color:#000000; ">im here now</Text></Message><Message Date="10/7/2008" Time="10:28:16 PM" DateTime="2008-10-07T11:28:16.309Z" SessionID="20"><From><User FriendlyName="- James O'"/></From><To><User FriendlyName="Pierreth"/></To><Text Style="font-family:MS Shell Dlg; color:#000000; ">hihi</Text></Message><Message Date="10/7/2008" Time="10:28:22 PM" DateTime="2008-10-07T11:28:22.069Z" SessionID="20"><From><User FriendlyName="Pierreth"/></From><To><User FriendlyName="- James O'"/></To><Text Style="font-family:Times New Roman; font-weight:bold; font-style:italic; color:#000000; ">wots ur gamertag?</Text></Message><Message Date="10/7/2008" Time="10:28:24 PM" DateTime="2008-10-07T11:28:24.235Z" SessionID="20"><From><User FriendlyName="- James O'"/></From><To><User FriendlyName="Pierreth"/></To><Text Style="font-family:MS Shell Dlg; color:#000000; ">Huzzah!!!1!1!</Text></Message><Message Date="10/7/2008" Time="10:28:29 PM" DateTime="2008-10-07T11:28:29.576Z" SessionID="20"><From><User FriendlyName="- James O'"/></From><To><User FriendlyName="Pierreth"/></To><Text Style="font-family:MS Shell Dlg; color:#000000; ">Dunno, aint connected yet</Text></Message><Message Date="10/7/2008" Time="10:28:35 PM" DateTime="2008-10-07T11:28:35.392Z" SessionID="20"><From><User FriendlyName="- James O'"/></From><To><User FriendlyName="Pierreth"/></To><Text Style="font-family:MS Shell Dlg; color:#000000; ">I was setting up media center</Text></Message><Message Date="10/7/2008" Time="10:28:38 PM" DateTime="2008-10-07T11:28:38.105Z" SessionID="20"><From><User FriendlyName="- James O'"/></From><To><User FriendlyName="Pierreth"/></To><Text Style="font-family:MS Shell Dlg; color:#000000; ">then folks took over</Text></Message><Message Date="10/7/2008" Time="10:28:41 PM" DateTime="2008-10-07T11:28:41.071Z" SessionID="20"><From><User FriendlyName="- James O'"/></From><To><User FriendlyName="Pierreth"/></To><Text Style="font-family:MS Shell Dlg; color:#000000; ">they'll be done soon</Text></Message><Message Date="10/7/2008" Time="10:28:47 PM" DateTime="2008-10-07T11:28:47.541Z" SessionID="20"><From><User FriendlyName="- James O'"/></From><To><User FriendlyName="Pierreth"/></To><Text Style="font-family:MS Shell Dlg; color:#000000; ">they're watching a crappy movie </Text></Message><Message Date="10/7/2008" Time="10:29:10 PM" DateTime="2008-10-07T11:29:10.102Z" SessionID="20"><From><User FriendlyName="Pierreth"/></From><To><User FriendlyName="- James O'"/></To><Text Style="font-family:Times New Roman; font-weight:bold; font-style:italic; color:#000000; ">kkz</Text></Message><Message Date="10/7/2008" Time="10:33:42 PM" DateTime="2008-10-07T11:33:42.050Z" SessionID="20"><From><User FriendlyName="- James O'"/></From><To><User FriendlyName="Pierreth"/></To><Text Style="font-family:MS Shell Dlg; color:#000000; ">um</Text></Message><Message Date="10/7/2008" Time="10:33:46 PM" DateTime="2008-10-07T11:33:46.489Z" SessionID="20"><From><User FriendlyName="- James O'"/></From><To><User FriendlyName="Pierreth"/></To><Text Style="font-family:MS Shell Dlg; color:#000000; ">if I set a gamertag up</Text></Message><Message Date="10/7/2008" Time="10:33:55 PM" DateTime="2008-10-07T11:33:55.839Z" SessionID="20"><From><User FriendlyName="- James O'"/></From><To><User FriendlyName="Pierreth"/></To><Text Style="font-family:MS Shell Dlg; color:#000000; ">could we play something 2geva?</Text></Message><Message Date="10/7/2008" Time="10:34:08 PM" DateTime="2008-10-07T11:34:08.824Z" SessionID="20"><From><User FriendlyName="Pierreth"/></From><To><User FriendlyName="- James O'"/></To><Text Style="font-family:Times New Roman; font-weight:bold; font-style:italic; color:#000000; ">for a tad bit</Text></Message><Message Date="10/7/2008" Time="10:34:10 PM" DateTime="2008-10-07T11:34:10.688Z" SessionID="20"><From><User FriendlyName="Pierreth"/></From><To><User FriendlyName="- James O'"/></To><Text Style="font-family:Times New Roman; font-weight:bold; font-style:italic; color:#000000; ">lol</Text></Message><Message Date="10/7/2008" Time="10:34:16 PM" DateTime="2008-10-07T11:34:16.666Z" SessionID="20"><From><User FriendlyName="- James O'"/></From><To><User FriendlyName="Pierreth"/></To><Text Style="font-family:MS Shell Dlg; color:#000000; ">got uni 2moro?</Text></Message><Message Date="10/7/2008" Time="10:34:18 PM" DateTime="2008-10-07T11:34:18.213Z" SessionID="20"><From><User FriendlyName="Pierreth"/></From><To><User FriendlyName="- James O'"/></To><Text Style="font-family:Times New Roman; font-weight:bold; font-style:italic; color:#000000; ">ive got an assignment due 2moz</Text></Message><Message Date="10/7/2008" Time="10:34:20 PM" DateTime="2008-10-07T11:34:20.477Z" SessionID="20"><From><User FriendlyName="Pierreth"/></From><To><User FriendlyName="- James O'"/></To><Text Style="font-family:Times New Roman; font-weight:bold; font-style:italic; color:#000000; ">lets face it</Text></Message><Message Date="10/7/2008" Time="10:34:21 PM" DateTime="2008-10-07T11:34:21.594Z" SessionID="20"><From><User FriendlyName="- James O'"/></From><To><User FriendlyName="Pierreth"/></To><Text Style="font-family:MS Shell Dlg; color:#000000; ">haha</Text></Message><Message Date="10/7/2008" Time="10:34:24 PM" DateTime="2008-10-07T11:34:24.692Z" SessionID="20"><From><User FriendlyName="Pierreth"/></From><To><User FriendlyName="- James O'"/></To><Text Style="font-family:Times New Roman; font-weight:bold; font-style:italic; color:#000000; ">i aint doin any more tonight</Text></Message><Message Date="10/7/2008" Time="10:34:31 PM" DateTime="2008-10-07T11:34:31.591Z" SessionID="20"><From><User FriendlyName="- James O'"/></From><To><User FriendlyName="Pierreth"/></To><Text Style="font-family:MS Shell Dlg; color:#000000; ">thats alright, if u got work to do</Text></Message><Message Date="10/7/2008" Time="10:34:31 PM" DateTime="2008-10-07T11:34:31.867Z" SessionID="20"><From><User FriendlyName="Pierreth"/></From><To><User FriendlyName="- James O'"/></To><Text Style="font-family:Times New Roman; font-weight:bold; font-style:italic; color:#000000; ">but i will need to get up earlyish</Text></Message><Message Date="10/7/2008" Time="10:34:47 PM" DateTime="2008-10-07T11:34:47.748Z" SessionID="20"><From><User FriendlyName="- James O'"/></From><To><User FriendlyName="Pierreth"/></To><Text Style="font-family:MS Shell Dlg; color:#000000; ">Man, finding motivation to do assignments is hell</Text></Message><Message Date="10/7/2008" Time="10:35:21 PM" DateTime="2008-10-07T11:35:21.351Z" SessionID="20"><From><User FriendlyName="Pierreth"/></From><To><User FriendlyName="- James O'"/></To><Text Style="font-family:Times New Roman; font-weight:bold; font-style:italic; color:#000000; ">yeh</Text></Message><Message Date="10/7/2008" Time="10:35:24 PM" DateTime="2008-10-07T11:35:24.720Z" SessionID="20"><From><User FriendlyName="Pierreth"/></From><To><User FriendlyName="- James O'"/></To><Text Style="font-family:Times New Roman; font-weight:bold; font-style:italic; color:#000000; ">im shit at it</Text></Message><Message Date="10/7/2008" Time="10:35:55 PM" DateTime="2008-10-07T11:35:55.524Z" SessionID="20"><From><User FriendlyName="- James O'"/></From><To><User FriendlyName="Pierreth"/></To><Text Style="font-family:MS Shell Dlg; color:#000000; ">got an essay due mondee</Text></Message><Message Date="10/7/2008" Time="10:36:00 PM" DateTime="2008-10-07T11:36:00.563Z" SessionID="20"><From><User FriendlyName="- James O'"/></From><To><User FriendlyName="Pierreth"/></To><Text Style="font-family:MS Shell Dlg; color:#000000; ">and I know I can do it</Text></Message><Message Date="10/7/2008" Time="10:36:08 PM" DateTime="2008-10-07T11:36:08.641Z" SessionID="20"><From><User FriendlyName="- James O'"/></From><To><User FriendlyName="Pierreth"/></To><Text Style="font-family:MS Shell Dlg; color:#000000; ">its basically my speech in written form</Text></Message><Message Date="10/7/2008" Time="10:36:12 PM" DateTime="2008-10-07T11:36:12.112Z" SessionID="20"><From><User FriendlyName="- James O'"/></From><To><User FriendlyName="Pierreth"/></To><Text Style="font-family:MS Shell Dlg; color:#000000; ">but motivation</Text></Message><Message Date="10/7/2008" Time="10:36:13 PM" DateTime="2008-10-07T11:36:13.064Z" SessionID="20"><From><User FriendlyName="- James O'"/></From><To><User FriendlyName="Pierreth"/></To><Text Style="font-family:MS Shell Dlg; color:#000000; ">NONE</Text></Message><Message Date="10/7/2008" Time="10:36:26 PM" DateTime="2008-10-07T11:36:26.384Z" SessionID="20"><From><User FriendlyName="Pierreth"/></From><To><User FriendlyName="- James O'"/></To><Text Style="font-family:Times New Roman; font-weight:bold; font-style:italic; color:#000000; ">exarcary</Text></Message><Message Date="10/7/2008" Time="10:36:38 PM" DateTime="2008-10-07T11:36:38.001Z" SessionID="20"><From><User FriendlyName="Pierreth"/></From><To><User FriendlyName="- James O'"/></To><Text Style="font-family:Times New Roman; font-weight:bold; font-style:italic; color:#000000; ">[asian exactly]</Text></Message><Message Date="10/7/2008" Time="10:36:47 PM" DateTime="2008-10-07T11:36:47.121Z" SessionID="20"><From><User FriendlyName="- James O'"/></From><To><User FriendlyName="Pierreth"/></To><Text Style="font-family:MS Shell Dlg; color:#000000; ">ALL i want is holidays and a time to play games and shit</Text></Message><Message Date="10/7/2008" Time="10:36:56 PM" DateTime="2008-10-07T11:36:56.438Z" SessionID="20"><From><User FriendlyName="- James O'"/></From><To><User FriendlyName="Pierreth"/></To><Text Style="font-family:MS Shell Dlg; color:#000000; ">which, admitaly is largely what Im doing</Text></Message><Message Date="10/7/2008" Time="10:37:18 PM" DateTime="2008-10-07T11:37:18.886Z" SessionID="20"><From><User FriendlyName="Pierreth"/></From><To><User FriendlyName="- James O'"/></To><Text Style="font-family:Times New Roman; font-weight:bold; font-style:italic; color:#000000; ">yep</Text></Message><Message Date="10/7/2008" Time="10:37:21 PM" DateTime="2008-10-07T11:37:21.954Z" SessionID="20"><From><User FriendlyName="Pierreth"/></From><To><User FriendlyName="- James O'"/></To><Text Style="font-family:Times New Roman; font-weight:bold; font-style:italic; color:#000000; ">thats what im doing</Text></Message><Message Date="10/7/2008" Time="10:47:04 PM" DateTime="2008-10-07T11:47:04.411Z" SessionID="20"><From><User FriendlyName="- James O'"/></From><To><User FriendlyName="Pierreth"/></To><Text Style="font-family:MS Shell Dlg; color:#000000; ">http://www.danielhindes.net/files/Lisa_Miskovsky_-_Still_Alive.mp3</Text></Message><Message Date="10/7/2008" Time="10:52:25 PM" DateTime="2008-10-07T11:52:25.752Z" SessionID="20"><From><User FriendlyName="- James O'"/></From><To><User FriendlyName="Pierreth"/></To><Text Style="font-family:MS Shell Dlg; color:#000000; ">from mirrors edge</Text></Message><Message Date="10/7/2008" Time="10:52:28 PM" DateTime="2008-10-07T11:52:28.592Z" SessionID="20"><From><User FriendlyName="- James O'"/></From><To><User FriendlyName="Pierreth"/></To><Text Style="font-family:MS Shell Dlg; color:#000000; ">with lyrics</Text></Message><Message Date="10/7/2008" Time="10:53:06 PM" DateTime="2008-10-07T11:53:06.729Z" SessionID="21"><From><User FriendlyName="Pierreth"/></From><To><User FriendlyName="- James O'"/></To><Text Style="font-family:Times New Roman; font-weight:bold; font-style:italic; color:#000000; ">it's delightful</Text></Message><Message Date="10/7/2008" Time="11:01:10 PM" DateTime="2008-10-07T12:01:10.779Z" SessionID="21"><From><User FriendlyName="- James O'"/></From><To><User FriendlyName="Pierreth"/></To><Text Style="font-family:MS Shell Dlg; color:#000000; ">im creating a live account</Text></Message><Message Date="10/7/2008" Time="11:01:19 PM" DateTime="2008-10-07T12:01:19.058Z" SessionID="21"><From><User FriendlyName="- James O'"/></From><To><User FriendlyName="Pierreth"/></To><Text Style="font-family:MS Shell Dlg; color:#000000; ">I think saccy used all the gold accounts tho</Text></Message><Message Date="10/7/2008" Time="11:01:20 PM" DateTime="2008-10-07T12:01:20.188Z" SessionID="21"><From><User FriendlyName="Pierreth"/></From><To><User FriendlyName="- James O'"/></To><Text Style="font-family:Times New Roman; font-weight:bold; font-style:italic; color:#000000; ">w000000000t</Text></Message><Message Date="10/7/2008" Time="11:01:27 PM" DateTime="2008-10-07T12:01:27.621Z" SessionID="21"><From><User FriendlyName="Pierreth"/></From><To><User FriendlyName="- James O'"/></To><Text Style="font-family:Times New Roman; font-weight:bold; font-style:italic; color:#000000; ">teh bastardo</Text></Message><Message Date="10/7/2008" Time="11:01:48 PM" DateTime="2008-10-07T12:01:48.916Z" SessionID="21"><From><User FriendlyName="- James O'"/></From><To><User FriendlyName="Pierreth"/></To><Text Style="font-family:MS Shell Dlg; color:#000000; ">you dont have any free months with any of ur games or something do you?</Text></Message><Message Date="10/7/2008" Time="11:08:22 PM" DateTime="2008-10-07T12:08:22.802Z" SessionID="21"><From><User FriendlyName="- James O'"/></From><To><User FriendlyName="Pierreth"/></To><Text Style="font-family:MS Shell Dlg; color:#000000; ">hmm, chatting is hard on a 360 tho</Text></Message><Message Date="10/7/2008" Time="11:08:30 PM" DateTime="2008-10-07T12:08:30.780Z" SessionID="21"><From><User FriendlyName="Pierreth"/></From><To><User FriendlyName="- James O'"/></To><Text Style="font-family:Times New Roman; font-weight:bold; font-style:italic; color:#000000; ">yes</Text></Message><Message Date="10/7/2008" Time="11:08:38 PM" DateTime="2008-10-07T12:08:38.173Z" SessionID="21"><From><User FriendlyName="Pierreth"/></From><To><User FriendlyName="- James O'"/></To><Text Style="font-family:Times New Roman; font-weight:bold; font-style:italic; color:#000000; ">thus my uber chat pad</Text></Message><Message Date="10/7/2008" Time="11:12:44 PM" DateTime="2008-10-07T12:12:44.490Z" SessionID="21"><From><User FriendlyName="- James O'"/></From><To><User FriendlyName="Pierreth"/></To><Text Style="font-family:MS Shell Dlg; color:#000000; ">streaming videos to the 360 is rather neat</Text></Message><Message Date="10/7/2008" Time="11:12:49 PM" DateTime="2008-10-07T12:12:49.136Z" SessionID="21"><From><User FriendlyName="- James O'"/></From><To><User FriendlyName="Pierreth"/></To><Text Style="font-family:MS Shell Dlg; color:#000000; ">that was the main reason I hooked it up</Text></Message><Message Date="10/7/2008" Time="11:13:04 PM" DateTime="2008-10-07T12:13:04.430Z" SessionID="21"><From><User FriendlyName="Pierreth"/></From><To><User FriendlyName="- James O'"/></To><Text Style="font-family:Times New Roman; font-weight:bold; font-style:italic; color:#000000; ">i havent set up windows media such n such</Text></Message><Message Date="10/7/2008" Time="11:13:21 PM" DateTime="2008-10-07T12:13:21.002Z" SessionID="21"><From><User FriendlyName="- James O'"/></From><To><User FriendlyName="Pierreth"/></To><Text Style="font-family:MS Shell Dlg; color:#000000; ">Its quite easy</Text></Message><Message Date="10/7/2008" Time="11:13:24 PM" DateTime="2008-10-07T12:13:24.488Z" SessionID="21"><From><User FriendlyName="- James O'"/></From><To><User FriendlyName="Pierreth"/></To><Text Style="font-family:MS Shell Dlg; color:#000000; ">Im not using media center</Text></Message><Message Date="10/7/2008" Time="11:13:26 PM" DateTime="2008-10-07T12:13:26.559Z" SessionID="21"><From><User FriendlyName="- James O'"/></From><To><User FriendlyName="Pierreth"/></To><Text Style="font-family:MS Shell Dlg; color:#000000; ">even tho I have it</Text></Message><Message Date="10/7/2008" Time="11:13:36 PM" DateTime="2008-10-07T12:13:36.141Z" SessionID="21"><From><User FriendlyName="- James O'"/></From><To><User FriendlyName="Pierreth"/></To><Text Style="font-family:MS Shell Dlg; color:#000000; ">its got a nice, but no divx support</Text></Message><Message Date="10/7/2008" Time="11:13:43 PM" DateTime="2008-10-07T12:13:43.917Z" SessionID="21"><From><User FriendlyName="- James O'"/></From><To><User FriendlyName="Pierreth"/></To><Text Style="font-family:MS Shell Dlg; color:#000000; ">only the main xbox dashboard player has divx support :(</Text></Message><Message Date="10/7/2008" Time="11:15:43 PM" DateTime="2008-10-07T12:15:43.104Z" SessionID="21"><From><User FriendlyName="Pierreth"/></From><To><User FriendlyName="- James O'"/></To><Text Style="font-family:Times New Roman; font-weight:bold; font-style:italic; color:#000000; ">ahh</Text></Message><Message Date="10/7/2008" Time="11:15:52 PM" DateTime="2008-10-07T12:15:52.597Z" SessionID="21"><From><User FriendlyName="Pierreth"/></From><To><User FriendlyName="- James O'"/></To><Text Style="font-family:Times New Roman; font-weight:bold; font-style:italic; color:#000000; ">thats inconvenient</Text></Message><Message Date="10/9/2008" Time="10:35:59 PM" DateTime="2008-10-09T11:35:59.916Z" SessionID="22"><From><User FriendlyName="Pierreth"/></From><To><User FriendlyName="- James O'"/></To><Text>hey man</Text></Message><Message Date="10/9/2008" Time="10:36:05 PM" DateTime="2008-10-09T11:36:05.562Z" SessionID="22"><From><User FriendlyName="- James O'"/></From><To><User FriendlyName="Pierreth"/></To><Text Style="font-family:MS Shell Dlg; color:#000000; ">Hi oh</Text></Message><Message Date="10/9/2008" Time="10:36:13 PM" DateTime="2008-10-09T11:36:13.364Z" SessionID="22"><From><User FriendlyName="Pierreth"/></From><To><User FriendlyName="- James O'"/></To><Text>i found a 1 month gold card</Text></Message><Message Date="10/9/2008" Time="10:36:18 PM" DateTime="2008-10-09T11:36:18.450Z" SessionID="22"><From><User FriendlyName="- James O'"/></From><To><User FriendlyName="Pierreth"/></To><Text Style="font-family:MS Shell Dlg; color:#000000; ">:-O:-O</Text></Message><Message Date="10/9/2008" Time="10:36:20 PM" DateTime="2008-10-09T11:36:20.663Z" SessionID="22"><From><User FriendlyName="- James O'"/></From><To><User FriendlyName="Pierreth"/></To><Text Style="font-family:MS Shell Dlg; color:#000000; ">wikkedsex!</Text></Message><Message Date="10/9/2008" Time="10:37:09 PM" DateTime="2008-10-09T11:37:09.913Z" SessionID="22"><From><User FriendlyName="- James O'"/></From><To><User FriendlyName="Pierreth"/></To><Text Style="font-family:MS Shell Dlg; color:#000000; ">Umm, I should save it for Fable 2 co-op?</Text></Message><Message Date="10/9/2008" Time="10:37:22 PM" DateTime="2008-10-09T11:37:22.848Z" SessionID="22"><From><User FriendlyName="Pierreth"/></From><To><User FriendlyName="- James O'"/></To><Text>i shall attemp to write u the code on this</Text></Message><Message Date="10/9/2008" Time="10:37:41 PM" DateTime="2008-10-09T11:37:41.731Z" SessionID="22"><From><User FriendlyName="Pierreth"/></From><To><User FriendlyName="- James O'"/></To><Text>or resident evil 5 co-op</Text></Message><Message Date="10/9/2008" Time="10:38:51 PM" DateTime="2008-10-09T11:38:51.815Z" SessionID="22"><From><User FriendlyName="- James O'"/></From><To><User FriendlyName="Pierreth"/></To><Text Style="font-family:MS Shell Dlg; color:#000000; ">ooh yeh</Text></Message><Message Date="10/9/2008" Time="10:39:18 PM" DateTime="2008-10-09T11:39:18.154Z" SessionID="22"><From><User FriendlyName="- James O'"/></From><To><User FriendlyName="Pierreth"/></To><Text Style="font-family:MS Shell Dlg; color:#000000; ">Checking release date</Text></Message><Message Date="10/9/2008" Time="10:40:29 PM" DateTime="2008-10-09T11:40:29.957Z" SessionID="22"><From><User FriendlyName="Pierreth"/></From><To><User FriendlyName="- James O'"/></To><Text>CPHXQ-4FRJ7-4P8Y8-R2KF6-G9J6Q</Text></Message><Message Date="10/9/2008" Time="10:41:00 PM" DateTime="2008-10-09T11:41:00.567Z" SessionID="22"><From><User FriendlyName="- James O'"/></From><To><User FriendlyName="Pierreth"/></To><Text Style="font-family:MS Shell Dlg; color:#000000; ">Revil isnt out till march next year</Text></Message><Message Date="10/9/2008" Time="10:41:06 PM" DateTime="2008-10-09T11:41:06.277Z" SessionID="22"><From><User FriendlyName="Pierreth"/></From><To><User FriendlyName="- James O'"/></To><Text>naww</Text></Message><Message Date="10/9/2008" Time="10:41:07 PM" DateTime="2008-10-09T11:41:07.792Z" SessionID="22"><From><User FriendlyName="Pierreth"/></From><To><User FriendlyName="- James O'"/></To><Text>ghey</Text></Message><Message Date="10/9/2008" Time="10:41:18 PM" DateTime="2008-10-09T11:41:18.553Z" SessionID="22"><From><User FriendlyName="Pierreth"/></From><To><User FriendlyName="- James O'"/></To><Text>are u gonna get the 12 month one?</Text></Message><Message Date="10/9/2008" Time="10:41:22 PM" DateTime="2008-10-09T11:41:22.996Z" SessionID="22"><From><User FriendlyName="- James O'"/></From><To><User FriendlyName="Pierreth"/></To><Text Style="font-family:MS Shell Dlg; color:#000000; ">so I'll prolly punch it in, in a week or two</Text></Message><Message Date="10/9/2008" Time="10:41:25 PM" DateTime="2008-10-09T11:41:25.547Z" SessionID="22"><From><User FriendlyName="- James O'"/></From><To><User FriendlyName="Pierreth"/></To><Text Style="font-family:MS Shell Dlg; color:#000000; ">I may yeah</Text></Message><Message Date="10/9/2008" Time="10:41:42 PM" DateTime="2008-10-09T11:41:42.320Z" SessionID="22"><From><User FriendlyName="- James O'"/></From><To><User FriendlyName="Pierreth"/></To><Text Style="font-family:MS Shell Dlg; color:#000000; ">or maybe after uni?</Text></Message><Message Date="10/9/2008" Time="10:41:47 PM" DateTime="2008-10-09T11:41:47.536Z" SessionID="22"><From><User FriendlyName="- James O'"/></From><To><User FriendlyName="Pierreth"/></To><Text Style="font-family:MS Shell Dlg; color:#000000; ">when free time=infinite</Text></Message><Message Date="10/9/2008" Time="10:42:10 PM" DateTime="2008-10-09T11:42:10.771Z" SessionID="23"><From><User FriendlyName="Pierreth"/></From><To><User FriendlyName="- James O'"/></To><Text>yay</Text></Message><Message Date="10/9/2008" Time="10:42:48 PM" DateTime="2008-10-09T11:42:48.133Z" SessionID="23"><From><User FriendlyName="Pierreth"/></From><To><User FriendlyName="- James O'"/></To><Text>we can play all sortsa games</Text></Message><Message Date="10/9/2008" Time="10:42:52 PM" DateTime="2008-10-09T11:42:52.444Z" SessionID="23"><From><User FriendlyName="Pierreth"/></From><To><User FriendlyName="- James O'"/></To><Text>like gta4</Text></Message><Message Date="10/9/2008" Time="10:43:01 PM" DateTime="2008-10-09T11:43:01.182Z" SessionID="23"><From><User FriendlyName="Pierreth"/></From><To><User FriendlyName="- James O'"/></To><Text>and so on and so forth</Text></Message><Message Date="10/9/2008" Time="10:43:20 PM" DateTime="2008-10-09T11:43:20.703Z" SessionID="23"><From><User FriendlyName="- James O'"/></From><To><User FriendlyName="Pierreth"/></To><Text Style="font-family:MS Shell Dlg; color:#000000; ">indeed</Text></Message><Message Date="10/9/2008" Time="10:43:26 PM" DateTime="2008-10-09T11:43:26.508Z" SessionID="23"><From><User FriendlyName="- James O'"/></From><To><User FriendlyName="Pierreth"/></To><Text Style="font-family:MS Shell Dlg; color:#000000; ">I finished the first COD2 campaign</Text></Message><Message Date="10/9/2008" Time="10:43:39 PM" DateTime="2008-10-09T11:43:39.735Z" SessionID="23"><From><User FriendlyName="- James O'"/></From><To><User FriendlyName="Pierreth"/></To><Text Style="font-family:MS Shell Dlg; color:#000000; ">I finished most of it on PC, but its still fun</Text></Message><Message Date="10/9/2008" Time="10:43:50 PM" DateTime="2008-10-09T11:43:50.289Z" SessionID="23"><From><User FriendlyName="- James O'"/></From><To><User FriendlyName="Pierreth"/></To><Text Style="font-family:MS Shell Dlg; color:#000000; ">good to just listen to podcasts and shoot thing whilst horizontal</Text></Message><Message Date="10/9/2008" Time="10:44:21 PM" DateTime="2008-10-09T11:44:21.262Z" SessionID="23"><From><User FriendlyName="Pierreth"/></From><To><User FriendlyName="- James O'"/></To><Text>i finished the game today</Text></Message><Message Date="10/9/2008" Time="10:44:49 PM" DateTime="2008-10-09T11:44:49.572Z" SessionID="23"><From><User FriendlyName="Pierreth"/></From><To><User FriendlyName="- James O'"/></To><Text>i had like 5 missions to go and decided id just finish it off on easy</Text></Message><Message Date="10/10/2008" Time="6:34:28 PM" DateTime="2008-10-10T07:34:28.645Z" SessionID="24"><From><User FriendlyName="- James O'"/></From><To><User FriendlyName="Pierreth"/></To><Text Style="font-family:MS Shell Dlg; color:#000000; ">Fable 2 Co-Op patch confirmed</Text></Message><Message Date="10/10/2008" Time="6:34:38 PM" DateTime="2008-10-10T07:34:38.051Z" SessionID="24"><From><User FriendlyName="- James O'"/></From><To><User FriendlyName="Pierreth"/></To><Text Style="font-family:MS Shell Dlg; color:#000000; ">So we can toale play and such:)</Text></Message><Message Date="10/10/2008" Time="6:34:52 PM" DateTime="2008-10-10T07:34:52.548Z" SessionID="24"><From><User FriendlyName="Pierreth"/></From><To><User FriendlyName="- James O'"/></To><Text Style="font-family:Times New Roman; font-weight:bold; font-style:italic; color:#000000; ">sex as</Text></Message><Message Date="10/10/2008" Time="6:35:24 PM" DateTime="2008-10-10T07:35:24.733Z" SessionID="24"><From><User FriendlyName="- James O'"/></From><To><User FriendlyName="Pierreth"/></To><Text Style="font-family:MS Shell Dlg; color:#000000; ">indeed</Text></Message><Message Date="10/10/2008" Time="6:35:33 PM" DateTime="2008-10-10T07:35:33.330Z" SessionID="24"><From><User FriendlyName="- James O'"/></From><To><User FriendlyName="Pierreth"/></To><Text Style="font-family:MS Shell Dlg; color:#000000; ">I burnt RS:Vegas 2 as well so we can tap a bit of that</Text></Message><Message Date="10/10/2008" Time="6:35:50 PM" DateTime="2008-10-10T07:35:50.666Z" SessionID="24"><From><User FriendlyName="Pierreth"/></From><To><User FriendlyName="- James O'"/></To><Text Style="font-family:Times New Roman; font-weight:bold; font-style:italic; color:#000000; ">nice</Text></Message><Message Date="10/10/2008" Time="6:36:02 PM" DateTime="2008-10-10T07:36:02.571Z" SessionID="24"><From><User FriendlyName="Pierreth"/></From><To><User FriendlyName="- James O'"/></To><Text Style="font-family:Times New Roman; font-weight:bold; font-style:italic; color:#000000; ">when u getting ur 12 months??!?!?!</Text></Message><Message Date="10/10/2008" Time="6:36:35 PM" DateTime="2008-10-10T07:36:35.460Z" SessionID="24"><From><User FriendlyName="- James O'"/></From><To><User FriendlyName="Pierreth"/></To><Text Style="font-family:MS Shell Dlg; color:#000000; ">I'll see how my one month goes</Text></Message><Message Date="10/10/2008" Time="6:36:50 PM" DateTime="2008-10-10T07:36:50.778Z" SessionID="24"><From><User FriendlyName="Pierreth"/></From><To><User FriendlyName="- James O'"/></To><Text Style="font-family:Times New Roman; font-weight:bold; font-style:italic; color:#000000; ">when u gonna use that?</Text></Message><Message Date="10/10/2008" Time="6:36:59 PM" DateTime="2008-10-10T07:36:59.146Z" SessionID="24"><From><User FriendlyName="- James O'"/></From><To><User FriendlyName="Pierreth"/></To><Text Style="font-family:MS Shell Dlg; color:#000000; ">if i can justify it then I will</Text></Message><Message Date="10/10/2008" Time="6:37:08 PM" DateTime="2008-10-10T07:37:08.512Z" SessionID="24"><From><User FriendlyName="- James O'"/></From><To><User FriendlyName="Pierreth"/></To><Text Style="font-family:MS Shell Dlg; color:#000000; ">Umm, either when fable 2 comes out, or after my exams</Text></Message><Message Date="10/10/2008" Time="6:37:12 PM" DateTime="2008-10-10T07:37:12.735Z" SessionID="24"><From><User FriendlyName="- James O'"/></From><To><User FriendlyName="Pierreth"/></To><Text Style="font-family:MS Shell Dlg; color:#000000; ">and I've free time+1</Text></Message><Message Date="10/10/2008" Time="6:37:32 PM" DateTime="2008-10-10T07:37:32.897Z" SessionID="25"><From><User FriendlyName="Pierreth"/></From><To><User FriendlyName="- James O'"/></To><Text Style="font-family:Times New Roman; font-weight:bold; font-style:italic; color:#000000; ">im not even excited for fable</Text></Message><Message Date="10/10/2008" Time="6:37:41 PM" DateTime="2008-10-10T07:37:41.028Z" SessionID="25"><From><User FriendlyName="- James O'"/></From><To><User FriendlyName="Pierreth"/></To><Text Style="font-family:MS Shell Dlg; color:#000000; ">o rly?</Text></Message><Message Date="10/10/2008" Time="6:37:41 PM" DateTime="2008-10-10T07:37:41.749Z" SessionID="25"><From><User FriendlyName="Pierreth"/></From><To><User FriendlyName="- James O'"/></To><Text Style="font-family:Times New Roman; font-weight:bold; font-style:italic; color:#000000; ">ther i said it!</Text></Message><Message Date="10/10/2008" Time="6:37:44 PM" DateTime="2008-10-10T07:37:44.797Z" SessionID="25"><From><User FriendlyName="- James O'"/></From><To><User FriendlyName="Pierreth"/></To><Text Style="font-family:MS Shell Dlg; color:#000000; ">I think it looks fun</Text></Message><Message Date="10/10/2008" Time="6:37:45 PM" DateTime="2008-10-10T07:37:45.467Z" SessionID="25"><From><User FriendlyName="Pierreth"/></From><To><User FriendlyName="- James O'"/></To><Text Style="font-family:Times New Roman; font-weight:bold; font-style:italic; color:#000000; ">:D</Text></Message><Message Date="10/10/2008" Time="6:37:50 PM" DateTime="2008-10-10T07:37:50.981Z" SessionID="25"><From><User FriendlyName="Pierreth"/></From><To><User FriendlyName="- James O'"/></To><Text Style="font-family:Times New Roman; font-weight:bold; font-style:italic; color:#000000; ">i dunno</Text></Message><Message Date="10/10/2008" Time="6:37:57 PM" DateTime="2008-10-10T07:37:57.611Z" SessionID="25"><From><User FriendlyName="Pierreth"/></From><To><User FriendlyName="- James O'"/></To><Text Style="font-family:Times New Roman; font-weight:bold; font-style:italic; color:#000000; ">i think it looks too much like the first one</Text></Message><Message Date="10/10/2008" Time="6:38:03 PM" DateTime="2008-10-10T07:38:03.744Z" SessionID="25"><From><User FriendlyName="Pierreth"/></From><To><User FriendlyName="- James O'"/></To><Text Style="font-family:Times New Roman; font-weight:bold; font-style:italic; color:#000000; ">which i found to be quite dull</Text></Message><Message Date="10/10/2008" Time="6:38:05 PM" DateTime="2008-10-10T07:38:05.778Z" SessionID="25"><From><User FriendlyName="- James O'"/></From><To><User FriendlyName="Pierreth"/></To><Text Style="font-family:MS Shell Dlg; color:#000000; ">plus there's an achievement for having an orgie</Text></Message><Message Date="10/10/2008" Time="6:38:13 PM" DateTime="2008-10-10T07:38:13.183Z" SessionID="25"><From><User FriendlyName="Pierreth"/></From><To><User FriendlyName="- James O'"/></To><Text Style="font-family:Times New Roman; font-weight:bold; font-style:italic; color:#000000; ">holy shit</Text></Message><Message Date="10/10/2008" Time="6:38:25 PM" DateTime="2008-10-10T07:38:25.768Z" SessionID="25"><From><User FriendlyName="Pierreth"/></From><To><User FriendlyName="- James O'"/></To><Text Style="font-family:Times New Roman; font-weight:bold; font-style:italic; color:#000000; ">they always had some cool humour in it</Text></Message><Message Date="10/10/2008" Time="6:38:26 PM" DateTime="2008-10-10T07:38:26.919Z" SessionID="25"><From><User FriendlyName="- James O'"/></From><To><User FriendlyName="Pierreth"/></To><Text Style="font-family:MS Shell Dlg; color:#000000; ">"responsibly particpate in an orgy"</Text></Message><Message Date="10/10/2008" Time="6:38:39 PM" DateTime="2008-10-10T07:38:39.333Z" SessionID="25"><From><User FriendlyName="- James O'"/></From><To><User FriendlyName="Pierreth"/></To><Text Style="font-family:MS Shell Dlg; color:#000000; ">Nah I'm keen to play it, I dont think it will be GoTY or nothing</Text></Message><Message Date="10/10/2008" Time="6:38:50 PM" DateTime="2008-10-10T07:38:50.011Z" SessionID="25"><From><User FriendlyName="- James O'"/></From><To><User FriendlyName="Pierreth"/></To><Text Style="font-family:MS Shell Dlg; color:#000000; ">but atleast worth while</Text></Message><Message Date="10/10/2008" Time="6:39:02 PM" DateTime="2008-10-10T07:39:02.490Z" SessionID="25"><From><User FriendlyName="- James O'"/></From><To><User FriendlyName="Pierreth"/></To><Text Style="font-family:MS Shell Dlg; color:#000000; ">I found the first game fun, a little bit easy and narrow in scope</Text></Message><Message Date="10/10/2008" Time="6:39:11 PM" DateTime="2008-10-10T07:39:11.856Z" SessionID="25"><From><User FriendlyName="- James O'"/></From><To><User FriendlyName="Pierreth"/></To><Text Style="font-family:MS Shell Dlg; color:#000000; ">But man, Fable 2 looks so beautiful,</Text></Message><Message Date="10/10/2008" Time="6:39:16 PM" DateTime="2008-10-10T07:39:16.264Z" SessionID="25"><From><User FriendlyName="- James O'"/></From><To><User FriendlyName="Pierreth"/></To><Text Style="font-family:MS Shell Dlg; color:#000000; ">http://www.youtube.com/watch?v=_AaeCqASFZU</Text></Message><Message Date="10/10/2008" Time="6:39:20 PM" DateTime="2008-10-10T07:39:20.063Z" SessionID="25"><From><User FriendlyName="- James O'"/></From><To><User FriendlyName="Pierreth"/></To><Text Style="font-family:MS Shell Dlg; color:#000000; ">oh and See my scout ness</Text></Message><Message Date="10/10/2008" Time="6:39:37 PM" DateTime="2008-10-10T07:39:37.270Z" SessionID="25"><From><User FriendlyName="- James O'"/></From><To><User FriendlyName="Pierreth"/></To><Text Style="font-family:MS Shell Dlg; color:#000000; ">Its not a terrific show of my skilz, but you know, it was my first recording</Text></Message><Message Date="10/10/2008" Time="6:44:18 PM" DateTime="2008-10-10T07:44:18.497Z" SessionID="26"><From><User FriendlyName="Pierreth"/></From><To><User FriendlyName="- James O'"/></To><Text Style="font-family:Times New Roman; font-weight:bold; font-style:italic; color:#000000; ">it wonderful</Text></Message><Message Date="10/10/2008" Time="6:58:48 PM" DateTime="2008-10-10T07:58:48.434Z" SessionID="26"><From><User FriendlyName="- James O'"/></From><To><User FriendlyName="Pierreth"/></To><Text Style="font-family:MS Shell Dlg; color:#000000; ">I mostly just wanted to capture a few kills and me batting in a heavy</Text></Message><Message Date="10/10/2008" Time="6:58:59 PM" DateTime="2008-10-10T07:58:59.488Z" SessionID="26"><From><User FriendlyName="- James O'"/></From><To><User FriendlyName="Pierreth"/></To><Text Style="font-family:MS Shell Dlg; color:#000000; ">(not easy to do, heavies rip scouts, but totaly awesome when you do)</Text></Message><Message Date="10/11/2008" Time="5:52:04 PM" DateTime="2008-10-11T06:52:04.544Z" SessionID="27"><From><User FriendlyName="Pierreth"/></From><To><User FriendlyName="- James O'"/></To><Text>hey jimy</Text></Message><Message Date="10/11/2008" Time="5:52:06 PM" DateTime="2008-10-11T06:52:06.413Z" SessionID="27"><From><User FriendlyName="Pierreth"/></From><To><User FriendlyName="- James O'"/></To><Text>come play haloz with us</Text></Message><Message Date="10/11/2008" Time="5:52:11 PM" DateTime="2008-10-11T06:52:11.947Z" SessionID="27"><From><User FriendlyName="- James O'"/></From><To><User FriendlyName="Pierreth"/></To><Text Style="font-family:MS Shell Dlg; color:#000000; ">gtg</Text></Message><Message Date="10/11/2008" Time="5:52:17 PM" DateTime="2008-10-11T06:52:17.417Z" SessionID="27"><From><User FriendlyName="- James O'"/></From><To><User FriendlyName="Pierreth"/></To><Text Style="font-family:MS Shell Dlg; color:#000000; ">sorry, going 2 newtown</Text></Message><Message Date="10/11/2008" Time="5:52:26 PM" DateTime="2008-10-11T06:52:26.875Z" SessionID="27"><From><User FriendlyName="Pierreth"/></From><To><User FriendlyName="- James O'"/></To><Text>with ur boyfriend?</Text></Message><Message Date="10/11/2008" Time="5:52:43 PM" DateTime="2008-10-11T06:52:43.478Z" SessionID="27"><From><User FriendlyName="- James O'"/></From><To><User FriendlyName="Pierreth"/></To><Text Style="font-family:MS Shell Dlg; color:#000000; ">brother</Text></Message><Message Date="10/11/2008" Time="5:52:45 PM" DateTime="2008-10-11T06:52:45.366Z" SessionID="27"><From><User FriendlyName="- James O'"/></From><To><User FriendlyName="Pierreth"/></To><Text Style="font-family:MS Shell Dlg; color:#000000; ">family din dins</Text></Message><Message Date="10/11/2008" Time="5:52:50 PM" DateTime="2008-10-11T06:52:50.670Z" SessionID="27"><From><User FriendlyName="Pierreth"/></From><To><User FriendlyName="- James O'"/></To><Text>ok man</Text></Message><Message Date="10/11/2008" Time="5:52:51 PM" DateTime="2008-10-11T06:52:51.253Z" SessionID="27"><From><User FriendlyName="- James O'"/></From><To><User FriendlyName="Pierreth"/></To><Text Style="font-family:MS Shell Dlg; color:#000000; ">Back laters 2nite</Text></Message><Message Date="10/11/2008" Time="5:52:54 PM" DateTime="2008-10-11T06:52:54.491Z" SessionID="28"><From><User FriendlyName="Pierreth"/></From><To><User FriendlyName="- James O'"/></To><Text>have funzzzoe</Text></Message><Message Date="10/11/2008" Time="5:53:05 PM" DateTime="2008-10-11T06:53:05.795Z" SessionID="28"><From><User FriendlyName="- James O'"/></From><To><User FriendlyName="Pierreth"/></To><Text Style="font-family:MS Shell Dlg; color:#000000; ">kkz</Text></Message><Message Date="10/12/2008" Time="3:22:23 PM" DateTime="2008-10-12T04:22:23.715Z" SessionID="29"><From><User FriendlyName="- James O'"/></From><To><User FriendlyName="Pierreth"/></To><Text Style="font-family:MS Shell Dlg; color:#000000; ">Fallout 3 is on the net</Text></Message><Message Date="10/12/2008" Time="3:22:39 PM" DateTime="2008-10-12T04:22:39.127Z" SessionID="29"><From><User FriendlyName="- James O'"/></From><To><User FriendlyName="Pierreth"/></To><Text Style="font-family:MS Shell Dlg; color:#000000; ">I dont have the bandwidth, but u shood see if that guy you got ur 360 modded off has it yet</Text></Message><Message Date="10/15/2008" Time="9:41:44 AM" DateTime="2008-10-14T22:41:44.624Z" SessionID="30"><From><User FriendlyName="Pierreth"/></From><To><User FriendlyName="- James O'"/></To><Text Style="font-family:Times New Roman; font-weight:bold; font-style:italic; color:#000000; ">link me to fallout 3 and i will DL it</Text></Message><Message Date="10/15/2008" Time="10:05:38 AM" DateTime="2008-10-14T23:05:38.671Z" SessionID="30"><From><User FriendlyName="- James O'"/></From><To><User FriendlyName="Pierreth"/></To><Text Style="font-family:MS Shell Dlg; color:#000000; ">http://www.ilovetorrents.com/</Text></Message><Message Date="10/15/2008" Time="10:05:43 AM" DateTime="2008-10-14T23:05:43.661Z" SessionID="30"><From><User FriendlyName="- James O'"/></From><To><User FriendlyName="Pierreth"/></To><Text Style="font-family:MS Shell Dlg; color:#000000; ">You have 2 register there</Text></Message><Message Date="10/15/2008" Time="10:05:46 AM" DateTime="2008-10-14T23:05:46.420Z" SessionID="30"><From><User FriendlyName="- James O'"/></From><To><User FriendlyName="Pierreth"/></To><Text Style="font-family:MS Shell Dlg; color:#000000; ">its a private tracker</Text></Message><Message Date="10/15/2008" Time="10:05:52 AM" DateTime="2008-10-14T23:05:52.835Z" SessionID="30"><From><User FriendlyName="- James O'"/></From><To><User FriendlyName="Pierreth"/></To><Text Style="font-family:MS Shell Dlg; color:#000000; ">300 seeds to like 30 leechers</Text></Message><Message Date="10/16/2008" Time="8:43:34 AM" DateTime="2008-10-15T21:43:34.794Z" SessionID="31"><From><User FriendlyName="Pierreth"/></From><To><User FriendlyName="- James O'"/></To><Text>ive started downloading fallout 3 as of 8:40 16/10/2008</Text></Message><Message Date="10/16/2008" Time="8:43:40 AM" DateTime="2008-10-15T21:43:40.791Z" SessionID="31"><From><User FriendlyName="Pierreth"/></From><To><User FriendlyName="- James O'"/></To><Text>it recons ther's nine hours to go</Text></Message><Message Date="10/16/2008" Time="8:44:16 AM" DateTime="2008-10-15T21:44:16.262Z" SessionID="31"><From><User FriendlyName="Pierreth"/></From><To><User FriendlyName="- James O'"/></To><Text>but im going to have to stop the download when i go to uni coz my rents will be using the computer and complaining about the speed things are moving</Text></Message><Message Date="10/16/2008" Time="8:44:32 AM" DateTime="2008-10-15T21:44:32.629Z" SessionID="31"><From><User FriendlyName="Pierreth"/></From><To><User FriendlyName="- James O'"/></To><Text>i'll set it up to DL over night so hopefully we can be playing it by the weekened.</Text></Message><Message Date="10/16/2008" Time="8:44:34 AM" DateTime="2008-10-15T21:44:34.388Z" SessionID="31"><From><User FriendlyName="Pierreth"/></From><To><User FriendlyName="- James O'"/></To><Text>yipppe</Text></Message><Message Date="10/17/2008" Time="2:22:41 PM" DateTime="2008-10-17T03:22:41.779Z" SessionID="32"><From><User FriendlyName="Pierreth"/></From><To><User FriendlyName="- James O'"/></To><Text Style="font-family:Times New Roman; font-weight:bold; font-style:italic; color:#000000; ">hey man</Text></Message><Message Date="10/17/2008" Time="2:22:44 PM" DateTime="2008-10-17T03:22:44.854Z" SessionID="32"><From><User FriendlyName="- James O'"/></From><To><User FriendlyName="Pierreth"/></To><Text Style="font-family:MS Shell Dlg; color:#000000; ">hihi</Text></Message><Message Date="10/17/2008" Time="2:22:48 PM" DateTime="2008-10-17T03:22:48.129Z" SessionID="32"><From><User FriendlyName="Pierreth"/></From><To><User FriendlyName="- James O'"/></To><Text Style="font-family:Times New Roman; font-weight:bold; font-style:italic; color:#000000; ">my stupido father turned the computer off last night</Text></Message><Message Date="10/17/2008" Time="2:22:56 PM" DateTime="2008-10-17T03:22:56.524Z" SessionID="32"><From><User FriendlyName="Pierreth"/></From><To><User FriendlyName="- James O'"/></To><Text Style="font-family:Times New Roman; font-weight:bold; font-style:italic; color:#000000; ">and i only just got home from work</Text></Message><Message Date="10/17/2008" Time="2:23:04 PM" DateTime="2008-10-17T03:23:04.989Z" SessionID="32"><From><User FriendlyName="Pierreth"/></From><To><User FriendlyName="- James O'"/></To><Text Style="font-family:Times New Roman; font-weight:bold; font-style:italic; color:#000000; ">so ive just started DLing fallout again</Text></Message><Message Date="10/17/2008" Time="2:25:57 PM" DateTime="2008-10-17T03:25:57.277Z" SessionID="32"><From><User FriendlyName="- James O'"/></From><To><User FriendlyName="Pierreth"/></To><Text Style="font-family:MS Shell Dlg; color:#000000; ">no worries</Text></Message><Message Date="10/17/2008" Time="2:26:04 PM" DateTime="2008-10-17T03:26:04.820Z" SessionID="32"><From><User FriendlyName="- James O'"/></From><To><User FriendlyName="Pierreth"/></To><Text Style="font-family:MS Shell Dlg; color:#000000; ">I shouldnt have any new games till uni is done :(</Text></Message><Message Date="10/17/2008" Time="2:26:20 PM" DateTime="2008-10-17T03:26:20.556Z" SessionID="32"><From><User FriendlyName="Pierreth"/></From><To><User FriendlyName="- James O'"/></To><Text Style="font-family:Times New Roman; font-weight:bold; font-style:italic; color:#000000; ">yes u should</Text></Message><Message Date="10/17/2008" Time="2:26:22 PM" DateTime="2008-10-17T03:26:22.085Z" SessionID="32"><From><User FriendlyName="- James O'"/></From><To><User FriendlyName="Pierreth"/></To><Text Style="font-family:MS Shell Dlg; color:#000000; ">4 days till fable 2</Text></Message><Message Date="10/17/2008" Time="2:26:28 PM" DateTime="2008-10-17T03:26:28.930Z" SessionID="32"><From><User FriendlyName="- James O'"/></From><To><User FriendlyName="Pierreth"/></To><Text Style="font-family:MS Shell Dlg; color:#000000; ">6 in aus</Text></Message><Message Date="10/17/2008" Time="2:26:31 PM" DateTime="2008-10-17T03:26:31.153Z" SessionID="32"><From><User FriendlyName="- James O'"/></From><To><User FriendlyName="Pierreth"/></To><Text Style="font-family:MS Shell Dlg; color:#000000; ">next weekend</Text></Message><Message Date="10/17/2008" Time="2:26:35 PM" DateTime="2008-10-17T03:26:35.492Z" SessionID="33"><From><User FriendlyName="Pierreth"/></From><To><User FriendlyName="- James O'"/></To><Text Style="font-family:Times New Roman; font-weight:bold; font-style:italic; color:#000000; ">yeh</Text></Message><Message Date="10/17/2008" Time="2:26:40 PM" DateTime="2008-10-17T03:26:40.794Z" SessionID="33"><From><User FriendlyName="Pierreth"/></From><To><User FriendlyName="- James O'"/></To><Text Style="font-family:Times New Roman; font-weight:bold; font-style:italic; color:#000000; ">same day as farcry 2</Text></Message><Message Date="10/17/2008" Time="2:26:49 PM" DateTime="2008-10-17T03:26:49.033Z" SessionID="33"><From><User FriendlyName="- James O'"/></From><To><User FriendlyName="Pierreth"/></To><Text Style="font-family:MS Shell Dlg; color:#000000; ">(A)</Text></Message><Message Date="10/17/2008" Time="2:26:55 PM" DateTime="2008-10-17T03:26:55.193Z" SessionID="33"><From><User FriendlyName="Pierreth"/></From><To><User FriendlyName="- James O'"/></To><Text Style="font-family:Times New Roman; font-weight:bold; font-style:italic; color:#000000; ">a holy day</Text></Message><Message Date="10/17/2008" Time="2:28:41 PM" DateTime="2008-10-17T03:28:41.341Z" SessionID="34"><From><User FriendlyName="Pierreth"/></From><To><User FriendlyName="- James O'"/></To><Text Style="font-family:Times New Roman; font-weight:bold; font-style:italic; color:#000000; ">id like to get saints row 2</Text></Message><Message Date="10/17/2008" Time="2:28:54 PM" DateTime="2008-10-17T03:28:54.132Z" SessionID="34"><From><User FriendlyName="Pierreth"/></From><To><User FriendlyName="- James O'"/></To><Text Style="font-family:Times New Roman; font-weight:bold; font-style:italic; color:#000000; ">its all drop-in/out co-op</Text></Message><Message Date="10/17/2008" Time="4:10:22 PM" DateTime="2008-10-17T05:10:22.714Z" SessionID="35"><From><User FriendlyName="- James O'"/></From><To><User FriendlyName="Pierreth"/></To><Text Style="font-family:MS Shell Dlg; color:#000000; ">Fable 2 is leaked too</Text></Message><Message Date="10/22/2008" Time="11:14:24 AM" DateTime="2008-10-22T00:14:24.994Z" SessionID="36"><From><User FriendlyName="- James O'"/></From><To><User FriendlyName="Pierreth"/></To><Text Style="font-family:MS Shell Dlg; color:#000000; ">oh hai</Text></Message><Message Date="10/22/2008" Time="11:14:26 AM" DateTime="2008-10-22T00:14:26.029Z" SessionID="36"><From><User FriendlyName="- James O'"/></From><To><User FriendlyName="Pierreth"/></To><Text Style="font-family:MS Shell Dlg; color:#000000; ">pc back</Text></Message><Message Date="10/22/2008" Time="11:14:37 AM" DateTime="2008-10-22T00:14:37.494Z" SessionID="36"><From><User FriendlyName="Pierreth"/></From><To><User FriendlyName="- James O'"/></To><Text Style="font-family:Times New Roman; font-weight:bold; font-style:italic; color:#000000; ">sexcellent</Text></Message><Message Date="10/22/2008" Time="11:14:44 AM" DateTime="2008-10-22T00:14:44.088Z" SessionID="36"><From><User FriendlyName="Pierreth"/></From><To><User FriendlyName="- James O'"/></To><Text Style="font-family:Times New Roman; font-weight:bold; font-style:italic; color:#000000; ">did jared bring fable 2 over?</Text></Message><Message Date="10/22/2008" Time="11:14:46 AM" DateTime="2008-10-22T00:14:46.828Z" SessionID="36"><From><User FriendlyName="- James O'"/></From><To><User FriendlyName="Pierreth"/></To><Text Style="font-family:MS Shell Dlg; color:#000000; ">no</Text></Message><Message Date="10/22/2008" Time="11:14:50 AM" DateTime="2008-10-22T00:14:50.307Z" SessionID="36"><From><User FriendlyName="- James O'"/></From><To><User FriendlyName="Pierreth"/></To><Text Style="font-family:MS Shell Dlg; color:#000000; ">I've got a date today</Text></Message><Message Date="10/22/2008" Time="11:14:59 AM" DateTime="2008-10-22T00:14:59.026Z" SessionID="36"><From><User FriendlyName="- James O'"/></From><To><User FriendlyName="Pierreth"/></To><Text Style="font-family:MS Shell Dlg; color:#000000; ">not sure when it'll end</Text></Message><Message Date="10/22/2008" Time="11:15:06 AM" DateTime="2008-10-22T00:15:06.878Z" SessionID="36"><From><User FriendlyName="- James O'"/></From><To><User FriendlyName="Pierreth"/></To><Text Style="font-family:MS Shell Dlg; color:#000000; ">but I should be relatively free this afternoon</Text></Message><Message Date="10/22/2008" Time="11:15:18 AM" DateTime="2008-10-22T00:15:18.606Z" SessionID="36"><From><User FriendlyName="Pierreth"/></From><To><User FriendlyName="- James O'"/></To><Text Style="font-family:Times New Roman; font-weight:bold; font-style:italic; color:#000000; ">a date with who?</Text></Message><Message Date="10/22/2008" Time="11:15:33 AM" DateTime="2008-10-22T00:15:33.367Z" SessionID="36"><From><User FriendlyName="- James O'"/></From><To><User FriendlyName="Pierreth"/></To><Text Style="font-family:MS Shell Dlg; color:#000000; ">John Harkins</Text></Message><Message Date="10/22/2008" Time="11:15:40 AM" DateTime="2008-10-22T00:15:40.212Z" SessionID="36"><From><User FriendlyName="Pierreth"/></From><To><User FriendlyName="- James O'"/></To><Text Style="font-family:Times New Roman; font-weight:bold; font-style:italic; color:#000000; ">:|</Text></Message><Message Date="10/22/2008" Time="11:15:42 AM" DateTime="2008-10-22T00:15:42.585Z" SessionID="36"><From><User FriendlyName="Pierreth"/></From><To><User FriendlyName="- James O'"/></To><Text Style="font-family:Times New Roman; font-weight:bold; font-style:italic; color:#000000; ">is he cute?</Text></Message><Message Date="10/22/2008" Time="11:15:43 AM" DateTime="2008-10-22T00:15:43.424Z" SessionID="36"><From><User FriendlyName="- James O'"/></From><To><User FriendlyName="Pierreth"/></To><Text Style="font-family:MS Shell Dlg; color:#000000; ">Im gay</Text></Message><Message Date="10/22/2008" Time="11:15:47 AM" DateTime="2008-10-22T00:15:47.276Z" SessionID="36"><From><User FriendlyName="- James O'"/></From><To><User FriendlyName="Pierreth"/></To><Text Style="font-family:MS Shell Dlg; color:#000000; ">no overly</Text></Message><Message Date="10/22/2008" Time="11:15:55 AM" DateTime="2008-10-22T00:15:55.757Z" SessionID="36"><From><User FriendlyName="- James O'"/></From><To><User FriendlyName="Pierreth"/></To><Text Style="font-family:MS Shell Dlg; color:#000000; ">Its the guy who's cd Im designing</Text></Message><Message Date="10/22/2008" Time="11:15:56 AM" DateTime="2008-10-22T00:15:56.752Z" SessionID="36"><From><User FriendlyName="Pierreth"/></From><To><User FriendlyName="- James O'"/></To><Text Style="font-family:Times New Roman; font-weight:bold; font-style:italic; color:#000000; ">what is it for?</Text></Message><Message Date="10/22/2008" Time="11:15:58 AM" DateTime="2008-10-22T00:15:58.754Z" SessionID="36"><From><User FriendlyName="Pierreth"/></From><To><User FriendlyName="- James O'"/></To><Text Style="font-family:Times New Roman; font-weight:bold; font-style:italic; color:#000000; ">ahh kk</Text></Message><Message Date="10/22/2008" Time="11:21:31 AM" DateTime="2008-10-22T00:21:31.602Z" SessionID="36"><From><User FriendlyName="Pierreth"/></From><To><User FriendlyName="- James O'"/></To><Text Style="font-family:Times New Roman; font-weight:bold; font-style:italic; color:#000000; ">you free 2morro?</Text></Message><Message Date="10/22/2008" Time="11:21:38 AM" DateTime="2008-10-22T00:21:38.135Z" SessionID="36"><From><User FriendlyName="- James O'"/></From><To><User FriendlyName="Pierreth"/></To><Text Style="font-family:MS Shell Dlg; color:#000000; ">Umm, yes</Text></Message><Message Date="10/22/2008" Time="11:21:41 AM" DateTime="2008-10-22T00:21:41.024Z" SessionID="36"><From><User FriendlyName="Pierreth"/></From><To><User FriendlyName="- James O'"/></To><Text Style="font-family:Times New Roman; font-weight:bold; font-style:italic; color:#000000; ">coz that's when far cry 2 comes out</Text></Message><Message Date="10/22/2008" Time="11:21:42 AM" DateTime="2008-10-22T00:21:42.159Z" SessionID="36"><From><User FriendlyName="- James O'"/></From><To><User FriendlyName="Pierreth"/></To><Text Style="font-family:MS Shell Dlg; color:#000000; ">after 2ih</Text></Message><Message Date="10/22/2008" Time="11:21:44 AM" DateTime="2008-10-22T00:21:44.108Z" SessionID="36"><From><User FriendlyName="- James O'"/></From><To><User FriendlyName="Pierreth"/></To><Text Style="font-family:MS Shell Dlg; color:#000000; ">2ish</Text></Message><Message Date="10/22/2008" Time="11:21:47 AM" DateTime="2008-10-22T00:21:47.589Z" SessionID="36"><From><User FriendlyName="Pierreth"/></From><To><User FriendlyName="- James O'"/></To><Text Style="font-family:Times New Roman; font-weight:bold; font-style:italic; color:#000000; ">kk</Text></Message><Message Date="10/22/2008" Time="11:21:47 AM" DateTime="2008-10-22T00:21:47.830Z" SessionID="36"><From><User FriendlyName="- James O'"/></From><To><User FriendlyName="Pierreth"/></To><Text Style="font-family:MS Shell Dlg; color:#000000; ">I got uni, but finishes at 1230</Text></Message><Message Date="10/22/2008" Time="11:21:58 AM" DateTime="2008-10-22T00:21:58.140Z" SessionID="36"><From><User FriendlyName="- James O'"/></From><To><User FriendlyName="Pierreth"/></To><Text Style="font-family:MS Shell Dlg; color:#000000; ">usualyl leave 11:40ihs</Text></Message><Message Date="10/22/2008" Time="11:22:04 AM" DateTime="2008-10-22T00:22:04.656Z" SessionID="36"><From><User FriendlyName="Pierreth"/></From><To><User FriendlyName="- James O'"/></To><Text Style="font-family:Times New Roman; font-weight:bold; font-style:italic; color:#000000; ">kkkk</Text></Message><Message Date="10/22/2008" Time="11:23:48 AM" DateTime="2008-10-22T00:23:48.654Z" SessionID="36"><From><User FriendlyName="- James O'"/></From><To><User FriendlyName="Pierreth"/></To><Text Style="font-family:MS Shell Dlg; color:#000000; ">http://www.engadget.com/2008/10/21/asus-eee-pc-s101-hands-on/</Text></Message><Message Date="10/22/2008" Time="11:31:08 AM" DateTime="2008-10-22T00:31:08.694Z" SessionID="37"><From><User FriendlyName="Pierreth"/></From><To><User FriendlyName="- James O'"/></To><Text Style="font-family:Times New Roman; font-weight:bold; font-style:italic; color:#000000; ">that the one u getting?</Text></Message><Message Date="10/22/2008" Time="11:31:14 AM" DateTime="2008-10-22T00:31:14.613Z" SessionID="37"><From><User FriendlyName="- James O'"/></From><To><User FriendlyName="Pierreth"/></To><Text Style="font-family:MS Shell Dlg; color:#000000; ">want**</Text></Message><Message Date="10/22/2008" Time="11:31:25 AM" DateTime="2008-10-22T00:31:25.994Z" SessionID="37"><From><User FriendlyName="- James O'"/></From><To><User FriendlyName="Pierreth"/></To><Text Style="font-family:MS Shell Dlg; color:#000000; ">price was announced at $700 US</Text></Message><Message Date="10/22/2008" Time="11:31:30 AM" DateTime="2008-10-22T00:31:30.138Z" SessionID="37"><From><User FriendlyName="- James O'"/></From><To><User FriendlyName="Pierreth"/></To><Text Style="font-family:MS Shell Dlg; color:#000000; ">so depends on the mark up</Text></Message><Message Date="10/22/2008" Time="11:31:36 AM" DateTime="2008-10-22T00:31:36.002Z" SessionID="37"><From><User FriendlyName="Pierreth"/></From><To><User FriendlyName="- James O'"/></To><Text Style="font-family:Times New Roman; font-weight:bold; font-style:italic; color:#000000; ">kk</Text></Message><Message Date="10/22/2008" Time="11:31:46 AM" DateTime="2008-10-22T00:31:46.714Z" SessionID="37"><From><User FriendlyName="- James O'"/></From><To><User FriendlyName="Pierreth"/></To><Text Style="font-family:MS Shell Dlg; color:#000000; ">or if the us dollar shits itself again, i can get daddy to get one overseas</Text></Message><Message Date="10/22/2008" Time="11:32:01 AM" DateTime="2008-10-22T00:32:01.124Z" SessionID="37"><From><User FriendlyName="Pierreth"/></From><To><User FriendlyName="- James O'"/></To><Text Style="font-family:Times New Roman; font-weight:bold; font-style:italic; color:#000000; ">yeh</Text></Message><Message Date="10/22/2008" Time="11:35:49 AM" DateTime="2008-10-22T00:35:49.950Z" SessionID="37"><From><User FriendlyName="- James O'"/></From><To><User FriendlyName="Pierreth"/></To><Text Style="font-family:MS Shell Dlg; color:#000000; ">oh and I bought WoW</Text></Message><Message Date="10/22/2008" Time="11:35:55 AM" DateTime="2008-10-22T00:35:55.450Z" SessionID="37"><From><User FriendlyName="- James O'"/></From><To><User FriendlyName="Pierreth"/></To><Text Style="font-family:MS Shell Dlg; color:#000000; ">for after uni</Text></Message><Message Date="10/22/2008" Time="11:37:02 AM" DateTime="2008-10-22T00:37:02.804Z" SessionID="37"><From><User FriendlyName="Pierreth"/></From><To><User FriendlyName="- James O'"/></To><Text Style="font-family:Times New Roman; font-weight:bold; font-style:italic; color:#000000; ">lol</Text></Message><Message Date="10/22/2008" Time="11:41:00 AM" DateTime="2008-10-22T00:41:00.615Z" SessionID="37"><From><User FriendlyName="- James O'"/></From><To><User FriendlyName="Pierreth"/></To><Text Style="font-family:MS Shell Dlg; color:#000000; ">to play with uni friends</Text></Message><Message Date="10/22/2008" Time="11:41:04 AM" DateTime="2008-10-22T00:41:04.823Z" SessionID="37"><From><User FriendlyName="- James O'"/></From><To><User FriendlyName="Pierreth"/></To><Text Style="font-family:MS Shell Dlg; color:#000000; ">Alan Wake looks good</Text></Message><Message Date="10/22/2008" Time="11:41:05 AM" DateTime="2008-10-22T00:41:05.110Z" SessionID="37"><From><User FriendlyName="- James O'"/></From><To><User FriendlyName="Pierreth"/></To><Text Style="font-family:MS Shell Dlg; color:#000000; ">http://www.1up.com/do/blogEntry?bId=8919651&amp;publicUserId=5380373</Text></Message><Message Date="10/22/2008" Time="4:00:36 PM" DateTime="2008-10-22T05:00:36.008Z" SessionID="38"><From><User FriendlyName="- James O'"/></From><To><User FriendlyName="Pierreth"/></To><Text Style="font-family:MS Shell Dlg; color:#000000; ">oh hai</Text></Message><Message Date="10/22/2008" Time="4:00:45 PM" DateTime="2008-10-22T05:00:45.825Z" SessionID="39"><From><User FriendlyName="Pierreth"/></From><To><User FriendlyName="- James O'"/></To><Text Style="font-family:Times New Roman; font-weight:bold; font-style:italic; color:#000000; ">hey BREW!</Text></Message><Message Date="10/22/2008" Time="4:01:16 PM" DateTime="2008-10-22T05:01:16.595Z" SessionID="39"><From><User FriendlyName="Pierreth"/></From><To><User FriendlyName="- James O'"/></To><Text Style="font-family:Times New Roman; font-weight:bold; font-style:italic; color:#000000; ">why cant far cry 2 be out today?!</Text></Message><Message Date="10/22/2008" Time="4:01:26 PM" DateTime="2008-10-22T05:01:26.961Z" SessionID="39"><From><User FriendlyName="Pierreth"/></From><To><User FriendlyName="- James O'"/></To><Text Style="font-family:Times New Roman; font-weight:bold; font-style:italic; color:#000000; ">i just wanna get some games!</Text></Message><Message Date="10/22/2008" Time="4:01:35 PM" DateTime="2008-10-22T05:01:35.173Z" SessionID="39"><From><User FriendlyName="Pierreth"/></From><To><User FriendlyName="- James O'"/></To><Text Style="font-family:Times New Roman; font-weight:bold; font-style:italic; color:#000000; ">i mean...ive got saints row</Text></Message><Message Date="10/22/2008" Time="4:01:40 PM" DateTime="2008-10-22T05:01:40.110Z" SessionID="39"><From><User FriendlyName="Pierreth"/></From><To><User FriendlyName="- James O'"/></To><Text Style="font-family:Times New Roman; font-weight:bold; font-style:italic; color:#000000; ">and fallout 3</Text></Message><Message Date="10/22/2008" Time="4:01:42 PM" DateTime="2008-10-22T05:01:42.702Z" SessionID="39"><From><User FriendlyName="- James O'"/></From><To><User FriendlyName="Pierreth"/></To><Text Style="font-family:MS Shell Dlg; color:#000000; ">we could burn fall out now?</Text></Message><Message Date="10/22/2008" Time="4:01:50 PM" DateTime="2008-10-22T05:01:50.613Z" SessionID="39"><From><User FriendlyName="Pierreth"/></From><To><User FriendlyName="- James O'"/></To><Text Style="font-family:Times New Roman; font-weight:bold; font-style:italic; color:#000000; ">we need jared to come 2</Text></Message><Message Date="10/22/2008" Time="4:02:45 PM" DateTime="2008-10-22T05:02:45.991Z" SessionID="39"><From><User FriendlyName="- James O'"/></From><To><User FriendlyName="Pierreth"/></To><Text Style="font-family:MS Shell Dlg; color:#000000; ">has he got fable 2?</Text></Message><Message Date="10/22/2008" Time="4:02:48 PM" DateTime="2008-10-22T05:02:48.885Z" SessionID="39"><From><User FriendlyName="- James O'"/></From><To><User FriendlyName="Pierreth"/></To><Text Style="font-family:MS Shell Dlg; color:#000000; ">or getting</Text></Message><Message Date="10/22/2008" Time="4:02:49 PM" DateTime="2008-10-22T05:02:49.494Z" SessionID="39"><From><User FriendlyName="Pierreth"/></From><To><User FriendlyName="- James O'"/></To><Text Style="font-family:Times New Roman; font-weight:bold; font-style:italic; color:#000000; ">yeh</Text></Message><Message Date="10/22/2008" Time="4:02:51 PM" DateTime="2008-10-22T05:02:51.056Z" SessionID="39"><From><User FriendlyName="Pierreth"/></From><To><User FriendlyName="- James O'"/></To><Text Style="font-family:Times New Roman; font-weight:bold; font-style:italic; color:#000000; ">has</Text></Message><Message Date="10/22/2008" Time="4:02:53 PM" DateTime="2008-10-22T05:02:53.640Z" SessionID="39"><From><User FriendlyName="Pierreth"/></From><To><User FriendlyName="- James O'"/></To><Text Style="font-family:Times New Roman; font-weight:bold; font-style:italic; color:#000000; ">right now</Text></Message><Message Date="10/22/2008" Time="4:02:55 PM" DateTime="2008-10-22T05:02:55.534Z" SessionID="39"><From><User FriendlyName="Pierreth"/></From><To><User FriendlyName="- James O'"/></To><Text Style="font-family:Times New Roman; font-weight:bold; font-style:italic; color:#000000; ">is playing</Text></Message><Message Date="10/22/2008" Time="4:03:19 PM" DateTime="2008-10-22T05:03:19.331Z" SessionID="39"><From><User FriendlyName="- James O'"/></From><To><User FriendlyName="Pierreth"/></To><Text Style="font-family:MS Shell Dlg; color:#000000; ">lol</Text></Message><Message Date="10/22/2008" Time="4:03:24 PM" DateTime="2008-10-22T05:03:24.771Z" SessionID="39"><From><User FriendlyName="- James O'"/></From><To><User FriendlyName="Pierreth"/></To><Text Style="font-family:MS Shell Dlg; color:#000000; ">msg him to come share with us :)</Text></Message><Message Date="10/22/2008" Time="4:03:49 PM" DateTime="2008-10-22T05:03:49.073Z" SessionID="39"><From><User FriendlyName="Pierreth"/></From><To><User FriendlyName="- James O'"/></To><Text Style="font-family:Times New Roman; font-weight:bold; font-style:italic; color:#000000; ">i have</Text></Message><Message Date="10/22/2008" Time="4:03:52 PM" DateTime="2008-10-22T05:03:52.370Z" SessionID="39"><From><User FriendlyName="Pierreth"/></From><To><User FriendlyName="- James O'"/></To><Text Style="font-family:Times New Roman; font-weight:bold; font-style:italic; color:#000000; ">but he ignored</Text></Message><Message Date="10/22/2008" Time="4:04:00 PM" DateTime="2008-10-22T05:04:00.190Z" SessionID="39"><From><User FriendlyName="Pierreth"/></From><To><User FriendlyName="- James O'"/></To><Text Style="font-family:Times New Roman; font-weight:bold; font-style:italic; color:#000000; ">he sent me one and was like fable 2 is awesome</Text></Message><Message Date="10/22/2008" Time="4:04:06 PM" DateTime="2008-10-22T05:04:06.745Z" SessionID="39"><From><User FriendlyName="Pierreth"/></From><To><User FriendlyName="- James O'"/></To><Text Style="font-family:Times New Roman; font-weight:bold; font-style:italic; color:#000000; ">and im like yo take it to jimmehs</Text></Message><Message Date="10/22/2008" Time="4:04:09 PM" DateTime="2008-10-22T05:04:09.811Z" SessionID="39"><From><User FriendlyName="Pierreth"/></From><To><User FriendlyName="- James O'"/></To><Text Style="font-family:Times New Roman; font-weight:bold; font-style:italic; color:#000000; ">and he didnt reply</Text></Message><Message Date="10/22/2008" Time="4:04:11 PM" DateTime="2008-10-22T05:04:11.099Z" SessionID="39"><From><User FriendlyName="Pierreth"/></From><To><User FriendlyName="- James O'"/></To><Text Style="font-family:Times New Roman; font-weight:bold; font-style:italic; color:#000000; ">fag</Text></Message><Message Date="10/22/2008" Time="4:04:44 PM" DateTime="2008-10-22T05:04:44.191Z" SessionID="39"><From><User FriendlyName="- James O'"/></From><To><User FriendlyName="Pierreth"/></To><Text Style="font-family:MS Shell Dlg; color:#000000; ">ah</Text></Message><Message Date="10/22/2008" Time="4:04:49 PM" DateTime="2008-10-22T05:04:49.072Z" SessionID="39"><From><User FriendlyName="- James O'"/></From><To><User FriendlyName="Pierreth"/></To><Text Style="font-family:MS Shell Dlg; color:#000000; ">perhaps if you kidnap his game disc</Text></Message><Message Date="10/22/2008" Time="4:04:51 PM" DateTime="2008-10-22T05:04:51.129Z" SessionID="39"><From><User FriendlyName="Pierreth"/></From><To><User FriendlyName="- James O'"/></To><Text Style="font-family:Times New Roman; font-weight:bold; font-style:italic; color:#000000; ">calling</Text></Message><Message Date="10/22/2008" Time="4:05:59 PM" DateTime="2008-10-22T05:05:59.817Z" SessionID="39"><From><User FriendlyName="Pierreth"/></From><To><User FriendlyName="- James O'"/></To><Text Style="font-family:Times New Roman; font-weight:bold; font-style:italic; color:#000000; ">no answer</Text></Message><Message Date="10/22/2008" Time="4:07:51 PM" DateTime="2008-10-22T05:07:51.406Z" SessionID="39"><From><User FriendlyName="- James O'"/></From><To><User Fr