<?xml version="1.0"?>
<?xml-stylesheet type='text/xsl' href='MessageLog.xsl'?>
<Log FirstSessionID="1" LastSessionID="12"><Message Date="11/19/2008" Time="9:28:13 PM" DateTime="2008-11-19T10:28:13.616Z" SessionID="1"><From><User FriendlyName="James O'"/></From><To><User FriendlyName="simon"/></To><Text Style="font-family:MS Shell Dlg; color:#000000; ">Hello Mr Simon sir, don't suppose your mobile device is capable of browsing the ALDI website?</Text></Message><Message Date="11/19/2008" Time="9:28:18 PM" DateTime="2008-11-19T10:28:18.948Z" SessionID="1"><From><User FriendlyName="James O'"/></From><To><User FriendlyName="simon"/></To><Text Style="font-family:MS Shell Dlg; color:#000000; ">http://www.aldi.com.au/au/html/offers/offers_medion_20081120.htm</Text></Message><Message Date="11/19/2008" Time="10:25:55 PM" DateTime="2008-11-19T11:25:55.778Z" SessionID="2"><From><User FriendlyName="simon"/></From><To><User FriendlyName="James O'"/></To><Text>It sure is but mobile msn isnt passing the goddam url to the browser</Text></Message><Message Date="11/19/2008" Time="10:26:07 PM" DateTime="2008-11-19T11:26:07.753Z" SessionID="2"><From><User FriendlyName="simon"/></From><To><User FriendlyName="James O'"/></To><Text>Whats medion made now?</Text></Message><Message Date="11/19/2008" Time="10:26:56 PM" DateTime="2008-11-19T11:26:56.870Z" SessionID="2"><From><User FriendlyName="James O'"/></From><To><User FriendlyName="simon"/></To><Text Style="font-family:MS Shell Dlg; color:#000000; ">Its a 17" laptop</Text></Message><Message Date="11/19/2008" Time="10:27:03 PM" DateTime="2008-11-19T11:27:03.510Z" SessionID="2"><From><User FriendlyName="James O'"/></From><To><User FriendlyName="simon"/></To><Text Style="font-family:MS Shell Dlg; color:#000000; ">Processor: Intel Core 2 Duo processor T5450 (1.66 GHz, 2MB L2 Cache, FSB 667 MHz)
Operating System: Genuine Windows Vista Home Premium
Display: 17" TFT WXGA widescreen display for TV and DVD playback in widescreen 16:10 cinema format
Memory: 3 GB DDR2 SDRAM
Hard drive: 250 GB S-ATA Hard Disk Drive, 8 MB Cache
</Text></Message><Message Date="11/19/2008" Time="10:27:08 PM" DateTime="2008-11-19T11:27:08.996Z" SessionID="2"><From><User FriendlyName="James O'"/></From><To><User FriendlyName="simon"/></To><Text Style="font-family:MS Shell Dlg; color:#000000; ">Graphics: NVidia GeForce 8600M GS based on PCI-Express technology with 512MB GDDR2 memory
Webcamera: Integrated 1.3 megapixel webcam with microphone
Speaker system: 2 integrated speakers + subwoofer
Optical Drive: Multi-Standard Dual Layer DVD-/-CD-Writer: Multi-Standard DVD/CD writer with DVD-RAM and Dual Layer support. 
Wireless LAN: Wireless LAN IEEE 802.11 n-Draft up to 300Mbit/s.
Integrated 4</Text></Message><Message Date="11/19/2008" Time="10:27:17 PM" DateTime="2008-11-19T11:27:17.409Z" SessionID="2"><From><User FriendlyName="James O'"/></From><To><User FriendlyName="simon"/></To><Text Style="font-family:MS Shell Dlg; color:#000000; ">Integrated 4-in-1 memory card reader: Memory Card reader for SD, MMC, MS &amp; MS Pro flash 
memory cards</Text></Message><Message Date="11/19/2008" Time="10:29:17 PM" DateTime="2008-11-19T11:29:17.541Z" SessionID="2"><From><User FriendlyName="simon"/></From><To><User FriendlyName="James O'"/></To><Text>What res screen?</Text></Message><Message Date="11/19/2008" Time="10:30:03 PM" DateTime="2008-11-19T11:30:03.895Z" SessionID="2"><From><User FriendlyName="James O'"/></From><To><User FriendlyName="simon"/></To><Text Style="font-family:MS Shell Dlg; color:#000000; ">1440 x 900</Text></Message><Message Date="11/19/2008" Time="10:30:11 PM" DateTime="2008-11-19T11:30:11.213Z" SessionID="2"><From><User FriendlyName="James O'"/></From><To><User FriendlyName="simon"/></To><Text Style="font-family:MS Shell Dlg; color:#000000; ">It appears</Text></Message><Message Date="11/19/2008" Time="10:30:26 PM" DateTime="2008-11-19T11:30:26.850Z" SessionID="2"><From><User FriendlyName="James O'"/></From><To><User FriendlyName="simon"/></To><Text Style="font-family:MS Shell Dlg; color:#000000; ">Suprised ALDI threw in a blu ray drive tho</Text></Message><Message Date="11/19/2008" Time="10:30:50 PM" DateTime="2008-11-19T11:30:50.502Z" SessionID="2"><From><User FriendlyName="James O'"/></From><To><User FriendlyName="simon"/></To><Text Style="font-family:MS Shell Dlg; color:#000000; ">60 day satisfaction return and 2 year warranty</Text></Message><Message Date="11/19/2008" Time="10:31:35 PM" DateTime="2008-11-19T11:31:35.656Z" SessionID="2"><From><User FriendlyName="James O'"/></From><To><User FriendlyName="simon"/></To><Text Style="font-family:MS Shell Dlg; color:#000000; ">(blu-ray drive wasn't in those specs, but its plastered all over the aldi site)</Text></Message><Message Date="11/19/2008" Time="10:32:39 PM" DateTime="2008-11-19T11:32:39.788Z" SessionID="2"><From><User FriendlyName="simon"/></From><To><User FriendlyName="James O'"/></To><Text>True but only 8600</Text></Message><Message Date="11/19/2008" Time="10:33:02 PM" DateTime="2008-11-19T11:33:02.551Z" SessionID="2"><From><User FriendlyName="simon"/></From><To><User FriendlyName="James O'"/></To><Text>How much?</Text></Message><Message Date="11/19/2008" Time="10:35:38 PM" DateTime="2008-11-19T11:35:38.492Z" SessionID="2"><From><User FriendlyName="James O'"/></From><To><User FriendlyName="simon"/></To><Text Style="font-family:MS Shell Dlg; color:#000000; ">$1500</Text></Message><Message Date="11/19/2008" Time="10:36:02 PM" DateTime="2008-11-19T11:36:02.545Z" SessionID="2"><From><User FriendlyName="simon"/></From><To><User FriendlyName="James O'"/></To><Text>Not bad at all</Text></Message><Message Date="11/19/2008" Time="10:39:25 PM" DateTime="2008-11-19T11:39:25.827Z" SessionID="3"><From><User FriendlyName="James O'"/></From><To><User FriendlyName="simon"/></To><Text Style="font-family:MS Shell Dlg; color:#000000; ">Mate was looking into it</Text></Message><Message Date="11/19/2008" Time="10:39:33 PM" DateTime="2008-11-19T11:39:33.969Z" SessionID="3"><From><User FriendlyName="James O'"/></From><To><User FriendlyName="simon"/></To><Text Style="font-family:MS Shell Dlg; color:#000000; ">Altho Im totally into netbook hunting mode atm</Text></Message><Message Date="11/19/2008" Time="10:39:45 PM" DateTime="2008-11-19T11:39:45.120Z" SessionID="3"><From><User FriendlyName="James O'"/></From><To><User FriendlyName="simon"/></To><Text Style="font-family:MS Shell Dlg; color:#000000; ">so 17"s is kind of counter-intuitive to that idea</Text></Message><Message Date="11/19/2008" Time="10:40:42 PM" DateTime="2008-11-19T11:40:42.981Z" SessionID="3"><From><User FriendlyName="simon"/></From><To><User FriendlyName="James O'"/></To><Text>Sure is</Text></Message><Message Date="11/19/2008" Time="10:40:53 PM" DateTime="2008-11-19T11:40:53.361Z" SessionID="3"><From><User FriendlyName="simon"/></From><To><User FriendlyName="James O'"/></To><Text>Im happy with my halfway lappy</Text></Message><Message Date="11/19/2008" Time="10:41:19 PM" DateTime="2008-11-19T11:41:19.336Z" SessionID="3"><From><User FriendlyName="simon"/></From><To><User FriendlyName="James O'"/></To><Text>Asus u6s</Text></Message><Message Date="11/19/2008" Time="10:41:22 PM" DateTime="2008-11-19T11:41:22.332Z" SessionID="3"><From><User FriendlyName="James O'"/></From><To><User FriendlyName="simon"/></To><Text Style="font-family:MS Shell Dlg; color:#000000; ">I have an xps m1330, which I love</Text></Message><Message Date="11/19/2008" Time="10:41:45 PM" DateTime="2008-11-19T11:41:45.771Z" SessionID="3"><From><User FriendlyName="James O'"/></From><To><User FriendlyName="simon"/></To><Text Style="font-family:MS Shell Dlg; color:#000000; ">but I want something teeny for uni that I can just toss in my bag</Text></Message><Message Date="11/19/2008" Time="10:42:20 PM" DateTime="2008-11-19T11:42:20.230Z" SessionID="3"><From><User FriendlyName="James O'"/></From><To><User FriendlyName="simon"/></To><Text Style="font-family:MS Shell Dlg; color:#000000; ">she's cute</Text></Message><Message Date="11/19/2008" Time="10:53:35 PM" DateTime="2008-11-19T11:53:35.631Z" SessionID="4"><From><User FriendlyName="James O'"/></From><To><User FriendlyName="simon"/></To><Text Style="font-family:MS Shell Dlg; color:#000000; ">oh btw, is there any decent way to destroy a first gen imac?</Text></Message><Message Date="11/19/2008" Time="10:53:55 PM" DateTime="2008-11-19T11:53:55.757Z" SessionID="4"><From><User FriendlyName="simon"/></From><To><User FriendlyName="James O'"/></To><Text>Guns</Text></Message><Message Date="11/19/2008" Time="10:54:20 PM" DateTime="2008-11-19T11:54:20.481Z" SessionID="4"><From><User FriendlyName="James O'"/></From><To><User FriendlyName="simon"/></To><Text Style="font-family:MS Shell Dlg; color:#000000; ">Something that perhaps might explode it into a tiny key sized mac?</Text></Message><Message Date="11/19/2008" Time="10:54:33 PM" DateTime="2008-11-19T11:54:33.597Z" SessionID="4"><From><User FriendlyName="James O'"/></From><To><User FriendlyName="simon"/></To><Text Style="font-family:MS Shell Dlg; color:#000000; ">key chain*</Text></Message><Message Date="11/19/2008" Time="10:55:16 PM" DateTime="2008-11-19T11:55:16.691Z" SessionID="4"><From><User FriendlyName="simon"/></From><To><User FriendlyName="James O'"/></To><Text>No idea</Text></Message><Message Date="11/25/2008" Time="12:18:15 PM" DateTime="2008-11-25T01:18:15.832Z" SessionID="5"><From><User FriendlyName="simon"/></From><To><User FriendlyName="James O'"/></To><Text>10 years ay</Text></Message><Message Date="11/25/2008" Time="12:18:49 PM" DateTime="2008-11-25T01:18:49.972Z" SessionID="5"><From><User FriendlyName="James O'"/></From><To><User FriendlyName="simon"/></To><Text Style="font-family:MS Shell Dlg; color:#000000; ">went by quick</Text></Message><Message Date="11/25/2008" Time="12:18:50 PM" DateTime="2008-11-25T01:18:50.408Z" SessionID="5"><From><User FriendlyName="simon"/></From><To><User FriendlyName="James O'"/></To><Text>I'd say it's kinda timeless woowee</Text></Message><Message Date="11/25/2008" Time="12:19:14 PM" DateTime="2008-11-25T01:19:14.712Z" SessionID="5"><From><User FriendlyName="simon"/></From><To><User FriendlyName="James O'"/></To><Text>Oath</Text></Message><Message Date="11/25/2008" Time="12:19:48 PM" DateTime="2008-11-25T01:19:48.326Z" SessionID="5"><From><User FriendlyName="James O'"/></From><To><User FriendlyName="simon"/></To><Text Style="font-family:MS Shell Dlg; color:#000000; ">Not that I wouldn't like a remake on Wii HD, but yeh</Text></Message><Message Date="11/25/2008" Time="12:20:17 PM" DateTime="2008-11-25T01:20:17.638Z" SessionID="5"><From><User FriendlyName="simon"/></From><To><User FriendlyName="James O'"/></To><Text>Is wii hd a real thing </Text></Message><Message Date="11/25/2008" Time="12:20:24 PM" DateTime="2008-11-25T01:20:24.109Z" SessionID="5"><From><User FriendlyName="simon"/></From><To><User FriendlyName="James O'"/></To><Text>It damn well should be</Text></Message><Message Date="11/25/2008" Time="12:20:29 PM" DateTime="2008-11-25T01:20:29.609Z" SessionID="5"><From><User FriendlyName="simon"/></From><To><User FriendlyName="James O'"/></To><Text>Cause sd is gay</Text></Message><Message Date="11/25/2008" Time="12:20:38 PM" DateTime="2008-11-25T01:20:38.887Z" SessionID="5"><From><User FriendlyName="James O'"/></From><To><User FriendlyName="simon"/></To><Text Style="font-family:MS Shell Dlg; color:#000000; ">420p can lick mah nuts</Text></Message><Message Date="11/25/2008" Time="12:20:56 PM" DateTime="2008-11-25T01:20:56.827Z" SessionID="5"><From><User FriendlyName="James O'"/></From><To><User FriendlyName="simon"/></To><Text Style="font-family:MS Shell Dlg; color:#000000; ">So Nintendo, but it just don't cut it</Text></Message><Message Date="11/25/2008" Time="12:21:12 PM" DateTime="2008-11-25T01:21:12.488Z" SessionID="5"><From><User FriendlyName="simon"/></From><To><User FriendlyName="James O'"/></To><Text>Assholes</Text></Message><Message Date="11/25/2008" Time="12:22:22 PM" DateTime="2008-11-25T01:22:22.192Z" SessionID="5"><From><User FriendlyName="simon"/></From><To><User FriendlyName="James O'"/></To><Text>I reckon they should release it on xbox live all upgraded and shit</Text></Message><Message Date="11/25/2008" Time="12:22:36 PM" DateTime="2008-11-25T01:22:36.381Z" SessionID="5"><From><User FriendlyName="simon"/></From><To><User FriendlyName="James O'"/></To><Text>Nintendo would never allow it but i can dream</Text></Message><Message Date="11/25/2008" Time="12:23:08 PM" DateTime="2008-11-25T01:23:08.525Z" SessionID="5"><From><User FriendlyName="simon"/></From><To><User FriendlyName="James O'"/></To><Text>Dream of nintendo hardware failing and them turning into a software house like sega </Text></Message><Message Date="11/25/2008" Time="12:23:41 PM" DateTime="2008-11-25T01:23:41.081Z" SessionID="5"><From><User FriendlyName="simon"/></From><To><User FriendlyName="James O'"/></To><Text>But that was sad cause i loved the shit out of my dreamcast</Text></Message><Message Date="11/25/2008" Time="12:23:42 PM" DateTime="2008-11-25T01:23:42.353Z" SessionID="5"><From><User FriendlyName="James O'"/></From><To><User FriendlyName="simon"/></To><Text Style="font-family:MS Shell Dlg; color:#000000; ">If they made a ocarina of time remake as a launch title for the next system, you know with actual motiondetection like they later put into the "motion plus" attachement</Text></Message><Message Date="11/25/2008" Time="12:24:30 PM" DateTime="2008-11-25T01:24:30.028Z" SessionID="5"><From><User FriendlyName="simon"/></From><To><User FriendlyName="James O'"/></To><Text>why make zelda when you can make a shitty 5 in 1 sports game</Text></Message><Message Date="11/25/2008" Time="12:24:42 PM" DateTime="2008-11-25T01:24:42.595Z" SessionID="5"><From><User FriendlyName="simon"/></From><To><User FriendlyName="James O'"/></To><Text>Well...at least the bowling is fun</Text></Message><Message Date="11/25/2008" Time="12:27:04 PM" DateTime="2008-11-25T01:27:04.117Z" SessionID="5"><From><User FriendlyName="James O'"/></From><To><User FriendlyName="simon"/></To><Text Style="font-family:MS Shell Dlg; color:#000000; ">well, 2011 is meant to be the estimate release date on the "HD Wii"</Text></Message><Message Date="11/25/2008" Time="12:27:55 PM" DateTime="2008-11-25T01:27:55.891Z" SessionID="5"><From><User FriendlyName="simon"/></From><To><User FriendlyName="James O'"/></To><Text>So only like 6 years after the rest of the industry</Text></Message><Message Date="11/25/2008" Time="12:28:10 PM" DateTime="2008-11-25T01:28:10.085Z" SessionID="5"><From><User FriendlyName="simon"/></From><To><User FriendlyName="James O'"/></To><Text>Way to go</Text></Message><Message Date="12/9/2008" Time="10:50:12 AM" DateTime="2008-12-08T23:50:12.839Z" SessionID="6"><From><User FriendlyName="simon"/></From><To><User FriendlyName="James O'"/></To><Text Style="font-family:Tahoma; color:#000000; ">I can recommend a movie to NOT watch</Text></Message><Message Date="12/9/2008" Time="10:50:16 AM" DateTime="2008-12-08T23:50:16.733Z" SessionID="6"><From><User FriendlyName="simon"/></From><To><User FriendlyName="James O'"/></To><Text Style="font-family:Tahoma; color:#000000; ">Quantum of Solace</Text></Message><Message Date="12/9/2008" Time="10:50:27 AM" DateTime="2008-12-08T23:50:27.635Z" SessionID="6"><From><User FriendlyName="James O'"/></From><To><User FriendlyName="simon"/></To><Text Style="font-family:MS Shell Dlg; color:#000000; ">haha, I almost saw that</Text></Message><Message Date="12/9/2008" Time="10:50:34 AM" DateTime="2008-12-08T23:50:34.401Z" SessionID="6"><From><User FriendlyName="James O'"/></From><To><User FriendlyName="simon"/></To><Text Style="font-family:MS Shell Dlg; color:#000000; ">went for high school musical 3 instead</Text></Message><Message Date="12/9/2008" Time="10:50:41 AM" DateTime="2008-12-08T23:50:41.168Z" SessionID="6"><From><User FriendlyName="James O'"/></From><To><User FriendlyName="simon"/></To><Text Style="font-family:MS Shell Dlg; color:#000000; ">somehow I figure I'd of been better of with Bond...</Text></Message><Message Date="12/9/2008" Time="10:50:43 AM" DateTime="2008-12-08T23:50:43.377Z" SessionID="6"><From><User FriendlyName="simon"/></From><To><User FriendlyName="James O'"/></To><Text Style="font-family:Tahoma; color:#000000; ">To actually watch, just throw on The Big Lebowski, it's always a great choice</Text></Message><Message Date="12/9/2008" Time="10:50:52 AM" DateTime="2008-12-08T23:50:52.448Z" SessionID="6"><From><User FriendlyName="James O'"/></From><To><User FriendlyName="simon"/></To><Text Style="font-family:MS Shell Dlg; color:#000000; ">I downloaded that last night in fact</Text></Message><Message Date="12/9/2008" Time="10:51:02 AM" DateTime="2008-12-08T23:51:02.580Z" SessionID="6"><From><User FriendlyName="James O'"/></From><To><User FriendlyName="simon"/></To><Text Style="font-family:MS Shell Dlg; color:#000000; ">been meaning to see it</Text></Message><Message Date="12/9/2008" Time="10:51:19 AM" DateTime="2008-12-08T23:51:19.927Z" SessionID="6"><From><User FriendlyName="simon"/></From><To><User FriendlyName="James O'"/></To><Text Style="font-family:Tahoma; color:#000000; ">It's the greatest movie in the history of the world</Text></Message><Message Date="12/9/2008" Time="10:51:24 AM" DateTime="2008-12-08T23:51:24.219Z" SessionID="6"><From><User FriendlyName="simon"/></From><To><User FriendlyName="James O'"/></To><Text Style="font-family:Tahoma; color:#000000; ">Go watch it now, twice.</Text></Message><Message Date="12/9/2008" Time="4:48:39 PM" DateTime="2008-12-09T05:48:39.495Z" SessionID="7"><From><User FriendlyName="simon"/></From><To><User FriendlyName="James O'"/></To><Text Style="font-family:Tahoma; color:#000000; ">My next suggestion is The Evil Dead 2</Text></Message><Message Date="1/9/2009" Time="9:53:31 PM" DateTime="2009-01-09T10:53:31.908Z" SessionID="8"><From><User FriendlyName="simon"/></From><To><User FriendlyName="James O'"/></To><Text Style="font-family:Tahoma; color:#000000; ">darjeeling limited rocks the shit</Text></Message><Message Date="1/9/2009" Time="10:09:27 PM" DateTime="2009-01-09T11:09:27.349Z" SessionID="8"><From><User FriendlyName="James O'"/></From><To><User FriendlyName="simon"/></To><Text Style="font-family:MS Shell Dlg; color:#000000; ">weird movie</Text></Message><Message Date="1/15/2009" Time="12:23:03 AM" DateTime="2009-01-15T08:23:03.061Z" SessionID="9"><From><User FriendlyName="James O'"/></From><To><User FriendlyName="simon"/></To><Text Style="font-family:Segoe UI; color:#000000; ">Hay, I dont suppose there exists a 1 click dvd tv series &gt; divx (or watever format) tool</Text></Message><Message Date="1/15/2009" Time="12:23:49 AM" DateTime="2009-01-15T08:23:49.447Z" SessionID="9"><From><User FriendlyName="James O'"/></From><To><User FriendlyName="simon"/></To><Text Style="font-family:Segoe UI; color:#000000; ">I wanna backup my burnt losts discs to my hard drives, and sod ripping each ep and converting it</Text></Message><Message Date="1/15/2009" Time="12:24:00 AM" DateTime="2009-01-15T08:24:00.350Z" SessionID="9"><From><User FriendlyName="James O'"/></From><To><User FriendlyName="simon"/></To><Text Style="font-family:Segoe UI; color:#000000; ">There must be a nice, click me and I do the work for you sorta business</Text></Message><Message Date="1/15/2009" Time="12:25:13 AM" DateTime="2009-01-15T08:25:13.504Z" SessionID="10"><From><User FriendlyName="simon"/></From><To><User FriendlyName="James O'"/></To><Text Style="font-family:Tahoma; color:#000000; ">I wish - I'm ripping 7 seasons of Family Guy and 3 of Entourage as we speak</Text></Message><Message Date="1/15/2009" Time="12:25:32 AM" DateTime="2009-01-15T08:25:32.675Z" SessionID="10"><From><User FriendlyName="James O'"/></From><To><User FriendlyName="simon"/></To><Text Style="font-family:Segoe UI; color:#000000; ">I think I actually found a decent one...</Text></Message><Message Date="1/15/2009" Time="12:25:42 AM" DateTime="2009-01-15T08:25:42.258Z" SessionID="10"><From><User FriendlyName="James O'"/></From><To><User FriendlyName="simon"/></To><Text Style="font-family:Segoe UI; color:#000000; ">I had it sitting in my torrented aps list</Text></Message><Message Date="1/15/2009" Time="12:25:59 AM" DateTime="2009-01-15T08:25:59.673Z" SessionID="10"><From><User FriendlyName="simon"/></From><To><User FriendlyName="James O'"/></To><Text Style="font-family:Tahoma; color:#000000; ">Oh? Ive just been queing them all up on a per episode basis in AutoGK</Text></Message><Message Date="1/15/2009" Time="12:26:27 AM" DateTime="2009-01-15T08:26:27.205Z" SessionID="10"><From><User FriendlyName="James O'"/></From><To><User FriendlyName="simon"/></To><Text Style="font-family:Segoe UI; color:#000000; ">Xilisoft DVD Ripper loads each title in and lets you just remove everything thats not an ep, set a profile to convert and go</Text></Message><Message Date="1/15/2009" Time="12:27:17 AM" DateTime="2009-01-15T08:27:17.885Z" SessionID="10"><From><User FriendlyName="simon"/></From><To><User FriendlyName="James O'"/></To><Text Style="font-family:Tahoma; color:#000000; ">Interesting</Text></Message><Message Date="1/15/2009" Time="12:27:26 AM" DateTime="2009-01-15T08:27:26.280Z" SessionID="10"><From><User FriendlyName="simon"/></From><To><User FriendlyName="James O'"/></To><Text Style="font-family:Tahoma; color:#000000; ">I'll look it up</Text></Message><Message Date="1/15/2009" Time="12:29:31 AM" DateTime="2009-01-15T08:29:31.990Z" SessionID="10"><From><User FriendlyName="James O'"/></From><To><User FriendlyName="simon"/></To><Text Style="font-family:Segoe UI; color:#000000; ">Giving it ago now</Text></Message><Message Date="1/15/2009" Time="12:29:52 AM" DateTime="2009-01-15T08:29:52.664Z" SessionID="10"><From><User FriendlyName="simon"/></From><To><User FriendlyName="James O'"/></To><Text Style="font-family:Tahoma; color:#000000; ">Let me know how it goes...both ease of use and quality wise</Text></Message><Message Date="1/15/2009" Time="12:31:39 AM" DateTime="2009-01-15T08:31:39.391Z" SessionID="10"><From><User FriendlyName="James O'"/></From><To><User FriendlyName="simon"/></To><Text Style="font-family:Segoe UI; color:#000000; ">Will do</Text></Message><Message Date="1/15/2009" Time="12:34:06 AM" DateTime="2009-01-15T08:34:06.397Z" SessionID="10"><From><User FriendlyName="James O'"/></From><To><User FriendlyName="simon"/></To><Text Style="font-family:Segoe UI; color:#000000; ">Didn't like converting to divx, xvid seems to be working fine</Text></Message><Message Date="1/15/2009" Time="12:34:22 AM" DateTime="2009-01-15T08:34:22.878Z" SessionID="10"><From><User FriendlyName="simon"/></From><To><User FriendlyName="James O'"/></To><Text Style="font-family:Tahoma; color:#000000; ">I'd go xvid or x264 anyway</Text></Message><Message Date="1/15/2009" Time="12:34:46 AM" DateTime="2009-01-15T08:34:46.240Z" SessionID="10"><From><User FriendlyName="James O'"/></From><To><User FriendlyName="simon"/></To><Text Style="font-family:Segoe UI; color:#000000; ">Im ripping them to the "higher" setting, says output will be ~600mb</Text></Message><Message Date="1/15/2009" Time="12:34:54 AM" DateTime="2009-01-15T08:34:54.366Z" SessionID="10"><From><User FriendlyName="simon"/></From><To><User FriendlyName="James O'"/></To><Text Style="font-family:Tahoma; color:#000000; ">Per ep?</Text></Message><Message Date="1/15/2009" Time="12:34:56 AM" DateTime="2009-01-15T08:34:56.015Z" SessionID="10"><From><User FriendlyName="James O'"/></From><To><User FriendlyName="simon"/></To><Text Style="font-family:Segoe UI; color:#000000; ">These dvd's are all dvd shrunk anyways</Text></Message><Message Date="1/15/2009" Time="12:35:01 AM" DateTime="2009-01-15T08:35:01.727Z" SessionID="10"><From><User FriendlyName="simon"/></From><To><User FriendlyName="James O'"/></To><Text Style="font-family:Tahoma; color:#000000; ">What show?</Text></Message><Message Date="1/15/2009" Time="12:35:04 AM" DateTime="2009-01-15T08:35:04.303Z" SessionID="10"><From><User FriendlyName="James O'"/></From><To><User FriendlyName="simon"/></To><Text Style="font-family:Segoe UI; color:#000000; ">Lost</Text></Message><Message Date="1/15/2009" Time="12:35:08 AM" DateTime="2009-01-15T08:35:08.727Z" SessionID="10"><From><User FriendlyName="simon"/></From><To><User FriendlyName="James O'"/></To><Text Style="font-family:Tahoma; color:#000000; ">So an hour a pop?</Text></Message><Message Date="1/15/2009" Time="12:35:11 AM" DateTime="2009-01-15T08:35:11.501Z" SessionID="10"><From><User FriendlyName="James O'"/></From><To><User FriendlyName="simon"/></To><Text Style="font-family:Segoe UI; color:#000000; ">so 42 minute eps</Text></Message><Message Date="1/15/2009" Time="12:35:19 AM" DateTime="2009-01-15T08:35:19.101Z" SessionID="10"><From><User FriendlyName="simon"/></From><To><User FriendlyName="James O'"/></To><Text Style="font-family:Tahoma; color:#000000; ">That's alright</Text></Message><Message Date="1/15/2009" Time="12:35:23 AM" DateTime="2009-01-15T08:35:23.507Z" SessionID="10"><From><User FriendlyName="simon"/></From><To><User FriendlyName="James O'"/></To><Text Style="font-family:Tahoma; color:#000000; ">I spose</Text></Message><Message Date="1/15/2009" Time="12:35:29 AM" DateTime="2009-01-15T08:35:29.699Z" SessionID="10"><From><User FriendlyName="James O'"/></From><To><User FriendlyName="simon"/></To><Text Style="font-family:Segoe UI; color:#000000; ">I don't know what sort of bitrate that'll pop out</Text></Message><Message Date="1/15/2009" Time="12:35:34 AM" DateTime="2009-01-15T08:35:34.955Z" SessionID="10"><From><User FriendlyName="James O'"/></From><To><User FriendlyName="simon"/></To><Text Style="font-family:Segoe UI; color:#000000; ">I'll have a look tommorow</Text></Message><Message Date="1/15/2009" Time="12:35:55 AM" DateTime="2009-01-15T08:35:55.936Z" SessionID="10"><From><User FriendlyName="James O'"/></From><To><User FriendlyName="simon"/></To><Text Style="font-family:Segoe UI; color:#000000; ">and ETA for the disc is 2 hours</Text></Message><Message Date="1/15/2009" Time="12:36:04 AM" DateTime="2009-01-15T08:36:04.991Z" SessionID="10"><From><User FriendlyName="James O'"/></From><To><User FriendlyName="simon"/></To><Text Style="font-family:Segoe UI; color:#000000; ">seems pretty quick</Text></Message><Message Date="1/15/2009" Time="12:36:18 AM" DateTime="2009-01-15T08:36:18.118Z" SessionID="10"><From><User FriendlyName="James O'"/></From><To><User FriendlyName="simon"/></To><Text Style="font-family:Segoe UI; color:#000000; ">7% after a couple mins</Text></Message><Message Date="1/15/2009" Time="12:36:24 AM" DateTime="2009-01-15T08:36:24.141Z" SessionID="10"><From><User FriendlyName="James O'"/></From><To><User FriendlyName="simon"/></To><Text Style="font-family:Segoe UI; color:#000000; ">(like 2)</Text></Message><Message Date="1/15/2009" Time="12:36:42 AM" DateTime="2009-01-15T08:36:42.283Z" SessionID="10"><From><User FriendlyName="James O'"/></From><To><User FriendlyName="simon"/></To><Text Style="font-family:Segoe UI; color:#000000; ">And my drives are the ones required to pirate xbox 360 games, so not the fatest</Text></Message><Message Date="1/15/2009" Time="12:36:51 AM" DateTime="2009-01-15T08:36:51.210Z" SessionID="10"><From><User FriendlyName="simon"/></From><To><User FriendlyName="James O'"/></To><Text Style="font-family:Tahoma; color:#000000; ">I ripped Two And A Half Men which falls short of even 20 minutes and I did 233mb per ep</Text></Message><Message Date="1/15/2009" Time="12:38:16 AM" DateTime="2009-01-15T08:38:16.192Z" SessionID="10"><From><User FriendlyName="James O'"/></From><To><User FriendlyName="simon"/></To><Text Style="font-family:Segoe UI; color:#000000; ">Nice</Text></Message><Message Date="1/15/2009" Time="12:38:43 AM" DateTime="2009-01-15T08:38:43.773Z" SessionID="10"><From><User FriendlyName="James O'"/></From><To><User FriendlyName="simon"/></To><Text Style="font-family:Segoe UI; color:#000000; ">I don't have the fastest setup</Text></Message><Message Date="1/15/2009" Time="12:39:22 AM" DateTime="2009-01-15T08:39:22.486Z" SessionID="10"><From><User FriendlyName="simon"/></From><To><User FriendlyName="James O'"/></To><Text Style="font-family:Tahoma; color:#000000; ">CPU?</Text></Message><Message Date="1/15/2009" Time="12:39:28 AM" DateTime="2009-01-15T08:39:28.743Z" SessionID="10"><From><User FriendlyName="James O'"/></From><To><User FriendlyName="simon"/></To><Text Style="font-family:Segoe UI; color:#000000; ">5200+ (am2)</Text></Message><Message Date="1/15/2009" Time="12:39:48 AM" DateTime="2009-01-15T08:39:48.261Z" SessionID="10"><From><User FriendlyName="James O'"/></From><To><User FriendlyName="simon"/></To><Text Style="font-family:Segoe UI; color:#000000; ">might be a touched OC'd, cant remember if I took that of or not</Text></Message><Message Date="1/15/2009" Time="12:39:58 AM" DateTime="2009-01-15T08:39:58.943Z" SessionID="10"><From><User FriendlyName="simon"/></From><To><User FriendlyName="James O'"/></To><Text Style="font-family:Tahoma; color:#000000; ">Q6600 here, does it have decent multi-core support?</Text></Message><Message Date="1/15/2009" Time="12:40:59 AM" DateTime="2009-01-15T08:40:59.212Z" SessionID="10"><From><User FriendlyName="James O'"/></From><To><User FriendlyName="simon"/></To><Text Style="font-family:Segoe UI; color:#000000; ">Uh, it says so</Text></Message><Message Date="1/15/2009" Time="12:41:17 AM" DateTime="2009-01-15T08:41:17.088Z" SessionID="10"><From><User FriendlyName="simon"/></From><To><User FriendlyName="James O'"/></To><Text Style="font-family:Tahoma; color:#000000; ">They always say so .dance</Text></Message><Message Date="1/15/2009" Time="12:41:23 AM" DateTime="2009-01-15T08:41:23.378Z" SessionID="10"><From><User FriendlyName="James O'"/></From><To><User FriendlyName="simon"/></To><Text Style="font-family:Segoe UI; color:#000000; ">Or atleast, it "supports", don't know how well it utilises it though</Text></Message><Message Date="1/15/2009" Time="12:41:37 AM" DateTime="2009-01-15T08:41:37.659Z" SessionID="10"><From><User FriendlyName="simon"/></From><To><User FriendlyName="James O'"/></To><Text Style="font-family:Tahoma; color:#000000; ">Played with Windows 7 yet?</Text></Message><Message Date="1/15/2009" Time="12:42:07 AM" DateTime="2009-01-15T08:42:07.892Z" SessionID="10"><From><User FriendlyName="James O'"/></From><To><User FriendlyName="simon"/></To><Text Style="font-family:Segoe UI; color:#000000; ">For about half an hour</Text></Message><Message Date="1/15/2009" Time="12:42:09 AM" DateTime="2009-01-15T08:42:09.924Z" SessionID="10"><From><User FriendlyName="James O'"/></From><To><User FriendlyName="simon"/></To><Text Style="font-family:Segoe UI; color:#000000; ">then it diwed</Text></Message><Message Date="1/15/2009" Time="12:42:28 AM" DateTime="2009-01-15T08:42:28.513Z" SessionID="10"><From><User FriendlyName="simon"/></From><To><User FriendlyName="James O'"/></To><Text Style="font-family:Tahoma; color:#000000; ">Really?</Text></Message><Message Date="1/15/2009" Time="12:42:34 AM" DateTime="2009-01-15T08:42:34.673Z" SessionID="10"><From><User FriendlyName="James O'"/></From><To><User FriendlyName="simon"/></To><Text Style="font-family:Segoe UI; color:#000000; ">horrible flames</Text></Message><Message Date="1/15/2009" Time="12:42:49 AM" DateTime="2009-01-15T08:42:49.623Z" SessionID="10"><From><User FriendlyName="simon"/></From><To><User FriendlyName="James O'"/></To><Text Style="font-family:Tahoma; color:#000000; ">I installed it on my lappy a few days ago and it's been running great</Text></Message><Message Date="1/15/2009" Time="12:43:01 AM" DateTime="2009-01-15T08:43:01.438Z" SessionID="10"><From><User FriendlyName="James O'"/></From><To><User FriendlyName="simon"/></To><Text Style="font-family:Segoe UI; color:#000000; ">I've had issues with my bootloaders</Text></Message><Message Date="1/15/2009" Time="12:43:15 AM" DateTime="2009-01-15T08:43:15.292Z" SessionID="10"><From><User FriendlyName="James O'"/></From><To><User FriendlyName="simon"/></To><Text Style="font-family:Segoe UI; color:#000000; ">Had one left over on my old drive that I couldn't get rid of</Text></Message><Message Date="1/15/2009" Time="12:43:19 AM" DateTime="2009-01-15T08:43:19.795Z" SessionID="10"><From><User FriendlyName="James O'"/></From><To><User FriendlyName="simon"/></To><Text Style="font-family:Segoe UI; color:#000000; ">(finally did btw)</Text></Message><Message Date="1/15/2009" Time="12:43:48 AM" DateTime="2009-01-15T08:43:48.497Z" SessionID="10"><From><User FriendlyName="James O'"/></From><To><User FriendlyName="simon"/></To><Text Style="font-family:Segoe UI; color:#000000; ">And then it got messy and then there was a missing file exe, and know that drive cracked the shits with me and won't show up</Text></Message><Message Date="1/15/2009" Time="12:43:57 AM" DateTime="2009-01-15T08:43:57.479Z" SessionID="10"><From><User FriendlyName="James O'"/></From><To><User FriendlyName="simon"/></To><Text Style="font-family:Segoe UI; color:#000000; ">So I spanked it and took it out of my system</Text></Message><Message Date="1/15/2009" Time="12:44:09 AM" DateTime="2009-01-15T08:44:09.080Z" SessionID="10"><From><User FriendlyName="simon"/></From><To><User FriendlyName="James O'"/></To><Text Style="font-family:Tahoma; color:#000000; ">Fun and games</Text></Message><Message Date="1/15/2009" Time="12:45:30 AM" DateTime="2009-01-15T08:45:30.660Z" SessionID="10"><From><User FriendlyName="James O'"/></From><To><User FriendlyName="simon"/></To><Text Style="font-family:Segoe UI; color:#000000; ">Yup, then I had a case of dissapearing 300gb IDE drive</Text></Message><Message Date="1/15/2009" Time="12:45:42 AM" DateTime="2009-01-15T08:45:42.851Z" SessionID="10"><From><User FriendlyName="James O'"/></From><To><User FriendlyName="simon"/></To><Text Style="font-family:Segoe UI; color:#000000; ">Bloody head ache</Text></Message><Message Date="1/15/2009" Time="12:46:15 AM" DateTime="2009-01-15T08:46:15.879Z" SessionID="10"><From><User FriendlyName="James O'"/></From><To><User FriendlyName="simon"/></To><Text Style="font-family:Segoe UI; color:#000000; ">so now I've got shit sorted, I re-installed vista on my main drive, got my games on another drive, and my 2x1tb drives linked together sharing all my media</Text></Message><Message Date="1/15/2009" Time="12:46:18 AM" DateTime="2009-01-15T08:46:18.167Z" SessionID="10"><From><User FriendlyName="James O'"/></From><To><User FriendlyName="simon"/></To><Text Style="font-family:Segoe UI; color:#000000; ">and Im happy with it</Text></Message><Message Date="1/15/2009" Time="12:46:26 AM" DateTime="2009-01-15T08:46:26.277Z" SessionID="10"><From><User FriendlyName="James O'"/></From><To><User FriendlyName="simon"/></To><Text Style="font-family:Segoe UI; color:#000000; ">I might try dual booting the beta on my laptop</Text></Message><Message Date="1/15/2009" Time="12:51:53 AM" DateTime="2009-01-15T08:51:53.017Z" SessionID="11"><From><User FriendlyName="simon"/></From><To><User FriendlyName="James O'"/></To><Text Style="font-family:Tahoma; color:#000000; ">I didn't even dual boot ay</Text></Message><Message Date="1/15/2009" Time="12:52:08 AM" DateTime="2009-01-15T08:52:08.536Z" SessionID="11"><From><User FriendlyName="simon"/></From><To><User FriendlyName="James O'"/></To><Text Style="font-family:Tahoma; color:#000000; ">I just imaged my Vista drive and then formatted and only installed Win7</Text></Message><Message Date="1/15/2009" Time="12:52:17 AM" DateTime="2009-01-15T08:52:17.663Z" SessionID="11"><From><User FriendlyName="simon"/></From><To><User FriendlyName="James O'"/></To><Text Style="font-family:Tahoma; color:#000000; ">If I don't like it I'll just restore the image bam back to normal</Text></Message><Message Date="1/15/2009" Time="12:52:38 AM" DateTime="2009-01-15T08:52:38.649Z" SessionID="11"><From><User FriendlyName="James O'"/></From><To><User FriendlyName="simon"/></To><Text Style="font-family:Segoe UI; color:#000000; ">You're mad sir!</Text></Message><Message Date="1/15/2009" Time="12:52:38 AM" DateTime="2009-01-15T08:52:38.913Z" SessionID="11"><From><User FriendlyName="simon"/></From><To><User FriendlyName="James O'"/></To><Text Style="font-family:Tahoma; color:#000000; ">But it is only my laptop...not ready to take the leap on my desktop</Text></Message><Message Date="1/15/2009" Time="12:52:48 AM" DateTime="2009-01-15T08:52:48.812Z" SessionID="11"><From><User FriendlyName="simon"/></From><To><User FriendlyName="James O'"/></To><Text Style="font-family:Tahoma; color:#000000; ">Dual-booting is for pussies!</Text></Message><Message Date="1/15/2009" Time="12:52:49 AM" DateTime="2009-01-15T08:52:49.845Z" SessionID="11"><From><User FriendlyName="simon"/></From><To><User FriendlyName="James O'"/></To><Text Style="font-family:Tahoma; color:#000000; ">haha</Text></Message><Message Date="1/15/2009" Time="12:52:59 AM" DateTime="2009-01-15T08:52:59.055Z" SessionID="11"><From><User FriendlyName="James O'"/></From><To><User FriendlyName="simon"/></To><Text Style="font-family:Segoe UI; color:#000000; ">Haha :$</Text></Message><Message Date="1/15/2009" Time="12:53:20 AM" DateTime="2009-01-15T08:53:20.428Z" SessionID="11"><From><User FriendlyName="James O'"/></From><To><User FriendlyName="simon"/></To><Text Style="font-family:Segoe UI; color:#000000; ">Real men virtualise?</Text></Message><Message Date="1/15/2009" Time="12:53:35 AM" DateTime="2009-01-15T08:53:35.003Z" SessionID="11"><From><User FriendlyName="simon"/></From><To><User FriendlyName="James O'"/></To><Text Style="font-family:Tahoma; color:#000000; ">Last time I installed linux was in a VM :-O</Text></Message><Message Date="1/15/2009" Time="12:55:05 AM" DateTime="2009-01-15T08:55:05.296Z" SessionID="11"><From><User FriendlyName="James O'"/></From><To><User FriendlyName="simon"/></To><Text Style="font-family:Segoe UI; color:#000000; ">Accidental real men (h5)</Text></Message><Message Date="1/15/2009" Time="12:56:56 AM" DateTime="2009-01-15T08:56:56.024Z" SessionID="11"><From><User FriendlyName="simon"/></From><To><User FriendlyName="James O'"/></To><Text Style="font-family:Tahoma; color:#000000; ">Stupid Perth</Text></Message><Message Date="1/15/2009" Time="12:57:15 AM" DateTime="2009-01-15T08:57:15.887Z" SessionID="11"><From><User FriendlyName="simon"/></From><To><User FriendlyName="James O'"/></To><Text Style="font-family:Tahoma; color:#000000; ">I'm doing a radio cutover tonight on the Vodafone network and because it's in Perth the guys won't be on site until about now...</Text></Message><Message Date="1/15/2009" Time="12:57:24 AM" DateTime="2009-01-15T08:57:24.817Z" SessionID="11"><From><User FriendlyName="simon"/></From><To><User FriendlyName="James O'"/></To><Text Style="font-family:Tahoma; color:#000000; ">They got like 2 hours of work to do before I can do my configurations from here...</Text></Message><Message Date="1/15/2009" Time="12:57:34 AM" DateTime="2009-01-15T08:57:34.733Z" SessionID="11"><From><User FriendlyName="simon"/></From><To><User FriendlyName="James O'"/></To><Text Style="font-family:Tahoma; color:#000000; ">So it appears as though I'm in for the long haul</Text></Message><Message Date="1/15/2009" Time="12:57:53 AM" DateTime="2009-01-15T08:57:53.548Z" SessionID="11"><From><User FriendlyName="James O'"/></From><To><User FriendlyName="simon"/></To><Text Style="font-family:Segoe UI; color:#000000; ">ugh, in Perth</Text></Message><Message Date="1/15/2009" Time="12:58:04 AM" DateTime="2009-01-15T08:58:04.626Z" SessionID="11"><From><User FriendlyName="James O'"/></From><To><User FriendlyName="simon"/></To><Text Style="font-family:Segoe UI; color:#000000; ">bummer</Text></Message><Message Date="1/15/2009" Time="12:58:16 AM" DateTime="2009-01-15T08:58:16.118Z" SessionID="11"><From><User FriendlyName="simon"/></From><To><User FriendlyName="James O'"/></To><Text Style="font-family:Tahoma; color:#000000; ">All good, I somehow managed a nap from 5-10 tonight</Text></Message><Message Date="1/15/2009" Time="1:00:29 AM" DateTime="2009-01-15T09:00:29.545Z" SessionID="11"><From><User FriendlyName="James O'"/></From><To><User FriendlyName="simon"/></To><Text Style="font-family:Segoe UI; color:#000000; ">btw, if u watch scrubs, new eps of season 8 totally make up for whatever the mess that season 7 was</Text></Message><Message Date="1/15/2009" Time="1:01:10 AM" DateTime="2009-01-15T09:01:10.320Z" SessionID="11"><From><User FriendlyName="simon"/></From><To><User FriendlyName="James O'"/></To><Text Style="font-family:Tahoma; color:#000000; ">Really?</Text></Message><Message Date="1/15/2009" Time="1:01:19 AM" DateTime="2009-01-15T09:01:19.897Z" SessionID="11"><From><User FriendlyName="simon"/></From><To><User FriendlyName="James O'"/></To><Text Style="font-family:Tahoma; color:#000000; ">I've only gotten into the show recently on Foxtel</Text></Message><Message Date="1/15/2009" Time="1:01:34 AM" DateTime="2009-01-15T09:01:34.866Z" SessionID="11"><From><User FriendlyName="simon"/></From><To><User FriendlyName="James O'"/></To><Text Style="font-family:Tahoma; color:#000000; ">So I got a lot of catching up to do but the quality varies a fair bit</Text></Message><Message Date="1/15/2009" Time="1:01:42 AM" DateTime="2009-01-15T09:01:42.583Z" SessionID="11"><From><User FriendlyName="simon"/></From><To><User FriendlyName="James O'"/></To><Text Style="font-family:Tahoma; color:#000000; ">But Turk/JD together kill me </Text></Message><Message Date="1/15/2009" Time="1:02:09 AM" DateTime="2009-01-15T09:02:09.701Z" SessionID="11"><From><User FriendlyName="James O'"/></From><To><User FriendlyName="simon"/></To><Text Style="font-family:Segoe UI; color:#000000; ">Season 1-5 are awesome, 6 starts of slow and picks up, season 7 is kind of dull, last few eps are ok, but 8 is awesome so far (Y)</Text></Message><Message Date="1/15/2009" Time="1:02:25 AM" DateTime="2009-01-15T09:02:25.083Z" SessionID="12"><From><User FriendlyName="James O'"/></From><To><User FriendlyName="simon"/></To><Text Style="font-family:Segoe UI; color:#000000; ">season 7 was only 10 eps</Text></Message><Message Date="1/15/2009" Time="1:02:45 AM" DateTime="2009-01-15T09:02:45.605Z" SessionID="12"><From><User FriendlyName="simon"/></From><To><User FriendlyName="James O'"/></To><Text Style="font-family:Tahoma; color:#000000; ">I'm going to have to find someone with all the Scrubs I think</Text></Message><Message Date="1/15/2009" Time="1:02:52 AM" DateTime="2009-01-15T09:02:52.561Z" SessionID="12"><From><User FriendlyName="simon"/></From><To><User FriendlyName="James O'"/></To><Text Style="font-family:Tahoma; color:#000000; ">I can't be fucked downloading 7+ seasons</Text></Message><Message Date="1/15/2009" Time="1:03:07 AM" DateTime="2009-01-15T09:03:07.207Z" SessionID="12"><From><User FriendlyName="simon"/></From><To><User FriendlyName="James O'"/></To><Text Style="font-family:Tahoma; color:#000000; ">I've just started getting into The Wire too, you seen it?</Text></Message><Message Date="1/15/2009" Time="1:03:44 AM" DateTime="2009-01-15T09:03:44.546Z" SessionID="12"><From><User FriendlyName="James O'"/></From><To><User FriendlyName="simon"/></To><Text Style="font-family:Segoe UI; color:#000000; ">Not yet, but I grabbed the first season through our intermediate source</Text></Message><Message Date="1/15/2009" Time="1:03:56 AM" DateTime="2009-01-15T09:03:56.338Z" SessionID="12"><From><User FriendlyName="simon"/></From><To><User FriendlyName="James O'"/></To><Text Style="font-family:Tahoma; color:#000000; ">Great job</Text></Message><Message Date="1/15/2009" Time="1:04:07 AM" DateTime="2009-01-15T09:04:07.182Z" SessionID="12"><From><User FriendlyName="simon"/></From><To><User FriendlyName="James O'"/></To><Text Style="font-family:Tahoma; color:#000000; ">I got the first 3 seasons now based on the strength of the first season</Text></Message><Message Date="1/15/2009" Time="1:04:11 AM" DateTime="2009-01-15T09:04:11.923Z" SessionID="12"><From><User FriendlyName="simon"/></From><To><User FriendlyName="James O'"/></To><Text Style="font-family:Tahoma; color:#000000; ">Almost through season 2 now</Text></Message><Message Date="1/15/2009" Time="1:04:21 AM" DateTime="2009-01-15T09:04:21.431Z" SessionID="12"><From><User FriendlyName="simon"/></From><To><User FriendlyName="James O'"/></To><Text Style="font-family:Tahoma; color:#000000; ">Once I start watching season 3 I spose I'll grab 4 and 5 too</Text></Message><Message Date="1/15/2009" Time="1:04:49 AM" DateTime="2009-01-15T09:04:49.234Z" SessionID="12"><From><User FriendlyName="James O'"/></From><To><User FriendlyName="simon"/></To><Text Style="font-family:Segoe UI; color:#000000; ">Wikked, I have heard its like the greatest of all television, so I suppose I owe it to myself to check it out</Text></Message><Message Date="1/15/2009" Time="1:05:15 AM" DateTime="2009-01-15T09:05:15.847Z" SessionID="12"><From><User FriendlyName="James O'"/></From><To><User FriendlyName="simon"/></To><Text Style="font-family:Segoe UI; color:#000000; ">oh btw, the eps are in MKV, you dont watch them on ur 360 by any chance do you?</Text></Message><Message Date="1/15/2009" Time="1:05:48 AM" DateTime="2009-01-15T09:05:48.946Z" SessionID="12"><From><User FriendlyName="simon"/></From><To><User FriendlyName="James O'"/></To><Text Style="font-family:Tahoma; color:#000000; ">Nah, I've got my main PC in a cupboard with a hole in the wall with a HDMI cable straight to the loungeroom...</Text></Message><Message Date="1/15/2009" Time="1:05:54 AM" DateTime="2009-01-15T09:05:54.522Z" SessionID="12"><From><User FriendlyName="James O'"/></From><To><User FriendlyName="simon"/></To><Text Style="font-family:Segoe UI; color:#000000; ">Cause I've been using a tool, xenonMKV that rips the .264 video and reconverts the audio and throws it in an MP4 container than runs on the 360, but those episodes of the wire didn't run on it</Text></Message><Message Date="1/15/2009" Time="1:05:56 AM" DateTime="2009-01-15T09:05:56.487Z" SessionID="12"><From><User FriendlyName="simon"/></From><To><User FriendlyName="James O'"/></To><Text Style="font-family:Tahoma; color:#000000; ">XBMC for Windows</Text></Message><Message Date="1/15/2009" Time="1:06:24 AM" DateTime="2009-01-15T09:06:24.115Z" SessionID="12"><From><User FriendlyName="simon"/></From><To><User FriendlyName="James O'"/></To><Text Style="font-family:Tahoma; color:#000000; ">or just MPC if I'm not feeling adventerous</Text></Message><Message Date="1/15/2009" Time="1:06:43 AM" DateTime="2009-01-15T09:06:43.189Z" SessionID="12"><From><User FriendlyName="James O'"/></From><To><User FriendlyName="simon"/></To><Text Style="font-family:Segoe UI; color:#000000; ">Ah right, I've hooked my laptop up via hdmi to watch some RM video, did the job but a touch of a hassel, since I usually hook the power cable up too</Text></Message><Message Date="1/15/2009" Time="1:07:11 AM" DateTime="2009-01-15T09:07:11.482Z" SessionID="12"><From><User FriendlyName="simon"/></From><To><User FriendlyName="James O'"/></To><Text Style="font-family:Tahoma; color:#000000; ">Yeah it's not a solution I'd recommend unless you can have it connected all the time or as a dedicated HTPC</Text></Message><Message Date="1/15/2009" Time="1:07:46 AM" DateTime="2009-01-15T09:07:46.785Z" SessionID="12"><From><User FriendlyName="simon"/></From><To><User FriendlyName="James O'"/></To><Text Style="font-family:Tahoma; color:#000000; ">Or the other way I'd do it is to have a laptop dock in the entertainment unit...so you just dock it in and bam lappy is now a HTPC</Text></Message><Message Date="1/15/2009" Time="1:07:58 AM" DateTime="2009-01-15T09:07:58.339Z" SessionID="12"><From><User FriendlyName="James O'"/></From><To><User FriendlyName="simon"/></To><Text Style="font-family:Segoe UI; color:#000000; ">I was thinking of building one *-)</Text></Message><Message Date="1/15/2009" Time="1:08:08 AM" DateTime="2009-01-15T09:08:08.303Z" SessionID="12"><From><User FriendlyName="simon"/></From><To><User FriendlyName="James O'"/></To><Text Style="font-family:Tahoma; color:#000000; ">I highly recommend it</Text></Message><Message Date="1/15/2009" Time="1:08:25 AM" DateTime="2009-01-15T09:08:25.798Z" SessionID="12"><From><User FriendlyName="simon"/></From><To><User FriendlyName="James O'"/></To><Text Style="font-family:Tahoma; color:#000000; ">With the price of hard drives there's no reason you can't put together a rad HTPC with 2tb of radness</Text></Message><Message Date="1/15/2009" Time="1:08:29 AM" DateTime="2009-01-15T09:08:29.312Z" SessionID="12"><From><User FriendlyName="James O'"/></From><To><User FriendlyName="simon"/></To><Text Style="font-family:Segoe UI; color:#000000; ">But the xbox with media sharing rocks my world atm</Text></Message><Message Date="1/15/2009" Time="1:08:40 AM" DateTime="2009-01-15T09:08:40.927Z" SessionID="12"><From><User FriendlyName="simon"/></From><To><User FriendlyName="James O'"/></To><Text Style="font-family:Tahoma; color:#000000; ">and throw a torrent app on it and leave it on 24/7</Text></Message><Message Date="1/15/2009" Time="1:09:06 AM" DateTime="2009-01-15T09:09:06.499Z" SessionID="12"><From><User FriendlyName="James O'"/></From><To><User FriendlyName="simon"/></To><Text Style="font-family:Segoe UI; color:#000000; ">Ive got everything on my main PC with 2tb of extra storage for my media, and It all just appears under the xbox media tab</Text></Message><Message Date="1/15/2009" Time="1:09:30 AM" DateTime="2009-01-15T09:09:30.256Z" SessionID="12"><From><User FriendlyName="James O'"/></From><To><User FriendlyName="simon"/></To><Text Style="font-family:Segoe UI; color:#000000; ">Only issues are Real Media and MKV doesnt playback</Text></Message><Message Date="1/15/2009" Time="1:09:37 AM" DateTime="2009-01-15T09:09:37.880Z" SessionID="12"><From><User FriendlyName="James O'"/></From><To><User FriendlyName="simon"/></To><Text Style="font-family:Segoe UI; color:#000000; ">which some of my anime is stored in</Text></Message><Message Date="1/15/2009" Time="1:09:41 AM" DateTime="2009-01-15T09:09:41.868Z" SessionID="12"><From><User FriendlyName="simon"/></From><To><User FriendlyName="James O'"/></To><Text Style="font-family:Tahoma; color:#000000; ">I know that's rad but the media compatability is where it comes apart :(</Text></Message><Message Date="1/15/2009" Time="1:10:08 AM" DateTime="2009-01-15T09:10:08.084Z" SessionID="12"><From><User FriendlyName="James O'"/></From><To><User FriendlyName="simon"/></To><Text Style="font-family:Segoe UI; color:#000000; ">(I dabble, Im not "that" guy, I grab a few series here and there that people recommend me)</Text></Message><Message Date="1/15/2009" Time="1:10:14 AM" DateTime="2009-01-15T09:10:14.163Z" SessionID="12"><From><User FriendlyName="simon"/></From><To><User FriendlyName="James O'"/></To><Text Style="font-family:Tahoma; color:#000000; ">I don't have any anime but I got a shitload of 1080p/720p MKV's with DTS and shit which the 360 doesn't play nice with</Text></Message><Message Date="1/15/2009" Time="1:10:31 AM" DateTime="2009-01-15T09:10:31.897Z" SessionID="12"><From><User FriendlyName="James O'"/></From><To><User FriendlyName="simon"/></To><Text Style="font-family:Segoe UI; color:#000000; ">I was looking at TVersity</Text></Message><Message Date="1/15/2009" Time="1:10:40 AM" DateTime="2009-01-15T09:10:40.035Z" SessionID="12"><From><User FriendlyName="simon"/></From><To><User FriendlyName="James O'"/></To><Text Style="font-family:Tahoma; color:#000000; ">Good shit but not for HD</Text></Message><Message Date="1/15/2009" Time="1:10:42 AM" DateTime="2009-01-15T09:10:42.768Z" SessionID="12"><From><User FriendlyName="James O'"/></From><To><User FriendlyName="simon"/></To><Text Style="font-family:Segoe UI; color:#000000; ">but last time I sued that it totally broke my windows streaming shit, AND didn't work</Text></Message><Message Date="1/15/2009" Time="1:10:44 AM" DateTime="2009-01-15T09:10:44.624Z" SessionID="12"><From><User FriendlyName="James O'"/></From><To><User FriendlyName="simon"/></To><Text Style="font-family:Segoe UI; color:#000000; ">ah right</Text></Message><Message Date="1/15/2009" Time="1:10:52 AM" DateTime="2009-01-15T09:10:52.639Z" SessionID="12"><From><User FriendlyName="James O'"/></From><To><User FriendlyName="simon"/></To><Text Style="font-family:Segoe UI; color:#000000; ">I only wanted it for MKV support</Text></Message><Message Date="1/15/2009" Time="1:11:01 AM" DateTime="2009-01-15T09:11:01.837Z" SessionID="12"><From><User FriendlyName="James O'"/></From><To><User FriendlyName="simon"/></To><Text Style="font-family:Segoe UI; color:#000000; ">but this quick little tool I had totally did the job fine</Text></Message><Message Date="1/15/2009" Time="1:11:16 AM" DateTime="2009-01-15T09:11:16.660Z" SessionID="12"><From><User FriendlyName="James O'"/></From><To><User FriendlyName="simon"/></To><Text Style="font-family:Segoe UI; color:#000000; ">but no soft-&gt;hard sub, since it just pulls the video stream</Text></Message><Message Date="1/15/2009" Time="1:11:49 AM" DateTime="2009-01-15T09:11:49.968Z" SessionID="12"><From><User FriendlyName="James O'"/></From><To><User FriendlyName="simon"/></To><Text Style="font-family:Segoe UI; color:#000000; ">so if its in MKV it must be hard subbed, and thats not always the case, or if its dual audio, i have to convert the dub stream</Text></Message><Message Date="1/15/2009" Time="1:12:00 AM" DateTime="2009-01-15T09:12:00.719Z" SessionID="12"><From><User FriendlyName="simon"/></From><To><User FriendlyName="James O'"/></To><Text Style="font-family:Tahoma; color:#000000; ">Also - The Wire has the best opening theme song ever</Text></Message><Message Date="1/15/2009" Time="1:12:08 AM" DateTime="2009-01-15T09:12:08.242Z" SessionID="12"><From><User FriendlyName="simon"/></From><To><User FriendlyName="James O'"/></To><Text Style="font-family:Tahoma; color:#000000; ">Tom Waits - Way Down In The Hole</Text></Message><Message Date="1/15/2009" Time="1:12:09 AM" DateTime="2009-01-15T09:12:09.861Z" SessionID="12"><From><User FriendlyName="James O'"/></From><To><User FriendlyName="simon"/></To><Text Style="font-family:Segoe UI; color:#000000; ">Haha, I look forward to this</Text></Message><Message Date="1/15/2009" Time="1:12:17 AM" DateTime="2009-01-15T09:12:17.723Z" SessionID="12"><From><User FriendlyName="simon"/></From><To><User FriendlyName="James O'"/></To><Text Style="font-family:Tahoma; color:#000000; ">But only season 2 is actually Tom Waits</Text></Message><Message Date="1/15/2009" Time="1:12:25 AM" DateTime="2009-01-15T09:12:25.490Z" SessionID="12"><From><User FriendlyName="simon"/></From><To><User FriendlyName="James O'"/></To><Text Style="font-family:Tahoma; color:#000000; ">The rest of the seasons have different covers...</Text></Message><Message Date="1/15/2009" Time="1:12:31 AM" DateTime="2009-01-15T09:12:31.700Z" SessionID="12"><From><User FriendlyName="simon"/></From><To><User FriendlyName="James O'"/></To><Text Style="font-family:Tahoma; color:#000000; ">Kinda like that song on Weeds</Text></Message><Message Date="1/15/2009" Time="1:15:16 AM" DateTime="2009-01-15T09:15:16.080Z" SessionID="12"><From><User FriendlyName="James O'"/></From><To><User FriendlyName="simon"/></To><Text Style="font-family:Segoe UI; color:#000000; ">Haven't watched</Text></Message><Message Date="1/15/2009" Time="1:16:09 AM" DateTime="2009-01-15T09:16:09.351Z" SessionID="12"><From><User FriendlyName="simon"/></From><To><User FriendlyName="James O'"/></To><Text Style="font-family:Tahoma; color:#000000; ">Another good show</Text></Message><Message Date="1/15/2009" Time="1:17:07 AM" DateTime="2009-01-15T09:17:07.466Z" SessionID="12"><From><User FriendlyName="James O'"/></From><To><User FriendlyName="simon"/></To><Text Style="font-family:Segoe UI; color:#000000; ">Heard good things, but I've got 36gb bandwidth cap, which is nice and plenty, but i can only really afford what I need and or something someone insists I watch</Text></Message><Message Date="1/15/2009" Time="1:17:50 AM" DateTime="2009-01-15T09:17:50.730Z" SessionID="12"><From><User FriendlyName="simon"/></From><To><User FriendlyName="James O'"/></To><Text Style="font-family:Tahoma; color:#000000; ">Bandwidth caps are shit</Text></Message><Message Date="1/15/2009" Time="1:17:52 AM" DateTime="2009-01-15T09:17:52.605Z" SessionID="12"><From><User FriendlyName="simon"/></From><To><User FriendlyName="James O'"/></To><Text Style="font-family:Tahoma; color:#000000; ">I'm sick of it</Text></Message><Message Date="1/15/2009" Time="1:18:01 AM" DateTime="2009-01-15T09:18:01.019Z" SessionID="12"><From><User FriendlyName="James O'"/></From><To><User FriendlyName="simon"/></To><Text Style="font-family:Segoe UI; color:#000000; ">you can say that again</Text></Message><Message Date="1/15/2009" Time="1:18:02 AM" DateTime="2009-01-15T09:18:02.147Z" SessionID="12"><From><User FriendlyName="simon"/></From><To><User FriendlyName="James O'"/></To><Text Style="font-family:Tahoma; color:#000000; ">All this HD stuff I want to get :(</Text></Message><Message Date="1/15/2009" Time="1:18:46 AM" DateTime="2009-01-15T09:18:46.180Z" SessionID="12"><From><User FriendlyName="simon"/></From><To><User FriendlyName="James O'"/></To><Text Style="font-family:Tahoma; color:#000000; ">For a start I reckon they should only include mb/gb that actually hit the Southern Cross Cable that they get charged for - local Australian traffic should all be free</Text></Message><Message Date="1/15/2009" Time="1:18:48 AM" DateTime="2009-01-15T09:18:48.839Z" SessionID="12"><From><User FriendlyName="James O'"/></From><To><User FriendlyName="simon"/></To><Text Style="font-family:Segoe UI; color:#000000; ">I hate rationing out what movies I can download this month and shiznit</Text></Message><Message Date="1/15/2009" Time="1:19:09 AM" DateTime="2009-01-15T09:19:09.089Z" SessionID="12"><From><User FriendlyName="simon"/></From><To><User FriendlyName="James O'"/></To><Text Style="font-family:Tahoma; color:#000000; ">Then all we need to do is start a kickass Aussie-only BT tracker</Text></Message><Message Date="1/15/2009" Time="1:19:15 AM" DateTime="2009-01-15T09:19:15.731Z" SessionID="12"><From><User FriendlyName="James O'"/></From><To><User FriendlyName="simon"/></To><Text Style="font-family:Segoe UI; color:#000000; ">Hells yeah!</Text></Message><Message Date="1/15/2009" Time="1:19:37 AM" DateTime="2009-01-15T09:19:37.264Z" SessionID="12"><From><User FriendlyName="simon"/></From><To><User FriendlyName="James O'"/></To><Text Style="font-family:Tahoma; color:#000000; ">I CAN DREAM</Text></Message><Message Date="1/15/2009" Time="1:19:42 AM" DateTime="2009-01-15T09:19:42.176Z" SessionID="12"><From><User FriendlyName="James O'"/></From><To><User FriendlyName="simon"/></To><Text Style="font-family:Segoe UI; color:#000000; ">And then a nice local megaupload mirror (A)</Text></Message><Message Date="1/15/2009" Time="1:20:07 AM" DateTime="2009-01-15T09:20:07.156Z" SessionID="12"><From><User FriendlyName="simon"/></From><To><User FriendlyName="James O'"/></To><Text Style="font-family:Tahoma; color:#000000; ">Just a decent fucking newsgroup service</Text></Message><Message Date="1/15/2009" Time="1:20:27 AM" DateTime="2009-01-15T09:20:27.970Z" SessionID="12"><From><User FriendlyName="James O'"/></From><To><User FriendlyName="simon"/></To><Text Style="font-family:Segoe UI; color:#000000; ">I get 150-1.1mb of Megaupload now, and i got a tool that handles the security captcha's and ques up whatever I throw at it, It's becoming pretty viable for me to grab shit of megaupload</Text></Message><Message Date="1/15/2009" Time="1:20:58 AM" DateTime="2009-01-15T09:20:58.151Z" SessionID="12"><From><User FriendlyName="James O'"/></From><To><User FriendlyName="simon"/></To><Text Style="font-family:Segoe UI; color:#000000; ">Like the other day I grabbed the latest how I met your mother, solid connection, musta been a good time of day,  800kbps was done in like 4 minutes</Text></Message><Message Date="1/15/2009" Time="1:21:08 AM" DateTime="2009-01-15T09:21:08.929Z" SessionID="12"><From><User FriendlyName="simon"/></From><To><User FriendlyName="James O'"/></To><Text Style="font-family:Tahoma; color:#000000; ">Nice - where from?</Text></Message><Message Date="1/15/2009" Time="1:21:12 AM" DateTime="2009-01-15T09:21:12.406Z" SessionID="12"><From><User FriendlyName="James O'"/></From><To><User FriendlyName="simon"/></To><Text Style="font-family:Segoe UI; color:#000000; ">Megaupload</Text></Message><Message Date="1/15/2009" Time="1:21:12 AM" DateTime="2009-01-15T09:21:12.448Z" SessionID="12"><From><User FriendlyName="simon"/></From><To><User FriendlyName="James O'"/></To><Text Style="font-family:Tahoma; color:#000000; ">That new ep was hilarious</Text></Message><Message Date="1/15/2009" Time="1:21:18 AM" DateTime="2009-01-15T09:21:18.061Z" SessionID="12"><From><User FriendlyName="James O'"/></From><To><User FriendlyName="simon"/></To><Text Style="font-family:Segoe UI; color:#000000; ">Loved it</Text></Message><Message Date="1/15/2009" Time="1:21:24 AM" DateTime="2009-01-15T09:21:24.337Z" SessionID="12"><From><User FriendlyName="simon"/></From><To><User FriendlyName="James O'"/></To><Text Style="font-family:Tahoma; color:#000000; ">But what site uploads shit to Megaupload?</Text></Message><Message Date="1/15/2009" Time="1:21:31 AM" DateTime="2009-01-15T09:21:31.891Z" SessionID="12"><From><User FriendlyName="James O'"/></From><To><User FriendlyName="simon"/></To><Text Style="font-family:Segoe UI; color:#000000; ">Warez forums</Text></Message><Message Date="1/15/2009" Time="1:21:41 AM" DateTime="2009-01-15T09:21:41.896Z" SessionID="12"><From><User FriendlyName="simon"/></From><To><User FriendlyName="James O'"/></To><Text Style="font-family:Tahoma; color:#000000; ">The look on Marshalls face when he walks away from the bedroom the first time is brilliant</Text></Message><Message Date="1/15/2009" Time="1:22:33 AM" DateTime="2009-01-15T09:22:33.468Z" SessionID="12"><From><User FriendlyName="James O'"/></From><To><User FriendlyName="simon"/></To><Text Style="font-family:Segoe UI; color:#000000; ">All the "read a magazine" jokes</Text></Message><Message Date="1/15/2009" Time="1:22:57 AM" DateTime="2009-01-15T09:22:57.569Z" SessionID="12"><From><User FriendlyName="simon"/></From><To><User FriendlyName="James O'"/></To><Text Style="font-family:Tahoma; color:#000000; ">Barneys was the best...read a magazine means masturbating...right?</Text></Message><Message Date="1/15/2009" Time="1:23:20 AM" DateTime="2009-01-15T09:23:20.446Z" SessionID="12"><From><User FriendlyName="James O'"/></From><To><User FriendlyName="simon"/></To><Text Style="font-family:Segoe UI; color:#000000; ">and I like the sorta touching side of barney</Text></Message><Message Date="1/15/2009" Time="1:23:27 AM" DateTime="2009-01-15T09:23:27.317Z" SessionID="12"><From><User FriendlyName="James O'"/></From><To><User FriendlyName="simon"/></To><Text Style="font-family:Segoe UI; color:#000000; ">Reminds me of Dr horrible</Text></Message><Message Date="1/15/2009" Time="1:23:46 AM" DateTime="2009-01-15T09:23:46.038Z" SessionID="12"><From><User FriendlyName="simon"/></From><To><User FriendlyName="James O'"/></To><Text Style="font-family:Tahoma; color:#000000; ">The end of the ep was really well acted by NPH</Text></Message><Message Date="1/15/2009" Time="1:23:52 AM" DateTime="2009-01-15T09:23:52.458Z" SessionID="12"><From><User FriendlyName="James O'"/></From><To><User FriendlyName="simon"/></To><Text Style="font-family:Segoe UI; color:#000000; ">Oh, btw, you can't recommend a tool to convert the hell out of some real media video?</Text></Message><Message Date="1/15/2009" Time="1:24:00 AM" DateTime="2009-01-15T09:24:00.585Z" SessionID="12"><From><User FriendlyName="James O'"/></From><To><User FriendlyName="simon"/></To><Text Style="font-family:Segoe UI; color:#000000; ">Yeah, NPH really is awesome</Text></Message><Message Date="1/15/2009" Time="1:24:05 AM" DateTime="2009-01-15T09:24:05.113Z" SessionID="12"><From><User FriendlyName="simon"/></From><To><User FriendlyName="James O'"/></To><Text Style="font-family:Tahoma; color:#000000; ">ConvertXtoDVD?</Text></Message><Message Date="1/15/2009" Time="1:24:19 AM" DateTime="2009-01-15T09:24:19.674Z" SessionID="12"><From><User FriendlyName="simon"/></From><To><User FriendlyName="James O'"/></To><Text Style="font-family:Tahoma; color:#000000; ">or WinAVI</Text></Message><Message Date="1/15/2009" Time="1:24:45 AM" DateTime="2009-01-15T09:24:45.499Z" SessionID="12"><From><User FriendlyName="James O'"/></From><To><User FriendlyName="simon"/></To><Text Style="font-family:Segoe UI; color:#000000; ">I'd like to convert it to .264, but anything that maintains some quality, regardless of filesize would do the trick</Text></Message><Message Date="1/15/2009" Time="1:24:52 AM" DateTime="2009-01-15T09:24:52.347Z" SessionID="12"><From><User FriendlyName="James O'"/></From><To><User FriendlyName="simon"/></To><Text Style="font-family:Segoe UI; color:#000000; ">I tried WinAVI as I've used it before</Text></Message><Message Date="1/15/2009" Time="1:25:01 AM" DateTime="2009-01-15T09:25:01.978Z" SessionID="12"><From><User FriendlyName="James O'"/></From><To><User FriendlyName="simon"/></To><Text Style="font-family:Segoe UI; color:#000000; ">But it kept stopping after like 16 mintues of conversion, saying it was done</Text></Message><Message Date="1/15/2009" Time="1:25:04 AM" DateTime="2009-01-15T09:25:04.446Z" SessionID="12"><From><User FriendlyName="simon"/></From><To><User FriendlyName="James O'"/></To><Text Style="font-family:Tahoma; color:#000000; ">It's fast and supports a lot of formats but isn't the best quality</Text></Message><Message Date="1/15/2009" Time="1:25:17 AM" DateTime="2009-01-15T09:25:17.752Z" SessionID="12"><From><User FriendlyName="James O'"/></From><To><User FriendlyName="simon"/></To><Text Style="font-family:Segoe UI; color:#000000; ">maybe it'll be ok since I'm on a fresh install of windows</Text></Message><Message Date="1/15/2009" Time="1:25:24 AM" DateTime="2009-01-15T09:25:24.832Z" SessionID="12"><From><User FriendlyName="simon"/></From><To><User FriendlyName="James O'"/></To><Text Style="font-family:Tahoma; color:#000000; ">can't hurt</Text></Message><Message Date="1/15/2009" Time="1:27:46 AM" DateTime="2009-01-15T09:27:46.486Z" SessionID="12"><From><User FriendlyName="James O'"/></From><To><User FriendlyName="simon"/></To><Text Style="font-family:Segoe UI; color:#000000; ">"Ultra RM converter"</Text></Message><Message Date="1/15/2009" Time="1:28:05 AM" DateTime="2009-01-15T09:28:05.020Z" SessionID="12"><From><User FriendlyName="James O'"/></From><To><User FriendlyName="simon"/></To><Text Style="font-family:Segoe UI; color:#000000; ">That sounds roughyl what I want</Text></Message><Message Date="1/15/2009" Time="1:30:41 AM" DateTime="2009-01-15T09:30:41.274Z" SessionID="12"><From><User FriendlyName="James O'"/></From><To><User FriendlyName="simon"/></To><Text Style="font-family:Segoe UI; color:#000000; ">Right, well I best wander off to seek unconciousness</Text></Message><Message Date="1/15/2009" Time="1:30:59 AM" DateTime="2009-01-15T09:30:59.782Z" SessionID="12"><From><User FriendlyName="simon"/></From><To><User FriendlyName="James O'"/></To><Text Style="font-family:Tahoma; color:#000000; ">Enjoy</Text></Message><Message Date="1/15/2009" Time="1:31:11 AM" DateTime="2009-01-15T09:31:11.216Z" SessionID="12"><From><User FriendlyName="simon"/></From><To><User FriendlyName="James O'"/></To><Text Style="font-family:Tahoma; color:#000000; ">I've got a good 8 hours before I can enjoy that</Text></Message><Message Date="1/15/2009" Time="1:31:29 AM" DateTime="2009-01-15T09:31:29.636Z" SessionID="12"><From><User FriendlyName="James O'"/></From><To><User FriendlyName="simon"/></To><Text Style="font-family:Segoe UI; color:#000000; ">Ah bummer</Text></Message><Message Date="1/15/2009" Time="1:32:10 AM" DateTime="2009-01-15T09:32:10.335Z" SessionID="12"><From><User FriendlyName="James O'"/></From><To><User FriendlyName="simon"/></To><Text Style="font-family:Segoe UI; color:#000000; ">Well, i'll talk to you later</Text></Message><Message Date="1/15/2009" Time="1:32:20 AM" DateTime="2009-01-15T09:32:20.261Z" SessionID="12"><From><User FriendlyName="James O'"/></From><To><User FriendlyName="simon"/></To><Text Style="font-family:Segoe UI; color:#000000; ">I'll let you know how xili's dvd ripation goes</Text></Message><Message Date="1/15/2009" Time="1:32:47 AM" DateTime="2009-01-15T09:32:47.669Z" SessionID="13"><From><User FriendlyName="simon"/></From><To><User FriendlyName="James O'"/></To><Text Style="font-family:Tahoma; color:#000000; ">Swoite, catch</Text></Message><Message Date="1/16/2009" Time="12:09:46 AM" DateTime="2009-01-16T08:09:46.457Z" SessionID="14"><From><User FriendlyName="James O'"/></From><To><User FriendlyName="simon"/></To><Text Style="font-family:Segoe UI; color:#000000; ">xilisoft dvd ripper sucked on my nuts</Text></Message><Message Date="1/16/2009" Time="12:09:59 AM" DateTime="2009-01-16T08:09:59.566Z" SessionID="14"><From><User FriendlyName="James O'"/></From><To><User FriendlyName="simon"/></To><Text Style="font-family:Segoe UI; color:#000000; ">it didnt get past converting the first of four eps</Text></Message><Message Date="1/16/2009" Time="12:15:27 AM" DateTime="2009-01-16T08:15:27.337Z" SessionID="14"><From><User FriendlyName="simon"/></From><To><User FriendlyName="James O'"/></To><Text Style="font-family:Tahoma; color:#000000; ">haha</Text></Message><Message Date="1/16/2009" Time="12:15:27 AM" DateTime="2009-01-16T08:15:27.662Z" SessionID="14"><From><User FriendlyName="simon"/></From><To><User FriendlyName="James O'"/></To><Text Style="font-family:Tahoma; color:#000000; ">piece of shit</Text></Message><Message Date="1/16/2009" Time="12:18:24 AM" DateTime="2009-01-16T08:18:24.923Z" SessionID="14"><From><User FriendlyName="James O'"/></From><To><User FriendlyName="simon"/></To><Text Style="font-family:Segoe UI; color:#000000; ">indeed, on the upside, the RM converter I found works quite well</Text></Message><Message Date="1/16/2009" Time="12:18:54 AM" DateTime="2009-01-16T08:18:54.239Z" SessionID="14"><From><User FriendlyName="James O'"/></From><To><User FriendlyName="simon"/></To><Text Style="font-family:Segoe UI; color:#000000; ">Next to no quality loss, which is tops, since RM usually goes to hell when you convert it</Text></Message><Message Date="1/16/2009" Time="3:36:05 AM" DateTime="2009-01-16T11:36:05.478Z" SessionID="15"><From><User FriendlyName="simon"/></From><To><User FriendlyName="James O'"/></To><Text Style="font-family:Tahoma; color:#000000; ">what</Text></Message><Message Date="1/23/2009" Time="2:21:27 AM" DateTime="2009-01-23T10:21:27.016Z" SessionID="16"><From><User FriendlyName="simon"/></From><To><User FriendlyName="James O'"/></To><Text Style="font-family:Tahoma; color:#000000; ">Lost?</Text></Message><Message Date="1/23/2009" Time="2:21:33 AM" DateTime="2009-01-23T10:21:33.062Z" SessionID="16"><From><User FriendlyName="simon"/></From><To><User FriendlyName="James O'"/></To><Text Style="font-family:Tahoma; color:#000000; ">Is that a reference to that show with that fat guy that's still fat?</Text></Message><Message Date="1/26/2009" Time="2:46:16 AM" DateTime="2009-01-26T10:46:16.607Z" SessionID="17"><From><User FriendlyName="simon"/></From><To><User FriendlyName="James O'"/></To><Text Style="font-family:Tahoma; color:#000000; ">http://forums.somethingawful.com/showthread.php?threadid=3060604</Text></Message><Message Date="1/26/2009" Time="3:53:55 AM" DateTime="2009-01-26T11:53:55.764Z" SessionID="17"><From><User FriendlyName="James O'"/></From><To><User FriendlyName="simon"/></To><Text Style="font-family:Segoe UI; color:#000000; ">Finally capped 999 lines in tetris ds</Text></Message><Message Date="1/26/2009" Time="3:54:44 AM" DateTime="2009-01-26T11:54:44.998Z" SessionID="17"><From><User FriendlyName="James O'"/></From><To><User FriendlyName="simon"/></To><Text Style="font-family:Segoe UI; color:#000000; ">lol @ breathing fire one</Text></Message><Message Date="1/29/2009" Time="2:52:34 AM" DateTime="2009-01-29T10:52:34.149Z" SessionID="18"><From><User FriendlyName="James O'"/></From><To><User FriendlyName="simon"/></To><Text Style="font-family:Segoe UI; color:#000000; ">http://na.square-enix.com/ff13/</Text></Message><Message Date="1/29/2009" Time="2:52:48 AM" DateTime="2009-01-29T10:52:48.747Z" SessionID="19"><From><User FriendlyName="James O'"/></From><To><User FriendlyName="simon"/></To><Text Style="font-family:Segoe UI; color:#000000; ">I'm such a sucker for countdown clocks</Text></Message><Message Date="1/29/2009" Time="5:22:10 PM" DateTime="2009-01-30T01:22:10.162Z" SessionID="20"><From><User FriendlyName="James O'"/></From><To><User FriendlyName="simon"/></To><Text Style="font-family:Segoe UI; color:#000000; ">Hello Sir</Text></Message><Message Date="1/29/2009" Time="5:22:26 PM" DateTime="2009-01-30T01:22:26.552Z" SessionID="20"><From><User FriendlyName="James O'"/></From><To><User FriendlyName="simon"/></To><Text Style="font-family:Segoe UI; color:#000000; ">I'm about to purchase a Samsung NC10 netbook from the UK</Text></Message><Message Date="1/29/2009" Time="5:22:47 PM" DateTime="2009-01-30T01:22:47.061Z" SessionID="20"><From><User FriendlyName="James O'"/></From><To><User FriendlyName="simon"/></To><Text Style="font-family:Segoe UI; color:#000000; ">All up, it's gonner cost me around $650 shipped to our gentle land down under</Text></Message><Message Date="1/29/2009" Time="5:36:16 PM" DateTime="2009-01-30T01:36:16.079Z" SessionID="21"><From><User FriendlyName="simon"/></From><To><User FriendlyName="James O'"/></To><Text Style="font-family:Tahoma; color:#000000; ">not bad</Text></Message><Message Date="1/29/2009" Time="5:37:39 PM" DateTime="2009-01-30T01:37:39.428Z" SessionID="21"><From><User FriendlyName="James O'"/></From><To><User FriendlyName="simon"/></To><Text Style="font-family:Segoe UI; color:#000000; ">yeah</Text></Message><Message Date="1/29/2009" Time="5:37:49 PM" DateTime="2009-01-30T01:37:49.762Z" SessionID="21"><From><User FriendlyName="James O'"/></From><To><User FriendlyName="simon"/></To><Text Style="font-family:Segoe UI; color:#000000; ">Im entering parental units credit card details now (Y) :)</Text></Message><Message Date="1/29/2009" Time="5:39:39 PM" DateTime="2009-01-30T01:39:39.101Z" SessionID="22"><From><User FriendlyName="simon"/></From><To><User FriendlyName="James O'"/></To><Text Style="font-family:Tahoma; color:#000000; ">If it's their shout throw one in for me</Text></Message><Message Date="1/29/2009" Time="5:39:51 PM" DateTime="2009-01-30T01:39:51.980Z" SessionID="22"><From><User FriendlyName="James O'"/></From><To><User FriendlyName="simon"/></To><Text Style="font-family:Segoe UI; color:#000000; ">haha</Text></Message><Message Date="1/29/2009" Time="5:40:11 PM" DateTime="2009-01-30T01:40:11.210Z" SessionID="22"><From><User FriendlyName="James O'"/></From><To><User FriendlyName="simon"/></To><Text Style="font-family:Segoe UI; color:#000000; ">You know, it's cheaper to pay the shipping fee's, than to buy it in their stores</Text></Message><Message Date="1/29/2009" Time="5:40:14 PM" DateTime="2009-01-30T01:40:14.953Z" SessionID="22"><From><User FriendlyName="James O'"/></From><To><User FriendlyName="simon"/></To><Text Style="font-family:Segoe UI; color:#000000; ">cause of there VAT tax</Text></Message><Message Date="1/29/2009" Time="5:40:22 PM" DateTime="2009-01-30T01:40:22.768Z" SessionID="22"><From><User FriendlyName="James O'"/></From><To><User FriendlyName="simon"/></To><Text Style="font-family:Segoe UI; color:#000000; ">tax is like 53 poinds</Text></Message><Message Date="1/29/2009" Time="5:40:24 PM" DateTime="2009-01-30T01:40:24.783Z" SessionID="22"><From><User FriendlyName="James O'"/></From><To><User FriendlyName="simon"/></To><Text Style="font-family:Segoe UI; color:#000000; ">shipping 32</Text></Message><Message Date="1/29/2009" Time="5:40:35 PM" DateTime="2009-01-30T01:40:35.247Z" SessionID="22"><From><User FriendlyName="James O'"/></From><To><User FriendlyName="simon"/></To><Text Style="font-family:Segoe UI; color:#000000; ">Dont pay the tax when you import it</Text></Message><Message Date="1/29/2009" Time="5:40:38 PM" DateTime="2009-01-30T01:40:38.239Z" SessionID="22"><From><User FriendlyName="James O'"/></From><To><User FriendlyName="simon"/></To><Text Style="font-family:Segoe UI; color:#000000; ">Fucking score(Y)</Text></Message><Message Date="1/29/2009" Time="5:42:04 PM" DateTime="2009-01-30T01:42:04.178Z" SessionID="23"><From><User FriendlyName="simon"/></From><To><User FriendlyName="James O'"/></To><Text Style="font-family:Tahoma; color:#000000; ">unless customs see it</Text></Message><Message Date="1/29/2009" Time="5:42:06 PM" DateTime="2009-01-30T01:42:06.142Z" SessionID="23"><From><User FriendlyName="simon"/></From><To><User FriendlyName="James O'"/></To><Text Style="font-family:Tahoma; color:#000000; ">unlikely, though</Text></Message><Message Date="1/29/2009" Time="5:42:56 PM" DateTime="2009-01-30T01:42:56.446Z" SessionID="23"><From><User FriendlyName="James O'"/></From><To><User FriendlyName="simon"/></To><Text Style="font-family:Segoe UI; color:#000000; ">My dad was going to London next week</Text></Message><Message Date="1/29/2009" Time="5:43:01 PM" DateTime="2009-01-30T01:43:01.997Z" SessionID="23"><From><User FriendlyName="James O'"/></From><To><User FriendlyName="simon"/></To><Text Style="font-family:Segoe UI; color:#000000; ">so I was gonner get him to get one over there</Text></Message><Message Date="1/29/2009" Time="5:43:14 PM" DateTime="2009-01-30T01:43:14.620Z" SessionID="23"><From><User FriendlyName="James O'"/></From><To><User FriendlyName="simon"/></To><Text Style="font-family:Segoe UI; color:#000000; ">Ended up $317 (pounds)</Text></Message><Message Date="1/29/2009" Time="5:43:56 PM" DateTime="2009-01-30T01:43:56.791Z" SessionID="23"><From><User FriendlyName="James O'"/></From><To><User FriendlyName="simon"/></To><Text Style="font-family:Segoe UI; color:#000000; ">Which, works out $670</Text></Message><Message Date="1/29/2009" Time="5:44:41 PM" DateTime="2009-01-30T01:44:41.866Z" SessionID="23"><From><User FriendlyName="James O'"/></From><To><User FriendlyName="simon"/></To><Text Style="font-family:Segoe UI; color:#000000; ">Shipping is "World Wide Express", they say it'll arrive monday</Text></Message><Message Date="1/29/2009" Time="5:44:48 PM" DateTime="2009-01-30T01:44:48.012Z" SessionID="23"><From><User FriendlyName="simon"/></From><To><User FriendlyName="James O'"/></To><Text Style="font-family:Tahoma; color:#000000; ">niiiiiiice</Text></Message><Message Date="1/29/2009" Time="5:44:56 PM" DateTime="2009-01-30T01:44:56.688Z" SessionID="23"><From><User FriendlyName="James O'"/></From><To><User FriendlyName="simon"/></To><Text Style="font-family:Segoe UI; color:#000000; ">which, might be a little optimistic</Text></Message><Message Date="1/29/2009" Time="5:45:11 PM" DateTime="2009-01-30T01:45:11.182Z" SessionID="23"><From><User FriendlyName="James O'"/></From><To><User FriendlyName="simon"/></To><Text Style="font-family:Segoe UI; color:#000000; ">But, $32 pounds, i'd expect it to be relatively accurate</Text></Message><Message Date="3/6/2009" Time="11:01:08 AM" DateTime="2009-03-06T00:01:08.057Z" SessionID="24"><From><User FriendlyName="simon"/></From><To><User FriendlyName="James O'"/></To><Text Style="font-family:Tahoma; color:#000000; ">Gran Torino</Text></Message><Message Date="3/6/2009" Time="11:36:18 AM" DateTime="2009-03-06T00:36:18.479Z" SessionID="24"><From><User FriendlyName="James O'"/></From><To><User FriendlyName="simon"/></To><Text Style="font-family:Segoe UI; color:#000000; ">Downloaded night before last</Text></Message><Message Date="3/6/2009" Time="11:36:31 AM" DateTime="2009-03-06T00:36:31.268Z" SessionID="25"><From><User FriendlyName="simon"/></From><To><User FriendlyName="James O'"/></To><Text Style="font-family:Tahoma; color:#000000; ">Racism is brilliant</Text></Message><Message Date="3/23/2009" Time="6:40:32 PM" DateTime="2009-03-23T07:40:32.386Z" SessionID="26"><From><User FriendlyName="James O'"/></From><To><User FriendlyName="simon"/></To><Text Style="font-family:Segoe UI; color:#000000; ">Well hullo</Text></Message><Message Date="3/23/2009" Time="6:41:06 PM" DateTime="2009-03-23T07:41:06.334Z" SessionID="26"><From><User FriendlyName="simon"/></From><To><User FriendlyName="James O'"/></To><Text Style="font-family:Tahoma; color:#000000; ">Mornin'</Text></Message><Message Date="3/23/2009" Time="6:41:07 PM" DateTime="2009-03-23T07:41:07.981Z" SessionID="26"><From><User FriendlyName="James O'"/></From><To><User FriendlyName="simon"/></To><Text Style="font-family:Segoe UI; color:#000000; ">Quick question, is there a nice way to track down a samsung laptop (netbook) replacement keyboard?</Text></Message><Message Date="3/23/2009" Time="6:41:14 PM" DateTime="2009-03-23T07:41:14.716Z" SessionID="26"><From><User FriendlyName="James O'"/></From><To><User FriendlyName="simon"/></To><Text Style="font-family:Segoe UI; color:#000000; ">I found one listed on a german site</Text></Message><Message Date="3/23/2009" Time="6:41:19 PM" DateTime="2009-03-23T07:41:19.277Z" SessionID="26"><From><User FriendlyName="simon"/></From><To><User FriendlyName="James O'"/></To><Text Style="font-family:Tahoma; color:#000000; ">Steal one from a dude on a train?</Text></Message><Message Date="3/23/2009" Time="6:41:25 PM" DateTime="2009-03-23T07:41:25.595Z" SessionID="26"><From><User FriendlyName="James O'"/></From><To><User FriendlyName="simon"/></To><Text Style="font-family:Segoe UI; color:#000000; ">40 euro for the UK keyboard</Text></Message><Message Date="3/23/2009" Time="6:41:26 PM" DateTime="2009-03-23T07:41:26.997Z" SessionID="26"><From><User FriendlyName="simon"/></From><To><User FriendlyName="James O'"/></To><Text Style="font-family:Tahoma; color:#000000; ">Email Samsung</Text></Message><Message Date="3/23/2009" Time="6:41:37 PM" DateTime="2009-03-23T07:41:37.081Z" SessionID="26"><From><User FriendlyName="James O'"/></From><To><User FriendlyName="simon"/></To><Text Style="font-family:Segoe UI; color:#000000; ">Well, samsung don't distribute laptops in Australia</Text></Message><Message Date="3/23/2009" Time="6:41:52 PM" DateTime="2009-03-23T07:41:52.591Z" SessionID="26"><From><User FriendlyName="James O'"/></From><To><User FriendlyName="simon"/></To><Text Style="font-family:Segoe UI; color:#000000; ">and they recommended me to "toms hardware" or something in milperra</Text></Message><Message Date="3/23/2009" Time="6:42:03 PM" DateTime="2009-03-23T07:42:03.086Z" SessionID="26"><From><User FriendlyName="James O'"/></From><To><User FriendlyName="simon"/></To><Text Style="font-family:Segoe UI; color:#000000; ">but I called them and they said its $60 for a quote</Text></Message><Message Date="3/23/2009" Time="6:42:20 PM" DateTime="2009-03-23T07:42:20.124Z" SessionID="26"><From><User FriendlyName="James O'"/></From><To><User FriendlyName="simon"/></To><Text Style="font-family:Segoe UI; color:#000000; ">at which point, its $20 extra to get it from germany (not sure of shipping yet)</Text></Message><Message Date="3/23/2009" Time="6:42:50 PM" DateTime="2009-03-23T07:42:50.977Z" SessionID="26"><From><User FriendlyName="simon"/></From><To><User FriendlyName="James O'"/></To><Text Style="font-family:Tahoma; color:#000000; ">Hahaha, wow that's rough</Text></Message><Message Date="3/23/2009" Time="6:43:08 PM" DateTime="2009-03-23T07:43:08.558Z" SessionID="26"><From><User FriendlyName="James O'"/></From><To><User FriendlyName="simon"/></To><Text Style="font-family:Segoe UI; color:#000000; ">HOWEVER, the german site doesn't seem to want to send me an e-mail once I've registered to give me a password and client number</Text></Message><Message Date="3/23/2009" Time="6:43:43 PM" DateTime="2009-03-23T07:43:43.570Z" SessionID="26"><From><User FriendlyName="James O'"/></From><To><User FriendlyName="simon"/></To><Text Style="font-family:Segoe UI; color:#000000; ">I also tried it on my gmail/hotmail accounts, to ensure it wasnt my ISP mail</Text></Message><Message Date="3/23/2009" Time="6:44:00 PM" DateTime="2009-03-23T07:44:00.794Z" SessionID="26"><From><User FriendlyName="simon"/></From><To><User FriendlyName="James O'"/></To><Text Style="font-family:Tahoma; color:#000000; ">I can only suggest ebay and Samsung</Text></Message><Message Date="3/23/2009" Time="6:44:15 PM" DateTime="2009-03-23T07:44:15.732Z" SessionID="26"><From><User FriendlyName="simon"/></From><To><User FriendlyName="James O'"/></To><Text Style="font-family:Tahoma; color:#000000; ">Luckily it was my hard drive on my laptop that died on the weekend so finding a replacement was a piece of piss</Text></Message><Message Date="3/23/2009" Time="6:44:26 PM" DateTime="2009-03-23T07:44:26.554Z" SessionID="26"><From><User FriendlyName="simon"/></From><To><User FriendlyName="James O'"/></To><Text Style="font-family:Tahoma; color:#000000; ">BUT FUCKING BALLS TO LAPTOPS BREAKING </Text></Message><Message Date="3/23/2009" Time="6:45:04 PM" DateTime="2009-03-23T07:45:04.392Z" SessionID="26"><From><User FriendlyName="James O'"/></From><To><User FriendlyName="simon"/></To><Text Style="font-family:Segoe UI; color:#000000; ">Indeed :(</Text></Message><Message Date="3/23/2009" Time="6:46:11 PM" DateTime="2009-03-23T07:46:11.279Z" SessionID="26"><From><User FriendlyName="James O'"/></From><To><User FriendlyName="simon"/></To><Text Style="font-family:Segoe UI; color:#000000; ">hmm, http://cgi.ebay.com.au/Samsung-NC10-TASTATUR-weiss-deutsches-Layout-keyboard_W0QQitemZ280325581151QQcmdZViewItemQQptZMuse_Tastaturen?hash=item280325581151&amp;_trksid=p3286.c0.m14&amp;_trkparms=66%3A2%7C65%3A1%7C39%3A1%7C240%3A1318#ebayphotohosting</Text></Message><Message Date="3/23/2009" Time="6:46:18 PM" DateTime="2009-03-23T07:46:18.894Z" SessionID="26"><From><User FriendlyName="James O'"/></From><To><User FriendlyName="simon"/></To><Text Style="font-family:Segoe UI; color:#000000; ">umm</Text></Message><Message Date="3/23/2009" Time="6:46:26 PM" DateTime="2009-03-23T07:46:26.109Z" SessionID="26"><From><User FriendlyName="James O'"/></From><To><User FriendlyName="simon"/></To><Text Style="font-family:Segoe UI; color:#000000; ">hang on, I'll tiny it</Text></Message><Message Date="3/23/2009" Time="6:46:55 PM" DateTime="2009-03-23T07:46:55.641Z" SessionID="26"><From><User FriendlyName="James O'"/></From><To><User FriendlyName="simon"/></To><Text Style="font-family:Segoe UI; color:#000000; ">http://tiny.cc/SYoCy</Text></Message><Message Date="3/23/2009" Time="6:47:22 PM" DateTime="2009-03-23T07:47:22.839Z" SessionID="26"><From><User FriendlyName="James O'"/></From><To><User FriendlyName="simon"/></To><Text Style="font-family:Segoe UI; color:#000000; ">Deutch keyboard...</Text></Message><Message Date="3/23/2009" Time="6:47:27 PM" DateTime="2009-03-23T07:47:27.982Z" SessionID="26"><From><User FriendlyName="James O'"/></From><To><User FriendlyName="simon"/></To><Text Style="font-family:Segoe UI; color:#000000; ">and its white</Text></Message><Message Date="3/23/2009" Time="6:47:28 PM" DateTime="2009-03-23T07:47:28.249Z" SessionID="26"><From><User FriendlyName="simon"/></From><To><User FriendlyName="James O'"/></To><Text Style="font-family:Tahoma; color:#000000; ">Got any friends in asia?</Text></Message><Message Date="3/23/2009" Time="6:47:30 PM" DateTime="2009-03-23T07:47:30.629Z" SessionID="26"><From><User FriendlyName="James O'"/></From><To><User FriendlyName="simon"/></To><Text Style="font-family:Segoe UI; color:#000000; ">mine is black</Text></Message><Message Date="3/23/2009" Time="6:47:45 PM" DateTime="2009-03-23T07:47:45.435Z" SessionID="26"><From><User FriendlyName="James O'"/></From><To><User FriendlyName="simon"/></To><Text Style="font-family:Segoe UI; color:#000000; ">Umm, I has a pilot father who goes via singapore?</Text></Message><Message Date="3/23/2009" Time="6:47:52 PM" DateTime="2009-03-23T07:47:52.603Z" SessionID="26"><From><User FriendlyName="James O'"/></From><To><User FriendlyName="simon"/></To><Text Style="font-family:Segoe UI; color:#000000; ">and an aunty in japan...</Text></Message><Message Date="3/23/2009" Time="6:48:00 PM" DateTime="2009-03-23T07:48:00.659Z" SessionID="26"><From><User FriendlyName="simon"/></From><To><User FriendlyName="James O'"/></To><Text Style="font-family:Tahoma; color:#000000; ">Singapore has lots of rad PC malls for that shit</Text></Message><Message Date="3/23/2009" Time="6:48:17 PM" DateTime="2009-03-23T07:48:17.706Z" SessionID="26"><From><User FriendlyName="simon"/></From><To><User FriendlyName="James O'"/></To><Text Style="font-family:Tahoma; color:#000000; ">And Hong Kong or Taiwan</Text></Message><Message Date="3/23/2009" Time="6:48:46 PM" DateTime="2009-03-23T07:48:46.436Z" SessionID="26"><From><User FriendlyName="James O'"/></From><To><User FriendlyName="simon"/></To><Text Style="font-family:Segoe UI; color:#000000; ">but $32 aus atm isn't a bad start</Text></Message><Message Date="3/23/2009" Time="6:48:51 PM" DateTime="2009-03-23T07:48:51.148Z" SessionID="26"><From><User FriendlyName="James O'"/></From><To><User FriendlyName="simon"/></To><Text Style="font-family:Segoe UI; color:#000000; ">... even tho its dutch</Text></Message><Message Date="3/23/2009" Time="6:49:04 PM" DateTime="2009-03-23T07:49:04.092Z" SessionID="26"><From><User FriendlyName="simon"/></From><To><User FriendlyName="James O'"/></To><Text Style="font-family:Tahoma; color:#000000; ">That's not a bad deal</Text></Message><Message Date="3/23/2009" Time="6:49:15 PM" DateTime="2009-03-23T07:49:15.416Z" SessionID="26"><From><User FriendlyName="simon"/></From><To><User FriendlyName="James O'"/></To><Text Style="font-family:Tahoma; color:#000000; ">How's the Samsung netbook go?</Text></Message><Message Date="3/23/2009" Time="6:49:35 PM" DateTime="2009-03-23T07:49:35.086Z" SessionID="26"><From><User FriendlyName="James O'"/></From><To><User FriendlyName="simon"/></To><Text Style="font-family:Segoe UI; color:#000000; ">Its gorgeous</Text></Message><Message Date="3/23/2009" Time="6:49:39 PM" DateTime="2009-03-23T07:49:39.741Z" SessionID="26"><From><User FriendlyName="James O'"/></From><To><User FriendlyName="simon"/></To><Text Style="font-family:Segoe UI; color:#000000; ">untill you spill tea on it</Text></Message><Message Date="3/23/2009" Time="6:49:44 PM" DateTime="2009-03-23T07:49:44.200Z" SessionID="26"><From><User FriendlyName="simon"/></From><To><User FriendlyName="James O'"/></To><Text Style="font-family:Tahoma; color:#000000; ">AKA which netbook is currnetly the top o' the game?</Text></Message><Message Date="3/23/2009" Time="6:50:01 PM" DateTime="2009-03-23T07:50:01.094Z" SessionID="26"><From><User FriendlyName="simon"/></From><To><User FriendlyName="James O'"/></To><Text Style="font-family:Tahoma; color:#000000; ">I hear the MSI is good?</Text></Message><Message Date="3/23/2009" Time="6:51:18 PM" DateTime="2009-03-23T07:51:18.928Z" SessionID="26"><From><User FriendlyName="James O'"/></From><To><User FriendlyName="simon"/></To><Text Style="font-family:Segoe UI; color:#000000; ">NC10 is still the best, but not available in australia</Text></Message><Message Date="3/23/2009" Time="6:51:41 PM" DateTime="2009-03-23T07:51:41.000Z" SessionID="26"><From><User FriendlyName="simon"/></From><To><User FriendlyName="James O'"/></To><Text Style="font-family:Tahoma; color:#000000; ">Is that the Asus one with the nv graphics?</Text></Message><Message Date="3/23/2009" Time="6:51:43 PM" DateTime="2009-03-23T07:51:43.853Z" SessionID="26"><From><User FriendlyName="James O'"/></From><To><User FriendlyName="simon"/></To><Text Style="font-family:Segoe UI; color:#000000; ">there's a few interesting things on the horizon, like the t91, the touchscreen eee tablet</Text></Message><Message Date="3/23/2009" Time="6:51:49 PM" DateTime="2009-03-23T07:51:49.319Z" SessionID="26"><From><User FriendlyName="simon"/></From><To><User FriendlyName="James O'"/></To><Text Style="font-family:Tahoma; color:#000000; ">No samsung</Text></Message><Message Date="3/23/2009" Time="6:51:52 PM" DateTime="2009-03-23T07:51:52.645Z" SessionID="26"><From><User FriendlyName="simon"/></From><To><User FriendlyName="James O'"/></To><Text Style="font-family:Tahoma; color:#000000; ">google to the rescue</Text></Message><Message Date="3/23/2009" Time="6:52:26 PM" DateTime="2009-03-23T07:52:26.938Z" SessionID="26"><From><User FriendlyName="simon"/></From><To><User FriendlyName="James O'"/></To><Text Style="font-family:Tahoma; color:#000000; ">Yeah I plan on waiting for the touchscreen ones to come out before I hit up a new toy :-O</Text></Message><Message Date="3/23/2009" Time="6:52:28 PM" DateTime="2009-03-23T07:52:28.784Z" SessionID="26"><From><User FriendlyName="James O'"/></From><To><User FriendlyName="simon"/></To><Text Style="font-family:Segoe UI; color:#000000; ">Well, nvidia is making a platform with 8400, but we wont see releases for a while, like q3/q4 in netbooks</Text></Message><Message Date="3/23/2009" Time="6:54:49 PM" DateTime="2009-03-23T07:54:49.423Z" SessionID="26"><From><User FriendlyName="James O'"/></From><To><User FriendlyName="simon"/></To><Text Style="font-family:Segoe UI; color:#000000; ">I guess white keyboard on a black netbook could be cool :P</Text></Message><Message Date="3/23/2009" Time="6:55:11 PM" DateTime="2009-03-23T07:55:11.764Z" SessionID="26"><From><User FriendlyName="James O'"/></From><To><User FriendlyName="simon"/></To><Text Style="font-family:Segoe UI; color:#000000; ">wow, dutch are weird, they have a shift up and shift down key :S</Text></Message><Message Date="3/23/2009" Time="6:55:16 PM" DateTime="2009-03-23T07:55:16.315Z" SessionID="26"><From><User FriendlyName="James O'"/></From><To><User FriendlyName="simon"/></To><Text Style="font-family:Segoe UI; color:#000000; ">I guess one is capslock?</Text></Message><Message Date="3/23/2009" Time="6:56:16 PM" DateTime="2009-03-23T07:56:16.355Z" SessionID="26"><From><User FriendlyName="James O'"/></From><To><User FriendlyName="simon"/></To><Text Style="font-family:Segoe UI; color:#000000; ">I just gotta find me a "BA59-02420U"</Text></Message><Message Date="3/23/2009" Time="7:01:00 PM" DateTime="2009-03-23T08:01:00.684Z" SessionID="26"><From><User FriendlyName="simon"/></From><To><User FriendlyName="James O'"/></To><Text Style="font-family:Tahoma; color:#000000; ">Well I just managed to recover all my digital camera photos from the old laptop drive</Text></Message><Message Date="3/23/2009" Time="7:01:12 PM" DateTime="2009-03-23T08:01:12.455Z" SessionID="26"><From><User FriendlyName="James O'"/></From><To><User FriendlyName="simon"/></To><Text Style="font-family:Segoe UI; color:#000000; ">huzzah</Text></Message><Message Date="3/23/2009" Time="7:01:15 PM" DateTime="2009-03-23T08:01:15.023Z" SessionID="26"><From><User FriendlyName="James O'"/></From><To><User FriendlyName="simon"/></To><Text Style="font-family:Segoe UI; color:#000000; ">How'd you do it?</Text></Message><Message Date="3/23/2009" Time="7:01:25 PM" DateTime="2009-03-23T08:01:25.315Z" SessionID="26"><From><User FriendlyName="simon"/></From><To><User FriendlyName="James O'"/></To><Text Style="font-family:Tahoma; color:#000000; ">But Naughty College Schoolgirls Vol. 52 doesn't seem to want to copy.</Text></Message><Message Date="3/23/2009" Time="7:02:11 PM" DateTime="2009-03-23T08:02:11.762Z" SessionID="26"><From><User FriendlyName="simon"/></From><To><User FriendlyName="James O'"/></To><Text Style="font-family:Tahoma; color:#000000; ">I love SATA - just banged the lappy drive in an my external casing and just seeing what I can do...one of the partitions is completely fucked, but bits and pieces of the other one is still working</Text></Message><Message Date="3/23/2009" Time="7:03:38 PM" DateTime="2009-03-23T08:03:38.980Z" SessionID="26"><From><User FriendlyName="James O'"/></From><To><User FriendlyName="simon"/></To><Text Style="font-family:Segoe UI; color:#000000; ">do you think there's a US/UK based stored that'd stock the parts?</Text></Message><Message Date="3/23/2009" Time="7:03:49 PM" DateTime="2009-03-23T08:03:49.287Z" SessionID="26"><From><User FriendlyName="simon"/></From><To><User FriendlyName="James O'"/></To><Text Style="font-family:Tahoma; color:#000000; ">I'd imagine so?</Text></Message><Message Date="3/23/2009" Time="7:04:05 PM" DateTime="2009-03-23T08:04:05.616Z" SessionID="26"><From><User FriendlyName="simon"/></From><To><User FriendlyName="James O'"/></To><Text Style="font-family:Tahoma; color:#000000; ">But if googling the serial number doesn't get you anywhere fucked if I know</Text></Message><Message Date="3/23/2009" Time="7:07:02 PM" DateTime="2009-03-23T08:07:02.347Z" SessionID="26"><From><User FriendlyName="James O'"/></From><To><User FriendlyName="simon"/></To><Text Style="font-family:Segoe UI; color:#000000; ">Ah huh!</Text></Message><Message Date="3/23/2009" Time="7:07:05 PM" DateTime="2009-03-23T08:07:05.395Z" SessionID="26"><From><User FriendlyName="James O'"/></From><To><User FriendlyName="simon"/></To><Text Style="font-family:Segoe UI; color:#000000; ">http://uk.eetnordic.com/product.aspx?id=BA59-02420N&amp;path=Samsung_BLACK_KEYBOARD_UK</Text></Message><Message Date="3/23/2009" Time="7:07:07 PM" DateTime="2009-03-23T08:07:07.403Z" SessionID="26"><From><User FriendlyName="James O'"/></From><To><User FriendlyName="simon"/></To><Text Style="font-family:Segoe UI; color:#000000; ">40 pounds</Text></Message><Message Date="3/23/2009" Time="7:07:17 PM" DateTime="2009-03-23T08:07:17.265Z" SessionID="26"><From><User FriendlyName="James O'"/></From><To><User FriendlyName="simon"/></To><Text Style="font-family:Segoe UI; color:#000000; ">!!!!!</Text></Message><Message Date="3/23/2009" Time="7:07:29 PM" DateTime="2009-03-23T08:07:29.477Z" SessionID="26"><From><User FriendlyName="simon"/></From><To><User FriendlyName="James O'"/></To><Text Style="font-family:Tahoma; color:#000000; ">POUNDS</Text></Message><Message Date="3/23/2009" Time="7:07:31 PM" DateTime="2009-03-23T08:07:31.360Z" SessionID="26"><From><User FriendlyName="James O'"/></From><To><User FriendlyName="simon"/></To><Text Style="font-family:Segoe UI; color:#000000; ">and the websites in fucking english</Text></Message><Message Date="3/23/2009" Time="7:07:32 PM" DateTime="2009-03-23T08:07:32.637Z" SessionID="26"><From><User FriendlyName="simon"/></From><To><User FriendlyName="James O'"/></To><Text Style="font-family:Tahoma; color:#000000; ">brutal</Text></Message><Message Date="3/23/2009" Time="7:07:42 PM" DateTime="2009-03-23T08:07:42.479Z" SessionID="26"><From><User FriendlyName="James O'"/></From><To><User FriendlyName="simon"/></To><Text Style="font-family:Segoe UI; color:#000000; ">eh</Text></Message><Message Date="3/23/2009" Time="7:07:51 PM" DateTime="2009-03-23T08:07:51.061Z" SessionID="26"><From><User FriendlyName="James O'"/></From><To><User FriendlyName="simon"/></To><Text Style="font-family:Segoe UI; color:#000000; ">its $83 instead of $79</Text></Message><Message Date="3/23/2009" Time="7:08:12 PM" DateTime="2009-03-23T08:08:12.211Z" SessionID="26"><From><User FriendlyName="James O'"/></From><To><User FriendlyName="simon"/></To><Text Style="font-family:Segoe UI; color:#000000; ">$78.5</Text></Message><Message Date="3/23/2009" Time="8:39:02 PM" DateTime="2009-03-23T09:39:02.682Z" SessionID="26"><From><User FriendlyName="James O'"/></From><To><User FriendlyName="simon"/></To><Text Style="font-family:Segoe UI; color:#000000; ">It appears that UK site only delivers to the UK...</Text></Message><Message Date="3/23/2009" Time="8:39:11 PM" DateTime="2009-03-23T09:39:11.105Z" SessionID="26"><From><User FriendlyName="James O'"/></From><To><User FriendlyName="simon"/></To><Text Style="font-family:Segoe UI; color:#000000; ">I have an uncle over there, so I could go through him</Text></Message><Message Date="3/23/2009