<?xml version="1.0"?>
<?xml-stylesheet type='text/xsl' href='MessageLog.xsl'?>
<Log FirstSessionID="1" LastSessionID="62"><Message Date="9/7/2008" Time="3:40:24 PM" DateTime="2008-09-07T05:40:24.282Z" SessionID="1"><From><User FriendlyName="- James O'"/></From><To><User FriendlyName="jonathan-"/></To><Text Style="font-family:MS Shell Dlg; color:#000000; ">ay</Text></Message><Message Date="9/7/2008" Time="3:40:29 PM" DateTime="2008-09-07T05:40:29.885Z" SessionID="1"><From><User FriendlyName="jonathan-"/></From><To><User FriendlyName="- James O'"/></To><Text Style="font-family:Comic Sans MS; color:#000000; ">ay</Text></Message><Message Date="9/7/2008" Time="3:40:32 PM" DateTime="2008-09-07T05:40:32.589Z" SessionID="1"><From><User FriendlyName="- James O'"/></From><To><User FriendlyName="jonathan-"/></To><Text Style="font-family:MS Shell Dlg; color:#000000; ">you start programming?</Text></Message><Message Date="9/7/2008" Time="3:41:23 PM" DateTime="2008-09-07T05:41:23.947Z" SessionID="1"><From><User FriendlyName="jonathan-"/></From><To><User FriendlyName="- James O'"/></To><Text Style="font-family:Comic Sans MS; color:#000000; ">assignment?</Text></Message><Message Date="9/7/2008" Time="3:41:28 PM" DateTime="2008-09-07T05:41:28.423Z" SessionID="1"><From><User FriendlyName="- James O'"/></From><To><User FriendlyName="jonathan-"/></To><Text Style="font-family:MS Shell Dlg; color:#000000; ">mm</Text></Message><Message Date="9/7/2008" Time="3:41:41 PM" DateTime="2008-09-07T05:41:41.412Z" SessionID="1"><From><User FriendlyName="- James O'"/></From><To><User FriendlyName="jonathan-"/></To><Text Style="font-family:MS Shell Dlg; color:#000000; ">or get any further on it</Text></Message><Message Date="9/7/2008" Time="3:42:26 PM" DateTime="2008-09-07T05:42:26.832Z" SessionID="1"><From><User FriendlyName="jonathan-"/></From><To><User FriendlyName="- James O'"/></To><Text Style="font-family:Comic Sans MS; color:#000000; ">nope it doesnt make any sense watso eva</Text></Message><Message Date="9/7/2008" Time="3:42:34 PM" DateTime="2008-09-07T05:42:34.816Z" SessionID="1"><From><User FriendlyName="jonathan-"/></From><To><User FriendlyName="- James O'"/></To><Text Style="font-family:Comic Sans MS; color:#000000; ">and ive looked at all the steps</Text></Message><Message Date="9/7/2008" Time="3:43:33 PM" DateTime="2008-09-07T05:43:33.872Z" SessionID="1"><From><User FriendlyName="- James O'"/></From><To><User FriendlyName="jonathan-"/></To><Text Style="font-family:MS Shell Dlg; color:#000000; ">im bored</Text></Message><Message Date="9/7/2008" Time="3:43:43 PM" DateTime="2008-09-07T05:43:43.159Z" SessionID="1"><From><User FriendlyName="- James O'"/></From><To><User FriendlyName="jonathan-"/></To><Text Style="font-family:MS Shell Dlg; color:#000000; ">but cbf trying to work on it</Text></Message><Message Date="9/7/2008" Time="3:44:05 PM" DateTime="2008-09-07T05:44:05.603Z" SessionID="1"><From><User FriendlyName="jonathan-"/></From><To><User FriendlyName="- James O'"/></To><Text Style="font-family:Comic Sans MS; color:#000000; ">haha yer f/e</Text></Message><Message Date="9/7/2008" Time="3:44:54 PM" DateTime="2008-09-07T05:44:54.364Z" SessionID="1"><From><User FriendlyName="- James O'"/></From><To><User FriendlyName="jonathan-"/></To><Text Style="font-family:MS Shell Dlg; color:#000000; ">I wanna watch heroes</Text></Message><Message Date="9/7/2008" Time="3:45:05 PM" DateTime="2008-09-07T05:45:05.831Z" SessionID="1"><From><User FriendlyName="jonathan-"/></From><To><User FriendlyName="- James O'"/></To><Text Style="font-family:Comic Sans MS; color:#000000; ">u got it yet?</Text></Message><Message Date="9/7/2008" Time="3:45:13 PM" DateTime="2008-09-07T05:45:13.123Z" SessionID="1"><From><User FriendlyName="- James O'"/></From><To><User FriendlyName="jonathan-"/></To><Text Style="font-family:MS Shell Dlg; color:#000000; ">but I was watching it with dad, and hes away</Text></Message><Message Date="9/7/2008" Time="3:45:22 PM" DateTime="2008-09-07T05:45:22.409Z" SessionID="1"><From><User FriendlyName="- James O'"/></From><To><User FriendlyName="jonathan-"/></To><Text Style="font-family:MS Shell Dlg; color:#000000; ">I'm watching season 1</Text></Message><Message Date="9/7/2008" Time="3:45:25 PM" DateTime="2008-09-07T05:45:25.519Z" SessionID="1"><From><User FriendlyName="jonathan-"/></From><To><User FriendlyName="- James O'"/></To><Text Style="font-family:Comic Sans MS; color:#000000; ">ohh f/e</Text></Message><Message Date="9/7/2008" Time="3:45:30 PM" DateTime="2008-09-07T05:45:30.915Z" SessionID="1"><From><User FriendlyName="- James O'"/></From><To><User FriendlyName="jonathan-"/></To><Text Style="font-family:MS Shell Dlg; color:#000000; ">4 eps left</Text></Message><Message Date="9/7/2008" Time="3:46:21 PM" DateTime="2008-09-07T05:46:21.165Z" SessionID="1"><From><User FriendlyName="jonathan-"/></From><To><User FriendlyName="- James O'"/></To><Text Style="font-family:Comic Sans MS; color:#000000; ">niice</Text></Message><Message Date="9/7/2008" Time="3:46:30 PM" DateTime="2008-09-07T05:46:30.729Z" SessionID="1"><From><User FriendlyName="- James O'"/></From><To><User FriendlyName="jonathan-"/></To><Text Style="font-family:MS Shell Dlg; color:#000000; ">its so fricken awesome btw</Text></Message><Message Date="9/7/2008" Time="3:47:05 PM" DateTime="2008-09-07T05:47:05.695Z" SessionID="1"><From><User FriendlyName="jonathan-"/></From><To><User FriendlyName="- James O'"/></To><Text Style="font-family:Comic Sans MS; color:#000000; ">haha if u say so</Text></Message><Message Date="9/7/2008" Time="3:47:23 PM" DateTime="2008-09-07T05:47:23.851Z" SessionID="1"><From><User FriendlyName="- James O'"/></From><To><User FriendlyName="jonathan-"/></To><Text Style="font-family:MS Shell Dlg; color:#000000; ">ya I say so</Text></Message><Message Date="9/7/2008" Time="3:47:26 PM" DateTime="2008-09-07T05:47:26.762Z" SessionID="1"><From><User FriendlyName="- James O'"/></From><To><User FriendlyName="jonathan-"/></To><Text Style="font-family:MS Shell Dlg; color:#000000; ">its brilliant</Text></Message><Message Date="9/7/2008" Time="3:47:31 PM" DateTime="2008-09-07T05:47:31.787Z" SessionID="1"><From><User FriendlyName="- James O'"/></From><To><User FriendlyName="jonathan-"/></To><Text Style="font-family:MS Shell Dlg; color:#000000; ">you gotta watch it from the beginning</Text></Message><Message Date="9/7/2008" Time="3:47:47 PM" DateTime="2008-09-07T05:47:47.427Z" SessionID="1"><From><User FriendlyName="- James O'"/></From><To><User FriendlyName="jonathan-"/></To><Text Style="font-family:MS Shell Dlg; color:#000000; ">I forgot how awesome it was tho</Text></Message><Message Date="9/7/2008" Time="3:49:06 PM" DateTime="2008-09-07T05:49:06.382Z" SessionID="1"><From><User FriendlyName="- James O'"/></From><To><User FriendlyName="jonathan-"/></To><Text Style="font-family:MS Shell Dlg; color:#000000; ">like I knew, but it'd been so long since i watched it I forgot how it was, and how gripping it was to watch</Text></Message><Message Date="9/7/2008" Time="3:49:36 PM" DateTime="2008-09-07T05:49:36.033Z" SessionID="1"><From><User FriendlyName="jonathan-"/></From><To><User FriendlyName="- James O'"/></To><Text Style="font-family:Comic Sans MS; color:#000000; ">haha</Text></Message><Message Date="9/7/2008" Time="3:51:02 PM" DateTime="2008-09-07T05:51:02.768Z" SessionID="1"><From><User FriendlyName="- James O'"/></From><To><User FriendlyName="jonathan-"/></To><Text Style="font-family:MS Shell Dlg; color:#000000; ">I might watch IronMan</Text></Message><Message Date="9/7/2008" Time="3:51:08 PM" DateTime="2008-09-07T05:51:08.897Z" SessionID="1"><From><User FriendlyName="- James O'"/></From><To><User FriendlyName="jonathan-"/></To><Text Style="font-family:MS Shell Dlg; color:#000000; ">downloaded a DVD Rip last night</Text></Message><Message Date="9/7/2008" Time="3:51:28 PM" DateTime="2008-09-07T05:51:28.436Z" SessionID="1"><From><User FriendlyName="jonathan-"/></From><To><User FriendlyName="- James O'"/></To><Text Style="font-family:Comic Sans MS; color:#000000; ">oh niice</Text></Message><Message Date="9/7/2008" Time="3:51:58 PM" DateTime="2008-09-07T05:51:58.707Z" SessionID="1"><From><User FriendlyName="- James O'"/></From><To><User FriendlyName="jonathan-"/></To><Text Style="font-family:MS Shell Dlg; color:#000000; ">sexily aweosme quality</Text></Message><Message Date="9/7/2008" Time="3:56:54 PM" DateTime="2008-09-07T05:56:54.585Z" SessionID="1"><From><User FriendlyName="- James O'"/></From><To><User FriendlyName="jonathan-"/></To><Text Style="font-family:MS Shell Dlg; color:#000000; ">I wanna watch it</Text></Message><Message Date="9/7/2008" Time="3:57:02 PM" DateTime="2008-09-07T05:57:02.176Z" SessionID="1"><From><User FriendlyName="- James O'"/></From><To><User FriendlyName="jonathan-"/></To><Text Style="font-family:MS Shell Dlg; color:#000000; ">but I feel I shood be doing something more useful with me time</Text></Message><Message Date="9/7/2008" Time="3:57:16 PM" DateTime="2008-09-07T05:57:16.159Z" SessionID="1"><From><User FriendlyName="- James O'"/></From><To><User FriendlyName="jonathan-"/></To><Text Style="font-family:MS Shell Dlg; color:#000000; ">meh fuck it</Text></Message><Message Date="9/7/2008" Time="3:57:29 PM" DateTime="2008-09-07T05:57:29.236Z" SessionID="1"><From><User FriendlyName="- James O'"/></From><To><User FriendlyName="jonathan-"/></To><Text Style="font-family:MS Shell Dlg; color:#000000; ">Im gonner make some coffee and eat some choclate and watch iron man</Text></Message><Message Date="9/7/2008" Time="4:05:45 PM" DateTime="2008-09-07T06:05:45.690Z" SessionID="1"><From><User FriendlyName="- James O'"/></From><To><User FriendlyName="jonathan-"/></To><Text Style="font-family:MS Shell Dlg; color:#000000; ">actually, I could go some buffy</Text></Message><Message Date="9/7/2008" Time="4:05:50 PM" DateTime="2008-09-07T06:05:50.618Z" SessionID="1"><From><User FriendlyName="- James O'"/></From><To><User FriendlyName="jonathan-"/></To><Text Style="font-family:MS Shell Dlg; color:#000000; ">http://cache.gizmodo.com/assets/images/gizmodo/2008/09/chrome1.jpg</Text></Message><Message Date="9/7/2008" Time="4:06:00 PM" DateTime="2008-09-07T06:06:00.184Z" SessionID="1"><From><User FriendlyName="- James O'"/></From><To><User FriendlyName="jonathan-"/></To><Text Style="font-family:MS Shell Dlg; color:#000000; ">(google launched a web browser btw)</Text></Message><Message Date="9/7/2008" Time="4:06:44 PM" DateTime="2008-09-07T06:06:44.801Z" SessionID="2"><From><User FriendlyName="- James O'"/></From><To><User FriendlyName="jonathan-"/></To><Text Style="font-family:MS Shell Dlg; color:#000000; ">sorry</Text></Message><Message Date="9/7/2008" Time="4:06:45 PM" DateTime="2008-09-07T06:06:45.137Z" SessionID="2"><From><User FriendlyName="- James O'"/></From><To><User FriendlyName="jonathan-"/></To><Text Style="font-family:MS Shell Dlg; color:#000000; ">http://gizmodo.com/5046344/google-chrome-fatal-flaw-discovered-will-destroy-lives-dignities</Text></Message><Message Date="9/9/2008" Time="9:44:01 PM" DateTime="2008-09-09T11:44:01.745Z" SessionID="3"><From><User FriendlyName="jonathan-"/></From><To><User FriendlyName="- James O'"/></To><Text Style="font-family:Comic Sans MS; color:#000000; ">oi there no soloutions for stat</Text></Message><Message Date="9/9/2008" Time="9:44:03 PM" DateTime="2008-09-09T11:44:03.643Z" SessionID="3"><From><User FriendlyName="jonathan-"/></From><To><User FriendlyName="- James O'"/></To><Text Style="font-family:Comic Sans MS; color:#000000; ">onlyl up to week 4</Text></Message><Message Date="9/10/2008" Time="5:02:21 PM" DateTime="2008-09-10T07:02:21.752Z" SessionID="4"><From><User FriendlyName="- James O'"/></From><To><User FriendlyName="jonathan-"/></To><Text Style="font-family:MS Shell Dlg; color:#000000; ">ay</Text></Message><Message Date="9/10/2008" Time="5:02:26 PM" DateTime="2008-09-10T07:02:26.564Z" SessionID="4"><From><User FriendlyName="- James O'"/></From><To><User FriendlyName="jonathan-"/></To><Text Style="font-family:MS Shell Dlg; color:#000000; ">I aint done nuthing 2day</Text></Message><Message Date="9/10/2008" Time="5:02:34 PM" DateTime="2008-09-10T07:02:34.733Z" SessionID="4"><From><User FriendlyName="jonathan-"/></From><To><User FriendlyName="- James O'"/></To><Text Style="font-family:Comic Sans MS; color:#000000; ">haha</Text></Message><Message Date="9/10/2008" Time="5:02:36 PM" DateTime="2008-09-10T07:02:36.621Z" SessionID="4"><From><User FriendlyName="- James O'"/></From><To><User FriendlyName="jonathan-"/></To><Text Style="font-family:MS Shell Dlg; color:#000000; ">but I got q1 of blake</Text></Message><Message Date="9/10/2008" Time="5:02:42 PM" DateTime="2008-09-10T07:02:42.338Z" SessionID="4"><From><User FriendlyName="- James O'"/></From><To><User FriendlyName="jonathan-"/></To><Text Style="font-family:MS Shell Dlg; color:#000000; ">for stat</Text></Message><Message Date="9/10/2008" Time="5:02:44 PM" DateTime="2008-09-10T07:02:44.307Z" SessionID="4"><From><User FriendlyName="jonathan-"/></From><To><User FriendlyName="- James O'"/></To><Text Style="font-family:Comic Sans MS; color:#000000; ">for assignment?</Text></Message><Message Date="9/10/2008" Time="5:02:46 PM" DateTime="2008-09-10T07:02:46.355Z" SessionID="4"><From><User FriendlyName="- James O'"/></From><To><User FriendlyName="jonathan-"/></To><Text Style="font-family:MS Shell Dlg; color:#000000; ">yuh</Text></Message><Message Date="9/10/2008" Time="5:02:49 PM" DateTime="2008-09-10T07:02:49.487Z" SessionID="4"><From><User FriendlyName="jonathan-"/></From><To><User FriendlyName="- James O'"/></To><Text Style="font-family:Comic Sans MS; color:#000000; ">oh sweet</Text></Message><Message Date="9/10/2008" Time="5:02:57 PM" DateTime="2008-09-10T07:02:57.330Z" SessionID="4"><From><User FriendlyName="jonathan-"/></From><To><User FriendlyName="- James O'"/></To><Text Style="font-family:Comic Sans MS; color:#000000; ">and we got 3 pretty much done yet?</Text></Message><Message Date="9/10/2008" Time="5:03:04 PM" DateTime="2008-09-10T07:03:04.042Z" SessionID="4"><From><User FriendlyName="- James O'"/></From><To><User FriendlyName="jonathan-"/></To><Text Style="font-family:MS Shell Dlg; color:#000000; ">yeh</Text></Message><Message Date="9/10/2008" Time="5:03:16 PM" DateTime="2008-09-10T07:03:16.535Z" SessionID="4"><From><User FriendlyName="- James O'"/></From><To><User FriendlyName="jonathan-"/></To><Text Style="font-family:MS Shell Dlg; color:#000000; ">dunno about 2 or the lab work</Text></Message><Message Date="9/10/2008" Time="5:03:22 PM" DateTime="2008-09-10T07:03:22.616Z" SessionID="4"><From><User FriendlyName="jonathan-"/></From><To><User FriendlyName="- James O'"/></To><Text Style="font-family:Comic Sans MS; color:#000000; ">ive done the lab work</Text></Message><Message Date="9/10/2008" Time="5:03:24 PM" DateTime="2008-09-10T07:03:24.744Z" SessionID="4"><From><User FriendlyName="- James O'"/></From><To><User FriendlyName="jonathan-"/></To><Text Style="font-family:MS Shell Dlg; color:#000000; ">I feel shit house, cbf doing anything 2nite</Text></Message><Message Date="9/10/2008" Time="5:03:25 PM" DateTime="2008-09-10T07:03:25.518Z" SessionID="4"><From><User FriendlyName="- James O'"/></From><To><User FriendlyName="jonathan-"/></To><Text Style="font-family:MS Shell Dlg; color:#000000; ">:-O</Text></Message><Message Date="9/10/2008" Time="5:03:26 PM" DateTime="2008-09-10T07:03:26.861Z" SessionID="4"><From><User FriendlyName="- James O'"/></From><To><User FriendlyName="jonathan-"/></To><Text Style="font-family:MS Shell Dlg; color:#000000; ">all of it?</Text></Message><Message Date="9/10/2008" Time="5:03:29 PM" DateTime="2008-09-10T07:03:29.697Z" SessionID="4"><From><User FriendlyName="jonathan-"/></From><To><User FriendlyName="- James O'"/></To><Text Style="font-family:Comic Sans MS; color:#000000; ">yer</Text></Message><Message Date="9/10/2008" Time="5:03:34 PM" DateTime="2008-09-10T07:03:34.886Z" SessionID="4"><From><User FriendlyName="- James O'"/></From><To><User FriendlyName="jonathan-"/></To><Text Style="font-family:MS Shell Dlg; color:#000000; ">with pictueres?</Text></Message><Message Date="9/10/2008" Time="5:03:45 PM" DateTime="2008-09-10T07:03:45.261Z" SessionID="4"><From><User FriendlyName="jonathan-"/></From><To><User FriendlyName="- James O'"/></To><Text Style="font-family:Comic Sans MS; color:#000000; ">no thats all i gotta do </Text></Message><Message Date="9/10/2008" Time="5:04:31 PM" DateTime="2008-09-10T07:04:31.754Z" SessionID="4"><From><User FriendlyName="jonathan-"/></From><To><User FriendlyName="- James O'"/></To><Text Style="font-family:Comic Sans MS; color:#000000; ">i wrote something for every log book question, but if u actually read it it has nothin to do with anythin</Text></Message><Message Date="9/10/2008" Time="5:04:56 PM" DateTime="2008-09-10T07:04:56.589Z" SessionID="4"><From><User FriendlyName="- James O'"/></From><To><User FriendlyName="jonathan-"/></To><Text Style="font-family:MS Shell Dlg; color:#000000; ">thats wat I planned on doing</Text></Message><Message Date="9/10/2008" Time="5:04:59 PM" DateTime="2008-09-10T07:04:59.317Z" SessionID="4"><From><User FriendlyName="- James O'"/></From><To><User FriendlyName="jonathan-"/></To><Text Style="font-family:MS Shell Dlg; color:#000000; ">how long did it take you?</Text></Message><Message Date="9/10/2008" Time="5:05:05 PM" DateTime="2008-09-10T07:05:05.430Z" SessionID="4"><From><User FriendlyName="jonathan-"/></From><To><User FriendlyName="- James O'"/></To><Text Style="font-family:Comic Sans MS; color:#000000; ">an hour</Text></Message><Message Date="9/10/2008" Time="5:05:06 PM" DateTime="2008-09-10T07:05:06.754Z" SessionID="4"><From><User FriendlyName="- James O'"/></From><To><User FriendlyName="jonathan-"/></To><Text Style="font-family:MS Shell Dlg; color:#000000; ">I'm in no mood to work</Text></Message><Message Date="9/10/2008" Time="5:05:10 PM" DateTime="2008-09-10T07:05:10.817Z" SessionID="4"><From><User FriendlyName="- James O'"/></From><To><User FriendlyName="jonathan-"/></To><Text Style="font-family:MS Shell Dlg; color:#000000; ">but I might just fly thru it</Text></Message><Message Date="9/10/2008" Time="5:05:19 PM" DateTime="2008-09-10T07:05:19.504Z" SessionID="4"><From><User FriendlyName="- James O'"/></From><To><User FriendlyName="jonathan-"/></To><Text Style="font-family:MS Shell Dlg; color:#000000; ">make it messy and busy so he wont read it</Text></Message><Message Date="9/10/2008" Time="5:05:38 PM" DateTime="2008-09-10T07:05:38.704Z" SessionID="4"><From><User FriendlyName="jonathan-"/></From><To><User FriendlyName="- James O'"/></To><Text Style="font-family:Comic Sans MS; color:#000000; ">yer, i cant evn read my own writing</Text></Message><Message Date="9/10/2008" Time="5:05:39 PM" DateTime="2008-09-10T07:05:39.727Z" SessionID="4"><From><User FriendlyName="- James O'"/></From><To><User FriendlyName="jonathan-"/></To><Text Style="font-family:MS Shell Dlg; color:#000000; ">Im just gonner try the stick pictures from the questions business I think</Text></Message><Message Date="9/10/2008" Time="5:05:50 PM" DateTime="2008-09-10T07:05:50.196Z" SessionID="4"><From><User FriendlyName="jonathan-"/></From><To><User FriendlyName="- James O'"/></To><Text Style="font-family:Comic Sans MS; color:#000000; ">yer same</Text></Message><Message Date="9/10/2008" Time="8:10:00 PM" DateTime="2008-09-10T10:10:00.493Z" SessionID="5"><From><User FriendlyName="- James O'"/></From><To><User FriendlyName="jonathan-"/></To><Text Style="font-family:MS Shell Dlg; color:#000000; ">didnt score q2 yet did u?</Text></Message><Message Date="9/10/2008" Time="8:12:28 PM" DateTime="2008-09-10T10:12:28.012Z" SessionID="6"><From><User FriendlyName="jonathan-"/></From><To><User FriendlyName="- James O'"/></To><Text Style="font-family:Comic Sans MS; color:#000000; ">na</Text></Message><Message Date="9/10/2008" Time="10:08:01 PM" DateTime="2008-09-10T12:08:01.866Z" SessionID="7"><From><User FriendlyName="jonathan-"/></From><To><User FriendlyName="- James O'"/></To><Text Style="font-family:Comic Sans MS; color:#000000; ">hey man can i grab q3 off ya?</Text></Message><Message Date="9/10/2008" Time="10:08:12 PM" DateTime="2008-09-10T12:08:12.267Z" SessionID="7"><From><User FriendlyName="- James O'"/></From><To><User FriendlyName="jonathan-"/></To><Text Style="font-family:MS Shell Dlg; color:#000000; ">one tic</Text></Message><Message Date="9/10/2008" Time="10:08:30 PM" DateTime="2008-09-10T12:08:30.514Z" SessionID="7"><From><User FriendlyName="jonathan-"/></From><To><User FriendlyName="- James O'"/></To><Text Style="font-family:Comic Sans MS; color:#000000; ">kk</Text></Message><Invitation Date="9/10/2008" Time="10:09:51 PM" DateTime="2008-09-10T12:09:51.364Z" SessionID="7"><From><User FriendlyName="- James O'"/></From><File>M:\BioStat.rar</File><Text Style="color:#545454; ">- James O' sends M:\BioStat.rar</Text></Invitation><Message Date="9/10/2008" Time="10:11:22 PM" DateTime="2008-09-10T12:11:22.604Z" SessionID="7"><From><User FriendlyName="- James O'"/></From><To><User FriendlyName="jonathan-"/></To><Text Style="font-family:MS Shell Dlg; color:#000000; ">cancelled?</Text></Message><Message Date="9/10/2008" Time="10:11:23 PM" DateTime="2008-09-10T12:11:23.229Z" SessionID="7"><From><User FriendlyName="- James O'"/></From><To><User FriendlyName="jonathan-"/></To><Text Style="font-family:MS Shell Dlg; color:#000000; ">gg</Text></Message><Message Date="9/10/2008" Time="10:11:31 PM" DateTime="2008-09-10T12:11:31.309Z" SessionID="7"><From><User FriendlyName="jonathan-"/></From><To><User FriendlyName="- James O'"/></To><Text Style="font-family:Comic Sans MS; color:#000000; ">soz msn signed out</Text></Message><Invitation Date="9/10/2008" Time="10:11:32 PM" DateTime="2008-09-10T12:11:32.203Z" SessionID="7"><From><User FriendlyName="- James O'"/></From><File>M:\BioStat.rar</File><Text Style="color:#545454; ">- James O' sends M:\BioStat.rar</Text></Invitation><InvitationResponse Date="9/10/2008" Time="10:11:56 PM" DateTime="2008-09-10T12:11:56.625Z" SessionID="7"><From><User FriendlyName="jonathan-"/></From><File>M:\BioStat.rar</File><Text Style="color:#545454; ">Transfer of "BioStat.rar" is complete.</Text></InvitationResponse><Message Date="9/10/2008" Time="10:11:57 PM" DateTime="2008-09-10T12:11:57.378Z" SessionID="7"><From><User FriendlyName="jonathan-"/></From><To><User FriendlyName="- James O'"/></To><Text Style="font-family:Comic Sans MS; color:#000000; ">thanks he</Text></Message><Message Date="9/10/2008" Time="10:12:07 PM" DateTime="2008-09-10T12:12:07.949Z" SessionID="7"><From><User FriendlyName="jonathan-"/></From><To><User FriendlyName="- James O'"/></To><Text Style="font-family:Comic Sans MS; color:#000000; ">heaps</Text></Message><Message Date="9/10/2008" Time="10:12:28 PM" DateTime="2008-09-10T12:12:28.463Z" SessionID="7"><From><User FriendlyName="- James O'"/></From><To><User FriendlyName="jonathan-"/></To><Text Style="font-family:MS Shell Dlg; color:#000000; ">first question, its refering to the mean and mean error</Text></Message><Message Date="9/10/2008" Time="10:13:15 PM" DateTime="2008-09-10T12:13:15.517Z" SessionID="8"><From><User FriendlyName="jonathan-"/></From><To><User FriendlyName="- James O'"/></To><Text Style="font-family:Comic Sans MS; color:#000000; ">kk</Text></Message><Message Date="9/11/2008" Time="9:43:41 AM" DateTime="2008-09-10T23:43:41.651Z" SessionID="9"><From><User FriendlyName="jonathan-"/></From><To><User FriendlyName="- James O'"/></To><Text Style="font-family:Comic Sans MS; color:#000000; ">hey did blake give u q1 of the stat assignment?</Text></Message><Message Date="9/11/2008" Time="9:56:54 AM" DateTime="2008-09-10T23:56:54.710Z" SessionID="9"><From><User FriendlyName="- James O'"/></From><To><User FriendlyName="jonathan-"/></To><Text Style="font-family:MS Shell Dlg; color:#000000; ">yuh</Text></Message><Message Date="9/11/2008" Time="10:19:44 AM" DateTime="2008-09-11T00:19:44.024Z" SessionID="10"><From><User FriendlyName="- James O'"/></From><To><User FriendlyName="jonathan-"/></To><Text Style="font-family:MS Shell Dlg; color:#000000; ">omg stop logging off</Text></Message><Message Date="9/11/2008" Time="10:32:15 AM" DateTime="2008-09-11T00:32:15.736Z" SessionID="11"><From><User FriendlyName="jonathan-"/></From><To><User FriendlyName="- James O'"/></To><Text Style="font-family:Comic Sans MS; color:#000000; ">haha sorry</Text></Message><Message Date="9/11/2008" Time="10:32:29 AM" DateTime="2008-09-11T00:32:29.399Z" SessionID="11"><From><User FriendlyName="jonathan-"/></From><To><User FriendlyName="- James O'"/></To><Text Style="font-family:Comic Sans MS; color:#000000; ">did blake send u p1 of stat?</Text></Message><Invitation Date="9/11/2008" Time="10:54:02 AM" DateTime="2008-09-11T00:54:02.730Z" SessionID="11"><From><User FriendlyName="- James O'"/></From><File>C:\Users\James\Documents\!UNI\stat ass 2, q1.txt</File><Text Style="color:#545454; ">- James O' sends C:\Users\James\Documents\!UNI\stat ass 2, q1.txt</Text></Invitation><InvitationResponse Date="9/11/2008" Time="10:55:25 AM" DateTime="2008-09-11T00:55:25.760Z" SessionID="11"><From><User FriendlyName="jonathan-"/></From><File>C:\Users\James\Documents\!UNI\stat ass 2, q1.txt</File><Text Style="color:#545454; ">Transfer of "stat ass 2, q1.txt" is complete.</Text></InvitationResponse><Message Date="9/11/2008" Time="10:56:06 AM" DateTime="2008-09-11T00:56:06.087Z" SessionID="11"><From><User FriendlyName="jonathan-"/></From><To><User FriendlyName="- James O'"/></To><Text Style="font-family:Comic Sans MS; color:#000000; ">umm a is wrong</Text></Message><Message Date="9/11/2008" Time="11:04:14 AM" DateTime="2008-09-11T01:04:14.127Z" SessionID="12"><From><User FriendlyName="jonathan-"/></From><To><User FriendlyName="- James O'"/></To><Text Style="font-family:Comic Sans MS; color:#000000; ">ill send u mine when i have done it</Text></Message><Message Date="9/11/2008" Time="1:17:10 PM" DateTime="2008-09-11T03:17:10.495Z" SessionID="13"><From><User FriendlyName="- James O'"/></From><To><User FriendlyName="jonathan-"/></To><Text Style="font-family:MS Shell Dlg; color:#000000; ">http://gamevideos.1up.com/video/id/21401</Text></Message><Message Date="9/11/2008" Time="1:17:59 PM" DateTime="2008-09-11T03:17:59.375Z" SessionID="14"><From><User FriendlyName="jonathan-"/></From><To><User FriendlyName="- James O'"/></To><Text Style="font-family:Comic Sans MS; color:#000000; ">hows assignment goin?</Text></Message><Message Date="9/11/2008" Time="1:18:35 PM" DateTime="2008-09-11T03:18:35.941Z" SessionID="14"><From><User FriendlyName="- James O'"/></From><To><User FriendlyName="jonathan-"/></To><Text Style="font-family:MS Shell Dlg; color:#000000; ">alright</Text></Message><Message Date="9/11/2008" Time="1:18:40 PM" DateTime="2008-09-11T03:18:40.435Z" SessionID="14"><From><User FriendlyName="- James O'"/></From><To><User FriendlyName="jonathan-"/></To><Text Style="font-family:MS Shell Dlg; color:#000000; ">I just have to copy it out basically</Text></Message><Message Date="9/11/2008" Time="1:18:42 PM" DateTime="2008-09-11T03:18:42.324Z" SessionID="14"><From><User FriendlyName="- James O'"/></From><To><User FriendlyName="jonathan-"/></To><Text Style="font-family:MS Shell Dlg; color:#000000; ">oi</Text></Message><Message Date="9/11/2008" Time="1:18:47 PM" DateTime="2008-09-11T03:18:47.834Z" SessionID="14"><From><User FriendlyName="- James O'"/></From><To><User FriendlyName="jonathan-"/></To><Text Style="font-family:MS Shell Dlg; color:#000000; ">u no programmings due tuesday now?</Text></Message><Message Date="9/11/2008" Time="1:18:51 PM" DateTime="2008-09-11T03:18:51.426Z" SessionID="14"><From><User FriendlyName="- James O'"/></From><To><User FriendlyName="jonathan-"/></To><Text Style="font-family:MS Shell Dlg; color:#000000; ">thats alright ay</Text></Message><Message Date="9/11/2008" Time="1:19:04 PM" DateTime="2008-09-11T03:19:04.493Z" SessionID="14"><From><User FriendlyName="jonathan-"/></From><To><User FriendlyName="- James O'"/></To><Text Style="font-family:Comic Sans MS; color:#000000; ">yer i saw</Text></Message><Message Date="9/11/2008" Time="1:19:26 PM" DateTime="2008-09-11T03:19:26.176Z" SessionID="14"><From><User FriendlyName="- James O'"/></From><To><User FriendlyName="jonathan-"/></To><Text Style="font-family:MS Shell Dlg; color:#000000; ">I'm thinking of going home like 1230 on monday so i can go work on it</Text></Message><Message Date="9/11/2008" Time="1:19:42 PM" DateTime="2008-09-11T03:19:42.349Z" SessionID="14"><From><User FriendlyName="jonathan-"/></From><To><User FriendlyName="- James O'"/></To><Text Style="font-family:Comic Sans MS; color:#000000; ">yer</Text></Message><Message Date="9/11/2008" Time="1:19:59 PM" DateTime="2008-09-11T03:19:59.099Z" SessionID="14"><From><User FriendlyName="- James O'"/></From><To><User FriendlyName="jonathan-"/></To><Text Style="font-family:MS Shell Dlg; color:#000000; ">I gotta bullshit my lab work for week 6 and 7 still</Text></Message><Message Date="9/11/2008" Time="1:20:07 PM" DateTime="2008-09-11T03:20:07.462Z" SessionID="14"><From><User FriendlyName="jonathan-"/></From><To><User FriendlyName="- James O'"/></To><Text Style="font-family:Comic Sans MS; color:#000000; ">yer thats pretty gay</Text></Message><Message Date="9/11/2008" Time="1:20:19 PM" DateTime="2008-09-11T03:20:19.801Z" SessionID="14"><From><User FriendlyName="- James O'"/></From><To><User FriendlyName="jonathan-"/></To><Text Style="font-family:MS Shell Dlg; color:#000000; ">Might go try and do the assignment</Text></Message><Message Date="9/11/2008" Time="1:20:22 PM" DateTime="2008-09-11T03:20:22.039Z" SessionID="14"><From><User FriendlyName="- James O'"/></From><To><User FriendlyName="jonathan-"/></To><Text Style="font-family:MS Shell Dlg; color:#000000; ">just finish it</Text></Message><Message Date="9/11/2008" Time="1:20:29 PM" DateTime="2008-09-11T03:20:29.279Z" SessionID="14"><From><User FriendlyName="- James O'"/></From><To><User FriendlyName="jonathan-"/></To><Text Style="font-family:MS Shell Dlg; color:#000000; ">then fuck around and play some tf2 for a bit</Text></Message><Message Date="9/11/2008" Time="1:20:37 PM" DateTime="2008-09-11T03:20:37.418Z" SessionID="14"><From><User FriendlyName="jonathan-"/></From><To><User FriendlyName="- James O'"/></To><Text Style="font-family:Comic Sans MS; color:#000000; ">haha yer f/e</Text></Message><Message Date="9/11/2008" Time="1:20:40 PM" DateTime="2008-09-11T03:20:40.504Z" SessionID="14"><From><User FriendlyName="- James O'"/></From><To><User FriendlyName="jonathan-"/></To><Text Style="font-family:MS Shell Dlg; color:#000000; ">oh man, i was playing scout like a fucking mad man yesterday!</Text></Message><Message Date="9/11/2008" Time="1:20:45 PM" DateTime="2008-09-11T03:20:45.525Z" SessionID="14"><From><User FriendlyName="- James O'"/></From><To><User FriendlyName="jonathan-"/></To><Text Style="font-family:MS Shell Dlg; color:#000000; ">2 deaths!</Text></Message><Message Date="9/11/2008" Time="1:20:49 PM" DateTime="2008-09-11T03:20:49.358Z" SessionID="14"><From><User FriendlyName="jonathan-"/></From><To><User FriendlyName="- James O'"/></To><Text Style="font-family:Comic Sans MS; color:#000000; ">oh wow</Text></Message><Message Date="9/11/2008" Time="1:20:51 PM" DateTime="2008-09-11T03:20:51.614Z" SessionID="14"><From><User FriendlyName="- James O'"/></From><To><User FriendlyName="jonathan-"/></To><Text Style="font-family:MS Shell Dlg; color:#000000; ">No on could hit me</Text></Message><Message Date="9/11/2008" Time="1:20:57 PM" DateTime="2008-09-11T03:20:57.435Z" SessionID="14"><From><User FriendlyName="jonathan-"/></From><To><User FriendlyName="- James O'"/></To><Text Style="font-family:Comic Sans MS; color:#000000; ">hahaha pro</Text></Message><Message Date="9/11/2008" Time="1:20:59 PM" DateTime="2008-09-11T03:20:59.829Z" SessionID="14"><From><User FriendlyName="- James O'"/></From><To><User FriendlyName="jonathan-"/></To><Text Style="font-family:MS Shell Dlg; color:#000000; ">So many times I ran away on 1 hp</Text></Message><Message Date="9/11/2008" Time="1:21:09 PM" DateTime="2008-09-11T03:21:09.682Z" SessionID="14"><From><User FriendlyName="- James O'"/></From><To><User FriendlyName="jonathan-"/></To><Text Style="font-family:MS Shell Dlg; color:#000000; ">and I batted in a sniper and 2 demo man</Text></Message><Message Date="9/11/2008" Time="1:21:16 PM" DateTime="2008-09-11T03:21:16.481Z" SessionID="14"><From><User FriendlyName="- James O'"/></From><To><User FriendlyName="jonathan-"/></To><Text Style="font-family:MS Shell Dlg; color:#000000; ">Best fucking feeling ever</Text></Message><Message Date="9/11/2008" Time="1:21:21 PM" DateTime="2008-09-11T03:21:21.769Z" SessionID="14"><From><User FriendlyName="- James O'"/></From><To><User FriendlyName="jonathan-"/></To><Text Style="font-family:MS Shell Dlg; color:#000000; ">I just wanna get insanely pro as a scout</Text></Message><Message Date="9/11/2008" Time="1:21:24 PM" DateTime="2008-09-11T03:21:24.455Z" SessionID="14"><From><User FriendlyName="jonathan-"/></From><To><User FriendlyName="- James O'"/></To><Text Style="font-family:Comic Sans MS; color:#000000; ">haha</Text></Message><Message Date="9/11/2008" Time="1:21:24 PM" DateTime="2008-09-11T03:21:24.873Z" SessionID="14"><From><User FriendlyName="- James O'"/></From><To><User FriendlyName="jonathan-"/></To><Text Style="font-family:MS Shell Dlg; color:#000000; ">cuz hes so fast and annoying</Text></Message><Message Date="9/11/2008" Time="1:21:35 PM" DateTime="2008-09-11T03:21:35.095Z" SessionID="14"><From><User FriendlyName="- James O'"/></From><To><User FriendlyName="jonathan-"/></To><Text Style="font-family:MS Shell Dlg; color:#000000; ">he runs like 1.5x speed on most classes</Text></Message><Message Date="9/11/2008" Time="1:21:45 PM" DateTime="2008-09-11T03:21:45.645Z" SessionID="14"><From><User FriendlyName="- James O'"/></From><To><User FriendlyName="jonathan-"/></To><Text Style="font-family:MS Shell Dlg; color:#000000; ">low hp but u can run circles around people its awesome</Text></Message><Message Date="9/11/2008" Time="1:22:01 PM" DateTime="2008-09-11T03:22:01.083Z" SessionID="14"><From><User FriendlyName="jonathan-"/></From><To><User FriendlyName="- James O'"/></To><Text Style="font-family:Comic Sans MS; color:#000000; ">haha niice</Text></Message><Message Date="9/11/2008" Time="1:23:19 PM" DateTime="2008-09-11T03:23:19.300Z" SessionID="14"><From><User FriendlyName="- James O'"/></From><To><User FriendlyName="jonathan-"/></To><Text Style="font-family:MS Shell Dlg; color:#000000; ">I'll try make a video 2nite</Text></Message><Message Date="9/11/2008" Time="1:23:29 PM" DateTime="2008-09-11T03:23:29.840Z" SessionID="14"><From><User FriendlyName="jonathan-"/></From><To><User FriendlyName="- James O'"/></To><Text Style="font-family:Comic Sans MS; color:#000000; ">of tf2?</Text></Message><Message Date="9/11/2008" Time="1:23:30 PM" DateTime="2008-09-11T03:23:30.667Z" SessionID="14"><From><User FriendlyName="- James O'"/></From><To><User FriendlyName="jonathan-"/></To><Text Style="font-family:MS Shell Dlg; color:#000000; ">throw it on utube</Text></Message><Message Date="9/11/2008" Time="1:23:31 PM" DateTime="2008-09-11T03:23:31.808Z" SessionID="14"><From><User FriendlyName="- James O'"/></From><To><User FriendlyName="jonathan-"/></To><Text Style="font-family:MS Shell Dlg; color:#000000; ">yeh</Text></Message><Message Date="9/11/2008" Time="1:23:34 PM" DateTime="2008-09-11T03:23:34.403Z" SessionID="14"><From><User FriendlyName="jonathan-"/></From><To><User FriendlyName="- James O'"/></To><Text Style="font-family:Comic Sans MS; color:#000000; ">niice</Text></Message><Message Date="9/11/2008" Time="1:23:35 PM" DateTime="2008-09-11T03:23:35.514Z" SessionID="14"><From><User FriendlyName="- James O'"/></From><To><User FriendlyName="jonathan-"/></To><Text Style="font-family:MS Shell Dlg; color:#000000; ">I got a bit of a demo</Text></Message><Message Date="9/11/2008" Time="1:23:37 PM" DateTime="2008-09-11T03:23:37.227Z" SessionID="14"><From><User FriendlyName="jonathan-"/></From><To><User FriendlyName="- James O'"/></To><Text Style="font-family:Comic Sans MS; color:#000000; ">show us wen ur done</Text></Message><Message Date="9/11/2008" Time="1:23:41 PM" DateTime="2008-09-11T03:23:41.753Z" SessionID="14"><From><User FriendlyName="- James O'"/></From><To><User FriendlyName="jonathan-"/></To><Text Style="font-family:MS Shell Dlg; color:#000000; ">I which I hada started from the beginning</Text></Message><Message Date="9/11/2008" Time="1:24:49 PM" DateTime="2008-09-11T03:24:49.952Z" SessionID="14"><From><User FriendlyName="- James O'"/></From><To><User FriendlyName="jonathan-"/></To><Text Style="font-family:MS Shell Dlg; color:#000000; ">gonner play with blake now, will record some more</Text></Message><Message Date="9/11/2008" Time="1:24:56 PM" DateTime="2008-09-11T03:24:56.176Z" SessionID="15"><From><User FriendlyName="jonathan-"/></From><To><User FriendlyName="- James O'"/></To><Text Style="font-family:Comic Sans MS; color:#000000; ">kk</Text></Message><Message Date="9/14/2008" Time="6:18:56 PM" DateTime="2008-09-14T08:18:56.582Z" SessionID="16"><From><User FriendlyName="- James O'"/></From><To><User FriendlyName="jonathan-"/></To><Text Style="font-family:MS Shell Dlg; color:#000000; ">ay</Text></Message><Message Date="9/14/2008" Time="6:19:07 PM" DateTime="2008-09-14T08:19:07.516Z" SessionID="16"><From><User FriendlyName="- James O'"/></From><To><User FriendlyName="jonathan-"/></To><Text Style="font-family:MS Shell Dlg; color:#000000; ">You do much work on programming?</Text></Message><Message Date="9/14/2008" Time="6:19:20 PM" DateTime="2008-09-14T08:19:20.911Z" SessionID="16"><From><User FriendlyName="jonathan-"/></From><To><User FriendlyName="- James O'"/></To><Text Style="font-family:Comic Sans MS; color:#000000; ">none</Text></Message><Message Date="9/14/2008" Time="6:19:22 PM" DateTime="2008-09-14T08:19:22.762Z" SessionID="16"><From><User FriendlyName="jonathan-"/></From><To><User FriendlyName="- James O'"/></To><Text Style="font-family:Comic Sans MS; color:#000000; ">wbu?</Text></Message><Message Date="9/14/2008" Time="6:19:25 PM" DateTime="2008-09-14T08:19:25.364Z" SessionID="16"><From><User FriendlyName="- James O'"/></From><To><User FriendlyName="jonathan-"/></To><Text Style="font-family:MS Shell Dlg; color:#000000; ">sameo</Text></Message><Message Date="9/14/2008" Time="6:19:29 PM" DateTime="2008-09-14T08:19:29.880Z" SessionID="16"><From><User FriendlyName="jonathan-"/></From><To><User FriendlyName="- James O'"/></To><Text Style="font-family:Comic Sans MS; color:#000000; ">hmm</Text></Message><Message Date="9/14/2008" Time="6:19:45 PM" DateTime="2008-09-14T08:19:45.137Z" SessionID="16"><From><User FriendlyName="- James O'"/></From><To><User FriendlyName="jonathan-"/></To><Text Style="font-family:MS Shell Dlg; color:#000000; ">Was thinking about trying some now</Text></Message><Message Date="9/14/2008" Time="6:19:57 PM" DateTime="2008-09-14T08:19:57.910Z" SessionID="16"><From><User FriendlyName="jonathan-"/></From><To><User FriendlyName="- James O'"/></To><Text Style="font-family:Comic Sans MS; color:#000000; ">yer</Text></Message><Message Date="9/14/2008" Time="6:20:07 PM" DateTime="2008-09-14T08:20:07.699Z" SessionID="16"><From><User FriendlyName="jonathan-"/></From><To><User FriendlyName="- James O'"/></To><Text Style="font-family:Comic Sans MS; color:#000000; ">i am gonna do some a bit later</Text></Message><Message Date="9/14/2008" Time="6:23:03 PM" DateTime="2008-09-14T08:23:03.304Z" SessionID="16"><From><User FriendlyName="- James O'"/></From><To><User FriendlyName="jonathan-"/></To><Text Style="font-family:MS Shell Dlg; color:#000000; ">u done part 2?</Text></Message><Message Date="9/14/2008" Time="6:23:13 PM" DateTime="2008-09-14T08:23:13.463Z" SessionID="16"><From><User FriendlyName="jonathan-"/></From><To><User FriendlyName="- James O'"/></To><Text Style="font-family:Comic Sans MS; color:#000000; ">umm na</Text></Message><Message Date="9/14/2008" Time="6:23:14 PM" DateTime="2008-09-14T08:23:14.853Z" SessionID="16"><From><User FriendlyName="jonathan-"/></From><To><User FriendlyName="- James O'"/></To><Text Style="font-family:Comic Sans MS; color:#000000; ">u?</Text></Message><Message Date="9/14/2008" Time="6:23:16 PM" DateTime="2008-09-14T08:23:16.952Z" SessionID="16"><From><User FriendlyName="- James O'"/></From><To><User FriendlyName="jonathan-"/></To><Text Style="font-family:MS Shell Dlg; color:#000000; ">nah</Text></Message><Message Date="9/14/2008" Time="6:23:24 PM" DateTime="2008-09-14T08:23:24.230Z" SessionID="16"><From><User FriendlyName="- James O'"/></From><To><User FriendlyName="jonathan-"/></To><Text Style="font-family:MS Shell Dlg; color:#000000; ">Part 1 took like 20 mins of friday</Text></Message><Message Date="9/14/2008" Time="6:23:28 PM" DateTime="2008-09-14T08:23:28.254Z" SessionID="16"><From><User FriendlyName="- James O'"/></From><To><User FriendlyName="jonathan-"/></To><Text Style="font-family:MS Shell Dlg; color:#000000; ">then I played starcraft</Text></Message><Message Date="9/14/2008" Time="6:23:32 PM" DateTime="2008-09-14T08:23:32.645Z" SessionID="16"><From><User FriendlyName="- James O'"/></From><To><User FriendlyName="jonathan-"/></To><Text Style="font-family:MS Shell Dlg; color:#000000; ">I regret nothing</Text></Message><Message Date="9/14/2008" Time="6:24:07 PM" DateTime="2008-09-14T08:24:07.963Z" SessionID="16"><From><User FriendlyName="jonathan-"/></From><To><User FriendlyName="- James O'"/></To><Text Style="font-family:Comic Sans MS; color:#000000; ">haha niice</Text></Message><Message Date="9/17/2008" Time="3:04:42 PM" DateTime="2008-09-17T05:04:42.917Z" SessionID="17"><From><User FriendlyName="- James O'"/></From><To><User FriendlyName="jonathan-"/></To><Text Style="font-family:MS Shell Dlg; color:#000000; ">ay</Text></Message><Message Date="9/17/2008" Time="3:04:48 PM" DateTime="2008-09-17T05:04:48.263Z" SessionID="17"><From><User FriendlyName="jonathan-"/></From><To><User FriendlyName="- James O'"/></To><Text Style="font-family:Comic Sans MS; color:#000000; ">hey</Text></Message><Message Date="9/17/2008" Time="3:06:48 PM" DateTime="2008-09-17T05:06:48.743Z" SessionID="17"><From><User FriendlyName="- James O'"/></From><To><User FriendlyName="jonathan-"/></To><Text Style="font-family:MS Shell Dlg; color:#000000; ">I got star wars, force unleashed</Text></Message><Message Date="9/17/2008" Time="3:06:58 PM" DateTime="2008-09-17T05:06:58.032Z" SessionID="17"><From><User FriendlyName="jonathan-"/></From><To><User FriendlyName="- James O'"/></To><Text Style="font-family:Comic Sans MS; color:#000000; ">on?</Text></Message><Message Date="9/17/2008" Time="3:07:27 PM" DateTime="2008-09-17T05:07:27.954Z" SessionID="17"><From><User FriendlyName="- James O'"/></From><To><User FriendlyName="jonathan-"/></To><Text Style="font-family:MS Shell Dlg; color:#000000; ">360</Text></Message><Message Date="9/17/2008" Time="3:07:31 PM" DateTime="2008-09-17T05:07:31.353Z" SessionID="17"><From><User FriendlyName="- James O'"/></From><To><User FriendlyName="jonathan-"/></To><Text Style="font-family:MS Shell Dlg; color:#000000; ">its awesome</Text></Message><Message Date="9/17/2008" Time="3:07:36 PM" DateTime="2008-09-17T05:07:36.264Z" SessionID="17"><From><User FriendlyName="- James O'"/></From><To><User FriendlyName="jonathan-"/></To><Text Style="font-family:MS Shell Dlg; color:#000000; ">pete and jared just left</Text></Message><Message Date="9/17/2008" Time="3:07:39 PM" DateTime="2008-09-17T05:07:39.775Z" SessionID="17"><From><User FriendlyName="- James O'"/></From><To><User FriendlyName="jonathan-"/></To><Text Style="font-family:MS Shell Dlg; color:#000000; ">should be starting speech now</Text></Message><Message Date="9/17/2008" Time="3:07:56 PM" DateTime="2008-09-17T05:07:56.103Z" SessionID="17"><From><User FriendlyName="jonathan-"/></From><To><User FriendlyName="- James O'"/></To><Text Style="font-family:Comic Sans MS; color:#000000; ">haha niice</Text></Message><Message Date="9/17/2008" Time="3:08:24 PM" DateTime="2008-09-17T05:08:24.645Z" SessionID="17"><From><User FriendlyName="jonathan-"/></From><To><User FriendlyName="- James O'"/></To><Text Style="font-family:Comic Sans MS; color:#000000; ">i just lost all the work i did the other week for meda which waslike 4hours worth or sumthin, poof it just vanished like OMFG!</Text></Message><Message Date="9/17/2008" Time="3:09:22 PM" DateTime="2008-09-17T05:09:22.309Z" SessionID="17"><From><User FriendlyName="- James O'"/></From><To><User FriendlyName="jonathan-"/></To><Text Style="font-family:MS Shell Dlg; color:#000000; ">wat were u doing?</Text></Message><Message Date="9/17/2008" Time="3:10:08 PM" DateTime="2008-09-17T05:10:08.444Z" SessionID="17"><From><User FriendlyName="jonathan-"/></From><To><User FriendlyName="- James O'"/></To><Text Style="font-family:Comic Sans MS; color:#000000; ">drawning a line</Text></Message><Message Date="9/17/2008" Time="3:10:17 PM" DateTime="2008-09-17T05:10:17.350Z" SessionID="17"><From><User FriendlyName="- James O'"/></From><To><User FriendlyName="jonathan-"/></To><Text Style="font-family:MS Shell Dlg; color:#000000; ">...</Text></Message><Message Date="9/17/2008" Time="3:10:19 PM" DateTime="2008-09-17T05:10:19.112Z" SessionID="17"><From><User FriendlyName="- James O'"/></From><To><User FriendlyName="jonathan-"/></To><Text Style="font-family:MS Shell Dlg; color:#000000; ">4 hours work?</Text></Message><Message Date="9/17/2008" Time="3:10:26 PM" DateTime="2008-09-17T05:10:26.007Z" SessionID="17"><From><User FriendlyName="jonathan-"/></From><To><User FriendlyName="- James O'"/></To><Text Style="font-family:Comic Sans MS; color:#000000; ">wait till u see the linme</Text></Message><Message Date="9/17/2008" Time="3:10:30 PM" DateTime="2008-09-17T05:10:30.913Z" SessionID="17"><From><User FriendlyName="jonathan-"/></From><To><User FriendlyName="- James O'"/></To><Text Style="font-family:Comic Sans MS; color:#000000; ">and i was watchin stargate</Text></Message><Message Date="9/17/2008" Time="3:10:51 PM" DateTime="2008-09-17T05:10:51.370Z" SessionID="17"><From><User FriendlyName="- James O'"/></From><To><User FriendlyName="jonathan-"/></To><Text Style="font-family:MS Shell Dlg; color:#000000; ">haha ok</Text></Message><Message Date="9/17/2008" Time="3:19:25 PM" DateTime="2008-09-17T05:19:25.898Z" SessionID="17"><From><User FriendlyName="- James O'"/></From><To><User FriendlyName="jonathan-"/></To><Text Style="font-family:MS Shell Dlg; color:#000000; ">i wanna work on tetris much</Text></Message><Message Date="9/17/2008" Time="3:19:38 PM" DateTime="2008-09-17T05:19:38.636Z" SessionID="17"><From><User FriendlyName="jonathan-"/></From><To><User FriendlyName="- James O'"/></To><Text Style="font-family:Comic Sans MS; color:#000000; ">haha so do it?</Text></Message><Message Date="9/17/2008" Time="3:22:23 PM" DateTime="2008-09-17T05:22:23.738Z" SessionID="17"><From><User FriendlyName="- James O'"/></From><To><User FriendlyName="jonathan-"/></To><Text Style="font-family:MS Shell Dlg; color:#000000; ">:-O</Text></Message><Message Date="9/17/2008" Time="3:22:25 PM" DateTime="2008-09-17T05:22:25.950Z" SessionID="17"><From><User FriendlyName="- James O'"/></From><To><User FriendlyName="jonathan-"/></To><Text Style="font-family:MS Shell Dlg; color:#000000; ">are you mad</Text></Message><Message Date="9/17/2008" Time="3:22:35 PM" DateTime="2008-09-17T05:22:35.017Z" SessionID="17"><From><User FriendlyName="jonathan-"/></From><To><User FriendlyName="- James O'"/></To><Text Style="font-family:Comic Sans MS; color:#000000; ">fk processing is so gay wen it gets in an infinite loop</Text></Message><Message Date="9/17/2008" Time="3:22:53 PM" DateTime="2008-09-17T05:22:53.979Z" SessionID="17"><From><User FriendlyName="- James O'"/></From><To><User FriendlyName="jonathan-"/></To><Text Style="font-family:MS Shell Dlg; color:#000000; ">haha, I know</Text></Message><Message Date="9/17/2008" Time="3:23:02 PM" DateTime="2008-09-17T05:23:02.969Z" SessionID="17"><From><User FriendlyName="- James O'"/></From><To><User FriendlyName="jonathan-"/></To><Text Style="font-family:MS Shell Dlg; color:#000000; ">task manager+close is the only way</Text></Message><Message Date="9/17/2008" Time="3:23:14 PM" DateTime="2008-09-17T05:23:14.817Z" SessionID="17"><From><User FriendlyName="jonathan-"/></From><To><User FriendlyName="- James O'"/></To><Text Style="font-family:Comic Sans MS; color:#000000; ">yer i kno</Text></Message><Message Date="9/17/2008" Time="3:23:19 PM" DateTime="2008-09-17T05:23:19.693Z" SessionID="17"><From><User FriendlyName="jonathan-"/></From><To><User FriendlyName="- James O'"/></To><Text Style="font-family:Comic Sans MS; color:#000000; ">soo gay</Text></Message><Message Date="9/17/2008" Time="3:25:41 PM" DateTime="2008-09-17T05:25:41.949Z" SessionID="17"><From><User FriendlyName="- James O'"/></From><To><User FriendlyName="jonathan-"/></To><Text Style="font-family:MS Shell Dlg; color:#000000; ">Im gonner do my blog now</Text></Message><Message Date="9/17/2008" Time="3:26:07 PM" DateTime="2008-09-17T05:26:07.026Z" SessionID="17"><From><User FriendlyName="jonathan-"/></From><To><User FriendlyName="- James O'"/></To><Text Style="font-family:Comic Sans MS; color:#000000; ">hmm nice idea</Text></Message><Message Date="9/17/2008" Time="3:26:18 PM" DateTime="2008-09-17T05:26:18.403Z" SessionID="17"><From><User FriendlyName="- James O'"/></From><To><User FriendlyName="jonathan-"/></To><Text Style="font-family:MS Shell Dlg; color:#000000; ">indeed</Text></Message><Message Date="9/17/2008" Time="10:50:54 PM" DateTime="2008-09-17T12:50:54.681Z" SessionID="18"><From><User FriendlyName="jonathan-"/></From><To><User FriendlyName="- James O'"/></To><Text Style="font-family:Comic Sans MS; color:#000000; ">hey wat did u get for stat?</Text></Message><Message Date="9/24/2008" Time="5:24:35 PM" DateTime="2008-09-24T07:24:35.234Z" SessionID="19"><From><User FriendlyName="jonathan-"/></From><To><User FriendlyName="- James O'"/></To><Text Style="font-family:Comic Sans MS; color:#000000; ">hey man hav u looked for jmp yet?</Text></Message><Message Date="10/5/2008" Time="3:19:36 PM" DateTime="2008-10-05T04:19:36.200Z" SessionID="20"><From><User FriendlyName="- James O'"/></From><To><User FriendlyName="jonathan-"/></To><Text Style="font-family:MS Shell Dlg; color:#000000; ">ay</Text></Message><Message Date="10/5/2008" Time="3:20:18 PM" DateTime="2008-10-05T04:20:18.351Z" SessionID="20"><From><User FriendlyName="- James O'"/></From><To><User FriendlyName="jonathan-"/></To><Text Style="font-family:MS Shell Dlg; color:#000000; ">programming is fare hard :(</Text></Message><Message Date="10/5/2008" Time="3:20:25 PM" DateTime="2008-10-05T04:20:25.847Z" SessionID="20"><From><User FriendlyName="jonathan-"/></From><To><User FriendlyName="- James O'"/></To><Text Style="font-family:Comic Sans MS; color:#000000; ">lame</Text></Message><Message Date="10/5/2008" Time="3:20:29 PM" DateTime="2008-10-05T04:20:29.068Z" SessionID="20"><From><User FriendlyName="jonathan-"/></From><To><User FriendlyName="- James O'"/></To><Text Style="font-family:Comic Sans MS; color:#000000; ">i havebnt even started</Text></Message><Message Date="10/5/2008" Time="3:20:31 PM" DateTime="2008-10-05T04:20:31.949Z" SessionID="20"><From><User FriendlyName="jonathan-"/></From><To><User FriendlyName="- James O'"/></To><Text Style="font-family:Comic Sans MS; color:#000000; ">u done bio?</Text></Message><Message Date="10/5/2008" Time="3:21:33 PM" DateTime="2008-10-05T04:21:33.197Z" SessionID="20"><From><User FriendlyName="- James O'"/></From><To><User FriendlyName="jonathan-"/></To><Text Style="font-family:MS Shell Dlg; color:#000000; ">no</Text></Message><Message Date="10/5/2008" Time="3:21:33 PM" DateTime="2008-10-05T04:21:33.901Z" SessionID="20"><From><User FriendlyName="- James O'"/></From><To><User FriendlyName="jonathan-"/></To><Text Style="font-family:MS Shell Dlg; color:#000000; ">you?</Text></Message><Message Date="10/5/2008" Time="3:21:41 PM" DateTime="2008-10-05T04:21:41.862Z" SessionID="20"><From><User FriendlyName="- James O'"/></From><To><User FriendlyName="jonathan-"/></To><Text Style="font-family:MS Shell Dlg; color:#000000; ">I dont think Im going next week</Text></Message><Message Date="10/5/2008" Time="3:21:43 PM" DateTime="2008-10-05T04:21:43.887Z" SessionID="20"><From><User FriendlyName="- James O'"/></From><To><User FriendlyName="jonathan-"/></To><Text Style="font-family:MS Shell Dlg; color:#000000; ">till friday...</Text></Message><Message Date="10/5/2008" Time="3:21:47 PM" DateTime="2008-10-05T04:21:47.514Z" SessionID="20"><From><User FriendlyName="jonathan-"/></From><To><User FriendlyName="- James O'"/></To><Text Style="font-family:Comic Sans MS; color:#000000; ">yer neither</Text></Message><Message Date="10/5/2008" Time="3:22:07 PM" DateTime="2008-10-05T04:22:07.731Z" SessionID="20"><From><User FriendlyName="- James O'"/></From><To><User FriendlyName="jonathan-"/></To><Text Style="font-family:MS Shell Dlg; color:#000000; ">so... lets hope we can mad copy our assignment and turn up late to stat and everything will be happy</Text></Message><Message Date="10/5/2008" Time="3:22:20 PM" DateTime="2008-10-05T04:22:20.332Z" SessionID="20"><From><User FriendlyName="jonathan-"/></From><To><User FriendlyName="- James O'"/></To><Text Style="font-family:Comic Sans MS; color:#000000; ">ive been on a camp since last sunday just got back so i havent done anythin</Text></Message><Message Date="10/5/2008" Time="3:22:27 PM" DateTime="2008-10-05T04:22:27.927Z" SessionID="20"><From><User FriendlyName="- James O'"/></From><To><User FriendlyName="jonathan-"/></To><Text Style="font-family:MS Shell Dlg; color:#000000; ">dw, no one has</Text></Message><Message Date="10/5/2008" Time="3:22:33 PM" DateTime="2008-10-05T04:22:33.272Z" SessionID="20"><From><User FriendlyName="- James O'"/></From><To><User FriendlyName="jonathan-"/></To><Text Style="font-family:MS Shell Dlg; color:#000000; ">just been relaxing</Text></Message><Message Date="10/5/2008" Time="3:22:40 PM" DateTime="2008-10-05T04:22:40.825Z" SessionID="20"><From><User FriendlyName="- James O'"/></From><To><User FriendlyName="jonathan-"/></To><Text Style="font-family:MS Shell Dlg; color:#000000; ">I started programming but im fare stumped</Text></Message><Message Date="10/5/2008" Time="3:22:47 PM" DateTime="2008-10-05T04:22:47.940Z" SessionID="20"><From><User FriendlyName="jonathan-"/></From><To><User FriendlyName="- James O'"/></To><Text Style="font-family:Comic Sans MS; color:#000000; ">hmm lame</Text></Message><Message Date="10/6/2008" Time="2:58:21 PM" DateTime="2008-10-06T03:58:21.725Z" SessionID="21"><From><User FriendlyName="- James O'"/></From><To><User FriendlyName="jonathan-"/></To><Text Style="font-family:MS Shell Dlg; color:#000000; ">hows programming?</Text></Message><Message Date="10/6/2008" Time="2:58:28 PM" DateTime="2008-10-06T03:58:28.555Z" SessionID="21"><From><User FriendlyName="jonathan-"/></From><To><User FriendlyName="- James O'"/></To><Text Style="font-family:Comic Sans MS; color:#000000; ">gay</Text></Message><Message Date="10/6/2008" Time="2:58:34 PM" DateTime="2008-10-06T03:58:34.162Z" SessionID="21"><From><User FriendlyName="- James O'"/></From><To><User FriendlyName="jonathan-"/></To><Text Style="font-family:MS Shell Dlg; color:#000000; ">indeed!</Text></Message><Message Date="10/6/2008" Time="2:58:39 PM" DateTime="2008-10-06T03:58:39.951Z" SessionID="21"><From><User FriendlyName="jonathan-"/></From><To><User FriendlyName="- James O'"/></To><Text Style="font-family:Comic Sans MS; color:#000000; ">just started, so tryin to do linked list</Text></Message><Message Date="10/6/2008" Time="2:58:42 PM" DateTime="2008-10-06T03:58:42.105Z" SessionID="21"><From><User FriendlyName="- James O'"/></From><To><User FriendlyName="jonathan-"/></To><Text Style="font-family:MS Shell Dlg; color:#000000; ">Im thinking of just ignoring</Text></Message><Message Date="10/6/2008" Time="2:59:08 PM" DateTime="2008-10-06T03:59:08.101Z" SessionID="21"><From><User FriendlyName="jonathan-"/></From><To><User FriendlyName="- James O'"/></To><Text Style="font-family:Comic Sans MS; color:#000000; ">ignoring wat?</Text></Message><Message Date="10/6/2008" Time="2:59:35 PM" DateTime="2008-10-06T03:59:35.272Z" SessionID="21"><From><User FriendlyName="- James O'"/></From><To><User FriendlyName="jonathan-"/></To><Text Style="font-family:MS Shell Dlg; color:#000000; ">the ass</Text></Message><Message Date="10/6/2008" Time="2:59:46 PM" DateTime="2008-10-06T03:59:46.608Z" SessionID="21"><From><User FriendlyName="- James O'"/></From><To><User FriendlyName="jonathan-"/></To><Text Style="font-family:MS Shell Dlg; color:#000000; ">wats 6 marks</Text></Message><Message Date="10/6/2008" Time="2:59:52 PM" DateTime="2008-10-06T03:59:52.847Z" SessionID="21"><From><User FriendlyName="- James O'"/></From><To><User FriendlyName="jonathan-"/></To><Text Style="font-family:MS Shell Dlg; color:#000000; ">no way im gonner finish it</Text></Message><Message Date="10/6/2008" Time="2:59:56 PM" DateTime="2008-10-06T03:59:56.858Z" SessionID="21"><From><User FriendlyName="jonathan-"/></From><To><User FriendlyName="- James O'"/></To><Text Style="font-family:Comic Sans MS; color:#000000; ">yer tru</Text></Message><Message Date="10/6/2008" Time="2:59:59 PM" DateTime="2008-10-06T03:59:59.991Z" SessionID="21"><From><User FriendlyName="- James O'"/></From><To><User FriendlyName="jonathan-"/></To><Text Style="font-family:MS Shell Dlg; color:#000000; ">and I've got essays to do</Text></Message><Message Date="10/6/2008" Time="3:00:07 PM" DateTime="2008-10-06T04:00:07.038Z" SessionID="21"><From><User FriendlyName="- James O'"/></From><To><User FriendlyName="jonathan-"/></To><Text Style="font-family:MS Shell Dlg; color:#000000; ">oh and wat about biostat</Text></Message><Message Date="10/6/2008" Time="3:00:11 PM" DateTime="2008-10-06T04:00:11.741Z" SessionID="21"><From><User FriendlyName="- James O'"/></From><To><User FriendlyName="jonathan-"/></To><Text Style="font-family:MS Shell Dlg; color:#000000; ">did u wanna go in thursday to copy it?</Text></Message><Message Date="10/6/2008" Time="3:00:23 PM" DateTime="2008-10-06T04:00:23.457Z" SessionID="21"><From><User FriendlyName="jonathan-"/></From><To><User FriendlyName="- James O'"/></To><Text Style="font-family:Comic Sans MS; color:#000000; ">copy it from who?</Text></Message><Message Date="10/6/2008" Time="3:00:56 PM" DateTime="2008-10-06T04:00:56.783Z" SessionID="21"><From><User FriendlyName="- James O'"/></From><To><User FriendlyName="jonathan-"/></To><Text Style="font-family:MS Shell Dlg; color:#000000; ">who ever's done it?</Text></Message><Message Date="10/6/2008" Time="3:01:04 PM" DateTime="2008-10-06T04:01:04.836Z" SessionID="22"><From><User FriendlyName="jonathan-"/></From><To><User FriendlyName="- James O'"/></To><Text Style="font-family:Comic Sans MS; color:#000000; ">yer may aswell</Text></Message><Message Date="10/6/2008" Time="3:01:15 PM" DateTime="2008-10-06T04:01:15.361Z" SessionID="22"><From><User FriendlyName="jonathan-"/></From><To><User FriendlyName="- James O'"/></To><Text Style="font-family:Comic Sans MS; color:#000000; ">do u kno y we need the linkedlist in prog ass?</Text></Message><Message Date="10/6/2008" Time="3:02:16 PM" DateTime="2008-10-06T04:02:16.710Z" SessionID="22"><From><User FriendlyName="- James O'"/></From><To><User FriendlyName="jonathan-"/></To><Text Style="font-family:MS Shell Dlg; color:#000000; ">the array is an array of a linked list</Text></Message><Message Date="10/6/2008" Time="3:02:28 PM" DateTime="2008-10-06T04:02:28.189Z" SessionID="23"><From><User FriendlyName="jonathan-"/></From><To><User FriendlyName="- James O'"/></To><Text Style="font-family:Comic Sans MS; color:#000000; ">kk</Text></Message><Message Date="10/6/2008" Time="3:10:12 PM" DateTime="2008-10-06T04:10:12.396Z" SessionID="23"><From><User FriendlyName="- James O'"/></From><To><User FriendlyName="jonathan-"/></To><Text Style="font-family:MS Shell Dlg; color:#000000; ">So</Text></Message><Message Date="10/6/2008" Time="3:10:18 PM" DateTime="2008-10-06T04:10:18.809Z" SessionID="23"><From><User FriendlyName="- James O'"/></From><To><User FriendlyName="jonathan-"/></To><Text Style="font-family:MS Shell Dlg; color:#000000; ">you know trains aren't running this week?</Text></Message><Message Date="10/6/2008" Time="3:10:49 PM" DateTime="2008-10-06T04:10:49.046Z" SessionID="23"><From><User FriendlyName="jonathan-"/></From><To><User FriendlyName="- James O'"/></To><Text Style="font-family:Comic Sans MS; color:#000000; ">serious gay</Text></Message><Message Date="10/6/2008" Time="3:11:17 PM" DateTime="2008-10-06T04:11:17.057Z" SessionID="23"><From><User FriendlyName="- James O'"/></From><To><User FriendlyName="jonathan-"/></To><Text Style="font-family:MS Shell Dlg; color:#000000; ">so if we go thursday to copierzor we'd have to drive</Text></Message><Message Date="10/6/2008" Time="3:11:34 PM" DateTime="2008-10-06T04:11:34.512Z" SessionID="23"><From><User FriendlyName="- James O'"/></From><To><User FriendlyName="jonathan-"/></To><Text Style="font-family:MS Shell Dlg; color:#000000; ">and fridya we can go with jess</Text></Message><Message Date="10/6/2008" Time="3:12:06 PM" DateTime="2008-10-06T04:12:06.165Z" SessionID="24"><From><User FriendlyName="jonathan-"/></From><To><User FriendlyName="- James O'"/></To><Text Style="font-family:Comic Sans MS; color:#000000; ">i cant go thursday as i go back to court</Text></Message><Message Date="10/6/2008" Time="3:12:24 PM" DateTime="2008-10-06T04:12:24.315Z" SessionID="24"><From><User FriendlyName="jonathan-"/></From><To><User FriendlyName="- James O'"/></To><Text Style="font-family:Comic Sans MS; color:#000000; ">but me and nick goin in on wednesday</Text></Message><Message Date="10/6/2008" Time="3:12:37 PM" DateTime="2008-10-06T04:12:37.801Z" SessionID="24"><From><User FriendlyName="- James O'"/></From><To><User FriendlyName="jonathan-"/></To><Text Style="font-family:MS Shell Dlg; color:#000000; ">why?</Text></Message><Message Date="10/6/2008" Time="3:12:43 PM" DateTime="2008-10-06T04:12:43.869Z" SessionID="24"><From><User FriendlyName="jonathan-"/></From><To><User FriendlyName="- James O'"/></To><Text Style="font-family:Comic Sans MS; color:#000000; ">gotta hand in an assignment</Text></Message><Message Date="10/6/2008" Time="3:12:48 PM" DateTime="2008-10-06T04:12:48.904Z" SessionID="24"><From><User FriendlyName="- James O'"/></From><To><User FriendlyName="jonathan-"/></To><Text Style="font-family:MS Shell Dlg; color:#000000; ">ah k</Text></Message><Message Date="10/6/2008" Time="3:13:02 PM" DateTime="2008-10-06T04:13:02.091Z" SessionID="24"><From><User FriendlyName="jonathan-"/></From><To><User FriendlyName="- James O'"/></To><Text Style="font-family:Comic Sans MS; color:#000000; ">yer</Text></Message><Message Date="10/6/2008" Time="3:21:16 PM" DateTime="2008-10-06T04:21:16.108Z" SessionID="25"><From><User FriendlyName="- James O'"/></From><To><User FriendlyName="jonathan-"/></To><Text Style="font-family:MS Shell Dlg; color:#000000; ">goner give it another crack :(</Text></Message><Message Date="10/8/2008" Time="1:44:45 PM" DateTime="2008-10-08T02:44:45.760Z" SessionID="26"><From><User FriendlyName="jonathan-"/></From><To><User FriendlyName="- James O'"/></To><Text Style="font-family:Comic Sans MS; color:#000000; ">hows the prog assignment goin?</Text></Message><Message Date="10/8/2008" Time="1:53:32 PM" DateTime="2008-10-08T02:53:32.736Z" SessionID="26"><From><User FriendlyName="- James O'"/></From><To><User FriendlyName="jonathan-"/></To><Text Style="font-family:MS Shell Dlg; color:#000000; ">that site was a major help</Text></Message><Message Date="10/8/2008" Time="1:53:44 PM" DateTime="2008-10-08T02:53:44.773Z" SessionID="26"><From><User FriendlyName="- James O'"/></From><To><User FriendlyName="jonathan-"/></To><Text Style="font-family:MS Shell Dlg; color:#000000; ">largely, my assignment is that</Text></Message><Message Date="10/8/2008" Time="1:54:04 PM" DateTime="2008-10-08T02:54:04.121Z" SessionID="26"><From><User FriendlyName="- James O'"/></From><To><User FriendlyName="jonathan-"/></To><Text Style="font-family:MS Shell Dlg; color:#000000; ">I kept my origanal classes and all that bus</Text></Message><Message Date="10/8/2008" Time="1:54:31 PM" DateTime="2008-10-08T02:54:31.328Z" SessionID="26"><From><User FriendlyName="- James O'"/></From><To><User FriendlyName="jonathan-"/></To><Text Style="font-family:MS Shell Dlg; color:#000000; ">urs?</Text></Message><Message Date="10/8/2008" Time="1:55:14 PM" DateTime="2008-10-08T02:55:14.889Z" SessionID="26"><From><User FriendlyName="- James O'"/></From><To><User FriendlyName="jonathan-"/></To><Text Style="font-family:MS Shell Dlg; color:#000000; ">I got chitty's stat</Text></Message><Message Date="10/8/2008" Time="1:55:19 PM" DateTime="2008-10-08T02:55:19.112Z" SessionID="26"><From><User FriendlyName="- James O'"/></From><To><User FriendlyName="jonathan-"/></To><Text Style="font-family:MS Shell Dlg; color:#000000; ">question 1 and 3</Text></Message><Message Date="10/8/2008" Time="1:55:22 PM" DateTime="2008-10-08T02:55:22.249Z" SessionID="26"><From><User FriendlyName="- James O'"/></From><To><User FriendlyName="jonathan-"/></To><Text Style="font-family:MS Shell Dlg; color:#000000; ">good enuf for me :)</Text></Message><Message Date="10/8/2008" Time="2:18:19 PM" DateTime="2008-10-08T03:18:19.109Z" SessionID="27"><From><User FriendlyName="jonathan-"/></From><To><User FriendlyName="- James O'"/></To><Text Style="font-family:Comic Sans MS; color:#000000; ">yer i aint done much on programming</Text></Message><Message Date="10/8/2008" Time="2:20:15 PM" DateTime="2008-10-08T03:20:15.970Z" SessionID="27"><From><User FriendlyName="- James O'"/></From><To><User FriendlyName="jonathan-"/></To><Text Style="font-family:MS Shell Dlg; color:#000000; ">that link you gave me is basicaly our ass</Text></Message><Message Date="10/8/2008" Time="2:20:32 PM" DateTime="2008-10-08T03:20:32.215Z" SessionID="27"><From><User FriendlyName="- James O'"/></From><To><User FriendlyName="jonathan-"/></To><Text Style="font-family:MS Shell Dlg; color:#000000; ">you just have to bang it in different files, change variable names and load a file into it</Text></Message><Message Date="10/8/2008" Time="2:20:37 PM" DateTime="2008-10-08T03:20:37.942Z" SessionID="27"><From><User FriendlyName="- James O'"/></From><To><User FriendlyName="jonathan-"/></To><Text Style="font-family:MS Shell Dlg; color:#000000; ">and all that statistics tracking crap</Text></Message><Message Date="10/8/2008" Time="2:40:18 PM" DateTime="2008-10-08T03:40:18.402Z" SessionID="27"><From><User FriendlyName="jonathan-"/></From><To><User FriendlyName="- James O'"/></To><Text Style="font-family:Comic Sans MS; color:#000000; ">yer was a mad find aye</Text></Message><Message Date="10/9/2008" Time="4:29:14 PM" DateTime="2008-10-09T05:29:14.580Z" SessionID="28"><From><User FriendlyName="- James O'"/></From><To><User FriendlyName="jonathan-"/></To><Text Style="font-family:MS Shell Dlg; color:#000000; ">ay</Text></Message><Message Date="10/9/2008" Time="4:29:22 PM" DateTime="2008-10-09T05:29:22.953Z" SessionID="28"><From><User FriendlyName="- James O'"/></From><To><User FriendlyName="jonathan-"/></To><Text Style="font-family:MS Shell Dlg; color:#000000; ">did u get a file to read in</Text></Message><Message Date="10/9/2008" Time="4:29:26 PM" DateTime="2008-10-09T05:29:26.537Z" SessionID="28"><From><User FriendlyName="- James O'"/></From><To><User FriendlyName="jonathan-"/></To><Text Style="font-family:MS Shell Dlg; color:#000000; ">its fucking hard as shit</Text></Message><Message Date="10/9/2008" Time="4:29:39 PM" DateTime="2008-10-09T05:29:39.695Z" SessionID="28"><From><User FriendlyName="jonathan-"/></From><To><User FriendlyName="- James O'"/></To><Text Style="font-family:Comic Sans MS; color:#000000; ">yer i got it sorta</Text></Message><Message Date="10/9/2008" Time="4:29:44 PM" DateTime="2008-10-09T05:29:44.166Z" SessionID="28"><From><User FriendlyName="- James O'"/></From><To><User FriendlyName="jonathan-"/></To><Text Style="font-family:MS Shell Dlg; color:#000000; ">:-O</Text></Message><Message Date="10/9/2008" Time="4:29:58 PM" DateTime="2008-10-09T05:29:58.486Z" SessionID="28"><From><User FriendlyName="- James O'"/></From><To><User FriendlyName="jonathan-"/></To><Text Style="font-family:MS Shell Dlg; color:#000000; ">I can read it in, but I get a core dump when it does the add function</Text></Message><Message Date="10/9/2008" Time="4:30:40 PM" DateTime="2008-10-09T05:30:40.821Z" SessionID="28"><From><User FriendlyName="jonathan-"/></From><To><User FriendlyName="- James O'"/></To><Text Style="font-family:Comic Sans MS; color:#000000; ">well im still using that guys hash table</Text></Message><Message Date="10/9/2008" Time="4:30:47 PM" DateTime="2008-10-09T05:30:47.000Z" SessionID="28"><From><User FriendlyName="- James O'"/></From><To><User FriendlyName="jonathan-"/></To><Text Style="font-family:MS Shell Dlg; color:#000000; ">same</Text></Message><Message Date="10/9/2008" Time="4:31:08 PM" DateTime="2008-10-09T05:31:08.708Z" SessionID="28"><From><User FriendlyName="- James O'"/></From><To><User FriendlyName="jonathan-"/></To><Text Style="font-family:MS Shell Dlg; color:#000000; ">have u got the add function working?</Text></Message><Message Date="10/9/2008" Time="4:31:23 PM" DateTime="2008-10-09T05:31:23.594Z" SessionID="28"><From><User FriendlyName="- James O'"/></From><To><User FriendlyName="jonathan-"/></To><Text Style="font-family:MS Shell Dlg; color:#000000; ">it was in his code</Text></Message><Message Date="10/11/2008" Time="2:53:20 PM" DateTime="2008-10-11T03:53:20.314Z" SessionID="29"><From><User FriendlyName="- James O'"/></From><To><User FriendlyName="jonathan-"/></To><Text Style="font-family:MS Shell Dlg; color:#000000; ">ay</Text></Message><Message Date="10/11/2008" Time="2:53:35 PM" DateTime="2008-10-11T03:53:35.042Z" SessionID="29"><From><User FriendlyName="jonathan-"/></From><To><User FriendlyName="- James O'"/></To><Text Style="font-family:Comic Sans MS; color:#000000; ">ey</Text></Message><Message Date="10/11/2008" Time="2:53:37 PM" DateTime="2008-10-11T03:53:37.598Z" SessionID="29"><From><User FriendlyName="- James O'"/></From><To><User FriendlyName="jonathan-"/></To><Text Style="font-family:MS Shell Dlg; color:#000000; ">I got GTA San Andreas for PC, in 64kb</Text></Message><Message Date="10/11/2008" Time="2:53:41 PM" DateTime="2008-10-11T03:53:41.229Z" SessionID="29"><From><User FriendlyName="- James O'"/></From><To><User FriendlyName="jonathan-"/></To><Text Style="font-family:MS Shell Dlg; color:#000000; ">uncompresses to 670mb</Text></Message><Message Date="10/11/2008" Time="2:53:44 PM" DateTime="2008-10-11T03:53:44.749Z" SessionID="29"><From><User FriendlyName="- James O'"/></From><To><User FriendlyName="jonathan-"/></To><Text Style="font-family:MS Shell Dlg; color:#000000; ">how fucking INSANE is that</Text></Message><Message Date="10/11/2008" Time="2:53:49 PM" DateTime="2008-10-11T03:53:49.580Z" SessionID="29"><From><User FriendlyName="- James O'"/></From><To><User FriendlyName="jonathan-"/></To><Text Style="font-family:MS Shell Dlg; color:#000000; ">absolutely batshit I tell ya</Text></Message><Message Date="10/11/2008" Time="2:53:54 PM" DateTime="2008-10-11T03:53:54.666Z" SessionID="29"><From><User FriendlyName="jonathan-"/></From><To><User FriendlyName="- James O'"/></To><Text Style="font-family:Comic Sans MS; color:#000000; ">haha niice</Text></Message><Message Date="10/11/2008" Time="2:53:59 PM" DateTime="2008-10-11T03:53:59.968Z" SessionID="29"><From><User FriendlyName="jonathan-"/></From><To><User FriendlyName="- James O'"/></To><Text Style="font-family:Comic Sans MS; color:#000000; ">how much of programmin u done?</Text></Message><Message Date="10/11/2008" Time="2:54:04 PM" DateTime="2008-10-11T03:54:04.989Z" SessionID="29"><From><User FriendlyName="- James O'"/></From><To><User FriendlyName="jonathan-"/></To><Text Style="font-family:MS Shell Dlg; color:#000000; ">I submitted</Text></Message><Message Date="10/11/2008" Time="2:54:22 PM" DateTime="2008-10-11T03:54:22.312Z" SessionID="29"><From><User FriendlyName="- James O'"/></From><To><User FriendlyName="jonathan-"/></To><Text Style="font-family:MS Shell Dlg; color:#000000; ">I'll probably get 0 tho, since andy and chris are submitting mine also</Text></Message><Message Date="10/11/2008" Time="2:54:50 PM" DateTime="2008-10-11T03:54:50.199Z" SessionID="29"><From><User FriendlyName="- James O'"/></From><To><User FriendlyName="jonathan-"/></To><Text Style="font-family:MS Shell Dlg; color:#000000; ">and andy gave mine to that fucking guy I hate, and probably to blake too</Text></Message><Message Date="10/11/2008" Time="2:55:02 PM" DateTime="2008-10-11T03:55:02.342Z" SessionID="30"><From><User FriendlyName="jonathan-"/></From><To><User FriendlyName="- James O'"/></To><Text Style="font-family:Comic Sans MS; color:#000000; ">ah lame</Text></Message><Message Date="10/11/2008" Time="2:55:12 PM" DateTime="2008-10-11T03:55:12.638Z" SessionID="30"><From><User FriendlyName="jonathan-"/></From><To><User FriendlyName="- James O'"/></To><Text Style="font-family:Comic Sans MS; color:#000000; ">so prob have to make sure i change mine alot then aye</Text></Message><Message Date="10/11/2008" Time="2:55:47 PM" DateTime="2008-10-11T03:55:47.095Z" SessionID="30"><From><User FriendlyName="- James O'"/></From><To><User FriendlyName="jonathan-"/></To><Text Style="font-family:MS Shell Dlg; color:#000000; ">mm</Text></Message><Message Date="10/11/2008" Time="2:56:48 PM" DateTime="2008-10-11T03:56:48.506Z" SessionID="30"><From><User FriendlyName="jonathan-"/></From><To><User FriendlyName="- James O'"/></To><Text Style="font-family:Comic Sans MS; color:#000000; ">were urs in all the dif files?</Text></Message><Message Date="10/11/2008" Time="2:57:18 PM" DateTime="2008-10-11T03:57:18.123Z" SessionID="30"><From><User FriendlyName="- James O'"/></From><To><User FriendlyName="jonathan-"/></To><Text Style="font-family:MS Shell Dlg; color:#000000; ">yeah</Text></Message><Message Date="10/11/2008" Time="2:58:34 PM" DateTime="2008-10-11T03:58:34.857Z" SessionID="30"><From><User FriendlyName="- James O'"/></From><To><User FriendlyName="jonathan-"/></To><Text Style="font-family:MS Shell Dlg; color:#000000; ">but I spent like 3+ hours changing mine to not look like the web one</Text></Message><Message Date="10/11/2008" Time="2:58:41 PM" DateTime="2008-10-11T03:58:41.249Z" SessionID="30"><From><User FriendlyName="- James O'"/></From><To><User FriendlyName="jonathan-"/></To><Text Style="font-family:MS Shell Dlg; color:#000000; ">but then chris and andy got the same thing</Text></Message><Message Date="10/11/2008" Time="2:58:46 PM" DateTime="2008-10-11T03:58:46.159Z" SessionID="30"><From><User FriendlyName="- James O'"/></From><To><User FriendlyName="jonathan-"/></To><Text Style="font-family:MS Shell Dlg; color:#000000; ">so mine will just look like theres</Text></Message><Message Date="10/11/2008" Time="2:58:56 PM" DateTime="2008-10-11T03:58:56.846Z" SessionID="30"><From><User FriendlyName="- James O'"/></From><To><User FriendlyName="jonathan-"/></To><Text Style="font-family:MS Shell Dlg; color:#000000; ">and that fucking stan douchebag</Text></Message><Message Date="10/11/2008" Time="2:59:03 PM" DateTime="2008-10-11T03:59:03.213Z" SessionID="30"><From><User FriendlyName="- James O'"/></From><To><User FriendlyName="jonathan-"/></To><Text Style="font-family:MS Shell Dlg; color:#000000; ">and if he passes it we're fucked</Text></Message><Message Date="10/11/2008" Time="2:59:36 PM" DateTime="2008-10-11T03:59:36.055Z" SessionID="30"><From><User FriendlyName="jonathan-"/></From><To><User FriendlyName="- James O'"/></To><Text Style="font-family:Comic Sans MS; color:#000000; ">yer ive changed all mine so it looks nothing like it</Text></Message><Message Date="10/11/2008" Time="2:59:42 PM" DateTime="2008-10-11T03:59:42.135Z" SessionID="30"><From><User FriendlyName="jonathan-"/></From><To><User FriendlyName="- James O'"/></To><Text Style="font-family:Comic Sans MS; color:#000000; ">but i cant seem to put it into files</Text></Message><Message Date="10/11/2008" Time="2:59:49 PM" DateTime="2008-10-11T03:59:49.124Z" SessionID="30"><From><User FriendlyName="jonathan-"/></From><To><User FriendlyName="- James O'"/></To><Text Style="font-family:Comic Sans MS; color:#000000; ">i just get errors galore</Text></Message><Message Date="10/11/2008" Time="3:00:01 PM" DateTime="2008-10-11T04:00:01.862Z" SessionID="30"><From><User FriendlyName="- James O'"/></From><To><User FriendlyName="jonathan-"/></To><Text Style="font-family:MS Shell Dlg; color:#000000; ">Ah,</Text></Message><Message Date="10/11/2008" Time="3:00:08 PM" DateTime="2008-10-11T04:00:08.341Z" SessionID="30"><From><User FriendlyName="- James O'"/></From><To><User FriendlyName="jonathan-"/></To><Text Style="font-family:MS Shell Dlg; color:#000000; ">Mines doesnt read</Text></Message><Message Date="10/11/2008" Time="3:00:16 PM" DateTime="2008-10-11T04:00:16.227Z" SessionID="30"><From><User FriendlyName="- James O'"/></From><To><User FriendlyName="jonathan-"/></To><Text Style="font-family:MS Shell Dlg; color:#000000; ">but andy's and chris's will look the same</Text></Message><Message Date="10/11/2008" Time="3:00:20 PM" DateTime="2008-10-11T04:00:20.252Z" SessionID="30"><From><User FriendlyName="- James O'"/></From><To><User FriendlyName="jonathan-"/></To><Text Style="font-family:MS Shell Dlg; color:#000000; ">so mad obvious</Text></Message><Message Date="10/11/2008" Time="3:00:22 PM" DateTime="2008-10-11T04:00:22.483Z" SessionID="30"><From><User FriendlyName="- James O'"/></From><To><User FriendlyName="jonathan-"/></To><Text Style="font-family:MS Shell Dlg; color:#000000; ">fuck it</Text></Message><Message Date="10/11/2008" Time="3:00:23 PM" DateTime="2008-10-11T04:00:23.411Z" SessionID="30"><From><User FriendlyName="- James O'"/></From><To><User FriendlyName="jonathan-"/></To><Text Style="font-family:MS Shell Dlg; color:#000000; ">all well</Text></Message><Message Date="10/11/2008" Time="3:00:27 PM" DateTime="2008-10-11T04:00:27.564Z" SessionID="30"><From><User FriendlyName="jonathan-"/></From><To><User FriendlyName="- James O'"/></To><Text Style="font-family:Comic Sans MS; color:#000000; ">mine reads</Text></Message><Message Date="10/11/2008" Time="3:00:28 PM" DateTime="2008-10-11T04:00:28.419Z" SessionID="30"><From><User FriendlyName="- James O'"/></From><To><User FriendlyName="jonathan-"/></To><Text Style="font-family:MS Shell Dlg; color:#000000; ">Atleast i can make em feel guilty</Text></Message><Message Date="10/11/2008" Time="3:00:31 PM" DateTime="2008-10-11T04:00:31.950Z" SessionID="30"><From><User FriendlyName="jonathan-"/></From><To><User FriendlyName="- James O'"/></To><Text Style="font-family:Comic Sans MS; color:#000000; ">if u want that</Text></Message><Message Date="10/11/2008" Time="3:00:43 PM" DateTime="2008-10-11T04:00:43.049Z" SessionID="30"><From><User FriendlyName="- James O'"/></From><To><User FriendlyName="jonathan-"/></To><Text Style="font-family:MS Shell Dlg; color:#000000; ">it reads stuff in, but it then core dumps</Text></Message><Message Date="10/11/2008" Time="3:00:48 PM" DateTime="2008-10-11T04:00:48.069Z" SessionID="30"><From><User FriendlyName="jonathan-"/></From><To><User FriendlyName="- James O'"/></To><Text Style="font-family:Comic Sans MS; color:#000000; ">oh haha</Text></Message><Message Date="10/11/2008" Time="3:01:13 PM" DateTime="2008-10-11T04:01:13.363Z" SessionID="30"><From><User FriendlyName="jonathan-"/></From><To><User FriendlyName="- James O'"/></To><Text Style="font-family:Comic Sans MS; color:#000000; ">mine reads in thats all, am struggling to figure out how to call the functions and stuff</Text></Message><Message Date="10/12/2008" Time="2:36:24 PM" DateTime="2008-10-12T03:36:24.814Z" SessionID="31"><From><User FriendlyName="jonathan-"/></From><To><User FriendlyName="- James O'"/></To><Text Style="font-family:Comic Sans MS; color:#000000; ">jimmeh you there?</Text></Message><Message Date="10/12/2008" Time="2:54:04 PM" DateTime="2008-10-12T03:54:04.012Z" SessionID="31"><From><User FriendlyName="- James O'"/></From><To><User FriendlyName="jonathan-"/></To><Text Style="font-family:MS Shell Dlg; color:#000000; ">ay</Text></Message><Message Date="10/12/2008" Time="2:54:04 PM" DateTime="2008-10-12T03:54:04.818Z" SessionID="31"><From><User FriendlyName="- James O'"/></From><To><User FriendlyName="jonathan-"/></To><Text Style="font-family:MS Shell Dlg; color:#000000; ">yeh</Text></Message><Message Date="10/12/2008" Time="2:54:43 PM" DateTime="2008-10-12T03:54:43.556Z" SessionID="31"><From><User FriendlyName="- James O'"/></From><To><User FriendlyName="jonathan-"/></To><Text Style="font-family:MS Shell Dlg; color:#000000; ">...</Text></Message><Message Date="10/12/2008" Time="2:55:33 PM" DateTime="2008-10-12T03:55:33.567Z" SessionID="31"><From><User FriendlyName="jonathan-"/></From><To><User FriendlyName="- James O'"/></To><Text Style="font-family:Comic Sans MS; color:#000000; ">wen ur using ubuntu have u eva had the error where vmware ubuntu.vmx is not a valid virtuual machine configuration file?</Text></Message><Message Date="10/12/2008" Time="2:55:44 PM" DateTime="2008-10-12T03:55:44.413Z" SessionID="31"><From><User FriendlyName="- James O'"/></From><To><User FriendlyName="jonathan-"/></To><Text Style="font-family:MS Shell Dlg; color:#000000; ">no</Text></Message><Message Date="10/12/2008" Time="2:55:46 PM" DateTime="2008-10-12T03:55:46.733Z" SessionID="31"><From><User FriendlyName="- James O'"/></From><To><User FriendlyName="jonathan-"/></To><Text Style="font-family:MS Shell Dlg; color:#000000; ">better yet</Text></Message><Message Date="10/12/2008" Time="2:55:57 PM" DateTime="2008-10-12T03:55:57.469Z" SessionID="31"><From><User FriendlyName="- James O'"/></From><To><User FriendlyName="jonathan-"/></To><Text Style="font-family:MS Shell Dlg; color:#000000; ">I got one that says "Clock cpu timing error"</Text></Message><Message Date="10/12/2008" Time="2:56:02 PM" DateTime="2008-10-12T03:56:02.851Z" SessionID="31"><From><User FriendlyName="- James O'"/></From><To><User FriendlyName="jonathan-"/></To><Text Style="font-family:MS Shell Dlg; color:#000000; ">I cant run it at all on my pc</Text></Message><Message Date="10/12/2008" Time="2:56:06 PM" DateTime="2008-10-12T03:56:06.755Z" SessionID="31"><From><User FriendlyName="- James O'"/></From><To><User FriendlyName="jonathan-"/></To><Text Style="font-family:MS Shell Dlg; color:#000000; ">oh actually yeh I did do that</Text></Message><Message Date="10/12/2008" Time="2:56:10 PM" DateTime="2008-10-12T03:56:10.635Z" SessionID="31"><From><User FriendlyName="- James O'"/></From><To><User FriendlyName="jonathan-"/></To><Text Style="font-family:MS Shell Dlg; color:#000000; ">run vmware player</Text></Message><Message Date="10/12/2008" Time="2:56:18 PM" DateTime="2008-10-12T03:56:18.171Z" SessionID="31"><From><User FriendlyName="- James O'"/></From><To><User FriendlyName="jonathan-"/></To><Text Style="font-family:MS Shell Dlg; color:#000000; ">then open the ubuntu.vmx tihng</Text></Message><Message Date="10/12/2008" Time="2:57:00 PM" DateTime="2008-10-12T03:57:00.884Z" SessionID="31"><From><User FriendlyName="jonathan-"/></From><To><User FriendlyName="- James O'"/></To><Text Style="font-family:Comic Sans MS; color:#000000; ">how do u do that?</Text></Message><Message Date="10/12/2008" Time="2:57:13 PM" DateTime="2008-10-12T03:57:13.621Z" SessionID="31"><From><User FriendlyName="jonathan-"/></From><To><User FriendlyName="- James O'"/></To><Text Style="font-family:Comic Sans MS; color:#000000; ">i cant just open vmware without opening it with ubuntu</Text></Message><Message Date="10/12/2008" Time="2:57:23 PM" DateTime="2008-10-12T03:57:23.829Z" SessionID="31"><From><User FriendlyName="jonathan-"/></From><To><User FriendlyName="- James O'"/></To><Text Style="font-family:Comic Sans MS; color:#000000; ">and wen its open i can open a file or anythin</Text></Message><Message Date="10/12/2008" Time="2:57:37 PM" DateTime="2008-10-12T03:57:37.752Z" SessionID="31"><From><User FriendlyName="- James O'"/></From><To><User FriendlyName="jonathan-"/></To><Text Style="font-family:MS Shell Dlg; color:#000000; ">u on ur laptop?</Text></Message><Message Date="10/12/2008" Time="2:57:40 PM" DateTime="2008-10-12T03:57:40.841Z" SessionID="31"><From><User FriendlyName="jonathan-"/></From><To><User FriendlyName="- James O'"/></To><Text Style="font-family:Comic Sans MS; color:#000000; ">yer</Text></Message><Message Date="10/12/2008" Time="2:57:49 PM" DateTime="2008-10-12T03:57:49.752Z" SessionID="31"><From><User FriendlyName="- James O'"/></From><To><User FriendlyName="jonathan-"/></To><Text Style="font-family:MS Shell Dlg; color:#000000; ">press the windows key</Text></Message><Message Date="10/12/2008" Time="2:57:52 PM" DateTime="2008-10-12T03:57:52.366Z" SessionID="31"><From><User FriendlyName="- James O'"/></From><To><User FriendlyName="jonathan-"/></To><Text Style="font-family:MS Shell Dlg; color:#000000; ">type vmware</Text></Message><Message Date="10/12/2008" Time="2:57:54 PM" DateTime="2008-10-12T03:57:54.142Z" SessionID="31"><From><User FriendlyName="- James O'"/></From><To><User FriendlyName="jonathan-"/></To><Text Style="font-family:MS Shell Dlg; color:#000000; ">wait a tic</Text></Message><Message Date="10/12/2008" Time="2:57:56 PM" DateTime="2008-10-12T03:57:56.046Z" SessionID="31"><From><User FriendlyName="- James O'"/></From><To><User FriendlyName="jonathan-"/></To><Text Style="font-family:MS Shell Dlg; color:#000000; ">and press enter</Text></Message><Message Date="10/12/2008" Time="2:58:13 PM" DateTime="2008-10-12T03:58:13.898Z" SessionID="32"><From><User FriendlyName="jonathan-"/></From><To><User FriendlyName="- James O'"/></To><Text Style="font-family:Comic Sans MS; color:#000000; ">ye</Text></Message><Message Date="10/12/2008" Time="2:58:14 PM" DateTime="2008-10-12T03:58:14.713Z" SessionID="32"><From><User FriendlyName="jonathan-"/></From><To><User FriendlyName="- James O'"/></To><Text Style="font-family:Comic Sans MS; color:#000000; ">r</Text></Message><Message Date="10/12/2008" Time="2:59:17 PM" DateTime="2008-10-12T03:59:17.517Z" SessionID="32"><From><User FriendlyName="- James O'"/></From><To><User FriendlyName="jonathan-"/></To><Text Style="font-family:MS Shell Dlg; color:#000000; ">then open the vmx file</Text></Message><Message Date="10/12/2008" Time="2:59:34 PM" DateTime="2008-10-12T03:59:34.625Z" SessionID="33"><From><User FriendlyName="jonathan-"/></From><To><User FriendlyName="- James O'"/></To><Text Style="font-family:Comic Sans MS; color:#000000; ">is that just the normal file we open all the time to open ubuntu?</Text></Message><Message Date="10/12/2008" Time="2:59:40 PM" DateTime="2008-10-12T03:59:40.791Z" SessionID="33"><From><User FriendlyName="- James O'"/></From><To><User FriendlyName="jonathan-"/></To><Text Style="font-family:MS Shell Dlg; color:#000000; ">yes</Text></Message><Message Date="10/12/2008" Time="2:59:49 PM" DateTime="2008-10-12T03:59:49.411Z" SessionID="34"><From><User FriendlyName="jonathan-"/></From><To><User FriendlyName="- James O'"/></To><Text Style="font-family:Comic Sans MS; color:#000000; ">kk</Text></Message><Message Date="10/12/2008" Time="3:03:14 PM" DateTime="2008-10-12T04:03:14.599Z" SessionID="35"><From><User FriendlyName="jonathan-"/></From><To><User FriendlyName="- James O'"/></To><Text Style="font-family:Comic Sans MS; color:#000000; ">and then?</Text></Message><Message Date="10/12/2008" Time="3:03:40 PM" DateTime="2008-10-12T04:03:40.102Z" SessionID="35"><From><User FriendlyName="- James O'"/></From><To><User FriendlyName="jonathan-"/></To><Text Style="font-family:MS Shell Dlg; color:#000000; ">and then fucking what jono</Text></Message><Message Date="10/12/2008" Time="3:03:48 PM" DateTime="2008-10-12T04:03:48.499Z" SessionID="35"><From><User FriendlyName="- James O'"/></From><To><User FriendlyName="jonathan-"/></To><Text Style="font-family:MS Shell Dlg; color:#000000; ">Open, find the vmx thing</Text></Message><Message Date="10/12/2008" Time="3:03:52 PM" DateTime="2008-10-12T04:03:52.562Z" SessionID="35"><From><User FriendlyName="- James O'"/></From><To><User FriendlyName="jonathan-"/></To><Text Style="font-family:MS Shell Dlg; color:#000000; ">tada!!!!</Text></Message><Message Date="10/12/2008" Time="3:04:24 PM" DateTime="2008-10-12T04:04:24.008Z" SessionID="36"><From><User FriendlyName="jonathan-"/></From><To><User FriendlyName="- James O'"/></To><Text Style="font-family:Comic Sans MS; color:#000000; ">gay. i fkin hate vmware/ubuntu</Text></Message><Message Date="10/12/2008" Time="3:04:34 PM" DateTime="2008-10-12T04:04:34.347Z" SessionID="36"><From><User FriendlyName="- James O'"/></From><To><User FriendlyName="jonathan-"/></To><Text Style="font-family:MS Shell Dlg; color:#000000; ">it can be retarded</Text></Message><Message Date="10/12/2008" Time="3:04:48 PM" DateTime="2008-10-12T04:04:48.718Z" SessionID="37"><From><User FriendlyName="jonathan-"/></From><To><User FriendlyName="- James O'"/></To><Text Style="font-family:Comic Sans MS; color:#000000; ">just a lil fkin bit</Text></Message><Message Date="10/21/2008" Time="9:49:28 PM" DateTime="2008-10-21T10:49:28.530Z" SessionID="38"><From><User FriendlyName="jonathan- &gt;&gt;&gt;&gt; court!very loveable"/></From><To><User FriendlyName="- James O'"/></To><Text Style="font-family:Comic Sans MS; color:#000000; ">have u done much of programmin?</Text></Message><Message Date="10/21/2008" Time="9:53:14 PM" DateTime="2008-10-21T10:53:14.305Z" SessionID="38"><From><User FriendlyName="- James O'"/></From><To><User FriendlyName="jonathan- &gt;&gt;&gt;&gt; court!very loveable"/></To><Text Style="font-family:MS Shell Dlg; color:#000000; ">no</Text></Message><Message Date="10/25/2008" Time="11:26:03 AM" DateTime="2008-10-25T00:26:03.625Z" SessionID="39"><From><User FriendlyName="- James O'"/></From><To><User FriendlyName="jonathan-"/></To><Text Style="font-family:MS Shell Dlg; color:#000000; ">hay</Text></Message><Message Date="10/25/2008" Time="11:26:08 AM" DateTime="2008-10-25T00:26:08.853Z" SessionID="39"><From><User FriendlyName="- James O'"/></From><To><User FriendlyName="jonathan-"/></To><Text Style="font-family:MS Shell Dlg; color:#000000; ">how's programming?</Text></Message><Message Date="10/25/2008" Time="11:26:18 AM" DateTime="2008-10-25T00:26:18.323Z" SessionID="39"><From><User FriendlyName="jonathan-"/></From><To><User FriendlyName="- James O'"/></To><Text Style="font-family:Comic Sans MS; color:#000000; ">yer finished step 1 completely just then</Text></Message><Message Date="10/25/2008" Time="11:26:21 AM" DateTime="2008-10-25T00:26:21.317Z" SessionID="39"><From><User FriendlyName="jonathan-"/></From><To><User FriendlyName="- James O'"/></To><Text Style="font-family:Comic Sans MS; color:#000000; ">wbu?</Text></Message><Message Date="10/25/2008" Time="11:26:34 AM" DateTime="2008-10-25T00:26:34.097Z" SessionID="39"><From><User FriendlyName="- James O'"/></From><To><User FriendlyName="jonathan-"/></To><Text Style="font-family:MS Shell Dlg; color:#000000; ">nada</Text></Message><Message Date="10/25/2008" Time="11:26:37 AM" DateTime="2008-10-25T00:26:37.665Z" SessionID="39"><From><User FriendlyName="- James O'"/></From><To><User FriendlyName="jonathan-"/></To><Text Style="font-family:MS Shell Dlg; color:#000000; ">How long is it?</Text></Message><Message Date="10/25/2008" Time="11:26:45 AM" DateTime="2008-10-25T00:26:45.208Z" SessionID="39"><From><User FriendlyName="- James O'"/></From><To><User FriendlyName="jonathan-"/></To><Text Style="font-family:MS Shell Dlg; color:#000000; ">can one acquire part 1 of u?</Text></Message><Message Date="10/25/2008" Time="11:26:54 AM" DateTime="2008-10-25T00:26:54.967Z" SessionID="39"><From><User FriendlyName="- James O'"/></From><To><User FriendlyName="jonathan-"/></To><Text Style="font-family:MS Shell Dlg; color:#000000; ">or is it something I can get through in a few hours</Text></Message><Message Date="10/25/2008" Time="11:27:12 AM" DateTime="2008-10-25T00:27:12.279Z" SessionID="39"><From><User FriendlyName="- James O'"/></From><To><User FriendlyName="jonathan-"/></To><Text Style="font-family:MS Shell Dlg; color:#000000; ">Not rly in the mood to try and start and finish an assignment in the next few days rly</Text></Message><Message Date="10/25/2008" Time="11:27:19 AM" DateTime="2008-10-25T00:27:19.020Z" SessionID="39"><From><User FriendlyName="jonathan-"/></From><To><User FriendlyName="- James O'"/></To><Text Style="font-family:Comic Sans MS; color:#000000; ">umm a few hours of work and u should hav it</Text></Message><Message Date="10/25/2008" Time="11:27:20 AM" DateTime="2008-10-25T00:27:20.476Z" SessionID="39"><From><User FriendlyName="jonathan-"/></From><To><User FriendlyName="- James O'"/></To><Text Style="font-family:Comic Sans MS; color:#000000; ">haha</Text></Message><Message Date="10/25/2008" Time="11:27:24 AM" DateTime="2008-10-25T00:27:24.470Z" SessionID="39"><From><User FriendlyName="jonathan-"/></From><To><User FriendlyName="- James O'"/></To><Text Style="font-family:Comic Sans MS; color:#000000; ">yer i can give it to ya</Text></Message><Message Date="10/25/2008" Time="11:27:38 AM" DateTime="2008-10-25T00:27:38.732Z" SessionID="39"><From><User FriendlyName="jonathan-"/></From><To><User FriendlyName="- James O'"/></To><Text Style="font-family:Comic Sans MS; color:#000000; ">but if u get part 2 workin u have to gieve me that</Text></Message><Message Date="10/25/2008" Time="11:27:41 AM" DateTime="2008-10-25T00:27:41.099Z" SessionID="39"><From><User FriendlyName="- James O'"/></From><To><User FriendlyName="jonathan-"/></To><Text Style="font-family:MS Shell Dlg; color:#000000; ">I gotta work on my essay, being its worth 60% of my comp in society class, where as programming is wroth 6%</Text></Message><Message Date="10/25/2008" Time="11:27:49 AM" DateTime="2008-10-25T00:27:49.493Z" SessionID="39"><From><User FriendlyName="jonathan-"/></From><To><User FriendlyName="- James O'"/></To><Text Style="font-family:Comic Sans MS; color:#000000; ">yer f/e</Text></Message><Message Date="10/25/2008" Time="11:28:03 AM" DateTime="2008-10-25T00:28:03.470Z" SessionID="39"><From><User FriendlyName="- James O'"/></From><To><User FriendlyName="jonathan-"/></To><Text Style="font-family:MS Shell Dlg; color:#000000; ">jmot396</Text></Message><Message Date="10/25/2008" Time="11:28:18 AM" DateTime="2008-10-25T00:28:18.363Z" SessionID="39"><From><User FriendlyName="jonathan-"/></From><To><User FriendlyName="- James O'"/></To><Text Style="font-family:Comic Sans MS; color:#000000; ">ill do it in a bit</Text></Message><Message Date="10/25/2008" Time="11:28:29 AM" DateTime="2008-10-25T00:28:29.108Z" SessionID="39"><From><User FriendlyName="- James O'"/></From><To><User FriendlyName="jonathan-"/></To><Text Style="font-family:MS Shell Dlg; color:#000000; ">sure, ta man</Text></Message><Message Date="10/25/2008" Time="11:33:12 AM" DateTime="2008-10-25T00:33:12.689Z" SessionID="39"><From><User FriendlyName="jonathan-"/></From><To><User FriendlyName="- James O'"/></To><Text Style="font-family:Comic Sans MS; color:#000000; ">just sent let us kno if it works</Text></Message><Message Date="10/25/2008" Time="11:34:03 AM" DateTime="2008-10-25T00:34:03.453Z" SessionID="39"><From><User FriendlyName="- James O'"/></From><To><User FriendlyName="jonathan-"/></To><Text Style="font-family:MS Shell Dlg; color:#000000; ">k</Text></Message><Message Date="10/25/2008" Time="11:35:48 AM" DateTime="2008-10-25T00:35:48.985Z" SessionID="39"><From><User FriendlyName="- James O'"/></From><To><User FriendlyName="jonathan-"/></To><Text Style="font-family:MS Shell Dlg; color:#000000; ">Im downloading a podcast so I cant check</Text></Message><Message Date="10/25/2008" Time="11:35:56 AM" DateTime="2008-10-25T00:35:56.748Z" SessionID="39"><From><User FriendlyName="- James O'"/></From><To><User FriendlyName="jonathan-"/></To><Text Style="font-family:MS Shell Dlg; color:#000000; ">Im sure ill be fine</Text></Message><Message Date="10/25/2008" Time="11:36:03 AM" DateTime="2008-10-25T00:36:03.034Z" SessionID="39"><From><User FriendlyName="jonathan-"/></From><To><User FriendlyName="- James O'"/></To><Text Style="font-family:Comic Sans MS; color:#000000; ">yer kk</Text></Message><Message Date="10/26/2008" Time="5:36:42 PM" DateTime="2008-10-26T06:36:42.764Z" SessionID="40"><From><User FriendlyName="- James O'"/></From><To><User FriendlyName="jonathan-"/></To><Text Style="font-family:MS Shell Dlg; color:#000000; ">level 12 tauren warrior</Text></Message><Message Date="10/26/2008" Time="5:36:53 PM" DateTime="2008-10-26T06:36:53.690Z" SessionID="40"><From><User FriendlyName="- James O'"/></From><To><User FriendlyName="jonathan-"/></To><Text Style="font-family:MS Shell Dlg; color:#000000; ">crit 96 dmg</Text></Message><InvitationResponse Date="10/27/2008" Time="11:37:59 PM" DateTime="2008-10-27T12:37:59.892Z" SessionID="41"><From><User FriendlyName="jonathan-"/></From><File>C:\Users\James\Documents\War3Registry.reg</File><Text Style="color:#800000; ">The file you attempted to send has been detected as potentially unsafe and was not sent.</Text></InvitationResponse><Invitation Date="10/27/2008" Time="11:38:10 PM" DateTime="2008-10-27T12:38:10.230Z" SessionID="41"><From><User FriendlyName="- James O'"/></From><File>C:\Users\James\Documents\war3reg.rar</File><Text Style="color:#545454; ">- James O' sends C:\Users\James\Documents\war3reg.rar</Text></Invitation><Invitation Date="10/27/2008" Time="11:40:36 PM" DateTime="2008-10-27T12:40:36.040Z" SessionID="41"><From><User FriendlyName="- James O'"/></From><File>C:\Users\James\Documents\War3Registry.rar</File><Text Style="color:#545454; ">- James O' sends C:\Users\James\Documents\War3Registry.rar</Text></Invitation><Message Date="10/27/2008" Time="11:40:38 PM" DateTime="2008-10-27T12:40:38.237Z" SessionID="41"><From><User FriendlyName="- James O'"/></From><To><User FriendlyName="jonathan-"/></To><Text Style="font-family:MS Shell Dlg; color:#000000; ">try this</Text></Message><Message Date="10/27/2008" Time="11:40:44 PM" DateTime="2008-10-27T12:40:44.833Z" SessionID="41"><From><User FriendlyName="- James O'"/></From><To><User FriendlyName="jonathan-"/></To><Text Style="font-family:MS Shell Dlg; color:#000000; ">last one only had the install pass</Text></Message><Message Date="10/27/2008" Time="11:31:08 PM" DateTime="2008-10-27T12:31:08.530Z" SessionID="42"><From><User FriendlyName="I loath"/></From><To><User FriendlyName="jonathan-"/><User FriendlyName="- James O'"/></To><Text Style="font-family:Century Gothic; font-weight:bold; color:#800000; ">WACCA</Text></Message><Message Date="10/27/2008" Time="11:31:18 PM" DateTime="2008-10-27T12:31:18.559Z" SessionID="42"><From><User FriendlyName="- James O'"/></From><To><User FriendlyName="I loath"/><User FriendlyName="jonathan-"/></To><Text Style="font-family:MS Shell Dlg; color:#000000; ">neato</Text></Message><Message Date="10/27/2008" Time="11:31:21 PM" DateTime="2008-10-27T12:31:21.296Z" SessionID="42"><From><User FriendlyName="jonathan-"/></From><To><User FriendlyName="I loath"/><User FriendlyName="- James O'"/></To><Text Style="font-family:Comic Sans MS; color:#000000; ">hmmm</Text></Message><Message Date="10/27/2008" Time="11:31:59 PM" DateTime="2008-10-27T12:31:59.938Z" SessionID="42"><From><User FriendlyName="I loath"/></From><To><User FriendlyName="jonathan-"/><User FriendlyName="- James O'"/></To><Text Style="font-family:Century Gothic; font-weight:bold; color:#800000; ">jono, i have no idea, james will prob no</Text></Message><Message Date="10/27/2008" Time="11:32:00 PM" Dat