<?xml version="1.0"?>
<?xml-stylesheet type='text/xsl' href='MessageLog.xsl'?>
<Log FirstSessionID="1" LastSessionID="177"><Message Date="9/7/2008" Time="11:25:43 PM" DateTime="2008-09-07T13:25:43.738Z" SessionID="1"><From><User FriendlyName="- James O'"/></From><To><User FriendlyName="Marc. The Putinator"/></To><Text Style="font-family:MS Shell Dlg; color:#000000; ">Ay, new email and such</Text></Message><Message Date="9/7/2008" Time="11:25:48 PM" DateTime="2008-09-07T13:25:48.264Z" SessionID="1"><From><User FriendlyName="- James O'"/></From><To><User FriendlyName="Marc. The Putinator"/></To><Text Style="font-family:MS Shell Dlg; color:#000000; ">Um</Text></Message><Message Date="9/7/2008" Time="11:25:50 PM" DateTime="2008-09-07T13:25:50.048Z" SessionID="1"><From><User FriendlyName="- James O'"/></From><To><User FriendlyName="Marc. The Putinator"/></To><Text Style="font-family:MS Shell Dlg; color:#000000; ">oh</Text></Message><Message Date="9/7/2008" Time="11:25:51 PM" DateTime="2008-09-07T13:25:51.232Z" SessionID="1"><From><User FriendlyName="- James O'"/></From><To><User FriendlyName="Marc. The Putinator"/></To><Text Style="font-family:MS Shell Dlg; color:#000000; ">right</Text></Message><Message Date="9/7/2008" Time="11:26:01 PM" DateTime="2008-09-07T13:26:01.767Z" SessionID="1"><From><User FriendlyName="- James O'"/></From><To><User FriendlyName="Marc. The Putinator"/></To><Text Style="font-family:MS Shell Dlg; color:#000000; ">On shawns twitters theres 2, 2 hour "best of gfw" shows</Text></Message><Message Date="9/7/2008" Time="11:26:02 PM" DateTime="2008-09-07T13:26:02.879Z" SessionID="1"><From><User FriendlyName="- James O'"/></From><To><User FriendlyName="Marc. The Putinator"/></To><Text Style="font-family:MS Shell Dlg; color:#000000; ">&lt;3</Text></Message><Message Date="9/8/2008" Time="7:20:37 PM" DateTime="2008-09-08T09:20:37.388Z" SessionID="2"><From><User FriendlyName="Marc. The Putinator"/></From><To><User FriendlyName="- James O'"/></To><Text Style="font-family:MS Shell Dlg; color:#000000; ">those best of things are old</Text></Message><Message Date="9/8/2008" Time="7:20:54 PM" DateTime="2008-09-08T09:20:54.963Z" SessionID="2"><From><User FriendlyName="Marc. The Putinator"/></From><To><User FriendlyName="- James O'"/></To><Text Style="font-family:MS Shell Dlg; color:#000000; ">i listened to them about 3 months ago</Text></Message><Message Date="9/8/2008" Time="7:34:03 PM" DateTime="2008-09-08T09:34:03.077Z" SessionID="2"><From><User FriendlyName="- James O'"/></From><To><User FriendlyName="Marc. The Putinator"/></To><Text Style="font-family:MS Shell Dlg; color:#000000; ">o rly?</Text></Message><Message Date="9/8/2008" Time="7:34:05 PM" DateTime="2008-09-08T09:34:05.956Z" SessionID="2"><From><User FriendlyName="- James O'"/></From><To><User FriendlyName="Marc. The Putinator"/></To><Text Style="font-family:MS Shell Dlg; color:#000000; ">Musta missed em</Text></Message><Message Date="9/8/2008" Time="7:36:16 PM" DateTime="2008-09-08T09:36:16.073Z" SessionID="3"><From><User FriendlyName="- James O'"/></From><To><User FriendlyName="Marc. The Putinator"/></To><Text Style="font-family:MS Shell Dlg; color:#000000; ">oh and, I converted season 2 of Buffy to my PSP</Text></Message><Message Date="9/8/2008" Time="7:36:21 PM" DateTime="2008-09-08T09:36:21.221Z" SessionID="3"><From><User FriendlyName="- James O'"/></From><To><User FriendlyName="Marc. The Putinator"/></To><Text Style="font-family:MS Shell Dlg; color:#000000; ">so I can watch it on the train when Im alone</Text></Message><Message Date="9/8/2008" Time="7:36:25 PM" DateTime="2008-09-08T09:36:25.006Z" SessionID="3"><From><User FriendlyName="- James O'"/></From><To><User FriendlyName="Marc. The Putinator"/></To><Text Style="font-family:MS Shell Dlg; color:#000000; ">(Y)</Text></Message><Message Date="9/9/2008" Time="10:42:50 AM" DateTime="2008-09-09T00:42:50.111Z" SessionID="4"><From><User FriendlyName="- James O'"/></From><To><User FriendlyName="Marc. The Putinator"/></To><Text Style="font-family:MS Shell Dlg; color:#000000; ">Ay, english clear sky torrent</Text></Message><Message Date="9/9/2008" Time="10:47:27 AM" DateTime="2008-09-09T00:47:27.411Z" SessionID="5"><From><User FriendlyName="Marc. The Putinator"/></From><To><User FriendlyName="- James O'"/></To><Text Style="font-family:MS Shell Dlg; color:#000000; ">nice</Text></Message><Message Date="9/9/2008" Time="10:47:49 AM" DateTime="2008-09-09T00:47:49.554Z" SessionID="6"><From><User FriendlyName="Marc. The Putinator"/></From><To><User FriendlyName="- James O'"/></To><Text Style="font-family:MS Shell Dlg; color:#000000; ">ill start getting it tonight probs</Text></Message><Message Date="9/9/2008" Time="10:48:07 AM" DateTime="2008-09-09T00:48:07.641Z" SessionID="6"><From><User FriendlyName="Marc. The Putinator"/></From><To><User FriendlyName="- James O'"/></To><Text Style="font-family:MS Shell Dlg; color:#000000; ">although its been getting pretty shitty reviews...</Text></Message><Message Date="9/9/2008" Time="10:48:44 AM" DateTime="2008-09-09T00:48:44.371Z" SessionID="6"><From><User FriendlyName="- James O'"/></From><To><User FriendlyName="Marc. The Putinator"/></To><Text Style="font-family:MS Shell Dlg; color:#000000; ">lowest review was 68</Text></Message><Message Date="9/9/2008" Time="10:48:59 AM" DateTime="2008-09-09T00:48:59.072Z" SessionID="6"><From><User FriendlyName="Marc. The Putinator"/></From><To><User FriendlyName="- James O'"/></To><Text Style="font-family:MS Shell Dlg; color:#000000; ">yeah, but the text says otherwise...</Text></Message><Message Date="9/9/2008" Time="10:49:10 AM" DateTime="2008-09-09T00:49:10.920Z" SessionID="6"><From><User FriendlyName="Marc. The Putinator"/></From><To><User FriendlyName="- James O'"/></To><Text Style="font-family:MS Shell Dlg; color:#000000; ">they seem to be being very nice...</Text></Message><Message Date="9/9/2008" Time="10:49:17 AM" DateTime="2008-09-09T00:49:17.378Z" SessionID="6"><From><User FriendlyName="Marc. The Putinator"/></From><To><User FriendlyName="- James O'"/></To><Text Style="font-family:MS Shell Dlg; color:#000000; ">in the scoring that is</Text></Message><Message Date="9/9/2008" Time="10:49:32 AM" DateTime="2008-09-09T00:49:32.164Z" SessionID="6"><From><User FriendlyName="Marc. The Putinator"/></From><To><User FriendlyName="- James O'"/></To><Text Style="font-family:MS Shell Dlg; color:#000000; ">but saying its buggy as hell and incomplete otherwise</Text></Message><Message Date="9/9/2008" Time="10:49:34 AM" DateTime="2008-09-09T00:49:34.625Z" SessionID="6"><From><User FriendlyName="Marc. The Putinator"/></From><To><User FriendlyName="- James O'"/></To><Text Style="font-family:MS Shell Dlg; color:#000000; ">but yeah</Text></Message><Message Date="9/9/2008" Time="10:49:36 AM" DateTime="2008-09-09T00:49:36.474Z" SessionID="6"><From><User FriendlyName="Marc. The Putinator"/></From><To><User FriendlyName="- James O'"/></To><Text Style="font-family:MS Shell Dlg; color:#000000; ">ill get it</Text></Message><Message Date="9/9/2008" Time="10:49:43 AM" DateTime="2008-09-09T00:49:43.192Z" SessionID="6"><From><User FriendlyName="Marc. The Putinator"/></From><To><User FriendlyName="- James O'"/></To><Text Style="font-family:MS Shell Dlg; color:#000000; ">it will be good eventually</Text></Message><Message Date="9/9/2008" Time="10:49:57 AM" DateTime="2008-09-09T00:49:57.655Z" SessionID="6"><From><User FriendlyName="Marc. The Putinator"/></From><To><User FriendlyName="- James O'"/></To><Text Style="font-family:MS Shell Dlg; color:#000000; ">given a few patches</Text></Message><Message Date="9/9/2008" Time="10:51:38 AM" DateTime="2008-09-09T00:51:38.126Z" SessionID="6"><From><User FriendlyName="Marc. The Putinator"/></From><To><User FriendlyName="- James O'"/></To><Text Style="font-family:MS Shell Dlg; color:#000000; ">oh sweet its only 3.5gb</Text></Message><Message Date="9/9/2008" Time="10:51:49 AM" DateTime="2008-09-09T00:51:49.691Z" SessionID="6"><From><User FriendlyName="Marc. The Putinator"/></From><To><User FriendlyName="- James O'"/></To><Text Style="font-family:MS Shell Dlg; color:#000000; ">3.87 sorry</Text></Message><Message Date="9/9/2008" Time="10:52:02 AM" DateTime="2008-09-09T00:52:02.474Z" SessionID="6"><From><User FriendlyName="Marc. The Putinator"/></From><To><User FriendlyName="- James O'"/></To><Text Style="font-family:MS Shell Dlg; color:#000000; ">i was expecting 7 or something</Text></Message><Message Date="9/9/2008" Time="10:52:32 AM" DateTime="2008-09-09T00:52:32.869Z" SessionID="6"><From><User FriendlyName="Marc. The Putinator"/></From><To><User FriendlyName="- James O'"/></To><Text Style="font-family:MS Shell Dlg; color:#000000; ">dad is getting some more blank dvds today</Text></Message><Message Date="9/9/2008" Time="10:52:40 AM" DateTime="2008-09-09T00:52:40.209Z" SessionID="6"><From><User FriendlyName="Marc. The Putinator"/></From><To><User FriendlyName="- James O'"/></To><Text Style="font-family:MS Shell Dlg; color:#000000; ">buffy finished last night i believe</Text></Message><Message Date="9/9/2008" Time="10:53:29 AM" DateTime="2008-09-09T00:53:29.630Z" SessionID="6"><From><User FriendlyName="Marc. The Putinator"/></From><To><User FriendlyName="- James O'"/></To><Text Style="font-family:MS Shell Dlg; color:#000000; ">yep</Text></Message><Message Date="9/9/2008" Time="10:54:08 AM" DateTime="2008-09-09T00:54:08.812Z" SessionID="6"><From><User FriendlyName="Marc. The Putinator"/></From><To><User FriendlyName="- James O'"/></To><Text Style="font-family:MS Shell Dlg; color:#000000; ">so depending on how long it looks like Stalker will take ill have that stuff to you in the next few</Text></Message><Message Date="9/9/2008" Time="10:54:14 AM" DateTime="2008-09-09T00:54:14.162Z" SessionID="6"><From><User FriendlyName="Marc. The Putinator"/></From><To><User FriendlyName="- James O'"/></To><Text Style="font-family:MS Shell Dlg; color:#000000; ">before thursday id say.</Text></Message><Message Date="9/9/2008" Time="10:54:24 AM" DateTime="2008-09-09T00:54:24.773Z" SessionID="6"><From><User FriendlyName="- James O'"/></From><To><User FriendlyName="Marc. The Putinator"/></To><Text Style="font-family:MS Shell Dlg; color:#000000; ">wikked</Text></Message><Message Date="9/9/2008" Time="10:55:15 AM" DateTime="2008-09-09T00:55:15.552Z" SessionID="6"><From><User FriendlyName="Marc. The Putinator"/></From><To><User FriendlyName="- James O'"/></To><Text Style="font-family:MS Shell Dlg; color:#000000; ">im slowly convincing my folks to buy an E-PC</Text></Message><Message Date="9/9/2008" Time="10:55:20 AM" DateTime="2008-09-09T00:55:20.644Z" SessionID="6"><From><User FriendlyName="Marc. The Putinator"/></From><To><User FriendlyName="- James O'"/></To><Text Style="font-family:MS Shell Dlg; color:#000000; ">or a msi wind</Text></Message><Message Date="9/9/2008" Time="10:55:22 AM" DateTime="2008-09-09T00:55:22.971Z" SessionID="6"><From><User FriendlyName="Marc. The Putinator"/></From><To><User FriendlyName="- James O'"/></To><Text Style="font-family:MS Shell Dlg; color:#000000; ">depending</Text></Message><Message Date="9/9/2008" Time="10:55:33 AM" DateTime="2008-09-09T00:55:33.141Z" SessionID="6"><From><User FriendlyName="Marc. The Putinator"/></From><To><User FriendlyName="- James O'"/></To><Text Style="font-family:MS Shell Dlg; color:#000000; ">im going to give mum my laptop</Text></Message><Message Date="9/9/2008" Time="10:55:36 AM" DateTime="2008-09-09T00:55:36.648Z" SessionID="6"><From><User FriendlyName="Marc. The Putinator"/></From><To><User FriendlyName="- James O'"/></To><Text Style="font-family:MS Shell Dlg; color:#000000; ">and ill use the wind</Text></Message><Message Date="9/9/2008" Time="10:55:40 AM" DateTime="2008-09-09T00:55:40.129Z" SessionID="6"><From><User FriendlyName="Marc. The Putinator"/></From><To><User FriendlyName="- James O'"/></To><Text Style="font-family:MS Shell Dlg; color:#000000; ">for uni</Text></Message><Message Date="9/9/2008" Time="11:05:03 AM" DateTime="2008-09-09T01:05:03.168Z" SessionID="6"><From><User FriendlyName="Marc. The Putinator"/></From><To><User FriendlyName="- James O'"/></To><Text Style="font-family:MS Shell Dlg; color:#000000; ">fuck i hate essays</Text></Message><Message Date="9/9/2008" Time="11:05:09 AM" DateTime="2008-09-09T01:05:09.507Z" SessionID="6"><From><User FriendlyName="Marc. The Putinator"/></From><To><User FriendlyName="- James O'"/></To><Text Style="font-family:MS Shell Dlg; color:#000000; ">fucking 2000 words due today</Text></Message><Message Date="9/9/2008" Time="11:05:21 AM" DateTime="2008-09-09T01:05:21.645Z" SessionID="6"><From><User FriendlyName="Marc. The Putinator"/></From><To><User FriendlyName="- James O'"/></To><Text Style="font-family:MS Shell Dlg; color:#000000; ">at around 3:45</Text></Message><Message Date="9/9/2008" Time="11:05:30 AM" DateTime="2008-09-09T01:05:30.149Z" SessionID="6"><From><User FriendlyName="Marc. The Putinator"/></From><To><User FriendlyName="- James O'"/></To><Text Style="font-family:MS Shell Dlg; color:#000000; ">ive done the grand total of 600</Text></Message><Message Date="9/9/2008" Time="11:06:06 AM" DateTime="2008-09-09T01:06:06.867Z" SessionID="6"><From><User FriendlyName="- James O'"/></From><To><User FriendlyName="Marc. The Putinator"/></To><Text Style="font-family:MS Shell Dlg; color:#000000; ">jesus</Text></Message><Message Date="9/9/2008" Time="11:06:12 AM" DateTime="2008-09-09T01:06:12.801Z" SessionID="6"><From><User FriendlyName="- James O'"/></From><To><User FriendlyName="Marc. The Putinator"/></To><Text Style="font-family:MS Shell Dlg; color:#000000; ">good luck sir</Text></Message><Message Date="9/9/2008" Time="11:06:13 AM" DateTime="2008-09-09T01:06:13.350Z" SessionID="6"><From><User FriendlyName="Marc. The Putinator"/></From><To><User FriendlyName="- James O'"/></To><Text Style="font-family:MS Shell Dlg; color:#000000; ">yeah</Text></Message><Message Date="9/9/2008" Time="11:06:18 AM" DateTime="2008-09-09T01:06:18.113Z" SessionID="6"><From><User FriendlyName="- James O'"/></From><To><User FriendlyName="Marc. The Putinator"/></To><Text Style="font-family:MS Shell Dlg; color:#000000; ">i've got a stat assignment due friday</Text></Message><Message Date="9/9/2008" Time="11:06:20 AM" DateTime="2008-09-09T01:06:20.936Z" SessionID="6"><From><User FriendlyName="Marc. The Putinator"/></From><To><User FriendlyName="- James O'"/></To><Text Style="font-family:MS Shell Dlg; color:#000000; ">going to hand it in a day late probs</Text></Message><Message Date="9/9/2008" Time="11:06:21 AM" DateTime="2008-09-09T01:06:21.529Z" SessionID="6"><From><User FriendlyName="- James O'"/></From><To><User FriendlyName="Marc. The Putinator"/></To><Text Style="font-family:MS Shell Dlg; color:#000000; ">so fkced for that</Text></Message><Message Date="9/9/2008" Time="11:06:36 AM" DateTime="2008-09-09T01:06:36.071Z" SessionID="6"><From><User FriendlyName="Marc. The Putinator"/></From><To><User FriendlyName="- James O'"/></To><Text Style="font-family:MS Shell Dlg; color:#000000; ">its like a 5% loss for the first day</Text></Message><Message Date="9/9/2008" Time="11:06:41 AM" DateTime="2008-09-09T01:06:41.524Z" SessionID="6"><From><User FriendlyName="Marc. The Putinator"/></From><To><User FriendlyName="- James O'"/></To><Text Style="font-family:MS Shell Dlg; color:#000000; ">so meh</Text></Message><Message Date="9/9/2008" Time="10:44:23 PM" DateTime="2008-09-09T12:44:23.158Z" SessionID="7"><From><User FriendlyName="Marc. The Putinator"/></From><To><User FriendlyName="- James O'"/></To><Text Style="font-family:MS Shell Dlg; color:#000000; ">no crack for stalker yet so ill wait a few days</Text></Message><Message Date="9/10/2008" Time="11:39:09 PM" DateTime="2008-09-10T13:39:09.180Z" SessionID="8"><From><User FriendlyName="Marc. The Putinator"/></From><To><User FriendlyName="- James O'"/></To><Text Style="font-family:MS Shell Dlg; color:#000000; ">gotta wait till the US version of Stalker Clear Sky comes out</Text></Message><Message Date="9/10/2008" Time="11:39:42 PM" DateTime="2008-09-10T13:39:42.918Z" SessionID="8"><From><User FriendlyName="Marc. The Putinator"/></From><To><User FriendlyName="- James O'"/></To><Text Style="font-family:MS Shell Dlg; color:#000000; ">the copy protection on the euro one is apparently nearly impossible to defeat</Text></Message><Message Date="9/10/2008" Time="11:39:53 PM" DateTime="2008-09-10T13:39:53.854Z" SessionID="8"><From><User FriendlyName="Marc. The Putinator"/></From><To><User FriendlyName="- James O'"/></To><Text Style="font-family:MS Shell Dlg; color:#000000; ">and the process to beat it is infuriating</Text></Message><Message Date="9/10/2008" Time="11:40:01 PM" DateTime="2008-09-10T13:40:01.128Z" SessionID="8"><From><User FriendlyName="Marc. The Putinator"/></From><To><User FriendlyName="- James O'"/></To><Text Style="font-family:MS Shell Dlg; color:#000000; ">&gt;.&lt;</Text></Message><Message Date="9/10/2008" Time="11:40:08 PM" DateTime="2008-09-10T13:40:08.353Z" SessionID="8"><From><User FriendlyName="- James O'"/></From><To><User FriendlyName="Marc. The Putinator"/></To><Text Style="font-family:MS Shell Dlg; color:#000000; ">comes out in a week or so in US</Text></Message><Message Date="9/10/2008" Time="11:40:11 PM" DateTime="2008-09-10T13:40:11.769Z" SessionID="8"><From><User FriendlyName="Marc. The Putinator"/></From><To><User FriendlyName="- James O'"/></To><Text Style="font-family:MS Shell Dlg; color:#000000; ">the date is set for 15th</Text></Message><Message Date="9/10/2008" Time="11:40:12 PM" DateTime="2008-09-10T13:40:12.824Z" SessionID="8"><From><User FriendlyName="- James O'"/></From><To><User FriendlyName="Marc. The Putinator"/></To><Text Style="font-family:MS Shell Dlg; color:#000000; ">oh and new house in a week</Text></Message><Message Date="9/10/2008" Time="11:40:13 PM" DateTime="2008-09-10T13:40:13.822Z" SessionID="8"><From><User FriendlyName="- James O'"/></From><To><User FriendlyName="Marc. The Putinator"/></To><Text Style="font-family:MS Shell Dlg; color:#000000; ">16th</Text></Message><Message Date="9/10/2008" Time="11:40:19 PM" DateTime="2008-09-10T13:40:19.464Z" SessionID="8"><From><User FriendlyName="Marc. The Putinator"/></From><To><User FriendlyName="- James O'"/></To><Text Style="font-family:MS Shell Dlg; color:#000000; ">yeah i heard</Text></Message><Message Date="9/10/2008" Time="11:40:20 PM" DateTime="2008-09-10T13:40:20.848Z" SessionID="8"><From><User FriendlyName="Marc. The Putinator"/></From><To><User FriendlyName="- James O'"/></To><Text Style="font-family:MS Shell Dlg; color:#000000; ">:D</Text></Message><Message Date="9/10/2008" Time="11:40:28 PM" DateTime="2008-09-10T13:40:28.414Z" SessionID="8"><From><User FriendlyName="- James O'"/></From><To><User FriendlyName="Marc. The Putinator"/></To><Text Style="font-family:MS Shell Dlg; color:#000000; ">Red head from Dr Horrible is in the 2nd ep</Text></Message><Message Date="9/10/2008" Time="11:40:35 PM" DateTime="2008-09-10T13:40:35.532Z" SessionID="8"><From><User FriendlyName="Marc. The Putinator"/></From><To><User FriendlyName="- James O'"/></To><Text Style="font-family:MS Shell Dlg; color:#000000; ">of nice</Text></Message><Message Date="9/10/2008" Time="11:40:39 PM" DateTime="2008-09-10T13:40:39.006Z" SessionID="8"><From><User FriendlyName="Marc. The Putinator"/></From><To><User FriendlyName="- James O'"/></To><Text Style="font-family:MS Shell Dlg; color:#000000; ">oh nice*</Text></Message><Message Date="9/10/2008" Time="11:40:50 PM" DateTime="2008-09-10T13:40:50.285Z" SessionID="8"><From><User FriendlyName="Marc. The Putinator"/></From><To><User FriendlyName="- James O'"/></To><Text Style="font-family:MS Shell Dlg; color:#000000; ">wasnt she Gean Grey in X-men?</Text></Message><Message Date="9/10/2008" Time="11:41:11 PM" DateTime="2008-09-10T13:41:11.189Z" SessionID="8"><From><User FriendlyName="Marc. The Putinator"/></From><To><User FriendlyName="- James O'"/></To><Text Style="font-family:MS Shell Dlg; color:#000000; ">aka pheonix</Text></Message><Message Date="9/10/2008" Time="11:41:13 PM" DateTime="2008-09-10T13:41:13.113Z" SessionID="8"><From><User FriendlyName="- James O'"/></From><To><User FriendlyName="Marc. The Putinator"/></To><Text Style="font-family:MS Shell Dlg; color:#000000; ">yeah, My aunty sent me a link to a mini online series she did, 10* 6 mins eps about an MMO guild</Text></Message><Message Date="9/10/2008" Time="11:41:17 PM" DateTime="2008-09-10T13:41:17.520Z" SessionID="8"><From><User FriendlyName="Marc. The Putinator"/></From><To><User FriendlyName="- James O'"/></To><Text Style="font-family:MS Shell Dlg; color:#000000; ">phoenix*</Text></Message><Message Date="9/10/2008" Time="11:41:29 PM" DateTime="2008-09-10T13:41:29.878Z" SessionID="8"><From><User FriendlyName="- James O'"/></From><To><User FriendlyName="Marc. The Putinator"/></To><Text Style="font-family:MS Shell Dlg; color:#000000; ">I dont think that was her</Text></Message><Message Date="9/10/2008" Time="11:41:36 PM" DateTime="2008-09-10T13:41:36.349Z" SessionID="8"><From><User FriendlyName="- James O'"/></From><To><User FriendlyName="Marc. The Putinator"/></To><Text Style="font-family:MS Shell Dlg; color:#000000; ">I know who you mean</Text></Message><Message Date="9/10/2008" Time="11:41:38 PM" DateTime="2008-09-10T13:41:38.740Z" SessionID="8"><From><User FriendlyName="- James O'"/></From><To><User FriendlyName="Marc. The Putinator"/></To><Text Style="font-family:MS Shell Dlg; color:#000000; ">she was in buffy</Text></Message><Message Date="9/10/2008" Time="11:42:53 PM" DateTime="2008-09-10T13:42:53.963Z" SessionID="8"><From><User FriendlyName="Marc. The Putinator"/></From><To><User FriendlyName="- James O'"/></To><Text Style="font-family:MS Shell Dlg; color:#000000; ">right u are</Text></Message><Message Date="9/10/2008" Time="11:42:56 PM" DateTime="2008-09-10T13:42:56.707Z" SessionID="8"><From><User FriendlyName="Marc. The Putinator"/></From><To><User FriendlyName="- James O'"/></To><Text Style="font-family:MS Shell Dlg; color:#000000; ">different person</Text></Message><Message Date="9/10/2008" Time="11:43:13 PM" DateTime="2008-09-10T13:43:13.371Z" SessionID="8"><From><User FriendlyName="- James O'"/></From><To><User FriendlyName="Marc. The Putinator"/></To><Text Style="font-family:MS Shell Dlg; color:#000000; ">mm, does look similiar to gene tho</Text></Message><Message Date="9/10/2008" Time="11:43:34 PM" DateTime="2008-09-10T13:43:34.952Z" SessionID="8"><From><User FriendlyName="- James O'"/></From><To><User FriendlyName="Marc. The Putinator"/></To><Text Style="font-family:MS Shell Dlg; color:#000000; ">The guild was pretty funny</Text></Message><Message Date="9/10/2008" Time="11:46:22 PM" DateTime="2008-09-10T13:46:22.259Z" SessionID="8"><From><User FriendlyName="- James O'"/></From><To><User FriendlyName="Marc. The Putinator"/></To><Text Style="font-family:MS Shell Dlg; color:#000000; ">Downloaded Indigo Prophecy</Text></Message><Message Date="9/10/2008" Time="11:46:34 PM" DateTime="2008-09-10T13:46:34.657Z" SessionID="8"><From><User FriendlyName="- James O'"/></From><To><User FriendlyName="Marc. The Putinator"/></To><Text Style="font-family:MS Shell Dlg; color:#000000; ">pretty interesting beginning</Text></Message><Message Date="9/10/2008" Time="11:47:13 PM" DateTime="2008-09-10T13:47:13.086Z" SessionID="8"><From><User FriendlyName="Marc. The Putinator"/></From><To><User FriendlyName="- James O'"/></To><Text Style="font-family:MS Shell Dlg; color:#000000; ">http://images3.wikia.nocookie.net/buffy/images/thumb/6/6b/Felicia_Day.jpg/250px-Felicia_Day.jpg
http://lh4.ggpht.com/_GeWMEMC2vSY/RoI69ef8GmI/AAAAAAAAF3c/pOAjVG7xGSI/Jean+Grey.jpg</Text></Message><Message Date="9/10/2008" Time="11:47:16 PM" DateTime="2008-09-10T13:47:16.842Z" SessionID="8"><From><User FriendlyName="Marc. The Putinator"/></From><To><User FriendlyName="- James O'"/></To><Text Style="font-family:MS Shell Dlg; color:#000000; ">uncanny</Text></Message><Message Date="9/10/2008" Time="11:47:43 PM" DateTime="2008-09-10T13:47:43.984Z" SessionID="8"><From><User FriendlyName="- James O'"/></From><To><User FriendlyName="Marc. The Putinator"/></To><Text Style="font-family:MS Shell Dlg; color:#000000; ">mostly the hair</Text></Message><Message Date="9/10/2008" Time="11:47:53 PM" DateTime="2008-09-10T13:47:53.231Z" SessionID="8"><From><User FriendlyName="- James O'"/></From><To><User FriendlyName="Marc. The Putinator"/></To><Text Style="font-family:MS Shell Dlg; color:#000000; ">but yeh,</Text></Message><Message Date="9/10/2008" Time="11:49:06 PM" DateTime="2008-09-10T13:49:06.662Z" SessionID="8"><From><User FriendlyName="Marc. The Putinator"/></From><To><User FriendlyName="- James O'"/></To><Text Style="font-family:MS Shell Dlg; color:#000000; ">yea</Text></Message><Message Date="9/10/2008" Time="11:49:25 PM" DateTime="2008-09-10T13:49:25.803Z" SessionID="8"><From><User FriendlyName="Marc. The Putinator"/></From><To><User FriendlyName="- James O'"/></To><Text Style="font-family:MS Shell Dlg; color:#000000; ">felicia day has a softer face than Famke Janssen</Text></Message><Message Date="9/10/2008" Time="11:49:43 PM" DateTime="2008-09-10T13:49:43.222Z" SessionID="8"><From><User FriendlyName="- James O'"/></From><To><User FriendlyName="Marc. The Putinator"/></To><Text Style="font-family:MS Shell Dlg; color:#000000; ">yeah, she's cute as a button</Text></Message><Message Date="9/10/2008" Time="11:49:45 PM" DateTime="2008-09-10T13:49:45.295Z" SessionID="8"><From><User FriendlyName="Marc. The Putinator"/></From><To><User FriendlyName="- James O'"/></To><Text Style="font-family:MS Shell Dlg; color:#000000; ">Famke is a weird arse name..</Text></Message><Message Date="9/10/2008" Time="11:49:52 PM" DateTime="2008-09-10T13:49:52.292Z" SessionID="8"><From><User FriendlyName="- James O'"/></From><To><User FriendlyName="Marc. The Putinator"/></To><Text Style="font-family:MS Shell Dlg; color:#000000; ">loses points there</Text></Message><Message Date="9/10/2008" Time="11:49:54 PM" DateTime="2008-09-10T13:49:54.814Z" SessionID="8"><From><User FriendlyName="Marc. The Putinator"/></From><To><User FriendlyName="- James O'"/></To><Text Style="font-family:MS Shell Dlg; color:#000000; ">or a weird person name</Text></Message><Message Date="9/10/2008" Time="11:50:05 PM" DateTime="2008-09-10T13:50:05.281Z" SessionID="8"><From><User FriendlyName="Marc. The Putinator"/></From><To><User FriendlyName="- James O'"/></To><Text Style="font-family:MS Shell Dlg; color:#000000; ">all arse names are weird...</Text></Message><Message Date="9/10/2008" Time="11:50:18 PM" DateTime="2008-09-10T13:50:18.558Z" SessionID="8"><From><User FriendlyName="Marc. The Putinator"/></From><To><User FriendlyName="- James O'"/></To><Text Style="font-family:MS Shell Dlg; color:#000000; ">who names their arse, etc.</Text></Message><Message Date="9/10/2008" Time="11:50:36 PM" DateTime="2008-09-10T13:50:36.160Z" SessionID="8"><From><User FriendlyName="- James O'"/></From><To><User FriendlyName="Marc. The Putinator"/></To><Text Style="font-family:MS Shell Dlg; color:#000000; ">indeed sir</Text></Message><Message Date="9/10/2008" Time="11:51:13 PM" DateTime="2008-09-10T13:51:13.309Z" SessionID="8"><From><User FriendlyName="Marc. The Putinator"/></From><To><User FriendlyName="- James O'"/></To><Text Style="font-family:MS Shell Dlg; color:#000000; ">you at uni tomorrow?</Text></Message><Message Date="9/10/2008" Time="11:51:21 PM" DateTime="2008-09-10T13:51:21.778Z" SessionID="8"><From><User FriendlyName="- James O'"/></From><To><User FriendlyName="Marc. The Putinator"/></To><Text Style="font-family:MS Shell Dlg; color:#000000; ">nay</Text></Message><Message Date="9/10/2008" Time="11:51:26 PM" DateTime="2008-09-10T13:51:26.985Z" SessionID="8"><From><User FriendlyName="- James O'"/></From><To><User FriendlyName="Marc. The Putinator"/></To><Text Style="font-family:MS Shell Dlg; color:#000000; ">Creative arts took a week off</Text></Message><Message Date="9/10/2008" Time="11:51:29 PM" DateTime="2008-09-10T13:51:29.543Z" SessionID="8"><From><User FriendlyName="- James O'"/></From><To><User FriendlyName="Marc. The Putinator"/></To><Text Style="font-family:MS Shell Dlg; color:#000000; ">suites me</Text></Message><Message Date="9/10/2008" Time="11:51:41 PM" DateTime="2008-09-10T13:51:41.582Z" SessionID="8"><From><User FriendlyName="- James O'"/></From><To><User FriendlyName="Marc. The Putinator"/></To><Text Style="font-family:MS Shell Dlg; color:#000000; ">plus I have 2 bullshit all my stat labs for the past 4 weeks</Text></Message><Message Date="9/10/2008" Time="11:51:58 PM" DateTime="2008-09-10T13:51:58.964Z" SessionID="8"><From><User FriendlyName="- James O'"/></From><To><User FriendlyName="Marc. The Putinator"/></To><Text Style="font-family:MS Shell Dlg; color:#000000; ">and collbaratively copy my stat assignment</Text></Message><Message Date="9/10/2008" Time="11:52:13 PM" DateTime="2008-09-10T13:52:13.347Z" SessionID="8"><From><User FriendlyName="- James O'"/></From><To><User FriendlyName="Marc. The Putinator"/></To><Text Style="font-family:MS Shell Dlg; color:#000000; ">everyone hates biostatisics, but it creates a good community of sharing</Text></Message><Message Date="9/10/2008" Time="11:52:43 PM" DateTime="2008-09-10T13:52:43.167Z" SessionID="8"><From><User FriendlyName="- James O'"/></From><To><User FriendlyName="Marc. The Putinator"/></To><Text Style="font-family:MS Shell Dlg; color:#000000; ">we all just wanna pass it and be done with it, since test is woth 60%, all trying to get the best marks since we dont get most the work thats going on</Text></Message><Message Date="9/10/2008" Time="11:52:55 PM" DateTime="2008-09-10T13:52:55.165Z" SessionID="8"><From><User FriendlyName="- James O'"/></From><To><User FriendlyName="Marc. The Putinator"/></To><Text Style="font-family:MS Shell Dlg; color:#000000; ">And I got another programming ass due sunday, which I havent started</Text></Message><Message Date="9/10/2008" Time="11:53:01 PM" DateTime="2008-09-10T13:53:01.205Z" SessionID="8"><From><User FriendlyName="- James O'"/></From><To><User FriendlyName="Marc. The Putinator"/></To><Text Style="font-family:MS Shell Dlg; color:#000000; ">yay for the weekend</Text></Message><Message Date="9/10/2008" Time="11:54:15 PM" DateTime="2008-09-10T13:54:15.612Z" SessionID="8"><From><User FriendlyName="Marc. The Putinator"/></From><To><User FriendlyName="- James O'"/></To><Text Style="font-family:MS Shell Dlg; color:#000000; ">fun fun fun</Text></Message><Message Date="9/10/2008" Time="11:54:29 PM" DateTime="2008-09-10T13:54:29.307Z" SessionID="8"><From><User FriendlyName="Marc. The Putinator"/></From><To><User FriendlyName="- James O'"/></To><Text Style="font-family:MS Shell Dlg; color:#000000; ">at least we can have some fun on saturday night</Text></Message><Message Date="9/10/2008" Time="11:56:09 PM" DateTime="2008-09-10T13:56:09.184Z" SessionID="8"><From><User FriendlyName="- James O'"/></From><To><User FriendlyName="Marc. The Putinator"/></To><Text Style="font-family:MS Shell Dlg; color:#000000; ">bout to goto bed</Text></Message><Message Date="9/10/2008" Time="11:56:14 PM" DateTime="2008-09-10T13:56:14.510Z" SessionID="8"><From><User FriendlyName="- James O'"/></From><To><User FriendlyName="Marc. The Putinator"/></To><Text Style="font-family:MS Shell Dlg; color:#000000; ">anything worth downloading?</Text></Message><Message Date="9/10/2008" Time="11:56:20 PM" DateTime="2008-09-10T13:56:20.434Z" SessionID="8"><From><User FriendlyName="Marc. The Putinator"/></From><To><User FriendlyName="- James O'"/></To><Text Style="font-family:MS Shell Dlg; color:#000000; ">ummm not so far</Text></Message><Message Date="9/10/2008" Time="11:56:27 PM" DateTime="2008-09-10T13:56:27.855Z" SessionID="8"><From><User FriendlyName="- James O'"/></From><To><User FriendlyName="Marc. The Putinator"/></To><Text Style="font-family:MS Shell Dlg; color:#000000; ">I downloaded locks quest for ds</Text></Message><Message Date="9/10/2008" Time="11:56:33 PM" DateTime="2008-09-10T13:56:33.010Z" SessionID="8"><From><User FriendlyName="Marc. The Putinator"/></From><To><User FriendlyName="- James O'"/></To><Text Style="font-family:MS Shell Dlg; color:#000000; ">hm</Text></Message><Message Date="9/10/2008" Time="11:56:40 PM" DateTime="2008-09-10T13:56:40.608Z" SessionID="8"><From><User FriendlyName="Marc. The Putinator"/></From><To><User FriendlyName="- James O'"/></To><Text Style="font-family:MS Shell Dlg; color:#000000; ">jess still has mine</Text></Message><Message Date="9/10/2008" Time="11:56:40 PM" DateTime="2008-09-10T13:56:40.963Z" SessionID="8"><From><User FriendlyName="- James O'"/></From><To><User FriendlyName="Marc. The Putinator"/></To><Text Style="font-family:MS Shell Dlg; color:#000000; ">its like a RTS/Tower Defence game</Text></Message><Message Date="9/10/2008" Time="11:56:42 PM" DateTime="2008-09-10T13:56:42.819Z" SessionID="8"><From><User FriendlyName="- James O'"/></From><To><User FriendlyName="Marc. The Putinator"/></To><Text Style="font-family:MS Shell Dlg; color:#000000; ">looks good</Text></Message><Message Date="9/10/2008" Time="11:57:13 PM" DateTime="2008-09-10T13:57:13.810Z" SessionID="8"><From><User FriendlyName="Marc. The Putinator"/></From><To><User FriendlyName="- James O'"/></To><Text Style="font-family:MS Shell Dlg; color:#000000; ">im so not lookin forward to spending all night doing this fn assignment</Text></Message><Message Date="9/10/2008" Time="11:57:23 PM" DateTime="2008-09-10T13:57:23.694Z" SessionID="8"><From><User FriendlyName="Marc. The Putinator"/></From><To><User FriendlyName="- James O'"/></To><Text Style="font-family:MS Shell Dlg; color:#000000; ">esspecially since its already 2 days late &gt;.&lt;</Text></Message><Message Date="9/10/2008" Time="11:57:37 PM" DateTime="2008-09-10T13:57:37.327Z" SessionID="8"><From><User FriendlyName="Marc. The Putinator"/></From><To><User FriendlyName="- James O'"/></To><Text Style="font-family:MS Shell Dlg; color:#000000; ">cant really postpone it any longer</Text></Message><Message Date="9/10/2008" Time="11:57:48 PM" DateTime="2008-09-10T13:57:48.747Z" SessionID="8"><From><User FriendlyName="Marc. The Putinator"/></From><To><User FriendlyName="- James O'"/></To><Text Style="font-family:MS Shell Dlg; color:#000000; ">thank god for 2% per day late penalty</Text></Message><Message Date="9/10/2008" Time="11:57:55 PM" DateTime="2008-09-10T13:57:55.876Z" SessionID="8"><From><User FriendlyName="Marc. The Putinator"/></From><To><User FriendlyName="- James O'"/></To><Text Style="font-family:MS Shell Dlg; color:#000000; ">its truely ridiculous</Text></Message><Message Date="9/10/2008" Time="11:58:50 PM" DateTime="2008-09-10T13:58:50.423Z" SessionID="8"><From><User FriendlyName="Marc. The Putinator"/></From><To><User FriendlyName="- James O'"/></To><Text Style="font-family:MS Shell Dlg; color:#000000; ">anyhow</Text></Message><Message Date="9/10/2008" Time="11:58:53 PM" DateTime="2008-09-10T13:58:53.057Z" SessionID="8"><From><User FriendlyName="Marc. The Putinator"/></From><To><User FriendlyName="- James O'"/></To><Text Style="font-family:MS Shell Dlg; color:#000000; ">have a good night</Text></Message><Message Date="9/10/2008" Time="11:59:02 PM" DateTime="2008-09-10T13:59:02.306Z" SessionID="8"><From><User FriendlyName="Marc. The Putinator"/></From><To><User FriendlyName="- James O'"/></To><Text Style="font-family:MS Shell Dlg; color:#000000; ">i better get hard to work</Text></Message><Message Date="9/10/2008" Time="11:59:27 PM" DateTime="2008-09-10T13:59:27.618Z" SessionID="8"><From><User FriendlyName="- James O'"/></From><To><User FriendlyName="Marc. The Putinator"/></To><Text Style="font-family:MS Shell Dlg; color:#000000; ">yeah, good luck</Text></Message><Message Date="9/10/2008" Time="11:59:30 PM" DateTime="2008-09-10T13:59:30.288Z" SessionID="8"><From><User FriendlyName="- James O'"/></From><To><User FriendlyName="Marc. The Putinator"/></To><Text Style="font-family:MS Shell Dlg; color:#000000; ">talk to ya later</Text></Message><Message Date="9/10/2008" Time="11:59:34 PM" DateTime="2008-09-10T13:59:34.656Z" SessionID="8"><From><User FriendlyName="Marc. The Putinator"/></From><To><User FriendlyName="- James O'"/></To><Text Style="font-family:MS Shell Dlg; color:#000000; ">btw</Text></Message><Message Date="9/10/2008" Time="11:59:38 PM" DateTime="2008-09-10T13:59:38.349Z" SessionID="8"><From><User FriendlyName="Marc. The Putinator"/></From><To><User FriendlyName="- James O'"/></To><Text Style="font-family:MS Shell Dlg; color:#000000; ">i got a whiteboard</Text></Message><Message Date="9/10/2008" Time="11:59:45 PM" DateTime="2008-09-10T13:59:45.188Z" SessionID="8"><From><User FriendlyName="Marc. The Putinator"/></From><To><User FriendlyName="- James O'"/></To><Text Style="font-family:MS Shell Dlg; color:#000000; ">infinite entertainment.</Text></Message><Message Date="9/10/2008" Time="11:59:55 PM" DateTime="2008-09-10T13:59:55.649Z" SessionID="8"><From><User FriendlyName="- James O'"/></From><To><User FriendlyName="Marc. The Putinator"/></To><Text Style="font-family:MS Shell Dlg; color:#000000; ">Haha</Text></Message><Message Date="9/11/2008" Time="12:00:06 AM" DateTime="2008-09-10T14:00:06.379Z" SessionID="8"><From><User FriendlyName="- James O'"/></From><To><User FriendlyName="Marc. The Putinator"/></To><Text Style="font-family:MS Shell Dlg; color:#000000; ">wikked</Text></Message><Message Date="9/11/2008" Time="12:00:33 AM" DateTime="2008-09-10T14:00:33.173Z" SessionID="9"><From><User FriendlyName="Marc. The Putinator"/></From><To><User FriendlyName="- James O'"/></To><Text Style="font-family:MS Shell Dlg; color:#000000; ">ciao</Text></Message><Message Date="9/11/2008" Time="12:00:36 AM" DateTime="2008-09-10T14:00:36.361Z" SessionID="9"><From><User FriendlyName="- James O'"/></From><To><User FriendlyName="Marc. The Putinator"/></To><Text Style="font-family:MS Shell Dlg; color:#000000; ">Chow</Text></Message><Message Date="9/14/2008" Time="12:51:35 AM" DateTime="2008-09-13T14:51:35.709Z" SessionID="10"><From><User FriendlyName="- James O'"/></From><To><User FriendlyName="Marc. The Putinator"/></To><Text Style="font-family:MS Shell Dlg; color:#000000; ">ooh</Text></Message><Message Date="9/14/2008" Time="12:51:37 AM" DateTime="2008-09-13T14:51:37.947Z" SessionID="10"><From><User FriendlyName="- James O'"/></From><To><User FriendlyName="Marc. The Putinator"/></To><Text Style="font-family:MS Shell Dlg; color:#000000; ">october 21st</Text></Message><Message Date="9/14/2008" Time="12:51:43 AM" DateTime="2008-09-13T14:51:43.955Z" SessionID="10"><From><User FriendlyName="- James O'"/></From><To><User FriendlyName="Marc. The Putinator"/></To><Text Style="font-family:MS Shell Dlg; color:#000000; ">a THREEvening with Kevin Smith</Text></Message><Message Date="9/14/2008" Time="1:59:23 PM" DateTime="2008-09-14T03:59:23.536Z" SessionID="11"><From><User FriendlyName="Marc. The Putinator"/></From><To><User FriendlyName="- James O'"/></To><Text Style="font-family:MS Shell Dlg; color:#000000; ">:-O:-O:-O:-O</Text></Message><Message Date="9/14/2008" Time="1:59:32 PM" DateTime="2008-09-14T03:59:32.815Z" SessionID="11"><From><User FriendlyName="Marc. The Putinator"/></From><To><User FriendlyName="- James O'"/></To><Text Style="font-family:MS Shell Dlg; color:#000000; ">sweeeet</Text></Message><Message Date="9/14/2008" Time="1:59:35 PM" DateTime="2008-09-14T03:59:35.158Z" SessionID="11"><From><User FriendlyName="- James O'"/></From><To><User FriendlyName="Marc. The Putinator"/></To><Text Style="font-family:MS Shell Dlg; color:#000000; ">and I grabbed the new ross noble last night</Text></Message><Message Date="9/14/2008" Time="1:59:38 PM" DateTime="2008-09-14T03:59:38.816Z" SessionID="11"><From><User FriendlyName="Marc. The Putinator"/></From><To><User FriendlyName="- James O'"/></To><Text Style="font-family:MS Shell Dlg; color:#000000; ">oh nice</Text></Message><Message Date="9/14/2008" Time="1:59:44 PM" DateTime="2008-09-14T03:59:44.389Z" SessionID="11"><From><User FriendlyName="- James O'"/></From><To><User FriendlyName="Marc. The Putinator"/></To><Text Style="font-family:MS Shell Dlg; color:#000000; ">which is based on the tour we saw</Text></Message><Message Date="9/14/2008" Time="1:59:51 PM" DateTime="2008-09-14T03:59:51.851Z" SessionID="11"><From><User FriendlyName="Marc. The Putinator"/></From><To><User FriendlyName="- James O'"/></To><Text Style="font-family:MS Shell Dlg; color:#000000; ">yea</Text></Message><Message Date="9/14/2008" Time="2:00:12 PM" DateTime="2008-09-14T04:00:12.652Z" SessionID="11"><From><User FriendlyName="Marc. The Putinator"/></From><To><User FriendlyName="- James O'"/></To><Text Style="font-family:MS Shell Dlg; color:#000000; ">check out any Steven K amos yet?</Text></Message><Message Date="9/14/2008" Time="2:01:12 PM" DateTime="2008-09-14T04:01:12.792Z" SessionID="11"><From><User FriendlyName="Marc. The Putinator"/></From><To><User FriendlyName="- James O'"/></To><Text Style="font-family:MS Shell Dlg; color:#000000; ">stephen*</Text></Message><Message Date="9/14/2008" Time="2:03:28 PM" DateTime="2008-09-14T04:03:28.041Z" SessionID="11"><From><User FriendlyName="- James O'"/></From><To><User FriendlyName="Marc. The Putinator"/></To><Text Style="font-family:MS Shell Dlg; color:#000000; "> yeh</Text></Message><Message Date="9/14/2008" Time="2:03:36 PM" DateTime="2008-09-14T04:03:36.175Z" SessionID="11"><From><User FriendlyName="- James O'"/></From><To><User FriendlyName="Marc. The Putinator"/></To><Text Style="font-family:MS Shell Dlg; color:#000000; ">watched a few clips o youtube at 2am</Text></Message><Message Date="9/14/2008" Time="2:04:00 PM" DateTime="2008-09-14T04:04:00.013Z" SessionID="12"><From><User FriendlyName="- James O'"/></From><To><User FriendlyName="Marc. The Putinator"/></To><Text Style="font-family:MS Shell Dlg; color:#000000; ">1upYours is good this week</Text></Message><Message Date="9/14/2008" Time="2:04:05 PM" DateTime="2008-09-14T04:04:05.014Z" SessionID="13"><From><User FriendlyName="Marc. The Putinator"/></From><To><User FriendlyName="- James O'"/></To><Text Style="font-family:MS Shell Dlg; color:#000000; ">http://www.youtube.com/watch?v=XB1qYBnn7sg&amp;feature=related</Text></Message><Message Date="9/14/2008" Time="2:04:06 PM" DateTime="2008-09-14T04:04:06.300Z" SessionID="13"><From><User FriendlyName="Marc. The Putinator"/></From><To><User FriendlyName="- James O'"/></To><Text Style="font-family:MS Shell Dlg; color:#000000; ">yeah?</Text></Message><Message Date="9/14/2008" Time="2:05:10 PM" DateTime="2008-09-14T04:05:10.949Z" SessionID="13"><From><User FriendlyName="- James O'"/></From><To><User FriendlyName="Marc. The Putinator"/></To><Text Style="font-family:MS Shell Dlg; color:#000000; ">mm</Text></Message><Message Date="9/14/2008" Time="2:05:15 PM" DateTime="2008-09-14T04:05:15.011Z" SessionID="13"><From><User FriendlyName="- James O'"/></From><To><User FriendlyName="Marc. The Putinator"/></To><Text Style="font-family:MS Shell Dlg; color:#000000; ">yeh, that was the first one I saw</Text></Message><Message Date="9/14/2008" Time="2:05:30 PM" DateTime="2008-09-14T04:05:30.113Z" SessionID="13"><From><User FriendlyName="- James O'"/></From><To><User FriendlyName="Marc. The Putinator"/></To><Text Style="font-family:MS Shell Dlg; color:#000000; ">I didnt actually search for it, I just "other videos" jumped</Text></Message><Message Date="9/14/2008" Time="2:05:39 PM" DateTime="2008-09-14T04:05:39.188Z" SessionID="13"><From><User FriendlyName="Marc. The Putinator"/></From><To><User FriendlyName="- James O'"/></To><Text Style="font-family:MS Shell Dlg; color:#000000; ">mhmm</Text></Message><Message Date="9/14/2008" Time="2:05:42 PM" DateTime="2008-09-14T04:05:42.040Z" SessionID="13"><From><User FriendlyName="- James O'"/></From><To><User FriendlyName="Marc. The Putinator"/></To><Text Style="font-family:MS Shell Dlg; color:#000000; ">Im like thats the dude marc talked about</Text></Message><Message Date="9/14/2008" Time="2:06:00 PM" DateTime="2008-09-14T04:06:00.382Z" SessionID="14"><From><User FriendlyName="- James O'"/></From><To><User FriendlyName="Marc. The Putinator"/></To><Text Style="font-family:MS Shell Dlg; color:#000000; ">*lunch*</Text></Message><Message Date="9/14/2008" Time="2:06:12 PM" DateTime="2008-09-14T04:06:12.238Z" SessionID="15"><From><User FriendlyName="Marc. The Putinator"/></From><To><User FriendlyName="- James O'"/></To><Text Style="font-family:MS Shell Dlg; color:#000000; ">kk cya soon</Text></Message><Message Date="9/14/2008" Time="2:11:58 PM" DateTime="2008-09-14T04:11:58.795Z" SessionID="15"><From><User FriendlyName="- James O'"/></From><To><User FriendlyName="Marc. The Putinator"/></To><Text Style="font-family:MS Shell Dlg; color:#000000; ">i got soul caliber 4, ace combat 6 and stranglehold for 360</Text></Message><Message Date="9/14/2008" Time="2:12:10 PM" DateTime="2008-09-14T04:12:10.736Z" SessionID="15"><From><User FriendlyName="- James O'"/></From><To><User FriendlyName="Marc. The Putinator"/></To><Text Style="font-family:MS Shell Dlg; color:#000000; ">and tiger woods 09</Text></Message><Message Date="9/14/2008" Time="2:12:12 PM" DateTime="2008-09-14T04:12:12.823Z" SessionID="15"><From><User FriendlyName="Marc. The Putinator"/></From><To><User FriendlyName="- James O'"/></To><Text Style="font-family:MS Shell Dlg; color:#000000; ">oh nice</Text></Message><Message Date="9/14/2008" Time="2:13:18 PM" DateTime="2008-09-14T04:13:18.441Z" SessionID="15"><From><User FriendlyName="- James O'"/></From><To><User FriendlyName="Marc. The Putinator"/></To><Text Style="font-family:MS Shell Dlg; color:#000000; ">pete got his 360 chipped</Text></Message><Message Date="9/14/2008" Time="2:13:33 PM" DateTime="2008-09-14T04:13:33.942Z" SessionID="15"><From><User FriendlyName="- James O'"/></From><To><User FriendlyName="Marc. The Putinator"/></To><Text Style="font-family:MS Shell Dlg; color:#000000; ">and he got games burnt for $10</Text></Message><Message Date="9/14/2008" Time="2:13:42 PM" DateTime="2008-09-14T04:13:42.148Z" SessionID="15"><From><User FriendlyName="- James O'"/></From><To><User FriendlyName="Marc. The Putinator"/></To><Text Style="font-family:MS Shell Dlg; color:#000000; ">and he gave us tiger woosd</Text></Message><Message Date="9/14/2008" Time="2:13:48 PM" DateTime="2008-09-14T04:13:48.531Z" SessionID="15"><From><User FriendlyName="- James O'"/></From><To><User FriendlyName="Marc. The Putinator"/></To><Text Style="font-family:MS Shell Dlg; color:#000000; ">and we he got soul cal,</Text></Message><Message Date="9/14/2008" Time="2:13:55 PM" DateTime="2008-09-14T04:13:55.110Z" SessionID="15"><From><User FriendlyName="Marc. The Putinator"/></From><To><User FriendlyName="- James O'"/></To><Text Style="font-family:MS Shell Dlg; color:#000000; ">im going to get medal of honor heros 2</Text></Message><Message Date="9/14/2008" Time="2:14:01 PM" DateTime="2008-09-14T04:14:01.660Z" SessionID="15"><From><User FriendlyName="- James O'"/></From><To><User FriendlyName="Marc. The Putinator"/></To><Text Style="font-family:MS Shell Dlg; color:#000000; ">oh yeh</Text></Message><Message Date="9/14/2008" Time="2:14:12 PM" DateTime="2008-09-14T04:14:12.455Z" SessionID="15"><From><User FriendlyName="Marc. The Putinator"/></From><To><User FriendlyName="- James O'"/></To><Text Style="font-family:MS Shell Dlg; color:#000000; ">and maybe battalion wars</Text></Message><Message Date="9/14/2008" Time="2:14:17 PM" DateTime="2008-09-14T04:14:17.874Z" SessionID="15"><From><User FriendlyName="- James O'"/></From><To><User FriendlyName="Marc. The Putinator"/></To><Text Style="font-family:MS Shell Dlg; color:#000000; ">wikked</Text></Message><Message Date="9/14/2008" Time="2:16:28 PM" DateTime="2008-09-14T04:16:28.928Z" SessionID="15"><From><User FriendlyName="- James O'"/></From><To><User FriendlyName="Marc. The Putinator"/></To><Text Style="font-family:MS Shell Dlg; color:#000000; ">Soul Caliber is wikked</Text></Message><Message Date="9/14/2008" Time="2:17:04 PM" DateTime="2008-09-14T04:17:04.924Z" SessionID="16"><From><User FriendlyName="Marc. The Putinator"/></From><To><User FriendlyName="- James O'"/></To><Text Style="font-family:MS Shell Dlg; color:#000000; ">yea its pretty fun</Text></Message><Message Date="9/14/2008" Time="2:17:17 PM" DateTime="2008-09-14T04:17:17.846Z" SessionID="16"><From><User FriendlyName="Marc. The Putinator"/></From><To><User FriendlyName="- James O'"/></To><Text Style="font-family:MS Shell Dlg; color:#000000; ">you up 2 space in spore yet?</Text></Message><Message Date="9/14/2008" Time="2:17:25 PM" DateTime="2008-09-14T04:17:25.827Z" SessionID="16"><From><User FriendlyName="- James O'"/></From><To><User FriendlyName="Marc. The Putinator"/></To><Text Style="font-family:MS Shell Dlg; color:#000000; ">aint touched it</Text></Message><Message Date="9/14/2008" Time="2:19:40 PM" DateTime="2008-09-14T04:19:40.011Z" SessionID="16"><From><User FriendlyName="Marc. The Putinator"/></From><To><User FriendlyName="- James O'"/></To><Text Style="font-family:MS Shell Dlg; color:#000000; ">fe</Text></Message><Message Date="9/14/2008" Time="2:19:53 PM" DateTime="2008-09-14T04:19:53.588Z" SessionID="16"><From><User FriendlyName="Marc. The Putinator"/></From><To><User FriendlyName="- James O'"/></To><Text Style="font-family:MS Shell Dlg; color:#000000; ">if i were u id just power through to the space stag</Text></Message><Message Date="9/14/2008" Time="2:19:56 PM" DateTime="2008-09-14T04:19:56.084Z" SessionID="16"><From><User FriendlyName="Marc. The Putinator"/></From><To><User FriendlyName="- James O'"/></To><Text Style="font-family:MS Shell Dlg; color:#000000; ">e*</Text></Message><Message Date="9/14/2008" Time="2:20:06 PM" DateTime="2008-09-14T04:20:06.706Z" SessionID="16"><From><User FriendlyName="Marc. The Putinator"/></From><To><User FriendlyName="- James O'"/></To><Text Style="font-family:MS Shell Dlg; color:#000000; ">the civ stage took like 15min</Text></Message><Message Date="9/14/2008" Time="2:20:16 PM" DateTime="2008-09-14T04:20:16.296Z" SessionID="16"><From><User FriendlyName="Marc. The Putinator"/></From><To><User FriendlyName="- James O'"/></To><Text Style="font-family:MS Shell Dlg; color:#000000; ">if you go military</Text></Message><Message Date="9/14/2008" Time="2:20:35 PM" DateTime="2008-09-14T04:20:35.202Z" SessionID="16"><From><User FriendlyName="Marc. The Putinator"/></From><To><User FriendlyName="- James O'"/></To><Text Style="font-family:MS Shell Dlg; color:#000000; ">pump out vehicles until you can get planes</Text></Message><Message Date="9/14/2008" Time="2:20:44 PM" DateTime="2008-09-14T04:20:44.384Z" SessionID="16"><From><User FriendlyName="Marc. The Putinator"/></From><To><User FriendlyName="- James O'"/></To><Text Style="font-family:MS Shell Dlg; color:#000000; ">pump out planes en-masse</Text></Message><Message Date="9/14/2008" Time="2:20:47 PM" DateTime="2008-09-14T04:20:47.260Z" SessionID="16"><From><User FriendlyName="Marc. The Putinator"/></From><To><User FriendlyName="- James O'"/></To><Text Style="font-family:MS Shell Dlg; color:#000000; ">win</Text></Message><Message Date="9/14/2008" Time="2:23:41 PM" DateTime="2008-09-14T04:23:41.307Z" SessionID="17"><From><User FriendlyName="Marc. The Putinator"/></From><To><User FriendlyName="- James O'"/></To><Text Style="font-family:MS Shell Dlg; color:#000000; ">http://www.mininova.org/tor/1801728</Text></Message><Message Date="9/14/2008" Time="3:02:59 PM" DateTime="2008-09-14T05:02:59.215Z" SessionID="17"><From><User FriendlyName="- James O'"/></From><To><User FriendlyName="Marc. The Putinator"/></To><Text Style="font-family:MS Shell Dlg; color:#000000; ">I grabbed the PSP version last nite</Text></Message><Message Date="9/14/2008" Time="3:03:10 PM" DateTime="2008-09-14T05:03:10.961Z" SessionID="17"><From><User FriendlyName="- James O'"/></From><To><User FriendlyName="Marc. The Putinator"/></To><Text Style="font-family:MS Shell Dlg; color:#000000; ">Pete's gonner rent it in when its out and bring it over</Text></Message><Message Date="9/19/2008" Time="5:10:18 PM" DateTime="2008-09-19T07:10:18.460Z" SessionID="18"><From><User FriendlyName="- James O'"/></From><To><User FriendlyName="Marc. The Putinator"/></To><Text Style="font-family:MS Shell Dlg; color:#000000; ">http://www.warez-bb.org/viewtopic.php?t=1616154&amp;sid=754706c1babed11a260bbc258f5ff22b</Text></Message><Message Date="9/19/2008" Time="5:20:52 PM" DateTime="2008-09-19T07:20:52.504Z" SessionID="18"><From><User FriendlyName="Marc. The Putinator"/></From><To><User FriendlyName="- James O'"/></To><Text Style="font-family:MS Shell Dlg; color:#000000; ">it seemed a little dodgey</Text></Message><Message Date="9/19/2008" Time="5:20:57 PM" DateTime="2008-09-19T07:20:57.042Z" SessionID="18"><From><User FriendlyName="Marc. The Putinator"/></From><To><User FriendlyName="- James O'"/></To><Text Style="font-family:MS Shell Dlg; color:#000000; ">ill just get the full </Text></Message><Message Date="9/19/2008" Time="5:21:06 PM" DateTime="2008-09-19T07:21:06.489Z" SessionID="18"><From><User FriendlyName="Marc. The Putinator"/></From><To><User FriendlyName="- James O'"/></To><Text Style="font-family:MS Shell Dlg; color:#000000; ">im not going to bother with clear sky for a bit</Text></Message><Message Date="9/19/2008" Time="5:21:26 PM" DateTime="2008-09-19T07:21:26.276Z" SessionID="18"><From><User FriendlyName="Marc. The Putinator"/></From><To><User FriendlyName="- James O'"/></To><Text Style="font-family:MS Shell Dlg; color:#000000; ">its even more buggy than the original ive been hearing</Text></Message><Message Date="9/20/2008" Time="12:51:17 PM" DateTime="2008-09-20T02:51:17.787Z" SessionID="19"><From><User FriendlyName="- James O'"/></From><To><User FriendlyName="Marc. The Putinator"/></To><Text Style="font-family:MS Shell Dlg; color:#000000; ">Shawn Elliots on 1up Yours</Text></Message><Message Date="9/20/2008" Time="8:15:00 PM" DateTime="2008-09-20T10:15:00.891Z" SessionID="20"><From><User FriendlyName="Marc. Vladmir Putin- Prime Minister for Action"/></From><To><User FriendlyName="- James O'"/></To><Text Style="font-family:MS Shell Dlg; color:#000000; ">http://www.onlinecomputer.com.au/product_info.php?products_id=779</Text></Message><Message Date="9/20/2008" Time="8:15:26 PM" DateTime="2008-09-20T10:15:26.558Z" SessionID="20"><From><User FriendlyName="- James O'"/></From><To><User FriendlyName="Marc. Vladmir Putin- Prime Minister for Action"/></To><Text Style="font-family:MS Shell Dlg; color:#000000; ">pretty</Text></Message><Message Date="9/20/2008" Time="8:15:31 PM" DateTime="2008-09-20T10:15:31.585Z" SessionID="20"><From><User FriendlyName="Marc. Vladmir Putin- Prime Minister for Action"/></From><To><User FriendlyName="- James O'"/></To><Text Style="font-family:MS Shell Dlg; color:#000000; ">I'm (90% sure) im buying this on monday</Text></Message><Message Date="9/20/2008" Time="8:16:38 PM" DateTime="2008-09-20T10:16:38.580Z" SessionID="20"><From><User FriendlyName="Marc. Vladmir Putin- Prime Minister for Action"/></From><To><User FriendlyName="- James O'"/></To><Text Style="font-family:MS Shell Dlg; color:#000000; ">i have realised over the last few weeks how much I need another laptop in this house</Text></Message><Message Date="9/20/2008" Time="8:17:34 PM" DateTime="2008-09-20T10:17:34.119Z" SessionID="20"><From><User FriendlyName="Marc. Vladmir Putin- Prime Minister for Action"/></From><To><User FriendlyName="- James O'"/></To><Text Style="font-family:MS Shell Dlg; color:#000000; ">between mum doing reports, dad doing spring festival stuff, and me doing uni work- we definately need 3 computers</Text></Message><Message Date="9/20/2008" Time="8:17:59 PM" DateTime="2008-09-20T10:17:59.709Z" SessionID="20"><From><User FriendlyName="Marc. Vladmir Putin- Prime Minister for Action"/></From><To><User FriendlyName="- James O'"/></To><Text Style="font-family:MS Shell Dlg; color:#000000; ">and i figure that a desktop, a midsized laptop and a super portable should do the job quite well</Text></Message><Message Date="9/20/2008" Time="8:18:31 PM" DateTime="2008-09-20T10:18:31.666Z" SessionID="20"><From><User FriendlyName="- James O'"/></From><To><User FriendlyName="Marc. Vladmir Putin- Prime Minister for Action"/></To><Text Style="font-family:MS Shell Dlg; color:#000000; ">Yeh, I'd buy one if I had the cash</Text></Message><Message Date="9/20/2008" Time="8:18:44 PM" DateTime="2008-09-20T10:18:44.457Z" SessionID="20"><From><User FriendlyName="Marc. Vladmir Putin- Prime Minister for Action"/></From><To><User FriendlyName="- James O'"/></To><Text Style="font-family:MS Shell Dlg; color:#000000; ">ive got savings</Text></Message><Message Date="9/20/2008" Time="8:19:05 PM" DateTime="2008-09-20T10:19:05.780Z" SessionID="20"><From><User FriendlyName="Marc. Vladmir Putin- Prime Minister for Action"/></From><To><User FriendlyName="- James O'"/></To><Text Style="font-family:MS Shell Dlg; color:#000000; ">im hopin a wont regret givin up my laptop to mum though...</Text></Message><Message Date="9/20/2008" Time="8:19:09 PM" DateTime="2008-09-20T10:19:09.517Z" SessionID="20"><From><User FriendlyName="- James O'"/></From><To><User FriendlyName="Marc. Vladmir Putin- Prime Minister for Action"/></To><Text Style="font-family:MS Shell Dlg; color:#000000; ">Might be getting some money to make a CD Cover for someone</Text></Message><Message Date="9/20/2008" Time="8:19:23 PM" DateTime="2008-09-20T10:19:23.355Z" SessionID="20"><From><User FriendlyName="Marc. Vladmir Putin- Prime Minister for Action"/></From><To><User FriendlyName="- James O'"/></To><Text Style="font-family:MS Shell Dlg; color:#000000; ">how much?</Text></Message><Message Date="9/20/2008" Time="8:19:26 PM" DateTime="2008-09-20T10:19:26.323Z" SessionID="20"><From><User FriendlyName="- James O'"/></From><To><User FriendlyName="Marc. Vladmir Putin- Prime Minister for Action"/></To><Text Style="font-family:MS Shell Dlg; color:#000000; ">$250</Text></Message><Message Date="9/20/2008" Time="8:19:48 PM" DateTime="2008-09-20T10:19:48.944Z" SessionID="20"><From><User FriendlyName="- James O'"/></From><To><User FriendlyName="Marc. Vladmir Putin- Prime Minister for Action"/></To><Text Style="font-family:MS Shell Dlg; color:#000000; ">and I got $50 from my neighbours for helping them move some furniture</Text></Message><Message Date="9/20/2008" Time="8:19:55 PM" DateTime="2008-09-20T10:19:55.056Z" SessionID="20"><From><User FriendlyName="- James O'"/></From><To><User FriendlyName="Marc. Vladmir Putin- Prime Minister for Action"/></To><Text Style="font-family:MS Shell Dlg; color:#000000; ">so I'll throw that in the bank</Text></Message><Message Date="9/20/2008" Time="8:19:56 PM" DateTime="2008-09-20T10:19:56.681Z" SessionID="20"><From><User FriendlyName="Marc. Vladmir Putin- Prime Minister for Action"/></From><To><User FriendlyName="- James O'"/></To><Text Style="font-family:MS Shell Dlg; color:#000000; ">haha noice</Text></Message><Message Date="9/20/2008" Time="8:20:05 PM" DateTime="2008-09-20T10:20:05.343Z" SessionID="20"><From><User FriendlyName="- James O'"/></From><To><User FriendlyName="Marc. Vladmir Putin- Prime Minister for Action"/></To><Text Style="font-family:MS Shell Dlg; color:#000000; ">not enuf for a windw, but we'll seed</Text></Message><Message Date="9/20/2008" Time="8:20:06 PM" DateTime="2008-09-20T10:20:06.183Z" SessionID="20"><From><User FriendlyName="Marc. Vladmir Putin- Prime Minister for Action"/></From><To><User FriendlyName="- James O'"/></To><Text Style="font-family:MS Shell Dlg; color:#000000; ">12hrs left on crysis btw</Text></Message><Message Date="9/20/2008" Time="8:20:09 PM" DateTime="2008-09-20T10:20:09.462Z" SessionID="20"><From><User FriendlyName="- James O'"/></From><To><User FriendlyName="Marc. Vladmir Putin- Prime Minister for Action"/></To><Text Style="font-family:MS Shell Dlg; color:#000000; ">oh wikked</Text></Message><Message Date="9/20/2008" Time="8:20:18 PM" DateTime="2008-09-20T10:20:18.428Z" SessionID="20"><From><User FriendlyName="- James O'"/></From><To><User FriendlyName="Marc. Vladmir Putin- Prime Minister for Action"/></To><Text Style="font-family:MS Shell Dlg; color:#000000; ">I should have Pure by tommoro morn</Text></Message><Message Date="9/20/2008" Time="8:20:20 PM" DateTime="2008-09-20T10:20:20.462Z" SessionID="20"><From><User FriendlyName="Marc. Vladmir Putin- Prime Minister for Action"/></From><To><User FriendlyName="- James O'"/></To><Text Style="font-family:MS Shell Dlg; color:#000000; ">well if you go back to that link</Text></Message><Message Date="9/20/2008" Time="8:20:29 PM" DateTime="2008-09-20T10:20:29.846Z" SessionID="20"><From><User FriendlyName="Marc. Vladmir Putin- Prime Minister for Action"/></From><To><User FriendlyName="- James O'"/></To><Text Style="font-family:MS Shell Dlg; color:#000000; ">they have 3 cell winds for 499</Text></Message><Message Date="9/20/2008" Time="8:20:39 PM" DateTime="2008-09-20T10:20:39.680Z" SessionID="20"><From><User FriendlyName="Marc. Vladmir Putin- Prime Minister for Action"/></From><To><User FriendlyName="- James O'"/></To><Text Style="font-family:MS Shell Dlg; color:#000000; ">3 cells, and 1gb ram</Text></Message><Message Date="9/20/2008" Time="8:20:40 PM" DateTime="2008-09-20T10:20:40.643Z" SessionID="20"><From><User FriendlyName="- James O'"/></From><To><User FriendlyName="Marc. Vladmir Putin- Prime Minister for Action"/></To><Text Style="font-family:MS Shell Dlg; color:#000000; ">I would want the 6 cell tho</Text></Message><Message Date="9/20/2008" Time="8:20:54 PM" DateTime="2008-09-20T10:20:54.012Z" SessionID="20"><From><User FriendlyName="Marc. Vladmir Putin- Prime Minister for Action"/></From><To><User FriendlyName="- James O'"/></To><Text Style="font-family:MS Shell Dlg; color:#000000; ">$48 for upgrade to 2gb ram.</Text></Message><Message Date="9/20/2008" Time="8:21:04 PM" DateTime="2008-09-20T10:21:04.578Z" SessionID="20"><From><User FriendlyName="Marc. Vladmir Putin- Prime Minister for Action"/></From><To><User FriendlyName="- James O'"/></To><Text Style="font-family:MS Shell Dlg; color:#000000; ">yeah</Text></Message><Message Date="9/20/2008" Time="8:21:26 PM" DateTime="2008-09-20T10:21:26.829Z" SessionID="20"><From><User FriendlyName="Marc. Vladmir Putin- Prime Minister for Action"/></From><To><User FriendlyName="- James O'"/></To><Text Style="font-family:MS Shell Dlg; color:#000000; ">thats the main reason why im getting one</Text></Message><Message Date="9/20/2008" Time="8:21:37 PM" DateTime="2008-09-20T10:21:37.482Z" SessionID="20"><From><User FriendlyName="Marc. Vladmir Putin- Prime Minister for Action"/></From><To><User FriendlyName="- James O'"/></To><Text Style="font-family:MS Shell Dlg; color:#000000; ">so i can use it in more than one lecture before the battery dies</Text></Message><Message Date="9/20/2008" Time="8:21:47 PM" DateTime="2008-09-20T10:21:47.772Z" SessionID="20"><From><User FriendlyName="Marc. Vladmir Putin- Prime Minister for Action"/></From><To><User FriendlyName="- James O'"/></To><Text Style="font-family:MS Shell Dlg; color:#000000; ">ive discovered the joys of writing notes on a laptop</Text></Message><Message Date="9/20/2008" Time="8:21:54 PM" DateTime="2008-09-20T10:21:54.607Z" SessionID="20"><From><User FriendlyName="Marc. Vladmir Putin- Prime Minister for Action"/></From><To><User FriendlyName="- James O'"/></To><Text Style="font-family:MS Shell Dlg; color:#000000; ">i can actually get everything down</Text></Message><Message Date="9/20/2008" Time="8:22:14 PM" DateTime="2008-09-20T10:22:14.701Z" SessionID="20"><From><User FriendlyName="Marc. Vladmir Putin- Prime Minister for Action"/></From><To><User FriendlyName="- James O'"/></To><Text Style="font-family:MS Shell Dlg; color:#000000; ">and its also making me a faster typist...</Text></Message><Message Date="9/20/2008" Time="8:22:22 PM" DateTime="2008-09-20T10:22:22.894Z" SessionID="20"><From><User FriendlyName="- James O'"/></From><To><User FriendlyName="Marc. Vladmir Putin- Prime Minister for Action"/></To><Text Style="font-family:MS Shell Dlg; color:#000000; ">Reading a report now, 5-7 hours battery life on tubro mode, with wifi on, brightness at 50%</Text></Message><Message Date="9/20/2008" Time="8:22:29 PM" DateTime="2008-09-20T10:22:29.226Z" SessionID="20"><From><User FriendlyName="Marc. Vladmir Putin- Prime Minister for Action"/></From><To><User FriendlyName="- James O'"/></To><Text Style="font-family:MS Shell Dlg; color:#000000; ">i can do about 60 words a minute when im copying</Text></Message><Message Date="9/20/2008" Time="8:22:34 PM" DateTime="2008-09-20T10:22:34.341Z" SessionID="20"><From><User FriendlyName="- James O'"/></From><To><User FriendlyName="Marc. Vladmir Putin- Prime Minister for Action"/></To><Text Style="font-family:MS Shell Dlg; color:#000000; ">(turbo, underclocks the system)</Text></Message><Message Date="9/20/2008" Time="8:22:53 PM" DateTime="2008-09-20T10:22:53.511Z" SessionID="20"><From><User FriendlyName="Marc. Vladmir Putin- Prime Minister for Action"/></From><To><User FriendlyName="- James O'"/></To><Text Style="font-family:MS Shell Dlg; color:#000000; ">turbo overclocks....</Text></Message><Message Date="9/20/2008" Time="8:23:12 PM" DateTime="2008-09-20T10:23:12.136Z" SessionID="20"><From><User FriendlyName="- James O'"/></From><To><User FriendlyName="Marc. Vladmir Putin- Prime Minister for Action"/></To><Text Style="font-family:MS Shell Dlg; color:#000000; ">yes</Text></Message><Message Date="9/20/2008" Time="8:23:15 PM" DateTime="2008-09-20T10:23:15.486Z" SessionID="20"><From><User FriendlyName="- James O'"/></From><To><User FriendlyName="Marc. Vladmir Putin- Prime Minister for Action"/></To><Text Style="font-family:MS Shell Dlg; color:#000000; ">genious, no?</Text></Message><Message Date="9/20/2008" Time="8:23:35 PM" DateTime="2008-09-20T10:23:35.643Z" SessionID="20"><From><User FriendlyName="Marc. Vladmir Putin- Prime Minister for Action"/></From><To><User FriendlyName="- James O'"/></To><Text Style="font-family:MS Shell Dlg; color:#000000; ">im confused</Text></Message><Message Date="9/20/2008" Time="8:23:49 PM" DateTime="2008-09-20T10:23:49.635Z" SessionID="20"><From><User FriendlyName="- James O'"/></From><To><User FriendlyName="Marc. Vladmir Putin- Prime Minister for Action"/></To><Text Style="font-family:MS Shell Dlg; color:#000000; ">Turbo, as in turbo battery life, it actually slows things down though</Text></Message><Message Date="9/20/2008" Time="8:23:55 PM" DateTime="2008-09-20T10:23:55.009Z" SessionID="20"><From><User FriendlyName="- James O'"/></From><To><User FriendlyName="Marc. Vladmir Putin- Prime Minister for Action"/></To><Text Style="font-family:MS Shell Dlg; color:#000000; ">but for not taking, it'd be fine I presume</Text></Message><Message Date="9/20/2008" Time="8:23:55 PM" DateTime="2008-09-20T10:23:55.515Z" SessionID="20"><From><User FriendlyName="Marc. Vladmir Putin- Prime Minister for Action"/></From><To><User FriendlyName="- James O'"/></To><Text Style="font-family:MS Shell Dlg; color:#000000; ">haha</Text></Message><Message Date="9/20/2008" Time="8:23:58 PM" DateTime="2008-09-20T10:23:58.189Z" SessionID="20"><From><User FriendlyName="Marc. Vladmir Putin- Prime Minister for Action"/></From><To><User FriendlyName="- James O'"/></To><Text Style="font-family:MS Shell Dlg; color:#000000; ">retarded</Text></Message><Message Date="9/20/2008" Time="8:24:15 PM" DateTime="2008-09-20T10:24:15.240Z" SessionID="20"><From><User FriendlyName="Marc. Vladmir Putin- Prime Minister for Action"/></From><To><User FriendlyName="- James O'"/></To><Text Style="font-family:MS Shell Dlg; color:#000000; ">yeah, its not like word takes a lot of gas</Text></Message><Message Date="9/20/2008" Time="8:25:17 PM" DateTime="2008-09-20T10:25:17.720Z" SessionID="20"><From><User FriendlyName="- James O'"/></From><To><User FriendlyName="Marc. Vladmir Putin- Prime Minister for Action"/></To><Text Style="font-family:MS Shell Dlg; color:#000000; ">indeed</Text></Message><Message Date="9/20/2008" Time="8:25:27 PM" DateTime="2008-09-20T10:25:27.477Z" SessionID="20"><From><User FriendlyName="- James O'"/></From><To><User FriendlyName="Marc. Vladmir Putin- Prime Minister for Action"/></To><Text Style="font-family:MS Shell Dlg; color:#000000; ">Might be able to finagle one for christmas</Text></Message><Message Date="9/20/2008" Time="8:25:35 PM" DateTime="2008-09-20T10:25:35.997Z" SessionID="20"><From><User FriendlyName="- James O'"/></From><To><User FriendlyName="Marc. Vladmir Putin- Prime Minister for Action"/></To><Text Style="font-family:MS Shell Dlg; color:#000000; ">or, after uni I could even seek employment</Text></Message><Message Date="9/20/2008" Time="8:25:40 PM" DateTime="2008-09-20T10:25:40.194Z" SessionID="20"><From><User FriendlyName="Marc. Vladmir Putin- Prime Minister for Action"/></From><To><User FriendlyName="- James O'"/></To><Text Style="font-family:MS Shell Dlg; color:#000000; ">ditto</Text></Message><Message Date="9/20/2008" Time="8:25:50 PM" DateTime="2008-09-20T10:25:50.911Z" SessionID="20"><From><User FriendlyName="Marc. Vladmir Putin- Prime Minister for Action"/></From><To><User FriendlyName="- James O'"/></To><Text Style="font-family:MS Shell Dlg; color:#000000; ">im thinking EB at menai</Text></Message><Message Date="9/20/2008" Time="8:25:59 PM" DateTime="2008-09-20T10:25:59.022Z" SessionID="20"><From><User FriendlyName="Marc. Vladmir Putin- Prime Minister for Action"/></From><To><User FriendlyName="- James O'"/></To><Text Style="font-family:MS Shell Dlg; color:#000000; ">or shit- anywhere...</Text></Message><Message Date="9/20/2008" Time="8:26:00 PM" DateTime="2008-09-20T10:26:00.699Z" SessionID="20"><From><User FriendlyName="- James O'"/></From><To><User FriendlyName="Marc. Vladmir Putin- Prime Minister for Action"/></To><Text Style="font-family:MS Shell Dlg; color:#000000; ">shit, I sware if I had a job, all I'd do is buy gadgets and shit</Text></Message><Message Date="9/20/2008" Time="8:26:02 PM" DateTime="2008-09-20T10:26:02.842Z" SessionID="20"><From><User FriendlyName="Marc. Vladmir Putin- Prime Minister for Action"/></From><To><User FriendlyName="- James O'"/></To><Text Style="font-family:MS Shell Dlg; color:#000000; ">that isnt fast food</Text></Message><Message Date="9/20/2008" Time="8:26:32 PM" DateTime="2008-09-20T10:26:32.768Z" SessionID="20"><From><User FriendlyName="- James O'"/></From><To><User FriendlyName="Marc. Vladmir Putin- Prime Minister for Action"/></To><Text Style="font-family:MS Shell Dlg; color:#000000; ">1TB drives for $153 on ITEstate</Text></Message><Message Date="9/20/2008" Time="8:26:40 PM" DateTime="2008-09-20T10:26:40.053Z" SessionID="20"><From><User FriendlyName="- James O'"/></From><To><User FriendlyName="Marc. Vladmir Putin- Prime Minister for Action"/></To><Text Style="font-family:MS Shell Dlg; color:#000000; ">I'd be on that like a mad man</Text></Message><Message Date="9/20/2008" Time="8:26:46 PM" DateTime="2008-09-20T10:26:46.973Z" SessionID="20"><From><User FriendlyName="- James O'"/></From><To><User FriendlyName="Marc. Vladmir Putin- Prime Minister for Action"/></To><Text Style="font-family:MS Shell Dlg; color:#000000; ">BUY 5 now!!!</Text></Message><Message Date="9/20/2008" Time="8:26:53 PM" DateTime="2008-09-20T10:26:53.019Z" SessionID="20"><From><User FriendlyName="- James O'"/></From><To><User FriendlyName="Marc. Vladmir Putin- Prime Minister for Action"/></To><Text Style="font-family:MS Shell Dlg; color:#000000; ">... if I had a bank account</Text></Message><Message Date="9/20/2008" Time="8:27:19 PM" DateTime="2008-09-20T10:27:19.553Z" SessionID="20"><From><User FriendlyName="Marc. Vladmir Putin- Prime Minister for Action"/></From><To><User FriendlyName="- James O'"/></To><Text Style="font-family:MS Shell Dlg; color:#000000; ">indeed</Text></Message><Message Date="9/20/2008" Time="8:27:43 PM" DateTime="2008-09-20T10:27:43.809Z" SessionID="20"><From><User FriendlyName="Marc. Vladmir Putin- Prime Minister for Action"/></From><To><User FriendlyName="- James O'"/></To><Text Style="font-family:MS Shell Dlg; color:#000000; ">i have like 2grand (i will have like 1grand after i buy that thing) but i cant really access it</Text></Message><Message Date="9/21/2008" Time="10:45:25 PM" DateTime="2008-09-21T12:45:25.048Z" SessionID="21"><From><User FriendlyName="Marc. Vladmir Putin- Prime Minister for Action"/></From><To><User FriendlyName="- James O'"/></To><Text Style="font-family:MS Shell Dlg; color:#000000; ">Hello my bruddah</Text></Message><Message Date="9/21/2008" Time="10:45:36 PM" DateTime="2008-09-21T12:45:36.177Z" SessionID="21"><From><User FriendlyName="- James O'"/></From><To><User FriendlyName="Marc. Vladmir Putin- Prime Minister for Action"/></To><Text Style="font-family:MS Shell Dlg; color:#000000; ">Eevenin</Text></Message><Message Date="9/21/2008" Time="10:45:44 PM" DateTime="2008-09-21T12:45:44.648Z" SessionID="21"><From><User FriendlyName="Marc. Vladmir Putin- Prime Minister for Action"/></From><To><User FriendlyName="- James O'"/></To><Text Style="font-family:MS Shell Dlg; color:#000000; ">I and I be in the stalling of Crysis head of war</Text></Message><Message Date="9/21/2008" Time="10:46:14 PM" DateTime="2008-09-21T12:46:14.454Z" SessionID="21"><From><User FriendlyName="Marc. Vladmir Putin- Prime Minister for Action"/></From><To><User FriendlyName="- James O'"/></To><Text Style="font-family:MS Shell Dlg; color:#000000; ">eh. i cant even type rustapharian..</Text></Message><Message Date="9/21/2008" Time="10:46:51 PM" DateTime="2008-09-21T12:46:51.585Z" SessionID="21"><From><User FriendlyName="Marc. Vladmir Putin- Prime Minister for Action"/></From><To><User FriendlyName="- James O'"/></To><Text Style="font-family:MS Shell Dlg; color:#000000; ">and tomorrow afternoon, i shall be ordering my wind</Text></Message><Message Date="9/21/2008" Time="10:47:11 PM" DateTime="2008-09-21T12:47:11.274Z" SessionID="21"><From><User FriendlyName="Marc. Vladmir Putin- Prime Minister for Action"/></From><To><User FriendlyName="- James O'"/></To><Text Style="font-family:MS Shell Dlg; color:#000000; ">i just gotta transfere me money</Text></Message><Message Date="9/21/2008" Time="10:48:20 PM" DateTime="2008-09-21T12:48:20.668Z" SessionID="21"><From><User FriendlyName="Marc. Vladmir Putin- Prime Minister for Action"/></From><To><User FriendlyName="- James O'"/></To><Text Style="font-family:MS Shell Dlg; color:#000000; ">oh and i might have mentioned that there was a chick in one of my lectures last semester who looks like Natalie Portman- well... unfortunately for our team, i found out tonight that she is a lesbian</Text></Message><Message Date="9/21/2008" Time="10:49:58 PM" DateTime="2008-09-21T12:49:58.989Z" SessionID="21"><From><User FriendlyName="Marc. Vladmir Putin- Prime Minister for Action"/></From><To><User FriendlyName="- James O'"/></To><Text Style="font-family:MS Shell Dlg; color:#000000; ">playin now</Text></Message><Message Date="9/21/2008" Time="10:50:08 PM" DateTime="2008-09-21T12:50:08.800Z" SessionID="21"><From><User FriendlyName="- James O'"/></From><To><User FriendlyName="Marc. Vladmir Putin- Prime Minister for Action"/></To><Text Style="font-family:MS Shell Dlg; color:#000000; ">GL</Text></Message><Message Date="9/22/2008" Time="8:01:52 PM" DateTime="2008-09-22T10:01:52.970Z" SessionID="22"><From><User FriendlyName="- James O'"/></From><To><User FriendlyName="Marc. Vladmir Putin- Prime Minister for Action"/></To><Text Style="font-family:MS Shell Dlg; color:#000000; ">Ay</Text></Message><Message Date="9/22/2008" Time="8:01:55 PM" DateTime="2008-09-22T10:01:55.487Z" SessionID="22"><From><User FriendlyName="- James O'"/></From><To><User FriendlyName="Marc. Vladmir Putin- Prime Minister for Action"/></To><Text Style="font-family:MS Shell Dlg; color:#000000; ">How'd Warhead go?</Text></Message><Message Date="9/22/2008" Time="9:02:12 PM" DateTime="2008-09-22T11:02:12.935Z" SessionID="23"><From><User FriendlyName="Marc. Vladmir Putin- Prime Minister for Action"/></From><To><User FriendlyName="- James O'"/></To><Text>ciao</Text></Message><Message Date="9/22/2008" Time="9:04:07 PM" DateTime="2008-09-22T11:04:07.188Z" SessionID="23"><From><User FriendlyName="Marc. Vladmir Putin- Prime Minister for Action"/></From><To><User FriendlyName="- James O'"/></To><Text>wind runs ET</Text></Message><Message Date="9/22/2008" Time="9:04:09 PM" DateTime="2008-09-22T11:04:09.063Z" SessionID="23"><From><User FriendlyName="Marc. Vladmir Putin- Prime Minister for Action"/></From><To><User FriendlyName="- James O'"/></To><Text>allllll goooood</Text></Message><Message Date="9/22/2008" Time="11:10:06 PM" DateTime="2008-09-22T13:10:06.062Z" SessionID="24"><From><User FriendlyName="Marc. Vladmir Putin- Prime Minister for Action"/></From><To><User FriendlyName="- James O'"/></To><Text Style="font-family:MS Shell Dlg; color:#000000; ">ay</Text></Message><Message Date="9/22/2008" Time="11:10:25 PM" DateTime="2008-09-22T13:10:25.906Z" SessionID="24"><From><User FriendlyName="Marc. Vladmir Putin- Prime Minister for Action"/></From><To><User FriendlyName="- James O'"/></To><Text Style="font-family:MS Shell Dlg; color:#000000; ">do you, by any chance, have flight sim 2002 or 2004?</Text></Message><Message Date="9/22/2008" Time="11:10:35 PM" DateTime="2008-09-22T13:10:35.804Z" SessionID="24"><From><User FriendlyName="Marc. Vladmir Putin- Prime Minister for Action"/></From><To><User FriendlyName="- James O'"/></To><Text Style="font-family:MS Shell Dlg; color:#000000; ">also</Text></Message><Message Date="9/22/2008" Time="11:10:36 PM" DateTime="2008-09-22T13:10:36.497Z" SessionID="24"><From><User FriendlyName="Marc. Vladmir Putin- Prime Minister for Action"/></From><To><User FriendlyName="- James O'"/></To><Text Style="font-family:MS Shell Dlg; color:#000000; ">http://de.sevenload.com/videos/pP4attt-Ausbruch-5</Text></Message><Message Date="9/22/2008" Time="11:10:49 PM" DateTime="2008-09-22T13:10:49.025Z" SessionID="24"><From><User FriendlyName="- James O'"/></From><To><User FriendlyName="Marc. Vladmir Putin- Prime Minister for Action"/></To><Text Style="font-family:MS Shell Dlg; color:#000000; ">I have 2002 and 2004</Text></Message><Message Date="9/22/2008" Time="11:11:09 PM" DateTime="2008-09-22T13:11:09.813Z" SessionID="24"><From><User FriendlyName="- James O'"/></From><To><User FriendlyName="Marc. Vladmir Putin- Prime Minister for Action"/></To><Text Style="font-family:MS Shell Dlg; color:#000000; ">haha that was crazy huh</Text></Message><Message Date="9/22/2008" Time="11:11:14 PM" DateTime="2008-09-22T13:11:14.964Z" SessionID="24"><From><User FriendlyName="- James O'"/></From><To><User FriendlyName="Marc. Vladmir Putin- Prime Minister for Action"/></To><Text Style="font-family:MS Shell Dlg; color:#000000; ">Im very impressed at his skills</Text></Message><Message Date="9/22/2008" Time="11:12:04 PM" DateTime="2008-09-22T13:12:04.881Z" SessionID="24"><From><User FriendlyName="Marc. Vladmir Putin- Prime Minister for Action"/></From><To><User FriendlyName="- James O'"/></To><Text Style="font-family:MS Shell Dlg; color:#000000; ">as am i</Text></Message><Message Date="9/22/2008" Time="11:12:13 PM" DateTime="2008-09-22T13:12:13.818Z" SessionID="24"><From><User FriendlyName="Marc. Vladmir Putin- Prime Minister for Action"/></From><To><User FriendlyName="- James O'"/></To><Text Style="font-family:MS Shell Dlg; color:#000000; ">im totally stealing at least one of them</Text></Message><Message Date="9/22/2008" Time="11:12:23 PM" DateTime="2008-09-22T13:12:23.624Z" SessionID="24"><From><User FriendlyName="Marc. Vladmir Putin- Prime Minister for Action"/></From><To><User FriendlyName="- James O'"/></To><Text Style="font-family:MS Shell Dlg; color:#000000; ">they both run on the wind</Text></Message><Message Date="9/22/2008" Time="11:13:07 PM" DateTime="2008-09-22T13:13:07.271Z" SessionID="24"><From><User FriendlyName="- James O'"/></From><To><User FriendlyName="Marc. Vladmir Putin- Prime Minister for Action"/></To><Text Style="font-family:MS Shell Dlg; color:#000000; ">coolio</Text></Message><Message Date="9/22/2008" Time="11:13:18 PM" DateTime="2008-09-22T13:13:18.692Z" SessionID="24"><From><User FriendlyName="- James O'"/></From><To><User FriendlyName="Marc. Vladmir Putin- Prime Minister for Action"/></To><Text Style="font-family:MS Shell Dlg; color:#000000; ">altho, i'd recommend combat flight sim 1</Text></Message><Message Date="9/22/2008" Time="11:13:33 PM" DateTime="2008-09-22T13:13:33.235Z" SessionID="24"><From><User FriendlyName="- James O'"/></From><To><User FriendlyName="Marc. Vladmir Putin- Prime Minister for Action"/></To><Text Style="font-family:MS Shell Dlg; color:#000000; ">Its a bit more arcadey, quicker action, good to jump in for 5-10 minutes</Text></Message><Message Date="9/22/2008" Time="11:13:42 PM" DateTime="2008-09-22T13:13:42.146Z" SessionID="24"><From><User FriendlyName="- James O'"/></From><To><User FriendlyName="Marc. Vladmir Putin- Prime Minister for Action"/></To><Text Style="font-family:MS Shell Dlg; color:#000000; ">Bit older, but still holds up ok</Text></Message><Message Date="9/22/2008" Time="11:14:39 PM" DateTime="2008-09-22T13:14:39.842Z" SessionID="24"><From><User FriendlyName="- James O'"/></From><To><User FriendlyName="Marc. Vladmir Putin- Prime Minister for Action"/></To><Text Style="font-family:MS Shell Dlg; color:#000000; ">I bought that too</Text></Message><Message Date="9/22/2008" Time="11:14:52 PM" DateTime="2008-09-22T13:14:52.170Z" SessionID="24"><From><User FriendlyName="Marc. Vladmir Putin- Prime Minister for Action"/></From><To><User FriendlyName="- James O'"/></To><Text Style="font-family:MS Shell Dlg; color:#000000; ">mhmm</Text></Message><Message Date="9/22/2008" Time="11:14:54 PM" DateTime="2008-09-22T13:14:54.497Z" SessionID="24"><From><User FriendlyName="- James O'"/></From><To><User FriendlyName="Marc. Vladmir Putin- Prime Minister for Action"/></To><Text Style="font-family:MS Shell Dlg; color:#000000; ">I think its more fun than FS</Text></Message><Message Date="9/22/2008" Time="11:14:59 PM" DateTime="2008-09-22T13:14:59.984Z" SessionID="24"><From><User FriendlyName="- James O'"/></From><To><User FriendlyName="Marc. Vladmir Putin- Prime Minister for Action"/></To><Text Style="font-family:MS Shell Dlg; color:#000000; ">being it has objectives</Text></Message><Message Date="9/22/2008" Time="11:15:15 PM" DateTime="2008-09-22T13:15:15.295Z" SessionID="24"><From><User FriendlyName="Marc. Vladmir Putin- Prime Minister for Action"/></From><To><User FriendlyName="- James O'"/></To><Text Style="font-family:MS Shell Dlg; color:#000000; ">mhmm</Text></Message><Message Date="9/22/2008" Time="11:15:45 PM" DateTime="2008-09-22T13:15:45.789Z" SessionID="24"><From><User FriendlyName="Marc. Vladmir Putin- Prime Minister for Action"/></From><To><User FriendlyName="- James O'"/></To><Text Style="font-family:MS Shell Dlg; color:#000000; ">i think id go for fs more though, since i would be playing off of a keyboard</Text></Message><Message Date="9/22/2008" Time="11:15:54 PM" DateTime="2008-09-22T13:15:54.153Z" SessionID="24"><From><User FriendlyName="Marc. Vladmir Putin- Prime Minister for Action"/></From><To><User FriendlyName="- James O'"/></To><Text Style="font-family:MS Shell Dlg; color:#000000; ">and touchpad</Text></Message><Message Date="9/22/2008" Time="11:16:24 PM" DateTime="2008-09-22T13:16:24.824Z" SessionID="24"><From><User FriendlyName="- James O'"/></From><To><User FriendlyName="Marc. Vladmir Putin- Prime Minister for Action"/></To><Text Style="font-family:MS Shell Dlg; color:#000000; ">f/e I aint played FS in a while, but I found it dull after a while</Text></Message><Message Date="9/22/2008" Time="11:16:31 PM" DateTime="2008-09-22T13:16:31.293Z" SessionID="24"><From><User FriendlyName="- James O'"/></From><To><User FriendlyName="Marc. Vladmir Putin- Prime Minister for Action"/></To><Text Style="font-family:MS Shell Dlg; color:#000000; ">sorta had to make your own fun</Text></Message><Message Date="9/22/2008" Time="11:16:45 PM" DateTime="2008-09-22T13:16:45.819Z" SessionID="24"><From><User FriendlyName="- James O'"/></From><To><User FriendlyName="Marc. Vladmir Putin- Prime Minister for Action"/></To><Text Style="font-family:MS Shell Dlg; color:#000000; ">but ay, I can fang ya both, make up your own mind</Text></Message><Message Date="9/22/2008" Time="11:16:49 PM" DateTime="2008-09-22T13:16:49.521Z" SessionID="24"><From><User FriendlyName="Marc. Vladmir Putin- Prime Minister for Action"/></From><To><User FriendlyName="- James O'"/></To><Text Style="font-family:MS Shell Dlg; color:#000000; ">i rekon it would be good for semi concentrated flying during lectures</Text></Message><Message Date="9/22/2008" Time="11:17:01 PM" DateTime="2008-09-22T13:17:01.154Z" SessionID="24"><From><User FriendlyName="- James O'"/></From><To><User FriendlyName="Marc. Vladmir Putin- Prime Minister for Action"/></To><Text Style="font-family:MS Shell Dlg; color:#000000; ">yeah, that coobe cool</Text></Message><Message Date="9/22/2008" Time="11:17:14 PM" DateTime="2008-09-22T13:17:14.911Z" SessionID="24"><From><User FriendlyName="- James O'"/></From><To><User FriendlyName="Marc. Vladmir Putin- Prime Minister for Action"/></To><Text Style="font-family:MS Shell Dlg; color:#000000; ">I shood be able to fight FS and CFS on a dvd anyways</Text></Message><Message Date="9/22/2008" Time="11:17:24 PM" DateTime="2008-09-22T13:17:24.063Z" SessionID="24"><From><User FriendlyName="- James O'"/></From><To><User FriendlyName="Marc. Vladmir Putin- Prime Minister for Action"/></To><Text Style="font-family:MS Shell Dlg; color:#000000; ">if I rip em to ISO's</Text></Message><Message Date="9/22/2008" Time="11:17:28 PM" DateTime="2008-09-22T13:17:28.070Z" SessionID="24"><From><User FriendlyName="- James O'"/></From><To><User FriendlyName="Marc. Vladmir Putin- Prime Minister for Action"/></To><Text Style="font-family:MS Shell Dlg; color:#000000; ">anyway's, I gtg</Text></Message><Message Date="9/22/2008" Time="11:17:32 PM" DateTime="2008-09-22T13:17:32.741Z" SessionID="24"><From><User FriendlyName="- James O'"/></From><To><User FriendlyName="Marc. Vladmir Putin- Prime Minister for Action"/></To><Text Style="font-family:MS Shell Dlg; color:#000000; ">tired as hell</Text></Message><Message Date="9/22/2008" Time="11:17:35 PM" DateTime="2008-09-22T13:17:35.846Z" SessionID="24"><From><User FriendlyName="Marc. Vladmir Putin- Prime Minister for Action"/></From><To><User FriendlyName="- James O'"/></To><Text Style="font-family:MS Shell Dlg; color:#000000; ">night dude</Text></Message><Message Date="9/22/2008" Time="11:17:42 PM" DateTime="2008-09-22T13:17:42.085Z" SessionID="24"><From><User FriendlyName="- James O'"/></From><To><User FriendlyName="Marc. Vladmir Putin- Prime Minister for Action"/></To><Text Style="font-family:MS Shell Dlg; color:#000000; ">Seaosn 3 of heroes will be out like 12-1ish tommoro</Text></Message><Message Date="9/22/2008" Time="11:17:46 PM" DateTime="2008-09-22T13:17:46.813Z" SessionID="24"><From><User FriendlyName="Marc. Vladmir Putin- Prime Minister for Action"/></From><To><User FriendlyName="- James O'"/></To><Text Style="font-family:MS Shell Dlg; color:#000000; ">nice</Text></Message><Message Date="9/22/2008" Time="11:18:03 PM" DateTime="2008-09-22T13:18:03.971Z" SessionID="24"><From><User FriendlyName="Marc. Vladmir Putin- Prime Minister for Action"/></From><To><User FriendlyName="- James O'"/></To><Text Style="font-family:MS Shell Dlg; color:#000000; ">have a good one</Text></Message><Message Date="9/22/2008" Time="11:18:07 PM" DateTime="2008-09-22T13:18:07.531Z" SessionID="24"><From><User FriendlyName="- James O'"/></From><To><User FriendlyName="Marc. Vladmir Putin- Prime Minister for Action"/></To><Text Style="font-family:MS Shell Dlg; color:#000000; ">yeah u 2</Text></Message><Message Date="9/22/2008" Time="11:18:09 PM" DateTime="2008-09-22T13:18:09.601Z" SessionID="24"><From><User FriendlyName="- James O'"/></From><To><User FriendlyName="Marc. Vladmir Putin- Prime Minister for Action"/></To><Text Style="font-family:MS Shell Dlg; color:#000000; ">catcha round</Text></Message><Message Date="9/29/2008" Time="11:45:11 PM" DateTime="2008-09-29T13:45:11.971Z" SessionID="25"><From><User FriendlyName="- James O'"/></From><To><User FriendlyName="Marc"/></To><Text Style="font-family:MS Shell Dlg; color:#000000; ">Ay</Text></Message><Message Date="9/29/2008" Time="11:46:01 PM" DateTime="2008-09-29T13:46:01.938Z" SessionID="25"><From><User FriendlyName="- James O'"/></From><To><User FriendlyName="Marc"/></To><Text Style="font-family:MS Shell Dlg; color:#000000; ">I saw a wind today</Text></Message><Message Date="9/29/2008" Time="11:47:46 PM" DateTime="2008-09-29T13:47:46.943Z" SessionID="25"><From><User FriendlyName="- James O'"/></From><To><User FriendlyName="Marc"/></To><Text Style="font-family:MS Shell Dlg; color:#000000; ">pertey</Text></Message><Message Date="9/29/2008" Time="11:52:07 PM" DateTime="2008-09-29T13:52:07.017Z" SessionID="26"><From><User FriendlyName="- James O'"/></From><To><User FriendlyName="Marc"/></To><Text Style="font-family:MS Shell Dlg; color:#000000; ">msg us when it comes!</Text></Message><Message Date="9/30/2008" Time="1:52:35 PM" DateTime="2008-09-30T03:52:35.151Z" SessionID="27"><From><User FriendlyName="- James O'"/></From><To><User FriendlyName="Marc"/></To><Text Style="font-family:MS Shell Dlg; color:#000000; ">wind get?</Text></Message><Message Date="10/1/2008" Time="10:18:33 AM" DateTime="2008-10-01T00:18:33.787Z" SessionID="28"><From><User FriendlyName="- James O'"/></From><To><User FriendlyName="Marc"/></To><Text Style="font-family:MS Shell Dlg; color:#000000; ">get ya wind yet?</Text></Message><Message Date="10/1/2008" Time="10:19:20 AM" DateTime="2008-10-01T00:19:20.322Z" SessionID="29"><From><User FriendlyName="Marc"/></From><To><User FriendlyName="- James O'"/></To><Text Style="font-family:MS Shell Dlg; color:#000000; ">yep</Text></Message><Message Date="10/1/2008" Time="10:19:31 AM" DateTime="2008-10-01T00:19:31.201Z" SessionID="29"><From><User FriendlyName="Marc"/></From><To><User FriendlyName="- James O'"/></To><Text Style="font-family:MS Shell Dlg; color:#000000; ">got it on monday arvo</Text></Message><Message Date="10/1/2008" Time="10:20:08 AM" DateTime="2008-10-01T00:20:08.026Z" SessionID="29"><From><User FriendlyName="Marc"/></From><To><User FriendlyName="- James O'"/></To><Text Style="font-family:MS Shell Dlg; color:#000000; ">brb</Text></Message><Message Date="10/1/2008" Time="10:59:48 AM" DateTime="2008-10-01T00:59:48.585Z" SessionID="30"><From><User FriendlyName="Marc"/></From><To><User FriendlyName="- James O'"/></To><Text Style="font-family:MS Shell Dlg; color:#000000; ">back</Text></Message><Message Date="10/1/2008" Time="11:00:04 AM" DateTime="2008-10-01T01:00:04.271Z" SessionID="30"><From><User FriendlyName="Marc"/></From><To><User FriendlyName="- James O'"/></To><Text Style="font-family:MS Shell Dlg; color:#000000; ">ok, so i have 50gb to download. anything you want?</Text></Message><Message Date="10/1/2008" Time="11:00:17 AM" DateTime="2008-10-01T01:00:17.599Z" SessionID="30"><From><User FriendlyName="Marc"/></From><To><User FriendlyName="- James O'"/></To><Text Style="font-family:MS Shell Dlg; color:#000000; ">(that I'm not going to be ashamed to download?</Text></Message><Message Date="10/1/2008" Time="11:00:21 AM" DateTime="2008-10-01T01:00:21.588Z" SessionID="30"><From><User FriendlyName="Marc"/></From><To><User FriendlyName="- James O'"/></To><Text Style="font-family:MS Shell Dlg; color:#000000; ">)</Text></Message><Message Date="10/1/2008" Time="11:38:33 AM" DateTime="2008-10-01T01:38:33.906Z" SessionID="30"><From><User FriendlyName="Marc"/></From><To><User FriendlyName="- James O'"/></To><Text Style="font-family:MS Shell Dlg; color:#000000; ">ok. so far on the download queue:</Text></Message><Message Date="10/1/2008" Time="11:39:29 AM" DateTime="2008-10-01T01:39:29.769Z" SessionID="30"><From><User FriendlyName="Marc"/></From><To><User FriendlyName="- James O'"/></To><Text Style="font-family:MS Shell Dlg; color:#000000; ">indian jones and kingdom of the crystal skull dvd rip
stalker clearsky
battalion wars 2
the witcher enhanced edition</Text></Message><Message Date="10/1/2008" Time="11:41:49 AM" DateTime="2008-10-01T01:41:49.463Z" SessionID="30"><From><User FriendlyName="- James O'"/></From><To><User FriendlyName="Marc"/></To><Text Style="font-family:MS Shell Dlg; color:#000000; ">I grabbed news eps of heroes, ugly betty, gossip girl and dexter this morning</Text></Message><Message Date="10/1/2008" Time="11:41:58 AM" DateTime="2008-10-01T01:41:58.629Z" SessionID="30"><From><User FriendlyName="- James O'"/></From><To><User FriendlyName="Marc"/></To><Text Style="font-family:MS Shell Dlg; color:#000000; ">so im good</Text></Message><Message Date="10/1/2008" Time="11:42:43 AM" DateTime="2008-10-01T01:42:43.664Z" SessionID="30"><From><User FriendlyName="Marc"/></From><To><User FriendlyName="- James O'"/></To><Text Style="font-family:MS Shell Dlg; color:#000000; ">well ill be getting fallout 3 the moment its released.</Text></Message><Message Date="10/1/2008" Time="11:42:50 AM" DateTime="2008-10-01T01:42:50.127Z" SessionID="30"><From><User FriendlyName="- James O'"/></From><To><User FriendlyName="Marc"/></To><Text Style="font-family:MS Shell Dlg; color:#000000; ">soon?</Text></Message><Message Date="10/1/2008" Time="11:44:26 AM" DateTime="2008-10-01T01:44:26.451Z" SessionID="30"><From><User FriendlyName="- James O'"/></From><To><User FriendlyName="Marc"/></To><Text Style="font-family:MS Shell Dlg; color:#000000; ">oh and hows the wind? Liking it?</Text></Message><Message Date="10/1/2008" Time="11:45:06 AM" DateTime="2008-10-01T01:45:06.411Z" SessionID="30"><From><User FriendlyName="Marc"/></From><To><User FriendlyName="- James O'"/></To><Text Style="font-family:MS Shell Dlg; color:#000000; ">yea its good</Text></Message><Message Date="10/1/2008" Time="11:45:17 AM" DateTime="2008-10-01T01:45:17.634Z" SessionID="30"><From><User FriendlyName="Marc"/></From><To><User FriendlyName="- James O'"/></To><Text Style="font-family:MS Shell Dlg; color:#000000; ">im getting used to the layout a bit</Text></Message><Message Date="10/1/2008" Time="11:45:27 AM" DateTime="2008-10-01T01:45:27.331Z" SessionID="30"><From><User FriendlyName="Marc"/></From><To><User FriendlyName="- James O'"/></To><Text Style="font-family:MS Shell Dlg; color:#000000; ">the touchpad is super sensitive because its so small</Text></Message><Message Date="10/1/2008" Time="11:45:46 AM" DateTime="2008-10-01T01:45:46.487Z" SessionID="30"><From><User FriendlyName="Marc"/></From><To><User FriendlyName="- James O'"/></To><Text Style="font-family:MS Shell Dlg; color:#000000; ">and i keep on accidentally bumping it and selecting somewhere else in my sentences</Text></Message><Message Date="10/1/2008" Time="11:46:00 AM" DateTime="2008-10-01T01:46:00.964Z" SessionID="30"><From><User FriendlyName="Marc"/></From><To><User FriendlyName="- James O'"/></To><Text Style="font-family:MS Shell Dlg; color:#000000; ">and i keep on pressing = instead of backspace</Text></Message><Message Date="10/1/2008" Time="11:46:27 AM" DateTime="2008-10-01T01:46:27.916Z" SessionID="30"><From><User FriendlyName="Marc"/></From><To><User FriendlyName="- James O'"/></To><Text Style="font-family:MS Shell Dlg; color:#000000; ">it is struggling a little bit with morrowind, but not too much</Text></Message><Message Date="10/1/2008" Time="11:46:41 AM" DateTime="2008-10-01T01:46:41.712Z" SessionID="30"><From><User FriendlyName="Marc"/></From><To><User FriendlyName="- James O'"/></To><Text Style="font-family:MS Shell Dlg; color:#000000; ">it just drops the view distance a bit to close for my liking</Text></Message><Message Date="10/1/2008" Time="11:46:49 AM" DateTime="2008-10-01T01:46:49.089Z" SessionID="30"><From><User FriendlyName="Marc"/></From><To><User FriendlyName="- James O'"/></To><Text Style="font-family:MS Shell Dlg; color:#000000; ">makes a few quests a bit to hard and such</Text></Message><Message Date="10/1/2008" Time="11:49:04 AM" DateTime="2008-10-01T01:49:04.713Z" SessionID="30"><From><User FriendlyName="- James O'"/></From><To><User FriendlyName="Marc"/></To><Text Style="font-family:MS Shell Dlg; color:#000000; ">I saw one at miranda monday</Text></Message><Message Date="10/1/2008" Time="11:49:09 AM" DateTime="2008-10-01T01:49:09.990Z" SessionID="30"><From><User FriendlyName="- James O'"/></From><To><User FriendlyName="Marc"/></To><Text Style="font-family:MS Shell Dlg; color:#000000; ">looked pretty</Text></Message><Message Date="10/1/2008" Time="11:49:17 AM" DateTime="2008-10-01T01:49:17.093Z" SessionID="30"><From><User FriendlyName="- James O'"/></From><To><User FriendlyName="Marc"/></To><Text Style="font-family:MS Shell Dlg; color:#000000; ">size and weight all Aok?</Text></Message><Message Date="10/1/2008" Time="11:49:31 AM" DateTime="2008-10-01T01:49:31.117Z" SessionID="30"><From><User FriendlyName="Marc"/></From><To><User FriendlyName="- James O'"/></To><Text Style="font-family:MS Shell Dlg; color:#000000; ">yeha</Text></Message><Message Date="10/1/2008" Time="11:49:47 AM" DateTime="2008-10-01T01:49:47.570Z" SessionID="30"><From><User FriendlyName="Marc"/></From><To><User FriendlyName="- James O'"/></To><Text Style="font-family:MS Shell Dlg; color:#000000; ">the 6 cell isnt flush with the bottom</Text></Message><Message Date="10/1/2008" Time="11:50:05 AM" DateTime="2008-10-01T01:50:05.282Z" SessionID="30"><From><User FriendlyName="Marc"/></From><To><User FriendlyName="- James O'"/></To><Text Style="font-family:MS Shell Dlg; color:#000000; ">which it actually handy when you're typing because it lifts it up enough to give you a better angle</Text></Message><Message Date="10/1/2008" Time="11:50:26 AM" DateTime="2008-10-01T01:50:26.638Z" SessionID="30"><From><User FriendlyName="Marc"/></From><To><User FriendlyName="- James O'"/></To><Text Style="font-family:MS Shell Dlg; color:#000000; ">but it means that it is a little prone to rolling backwards if you're not careful </Text></Message><Message Date="10/1/2008" Time="11:51:27 AM" DateTime="2008-10-01T01:51:27.513Z" SessionID="30"><From><User FriendlyName="Marc"/></From><To><User FriendlyName="- James O'"/></To><Text Style="font-family:MS Shell Dlg; color:#000000; ">also, its meant to get an extra few hours on the battery saving mode, but either the battery time estimate is off or its not turning on.</Text></Message><Message Date="10/1/2008" Time="11:51:45 AM" DateTime="2008-10-01T01:51:45.712Z" SessionID="30"><From><User FriendlyName="Marc"/></From><To><User FriendlyName="- James O'"/></To><Text Style="font-family:MS Shell Dlg; color:#000000; ">my guess is the first since those things are rather inaccurate</Text></Message><Message Date="10/1/2008" Time="11:52:15 AM" DateTime="2008-10-01T01:52:15.869Z" SessionID="30"><From><User FriendlyName="Marc"/></From><To><User FriendlyName="- James O'"/></To><Text Style="font-family:MS Shell Dlg; color:#000000; ">oh do you know if i can somehow change the outputs for my audio?</Text></Message><Message Date="10/1/2008" Time="11:52:25 AM" DateTime="2008-10-01T01:52:25.466Z" SessionID="30"><From><User FriendlyName="Marc"/></From><To><User FriendlyName="- James O'"/></To><Text Style="font-family:MS Shell Dlg; color:#000000; ">cause my green port is dead</Text></Message><Message Date="10/1/2008" Time="11:52:47 AM" DateTime="2008-10-01T01:52:47.735Z" SessionID="30"><From><User FriendlyName="Marc"/></From><To><User FriendlyName="- James O'"/></To><Text Style="font-family:MS Shell Dlg; color:#000000; ">but the ac97 stuff wont let me switch the green port..</Text></Message><Message Date="10/1/2008" Time="11:52:57 AM" DateTime="2008-10-01T01:52:57.843Z" SessionID="30"><From><User FriendlyName="- James O'"/></From><To><User FriendlyName="Marc"/></To><Text Style="font-family:MS Shell Dlg; color:#0000