<?xml version="1.0"?>
<?xml-stylesheet type='text/xsl' href='MessageLog.xsl'?>
<Log FirstSessionID="1" LastSessionID="31"><Message Date="9/7/2008" Time="12:24:01 PM" DateTime="2008-09-07T02:24:01.176Z" SessionID="1"><From><User FriendlyName="Patrick"/></From><To><User FriendlyName="- James O'"/></To><Text Style="font-family:Times New Roman; color:#000000; ">Hey who is this?</Text></Message><Message Date="9/7/2008" Time="12:24:05 PM" DateTime="2008-09-07T02:24:05.620Z" SessionID="1"><From><User FriendlyName="Patrick"/></From><To><User FriendlyName="- James O'"/></To><Text Style="font-family:Times New Roman; color:#000000; ">lol, i joke, i joke</Text></Message><Message Date="9/7/2008" Time="12:24:12 PM" DateTime="2008-09-07T02:24:12.949Z" SessionID="1"><From><User FriendlyName="- James O'"/></From><To><User FriendlyName="Patrick"/></To><Text Style="font-family:MS Shell Dlg; color:#000000; ">lol Ive got like 10 of those already</Text></Message><Message Date="9/7/2008" Time="12:24:30 PM" DateTime="2008-09-07T02:24:30.420Z" SessionID="1"><From><User FriendlyName="Patrick"/></From><To><User FriendlyName="- James O'"/></To><Text Style="font-family:Times New Roman; color:#000000; ">You'd think they read the personal display name message</Text></Message><Message Date="9/7/2008" Time="12:24:36 PM" DateTime="2008-09-07T02:24:36.925Z" SessionID="1"><From><User FriendlyName="Patrick"/></From><To><User FriendlyName="- James O'"/></To><Text Style="font-family:Times New Roman; color:#000000; ">but then again who reads the fine print, lol</Text></Message><Message Date="9/7/2008" Time="4:04:56 PM" DateTime="2008-09-07T06:04:56.971Z" SessionID="2"><From><User FriendlyName="- James O'"/></From><To><User FriendlyName="Patrick"/></To><Text Style="font-family:MS Shell Dlg; color:#000000; ">http://cache.gizmodo.com/assets/images/gizmodo/2008/09/chrome1.jpg</Text></Message><Message Date="9/7/2008" Time="4:05:07 PM" DateTime="2008-09-07T06:05:07.030Z" SessionID="2"><From><User FriendlyName="- James O'"/></From><To><User FriendlyName="Patrick"/></To><Text Style="font-family:MS Shell Dlg; color:#000000; ">people finally realised why google is evil with the release of there browser</Text></Message><Message Date="9/7/2008" Time="4:05:59 PM" DateTime="2008-09-07T06:05:59.492Z" SessionID="3"><From><User FriendlyName="Patrick"/></From><To><User FriendlyName="- James O'"/></To><Text Style="font-family:MS Shell Dlg; color:#000000; ">not getting it</Text></Message><Message Date="9/7/2008" Time="4:06:15 PM" DateTime="2008-09-07T06:06:15.525Z" SessionID="3"><From><User FriendlyName="- James O'"/></From><To><User FriendlyName="Patrick"/></To><Text Style="font-family:MS Shell Dlg; color:#000000; ">oh</Text></Message><Message Date="9/7/2008" Time="4:06:35 PM" DateTime="2008-09-07T06:06:35.434Z" SessionID="3"><From><User FriendlyName="- James O'"/></From><To><User FriendlyName="Patrick"/></To><Text Style="font-family:MS Shell Dlg; color:#000000; ">thats picture 1</Text></Message><Message Date="9/7/2008" Time="4:06:37 PM" DateTime="2008-09-07T06:06:37.849Z" SessionID="3"><From><User FriendlyName="- James O'"/></From><To><User FriendlyName="Patrick"/></To><Text Style="font-family:MS Shell Dlg; color:#000000; ">http://gizmodo.com/5046344/google-chrome-fatal-flaw-discovered-will-destroy-lives-dignities</Text></Message><Message Date="9/7/2008" Time="4:06:59 PM" DateTime="2008-09-07T06:06:59.542Z" SessionID="3"><From><User FriendlyName="Patrick"/></From><To><User FriendlyName="- James O'"/></To><Text Style="font-family:MS Shell Dlg; color:#000000; ">g2g, will view pics though, ty and cya</Text></Message><Message Date="9/14/2008" Time="4:20:11 PM" DateTime="2008-09-14T06:20:11.673Z" SessionID="4"><From><User FriendlyName="Patrick"/></From><To><User FriendlyName="- James O'"/></To><Text Style="font-family:Times New Roman; color:#000000; ">heh heh heh, nice display name</Text></Message><Message Date="9/14/2008" Time="7:05:20 PM" DateTime="2008-09-14T09:05:20.367Z" SessionID="5"><From><User FriendlyName="- James O'"/></From><To><User FriendlyName="Patrick"/></To><Text Style="font-family:MS Shell Dlg; color:#000000; ">http://www.tribalwar.com/forums/showthread.php?t=557071</Text></Message><Message Date="9/14/2008" Time="11:12:08 PM" DateTime="2008-09-14T13:12:08.717Z" SessionID="6"><From><User FriendlyName="- James O'"/></From><To><User FriendlyName="Patrick"/></To><Text Style="font-family:MS Shell Dlg; color:#000000; ">http://vimeo.com/1654340</Text></Message><Message Date="10/11/2008" Time="2:47:39 PM" DateTime="2008-10-11T03:47:39.059Z" SessionID="7"><From><User FriendlyName="- James O'"/></From><To><User FriendlyName="Patrick G"/></To><Text Style="font-family:MS Shell Dlg; color:#000000; ">GTA San Andreas rip, 64kb &gt; 600mb</Text></Message><Message Date="10/11/2008" Time="2:47:47 PM" DateTime="2008-10-11T03:47:47.385Z" SessionID="7"><From><User FriendlyName="- James O'"/></From><To><User FriendlyName="Patrick G"/></To><Text Style="font-family:MS Shell Dlg; color:#000000; ">got compression?</Text></Message><Message Date="10/11/2008" Time="2:47:51 PM" DateTime="2008-10-11T03:47:51.705Z" SessionID="7"><From><User FriendlyName="- James O'"/></From><To><User FriendlyName="Patrick G"/></To><Text Style="font-family:MS Shell Dlg; color:#000000; ">Takes 5 hours to decompress</Text></Message><Message Date="10/11/2008" Time="2:47:52 PM" DateTime="2008-10-11T03:47:52.448Z" SessionID="7"><From><User FriendlyName="- James O'"/></From><To><User FriendlyName="Patrick G"/></To><Text Style="font-family:MS Shell Dlg; color:#000000; ">haha</Text></Message><Message Date="10/11/2008" Time="3:32:30 PM" DateTime="2008-10-11T04:32:30.133Z" SessionID="8"><From><User FriendlyName="Patrick G"/></From><To><User FriendlyName="- James O'"/></To><Text Style="font-family:MS Shell Dlg; color:#000000; ">I've got that game already, but thanks man</Text></Message><Message Date="10/11/2008" Time="3:32:34 PM" DateTime="2008-10-11T04:32:34.519Z" SessionID="8"><From><User FriendlyName="Patrick G"/></From><To><User FriendlyName="- James O'"/></To><Text Style="font-family:MS Shell Dlg; color:#000000; ">hey do you have any NFS?</Text></Message><Message Date="10/11/2008" Time="3:32:48 PM" DateTime="2008-10-11T04:32:48.843Z" SessionID="8"><From><User FriendlyName="Patrick G"/></From><To><User FriendlyName="- James O'"/></To><Text Style="font-family:MS Shell Dlg; color:#000000; ">I am looking crazily for them, DSE has them but not in my local sotre</Text></Message><Message Date="10/11/2008" Time="3:33:05 PM" DateTime="2008-10-11T04:33:05.332Z" SessionID="8"><From><User FriendlyName="Patrick G"/></From><To><User FriendlyName="- James O'"/></To><Text Style="font-family:MS Shell Dlg; color:#000000; ">I am looking at Need For Speed Most wanted :P</Text></Message><Message Date="10/11/2008" Time="3:34:41 PM" DateTime="2008-10-11T04:34:41.011Z" SessionID="8"><From><User FriendlyName="- James O'"/></From><To><User FriendlyName="Patrick G"/></To><Text Style="font-family:MS Shell Dlg; color:#000000; ">yeah</Text></Message><Message Date="10/11/2008" Time="3:35:26 PM" DateTime="2008-10-11T04:35:26.030Z" SessionID="8"><From><User FriendlyName="- James O'"/></From><To><User FriendlyName="Patrick G"/></To><Text Style="font-family:MS Shell Dlg; color:#000000; ">I got underground 1 (better than 2 imo), most wanted, I had carbon but I deleted it and I got the latest one, pro street, but I found the handling to be a total pain. I also have Grid: Race Driver</Text></Message><Message Date="10/11/2008" Time="3:35:41 PM" DateTime="2008-10-11T04:35:41.624Z" SessionID="8"><From><User FriendlyName="Patrick G"/></From><To><User FriendlyName="- James O'"/></To><Text Style="font-family:MS Shell Dlg; color:#000000; ">Juiced?</Text></Message><Message Date="10/11/2008" Time="3:35:44 PM" DateTime="2008-10-11T04:35:44.299Z" SessionID="8"><From><User FriendlyName="- James O'"/></From><To><User FriendlyName="Patrick G"/></To><Text Style="font-family:MS Shell Dlg; color:#000000; ">and Dirt, the last colin mcrae game before he died</Text></Message><Message Date="10/11/2008" Time="3:35:49 PM" DateTime="2008-10-11T04:35:49.794Z" SessionID="8"><From><User FriendlyName="- James O'"/></From><To><User FriendlyName="Patrick G"/></To><Text Style="font-family:MS Shell Dlg; color:#000000; ">Nah, never bothered, it good</Text></Message><Message Date="10/11/2008" Time="3:35:50 PM" DateTime="2008-10-11T04:35:50.502Z" SessionID="8"><From><User FriendlyName="Patrick G"/></From><To><User FriendlyName="- James O'"/></To><Text Style="font-family:MS Shell Dlg; color:#000000; ">i hear that has Sydney, i want i want, lol</Text></Message><Message Date="10/11/2008" Time="3:35:57 PM" DateTime="2008-10-11T04:35:57.826Z" SessionID="8"><From><User FriendlyName="- James O'"/></From><To><User FriendlyName="Patrick G"/></To><Text Style="font-family:MS Shell Dlg; color:#000000; ">1 or 2?</Text></Message><Message Date="10/11/2008" Time="3:36:03 PM" DateTime="2008-10-11T04:36:03.715Z" SessionID="8"><From><User FriendlyName="Patrick G"/></From><To><User FriendlyName="- James O'"/></To><Text Style="font-family:MS Shell Dlg; color:#000000; ">hot imports night</Text></Message><Message Date="10/11/2008" Time="3:36:15 PM" DateTime="2008-10-11T04:36:15.065Z" SessionID="8"><From><User FriendlyName="- James O'"/></From><To><User FriendlyName="Patrick G"/></To><Text Style="font-family:MS Shell Dlg; color:#000000; ">so... 2</Text></Message><Message Date="10/11/2008" Time="3:36:21 PM" DateTime="2008-10-11T04:36:21.741Z" SessionID="8"><From><User FriendlyName="Patrick G"/></From><To><User FriendlyName="- James O'"/></To><Text Style="font-family:MS Shell Dlg; color:#000000; ">i'd say this years one</Text></Message><Message Date="10/11/2008" Time="3:36:46 PM" DateTime="2008-10-11T04:36:46.420Z" SessionID="8"><From><User FriendlyName="- James O'"/></From><To><User FriendlyName="Patrick G"/></To><Text Style="font-family:MS Shell Dlg; color:#000000; ">its 3.6gb</Text></Message><Message Date="10/11/2008" Time="3:37:01 PM" DateTime="2008-10-11T04:37:01.730Z" SessionID="8"><From><User FriendlyName="Patrick G"/></From><To><User FriendlyName="- James O'"/></To><Text Style="font-family:MS Shell Dlg; color:#000000; ">yeah thats why i am waiting for the price to come down, </Text></Message><Message Date="10/11/2008" Time="3:37:03 PM" DateTime="2008-10-11T04:37:03.338Z" SessionID="8"><From><User FriendlyName="- James O'"/></From><To><User FriendlyName="Patrick G"/></To><Text Style="font-family:MS Shell Dlg; color:#000000; ">210 seeds to 9 leachers though, probably get awesome speeds</Text></Message><Message Date="10/11/2008" Time="3:37:06 PM" DateTime="2008-10-11T04:37:06.698Z" SessionID="8"><From><User FriendlyName="Patrick G"/></From><To><User FriendlyName="- James O'"/></To><Text Style="font-family:MS Shell Dlg; color:#000000; ">i only have weak adsl, lol</Text></Message><Message Date="10/11/2008" Time="3:37:18 PM" DateTime="2008-10-11T04:37:18.008Z" SessionID="8"><From><User FriendlyName="- James O'"/></From><To><User FriendlyName="Patrick G"/></To><Text Style="font-family:MS Shell Dlg; color:#000000; ">I can grab it for ya if u want</Text></Message><Message Date="10/11/2008" Time="3:37:26 PM" DateTime="2008-10-11T04:37:26.224Z" SessionID="8"><From><User FriendlyName="Patrick G"/></From><To><User FriendlyName="- James O'"/></To><Text Style="font-family:MS Shell Dlg; color:#000000; ">nah thats ok, thanks though</Text></Message><Message Date="10/11/2008" Time="3:37:31 PM" DateTime="2008-10-11T04:37:31.307Z" SessionID="8"><From><User FriendlyName="Patrick G"/></From><To><User FriendlyName="- James O'"/></To><Text Style="font-family:MS Shell Dlg; color:#000000; ">How big is most wanted?</Text></Message><Message Date="10/11/2008" Time="3:37:39 PM" DateTime="2008-10-11T04:37:39.620Z" SessionID="8"><From><User FriendlyName="Patrick G"/></From><To><User FriendlyName="- James O'"/></To><Text Style="font-family:MS Shell Dlg; color:#000000; ">i am looking for that one</Text></Message><Message Date="10/11/2008" Time="3:38:01 PM" DateTime="2008-10-11T04:38:01.178Z" SessionID="8"><From><User FriendlyName="- James O'"/></From><To><User FriendlyName="Patrick G"/></To><Text Style="font-family:MS Shell Dlg; color:#000000; ">you can have my copy</Text></Message><Message Date="10/11/2008" Time="3:38:12 PM" DateTime="2008-10-11T04:38:12.105Z" SessionID="8"><From><User FriendlyName="- James O'"/></From><To><User FriendlyName="Patrick G"/></To><Text Style="font-family:MS Shell Dlg; color:#000000; ">My mate stole like 8 copies from his place at pizza hut</Text></Message><Message Date="10/11/2008" Time="3:38:24 PM" DateTime="2008-10-11T04:38:24.903Z" SessionID="8"><From><User FriendlyName="- James O'"/></From><To><User FriendlyName="Patrick G"/></To><Text Style="font-family:MS Shell Dlg; color:#000000; ">after their deal expired they had a tonne of games left over</Text></Message><Message Date="10/11/2008" Time="3:38:31 PM" DateTime="2008-10-11T04:38:31.571Z" SessionID="8"><From><User FriendlyName="Patrick G"/></From><To><User FriendlyName="- James O'"/></To><Text Style="font-family:MS Shell Dlg; color:#000000; ">hahahah oh yeah they use to givem out with a fmaily meal</Text></Message><Message Date="10/11/2008" Time="3:38:34 PM" DateTime="2008-10-11T04:38:34.391Z" SessionID="8"><From><User FriendlyName="- James O'"/></From><To><User FriendlyName="Patrick G"/></To><Text Style="font-family:MS Shell Dlg; color:#000000; ">so I got a legit copy</Text></Message><Message Date="10/11/2008" Time="3:38:38 PM" DateTime="2008-10-11T04:38:38.046Z" SessionID="8"><From><User FriendlyName="- James O'"/></From><To><User FriendlyName="Patrick G"/></To><Text Style="font-family:MS Shell Dlg; color:#000000; ">its the CD version</Text></Message><Message Date="10/11/2008" Time="3:38:42 PM" DateTime="2008-10-11T04:38:42.037Z" SessionID="8"><From><User FriendlyName="- James O'"/></From><To><User FriendlyName="Patrick G"/></To><Text Style="font-family:MS Shell Dlg; color:#000000; ">so like 3-4 discs or something</Text></Message><Message Date="10/11/2008" Time="3:38:54 PM" DateTime="2008-10-11T04:38:54.230Z" SessionID="8"><From><User FriendlyName="Patrick G"/></From><To><User FriendlyName="- James O'"/></To><Text Style="font-family:MS Shell Dlg; color:#000000; ">Nah I don't want to take your only copy</Text></Message><Message Date="10/11/2008" Time="3:38:55 PM" DateTime="2008-10-11T04:38:55.836Z" SessionID="8"><From><User FriendlyName="- James O'"/></From><To><User FriendlyName="Patrick G"/></To><Text Style="font-family:MS Shell Dlg; color:#000000; ">but if u want it, it's ur's</Text></Message><Message Date="10/11/2008" Time="3:39:02 PM" DateTime="2008-10-11T04:39:02.659Z" SessionID="8"><From><User FriendlyName="- James O'"/></From><To><User FriendlyName="Patrick G"/></To><Text Style="font-family:MS Shell Dlg; color:#000000; ">haha I played like 20 minutes of it</Text></Message><Message Date="10/11/2008" Time="3:39:05 PM" DateTime="2008-10-11T04:39:05.170Z" SessionID="8"><From><User FriendlyName="- James O'"/></From><To><User FriendlyName="Patrick G"/></To><Text Style="font-family:MS Shell Dlg; color:#000000; ">and uninstalled</Text></Message><Message Date="10/11/2008" Time="3:39:15 PM" DateTime="2008-10-11T04:39:15.609Z" SessionID="8"><From><User FriendlyName="- James O'"/></From><To><User FriendlyName="Patrick G"/></To><Text Style="font-family:MS Shell Dlg; color:#000000; ">I really have no need for it</Text></Message><Message Date="10/11/2008" Time="3:39:31 PM" DateTime="2008-10-11T04:39:31.055Z" SessionID="8"><From><User FriendlyName="- James O'"/></From><To><User FriendlyName="Patrick G"/></To><Text Style="font-family:MS Shell Dlg; color:#000000; ">Im not huge on racing games</Text></Message><Message Date="10/11/2008" Time="3:39:49 PM" DateTime="2008-10-11T04:39:49.557Z" SessionID="8"><From><User FriendlyName="- James O'"/></From><To><User FriendlyName="Patrick G"/></To><Text Style="font-family:MS Shell Dlg; color:#000000; ">plus I got carbon on Wii, and there is another one coming out in a month or two</Text></Message><Message Date="10/11/2008" Time="3:40:21 PM" DateTime="2008-10-11T04:40:21.393Z" SessionID="8"><From><User FriendlyName="Patrick G"/></From><To><User FriendlyName="- James O'"/></To><Text Style="font-family:MS Shell Dlg; color:#000000; ">yes, ummm undercover i think it was</Text></Message><Message Date="10/11/2008" Time="3:40:31 PM" DateTime="2008-10-11T04:40:31.682Z" SessionID="8"><From><User FriendlyName="Patrick G"/></From><To><User FriendlyName="- James O'"/></To><Text Style="font-family:MS Shell Dlg; color:#000000; ">i hope they put the new nissan GTR in</Text></Message><Message Date="10/11/2008" Time="3:40:37 PM" DateTime="2008-10-11T04:40:37.315Z" SessionID="8"><From><User FriendlyName="Patrick G"/></From><To><User FriendlyName="- James O'"/></To><Text Style="font-family:MS Shell Dlg; color:#000000; ">that will be a ripper :D</Text></Message><Message Date="10/11/2008" Time="3:40:57 PM" DateTime="2008-10-11T04:40:57.476Z" SessionID="8"><From><User FriendlyName="- James O'"/></From><To><User FriendlyName="Patrick G"/></To><Text Style="font-family:MS Shell Dlg; color:#000000; ">haha, I gotta get stuck into an essay</Text></Message><Message Date="10/11/2008" Time="3:41:10 PM" DateTime="2008-10-11T04:41:10.370Z" SessionID="8"><From><User FriendlyName="- James O'"/></From><To><User FriendlyName="Patrick G"/></To><Text Style="font-family:MS Shell Dlg; color:#000000; ">but talk to us 2moro and let us know when you'll be at uni</Text></Message><Message Date="10/11/2008" Time="3:41:18 PM" DateTime="2008-10-11T04:41:18.904Z" SessionID="8"><From><User FriendlyName="Patrick G"/></From><To><User FriendlyName="- James O'"/></To><Text Style="font-family:MS Shell Dlg; color:#000000; ">ok, thanks man</Text></Message><Message Date="10/11/2008" Time="3:41:44 PM" DateTime="2008-10-11T04:41:44.927Z" SessionID="8"><From><User FriendlyName="- James O'"/></From><To><User FriendlyName="Patrick G"/></To><Text Style="font-family:MS Shell Dlg; color:#000000; ">no worries</Text></Message><Message Date="10/11/2008" Time="10:43:26 PM" DateTime="2008-10-11T11:43:26.896Z" SessionID="9"><From><User FriendlyName="Patrick G"/></From><To><User FriendlyName="- James O'"/></To><Text Style="font-family:MS Shell Dlg; color:#000000; ">Hey did you want any games? I have GTA SA on DVD, and a GTa like game called Just Cause by Atari</Text></Message><Message Date="10/11/2008" Time="10:44:21 PM" DateTime="2008-10-11T11:44:21.915Z" SessionID="9"><From><User FriendlyName="- James O'"/></From><To><User FriendlyName="Patrick G"/></To><Text Style="font-family:MS Shell Dlg; color:#000000; ">Nah it's fine man</Text></Message><Message Date="10/11/2008" Time="10:52:58 PM" DateTime="2008-10-11T11:52:58.662Z" SessionID="10"><From><User FriendlyName="Patrick G"/></From><To><User FriendlyName="- James O'"/></To><Text Style="font-family:MS Shell Dlg; color:#000000; ">ok</Text></Message><Message Date="10/11/2008" Time="10:53:24 PM" DateTime="2008-10-11T11:53:24.872Z" SessionID="10"><From><User FriendlyName="Patrick G"/></From><To><User FriendlyName="- James O'"/></To><Text Style="font-family:MS Shell Dlg; color:#000000; ">nps</Text></Message><Message Date="10/12/2008" Time="9:25:56 AM" DateTime="2008-10-11T22:25:56.594Z" SessionID="11"><From><User FriendlyName="Patrick G"/></From><To><User FriendlyName="- James O'"/></To><Text Style="font-family:MS Shell Dlg; color:#000000; ">Hi, wow don't you need to sleep, its like in the American movie sterotypes, lol, 
Your msn looks exactly the same as yestoday</Text></Message><Message Date="10/15/2008" Time="10:24:04 PM" DateTime="2008-10-15T11:24:04.301Z" SessionID="12"><From><User FriendlyName="- James O'"/></From><To><User FriendlyName="Patrick G"/></To><Text Style="font-family:MS Shell Dlg; color:#000000; ">ay</Text></Message><Message Date="10/15/2008" Time="10:24:08 PM" DateTime="2008-10-15T11:24:08.100Z" SessionID="12"><From><User FriendlyName="- James O'"/></From><To><User FriendlyName="Patrick G"/></To><Text Style="font-family:MS Shell Dlg; color:#000000; ">you have uni 2moro</Text></Message><Message Date="10/15/2008" Time="10:24:14 PM" DateTime="2008-10-15T11:24:14.679Z" SessionID="12"><From><User FriendlyName="Patrick G"/></From><To><User FriendlyName="- James O'"/></To><Text Style="font-family:Times New Roman; color:#000000; ">Yeah man</Text></Message><Message Date="10/15/2008" Time="10:24:48 PM" DateTime="2008-10-15T11:24:48.881Z" SessionID="12"><From><User FriendlyName="- James O'"/></From><To><User FriendlyName="Patrick G"/></To><Text Style="font-family:MS Shell Dlg; color:#000000; ">what time</Text></Message><Message Date="10/15/2008" Time="10:24:56 PM" DateTime="2008-10-15T11:24:56.199Z" SessionID="12"><From><User FriendlyName="- James O'"/></From><To><User FriendlyName="Patrick G"/></To><Text Style="font-family:MS Shell Dlg; color:#000000; ">Im there from 9:30 to 12:30 then I bail asap</Text></Message><Message Date="10/15/2008" Time="10:26:32 PM" DateTime="2008-10-15T11:26:32.335Z" SessionID="12"><From><User FriendlyName="Patrick G"/></From><To><User FriendlyName="- James O'"/></To><Text Style="font-family:Times New Roman; color:#000000; ">9:30 to 16:30 for me</Text></Message><Message Date="10/15/2008" Time="10:26:41 PM" DateTime="2008-10-15T11:26:41.221Z" SessionID="12"><From><User FriendlyName="- James O'"/></From><To><User FriendlyName="Patrick G"/></To><Text Style="font-family:MS Shell Dlg; color:#000000; ">wilco</Text></Message><Message Date="10/15/2008" Time="10:26:44 PM" DateTime="2008-10-15T11:26:44.970Z" SessionID="12"><From><User FriendlyName="- James O'"/></From><To><User FriendlyName="Patrick G"/></To><Text Style="font-family:MS Shell Dlg; color:#000000; ">any breaks?</Text></Message><Message Date="10/15/2008" Time="10:26:46 PM" DateTime="2008-10-15T11:26:46.177Z" SessionID="12"><From><User FriendlyName="- James O'"/></From><To><User FriendlyName="Patrick G"/></To><Text Style="font-family:MS Shell Dlg; color:#000000; ">or such</Text></Message><Message Date="10/15/2008" Time="10:27:00 PM" DateTime="2008-10-15T11:27:00.985Z" SessionID="12"><From><User FriendlyName="Patrick G"/></From><To><User FriendlyName="- James O'"/></To><Text Style="font-family:Times New Roman; color:#000000; ">nope preety tight hey</Text></Message><Message Date="10/15/2008" Time="10:27:17 PM" DateTime="2008-10-15T11:27:17.841Z" SessionID="12"><From><User FriendlyName="Patrick G"/></From><To><User FriendlyName="- James O'"/></To><Text Style="font-family:Times New Roman; color:#000000; ">i may be able to get there b4 9:00 but you'll not be there</Text></Message><Message Date="10/15/2008" Time="10:27:35 PM" DateTime="2008-10-15T11:27:35.549Z" SessionID="12"><From><User FriendlyName="- James O'"/></From><To><User FriendlyName="Patrick G"/></To><Text Style="font-family:MS Shell Dlg; color:#000000; ">yeah, we turn up a lil late</Text></Message><Message Date="10/15/2008" Time="10:28:04 PM" DateTime="2008-10-15T11:28:04.585Z" SessionID="12"><From><User FriendlyName="Patrick G"/></From><To><User FriendlyName="- James O'"/></To><Text Style="font-family:Times New Roman; color:#000000; ">yes, so it won't work, thats alright</Text></Message><Message Date="10/15/2008" Time="10:28:16 PM" DateTime="2008-10-15T11:28:16.604Z" SessionID="12"><From><User FriendlyName="Patrick G"/></From><To><User FriendlyName="- James O'"/></To><Text Style="font-family:Times New Roman; color:#000000; ">I hit a car today, not a good driver</Text></Message><Message Date="10/15/2008" Time="10:28:32 PM" DateTime="2008-10-15T11:28:32.191Z" SessionID="12"><From><User FriendlyName="- James O'"/></From><To><User FriendlyName="Patrick G"/></To><Text Style="font-family:MS Shell Dlg; color:#000000; ">haha bumnmer</Text></Message><Message Date="10/15/2008" Time="10:29:17 PM" DateTime="2008-10-15T11:29:17.906Z" SessionID="12"><From><User FriendlyName="Patrick G"/></From><To><User FriendlyName="- James O'"/></To><Text Style="font-family:Times New Roman; color:#000000; ">ohh yeah, took off a lot of paint</Text></Message><Message Date="10/16/2008" Time="9:39:55 PM" DateTime="2008-10-16T10:39:55.644Z" SessionID="13"><From><User FriendlyName="Patrick G"/></From><To><User FriendlyName="- James O'"/></To><Text Style="font-family:Times New Roman; color:#000000; ">Hey, do you come to uni on Fridays?</Text></Message><Message Date="10/22/2008" Time="6:50:01 PM" DateTime="2008-10-22T07:50:01.267Z" SessionID="14"><From><User FriendlyName="Patrick G"/></From><To><User FriendlyName="- James O'"/></To><Text Style="font-family:Times New Roman; color:#000000; ">You have what??</Text></Message><Message Date="11/11/2008" Time="12:15:43 AM" DateTime="2008-11-10T13:15:43.942Z" SessionID="15"><From><User FriendlyName="- James O' - Remember remember the fifth of November."/></From><To><User FriendlyName="Patrick G"/></To><Text Style="font-family:MS Shell Dlg; color:#000000; ">600kbps of downstream, Yay for active torrents =)</Text></Message><Message Date="11/11/2008" Time="12:16:19 AM" DateTime="2008-11-10T13:16:19.491Z" SessionID="15"><From><User FriendlyName="Patrick G"/></From><To><User FriendlyName="- James O' - Remember remember the fifth of November."/></To><Text Style="font-family:Times New Roman; color:#000000; ">LOL</Text></Message><Message Date="11/11/2008" Time="12:16:23 AM" DateTime="2008-11-10T13:16:23.868Z" SessionID="15"><From><User FriendlyName="Patrick G"/></From><To><User FriendlyName="- James O' - Remember remember the fifth of November."/></To><Text Style="font-family:Times New Roman; color:#000000; ">No yay for exams</Text></Message><Message Date="11/11/2008" Time="12:16:36 AM" DateTime="2008-11-10T13:16:36.226Z" SessionID="15"><From><User FriendlyName="- James O' - Remember remember the fifth of November."/></From><To><User FriendlyName="Patrick G"/></To><Text Style="font-family:MS Shell Dlg; color:#000000; ">finished last tuesday:D</Text></Message><Message Date="11/11/2008" Time="12:16:44 AM" DateTime="2008-11-10T13:16:44.384Z" SessionID="15"><From><User FriendlyName="Patrick G"/></From><To><User FriendlyName="- James O' - Remember remember the fifth of November."/></To><Text Style="font-family:Times New Roman; color:#000000; ">oh dang</Text></Message><Message Date="11/11/2008" Time="12:19:35 AM" DateTime="2008-11-10T13:19:35.200Z" SessionID="15"><From><User FriendlyName="- James O' - Remember remember the fifth of November."/></From><To><User FriendlyName="Patrick G"/></To><Text Style="font-family:MS Shell Dlg; color:#000000; ">662kbps</Text></Message><Message Date="11/11/2008" Time="12:19:38 AM" DateTime="2008-11-10T13:19:38.325Z" SessionID="15"><From><User FriendlyName="- James O' - Remember remember the fifth of November."/></From><To><User FriendlyName="Patrick G"/></To><Text Style="font-family:MS Shell Dlg; color:#000000; ">*drools*</Text></Message><Message Date="11/11/2008" Time="12:19:57 AM" DateTime="2008-11-10T13:19:57.420Z" SessionID="15"><From><User FriendlyName="- James O' - Remember remember the fifth of November."/></From><To><User FriendlyName="Patrick G"/></To><Text Style="font-family:MS Shell Dlg; color:#000000; ">550mb in like 10 minutes</Text></Message><Message Date="11/11/2008" Time="12:20:07 AM" DateTime="2008-11-10T13:20:07.626Z" SessionID="15"><From><User FriendlyName="- James O' - Remember remember the fifth of November."/></From><To><User FriendlyName="Patrick G"/></To><Text Style="font-family:MS Shell Dlg; color:#000000; ">(getting latest ep of dexter btw)</Text></Message><Message Date="11/11/2008" Time="12:20:30 AM" DateTime="2008-11-10T13:20:30.349Z" SessionID="16"><From><User FriendlyName="Patrick G"/></From><To><User FriendlyName="- James O' - Remember remember the fifth of November."/></To><Text Style="font-family:Times New Roman; color:#000000; ">:-O</Text></Message><Message Date="11/11/2008" Time="12:20:34 AM" DateTime="2008-11-10T13:20:34.783Z" SessionID="16"><From><User FriendlyName="Patrick G"/></From><To><User FriendlyName="- James O' - Remember remember the fifth of November."/></To><Text Style="font-family:Times New Roman; color:#000000; ">owwww, </Text></Message><Message Date="11/11/2008" Time="12:20:45 AM" DateTime="2008-11-10T13:20:45.883Z" SessionID="16"><From><User FriendlyName="Patrick G"/></From><To><User FriendlyName="- James O' - Remember remember the fifth of November."/></To><Text Style="font-family:Times New Roman; color:#000000; ">you've got like my streets internet speed in one computer</Text></Message><Message Date="11/11/2008" Time="12:20:46 AM" DateTime="2008-11-10T13:20:46.669Z" SessionID="16"><From><User FriendlyName="Patrick G"/></From><To><User FriendlyName="- James O' - Remember remember the fifth of November."/></To><Text Style="font-family:Times New Roman; color:#000000; ">:P</Text></Message><Message Date="11/11/2008" Time="12:21:18 AM" DateTime="2008-11-10T13:21:18.944Z" SessionID="16"><From><User FriendlyName="- James O' - Remember remember the fifth of November."/></From><To><User FriendlyName="Patrick G"/></To><Text Style="font-family:MS Shell Dlg; color:#000000; ">lol it's just cable</Text></Message><Message Date="11/11/2008" Time="12:23:47 AM" DateTime="2008-11-10T13:23:47.386Z" SessionID="16"><From><User FriendlyName="- James O' - Remember remember the fifth of November."/></From><To><User FriendlyName="Patrick G"/></To><Text Style="font-family:MS Shell Dlg; color:#000000; ">So, bothered to try Windows 7 beta?</Text></Message><Message Date="11/11/2008" Time="12:25:01 AM" DateTime="2008-11-10T13:25:01.816Z" SessionID="16"><From><User FriendlyName="Patrick G"/></From><To><User FriendlyName="- James O' - Remember remember the fifth of November."/></To><Text Style="font-family:Times New Roman; color:#000000; ">no</Text></Message><Message Date="11/11/2008" Time="12:25:12 AM" DateTime="2008-11-10T13:25:12.237Z" SessionID="16"><From><User FriendlyName="Patrick G"/></From><To><User FriendlyName="- James O' - Remember remember the fifth of November."/></To><Text Style="font-family:Times New Roman; color:#000000; ">but i hear its a god compared to vista</Text></Message><Message Date="11/11/2008" Time="12:25:35 AM" DateTime="2008-11-10T13:25:35.445Z" SessionID="16"><From><User FriendlyName="- James O' - Remember remember the fifth of November."/></From><To><User FriendlyName="Patrick G"/></To><Text Style="font-family:MS Shell Dlg; color:#000000; ">Mmmm</Text></Message><Message Date="11/11/2008" Time="12:25:50 AM" DateTime="2008-11-10T13:25:50.761Z" SessionID="16"><From><User FriendlyName="- James O' - Remember remember the fifth of November."/></From><To><User FriendlyName="Patrick G"/></To><Text Style="font-family:MS Shell Dlg; color:#000000; ">To the best of my understanding, it's vista the way it should of been released</Text></Message><Message Date="11/11/2008" Time="12:26:11 AM" DateTime="2008-11-10T13:26:11.991Z" SessionID="16"><From><User FriendlyName="- James O' - Remember remember the fifth of November."/></From><To><User FriendlyName="Patrick G"/></To><Text Style="font-family:MS Shell Dlg; color:#000000; ">Vista's biggest issue was public perception and performance</Text></Message><Message Date="11/11/2008" Time="12:27:34 AM" DateTime="2008-11-10T13:27:34.084Z" SessionID="16"><From><User FriendlyName="- James O' - Remember remember the fifth of November."/></From><To><User FriendlyName="Patrick G"/></To><Text Style="font-family:MS Shell Dlg; color:#000000; ">Oh for fucks sake</Text></Message><Message Date="11/11/2008" Time="12:27:41 AM" DateTime="2008-11-10T13:27:41.453Z" SessionID="16"><From><User FriendlyName="- James O' - Remember remember the fifth of November."/></From><To><User FriendlyName="Patrick G"/></To><Text Style="font-family:MS Shell Dlg; color:#000000; ">550mb wasted</Text></Message><Message Date="11/11/2008" Time="12:27:55 AM" DateTime="2008-11-10T13:27:55.572Z" SessionID="16"><From><User FriendlyName="- James O' - Remember remember the fifth of November."/></From><To><User FriendlyName="Patrick G"/></To><Text Style="font-family:MS Shell Dlg; color:#000000; ">its a 1 minute 22 seconds WMV video that doesn't play</Text></Message><Message Date="11/11/2008" Time="12:27:57 AM" DateTime="2008-11-10T13:27:57.715Z" SessionID="16"><From><User FriendlyName="- James O' - Remember remember the fifth of November."/></From><To><User FriendlyName="Patrick G"/></To><Text Style="font-family:MS Shell Dlg; color:#000000; ">fucking terrific</Text></Message><Message Date="11/11/2008" Time="12:28:23 AM" DateTime="2008-11-10T13:28:23.062Z" SessionID="17"><From><User FriendlyName="Patrick G"/></From><To><User FriendlyName="- James O' - Remember remember the fifth of November."/></To><Text Style="font-family:Times New Roman; color:#000000; ">thats torrents for ya</Text></Message><Message Date="11/11/2008" Time="12:28:55 AM" DateTime="2008-11-10T13:28:55.029Z" SessionID="17"><From><User FriendlyName="- James O' - Remember remember the fifth of November."/></From><To><User FriendlyName="Patrick G"/></To><Text Style="font-family:MS Shell Dlg; color:#000000; ">Ugh</Text></Message><Message Date="11/11/2008" Time="12:29:01 AM" DateTime="2008-11-10T13:29:01.507Z" SessionID="17"><From><User FriendlyName="- James O' - Remember remember the fifth of November."/></From><To><User FriendlyName="Patrick G"/></To><Text Style="font-family:MS Shell Dlg; color:#000000; ">Serves me right for downloading off the main page</Text></Message><Message Date="11/11/2008" Time="12:29:17 AM" DateTime="2008-11-10T13:29:17.953Z" SessionID="17"><From><User FriendlyName="- James O' - Remember remember the fifth of November."/></From><To><User FriendlyName="Patrick G"/></To><Text Style="font-family:MS Shell Dlg; color:#000000; ">torrent was deleted</Text></Message><Message Date="11/11/2008" Time="12:29:25 AM" DateTime="2008-11-10T13:29:25.016Z" SessionID="17"><From><User FriendlyName="- James O' - Remember remember the fifth of November."/></From><To><User FriendlyName="Patrick G"/></To><Text Style="font-family:MS Shell Dlg; color:#000000; ">eh oh well</Text></Message><Message Date="11/11/2008" Time="12:29:34 AM" DateTime="2008-11-10T13:29:34.927Z" SessionID="17"><From><User FriendlyName="- James O' - Remember remember the fifth of November."/></From><To><User FriendlyName="Patrick G"/></To><Text Style="font-family:MS Shell Dlg; color:#000000; ">anyways, hititng the sack</Text></Message><Message Date="11/11/2008" Time="12:29:37 AM" DateTime="2008-11-10T13:29:37.430Z" SessionID="17"><From><User FriendlyName="- James O' - Remember remember the fifth of November."/></From><To><User FriendlyName="Patrick G"/></To><Text Style="font-family:MS Shell Dlg; color:#000000; ">have a good one</Text></Message><Message Date="11/11/2008" Time="12:29:50 AM" DateTime="2008-11-10T13:29:50.415Z" SessionID="18"><From><User FriendlyName="- James O' - Remember remember the fifth of November."/></From><To><User FriendlyName="Patrick G"/></To><Text Style="font-family:MS Shell Dlg; color:#000000; ">I might grab a beta of windows 7 at the end of the month</Text></Message><Message Date="11/11/2008" Time="12:29:51 AM" DateTime="2008-11-10T13:29:51.276Z" SessionID="18"><From><User FriendlyName="Patrick G"/></From><To><User FriendlyName="- James O' - Remember remember the fifth of November."/></To><Text Style="font-family:Times New Roman; color:#000000; ">cy</Text></Message><Message Date="11/11/2008" Time="12:29:59 AM" DateTime="2008-11-10T13:29:59.878Z" SessionID="18"><From><User FriendlyName="- James O' - Remember remember the fifth of November."/></From><To><User FriendlyName="Patrick G"/></To><Text Style="font-family:MS Shell Dlg; color:#000000; ">try dual booting on the laptop, for performance testing</Text></Message><Message Date="11/11/2008" Time="12:30:11 AM" DateTime="2008-11-10T13:30:11.435Z" SessionID="19"><From><User FriendlyName="Patrick G"/></From><To><User FriendlyName="- James O' - Remember remember the fifth of November."/></To><Text Style="font-family:Times New Roman; color:#000000; ">cool</Text></Message><Message Date="11/11/2008" Time="12:30:15 AM" DateTime="2008-11-10T13:30:15.969Z" SessionID="19"><From><User FriendlyName="Patrick G"/></From><To><User FriendlyName="- James O' - Remember remember the fifth of November."/></To><Text Style="font-family:Times New Roman; color:#000000; ">just do'nt poke the lcd</Text></Message><Message Date="11/11/2008" Time="12:30:21 AM" DateTime="2008-11-10T13:30:21.702Z" SessionID="19"><From><User FriendlyName="Patrick G"/></From><To><User FriendlyName="- James O' - Remember remember the fifth of November."/></To><Text Style="font-family:Times New Roman; color:#000000; ">unless you get a new lappy ;)</Text></Message><Message Date="11/11/2008" Time="12:30:23 AM" DateTime="2008-11-10T13:30:23.206Z" SessionID="19"><From><User FriendlyName="- James O' - Remember remember the fifth of November."/></From><To><User FriendlyName="Patrick G"/></To><Text Style="font-family:MS Shell Dlg; color:#000000; ">8-)</Text></Message><Message Date="11/11/2008" Time="12:30:30 AM" DateTime="2008-11-10T13:30:30.888Z" SessionID="19"><From><User FriendlyName="- James O' - Remember remember the fifth of November."/></From><To><User FriendlyName="Patrick G"/></To><Text Style="font-family:MS Shell Dlg; color:#000000; ">Mmmm</Text></Message><Message Date="11/17/2008" Time="12:12:16 PM" DateTime="2008-11-17T01:12:16.994Z" SessionID="20"><From><User FriendlyName="..\Patrick G"/></From><To><User FriendlyName="James O'"/></To><Text Style="font-family:Times New Roman; color:#000000; ">you know D minor?</Text></Message><Message Date="11/17/2008" Time="12:12:19 PM" DateTime="2008-11-17T01:12:19.492Z" SessionID="20"><From><User FriendlyName="..\Patrick G"/></From><To><User FriendlyName="James O'"/></To><Text Style="font-family:Times New Roman; color:#000000; ">wow, nice</Text></Message><Message Date="11/17/2008" Time="12:19:31 PM" DateTime="2008-11-17T01:19:31.173Z" SessionID="20"><From><User FriendlyName="James O'"/></From><To><User FriendlyName="..\Patrick G"/></To><Text Style="font-family:MS Shell Dlg; color:#000000; ">its pretty</Text></Message><Message Date="12/6/2008" Time="10:58:38 PM" DateTime="2008-12-06T11:58:38.489Z" SessionID="21"><From><User FriendlyName="Patrick G"/></From><To><User FriendlyName="James O'"/></To><Text Style="font-family:Times New Roman; color:#000000; ">Nice display message.. love reading peoples interesting and meaningful messages</Text></Message><Message Date="12/7/2008" Time="12:27:47 AM" DateTime="2008-12-06T13:27:47.656Z" SessionID="21"><From><User FriendlyName="James O'"/></From><To><User FriendlyName="Patrick G"/></To><Text Style="font-family:MS Shell Dlg; color:#000000; ">thank you sir</Text></Message><Message Date="12/14/2008" Time="10:21:09 PM" DateTime="2008-12-14T11:21:09.950Z" SessionID="22"><From><User FriendlyName="Patrick G"/></From><To><User FriendlyName="James O'"/></To><Text Style="font-family:MS Shell Dlg; color:#000000; ">Are you going to the desert?</Text></Message><Message Date="12/14/2008" Time="10:21:14 PM" DateTime="2008-12-14T11:21:14.875Z" SessionID="22"><From><User FriendlyName="Patrick G"/></From><To><User FriendlyName="James O'"/></To><Text Style="font-family:MS Shell Dlg; color:#000000; ">oh oh ho under the sea?</Text></Message><Message Date="12/14/2008" Time="10:21:28 PM" DateTime="2008-12-14T11:21:28.422Z" SessionID="22"><From><User FriendlyName="Patrick G"/></From><To><User FriendlyName="James O'"/></To><Text Style="font-family:MS Shell Dlg; color:#000000; ">air travel??</Text></Message><Message Date="12/14/2008" Time="10:21:31 PM" DateTime="2008-12-14T11:21:31.920Z" SessionID="22"><From><User FriendlyName="Patrick G"/></From><To><User FriendlyName="James O'"/></To><Text Style="font-family:MS Shell Dlg; color:#000000; ">ohh i give up</Text></Message><Message Date="12/14/2008" Time="10:21:38 PM" DateTime="2008-12-14T11:21:38.379Z" SessionID="22"><From><User FriendlyName="Patrick G"/></From><To><User FriendlyName="James O'"/></To><Text Style="font-family:MS Shell Dlg; color:#000000; ">where r u going that doesn't have roads</Text></Message><Message Date="12/14/2008" Time="10:21:42 PM" DateTime="2008-12-14T11:21:42.579Z" SessionID="22"><From><User FriendlyName="Patrick G"/></From><To><User FriendlyName="James O'"/></To><Text Style="font-family:MS Shell Dlg; color:#000000; ">Cyberspace!! ??</Text></Message><Message Date="12/14/2008" Time="10:39:35 PM" DateTime="2008-12-14T11:39:35.386Z" SessionID="22"><From><User FriendlyName="James O'"/></From><To><User FriendlyName="Patrick G"/></To><Text Style="font-family:MS Shell Dlg; color:#000000; ">for real?</Text></Message><Message Date="12/14/2008" Time="10:39:43 PM" DateTime="2008-12-14T11:39:43.287Z" SessionID="22"><From><User FriendlyName="James O'"/></From><To><User FriendlyName="Patrick G"/></To><Text Style="font-family:MS Shell Dlg; color:#000000; ">Dude, I'm sorry, geek card revoked</Text></Message><Message Date="12/14/2008" Time="10:40:06 PM" DateTime="2008-12-14T11:40:06.025Z" SessionID="22"><From><User FriendlyName="James O'"/></From><To><User FriendlyName="Patrick G"/></To><Text Style="font-family:MS Shell Dlg; color:#000000; ">That's a quote from Doc Brown</Text></Message><Message Date="12/14/2008" Time="10:40:16 PM" DateTime="2008-12-14T11:40:16.291Z" SessionID="22"><From><User FriendlyName="James O'"/></From><To><User FriendlyName="Patrick G"/></To><Text Style="font-family:MS Shell Dlg; color:#000000; ">Dr Emmet Brown...</Text></Message><Message Date="12/14/2008" Time="10:40:42 PM" DateTime="2008-12-14T11:40:42.593Z" SessionID="22"><From><User FriendlyName="James O'"/></From><To><User FriendlyName="Patrick G"/></To><Text Style="font-family:MS Shell Dlg; color:#000000; ">Marty McFly, Biff Tanen...</Text></Message><Message Date="12/14/2008" Time="10:40:49 PM" DateTime="2008-12-14T11:40:49.111Z" SessionID="22"><From><User FriendlyName="James O'"/></From><To><User FriendlyName="Patrick G"/></To><Text Style="font-family:MS Shell Dlg; color:#000000; ">Back to the future?</Text></Message><Message Date="12/14/2008" Time="10:40:50 PM" DateTime="2008-12-14T11:40:50.639Z" SessionID="22"><From><User FriendlyName="James O'"/></From><To><User FriendlyName="Patrick G"/></To><Text Style="font-family:MS Shell Dlg; color:#000000; ">Nothing?</Text></Message><Message Date="12/14/2008" Time="10:51:10 PM" DateTime="2008-12-14T11:51:10.641Z" SessionID="23"><From><User FriendlyName="Patrick G"/></From><To><User FriendlyName="James O'"/></To><Text Style="font-family:MS Shell Dlg; color:#000000; ">hahahahaha lol</Text></Message><Message Date="12/14/2008" Time="10:51:18 PM" DateTime="2008-12-14T11:51:18.279Z" SessionID="23"><From><User FriendlyName="Patrick G"/></From><To><User FriendlyName="James O'"/></To><Text Style="font-family:MS Shell Dlg; color:#000000; ">sorry, nooo i need my geek card</Text></Message><Message Date="12/14/2008" Time="10:51:28 PM" DateTime="2008-12-14T11:51:28.805Z" SessionID="23"><From><User FriendlyName="Patrick G"/></From><To><User FriendlyName="James O'"/></To><Text Style="font-family:MS Shell Dlg; color:#000000; ">it gives me free access to electric cars</Text></Message><Message Date="12/14/2008" Time="10:51:30 PM" DateTime="2008-12-14T11:51:30.911Z" SessionID="23"><From><User FriendlyName="Patrick G"/></From><To><User FriendlyName="James O'"/></To><Text Style="font-family:MS Shell Dlg; color:#000000; ">lol</Text></Message><Message Date="12/14/2008" Time="10:51:40 PM" DateTime="2008-12-14T11:51:40.777Z" SessionID="23"><From><User FriendlyName="Patrick G"/></From><To><User FriendlyName="James O'"/></To><Text Style="font-family:MS Shell Dlg; color:#000000; ">Do you watch the big bang theory, ohhh soo funny</Text></Message><Message Date="12/16/2008" Time="5:54:31 PM" DateTime="2008-12-16T06:54:31.248Z" SessionID="24"><From><User FriendlyName="Patrick G"/></From><To><User FriendlyName="James O'"/></To><Text Style="font-family:MS Shell Dlg; color:#000000; ">Please expand on the heros bit</Text></Message><Message Date="12/16/2008" Time="6:32:52 PM" DateTime="2008-12-16T07:32:52.959Z" SessionID="24"><From><User FriendlyName="James O'"/></From><To><User FriendlyName="Patrick G"/></To><Text Style="font-family:MS Shell Dlg; color:#000000; ">U watch Heroes?</Text></Message><Message Date="12/16/2008" Time="7:44:55 PM" DateTime="2008-12-16T08:44:55.991Z" SessionID="25"><From><User FriendlyName="Patrick G"/></From><To><User FriendlyName="James O'"/></To><Text Style="font-family:MS Shell Dlg; color:#000000; ">nope, heren makes sense, thats ok then lol</Text></Message><Message Date="12/16/2008" Time="7:45:10 PM" DateTime="2008-12-16T08:45:10.582Z" SessionID="25"><From><User FriendlyName="Patrick G"/></From><To><User FriendlyName="James O'"/></To><Text Style="font-family:MS Shell Dlg; color:#000000; ">I thought it was one of your interesting facts and news on Technology</Text></Message><Message Date="12/16/2008" Time="7:47:05 PM" DateTime="2008-12-16T08:47:05.763Z" SessionID="25"><From><User FriendlyName="James O'"/></From><To><User FriendlyName="Patrick G"/></To><Text Style="font-family:MS Shell Dlg; color:#000000; ">No...</Text></Message><Message Date="12/16/2008" Time="7:47:11 PM" DateTime="2008-12-16T08:47:11.778Z" SessionID="25"><From><User FriendlyName="James O'"/></From><To><User FriendlyName="Patrick G"/></To><Text Style="font-family:MS Shell Dlg; color:#000000; ">at the end of season 3 of heroes</Text></Message><Message Date="12/16/2008" Time="7:47:29 PM" DateTime="2008-12-16T08:47:29.575Z" SessionID="25"><From><User FriendlyName="James O'"/></From><To><User FriendlyName="Patrick G"/></To><Text Style="font-family:MS Shell Dlg; color:#000000; ">one of the characters is in a limo talking to a black dude in a suit, most obviously obama</Text></Message><Message Date="12/16/2008" Time="7:47:49 PM" DateTime="2008-12-16T08:47:49.245Z" SessionID="25"><From><User FriendlyName="James O'"/></From><To><User FriendlyName="Patrick G"/></To><Text Style="font-family:MS Shell Dlg; color:#000000; ">telling em how dangerous they are, and the black dude gives him the go ahead to do whatever they can to stop them</Text></Message><Message Date="12/16/2008" Time="7:47:59 PM" DateTime="2008-12-16T08:47:59.579Z" SessionID="25"><From><User FriendlyName="James O'"/></From><To><User FriendlyName="Patrick G"/></To><Text Style="font-family:MS Shell Dlg; color:#000000; ">and then the guys like "Thank you Mr President"</Text></Message><Message Date="12/16/2008" Time="7:48:02 PM" DateTime="2008-12-16T08:48:02.366Z" SessionID="25"><From><User FriendlyName="James O'"/></From><To><User FriendlyName="Patrick G"/></To><Text Style="font-family:MS Shell Dlg; color:#000000; ">fucking lame bullshit</Text></Message><Message Date="12/16/2008" Time="7:48:08 PM" DateTime="2008-12-16T08:48:08.842Z" SessionID="25"><From><User FriendlyName="James O'"/></From><To><User FriendlyName="Patrick G"/></To><Text Style="font-family:MS Shell Dlg; color:#000000; ">who writes this bollocks</Text></Message><Message Date="12/16/2008" Time="7:48:10 PM" DateTime="2008-12-16T08:48:10.874Z" SessionID="25"><From><User FriendlyName="James O'"/></From><To><User FriendlyName="Patrick G"/></To><Text Style="font-family:MS Shell Dlg; color:#000000; ">very disapointed</Text></Message><Message Date="12/25/2008" Time="10:32:53 PM" DateTime="2008-12-25T11:32:53.420Z" SessionID="26"><From><User FriendlyName="Patrick G"/></From><To><User FriendlyName="James O'"/></To><Text Style="font-family:Times New Roman; color:#000000; ">GBs of power?</Text></Message><Message Date="12/26/2008" Time="12:04:52 AM" DateTime="2008-12-25T13:04:52.382Z" SessionID="26"><From><User FriendlyName="James O'"/></From><To><User FriendlyName="Patrick G"/></To><Text Style="font-family:MS Shell Dlg; color:#000000; ">haha </Text></Message><Message Date="12/26/2008" Time="12:05:20 AM" DateTime="2008-12-25T13:05:20.354Z" SessionID="26"><From><User FriendlyName="James O'"/></From><To><User FriendlyName="Patrick G"/></To><Text Style="font-family:MS Shell Dlg; color:#000000; ">yeah man, i got two 1 terrabyte hard drives for christmas :)</Text></Message><Message Date="12/26/2008" Time="8:29:07 AM" DateTime="2008-12-25T21:29:07.256Z" SessionID="27"><From><User FriendlyName="Patrick G"/></From><To><User FriendlyName="James O'"/></To><Text Style="font-family:Times New Roman; color:#000000; ">woooooooo</Text></Message><Message Date="12/26/2008" Time="8:29:23 AM" DateTime="2008-12-25T21:29:23.542Z" SessionID="27"><From><User FriendlyName="Patrick G"/></From><To><User FriendlyName="James O'"/></To><Text Style="font-family:Times New Roman; color:#000000; ">digital tv recording tkaes like 11GBs for 2 hours so yeah thats madd power </Text></Message><Message Date="12/30/2008" Time="7:00:12 PM" DateTime="2008-12-30T08:00:12.371Z" SessionID="28"><From><User FriendlyName="James O'"/></From><To><User FriendlyName="Patrick G"/></To><Text Style="font-family:MS Shell Dlg; color:#000000; ">Hello Sir</Text></Message><Message Date="12/30/2008" Time="7:00:24 PM" DateTime="2008-12-30T08:00:24.234Z" SessionID="28"><From><User FriendlyName="James O'"/></From><To><User FriendlyName="Patrick G"/></To><Text Style="font-family:MS Shell Dlg; color:#000000; ">Im thinking I might download the latest windows 7 beta</Text></Message><Message Date="12/30/2008" Time="7:00:29 PM" DateTime="2008-12-30T08:00:29.927Z" SessionID="28"><From><User FriendlyName="James O'"/></From><To><User FriendlyName="Patrick G"/></To><Text Style="font-family:MS Shell Dlg; color:#000000; ">build 7000</Text></Message><Message Date="12/30/2008" Time="7:00:30 PM" DateTime="2008-12-30T08:00:30.244Z" SessionID="28"><From><User FriendlyName="Patrick G"/></From><To><User FriendlyName="James O'"/></To><Text Style="font-family:Times New Roman; color:#000000; ">Hi</Text></Message><Message Date="12/30/2008" Time="7:00:36 PM" DateTime="2008-12-30T08:00:36.013Z" SessionID="28"><From><User FriendlyName="Patrick G"/></From><To><User FriendlyName="James O'"/></To><Text Style="font-family:Times New Roman; color:#000000; ">huuuuuuuhhhh</Text></Message><Message Date="12/30/2008" Time="7:00:51 PM" DateTime="2008-12-30T08:00:51.382Z" SessionID="28"><From><User FriendlyName="James O'"/></From><To><User FriendlyName="Patrick G"/></To><Text Style="font-family:MS Shell Dlg; color:#000000; ">Was meant to be released around CES</Text></Message><Message Date="12/30/2008" Time="7:01:13 PM" DateTime="2008-12-30T08:01:13.823Z" SessionID="28"><From><User FriendlyName="Patrick G"/></From><To><User FriendlyName="James O'"/></To><Text Style="font-family:Times New Roman; color:#000000; ">yeah</Text></Message><Message Date="12/30/2008" Time="7:01:15 PM" DateTime="2008-12-30T08:01:15.759Z" SessionID="28"><From><User FriendlyName="Patrick G"/></From><To><User FriendlyName="James O'"/></To><Text Style="font-family:Times New Roman; color:#000000; ">is the uni gonna offer it you think??</Text></Message><Message Date="12/30/2008" Time="7:01:25 PM" DateTime="2008-12-30T08:01:25.905Z" SessionID="28"><From><User FriendlyName="James O'"/></From><To><User FriendlyName="Patrick G"/></To><Text Style="font-family:MS Shell Dlg; color:#000000; ">lol</Text></Message><Message Date="12/30/2008" Time="7:01:32 PM" DateTime="2008-12-30T08:01:32.512Z" SessionID="28"><From><User FriendlyName="James O'"/></From><To><User FriendlyName="Patrick G"/></To><Text Style="font-family:MS Shell Dlg; color:#000000; ">I was thinking bittorent</Text></Message><Message Date="12/30/2008" Time="7:03:06 PM" DateTime="2008-12-30T08:03:06.716Z" SessionID="28"><From><User FriendlyName="Patrick G"/></From><To><User FriendlyName="James O'"/></To><Text Style="font-family:Times New Roman; color:#000000; ">no i mean the real version</Text></Message><Message Date="12/30/2008" Time="7:03:23 PM" DateTime="2008-12-30T08:03:23.972Z" SessionID="28"><From><User FriendlyName="James O'"/></From><To><User FriendlyName="Patrick G"/></To><Text Style="font-family:MS Shell Dlg; color:#000000; ">Like on the cheap?</Text></Message><Message Date="12/30/2008" Time="7:03:31 PM" DateTime="2008-12-30T08:03:31.976Z" SessionID="28"><From><User FriendlyName="Patrick G"/></From><To><User FriendlyName="James O'"/></To><Text Style="font-family:Times New Roman; color:#000000; ">like free</Text></Message><Message Date="12/30/2008" Time="7:03:43 PM" DateTime="2008-12-30T08:03:43.783Z" SessionID="28"><From><User FriendlyName="Patrick G"/></From><To><User FriendlyName="James O'"/></To><Text Style="font-family:Times New Roman; color:#000000; ">Just like how they gave away Windows Vista Business for free</Text></Message><Message Date="12/30/2008" Time="7:03:54 PM" DateTime="2008-12-30T08:03:54.512Z" SessionID="28"><From><User FriendlyName="James O'"/></From><To><User FriendlyName="Patrick G"/></To><Text Style="font-family:MS Shell Dlg; color:#000000; ">they did?</Text></Message><Message Date="12/30/2008" Time="7:04:00 PM" DateTime="2008-12-30T08:04:00.345Z" SessionID="28"><From><User FriendlyName="Patrick G"/></From><To><User FriendlyName="James O'"/></To><Text Style="font-family:Times New Roman; color:#000000; ">hahahaha you didn;t know??</Text></Message><Message Date="12/30/2008" Time="7:04:03 PM" DateTime="2008-12-30T08:04:03.311Z" SessionID="28"><From><User FriendlyName="James O'"/></From><To><User FriendlyName="Patrick G"/></To><Text Style="font-family:MS Shell Dlg; color:#000000; ">Like final version?</Text></Message><Message Date="12/30/2008" Time="7:04:04 PM" DateTime="2008-12-30T08:04:04.873Z" SessionID="28"><From><User FriendlyName="Patrick G"/></From><To><User FriendlyName="James O'"/></To><Text Style="font-family:Times New Roman; color:#000000; ">they gave away Ubuntu free</Text></Message><Message Date="12/30/2008" Time="7:04:09 PM" DateTime="2008-12-30T08:04:09.747Z" SessionID="28"><From><User FriendlyName="Patrick G"/></From><To><User FriendlyName="James O'"/></To><Text Style="font-family:Times New Roman; color:#000000; ">Windows Server 2007 free</Text></Message><Message Date="12/30/2008" Time="7:04:17 PM" DateTime="2008-12-30T08:04:17.454Z" SessionID="28"><From><User FriendlyName="Patrick G"/></From><To><User FriendlyName="James O'"/></To><Text Style="font-family:Times New Roman; color:#000000; ">Visual studio free</Text></Message><Message Date="12/30/2008" Time="7:04:23 PM" DateTime="2008-12-30T08:04:23.708Z" SessionID="28"><From><User FriendlyName="Patrick G"/></From><To><User FriendlyName="James O'"/></To><Text Style="font-family:Times New Roman; color:#000000; ">audacity</Text></Message><Message Date="12/30/2008" Time="7:04:24 PM" DateTime="2008-12-30T08:04:24.766Z" SessionID="28"><From><User FriendlyName="James O'"/></From><To><User FriendlyName="Patrick G"/></To><Text Style="font-family:MS Shell Dlg; color:#000000; ">Licnsed?</Text></Message><Message Date="12/30/2008" Time="7:04:30 PM" DateTime="2008-12-30T08:04:30.996Z" SessionID="28"><From><User FriendlyName="Patrick G"/></From><To><User FriendlyName="James O'"/></To><Text Style="font-family:Times New Roman; color:#000000; ">yes as a uni licence</Text></Message><Message Date="12/30/2008" Time="7:04:35 PM" DateTime="2008-12-30T08:04:35.483Z" SessionID="28"><From><User FriendlyName="James O'"/></From><To><User FriendlyName="Patrick G"/></To><Text Style="font-family:MS Shell Dlg; color:#000000; ">oh cool</Text></Message><Message Date="12/30/2008" Time="7:04:41 PM" DateTime="2008-12-30T08:04:41.777Z" SessionID="28"><From><User FriendlyName="James O'"/></From><To><User FriendlyName="Patrick G"/></To><Text Style="font-family:MS Shell Dlg; color:#000000; ">Well Maybe then</Text></Message><Message Date="12/30/2008" Time="7:05:07 PM" DateTime="2008-12-30T08:05:07.938Z" SessionID="28"><From><User FriendlyName="Patrick G"/></From><To><User FriendlyName="James O'"/></To><Text Style="font-family:Times New Roman; color:#000000; ">nice</Text></Message><Message Date="12/30/2008" Time="7:05:45 PM" DateTime="2008-12-30T08:05:45.690Z" SessionID="28"><From><User FriendlyName="James O'"/></From><To><User FriendlyName="Patrick G"/></To><Text Style="font-family:MS Shell Dlg; color:#000000; ">I just cleared out and 80gb drive</Text></Message><Message Date="12/30/2008" Time="7:05:50 PM" DateTime="2008-12-30T08:05:50.201Z" SessionID="28"><From><User FriendlyName="James O'"/></From><To><User FriendlyName="Patrick G"/></To><Text Style="font-family:MS Shell Dlg; color:#000000; ">so im gonner throw it on that</Text></Message><Message Date="12/30/2008" Time="7:05:53 PM" DateTime="2008-12-30T08:05:53.919Z" SessionID="28"><From><User FriendlyName="James O'"/></From><To><User FriendlyName="Patrick G"/></To><Text Style="font-family:MS Shell Dlg; color:#000000; ">Next month</Text></Message><Message Date="12/30/2008" Time="7:06:11 PM" DateTime="2008-12-30T08:06:11.031Z" SessionID="28"><From><User FriendlyName="James O'"/></From><To><User FriendlyName="Patrick G"/></To><Text Style="font-family:MS Shell Dlg; color:#000000; ">oh god how sad, I'm going to be installing a beta version of windows 7 as I usher in the new year :(</Text></Message><Message Date="12/30/2008" Time="7:06:30 PM" DateTime="2008-12-30T08:06:30.171Z" SessionID="28"><From><User FriendlyName="Patrick G"/></From><To><User FriendlyName="James O'"/></To><Text Style="font-family:Times New Roman; color:#000000; ">hahahaha, lol!!!!1</Text></Message><Message Date="12/30/2008" Time="7:06:36 PM" DateTime="2008-12-30T08:06:36.486Z" SessionID="28"><From><User FriendlyName="Patrick G"/></From><To><User FriendlyName="James O'"/></To><Text Style="font-family:Times New Roman; color:#000000; ">well its a good time to throw out the bad</Text></Message><Message Date="12/30/2008" Time="7:06:42 PM" DateTime="2008-12-30T08:06:42.560Z" SessionID="28"><From><User FriendlyName="Patrick G"/></From><To><User FriendlyName="James O'"/></To><Text Style="font-family:Times New Roman; color:#000000; ">i.e. Vista</Text></Message><Message Date="12/30/2008" Time="7:07:07 PM" DateTime="2008-12-30T08:07:07.715Z" SessionID="28"><From><User FriendlyName="James O'"/></From><To><User FriendlyName="Patrick G"/></To><Text Style="font-family:MS Shell Dlg; color:#000000; ">Vista aint that bad</Text></Message><Message Date="12/30/2008" Time="7:07:58 PM" DateTime="2008-12-30T08:07:58.222Z" SessionID="28"><From><User FriendlyName="Patrick G"/></From><To><User FriendlyName="James O'"/></To><Text Style="font-family:Times New Roman; color:#000000; ">yeah i know</Text></Message><Message Date="12/30/2008" Time="7:08:01 PM" DateTime="2008-12-30T08:08:01.637Z" SessionID="28"><From><User FriendlyName="Patrick G"/></From><To><User FriendlyName="James O'"/></To><Text Style="font-family:Times New Roman; color:#000000; ">but business was</Text></Message><Message Date="12/30/2008" Time="7:08:10 PM" DateTime="2008-12-30T08:08:10.881Z" SessionID="28"><From><User FriendlyName="Patrick G"/></From><To><User FriendlyName="James O'"/></To><Text Style="font-family:Times New Roman; color:#000000; ">home premium is fiarly calm</Text></Message><Message Date="1/4/2009" Time="2:27:58 PM" DateTime="2009-01-04T03:27:58.535Z" SessionID="29"><From><User FriendlyName="James O'"/></From><To><User FriendlyName="Patrick G"/></To><Text Style="font-family:MS Shell Dlg; color:#000000; ">getting pumped for CES?</Text></Message><Message Date="1/4/2009" Time="2:30:36 PM" DateTime="2009-01-04T03:30:36.243Z" SessionID="29"><From><User FriendlyName="Patrick G"/></From><To><User FriendlyName="James O'"/></To><Text Style="font-family:Times New Roman; color:#000000; ">??</Text></Message><Message Date="1/4/2009" Time="2:30:45 PM" DateTime="2009-01-04T03:30:45.133Z" SessionID="29"><From><User FriendlyName="Patrick G"/></From><To><User FriendlyName="James O'"/></To><Text Style="font-family:Times New Roman; color:#000000; ">ms/</Text></Message><Message Date="1/4/2009" Time="2:30:47 PM" DateTime="2009-01-04T03:30:47.868Z" SessionID="29"><From><User FriendlyName="Patrick G"/></From><To><User FriendlyName="James O'"/></To><Text Style="font-family:Times New Roman; color:#000000; ">?</Text></Message><Message Date="1/4/2009" Time="2:30:57 PM" DateTime="2009-01-04T03:30:57.235Z" SessionID="29"><From><User FriendlyName="Patrick G"/></From><To><User FriendlyName="James O'"/></To><Text Style="font-family:Times New Roman; color:#000000; ">ohh</Text></Message><Message Date="1/4/2009" Time="2:30:58 PM" DateTime="2009-01-04T03:30:58.526Z" SessionID="29"><From><User FriendlyName="Patrick G"/></From><To><User FriendlyName="James O'"/></To><Text Style="font-family:Times New Roman; color:#000000; ">omg omg</Text></Message><Message Date="1/4/2009" Time="2:31:02 PM" DateTime="2009-01-04T03:31:02.800Z" SessionID="29"><From><User FriendlyName="Patrick G"/></From><To><User FriendlyName="James O'"/></To><Text Style="font-family:Times New Roman; color:#000000; ">is that the tech. show??</Text></Message><Message Date="1/4/2009" Time="2:31:07 PM" DateTime="2009-01-04T03:31:07.798Z" SessionID="29"><From><User FriendlyName="James O'"/></From><To><User FriendlyName="Patrick G"/></To><Text Style="font-family:MS Shell Dlg; color:#000000; ">Sir yes sir</Text></Message><Message Date="1/4/2009" Time="2:31:16 PM" DateTime="2009-01-04T03:31:16.539Z" SessionID="29"><From><User FriendlyName="Patrick G"/></From><To><User FriendlyName="James O'"/></To><Text Style="font-family:Times New Roman; color:#000000; ">huuuuuuuuuuuuhhhhhhhhhh</Text></Message><Message Date="1/4/2009" Time="2:31:17 PM" DateTime="2009-01-04T03:31:17.091Z" SessionID="29"><From><User FriendlyName="James O'"/></From><To><User FriendlyName="Patrick G"/></To><Text Style="font-family:MS Shell Dlg; color:#000000; ">Consumers Electronics Show</Text></Message><Message Date="1/4/2009" Time="2:31:20 PM" DateTime="2009-01-04T03:31:20.821Z" SessionID="29"><From><User FriendlyName="Patrick G"/></From><To><User FriendlyName="James O'"/></To><Text Style="font-family:Times New Roman; color:#000000; ">Never been to one of those</Text></Message><Message Date="1/4/2009" Time="2:31:24 PM" DateTime="2009-01-04T03:31:24.284Z" SessionID="29"><From><User FriendlyName="Patrick G"/></From><To><User FriendlyName="James O'"/></To><Text Style="font-family:Times New Roman; color:#000000; ">Umm Sydney?</Text></Message><Message Date="1/4/2009" Time="2:31:29 PM" DateTime="2009-01-04T03:31:29.203Z" SessionID="29"><From><User FriendlyName="James O'"/></From><To><User FriendlyName="Patrick G"/></To><Text Style="font-family:MS Shell Dlg; color:#000000; ">lol</Text></Message><Message Date="1/4/2009" Time="2:31:29 PM" DateTime="2009-01-04T03:31:29.754Z" SessionID="29"><From><User FriendlyName="James O'"/></From><To><User FriendlyName="Patrick G"/></To><Text Style="font-family:MS Shell Dlg; color:#000000; ">no</Text></Message><Message Date="1/4/2009" Time="2:31:34 PM" DateTime="2009-01-04T03:31:34.872Z" SessionID="29"><From><User FriendlyName="Patrick G"/></From><To><User FriendlyName="James O'"/></To><Text Style="font-family:Times New Roman; color:#000000; ">where</Text></Message><Message Date="1/4/2009" Time="2:31:38 PM" DateTime="2009-01-04T03:31:38.241Z" SessionID="29"><From><User FriendlyName="James O'"/></From><To><User FriendlyName="Patrick G"/></To><Text Style="font-family:MS Shell Dlg; color:#000000; ">Vegas</Text></Message><Message Date="1/4/2009" Time="2:31:43 PM" DateTime="2009-01-04T03:31:43.270Z" SessionID="29"><From><User FriendlyName="Patrick G"/></From><To><User FriendlyName="James O'"/></To><Text Style="font-family:Times New Roman; color:#000000; ">ohhh you mean that one</Text></Message><Message Date="1/4/2009" Time="2:31:52 PM" DateTime="2009-01-04T03:31:52.972Z" SessionID="29"><From><User FriendlyName="Patrick G"/></From><To><User FriendlyName="James O'"/></To><Text Style="font-family:Times New Roman; color:#000000; ">i thought you were gonna say theres one in Sydney</Text></Message><Message Date="1/4/2009" Time="2:32:10 PM" DateTime="2009-01-04T03:32:10.033Z" SessionID="29"><From><User FriendlyName="Patrick G"/></From><To><User FriendlyName="James O'"/></To><Text Style="font-family:Times New Roman; color:#000000; ">are you going to the US?</Text></Message><Message Date="1/4/2009" Time="2:32:56 PM" DateTime="2009-01-04T03:32:56.689Z" SessionID="29"><From><User FriendlyName="James O'"/></From><To><User FriendlyName="Patrick G"/></To><Text Style="font-family:MS Shell Dlg; color:#000000; ">haha no</Text></Message><Message Date="1/4/2009" Time="2:33:03 PM" DateTime="2009-01-04T03:33:03.894Z" SessionID="29"><From><User FriendlyName="James O'"/></From><To><User FriendlyName="Patrick G"/></To><Text Style="font-family:MS Shell Dlg; color:#000000; ">I'd be awesome to go one year</Text></Message><Message Date="1/4/2009" Time="2:33:09 PM" DateTime="2009-01-04T03:33:09.381Z" SessionID="29"><From><User FriendlyName="James O'"/></From><To><User FriendlyName="Patrick G"/></To><Text Style="font-family:MS Shell Dlg; color:#000000; ">My dad and mum are going to the states</Text></Message><Message Date="1/4/2009" Time="2:33:22 PM" DateTime="2009-01-04T03:33:22.396Z" SessionID="29"><From><User FriendlyName="Patrick G"/></From><To><User FriendlyName="James O'"/></To><Text Style="font-family:Times New Roman; color:#000000; ">ohhh so how do i watch the ces?</Text></Message><Message Date="1/4/2009" Time="2:33:31 PM" DateTime="2009-01-04T03:33:31.940Z" SessionID="29"><From><User FriendlyName="Patrick G"/></From><To><User FriendlyName="James O'"/></To><Text Style="font-family:Times New Roman; color:#000000; ">there are only 30 sec clisp of it on new usually</Text></Message><Message Date="1/4/2009" Time="2:33:33 PM" DateTime="2009-01-04T03:33:33.080Z" SessionID="29"><From><User FriendlyName="Patrick G"/></From><To><User FriendlyName="James O'"/></To><Text Style="font-family:Times New Roman; color:#000000; ">:(</Text></Message><Message Date="1/4/2009" Time="2:33:45 PM" DateTime="2009-01-04T03:33:45.288Z" SessionID="29"><From><User FriendlyName="Patrick G"/></From><To><User FriendlyName="James O'"/></To><Text Style="font-family:Times New Roman; color:#000000; ">Doesnt Sydney have a CES too? We should go one day</Text></Message><Message Date="1/4/2009" Time="2:34:08 PM" DateTime="2009-01-04T03:34:08.800Z" SessionID="29"><From><User FriendlyName="James O'"/></From><To><User FriendlyName="Patrick G"/></To><Text Style="font-family:MS Shell Dlg; color:#000000; ">Umm, I'll be on engadget and gizmodo, revision 3, dl.tv</Text></Message><Message Date="1/4/2009" Time="2:34:34 PM" DateTime="2009-01-04T03:34:34.956Z" SessionID="29"><From><User FriendlyName="Patrick G"/></From><To><User FriendlyName="James O'"/></To><Text Style="font-family:Times New Roman; color:#000000; ">me no got fast enough BB to download it, dam Telstra and their big fees</Text></Message><Message Date="1/4/2009" Time="2:34:36 PM" DateTime="2009-01-04T03:34:36.068Z" SessionID="29"><From><User FriendlyName="James O'"/></From><To><User FriendlyName="Patrick G"/></To><Text Style="font-family:MS Shell Dlg; color:#000000; ">I havent watched DL.TV in nearly a year, but they do very good end of day wrap ups and stuff (its a online tv show)</Text></Message><Message Date="1/4/2009" Time="2:37:40 PM" DateTime="2009-01-04T03:37:40.966Z" SessionID="30"><From><User FriendlyName="James O'"/></From><To><User FriendlyName="Patrick G"/></To><Text Style="font-family:MS Shell Dlg; color:#000000; ">I'll keep an eye out for any aussie tech trade shows tho</Text></Message><Message Date="1/4/2009" Time="2:37:57 PM" DateTime="2009-01-04T03:37:57.182Z" SessionID="31"><From><User FriendlyName="Patrick G"/></From><To><User FriendlyName="James O'"/></To><Text Style="font-family:Times New Roman; color:#000000; ">cool</Text></Message><Message Date="1/11/2009" Time="11:25:43 PM" DateTime="2009-01-12T07:25:43.763Z" SessionID="32"><From><User FriendlyName="Patrick G"/></From><To><User FriendlyName="James O'"/></To><Text Style="font-family:Times New Roman; color:#000000; ">Windows 7 is out!</Text></Message><Message Date="1/11/2009" Time="11:25:44 PM" DateTime="2009-01-12T07:25:44.738Z" SessionID="32"><From><User FriendlyName="Patrick G"/></From><To><User FriendlyName="James O'"/></To><Text Style="font-family:Times New Roman; color:#000000; ">Beta*</Text></Message><Message Date="1/11/2009" Time="11:25:45 PM" DateTime="2009-01-12T07:25:45.902Z" SessionID="32"><From><User FriendlyName="Patrick G"/></From><To><User FriendlyName="James O'"/></To><Text Style="font-family:Times New Roman; color:#000000; ">my bad</Text></Message><Message Date="1/11/2009" Time="11:25:52 PM" DateTime="2009-01-12T07:25:52.910Z" SessionID="32"><From><User FriendlyName="James O'"/></From><To><User FriendlyName="Patrick G"/></To><Text Style="font-family:Segoe UI; color:#000000; ">haha yeh I know</Text></Message><Message Date="1/11/2009" Time="11:25:55 PM" DateTime="2009-01-12T07:25:55.806Z" SessionID="32"><From><User FriendlyName="James O'"/></From><To><User FriendlyName="Patrick G"/></To><Text Style="font-family:Segoe UI; color:#000000; ">i tried it</Text></Message><Message Date="1/11/2009" Time="11:26:02 PM" DateTime="2009-01-12T07:26:02.203Z" SessionID="32"><From><User FriendlyName="Patrick G"/></From><To><User FriendlyName="James O'"/></To><Text Style="font-family:Times New Roman; color:#000000; ">i can't get it downloaded</Text></Message><Message Date="1/11/2009" Time="11:26:04 PM" DateTime="2009-01-12T07:26:04.021Z" SessionID="32"><From><User FriendlyName="James O'"/></From><To><User FriendlyName="Patrick G"/></To><Text Style="font-family:Segoe UI; color:#000000; ">broke my boot amanger</Text></Message><Message Date="1/11/2009" Time="11:26:58 PM" DateTime="2009-01-12T07:26:58.248Z" SessionID="32"><From><User FriendlyName="Patrick G"/></From><To><User FriendlyName="James O'"/></To><Text Style="font-family:Times New Roman; color:#000000; ">Windows Vista CD, boot up and run the error checking console and then start up fixer or soemthing like that</Text></Message><Message Date="1/11/2009" Time="11:27:14 PM" DateTime="2009-01-12T07:27:14.133Z" SessionID="32"><From><User FriendlyName="James O'"/></From><To><User FriendlyName="Patrick G"/></To><Text Style="font-family:Segoe UI; color:#000000; ">oh know, it really broke it</Text></Message><Message Date="1/11/2009" Time="11:27:33 PM" DateTime="2009-01-12T07:27:33.178Z" SessionID="32"><From><User FriendlyName="James O'"/></From><To><User FriendlyName="Patrick G"/></To><Text Style="font-family:Segoe UI; color:#000000; ">Wouldnt even get to the main menu of vista installed with that disc plugged in</Text></Message><Message Date="1/11/2009" Time="11:28:02 PM" DateTime="2009-01-12T07:28:02.415Z" SessionID="32"><From><User FriendlyName="Patrick G"/></From><To><User FriendlyName="James O'"/></To><Text Style="font-family:Times New Roman; color:#000000; ">ohhhhhhhhhhhhhhhhhh</Text></Message><Message Date="1/11/2009" Time="11:28:25 PM" DateTime="2009-01-12T07:28:25.693Z" SessionID="32"><From><User FriendlyName="James O'"/></From><To><User FriendlyName="Patrick G"/></To><Text Style="font-family:Segoe UI; color:#000000; ">Hay, some dude wants to make a game with me</Text></Message><Message Date="1/11/2009" Time="11:29:11 PM" DateTime="2009-01-12T07:29:11.167Z" SessionID="32"><From><User FriendlyName="Patrick G"/></From><To><User FriendlyName="James O'"/></To><Text Style="font-family:Times New Roman; color:#000000; ">hahaha been there b4 it didn't work out the toher guy ended up wanting to do other stuff so i had a half finsihed game and had to cut it short</Text></Message><Message Date="1/11/2009" Time="11:29:17 PM" DateTime="2009-01-12T07:29:17.450Z" SessionID="32"><From><User FriendlyName="Patrick G"/></From><To><User FriendlyName="James O'"/></To><Text Style="font-family:Times New Roman; color:#000000; ">is it a cool project, ?? i'll join if its gonna be finsihed for sure</Text></Message><Message Date="1/11/2009" Time="11:29:29 PM" DateTime="2009-01-12T07:29:29.712Z" SessionID="32"><From><User FriendlyName="Patrick G"/></From><To><User FriendlyName="James O'"/></To><Text Style="font-family:Times New Roman; color:#000000; ">i hate cutting games into a fast finish final boss level</Text></Message><Message Date="1/11/2009" Time="11:29:38 PM" DateTime="2009-01-12T07:29:38.140Z" SessionID="32"><From><User FriendlyName="James O'"/></From><To><User FriendlyName="Patrick G"/></To><Text Style="font-family:Segoe UI; color:#000000; ">Its sort of a mod/prototype</Text></Message><Message Date="1/11/2009" Time="11:30:00 PM" DateTime="2009-01-12T07:30:00.935Z" SessionID="32"><From><User FriendlyName="Patrick G"/></From><To><User FriendlyName="James O'"/></To><Text Style="font-family:Times New Roman; color:#000000; ">ohhh you mean real programming?? pass</Text></Message><Message Date="1/11/2009" Time="11:30:02 PM" DateTime="2009-01-12T07:30:02.637Z" SessionID="32"><From><User FriendlyName="Patrick G"/></From><To><User FriendlyName="James O'"/></To><Text Style="font-family:Times New Roman; color:#000000; ">lol</Text></Message><Message Date="1/11/2009" Time="11:30:08 PM" DateTime="2009-01-12T07:30:08.942Z" SessionID="32"><From><User FriendlyName="Patrick G"/></From><To><User FriendlyName="James O'"/></To><Text Style="font-family:Times New Roman; color:#000000; ">Comp Sci stuff, no thank you</Text></Message><Message Date="1/11/2009" Time="11:30:13 PM" DateTime="2009-01-12T07:30:13.024Z" SessionID="32"><From><User FriendlyName="James O'"/></From><To><User FriendlyName="Patrick G"/></To><Text Style="font-family:Segoe UI; color:#000000; ">yeah, sorta</Text></Message><Message Date="1/11/2009" Time="11:30:18 PM" DateTime="2009-01-12T07:30:18.914Z" SessionID="32"><From><User FriendlyName="Patrick G"/></From><To><User FriendlyName="James O'"/></To><Text Style="font-family:Times New Roman; color:#000000; ">I am thinking Game Maker 6.1</Text></Message><Message Date="1/11/2009" Time="11:30:19 PM" DateTime="2009-01-12T07:30:19.783Z" SessionID="32"><From><User FriendlyName="James O'"/></From><To><User FriendlyName="Patrick G"/></To><Text Style="font-family:Segoe UI; color:#000000; ">Scripting in the Torque Engine</Text></Message><Message Date="1/11/2009" Time="11:30:56 PM" DateTime="2009-01-12T07:30:56.382Z" SessionID="32"><From><User FriendlyName="Patrick G"/></From><To><User FriendlyName="James O'"/></To><Text Style="font-family:Times New Roman; color:#000000; ">I'll do the B&amp;W title page</Text></Message><Message Date="1/11/2009" Time="11:30:57 PM" DateTime="2009-01-12T07:30:57.158Z" SessionID="32"><From><User FriendlyName="Patrick G"/></From><To><User FriendlyName="James O'"/></To><Text Style="font-family:Times New Roman; color:#000000; ">lol</Text></Message><Message Date="1/25/2009" Time="11:26:29 PM" DateTime="2009-01-26T07:26:29.038Z" SessionID="33"><From><User FriendlyName="James O'"/></From><To><User FriendlyName="Patrick G"/></To><Text Style="font-family:Segoe UI; color:#000000; ">Hi oh</Text></Message><Message Date="1/25/2009" Time="11:27:19 PM" DateTime="2009-01-26T07:27:19.757Z" SessionID="33"><From><User FriendlyName="Patrick G"/></From><To><User FriendlyName="James O'"/></To><Text Style="font-family:Times New Roman; color:#000000; ">Oh Hi</Text></Message><Message Date="1/25/2009" Time="11:27:22 PM" DateTime="2009-01-26T07:27:22.195Z" SessionID="33"><From><User FriendlyName="Patrick G"/></From><To><User FriendlyName="James O'"/></To><Text Style="font-family:Times New Roman; color:#000000; ">LOL</Text></Message><Message Date="1/25/2009" Time="11:27:32 PM" DateTime="2009-01-26T07:27:32.864Z" SessionID="33"><From><User FriendlyName="Patrick G"/></From><To><User FriendlyName="James O'"/></To><Text Style="font-family:Times New Roman; color:#000000; ">Hectic CES this year hey</Text></Message><Message Date="1/25/2009" Time="11:27:45 PM" DateTime="2009-01-26T07:27:45.005Z" SessionID="33"><From><User FriendlyName="James O'"/></From><To><User FriendlyName="Patrick G"/></To><Text Style="font-family:Segoe UI; color:#000000; ">Yeh, not bad *-)</Text></Message><Message Date="1/25/2009" Time="11:28:05 PM" DateTime="2009-01-26T07:28:05.859Z" SessionID="33"><From><User FriendlyName="Patrick G"/></From><To><User FriendlyName="James O'"/></To><Text Style="font-family:Times New Roman; color:#000000; ">The fuel ceels were mad</Text></Message><Message Date="1/25/2009" Time="11:28:06 PM" DateTime="2009-01-26T07:28:06.091Z" SessionID="33"><From><User FriendlyName="James O'"/></From><To><User FriendlyName="Patrick G"/></To><Text Style="font-family:Segoe UI; color:#000000; ">Most exciting products as usual dont really have much interest to us though</Text></Message><Message Date="1/25/2009" Time="11:28:29 PM" DateTime="2009-01-26T07:28:29.631Z" SessionID="33"><From><User FriendlyName="James O'"/></From><To><User FriendlyName="Patrick G"/></To><Text Style="font-family:Segoe UI; color:#000000; ">Palm Pre, contract based smart phone, Sony P, over expensive and underpowered UMPC</Text></Message><Message Date="1/25/2009" Time="11:28:40 PM" DateTime="2009-01-26T07:28:40.431Z" SessionID="33"><From><User FriendlyName="Patrick G"/></From><To><User FriendlyName="James O'"/></To><Text Style="font-family:Times New Roman; color:#000000; ">yeah they're kinda the ones where its cool, its a must get and then when you get it its like oh wo oh wow and after a month, why the heck did i buy this for i don't ever use it</Text></Message><Message Date="1/25/2009" Time="11:28:59 PM" DateTime="2009-01-26T07:28:59.227Z" SessionID="33"><From><User FriendlyName="Patrick G"/></From><To><User FriendlyName="James O'"/></To><Text Style="font-family:Times New Roman; color:#000000; ">Asus Bamboo laptop</Text></Message><Message Date="1/25/2009" Time="11:29:05 PM" DateTime="2009-01-26T07:29:05.467Z" SessionID="33"><From><User FriendlyName="Patrick G"/></From><To><User FriendlyName="James O'"/></To><Text Style="font-family:Times New Roman; color:#000000; ">portable movie projector</Text></Message><Message Date="1/25/2009" Time="11:29:16 PM" DateTime="2009-01-26T07:29:16.523Z" SessionID="33"><From><User FriendlyName="Patrick G"/></From><To><User FriendlyName="James O'"/></To><Text Style="font-family:Times New Roman; color:#000000; ">a live plant in a keychain for mobile phones</Text></Message><Message Date="1/25/2009" Time="11:29:22 PM" DateTime="2009-01-26T07:29:22.009Z" SessionID="33"><From><User FriendlyName="James O'"/></From><To><User FriendlyName="Patrick G"/></To><Text Style="font-family:Segoe UI; color:#000000; ">Yeah, there where quite a few incy tiny projectors</Text></Message><Message Date="1/25/2009" Time="11:29:50 PM" DateTime="2009-01-26T07:29:50.454Z" SessionID="33"><From><User FriendlyName="James O'"/></From><To><User FriendlyName="Patrick G"/></To><Text Style="font-family:Segoe UI; color:#000000; ">I was gonner ask you, do you want any anime series?</Text></Message><Message Date="1/25/2009" Time="11:30:09 PM" DateTime="2009-01-26T07:30:09.500Z" SessionID="33"><From><User FriendlyName="James O'"/></From><To><User FriendlyName="Patrick G"/></To><Text Style="font-family:Segoe UI; color:#000000; ">I just finished Death Note, and I'm kinda itching for something new and exciting, just wondering if u did and had any recommendations</Text></Message><Message Date="1/25/2009" Time="11:30:17 PM" DateTime="2009-01-26T07:30:17.311Z" SessionID="33"><From><User FriendlyName="Patrick G"/></From><To><User FriendlyName="James O'"/></To><Text Style="font-family:Times New Roman; color:#000000; ">ohh dear god</Text></Message><Message Date="1/25/2009" Time="11:30:21 PM" DateTime="2009-01-26T07:30:21.477Z" SessionID="33"><From><User FriendlyName="Patrick G"/></From><To><User FriendlyName="James O'"/></To><Text Style="font-family:Times New Roman; color:#000000; ">I soo missed death note</Text></Message><Message Date="1/25/2009" Time="11:30:26 PM" DateTime="2009-01-26T07:30:26.196Z" SessionID="33"><From><User FriendlyName="Patrick G"/></From><To><User FriendlyName="James O'"/></To><Text Style="font-family:Times New Roman; color:#000000; ">yes please!!!</Text></Message><Message Date="1/25/2009" Time="11:30:35 PM" DateTime="2009-01-26T07:30:35.432Z" SessionID="33"><From><User FriendlyName="James O'"/></From><To><User FriendlyName="Patrick G"/></To><Text Style="font-family:Segoe UI; color:#000000; ">I started watching it a week ago, finished it tonight :)</Text></Message><Message Date="1/25/2009" Time="11:30:52 PM" DateTime="2009-01-26T07:30:52.573Z" SessionID="33"><From><User FriendlyName="Patrick G"/></From><To><User FriendlyName="James O'"/></To><Text Style="font-family:Times New Roman; color:#000000; ">yeah i watch one on SBS and missed rest due to busy summer session</Text></Message><Message Date="1/25/2009" Time="11:31:02 PM" DateTime="2009-01-26T07:31:02.022Z" SessionID="33"><From><User FriendlyName="James O'"/></From><To><User FriendlyName="Patrick G"/></To><Text Style="font-family:Segoe UI; color:#000000; ">I watched the pilot, and wasn't really interested</Text></Message><Message Date="1/25/2009" Time="11:31:07 PM" DateTime="2009-01-26T07:31:07.255Z" SessionID="33"><From><User FriendlyName="Patrick G"/></From><To><User FriendlyName="James O'"/></To><Text Style="font-family:Times New Roman; color:#000000; ">recommendations.... sailor moon? </Text></Message><Message Date="1/25/2009" Time="11:31:21 PM" DateTime="2009-01-26T07:31:21.883Z" SessionID="33"><From><User FriendlyName="James O'"/></From><To><User FriendlyName="Patrick G"/></To><Text Style="font-family:Segoe UI; color:#000000; ">But since I converted the series to playback on my xbox setup</Text></Message><Message Date="1/25/2009" Time="11:31:30 PM" DateTime="2009-01-26T07:31:30.730Z" SessionID="33"><From><User FriendlyName="James O'"/></From><To><User FriendlyName="Patrick G"/></To><Text Style="font-family:Segoe UI; color:#000000; ">I thought I'd give it ago, and the second episode hooked me in hard</Text></Message><Message Date="1/25/2009" Time="11:31:52 PM" DateTime="2009-01-26T07:31:52.188Z" SessionID="33"><From><User FriendlyName="Patrick G"/></From><To><User FriendlyName="James O'"/></To><Text Style="font-family:Times New Roman; color:#000000; ">OHhhhhhhhhhhhhhhhhh</Text></Message><Message Date="1/25/2009" Time="11:31:56 PM" DateTime="2009-01-26T07:31:56.071Z" SessionID="33"><From><User FriendlyName="Patrick G"/></From><To><User FriendlyName="James O'"/></To><Text Style="font-family:Times New Roman; color:#000000; ">What computer do you have?</Text></Message><Message Date="1/25/2009" Time="11:32:02 PM" DateTime="2009-01-26T07:32:02.403Z" SessionID="33"><From><User FriendlyName="Patrick G"/></From><To><User FriendlyName="James O'"/></To><Text Style="font-family:Times New Roman; color:#000000; ">It bugs me to convert any sorta video</Text></Message><Message Date="1/25/2009" Time="11:32:12 PM" DateTime="2009-01-26T07:32:12.387Z" SessionID="33"><From><User FriendlyName="Patrick G"/></From><To><User FriendlyName="James O'"/></To><Text Style="font-family:Times New Roman; color:#000000; ">i've had soo long waits doing all sorts of video rendering</Text></Message><Message Date="1/25/2009" Time="11:32:33 PM" DateTime="2009-01-26T07:32:33.986Z" SessionID="33"><From><User FriendlyName="James O'"/></From><To><User FriendlyName="Patrick G"/></To><Text Style="font-family:Segoe UI; color:#000000; ">I've got an AM2 system</Text></Message><Message Date="1/25/2009" Time="11:32:45 PM" DateTime="2009-01-26T07:32:45.981Z" SessionID="33"><From><User FriendlyName="Patrick G"/></From><To><User FriendlyName="James O'"/></To><Text Style="font-family:Times New Roman; color:#000000; ">and recently i converted a heap of DTV videos to be add free and compressed a little and it stuffs up for 1 second of audio ever 5 minutes or soo</Text></Message><Message Date="1/25/2009" Time="11:32:47 PM" DateTime="2009-01-26T07:32:47.378Z" SessionID="33"><From><User FriendlyName="Patrick G"/></From><To><User FriendlyName="James O'"/></To><Text Style="font-family:Times New Roman; color:#000000; ">:(</Text></Message><Message Date="1/25/2009" Time="11:32:53 PM" DateTime="2009-01-26T07:32:53.760Z" SessionID="33"><From><User FriendlyName="James O'"/></From><To><User FriendlyName="Patrick G"/></To><Text Style="font-family:Segoe UI; color:#000000; ">Running a 5200+</Text></Message><Message Date="1/25/2009" Time="11:33:02 PM" DateTime="2009-01-26T07:33:02.007Z" SessionID="33"><From><User FriendlyName="James O'"/></From><To><User FriendlyName="Patrick G"/></To><Text Style="font-family:Segoe UI; color:#000000; ">Oh bummer</Text></Message><Message Date="1/25/2009" Time="11:33:11 PM" DateTime="2009-01-26T07:33:11.982Z" SessionID="33"><From><User FriendlyName="James O'"/></From><To><User FriendlyName="Patrick G"/></To><Text Style="font-family:Segoe UI; color:#000000; ">I've been grabbing anime in MKV format,</Text></Message><Message Date="1/25/2009" Time="11:33:26 PM" DateTime="2009-01-26T07:33:26.724Z" SessionID="33"><From><User FriendlyName="James O'"/></From><To><User FriendlyName="Patrick G"/></To><Text Style="font-family:Segoe UI; color:#000000; ">So Its takes like 2 minutes to convert the audio, and just copy the video stream into an mp4 stream</Text></Message><Message Date="1/25/2009" Time="11:33:32 PM" DateTime="2009-01-26T07:33:32.555Z" SessionID="33"><From><User FriendlyName="James O'"/></From><To><User FriendlyName="Patrick G"/></To><Text Style="font-family:Segoe UI; color:#000000; ">which I can then view on the xbox</Text></Message><Message Date="1/25/2009" Time="11:33:42 PM" DateTime="2009-01-26T07:33:42.306Z" SessionID="33"><From><User FriendlyName="James O'"/></From><To><User FriendlyName="Patrick G"/></To><Text Style="font-family:Segoe UI; color:#000000; ">I've got 2tb of storage for my media</Text></Message><Message Date="1/25/2009" Time="11:33:59 PM" DateTime="2009-01-26T07:33:59.376Z" SessionID="33"><From><User FriendlyName="James O'"/></From><To><User FriendlyName="Patrick G"/></To><Text Style="font-family:Segoe UI; color:#000000; ">And I can view it all on my xbox, which upscales it all to 720p pretty decently</Text></Message><Message Date="1/25/2009" Time="11:34:52 PM" DateTime="2009-01-26T07:34:52.425Z" SessionID="33"><From><User FriendlyName="Patrick G"/></From><To><User FriendlyName="James O'"/></To><Text Style="font-family:Times New Roman; color:#000000; ">I can do 720 now too!! yay using my laptops HDMI</Text></Message><Message Date="1/25/2009" Time="11:34:59 PM" DateTime="2009-01-26T07:34:59.572Z" SessionID="33"><From><User FriendlyName="Patrick G"/></From><To><User FriendlyName="James O'"/></To><Text Style="font-family:Times New Roman; color:#000000; ">I recently got a non-stone age TV</Text></Message><Message Date="1/25/2009" Time="11:35:01 PM" DateTime="2009-01-26T07:35:01.694Z" SessionID="33"><From><User FriendlyName="Patrick G"/></From><To><User FriendlyName="James O'"/></To><Text Style="font-family:Times New Roman; color:#000000; ">:P</Text></Message><Message Date="1/25/2009" Time="11:35:19 PM" DateTime="2009-01-26T07:35:19.295Z" SessionID="33"><From><User FriendlyName="James O'"/></From><To><User FriendlyName="Patrick G"/></To><Text Style="font-family:Segoe UI; color:#000000; ">Tis nice</Text></Message><Message Date="1/25/2009" Time="11:35:28 PM" DateTime="2009-01-26T07:35:28.885Z" SessionID="33"><From><User FriendlyName="James O'"/></From><To><User FriendlyName="Patrick G"/></To><Text Style="font-family:Segoe UI; color:#000000; ">Networks streaming just pwns my life now</Text></Message><Message Date="1/25/2009" Time="11:35:55 PM" DateTime="2009-01-26T07:35:55.577Z" SessionID="33"><From><User FriendlyName="Patrick G"/></From><To><User FriendlyName="James O'"/></To><Text Style="font-family:Times New Roman; color:#000000; ">is that good or bad</Text></Message><Message Date="1/25/2009" Time="11:35:57 PM" DateTime="2009-01-26T07:35:57.027Z" SessionID="33"><From><User FriendlyName="Patrick G"/></From><To><User FriendlyName="James O'"/></To><Text Style="font-family:Times New Roman; color:#000000; ">pawns</Text></Message><Message Date="1/25/2009" Time="11:36:03 PM" DateTime="2009-01-26T07:36:03.301Z" SessionID="33"><From><User FriendlyName="Patrick G"/></From><To><User FriendlyName="James O'"/></To><Text Style="font-family:Times New Roman; color:#000000; ">lol</Text></Message><Message Date="1/25/2009" Time="11:37:37 PM" DateTime="2009-01-26T07:37:37.142Z" SessionID="33"><From><User FriendlyName="James O'"/></From><To><User FriendlyName="Patrick G"/></To><Text Style="font-family:Segoe UI; color:#000000; ">So good</Text></Message><Message Date="1/25/2009" Time="11:38:04 PM" DateTime="2009-01-26T07:38:04.483Z" SessionID="33"><From><User FriendlyName="James O'"/></From><To><User FriendlyName="Patrick G"/></To><Text Style="font-family:Segoe UI; color:#000000; ">Plus, h.264(or mkv)/RMVB rock for anime</Text></Message><Message Date="1/25/2009" Time="11:38:13 PM" DateTime="2009-01-26T07:38:13.401Z" SessionID="33"><From><User FriendlyName="James O'"/></From><To><User FriendlyName="Patrick G"/></To><Text Style="font-family:Segoe UI; color:#000000; ">40-80mb episodes look awesome</Text></Message><Message Date="1/25/2009" Time="11:39:35 PM" DateTime="2009-01-26T07:39:35.674Z" SessionID="33"><From><User FriendlyName="Patrick G"/></From><To><User FriendlyName="James O'"/></To><Text Style="font-family:Times New Roman; color:#000000; ">RMVB?</Text></Message><Message Date="1/25/2009" Time="11:39:38 PM" DateTime="2009-01-26T07:39:38.360Z" SessionID="33"><From><User FriendlyName="James O'"/></From><To><User FriendlyName="Patrick G"/></To><Text Style="font-family:Segoe UI; color:#000000; ">80mb episodes look glorious on my 37"</Text></Message><Message Date="1/25/2009" Time="11:39:42 PM" DateTime="2009-01-26T07:39:42.412Z" SessionID="33"><From><User FriendlyName="Patrick G"/></From><To><User FriendlyName="James O'"/></To><Text Style="font-family:Times New Roman; color:#000000; ">Thats what you mean by HKV</Text></Message><Message Date="1/25/2009" Time="11:39:47 PM" DateTime="2009-01-26T07:39:47.934Z" SessionID="33"><From><User FriendlyName="James O'"/></From><To><User FriendlyName="Patrick G"/></To><Text Style="font-family:Segoe UI; color:#000000; ">Real Media Video</Text></Message><Message Date="1/25/2009" Time="11:40:03 PM" DateTime="2009-01-26T07:40:03.585Z" SessionID="33"><From><User FriendlyName="Patrick G"/></From><To><User FriendlyName="James O'"/></To><Text Style="font-family:Times New Roman; color:#000000; ">yeah i use that too its got awesom compression for and quality for size</Text></Message><Message Date="1/25/2009" Time="11:40:11 PM" DateTime="2009-01-26T07:40:11.348Z" SessionID="33"><From><User FriendlyName="James O'"/></From><To><User FriendlyName="Patrick G"/></To><Text Style="font-family:Segoe UI; color:#000000; ">yeh</Text></Message><Message Date="1/25/2009" Time="11:40:17 PM" DateTime="2009-01-26T07:40:17.427Z" SessionID="33"><From><User FriendlyName="James O'"/></From><To><User FriendlyName="Patrick G"/></To><Text Style="font-family:Segoe UI; color:#000000; ">I prefer h.264 though</Text></Message><Message Date="1/25/2009" Time="11:40:19 PM" DateTime="2009-01-26T07:40:19.649Z" SessionID="33"><From><User FriendlyName="Patrick G"/></From><To><User FriendlyName="James O'"/></To><Text Style="font-family:Times New Roman; color:#000000; ">I use that heaps but my TV won't play it raw</Text></Message><Message Date="1/25/2009" Time="11:40:24 PM" DateTime="2009-01-26T07:40:24.902Z" SessionID="33"><From><User FriendlyName="Patrick G"/></From><To><User FriendlyName="James O'"/></To><Text Style="font-family:Times New Roman; color:#000000; ">it only does MPEG</Text></Message><Message Date="1/25/2009" Time="11:40:28 PM" DateTime="2009-01-26T07:40:28.842Z" SessionID="33"><From><User FriendlyName="James O'"/></From><To><User FriendlyName="Patrick G"/></To><Text Style="font-family:Segoe UI; color:#000000; ">Bummer</Text></Message><Message Date="1/25/2009" Time="11:40:32 PM" DateTime="2009-01-26T07:40:32.415Z" SessionID="33"><From><User FriendlyName="Patrick G"/></From><To><User FriendlyName="James O'"/></To><Text Style="font-family:Times New Roman; color:#000000; ">I am hoping a firmware will do it</Text></Message><Message Date="1/25/2009" Time="11:40:40 PM" DateTime="2009-01-26T07:40:40.000Z" SessionID="33"><From><User FriendlyName="James O'"/></From><To><User FriendlyName="Patrick G"/></To><Text Style="font-family:Segoe UI; color:#000000; ">360 plays nice with h.264 :)</Text></Message><Message Date="1/25/2009" Time="11:40:47 PM" DateTime="2009-01-26T07:40:47.836Z" SessionID="33"><From><User FriendlyName="Patrick G"/></From><To><User FriendlyName="James O'"/></To><Text Style="font-family:Times New Roman; color:#000000; ">Can you plug in a USB thumb drive and watch the RMVB straight off?</Text></Message><Message Date="1/25/2009" Time="11:40:51 PM" DateTime="2009-01-26T07:40:51.591Z" SessionID="33"><From><User FriendlyName="James O'"/></From><To><User FriendlyName="Patrick G"/></To><Text Style="font-family:Segoe UI; color:#000000; ">Not so much with MKV, but it's easy enough to convert it to mp4</Text></Message><Message Date="1/25/2009" Time="11:40:58 PM" DateTime="2009-01-26T07:40:58.998Z" SessionID="33"><From><User FriendlyName="James O'"/></From><To><User FriendlyName="Patrick G"/></To><Text Style="font-family:Segoe UI; color:#000000; ">No, nothing plays rmvb</Text></Message><Message Date="1/25/2009" Time="11:41:01 PM" DateTime="2009-01-26T07:41:01.950Z" SessionID="33"><From><User FriendlyName="James O'"/></From><To><User FriendlyName="Patrick G"/></To><Text Style="font-family:Segoe UI; color:#000000; ">its a liscned format</Text></Message><Message Date="1/25/2009" Time="11:41:03 PM" DateTime="2009-01-26T07:41:03.635Z" SessionID="33"><From><User FriendlyName="Patrick G"/></From><To><User FriendlyName="James O'"/></To><Text Style="font-family:Times New Roman; color:#000000; ">Thought so</Text></Message><Message Date="1/25/2009" Time="11:41:14 PM" DateTime="2009-01-26T07:41:14.633Z" SessionID="33"><From><User FriendlyName="Patrick G"/></From><To><User FriendlyName="James O'"/></To><Text Style="font-family:Times New Roman; color:#000000; ">my tv doesn't even play AVI</Text></Message><Message Date="1/25/2009" Time="11:41:19 PM" DateTime="2009-01-26T07:41:19.100Z" SessionID="33"><From><User FriendlyName="James O'"/></From><To><User FriendlyName="Patrick G"/></To><Text Style="font-family:Segoe UI; color:#000000; ">Only Real Player, and the less than legitimately created, Real Alternative</Text></Message><Message Date="1/25/2009" Time="11:41:30 PM" DateTime="2009-01-26T07:41:30.626Z" SessionID="33"><From><User FriendlyName="James O'"/></From><To><User FriendlyName="Patrick G"/></To><Text Style="font-family:Segoe UI; color:#000000; ">My dvd player does</Text></Message><Message Date="1/25/2009" Time="11:41:34 PM" DateTime="2009-01-26T07:41:34.274Z" SessionID="33"><From><User FriendlyName="James O'"/></From><To><User FriendlyName="Patrick G"/></To><Text Style="font-family:Segoe UI; color:#000000; ">but I had no joke</Text></Message><Message Date="1/25/2009" Time="11:41:36 PM" DateTime="2009-01-26T07:41:36.889Z" SessionID="33"><From><User FriendlyName="James O'"/></From><To><User FriendlyName="Patrick G"/></To><Text Style="font-family:Segoe UI; color:#000000; ">100 dvds burnt</Text></Message><Message Date="1/25/2009" Time="11:41:44 PM" DateTime="2009-01-26T07:41:44.312Z" SessionID="33"><From><User FriendlyName="James O'"/></From><To><User FriendlyName="Patrick G"/></To><Text Style="font-family:Segoe UI; color:#000000; ">sitting ontop of my dvd player in two stacks</Text></Message><Message Date="1/25/2009" Time="11:41:47 PM" DateTime="2009-01-26T07:41:47.969Z" SessionID="33"><From><User FriendlyName="James O'"/></From><To><User FriendlyName="Patrick G"/></To><Text Style="font-family:Segoe UI; color:#000000; ">100 dvd's</Text></Message><Message Date="1/25/2009" Time="11:41:50 PM" DateTime="2009-01-26T07:41:50.136Z" SessionID="33"><From><User FriendlyName="James O'"/></From><To><User FriendlyName="Patrick G"/></To><Text Style="font-family:Segoe UI; color:#000000; ">Fuck that</Text></Message><Message Date="1/25/2009" Time="11:41:54 PM" DateTime="2009-01-26T07:41:54.583Z" SessionID="33"><From><User FriendlyName="James O'"/></From><To><User FriendlyName="Patrick G"/></To><Text Style="font-family:Segoe UI; color:#000000; ">streaming is so much better</Text></Message><Message Date="1/25/2009" Time="11:42:36 PM" DateTime="2009-01-26T07:42:36.378Z" SessionID="34"><From><User FriendlyName="Patrick G"/></From><To><User FriendlyName="James O'"/></To><Text Style="font-family:Times New Roman; color:#000000; ">LOL</Text></Message><Message Date="1/25/2009" Time="11:42:36 PM" DateTime="2009-01-26T07:42:36.791Z" SessionID="34"><From><User FriendlyName="Patrick G"/></From><To><User FriendlyName="James O'"/></To><Text Style="font-family:Times New Roman; color:#000000; ">Same i have 120 so far</Text></Message><Message Date="1/25/2009" Time="11:42:50 PM" DateTime="2009-01-26T07:42:50.285Z" SessionID="34"><From><User FriendlyName="Patrick G"/></From><To><User FriendlyName="James O'"/></To><Text Style="font-family:Times New Roman; color:#000000; ">and their not re-writtable i am looking for a palce to throw em to recycle</Text></Message><Message Date="1/25/2009" Time="11:42:58 PM" DateTime="2009-01-26T07:42:58.903Z" SessionID="34"><From><User FriendlyName="Patrick G"/></From><To><User FriendlyName="James O'"/></To><Text Style="font-family:Times New Roman; color:#000000; ">cause remembering isist102, e-waste is a big issue</Text></Message><Message Date="1/25/2009" Time="11:43:16 PM" DateTime="2009-01-26T07:43:16.678Z" SessionID="34"><From><User FriendlyName="James O'"/></From><To><User FriendlyName="Patrick G"/></To><Text Style="font-family:Segoe UI; color:#000000; ">lol "remember" isit</Text></Message><Message Date="1/25/2009" Time="11:43:20 PM" DateTime="2009-01-26T07:43:20.141Z" SessionID="34"><From><User FriendlyName="James O'"/></From><To><User FriendlyName="Patrick G"/></To><Text Style="font-family:Segoe UI; color:#000000; ">Course I dont =)</Text></Message><Message Date="1/25/2009" Time="11:43:53 PM" DateTime="2009-01-26T07:43:53.265Z" SessionID="34"><From><User FriendlyName="Patrick G"/></From><To><User FriendlyName="James O'"/></To><Text Style="font-family:Times New Roman; color:#000000; ">lol</Text></Message><Message Date="1/25/2009" Time="11:44:04 PM" DateTime="2009-01-26T07:44:04.674Z" SessionID="34"><From><User FriendlyName="Patrick G"/></From><To><User FriendlyName="James O'"/></To><Text Style="font-family:Times New Roman; color:#000000; ">i fidn that a problem for my pre-resiquite courses</Text></Message><Message Date="1/25/2009" Time="11:44:10 PM" DateTime="2009-01-26T07:44:10.152Z" SessionID="34"><From><User FriendlyName="James O'"/></From><To><User FriendlyName="Patrick G"/></To><Text Style="font-family:Segoe UI; color:#000000; ">So, U dont really watch anime then?</Text></Message><Message Date="1/25/2009" Time="11:44:32 PM" DateTime="2009-01-26T07:44:32.519Z" SessionID="34"><From><User FriendlyName="Patrick G"/></From><To><User FriendlyName="James O'"/></To><Text Style="font-family:Times New Roman; color:#000000; ">nope</Text></Message><Message Date="1/25/2009" Time="11:44:38 PM" DateTime="2009-01-26T07:44:38.783Z" SessionID="34"><From><User FriendlyName="Patrick G"/></From><To><User FriendlyName="James O'"/></To><Text Style="font-family:Times New Roman; color:#000000; ">i have friends who are</Text></Message><Message Date="1/25/2009" Time="11:44:57 PM" DateTime="2009-01-26T07:44:57.148Z" SessionID="34"><From><User FriendlyName="Patrick G"/></From><To><User FriendlyName="James O'"/></To><Text Style="font-family:Times New Roman; color:#000000; ">and my sister likes sailor moon in Cantonese cause she thinks its a mockery of funniness</Text></Message><Message Date="1/25/2009" Time="11:45:49 PM" DateTime="2009-01-26T07:45:49.348Z" SessionID="34"><From><User FriendlyName="James O'"/></From><To><User FriendlyName="Patrick G"/></To><Text Style="font-family:Segoe UI; color:#000000; ">haha ok</Text></Message><Message Date="1/25/2009" Time="11:46:02 PM" DateTime="